Tweets,Date
,0
the final laps if you will Ha What if you pumped a trade war headline and nobody was around to believe it spy dji esf  ,29/4/2019
  PlannedParenthood selects a Chinese to lead their organization in the middle of trade war with China In Canada we also have a like minded feminist who brags about taking the abortion position to the voters Election is in Oct Shell be gone then ,29/4/2019
Making America great again Trump MAGA farmers TradeWar resist ,29/4/2019
US Farmer Income Drops Most Since  as Trade War Losses Mount In first quarter producers income declines  billion Personal income for farmers fell by the most in three years in the first quarter  pictwittercomAPDggqx ,29/4/2019
If anyone should have some dough socked away for a trade war its M ,29/4/2019
U S Cut All Tie with China China Cut All Trade with U S Fucking STUPID USELESS Sucker D Trump of U S  Why talk Trade War will China Why  Why  Fucking STUPID USELESS Sucker D Trump of U S  ,29/4/2019
 US investors confidently pouring money into China despite trade war   scmpnews ,29/4/2019
US farmer income plummets  billion as Trump trade war drags on Farmers not to worrythe rest of us will pick up the tab as the GOP buys their vote and calls it subsidies  ,29/4/2019
US Farmer Income Drops Most Since  as Trade War Losses Mount   ,29/4/2019
Trumps TradeWar is causing Extinction of Wisconsins Dairy Farmers  USFarmerFamily  USChamber  AC  robreiner  paulkrugman  RandPaul AlternativeFacts  ,29/4/2019
GOP destroys America US farmer income plummets  billion as Trump trade war drags on   ,29/4/2019
 M shows scars from Trumps harmful trade war  ,29/4/2019
Farmer Income Drops Most Since  as Trade War Losses Mount     ,29/4/2019
Seneca County farmers are feeling the pain from Trumps trade war via Bloomberg  ,29/4/2019
If youre looking at the short term sure But if youre looking at the longer term which the GOP never does btw then Trump is devastating every American citizen with his horrendous policies on climate change and the trade war America is gonna go broke real fast thanks to Trump ,29/4/2019
US farmer income plummets  billion as Trump trade war drags on   ,29/4/2019
US Farmer Income Drops Most Since  as Trade War Losses Mount Personal income for farmers fell by the most in three years in the first quarter as losses to US agriculture mount from President Donald Trumps trade wars   ,29/4/2019
I joined MelissaAFrancis on AftertheBell today to share my PoV on US trade  tariffs and key findings from my time spent W our alvarezmarsal Global TransactionAdvisory Group in Asia Thanks for hosting another thoughtprovoking discussion FoxBusiness BTS TradeWar pictwittercomdPuqBCzOpH ,29/4/2019
US Farmer Income Drops Most Since  as Trump Trade War Losses Mount   ,29/4/2019
Personal income for US farmers fall by the most in three years as Trumps trade war losses mount   via bpolitics ,29/4/2019
US farmer income plummets  billion as Trump trade war drags on  ,29/4/2019
paulkrugman Mr Krugman how do we have a record GDP first quarter with a smaller trade deficit when one of the months saw poor job growth and farmers are selling zero prduce to China due to trade war   ,29/4/2019
US farmer income plummets  billion as Trump trade war drags on  Axios   ,29/4/2019
And Snowflake Trudope wont take action on Chinese trade war against Canada Why not ban Huawei G and slap some tariffs on Chinese imports for good measure No backbone   ,29/4/2019
US Farmer Income Drops Most Since  as Trade War Losses Mount  pictwittercomjmlTwUh ,29/4/2019
Trudeau started Trumps trade war with China Is this Admiral Scheer copying Trumps daily lie ,29/4/2019
US farmer income plummets  billion as Trump trade war drags on WINTER IS COMMING   ,29/4/2019
supportfarmers buylocal familyfarms educateyourself Personal income for US farmers fall by the most in three years as Trumps trade war losses mount   via bpolitics ,29/4/2019
I think if Trump policies and trade war etc bankrupt that state bankrupt his supporters they would still support him and place the blame on someone or something else and that is exactly what Trump doesblames someone else ,29/4/2019
We know you lover our farmers and what a way to so it realDonaldTrump US farmer income plummets  billion as Trump trade war drags on  ,29/4/2019
Hi just a reminder that there are no winners in a trade war ,29/4/2019
I have heard that even farmers who lose their farms in the trade war will still sing Trumps praises I hope I heard wrong ,29/4/2019
The USChina trade war has severely crash on Hong Kong and China logistics companies Cases and debts from logistics companies received by RMS have more than doubled in the last two months tradewarimpactlogistics RMSHK   ,29/4/2019
TRADE WAR TARIFFS COMPOUND ECONOMIC PROBLEMS FOR WISCONSINS DECLINING INDUSTRIES Trump is making everything WORSE China is our largest goods trading partner Retaliatory tariffs target steel aluminum  Agri bus RonJohnsonWI GOP is wTrump not voters  ,29/4/2019
Farmer Income Drops Most Since  as Trade War Losses Mount   via YahooFinance ,29/4/2019
Farmer Income Drops Most Since  as Trade War Losses Mount  ,29/4/2019
Reversing Russian sanctions to allow money to fill his pocket National emergency for WHAT dwindling immigration numbers Trade war killing farmers Oh yeah ,29/4/2019
I just published Why The Trade War is Hurting China More Than the US  ,29/4/2019
Tell that to the farmers suffering from your trade war ,29/4/2019
No it is not Why dont you talk to the farmers about your trade war ,29/4/2019
ChinaUS trade war The United States uses made in USA instead of made in China and the US economy takes off ,29/4/2019
 every economic aspect of our Country is the best it has ever been Really Have you asked our soybean farmers who lost  of their sales to Brazil after you started your trade war with China How about the companies that lost business when you pulled us out of the TPP ,29/4/2019
US Farmers Incomes Drop Most Since  as Trade War Losses Mount Down  billion in st quarter ,29/4/2019
US farmer income falls most since  as Trump trade war losses mount pictwittercomnPJKoEudf ,29/4/2019
From The Economist Espresso A resolution of sorts ChinaUS trade TradeTalks TradeDeals TradeWar tariffs  ,29/4/2019
Farmer Income Drops Most Since  as Trade War Losses Mount  Democratic Underground  via demunderground ,29/4/2019
US farmer income plummets  billion as Trump trade war drags on TrumpTariffs   ,29/4/2019
Trade war is killing family farms The only farmers in Texas making money are the ones with oil royalties or windmills on their acreage Why do you trump and the GOP hate farmers ,29/4/2019
Trump Voters all the way  WhiteHouse its Dunceville stupid as they will never rebound or recoup a dime US farmer income plummets  billion as trade war drags its only going get worse That kind of loss hits GDP somewhere axios   ,29/4/2019
US farmer income plummets  billion as Trump trade war drags on  Axios farmers we are with you resist   ,29/4/2019
Farmer Income Drops Most Since  as Trade War Losses Mount MAGA   ,29/4/2019
US farmer income plummets  billion as Trump trade war drags on tradewar economics  ,29/4/2019
Texas and California agriculture hit hard due to trumps trade war means small business farmers get hammered while corporations oil companies profit handsomely Why do you trump and the GOP hate farmers ,29/4/2019
Trade war with US could lead to economic cold war for China Beijing researchers say  SCMPNews ,29/4/2019
Trump trade war US farmer income plummets  billion in Q  Axios   ,29/4/2019
realDonaldTrump TrumpMustGo JoeBiden US Farmers Incomes Drop Most Since  as Trade War Losses Mount Down  billion in st quarter link     via bpolitics ,29/4/2019
Your tariffs have cost the auto companies and farmers BILLIONS along with average American consumers Trump has been promising an end to his idiotic trade war for more than a year and WE are paying the price Both you and Finley are just Trump stooges ,29/4/2019
Personal income for US farmers falls by the most in three years as Trumps trade war losses mount So much winning MAGA Trumptrain trumpisanamateur makeamericagolfagain liar   via bpolitics ,29/4/2019
Wisconsin is known as Americas Dairyland but the milk makers who gave the state its moniker are vanishing falling prey to a variety of impediments including President Trump and his global trade war  pictwittercomGrEFhYF ,29/4/2019
Winning US farmer income plummets  billion as Trump trade war drags on   ,29/4/2019
US farmer income plummets  billion as Trump trade war drags on  Axios Oopsie   ,29/4/2019
US Farmer Income Drops Most Since  Amid Trade War Pain  Bloomberg   ,29/4/2019
Farmer Income Drops Most Since  as Trade War Losses Mount   ,29/4/2019
Personal income for US farmers fall by the most in three years as Trumps trade war losses mount   promisesmadepromiseskept promiseskept farmers farms MAGA ,29/4/2019
 US farmer income plummets  billion as Trump trade war drags on  Axios   ,29/4/2019
A top GOP senator warns that Trumps massive trade deal with Canada and Mexico is dead unless the president reverses his tariffs  via businessinsider TradeWar ,29/4/2019
US Farmers Incomes Drop Most Since  as Trade War Losses Mount   viabpolitics MAGA ,29/4/2019
The grain market is in the crapper Granted the trade war is not the only cause but it surely did not help matters ,29/4/2019
US farmer income plummets  billion as Trump trade war drags on  Axios Trump takes your cash and gives it to ted state farmers  especially Big Agribusinesses some of his biggest donors   ,29/4/2019
Now you and I as American taxpayers on the hook to bail out farmersmost of whom want a free market not a handoutfrom the damage Trumps stupid trade war has caused   ,29/4/2019
Meet the Huawei executive whose arrest plunged Canada into a global trade war and could change the future of telecommunications forever  pictwittercomrsjLq ,29/4/2019
US farmer income plummets  billion as Trump trade war drags onnotchickenfeed   ,29/4/2019
Why you should never start a trade war with an autocracy  ,29/4/2019
Farmer Income Drops Most Since  as TradeWar Losses Mount  pictwittercomZarAFHBSa ,29/4/2019
This is the ad for  How much more of your money do you want to waste on Donald Trumps trade war Here   and below  ,29/4/2019
How are Trumps tariffs and that trade war working out for Iowan farmers As well as Trumps treason ,29/4/2019
Trumps trade war is a policy failure The cost of his chestthumping will be financially borne for years to come by American consumers farmers companies workers and the communities they live in Excellent piece mikedorning katiadmi   ,29/4/2019
This is on the stable genius and his Trade War Good job dude American Farmers Confront a Mental Health Crisis   ,20/3/2019
PAK BOUGHT REJECTED CANOLA OILThe PTIGovernment better look into this matter The people voted you ImranKhanPTI because they believed your government will deliver Sixer if the oil was rejected because of TradeWar Cleanbowled if the shipments had pestspictwittercomFlZzBUql ,29/4/2019
The SPX posted a new record intraday high overnight gaining an impressive  YTD Tradewar resolutions  upbeat earnings helping SPX rise  DJIA   NASDAQ  Doji star could be ominous here trading Losses may exceed depositspictwittercomvAocJzMMZ ,29/4/2019
  farmer income plummets  billion as Trump trade war drags on ,29/4/2019
US farmer income plummets  billion as Trump trade war drags on  Axios So much winning   ,29/4/2019
Meet the Huawei executive whose arrest plunged Canada into a global trade war and could change the future of telecommunications forever   ,29/4/2019
No one could have predicted Trumps trade wars would decimate the heartland Farmer Income Drops Most Since  as Trade War Losses Mount   ,29/4/2019
Farmer Income Drops Most Since  as Trade War Losses Mount   SmartNews ,29/4/2019
 realDonaldTrump MAGA You will be remembered as the President who destroyed The Great American Farmer Farmer Income Drops Most Since  as Trade War Losses Mount   ,29/4/2019
AAPL  Do I know of a more researched stock Apple will beat tomorrow and either drop a mild amount or stay even no pops from AAPL unless we see some good Tradewar news ,29/4/2019
US farmer income plummets  billion as Trump trade war drags on  Axios  cathymcmorris   ,29/4/2019
US farmer income plummets  billion as Trump trade war drags on SmartNews   ,29/4/2019
So much winning Im tired of all the winning DerangedDonald Farmer Income Drops Most Since  as Trade War Losses Mount   ,29/4/2019
So easy to win a trade war ,29/4/2019
Keep taking one for the team you trump supporting fools US farmer income plummets  billion as Trump trade war drags on  ,29/4/2019
Yet US farmers incomes drop B in st Q most since  due to President Dumbass tariff and trade war So much winning MakeAmericaGagAgain ,29/4/2019
US farmer income plummets  billion as Trump trade war drags on   SmartNews ,29/4/2019
The Huawei issue Smell an American rat The US want us to be foot soldiers in their trade war with China We cant even fire our own very expensive and so called independent nuclear missiles without their say so But maybe well get loads of cheap shit food as a thank you ,29/4/2019
Trumps Trade War has pushed farmers incomes to a year low Rural voters are key to his support Most still believe hell help them But by  they will realize they were conned Trumps only hope Give China whatever it wants in Trade Deal   ,29/4/2019
Unfortunately no but probably the trade war helps a bit That said resilience is always a virtue in us ,29/4/2019
US farmer income plummets  billion as Trump trade war drags on MAGA   ,29/4/2019
Thanks Donald Trump  Making America Great Again US farmer income plummets  billion as Trump trade war drags on   ,29/4/2019
HEY DOES ANYBODY KNOW HOW WELL WE ARE WINNING THAT EASY TRADE WAR CRIMINAL TRUMP STARTED ,29/4/2019
US farmer income falls most since  as Trump trade war losses mount  pictwittercomuurnmlYH ,29/4/2019
Besides making more profits for shareholders and CEOs where did our people benefit from this trade war The costs only effect the middlelow income households   ,29/4/2019
Welp  theywill continue to vote Repub solely bc theyre scared guns will be gone  having to be all up in a womans uterus I cant care about people that dont care for themselves US farmer income plummets  billion as Trump trade war drags on   ,29/4/2019
Trumps anti China tirades are part of his political campaign America does need to bring more manufacturing home but he initiated a damaging trade war with no clear end in sight ,29/4/2019
RT profwolff Chile and Peru join Chinas Belt and Road Investment Initiative Signs of Chinas fastgrowing economy Trumps tariffs trade war theater is mostly his reelection effort Real economic change marches on  ,29/4/2019
Farmer income plummets  billion as Trump trade war drags on  Axios   ,29/4/2019
Farmer Income Drops Most Since  as Trade War Losses Mount  RepBost Great work with the tariffs Farmer want markets not a handout  ,29/4/2019
US farmer income plummets  billion as Trump trade war drags on  Axios TrumpEffect   ,29/4/2019
I read over the weekend that it cost them more to plant crops per unit than what the unit selling price was because the trade war killed off demand from the USA ,29/4/2019
Farmer Income Drops Most Since  as Trade War Losses Mount SmartNews   ,29/4/2019
Trumps trade war hammers Wisconsins ailing dairy farmersDairy farms in Wisconsin are on the brink of vanishing as they struggle to survive falling prices overproduction and President Trumps trade war   ,29/4/2019
Actually not  have made some thing worse for middle class and working  took advantage of many these people The trade war is bad for US farmers MANY OF them in bankruptcies MANY of us has to pay a lot more taxes You a ,29/4/2019
More About The Fight USChina the fighting wont stop when the trade war ends   via scmpnews ,29/4/2019
USMCA Tradewar   ,29/4/2019
The Real Story  Free MengWanzhou  A nation of law arrests Huwei executive as pawn in USA trade war with China  pictwittercomoDupjKeL ,29/4/2019
Thanks  realDonaldTrump trade war US farmer income plummets  billion in Q  Axios   ,29/4/2019
Winning the trade war Oops ,29/4/2019
Trump trade war hurting farmers and ranchers   ,29/4/2019
US team to visit China today to end trade war  pictwittercomQQJgOCSgd ,29/4/2019
TRUMPSPROMISEFarmer Income Drops Most Since  as Trade War Losses Mount   ,29/4/2019
From the man without a heart  and a brain US farmer income plummets  billion as Trump trade war drags on   ,29/4/2019
US farmer income plummets  billion as Trump trade war drags on  RepKinzinger  GOP  realDonaldTrump thanks for nothing GOP absenteeadam   ,29/4/2019
China lied about the severity of the ASF problem and allowed deflection to focus on tariffs and the trade war to put pressure on Trump We now see the real reason for the huge drop in demand   ,29/4/2019
US farmer income plummets  billion as Trump trade war drags on Farmers should be happy Drumpfs economy is doing so good   ,29/4/2019
A growing problem US farmer income plummets  billion as Trump trade war drags on   ,29/4/2019
There is a trade war going on and lets not forget who has been spying on world leaders Obama had bugged Merkles mobile among many others Oh and US was spying on its own people too So Im with Team Sugar on this smacks of pure politics ,29/4/2019
i have big power that can help trump to win the trade war and in many other fields such as north korea Please contact me via phone   i can talk with you baout these  will get mysterious ability ,29/4/2019
Hi my name is wupeng from china I know president trump has visited china recently and got a lot success I know president trump is complaining about chinas economy and starting trade war with china  I suppor usa and ,29/4/2019
Trump loses another trade war   ,29/4/2019
Day  YOU MUST FIRE THE CHINESE AMBASADOR Day  YOU MUST ARREST THE HUAWEI CEO Day  OH MY GOD WHY DONT WE HAVE A CHINESE AMBASADOR AND WHY ARE WE IN A TRADE WAR WITH CHINA What trudeau needs to do is stop listening to right wing lunatics Thats his greatest flaw Centrist ,29/4/2019
Trump forces Americans to pay  billion more for WASHING MACHINES They now cost about  more than they would have without Trumps DISASTROUS TRADE WAR so far HIGHER TARIFFS  HIGHER COST MOG MAGA  ,29/4/2019
DerangedDonald US farmer income plummets  billion as Trump trade war drags on  ,29/4/2019
One year in and this Trade War isnt showing any signs of stopping We cant wait for Trump to pull down these tariffs  its time for Iowans to find someone who will IACaucus   ,29/4/2019
Small farms are small businesses This administrations reckless trade war continues to hurt our farmers bottom line and the economy as a whole rural communities deserve better   ,29/4/2019
So lets stop bailing out the Farmers Lets fire Trump and end tariffs as it seems the safer bet Trump he best at being the worst for business Farmer Income Drops Most Since  as Trade War Losses Mount   ,29/4/2019
 Texas Farmers seek a bailout from US taxpayers due to Trump Tariffs Farmers have suffered from the tariffs and trade war with China Are you winning yet pictwittercomDtKlDGCoO ,29/4/2019
But they still believe in him US farmer income plummets  billion as Trump trade war drags on  ,29/4/2019
I will send you my welfare check if you like It covered less than  of my losses to that date I didnt support the trade war bailout and neither did most farmers We want the trade war solved not a few dollars to throw at tens of thousands in losses ,29/4/2019
Her arrest plunged Canada in the middle of a global trade war But who is Meng Wanzhou  ,29/4/2019
US farmer income plummets  billion as Trump trade war drags on The drop is being driven primarily by the fallout from President Trumps trade disputes a nosedive in commodity prices and record flooding in the Midwest   ,29/4/2019
US farmer income plummets  billion from Trumps asinine trade war And it dominoes from therefarmers support many industries If they cant buy from suppliers then the suppliers go under and on it goes Trump is destroying us   ,29/4/2019
Trump regret syndrome is spreading like a wildfire Farm equipment purchases plummet as Trumps trade war hits rural America   via bpolitics ,26/4/2019
