Tweets,Date
0,0
Chinas Profit Warnings Signal More Gloom for the Economy China ChineseEconomy ChineseStocks earnings EarningsSeason TradeWar  20190730 23594500000,2019-07-30
The biggest story in the world got barely any play in the first debates Will the ChinaUS trade war come up at all in Detroit DemDebate 23585900004,2019-07-30
Then youll LIKE MoscowMich and traitorTrump ROB KentuckyFarmers and AmericanFarmers trade wars are easy to win THERE was no TradeWar before they STARTED ONE  Who are the VICTIMS American Farmers LOST NOT Globalist republicanspictwittercomsTkTrk5za320190730 23580500000,2019-07-30
Trump shafted family farmers to give trade war bailouts to huge corporate farms instead report  20190730 23574100000,2019-07-30
ChinaUS trade war Korean Peninsula to top agenda  via YouTube20190730 23573000000,2019-07-30
Trump launches a trade war and you launch a sticker20190730 23571800000,2019-07-30
Missals firing in NKorea NO deal obstruction of justice 3 times clearly in the Mueller Report racist attacks on 4 Congressional women and Cummings tax cuts making the wealthy richer Iran is a fools game trade war costing billions to consumers 2 more mass shootings FAIL20190730 23563800000,2019-07-30
Rising tensions in the South China Sea and the fallout from the USAPRC trade war are set to dominate talks this week as top diplomats converge in Bangkok for a key ASEAN summit  BloombergAsia 20190730 23552000002,2019-07-30
More than 50 of federal aid meant to help American farmers cope with the negative impacts of the USChina trade war went to the largest  wealthiest farms 82 farmers received 500K or more while the bottom 80 accepted payments averaging less than 5K 20190730 23540100000,2019-07-30
Well you gonna bring Recession soonBecause of the Trade War You will Ruin our Country pictwittercomZ9AbRUUlHw20190730 23535900000,2019-07-30
Trump threat to tax French wine completely moronic minister says   Our allies are fed up with Trump TrumpEffect TradeWar Wine20190730 23524800000,2019-07-30
Oh yeah Sorry Far better to a allow China to hold innocent hostages in response to operation of rule of law in Canada b allow China to wage a one sided trade war against half of Canada completely unchecked c spy on us with their shitty huawei gear Great plan20190730 23523000000,2019-07-30
Whats at stake in USChina trade war   via FinancialTimes20190730 23522600001,2019-07-30
1 Please point to the part of usmca that references soybeans 2 Would outstanding tariff issues include the gop trade war with China 3 Are you ready to back your constituents and call to end this harmful trade war20190730 23515300001,2019-07-30
Hes got a secret plan to end the trade war  20190730 23504500001,2019-07-30
South Koreas economy Asias fourthlargest is facing multiple headwinds including the USChina trade war Trade is complicated  20190730 23485800000,2019-07-30
TradeWars Will Macau casinos be targeted in USChina trade war The odds are shortening for SheldonAdelson Trumps PatroninChief All their concessions along with those of three Macau and HongKong operators will expire in June 2022   pictwittercombCQKZdHxRH20190730 23482100004,2019-07-30
EditorialTime for sincerity from US in trade talks with China tradewar  pictwittercomcaS0su9e0120190730 234728000011,2019-07-30
VC investment in China has consistently decreased year after year Investors credit the fall to factors such as lack of innovation in new Chinese techstartups USChina tradewar worries and cash burn concerns venturecapital 23451400000,2019-07-30
Ahead of tonights debate see where the Democratic candidates stand on foreignpolicy issues including the trade war with China climate change the US role within international institutions and its involvement in Afghanistan  pictwittercomv3vunpFi0N20190730 23450100007,2019-07-30
THAILAND Trump tweets threaten to disrupt USChina trade talks SHANGHAI Chinese and US trade negotiators will bid to bring an end a yearlong trade war that has seen both tariffs and insults flung between the worlds two largest economies when  23430700000,2019-07-30
Regardless what peoples say that TRUMP is a liar if what you said is true why did you start the trade war for US was doing great even without trade warDoes it sound that the world will be a better place without you in it Dont feed public with lies bro it wont last20190730 23430400000,2019-07-30
Republicans blocked 250 million for election security measures in FY2019 But they have no problem giving farmers nearly 30 BILLION bc of the damage caused by Trumps trade war Most recipients are wealthy farmers so that may be why the GOP approves 20190730 23415700000,2019-07-30
Pastor Dip Shit Its your president that looks up to 3 dollar dictators like Putin and Kim Jung un Its your president thats ruining an entire industry with his trade war and every white domestic terrorist name check him by acting So eat a dick with your ugly AF wife  20190730 23414500001,2019-07-30
Neither chinabashing hawks nor pandaphile will bring the morethantrade war btn ChinaUS to an end Dumping Washingtons mentality of interventionism is only way out  20190730 23412600000,2019-07-30
Asia stocks set to trade lower as investors await Fed rate decision Stocks in Asia were poised to trade lower on Wednesday amid dampened expectations for a resolution to the USChina trade war Meanwhile investors await the US Federal Reserves  23403700000,2019-07-30
Trump inherited a healthy economy He does not get the credit for the economy If anything his massive borrowing and trade war will undermine this economy But you go ahead with your delusions20190730 23400300000,2019-07-30
Its not a 500k250k cap All producers receiving payment must meet AGI thresholds Payment is only on planted acres for 2019 2018 MFP is based on grain produced where the farmer took way below cost of prod due to trade war USDA is allowed to access this wo Cong approval20190730 23390800000,2019-07-30
Translation every US citizen adult or child is chipping in 25 so that trump can buy back the farmers votes lost due to his trade war folly  23384700000,2019-07-30
Powell has been Trumped The Fed steps into Trumps trade war  pictwittercom4K1jQlxKg520190730 23370100000,2019-07-30
Trump shafted family farmers to give trade war bailouts to huge corporate farms instead  20190730 23362300000,2019-07-30
PerhapsI dont have data on that partwould that be more qualitative at this point based on speculation trade war data since we are in the midst of the crisis20190730 23355400000,2019-07-30
Whoever has the risk incurred by the trade war gets the money except for people that dont need the money Its pretty simple If you make too much money you dont get the payment Was a breakthrough policy set by SecretarySonny who has done a great job despite tough sitch20190730 23352000000,2019-07-30
How much did the Trump administration pay Washington farms to make up for the trade war  20190730 23343400001,2019-07-30
Trump shafted family farmers to give trade war bailouts to huge corporate farms instead report   20190730 23342700000,2019-07-30
As trade talk resume but no deal in sight realDonaldTrump lashes out at China rip off     China tradewar20190730 23315000000,2019-07-30
When are Chinas official PMI and Aussie CPI data and how could they affect AUDUSD  AUDUSD PMI CPI EconomicIndicator TradeWar20190730 23313800001,2019-07-30
My take is RUT had strength today due to Trump Trade war escalatory comments Trump is laying the groundwork for 10 tariff on the remaining 300B in Chinese products and RUT does well since its companies are not impacted by the China trade war Same reason IWM was up last year20190730 23300100000,2019-07-30
PROMISES MADEPROMISES BROKEN Trump shafted family farmers to give trade war bailouts to huge corporate farms instead report  Raw Story TrumpLiesEveryTimeHeSpeaks VoteBlueToEndThisNightmare DumpTrump2020 ResistTogether  20190730 23293500000,2019-07-30
Trump flags and hats made in China are reportedly being held up at customs as trade war heats up  20190730 23292800000,2019-07-30
Trying to dodge and weeve on the broke promises of trump Hes added 8 TRILLION to the debt Business man my ass Or lets talk about the wall the failed trade war or the many other broken promises of Donald J Trump Or should I say drumf because that was their last name20190730 23282800000,2019-07-30
In the interim how much more money will he pledge to farmers who have been struggling to survive thanks to his trade war20190730 23275500000,2019-07-30
Woohoothey rang a bell Anything of importance youd like to discuss today Shooting in CA Racism in the White House The GOP created humanitarian crisis Trumps trade war Election interference PutinsMitch Nothing ComplicitGOP doyourjob20190730 23265400001,2019-07-30
Trump shafted family farmers to give trade war bailouts to huge corporate farms instead report  Raw Story  20190730 23254700000,2019-07-30
Mr President Thank you for saving the economy by having a trade war with China and cutting my tax refund We have the best economy ever and everything is fine Its such a shame that we have a horrible poverty problem that Democrats arent fixing by demonizing illegals  20190730 23245800001,2019-07-30
USChina trade war  no American freedom gas to worlds biggest growth market  20190730 23243600000,2019-07-30
Yall seem to like Socialism Government money paid to farmers without receiving goods Farmers please admit that some Socialism is good Repubs and Dems agree Not to be confused with Communism which is a horse of a different color Hope trade war ends soon God bless farms20190730 23243400000,2019-07-30
RepublicOns are in charge of the entire country and look at the mess theyve made  trade war rising prices farm subsidies deficit exploded allies insulted decades of environmental regulations wiped and the most unqualified corrupt cabinet in US history20190730 23235100000,2019-07-30
Ive been searching for a quantitative analysis on how the USChina trade war has resulted in losses for the American LNG export industry and cant find anything Point me in the right direction20190730 23230100000,2019-07-30
US tariffs on Chinese imports have helped Samsung which makes many smartphones in Vietnam Others are also moving to Vietnam some to India Hardly any to the US China tradewar  20190730 23224800000,2019-07-30
Trump shafted family farmers to give trade war bailouts to huge corporate farms instead report   20190730 23212900000,2019-07-30
President Trump Warns China Not to Wait For 2020 US Election to Make Trade Deal   As I said before no deal till 2020 as the Chinese know he wont win in 2020 This art of the deal wont work for him this time Agriculture Grains TradeWar20190730 23211000000,2019-07-30
More than half of farm bailout payments meant to alleviate the effects of the USs ongoing trade war with China went to bigger wealthier farms according to a study from the Environmental Working Group The analysis of the first  23202100000,2019-07-30
Well you are the one playing trade war They have no reason to trust anything you say or do because you tore up the iran deal and nafta for no reason There is no agreement because of your illegal tariffs20190730 23195400000,2019-07-30
Is this anything like giving farmers money after he screwed them with his trade war20190730 23181300000,2019-07-30
But it was passed in the house I mean cmon Your just denying facts at this point Trump added trillions to the national debt and started a useless and disastrous trade war He didnt build the wall instead he put children in concentration camps20190730 23174200000,2019-07-30
Youve lost the trade war20190730 23161100000,2019-07-30
Trump Kim meeting again and trade war with China heats up  via YouTube20190730 23145300000,2019-07-30
China US negotiators meet amid low expectations Deep tensions remain and neither side appears ready to compromise   tradewar chinapictwittercompo7KdWXyn020190730 23130000000,2019-07-30
And the Farm Aid due to a failing trade war against China20190730 23124000000,2019-07-30
US China trade talks resume with no breakthroughs in sight as American side aims to see what can be salvaged from draft deal scuttled by Beijing TradeWar  20190730 23124000000,2019-07-30
Our people are well fed and we can withstand the impact of the trade war20190730 23115700000,2019-07-30
BABA Is clearly waiting for China trade war news Been choppy lately Daily sell zone is at 17825 and daily buy zone is at 16756 Have to wait for those spots to trigger positions in my book  pictwittercomTNnrs0PFNy20190730 23113900000,2019-07-30
Black day in the stock markets for the risk of a hard Brexit and the USChina trade war  20190730 23111900000,2019-07-30
More than 50 of federal aid meant to help American farmers cope with the negative impacts of the USChina trade war went to the largest  wealthiest farms according to ewgs analysis of Department of Agriculture data reports rashaanayesh via axios 20190730 23110600002,2019-07-30
Trump shafted family farmers to give trade war bailouts to huge corporate farms instead report  Raw Story  20190730 23110000001,2019-07-30
US President Donald Trump ripped into China after US negotiators arrived in Shanghai to resurrect talks ChinaUS tradewar  20190730 23100000000,2019-07-30
The decline in employment from July 2018 to May 2019 was not only due to the effects of the trade war but also to domestic structural adjustments and cyclical factors the analysis showed20190730 23082700000,2019-07-30
Tariffs on China working fabulously How much have we paid our farmers since the easy trade war has started20190730 23081100000,2019-07-30
Ratfucker Mango Mussolini and Moscow Mitch shafted family farmers giving trade war bailouts to huge corporate farms instead  20190730 23081000000,2019-07-30
Foreign Companies Continue Exodus From China as Trade War Drags On  20190730 23073000000,2019-07-30
RT Swamy39   US China Trade war Global jewellers may shift manufacturing base to India from China  India Business News  Times of India   Swamy39  Ashwin Ashwinkiing July 30 2019  RT Ashwinkiing US China Trade war  20190730 23055700000,2019-07-30
Its not the only problem but its not a red herring The president accepted help from Russia started a trade war with China and attacked our NATO alliance Coincidence This doesnt make corporate bribery less But its a different track Also kickbacks from Saudi Arabia etc20190730 23053300000,2019-07-30
Highlighting an uneven distribution of the bailout which was designed to help offset effects of the USChina trade war the Environmental Working Group said the top 1 of aid recipients received an average of more than 180000 while the bottom 80 were paid less than 500020190730 23042800000,2019-07-30
Since 2015 Canada has kowtowed to China harder than ever before China holds innocent Canadians hostage No problem China wages onesided trade war against the conservative parts of the country No problem China squelches democracy in Taiwan and HK No problem20190730 23041900000,2019-07-30
What do you expect from a trade war20190730 23030900000,2019-07-30
It wont be more than 25bps 50 bps would be a huge policy mistake by FOMC FOMC has to communicate theyve taken out a small insurance policy but then Powell has to tamp down expectations for further grain liquor in the punch bowl  25 bps wont offset effect of the trade war20190730 23030900000,2019-07-30
Didnt the Trump administration just give Midwest farmers 14 billion because of his trade war with China Isnt that a giveaway20190730 23024100000,2019-07-30
EURO trashes EU for 1000 years  recession part of EUs DNA as no mechanism within for reflation  more ECB QE  greater negative interest rates  trade war with USA keen to hit EU with tariffs WTOBrexit  39bn saved  more growth due to 100bn trade deficit in goods with EU 20190730 23023500000,2019-07-30
Trump shafted family farmers to give trade war bailouts to huge corporate farms instead report  20190730 23011800000,2019-07-30
Trump shafted family farmers to give trade war bailouts to huge corporate farms instead report  Raw Story Unfortunately FoxNoise Propaganda Network tells trumps cult following that China is paying the tariffs and nothing will change their minds  20190730 22593700001,2019-07-30
India benefited modestly from USChina trade war SBI report  The Economic Times  Swamy39 20190730 22583000000,2019-07-30
Thanks 16th by percentage of revenue as was 4th in 2014 Does now include recent doles to offset losses from Trump trade war20190730 22574700000,2019-07-30
Do we want to talk about who pays for the subsidies to farmers because of trumps trade war Because it is the tax payers20190730 22573000000,2019-07-30
Trump shafted family farmers to give trade war bailouts to huge corporate farms instead report  20190730 22572900000,2019-07-30
US China Trade war Global jewellers may shift manufacturing base to India from China  India Business News  Times of India   Swamy3920190730 2256570000211,2019-07-30
If were winning the trade war why do we have to issue 12 billion dollars in emergency aid to farmers fucked by his trade war Trumpers atent smart but China isnt on its knees Theyre pointing and laughing at Trumps impotent threats Remember NK denuking20190730 22563500000,2019-07-30
As far as what hes done right    He pulled us out of TPP and the Paris Climate BS He declared a trade war against China resulting in the longestrunning bull market in history He did more for African Americans in 2 years than Obama did in 8 Its a rather long list20190730 22563400000,2019-07-30
TuckFrump Trump shafted family farmers to give trade war bailouts to huge corporate farms instead report   realTuckFrumper RawStory20190730 225615000096,2019-07-30
This tradewar is a broad accommodation of special interests Warrens plan is more like Trumps than it is anything else An appeal to domestic special interests that advances no useful policy while immiserating foreigners and stifling domestic growth is immoral20190730 22561300000,2019-07-30
Trump shafted family farmers to give trade war bailouts to huge corporate farms instead report  20190730 22555500009,2019-07-30
Trump is disruptive chaotic and creates uncertainty for all Large firms and small companies Wall Street to Main Street farmers and manufacturers In a trade warthere are no winners20190730 22540600000,2019-07-30
Data shows Trumps trade war is hurting US manufacturers 4 companies come clean about the negative impact  Business Insider Australia GOOD ONE TRUMP Youre such an economic powerhouse NOT AmericaHasBeenConned resistogether FBR impeach 20190730 225403000021,2019-07-30
Trump shafted family farmers to give trade war bailouts to huge corporate farms instead report  20190730 22531800000,2019-07-30
Trump shafted family farmers to give trade war bailouts to huge corporate farms instead report   20190730 22525100000,2019-07-30
Trump tried to paper over his disasterous trade war he caused American farmers By issuing a 16 billion bailout paying farmers for the work they lost due to the tariffs  meaning that he is effectively borrowing money from China to pay farmers not to sell their goods to China20190730 22522200000,2019-07-30
Subs your HUGE markets newsletter is out today Today Trump leans on the Fed  signals tradewar continuance Bonds rallying stocks stall DAX especially  Forex moves GBPUSD EURUSD USDJPY AUDUSD Copper Gold Crudeoil China long game ausbiz  pictwittercomWshSTbHQcU20190730 22505700002,2019-07-30
USDA gave almost 100 percent of Trumps trade war bailout to white farmers  20190730 22500000000,2019-07-30
Will they turn on him now Im betting not Trump shafted family farmers to give trade war bailouts to huge corporate farms instead report  20190730 22495900000,2019-07-30
USDA gave almost 100 percent of Trumps trade war bailout to white farmers   WHITE WELFARE IS ALIVE AND WELL AND BENEFITING RICH WHITE GUYS20190730 22494800000,2019-07-30
Trump shafted family farmers to give trade war bailouts to huge corporate farms instead report  22492400000,2019-07-30
Hong Kong Leader Sees No Room for Economic Optimism on Trade War  Bloomberg  20190730 22481100000,2019-07-30
Corporate Conning  Fleecing Ramps Up Under Trump  Trump Family Crime Business Trump shafted family farmers to give trade war bailouts to huge corporate farms instead report  20190730 22480600000,2019-07-30
Trump shafted family farmers to give trade war bailouts to huge corporate farms instead report  Raw Story  20190730 22480100000,2019-07-30
USDA gave almost 100 percent of Trumps trade war bailout to white farmers  20190730 22472700000,2019-07-30
TheGopTaxCut wasnt a radical right wing legislation that was outside mainstream US Lol What about a crazy trade war right after a recession Those arent radical since they are Republican agendas Ahhhhhhhhh I see what about farmer bailouts yet saying the economy is good20190730 22472400000,2019-07-30
Trump shafted family farmers to give trade war bailouts to huge corporate farms instead report  20190730 22455700000,2019-07-30
Trump shafted family farmers to give trade war bailouts to huge corporate farms instead report   20190730 22454400000,2019-07-30
Oh wait I see DonTheConman is trying to manipulate the Fed by making it clear that his trade war is not easily won and he is going to destroy value in the US economy and subsidize farmers for years to come Isnt the subsidies called Socialism20190730 22445900000,2019-07-30
OIL OOTT WTI The USSino trade war has a very high impact on WTI Yesterdays price action is totally out of the blue after Trumps tweets on China The fundamental is being overridden by the technical 20190730 22444900000,2019-07-30
More than half the federal aid meant to help American farmers cope with the negative impacts of trumps USChina trade war went to the largest and wealthiest farms  20190730 22442300001,2019-07-30
Seriously MAGA how do you support this grifterthank you GOP SenateGOP HouseGOP for putting rich people first MoscowMitchMcTreason GOPTaxScam Trump shafted family farmers to give trade war bailouts to huge corporate farms instead report  20190730 22440600001,2019-07-30
Trump shafted family farmers to give trade war bailouts to huge corporate farms instead report  20190730 22440300000,2019-07-30
from Axios More than half of federal aid meant to help American farmers cope with the negative impacts of the USChina trade war went to the largest and wealthiest farms By the numbers Now isnt that lovely so GOPHers who care so much about everyday Americans not20190730 22434400000,2019-07-30
Trump shafted family farmers to give trade war bailouts to huge corporate farms instead report   20190730 22431800000,2019-07-30
Trump shafted family farmers to give trade war bailouts to huge corporate farms instead report  Raw Story  20190730 22423000001,2019-07-30
So we keep on paying 8000000000 per quarter to farmers who cant sell their soybeans via Trumps socialism And after this trade deal is done if ever what do farmers do to replace markets they lost because of Trumps multiyear trade war pictwittercomlSwI6CFAHT20190730 22420900000,2019-07-30
Feds pay 24 million to Idaho ag operations over trade war  KIFI   Sounds like Socialism to me20190730 22413900000,2019-07-30
Trump shafted family farmers to give trade war bailouts to huge corporate farms instead report  20190730 22410700000,2019-07-30
and farmers of color have received almost nothing twitlers REDpubliKKKant Fascist Nazi Party Trump shafted family farmers to give trade war bailouts to huge corporate farms instead report  20190730 22404300000,2019-07-30
Tariffs on China dont cover the cost of your trade war From tariffs on 250 billion worth of goods does not even cover the cost to bail out the farmers  other companies affected by tariffs Youve taken in 208 billion to bail out farmers 28 billion Does not balance U lied20190730 22384600000,2019-07-30
Trump shafted family farmers to give trade war bailouts to huge corporate farms instead report  20190730 22384000000,2019-07-30
Trump shafted family farmers to give trade war bailouts to huge corporate farms instead report  20190730 22383700000,2019-07-30
News alert theres no trade war with Mexico or Canada thats been resolved Chyna needs to be put in their place and it has no effect on this car industry20190730 22370600000,2019-07-30
News unlocks 55 Q Trump threatens worse trade deal for China if Beijing stalls until after his reelection tradewar China Trump Trump2020Landslide Maybe TradeWars with Beijing will end Qproof Qarmy QAlert WWG1WGA WeAreTheNewsNow 20190730 22363500001,2019-07-30
It doesnt hurt to allow the Fed to help us fight China in this trade war Just dont abuse it20190730 22363500000,2019-07-30
realDonaldTrump China Wants to Delay Trade Talks Past 2020 Election in hopes of being able to negotiate with a more malleable Democratic president Yet if reelected Trump threatened to get much tougher with Beijing USA tradewar  20190730 22362000000,2019-07-30
News unlocks 55 Q Trump threatens worse trade deal for China if Beijing stalls until after his reelection tradewar China Trump Trump2020Landslide Maybe TradeWars with Beijing will end Qproof Qarmy QAlert WWG1WGA WeAreTheNewsNow  20190730 22352800005,2019-07-30
News unlocks 55 Q Trump threatens worse trade deal for China if Beijing stalls until after his reelection tradewar China Trump Trump2020Landslide Maybe TradeWars with Beijing will end Qproof Qarmy QAlert WWG1WGA WeAreTheNewsNow  20190730 22350100009,2019-07-30
Doesnt it have a Big Pharm poison pill Didnt Trump damage MI economy with the trade war when Obama helped yet now has a solution to the very problem he created Perhaps Repubs Shouldnt use MI as their pointless battleground and pass bipartisan bills to help all20190730 22340800000,2019-07-30
AUDUSD seesaws around 6week low ahead of China PMI Aussie CPI  AUDUSD TradeWar CPI PMI Politics20190730 22333800001,2019-07-30
