Tweets,Date
No theyre not trump nice try tho at a spin job you being proven wrong by many many articles Done by many many sources from many countries n done by ppl whom actually have a education in world economics Unlike you the idiot who has us in a unwinnable trade war pictwittercomJzqaKkc9N220190730 22332700001,2019-07-30
Trade war and US foreign policy  20190730 22324100000,2019-07-30
The biggest and wealthiest farms are getting the bulk of federal aid intended to support American farmers contending with fallout from the USChina trade war  20190730 2232340000216,2019-07-30
ADM Bunge fortunes change a year into trade war Analysts cut average annual profit estimates for ADM by 62 in the past three months while lifting Bunge by 18   tradewar profitspictwittercomcahaMcjZx020190730 22310000000,2019-07-30
I thought this Trade War was supposed to be easy to win Have we got a date when that win is coming20190730 22305500000,2019-07-30
Trump shafted family farmers to give trade war bailouts to huge corporate farms instead report  20190730 22303200000,2019-07-30
So you expect people to pay 1000 for a phone but when your profits fall you blame the trade war  20190730 22301000000,2019-07-30
Still no wall paid for by Mxico Still no Middle East deal Still no sign of winning the trade war with China Still no infrastructure bill Tax breaks only for the rich Still no heath insurance replacement His greatest accomplishment is to severely divide the country20190730 22300600000,2019-07-30
Tradewar headwinds or concerns likely carry the largest implications for the broader market while stockspecific themes may damage AAPL shares directly Where is the equity market headingpictwittercomJGuJ5dZhCL20190730 21252200000,2019-07-30
Trump shafted family farmers to give trade war bailouts to huge corporate farms instead report  20190730 22291800002,2019-07-30
Or surplus agricultural product subsidies for petrochemicals corporate relief trade war farmer bailouts theres a LOOONNNGGG list of waste before you need to start making up nonexistent tax spending boondoggles like the lies youre spinning here Just saying resist20190730 22285500000,2019-07-30
Trade war is at the root of President Trumps pursuit of rate cuts  222806000021,2019-07-30
Trump shafted family farmers to give trade war bailouts to huge corporate farms instead report  Raw Story  20190730 22275800000,2019-07-30
Trumps trade war has cost producers billions in lost income sent crop prices to record lows and contributed to a string of recent farm bankruptcies in the Midwest Farm groups like Tariffs Hurt the Heartland argue this is a problem that Trump himself created20190730 22271700000,2019-07-30
Trump shafted family farmers to give trade war bailouts to huge corporate farms instead report He did and then lied about it20190730 22263100000,2019-07-30
But your political party GOP has no problem with statism when Trump tells a private company where they can place factories Nor do you have problems w federal bailouts to constituencies adversely affected by your partys foolish trade war since they vote mostly for the GOP  20190730 22262500000,2019-07-30
Trump shafted family farmers to give trade war bailouts to huge corporate farms instead report  viaRawStory20190730 22243200000,2019-07-30
Trump shafted family farmers to give trade war bailouts to huge corporate farms instead report   20190730 22225900000,2019-07-30
Trump shafted family farmers to give trade war bailouts to huge corporate farms instead report   20190730 22224800000,2019-07-30
realDonaldTrump Trump shafted family farmers to give trade war bailouts to huge corporate farms instead report from non political group on trumps trade wars impact on small family farmers More winning pictwittercomFzjl9u2Uju20190730 22222400000,2019-07-30
Trump shafted family farmers to give trade war bailouts to huge corporate farms instead report  Raw Story  DUH  20190730 22214500000,2019-07-30
Trump shafted family farmers to give trade war bailouts to huge corporate farms instead report   20190730 22202800001,2019-07-30
Surprise Trumps tradewar bailout for farmers went to big agribusiness not small family farms and not farms owned by ppl of color via RawStory  20190730 22195200000,2019-07-30
US Trade Durable Goods And Inventories  Economys Looking Good Other Than That Trade War  20190730 22192400000,2019-07-30
Feds pay 24 million to Idaho ag operations over trade war  KIFI  20190730 22191500000,2019-07-30
Trump shafted family farmers to give trade war bailouts to huge corporate farms instead report on trumps trade war pictwittercom2dOW3zgqF020190730 22184000003,2019-07-30
Your 2000 a month that was quickly eaten up by your healthcare cost increases via Trump high gas prices huge food price increases thanks to trade war and more If youre happy youre a fool Sorry but you are  22181000000,2019-07-30
Thought the moron solved this problem Just like healthcare and Mexico paying for the wall and the national debt and the China Trade War and the opioid crisis and and and  20190730 221740000021,2019-07-30
Trump shafted family farmers to give trade war bailouts to huge corporate farms instead report  20190730 22165000000,2019-07-30
I know lots of farmers This shit is true and fucked up Trump shafted family farmers to give trade war bailouts to huge corporate farms instead report   20190730 22155100000,2019-07-30
USDA gave almost 100 percent of Trumps trade war bailout to white farmers Not only did almost all of the funds go to white operators but an overwhelming share of the funds appear to have gone to uppermiddleclass and wealthy families  20190730 22154500000,2019-07-30
Trump shafted family farmers to give trade war bailouts to huge corporate farms instead report  Raw Story  20190730 22153100000,2019-07-30
Trump shafted family farmers to give trade war bailouts to huge corporate farms instead report  20190730 22144000001,2019-07-30
The Fed is about to cut rates for the first time since 2008 as trade war weighs on economic growth  22141000000,2019-07-30
Trump shafted Family Farmers to give trade War bailouts to huge corporate Farms insteadreport  20190730 22140500000,2019-07-30
Trump shafted family farmers to give trade war bailouts to huge corporate farms instead report   mustread feedly20190730 22135200000,2019-07-30
Trump shafted family farmers to give trade war bailouts to huge corporate farms instead report  20190730 22132100002,2019-07-30
I eat no food from China Rent would not be raised because of China This trade war will eventually get resolved Please educate yourself because you sound like a foolish ignorant child We are losing hundreds of billions of dollars every year with China20190730 22131200000,2019-07-30
TRUMP CARD IN THE USCHINA TRADE WAR   realdonaldtrump TradeWars China TheDailyShow20190730 22125500000,2019-07-30
Data shows Trumps trade war is hurting US manufacturers Heres what 4 companies had to say about the negative impact   pictwittercomlZTNTjxjqN20190730 22121800000,2019-07-30
Trump shafted family farmers to give trade war bailouts to huge corporate farms instead report  20190730 22121000000,2019-07-30
SenateGOP China stopped buying our farmers soybeans because of Trumps trade war Russia steps in  20190730 22113500000,2019-07-30
In the end the trade war feels like part of a plan to bankrupt the last of the family farmers and transfer their land to the corporate farmers20190730 22112200001,2019-07-30
Trump shafted family farmers to give trade war bailouts to huge corporate farms instead  221103000011,2019-07-30
Trump shafted family farmers to give trade war bailouts to huge corporate farms instead report    Farmers TradeWar Tariffs20190730 22100100000,2019-07-30
Socialism like youre giving farmers due to a presidential trade war socialism like paved roads Seems like you only like to put fear in the ignorant with words they dont comprehend20190730 22095800001,2019-07-30
realDonaldTrump Breaks another Major Campaign Promise Just announced probably backing off Trade War with China also not making any budget cuts til after 2020 andof courseno bigger better healthcare plan GOP Going Down in Flames JohnCornyn SenTedCruz TXRandy1420190730 22095100000,2019-07-30
Trump shafted family farmers to give trade war bailouts to huge corporate farms instead  20190730 22092100002,2019-07-30
there are early signs that business spending may be rebounding with core durable goods orders turning positive the past two months Clinton McGarvin CFA equities economy tradewar homesales Europe treasuries  20190730 22091100001,2019-07-30
OVER 50 of federal aid meant to help with the negative impacts of the China trade war went to the largest and wealthiest farms according to Dept of AG data Why it matters The Trump admin prioritized aid to farms that produced high volumes leaving smaller farms behind20190730 22090400000,2019-07-30
Trump shafted family farmers to give trade war bailouts to huge corporate farms instead report   20190730 22082500000,2019-07-30
Trump shafted family farmers to give trade war bailouts to huge corporate farms instead report  Raw Story  20190730 22075000003,2019-07-30
So a lot of small farms are going to go under during the trade war And their fields acquired by big corporations Eventually Trump will point to the increase in stock value of those big companies as a sign of success20190730 22074300002,2019-07-30
When you believe in things that you dont understand then you suffer Stevie Wonder MAGA Trump shafted family farmers to give trade war bailouts to huge corporate farms instead report   20190730 22074100000,2019-07-30
Of course he did Trump shafted family farmers to give trade war bailouts to huge corporate farms instead report  20190730 22073300000,2019-07-30
Wall Street ends with benchmarks in the red ahead of Fed on trade war pessimism  20190730 22065000000,2019-07-30
Trump shafted family farmers to give trade war bailouts to huge corporate farms instead report  20190730 22063800000,2019-07-30
RT RawStory Trump shafted family farmers to give trade war bailouts to huge corporate farms instead report  20190730 22063500000,2019-07-30
How fucking PREDICTABLE Anybody who didnt expect this bailout for farmers to be a bigbucks scam had to be neckdeep in Trumps nether regions Trump shafted family farmers to give trade war bailouts to huge corporate farms instead report  20190730 22061600004,2019-07-30
Via RawStory Trump shafted family farmers to give trade war bailouts to huge corporate farms instead report  pictwittercomkU08Jf7HRo20190730 22060900000,2019-07-30
The EU wants to start a trade war we will just end up buying cars from the US or other non EU countries instead These days they are all designed for leftright hand drive fitment In fact such a trade embargo will help us kick start industry and new trade deals so bring it on20190730 22060400000,2019-07-30
New post How the USChina trade war hurts American entrepreneurs  20190730 22052300000,2019-07-30
Wall Street ends with benchmarks in the red ahead of Fed on trade war pessimism  20190730 22045300000,2019-07-30
Wall Street ends with benchmarks in the red ahead of Fed on trade war pessimism  20190730 22043300000,2019-07-30
Apples Tim Cook  AAPL is investigating capability of making Mac Book Pro domestically TradeWar20190730 22040800001,2019-07-30
Wall Street ends with benchmarks in the red ahead of Fed on trade war pessimism  20190730 22040400000,2019-07-30
crypto cryptocurrency bitcoin Sony warns price increase for PlayStation if US continues with trade war  pictwittercombYKQv9Jik320190730 22035800000,2019-07-30
Wall Street ends with benchmarks in the red ahead of Fed on trade war pessimism  20190730 22035800000,2019-07-30
Wall Street ends with benchmarks in the red ahead of Fed on trade war pessimism  20190730 22033800000,2019-07-30
