Mashable,1190739116062887936,2019-11-02 21:15:02,"b'The question is, why did it take Airbnb so long? https://t.co/dGHjLDMH9Z'"
Mashable,1190738853658796032,2019-11-02 21:14:00,b'Who needs scaffolding in the age of drones? https://t.co/hknplNnV4U'
Mashable,1190735004751605760,2019-11-02 20:58:42,"b'Some days, social media is a gift. This is one of those days. https://t.co/8Ezx6rvhaX'"
Mashable,1190733065464602624,2019-11-02 20:51:00,"b""We're officially living in the future https://t.co/ZiDxbCjVqR"""
Mashable,1190728787534565377,2019-11-02 20:34:00,"b""If you're gonna fly out of JFK, you might as well go all out, right? https://t.co/zuOf5NvYZB"""
Mashable,1190721237741387777,2019-11-02 20:04:00,"b""I wouldn't trust that hotel bed if I were you... https://t.co/HKnwfQgMmM"""
Mashable,1190718720907206657,2019-11-02 19:54:00,b'Why walk around the airport when you can ride your suitcase? https://t.co/GnJzWdpi3p'
Mashable,1190716477210603520,2019-11-02 19:45:05,"b'The \'Critters 3\' star called Thunberg a ""leader of our time."" https://t.co/Sjh92tC5tV'"
Mashable,1190713687943761920,2019-11-02 19:34:00,b'These cars could be super helpful in crowded cities https://t.co/Hl0yZSPcVb'
Mashable,1190706138301513729,2019-11-02 19:04:00,b'This tricked-out truck turns into a living space in seconds https://t.co/uvdq4K7uaT'
Mashable,1190701105010925569,2019-11-02 18:44:00,b'Meet the mad scientist of the Internet who built an actual hoverbike in his garage https://t.co/CxdIKD2zVC'
Mashable,1190697597826162689,2019-11-02 18:30:04,b'Alexa Answers is somehow turning out even worse than expected. https://t.co/reoa8gwNFr'
Mashable,1190696071858536448,2019-11-02 18:24:00,"b""Baby orangutans are quite possibly the cutest thing we've ever seen https://t.co/hNnsTaBxTy"""
Mashable,1190692767825047557,2019-11-02 18:10:52,b'Extra candy corn can go directly in the trash. https://t.co/hejrA6FlGI'
Mashable,1190691038786015232,2019-11-02 18:04:00,b'This house is made out of cardboard but can last a 100 years https://t.co/XMXGa87sJE'
Mashable,1190686760449130496,2019-11-02 17:47:00,"b""This treadmill is easy on your knees.... because it's underwater https://t.co/zXzGpxkRIG"""
Mashable,1190684243854163968,2019-11-02 17:37:00,b'This farm is run by robots and AI https://t.co/1WLStVByfx'
Mashable,1190679210555297794,2019-11-02 17:17:00,b'This home-grown algae is equal parts home decor and air purifier https://t.co/h7KFA5jKzy'
Mashable,1190678455769280514,2019-11-02 17:14:00,b'This ring is sleek and will help you stay in shape https://t.co/nFZseggkvy'
Mashable,1190678219474767875,2019-11-02 17:13:03,b'Maybe giving the U.S. president unfettered access to Twitter was a terrible idea? https://t.co/c1U56yNkF7'
Mashable,1190676694211813377,2019-11-02 17:07:00,b'Elon Musk is signing on to #TeamTrees after an exchange with YouTube MrBeast https://t.co/fsHJjhWiDs'
Mashable,1190671660824719360,2019-11-02 16:47:00,b'Imagine never buying a plastic shampoo or shower gel bottle ever again https://t.co/Al6K9J45s7'
Mashable,1190669144309387264,2019-11-02 16:37:00,b'Say goodbye to doggy bath time https://t.co/YLuR2sFumn'
Mashable,1190665890431455234,2019-11-02 16:24:04,b'What Android users should know about AirPods Pro https://t.co/uuAra3HXAC'
Mashable,1190664111220240384,2019-11-02 16:17:00,b'The One Where The Friends Cast Finally Releases Some New Content https://t.co/vV6tdc3R3c'
Mashable,1190664111216103430,2019-11-02 16:17:00,"b'We went to the year 3000, not much has changed but their backpacks are digital https://t.co/0b9IKxBfIC'"
Mashable,1190661594633555968,2019-11-02 16:07:00,"b""It's scary how cute these kitties are https://t.co/rN9Gj4fu6K"""
Mashable,1190656561376448512,2019-11-02 15:47:00,b'The helmet cyclists have been waiting for! https://t.co/PPUq2ddIjS'
Mashable,1190654044773072896,2019-11-02 15:37:00,"b""Looks like I'm not leaving my apartment this month https://t.co/nWRvHUXeR9"""
Mashable,1190649011704721410,2019-11-02 15:17:00,"b""We can't stop watching these flipping robots https://t.co/gwvAgDXBnt"""
Mashable,1190646890502795264,2019-11-02 15:08:34,b'The National Highway Traffic Safety Administration is investigating Tesla over alleged battery defects. https://t.co/P22lnf6jV8'
Mashable,1190646495139311618,2019-11-02 15:07:00,"b""Now those incessant piggy back rides don't have to be such a pain... literally https://t.co/YJfJsezvqW"""
Mashable,1190641462104322048,2019-11-02 14:47:00,b'This chainless drivetrain promises to make cycling a lot more efficient https://t.co/JXm2Rz0fFH'
Mashable,1190638945303846913,2019-11-02 14:37:00,b'This anti-manspreading chair is absolutely brilliant https://t.co/3gozdrnvAT'
Mashable,1190633912168583168,2019-11-02 14:17:00,b'Today is the perfect day to TIP \xf0\x9f\x91\x8f YOUR \xf0\x9f\x91\x8f UBER \xf0\x9f\x91\x8f DRIVER \xf0\x9f\x91\x8f https://t.co/RrNYwlHHgF'
Mashable,1190631395779121157,2019-11-02 14:07:00,b'Somehow this is not yet illegal https://t.co/gfYIUUvASY'
Mashable,1190628124020506626,2019-11-02 13:54:00,b'This robot has mad penmanship skills https://t.co/9FsGW3V2Wv'
Mashable,1190623090927132672,2019-11-02 13:34:00,b'This car of the future comes with its own greenhouse in the back https://t.co/XrDUDMwY82'
Mashable,1190618057732808704,2019-11-02 13:14:00,b'This tiny device projects storybook images from your phone https://t.co/IfGDXk9jtj'
Mashable,1190610507910320128,2019-11-02 12:44:00,"b""This isn't your average office lobby https://t.co/LUZsmEBOZC"""
Mashable,1190607991495487488,2019-11-02 12:34:00,b'Could delivery drones soon be here? https://t.co/rRwu0iea3T'
Mashable,1190602958335041537,2019-11-02 12:14:00,b'Someone has reinvented the broom and dustpan to make cleaning much easier https://t.co/NOtHfwbUSO'
Mashable,1190602726352273409,2019-11-02 12:13:04,b'When two become one https://t.co/hBanSQ7DVB'
Mashable,1190597924998262784,2019-11-02 11:54:00,b'These moving 3-D printed sculptures are actually static https://t.co/tEEUcbRzbj'
Mashable,1190592893322321920,2019-11-02 11:34:00,b'Meet the loneliest robot whose sole purpose is to sort pebbles https://t.co/sjvdi01p9O'
Mashable,1190585342375727104,2019-11-02 11:04:00,b'This is the smallest record player in the world https://t.co/FiyFJQdDE9'
Mashable,1190580308917116928,2019-11-02 10:44:00,b'Who needs friends when you can have a holographic gf who lives in a jar https://t.co/jIAxPTp5Y5'
Mashable,1190575275731501057,2019-11-02 10:24:00,"b""You'll never have to make your bed again https://t.co/r4DUok6ETO"""
Mashable,1190575041941049344,2019-11-02 10:23:04,b'Do AirPods Pro work with Android? https://t.co/zCqweRlrUv'
Mashable,1190572759082045440,2019-11-02 10:14:00,b'Beautiful footage of a mother whale and calf in their natural habitat https://t.co/vfuGvIOm6V'
Mashable,1190565209364148224,2019-11-02 09:44:00,b'Watching these otters go sledding will be the highlight of your day https://t.co/ifCa6kM6IS'
Mashable,1190562692949516289,2019-11-02 09:34:00,b'There is a saddle specifically designed for kids to legit ride on their parents https://t.co/NJyiwP4wSm'
Mashable,1190555143227531264,2019-11-02 09:04:00,"b'Toss your dog a treat, no matter where you are https://t.co/RAwp8YtXz9'"
Mashable,1190552626494156800,2019-11-02 08:54:00,b'Coffee addicts are going to love this one \xe2\x98\x95\xef\xb8\x8f https://t.co/Hd1H5EYpYs'
Mashable,1190542560198049792,2019-11-02 08:14:00,"b'It could all be yours for the low price of $20,000 https://t.co/TubZ9Snwak'"
Mashable,1190535010434072576,2019-11-02 07:44:00,b'This simple plastic bottle cutter may be the answer to better recycling https://t.co/ywBcelPlSG'
Mashable,1190527460607221761,2019-11-02 07:14:00,b'This invention is the new jet ski and we want one https://t.co/XrzB9uzRDV'
Mashable,1190522427555512320,2019-11-02 06:54:00,b'This wall of sea smoke might be the most ominous thing you will see all day https://t.co/N2YalK1JJ3'
Mashable,1190514877778944000,2019-11-02 06:24:00,b'This is like magic! https://t.co/0NTOTowo2S'
Mashable,1190504811298459648,2019-11-02 05:44:00,b'For all you gluten-free peeps https://t.co/bElNR2WAa1'
Mashable,1190489711954944001,2019-11-02 04:44:00,"b""This is the biggest greenhouse we've ever seen https://t.co/V2M3KP6Plp"""
Mashable,1190487195351580672,2019-11-02 04:34:00,b'Smart makeup mirror shows how you would look with different makeup instantly https://t.co/5jZpNztxdT'
Mashable,1190479645684092928,2019-11-02 04:04:00,b'This 3-screen laptop is the dream of tech nerds everywhere https://t.co/Z9M6eB1Ac5'
Mashable,1190477128946470912,2019-11-02 03:54:00,b'What a helpful little bot! https://t.co/AmoGCn2Jyz'
Mashable,1190472096087826433,2019-11-02 03:34:00,b'Could this possibly be the TV of the future? https://t.co/uFkKNdyIFP'
Mashable,1190464546416156674,2019-11-02 03:04:00,b'This futuristic car is so intuitive it knows your needs \xe2\x80\x94 and even your emotions https://t.co/ArzFRMKbtc'
Mashable,1190462029456265217,2019-11-02 02:54:00,b'Virtual reality \xe2\x80\x98shoes\xe2\x80\x99 are here and they\xe2\x80\x99re as weird as they sound https://t.co/a56gCGCBVN'
Mashable,1190454479734181888,2019-11-02 02:24:00,b'Turn your average laptop into a touchscreen https://t.co/4Hl078rUXq'
Mashable,1190449446762319873,2019-11-02 02:04:00,b'Someone designed a notebook that can last forever https://t.co/EnDauqguoV'
Mashable,1190446929941090304,2019-11-02 01:54:00,b'You may be brushing your hair all wrong \xe2\x80\x94 according to this smart brush https://t.co/JGwhsz51gm'
Mashable,1190441897061486593,2019-11-02 01:34:00,b'Heartbeat-like vibrations emitted by this wristband can help you stay relaxed https://t.co/KGa200akb6'
Mashable,1190434347343433728,2019-11-02 01:04:00,b'And this is why we need robots \xf0\x9f\xa4\x96 https://t.co/KCsLxuXJff'
Mashable,1190431830442426368,2019-11-02 00:54:00,"b""This umbrella is a weather forecaster that reminds you to take it when it's raining https://t.co/Of7SeA4YDG"""
Mashable,1190426797483032577,2019-11-02 00:34:00,"b'Who knew you could do this with 1,000 pounds of butter?! https://t.co/E4gmCrIjmw'"
Mashable,1190420380952997888,2019-11-02 00:08:30,b'That was intense https://t.co/HbcqjBWekR'
Mashable,1190419247928770560,2019-11-02 00:04:00,b'What a way to upgrade your morning commute https://t.co/Kihn0uzBJ9'
Mashable,1190416731161776130,2019-11-01 23:54:00,b'Bring your inner unicorn to life \xf0\x9f\xa6\x84 https://t.co/znsiPeIezM'
Mashable,1190411697925894150,2019-11-01 23:34:00,b'Your pants will vibrate when you walk. Repeat: your pants will VIBRATE https://t.co/g7Y3vALpyR'
Mashable,1190406664748335105,2019-11-01 23:14:00,"b'Finally, a bodysuit that\xe2\x80\x99ll have your grandma looking like a super-soldier https://t.co/90vsjzndK0'"
Mashable,1190406409537703936,2019-11-01 23:12:59,b'The joining of two great houses https://t.co/E9P6sxBkRJ'
Mashable,1190405911669592064,2019-11-01 23:11:00,b'Kim Kardashian shared a family Halloween photo with a hilariously bad Photoshop\n https://t.co/3YezVFacXX'
Mashable,1190401631713673217,2019-11-01 22:54:00,b'This woman is fitness goals https://t.co/lVIwYJcJbk'
Mashable,1190399145368047616,2019-11-01 22:44:07,b'People are already getting festive https://t.co/izFV1WKLm2'
Mashable,1190397353414537221,2019-11-01 22:37:00,"b'Reduce, reuse, recycle, Yeezy. https://t.co/WghOlHw8ME'"
Mashable,1190397228059430912,2019-11-01 22:36:30,"b""Emotional 'Overwatch 2' trailer reveals new heroes and a huge robot\nhttps://t.co/8uMMXM0cYf"""
Mashable,1190394081735626752,2019-11-01 22:24:00,"b'Far out, dude! https://t.co/Z3U0WWQvmy'"
Mashable,1190392320258199559,2019-11-01 22:17:00,"b'Get your tickets early, folks. #TheBatman is cast is really shaping up https://t.co/7mwquAwGkf'"
Mashable,1190390824124735489,2019-11-01 22:11:03,b'Facebook is the latest tech company to half-ass its way into healthcare\nhttps://t.co/NewcR4V2I9 https://t.co/8iJymMpy5b'
Mashable,1190389048960937986,2019-11-01 22:04:00,b'Because pushing your chair back is sometimes too difficult https://t.co/etNymiv10w'
Mashable,1190386532143620097,2019-11-01 21:54:00,b'Not sure if this will help your kids in science or give them nightmares https://t.co/6z5iUEwTVO'
Mashable,1190385876477661184,2019-11-01 21:51:23,"b'Mariah Carey, Christmas queen, declares the official start of the holiday season https://t.co/PiE7WktnPS'"
Mashable,1190382253957943296,2019-11-01 21:37:00,b'Give us all the #GameofThrones ASAP https://t.co/RiKoqo91v1'
Mashable,1190381498974818307,2019-11-01 21:34:00,b'This sponge-like material is 10 times stronger than steel https://t.co/qodY5MEEix'
Mashable,1190380195859116035,2019-11-01 21:28:49,"b""Blizzard president apologizes for 'failure' in Hong Kong debacle\nhttps://t.co/KxP4yRJ8ii"""
Mashable,1190375063574450177,2019-11-01 21:08:25,b'Instacart shoppers are fed up https://t.co/Ah3RQ00b5n'
Mashable,1190372708816699393,2019-11-01 20:59:04,b'Kim Kardashian shared a family Halloween photo with a hilariously bad Photoshop\n https://t.co/gOvhfiY5w9'
Mashable,1190368916234739712,2019-11-01 20:44:00,b'This looks very 007 https://t.co/acqheGP6GY'
Mashable,1190367685865066496,2019-11-01 20:39:06,b'Your precious Halloween moments = property of a large tech corporation https://t.co/OJZYJJB4HZ'
Mashable,1190366913706233857,2019-11-01 20:36:02,b'Ring watched your kids trick or treat and then bragged about it\nhttps://t.co/jLGvVVd9P8 https://t.co/BPWoK4ERw4'
Mashable,1190366399492841472,2019-11-01 20:34:00,b'Can we get a ride on that bus? https://t.co/8Osf6rmW6Q'
Mashable,1190365617745989633,2019-11-01 20:30:53,"b'Google revealed a security flaw on Halloween, so maybe update Chrome now\nhttps://t.co/Wao30FOR5J https://t.co/fgWrfySbBq'"
Mashable,1190359231003865089,2019-11-01 20:05:31,"b""'World of Warcraft: Shadowlands' trailer reveals a spooky looking expansion\nhttps://t.co/q9jXJF4rFK"""
Mashable,1190358849951158272,2019-11-01 20:04:00,b'This will make even the least outdoorsy person want to go camping https://t.co/oCqWHmiWpE'
Mashable,1190357087970181120,2019-11-01 19:57:00,"b'He\'s going by ""Treelon"" now https://t.co/qYuru9FJqC'"
Mashable,1190356333087907840,2019-11-01 19:54:00,b'Cold brew has never been easier to make https://t.co/yI2hxXo5Vl'
Mashable,1190354126795874306,2019-11-01 19:45:14,b'Turns out woman covered in blood after wrecking her car was just dressed as Carrie https://t.co/prfNdAGRDh'
Mashable,1190349070960865280,2019-11-01 19:25:08,"b""Emotional 'Overwatch 2' trailer reveals new heroes and a huge robot\nhttps://t.co/yhgQBEJZ89"""
Mashable,1190348854501281793,2019-11-01 19:24:17,"b""'Diablo 4' revealed with a hellish trailer\nhttps://t.co/xQ00ygUBhO"""
Mashable,1190348783353155584,2019-11-01 19:24:00,b'This entire castle was 3D printed with concrete https://t.co/PM4qN8OMYk'
Mashable,1190346266825256961,2019-11-01 19:14:00,b'This pocket-sized drone is changing the selfie game https://t.co/HTOr6MdhhQ'
Mashable,1190342854662610944,2019-11-01 19:00:26,"b""Blizzard president apologizes for 'failure' in Hong Kong debacle\nhttps://t.co/rogLY4LUHs"""
Mashable,1190341082447568900,2019-11-01 18:53:24,"b""'World of Warcraft: Shadowlands' trailer reveals a spooky looking expansion\nhttps://t.co/Dy2Mso4HnW"""
Mashable,1190338717128413184,2019-11-01 18:44:00,b'These pens have unlimited color options https://t.co/C4SLNQiF4w'
Mashable,1190336834242596865,2019-11-01 18:36:31,"b""'Diablo 4' revealed with a hellish trailer\nhttps://t.co/Zp6gp21wxD"""
Mashable,1190335697359720449,2019-11-01 18:32:00,"b""Watching this sand table change patterns is the most relaxing thing you'll see all day https://t.co/9q0eT3dBgu"""
Mashable,1190334245274836996,2019-11-01 18:26:14,"b""Elon Musk's on a Twitter break again https://t.co/3F9fVOyEZe"""
Mashable,1190331311380152321,2019-11-01 18:14:34,b'The untold story behind the world\xe2\x80\x99s first major internet attack: The Morris Worm. https://t.co/Ey4H7Kdz5f https://t.co/6hXMITfLnu'
Mashable,1190328651084161025,2019-11-01 18:04:00,b'The unicorns are here to stay https://t.co/PEzMboEUkr'
Mashable,1190324372692561920,2019-11-01 17:47:00,b'This nature-inspired wind turbine is shaped like a tree to blend in with its surroundings https://t.co/6H2efLPm3w'
Mashable,1190321855963512835,2019-11-01 17:37:00,b'These disposable plates are made entirely out of leaves \xf0\x9f\x8d\x83\xf0\x9f\x8d\xbd https://t.co/ho8lhn2B1Q'
Mashable,1190316822811348993,2019-11-01 17:17:00,"b'These inventions are totally unnecessary, but we want every. single. one. https://t.co/Q1I16XQgTi'"
Mashable,1190316052288299008,2019-11-01 17:13:56,"b""'Fire in Paradise' documentary hits Netflix as wildfires ravage California\nhttps://t.co/qchY5RKXF4"""
Mashable,1190314306329436161,2019-11-01 17:07:00,b'The worst part of having a cat has FINALLY been automated https://t.co/rjFA34JSip'
Mashable,1190309774929334277,2019-11-01 16:48:59,"b""John Krasinski does impression of Emily Blunt's dad and yes it does feature a British accent\nhttps://t.co/kk1e4z1D9j https://t.co/ftAflKTngS"""
Mashable,1190309273085075457,2019-11-01 16:47:00,b'Celebrities dressing as other celebrities for Halloween? How meta https://t.co/to0VvNDrr4'
Mashable,1190309032600489987,2019-11-01 16:46:02,b'Halloween is over. The seasonal holiday wars have begun. #MerryChristmas #November1st https://t.co/b9CIRHP9pq'
Mashable,1190309032587939840,2019-11-01 16:46:02,"b""'Fire in Paradise' documentary hits Netflix as wildfires ravage California\nhttps://t.co/O1tdD8yNq6"""
Mashable,1190306756397801480,2019-11-01 16:37:00,"b'We went to the year 3000, not much has changed but their backpacks are digital https://t.co/e4BOww93xi'"
Mashable,1190301723430027265,2019-11-01 16:17:00,"b""We're begging you to please give us this iconic duo in more projects https://t.co/cPwSyTzwdT"""
Mashable,1190299206872899585,2019-11-01 16:07:00,"b'Guess he has to rename ""Forever""... https://t.co/v00qKrWmIJ'"
Mashable,1190296685458657280,2019-11-01 15:56:59,"b'Mariah Carey, Christmas queen, declares the official start of the holiday season https://t.co/CAbDDy6PCm'"
Mashable,1190294173737373696,2019-11-01 15:47:00,b'This racing boat is totally fast and super fancy https://t.co/c87UQU5EKv'
Mashable,1190291656999874560,2019-11-01 15:37:00,b'The One Where The Friends Cast Finally Releases Some New Content https://t.co/Ro85awf1vy'
Mashable,1190288139253960705,2019-11-01 15:23:01,b'The college major meme will roast you no matter what you studied https://t.co/i6GMHCS2VI https://t.co/rEmBb6K2M7'
Mashable,1190286624111902721,2019-11-01 15:17:00,b'Cut to the pumpkins on our porch as soon as Halloween is over https://t.co/j4dWrPF1QO'
Mashable,1190284107344830469,2019-11-01 15:07:00,b'Print any temporary tattoo right onto your skin https://t.co/MK8cvMvTRx'
Mashable,1190281338374574081,2019-11-01 14:56:00,"b""'Terminator: Dark Fate' is a robotic rehash of familiar beats\nhttps://t.co/em6b2bTTU1"""
Mashable,1190279074167631874,2019-11-01 14:47:00,b'Someone reverse engineered the umbrella - and it totally works https://t.co/fqtmYjsr9J'
Mashable,1190276557589241856,2019-11-01 14:37:00,b'This food recycler eliminates the grossest part of composting https://t.co/GCJ3PAWkTo'
Mashable,1190275751112826880,2019-11-01 14:33:47,"b""'Terminator: Dark Fate' is a robotic rehash of familiar beats\nhttps://t.co/7hdOOMxpxs"""
Mashable,1190275146457718784,2019-11-01 14:31:23,b'Google seriously ups wearables game with $2.1 billion Fitbit purchase\nhttps://t.co/1UqawZdWN6 https://t.co/WiEGqtbBuM'
Mashable,1190272619750285313,2019-11-01 14:21:21,"b""This mom dressed her kids up as AirPods for Halloween, and yes, it's as adorable as it sounds https://t.co/WzgJd9r5Rt"""
Mashable,1190271524315553793,2019-11-01 14:17:00,b'This super strong duct tape can tape anything https://t.co/QwgOl63Xxw'
Mashable,1190269007770898432,2019-11-01 14:07:00,"b'The human brain is able to multitask, using both hands plus a robot arm simultaneously https://t.co/cDMcA5vNmo'"
Mashable,1190265736108892160,2019-11-01 13:54:00,"b'Finally, someone has reinvented the crutches \xf0\x9f\x91\x8f https://t.co/Ip1nQNFKlA'"
Mashable,1190261222618402816,2019-11-01 13:36:04,b'\xf0\x9f\x94\xa5\xf0\x9f\x94\xa5\xf0\x9f\x94\xa5\xf0\x9f\x94\xa5\xf0\x9f\x94\xa5 https://t.co/dfjD0ISptQ'
Mashable,1190260703141208067,2019-11-01 13:34:00,b'Someone built that Lego train set of your childhood dreams https://t.co/l5rJ9oTMM6'
Mashable,1190259601083686912,2019-11-01 13:29:37,b'Above and beyond. https://t.co/MCc1VeNfWL'
Mashable,1190257214663073792,2019-11-01 13:20:08,"b""Heidi Klum's elaborate, 13-hour Halloween costume will give you nightmares https://t.co/ftvwDj0vms"""
Mashable,1190255185265930240,2019-11-01 13:12:04,"b""David Harbour recreated THAT scene from 'The Shining' and it's frankly terrifying https://t.co/QAsINchnEc https://t.co/y9s3MuMC3s"""
Mashable,1190253153540878342,2019-11-01 13:04:00,b'Summer body here we come! https://t.co/mqntX2aD7e'
Mashable,1190252922942164994,2019-11-01 13:03:05,"b'Emily Dickinson doesn\'t deserve what ""Dickinson"" makes of her https://t.co/3FXzaquHFc'"
Mashable,1190252219217694723,2019-11-01 13:00:17,"b""'Death Stranding' is a gigantic creative risk that paid off immensely https://t.co/E4iJqCjP9z"""
Mashable,1190250636685692928,2019-11-01 12:54:00,b'Run to the beat of the music with this epic lightshow https://t.co/kIZdHC6cN1'
Mashable,1190245603617452034,2019-11-01 12:34:00,"b""When your toothpaste gets low, you're going to need this device https://t.co/sJYa4pSRYN"""
Mashable,1190238053975105536,2019-11-01 12:04:00,b'We can practically smell the bacon \xf0\x9f\xa5\x93 https://t.co/pXtJSB9eXo'
Mashable,1190235537157902336,2019-11-01 11:54:00,b'An e-waste company is employing former prison inmates to recycle https://t.co/TJfHEO17K9'
Mashable,1190233752842227712,2019-11-01 11:46:54,b'Gaten Matarazzo and Kristen Stewart are hilariously bad at VR Pictionary\nhttps://t.co/aOr3inUiFU https://t.co/J0GVdcA37K'
Mashable,1190231289544228864,2019-11-01 11:37:07,"b""Kristen Stewart's Halloween costume is a literal dead stereotype and we love it https://t.co/68pTCcG3ib https://t.co/zlTf4O0ebS"""
Mashable,1190227987410685952,2019-11-01 11:24:00,b'Take selfies with Nemo and the gang with this underwater device for your phone https://t.co/eMQjjxameB'
Mashable,1190224977674592257,2019-11-01 11:12:02,"b'Arctic sea ice is at record lows in northern waters around Alaska, largely due to record high ocean temperatures https://t.co/inU4U2l1v7'"
Mashable,1190222954451226625,2019-11-01 11:04:00,b'Never again will your laces come undone https://t.co/lRrm9CSPeI'
Mashable,1190220437625671682,2019-11-01 10:54:00,b'The ultimate hands-free selfie: taking selfies with your feet https://t.co/6zSU9AFWYJ'
Mashable,1190217215712415744,2019-11-01 10:41:12,"b'This, uh, took some preparation. https://t.co/07oIOYEw98'"
Mashable,1190216837990158336,2019-11-01 10:39:41,b'James Corden sends an audience member through a truly ridiculous Halloween obstacle course https://t.co/rrBnSjGjHV https://t.co/A5rFHHtKzi'
Mashable,1190212887853191168,2019-11-01 10:24:00,b'This unique artist creates famous faces out of food https://t.co/ouOs8v0zqz'
Mashable,1190207855066066944,2019-11-01 10:04:00,b'Rejuvenate your face with this light mask https://t.co/ZldvpeOL1v'
Mashable,1190205338248548352,2019-11-01 09:54:00,"b'If this patch detects stress, vibrations will guide you to achieve calmness \xf0\x9f\x98\x8c https://t.co/jtcWJXdE7p'"
Mashable,1190200305188622336,2019-11-01 09:34:00,"b""This robot looks just like a bat and it's creepy af https://t.co/p8A3K6XVIr"""
Mashable,1190192808570822656,2019-11-01 09:04:12,"b'Jason Momoa judges a pumpkin carving contest and things get very brutal, very fast\nhttps://t.co/XBoWvHNHBA https://t.co/zLYQAJgrN6'"
Mashable,1190192755462615040,2019-11-01 09:04:00,b'You better start working on that balance! https://t.co/TjVksVttnN'
Mashable,1190187721911918595,2019-11-01 08:44:00,"b""Doesn't get any easier than this https://t.co/zXDZcIEXXO"""
Mashable,1190180172223459329,2019-11-01 08:14:00,"b'Men, test your fertility at home with this smartphone app https://t.co/YSC1H34dLY'"
Mashable,1190175269128212481,2019-11-01 07:54:31,b'Nancy Pelosi tells Stephen Colbert why she *finally* opened the impeachment inquiry into Donald Trump\xe2\x80\xa6 https://t.co/FgfDqgZlvp'
Mashable,1190175139272577024,2019-11-01 07:54:00,"b'The world is your oyster! Er, we mean keyboard https://t.co/kgJ6Ggde1d'"
Mashable,1190167589466411008,2019-11-01 07:24:00,b'Check out this smart vehicle designed to act as your personal assistant https://t.co/aGUoNzGptV'
Mashable,1190166097254850560,2019-11-01 07:18:04,"b""'Death Stranding' is a gigantic creative risk that paid off immensely https://t.co/j5yJMifkZh"""
Mashable,1190162441793081344,2019-11-01 07:03:32,b'A great disturbance: Ewan McGregor was sick of having to lie about returning as Obi-Wan https://t.co/xVZGvW4rw7 https://t.co/ckeXDU5jG8'
Mashable,1190155904387309568,2019-11-01 06:37:34,"b""Watch Gaten Matarazzo and Jimmy Fallon hilariously butcher 'The NeverEnding Story' https://t.co/rAWquspk2U https://t.co/eq5dC1x4rE"""
Mashable,1190155006474883072,2019-11-01 06:34:00,b'These beautiful vertical forests could help cities clean up air pollution https://t.co/ucfZgpbKbp'
Mashable,1190149973213687809,2019-11-01 06:14:00,"b""Don't worry about remembering to water your plants, this planter does it for you https://t.co/e4OQ9nZnn4"""
Mashable,1190142423663443968,2019-11-01 05:44:00,"b""Don't worry about remembering to water your plants, this planter does it for you https://t.co/a4DoANb7wf"""
