Mashable,1193139925018972160,2019-11-09 12:15:00,b'An epic unibrow sets this Insta-famous model apart from the rest https://t.co/NvTFJVGiop'
Mashable,1193131620204605441,2019-11-09 11:42:00,b'This 16-year-old is on her way to becoming the first professional hijab-wearing-ballerina https://t.co/LGbxgnE8Lg'
Mashable,1193129103794343936,2019-11-09 11:32:00,"b""This is what Michael Phelps' diet was like during training \xf0\x9f\x98\xb1 https://t.co/ryhQiZSbW6"""
Mashable,1193124825461481473,2019-11-09 11:15:00,b'This artist is building the love she deserves -- someone who always texts back https://t.co/TwOgXPVLax'
Mashable,1193124070491074561,2019-11-09 11:12:00,b'Your kids will never be afraid of the dark -- or sleep -- again https://t.co/2PivgG1lck'
Mashable,1193122921134350342,2019-11-09 11:07:26,"b""In big step forward, tampons in Germany won't be taxed as luxury items\n\nhttps://t.co/9j73pJlJ4J https://t.co/wXG7Lx6GRs"""
Mashable,1193116520789901317,2019-11-09 10:42:00,"b""This cybersecurity expert has 1,500 passwords: Here's why and how https://t.co/nmkfl56DH3"""
Mashable,1193111487641874432,2019-11-09 10:22:00,b'Student engineers built an incredibly fast solar-powered car https://t.co/ed71yTKk0R'
Mashable,1193107209401643008,2019-11-09 10:05:00,"b""Sorry, but you can't really erase yourself from the internet https://t.co/ewdwx5lzMH"""
Mashable,1193102176262008832,2019-11-09 09:45:00,"b""These dolls with vitiligo can help kids love the skin they're in https://t.co/yhYNT145QL"""
Mashable,1193093871460220929,2019-11-09 09:12:00,b'This girl is breaking Instagram norms and going viral https://t.co/gbEDaAdhgN'
Mashable,1193088083492630528,2019-11-09 08:49:00,b'Facial recognition could make your commute MUCH easier https://t.co/B3SISYq0Zb'
Mashable,1193078771982782464,2019-11-09 08:12:00,b'Does social media make us happier? \xf0\x9f\xa4\x94 https://t.co/D22I8ZzdER'
Mashable,1193070970585546753,2019-11-09 07:41:00,b'Now you can get your star sign tattooed as freckles https://t.co/nblOYEjTqw'
Mashable,1193064175771082754,2019-11-09 07:14:00,b'Upgrade your latte game \xf0\x9f\x92\xaf https://t.co/S3SZjuCHOa'
Mashable,1193056122623578113,2019-11-09 06:42:00,b'Google Lens AI tried (and failed) to identify 20 adorable Corgis https://t.co/lqdKgqJYBv'
Mashable,1193049579572187136,2019-11-09 06:16:00,b'A new way of cycling is coming with airless tires that never go flat https://t.co/nvtw0zJZFs'
Mashable,1193042281638449152,2019-11-09 05:47:00,b'This tiny robot is basically an all-star gymnast https://t.co/TI79zJCKuc'
Mashable,1193037248351989760,2019-11-09 05:27:00,b'This smart luggage is a suitcase AND a scooter https://t.co/UHLfZsiLg0'
Mashable,1193032215300595719,2019-11-09 05:07:00,b'Bye bye germs \xf0\x9f\x91\x8b\xf0\x9f\x8f\xbb https://t.co/sMpKk0cxj6'
Mashable,1193028943605125120,2019-11-09 04:54:00,b'Curious creatures https://t.co/zQR63yJjD2'
Mashable,1193023910532354049,2019-11-09 04:34:00,b'AI just keeps getting cooler and cooler https://t.co/yn4mnpKjBY'
Mashable,1193016360852316160,2019-11-09 04:04:00,b'This underwater restaurant is also a marine life research center https://t.co/TN7hjqiQAK'
Mashable,1193013844156698624,2019-11-09 03:54:00,"b'OK, Amazon. We see you https://t.co/RmQTlfRPSA'"
Mashable,1193008811264471042,2019-11-09 03:34:00,b'This plane is not messing around https://t.co/31F9cdxtPf'
Mashable,1193003777776914433,2019-11-09 03:14:00,b'A whole new way to grocery shop https://t.co/TRSyqq8TxC'
Mashable,1192996477624311808,2019-11-09 02:44:59,b'Airbnb\xe2\x80\x99s party house problems keep piling up https://t.co/KvAPxxMgut'
Mashable,1192996228201508865,2019-11-09 02:44:00,b'This taxi is next level https://t.co/zDPSzFZRel'
Mashable,1192993711514370048,2019-11-09 02:34:00,"b'One small step for that robot, one giant leap for automated deliveries https://t.co/WvHR3B5AMk'"
Mashable,1192988678240559105,2019-11-09 02:14:00,b'This fully-electric concept car could be the future of transportation https://t.co/0ToeZ6hUr8'
Mashable,1192983645125922816,2019-11-09 01:54:00,b'These braille Lego bricks could have a serious positive impact on the way visually-impaired children are educated https://t.co/uFoW4NVbHO'
Mashable,1192981509747150849,2019-11-09 01:45:31,b'Say goodbye to (public) like counts https://t.co/maOuId08tT'
Mashable,1192976095303348230,2019-11-09 01:24:00,b'Astronauts could be living in these 3D-printed buildings on Mars one day https://t.co/moKgl1YtTy'
Mashable,1192973578838261762,2019-11-09 01:14:00,b'How degradable are biodegradable shopping bags? https://t.co/v6ThZFwPYV'
Mashable,1192967374267387904,2019-11-09 00:49:20,b'Facebook blocked Breitbart from posting the name of the alleged Trump whistleblower https://t.co/1ryw61mdDc'
Mashable,1192966029196050434,2019-11-09 00:44:00,b'I thought RoboCop was taller... https://t.co/RRvl8t8Whi'
Mashable,1192964535226945536,2019-11-09 00:38:04,"b""Don't let it happen to you https://t.co/lkVASORhY8"""
Mashable,1192963512844345350,2019-11-09 00:34:00,"b""All the grating power you'd expect from the latest Apple device that for some reason doesn't come with a Never Endi\xe2\x80\xa6 https://t.co/EPEnLWO2hT"""
Mashable,1192956424428675074,2019-11-09 00:05:50,b'Finally! \n\nhttps://t.co/3aWYLBOjSf'
Mashable,1192955962983960576,2019-11-09 00:04:00,"b""Meet the fire station's latest recruit https://t.co/qMuWhn3bc4"""
Mashable,1192950929667969025,2019-11-08 23:44:00,b'Would you take an Uber Air flying taxi? https://t.co/WJ8nVrT7kr'
Mashable,1192948413077188608,2019-11-08 23:34:00,b'Can you tell the difference? https://t.co/YE8PkWodi4'
Mashable,1192945671525011457,2019-11-08 23:23:06,b'Waymo says goodbye to Austin https://t.co/82wo0JLvUY'
Mashable,1192940863480987648,2019-11-08 23:04:00,b'Strawberry robots forever \xf0\x9f\x8d\x93 https://t.co/2Yff1Cnymc'
Mashable,1192938346584006656,2019-11-08 22:54:00,b'Space is beautiful https://t.co/KNblKsFgzP'
Mashable,1192934068587057153,2019-11-08 22:37:00,"b'Algae shoes sounds like a ""SpongeBob"" episode https://t.co/TTJ3MJXx0S'"
Mashable,1192933562208661505,2019-11-08 22:34:59,"b'12 gifts to give yourself, because why not https://t.co/FkpMVbGbVd'"
Mashable,1192933313607921666,2019-11-08 22:34:00,b'This robot could totally change gardening https://t.co/JXiJ4WC1iG'
Mashable,1192928019045920774,2019-11-08 22:12:57,"b'WeWork employees call out ""greed"" and ""deception"" in open letter\nhttps://t.co/7cUFHHbmSo'"
Mashable,1192925764045262848,2019-11-08 22:04:00,b'Sneaky octopus! https://t.co/JgZvhYsi8v'
Mashable,1192924002043363328,2019-11-08 21:57:00,"b'We\'ll file this under ""creepy and inappropriate"" https://t.co/eqq2gpJ9Ms'"
Mashable,1192923247362351104,2019-11-08 21:54:00,"b'Yeah stars are pretty, but can you count them all up? https://t.co/pCSPeez0yu'"
Mashable,1192922367741313026,2019-11-08 21:50:30,"b""Don't be fooled, Twitter is still a hellscape\nhttps://t.co/bbfrj4UGNk"""
Mashable,1192918214365368320,2019-11-08 21:34:00,b'This drone could totally change the wireless charging game https://t.co/bHl23IPJFy'
Mashable,1192915014392393728,2019-11-08 21:21:17,b'Escape the sensory world while you travel https://t.co/eMN8KLm8aH'
Mashable,1192913181028618242,2019-11-08 21:14:00,"b""The world's first flying motorcycle is gonna be a reality in 2020 https://t.co/C7FSIezSP9"""
Mashable,1192909433212420096,2019-11-08 20:59:06,b'Facebook gave Tinder and other dating apps special access to user data https://t.co/JuKn9TYCEV'
Mashable,1192905631105028096,2019-11-08 20:44:00,"b""These robotic hands let the user feel what they're holding https://t.co/ojSAy4N2rd"""
Mashable,1192903281149980672,2019-11-08 20:34:39,"b'Mastercard: Trans people should be able to use their chosen name on their debit card, not their deadname https://t.co/HztegM5WM3'"
Mashable,1192903114627506176,2019-11-08 20:34:00,"b'""Alexa, are we in the Matrix?"" https://t.co/A38kDC0JCh'"
Mashable,1192897268032114690,2019-11-08 20:10:46,b'Bored taxpayer rebels and transforms the IRS hold music into something beautiful https://t.co/DA7h5EdPk4'
Mashable,1192895565044076545,2019-11-08 20:04:00,"b'Yer a wizard, Hamster Potter! https://t.co/ghW304eVqV'"
Mashable,1192893803323154432,2019-11-08 19:57:00,b'An installation made up of thousands of handwritten messages is floating above where the Berlin Wall used to be https://t.co/8b5SXYIVf3'
Mashable,1192893048331669506,2019-11-08 19:54:00,"b""NASA's climbing robot is totally fearless https://t.co/F8jsxwCbFH"""
Mashable,1192888794296569858,2019-11-08 19:37:06,"b""Mystery text messages: Here's what caused the 2 a.m. confusion https://t.co/h7AJoZPCfa"""
Mashable,1192885498580221952,2019-11-08 19:24:00,"b'The 2020 Tokyo Olympic medals are made of 78,985 tons of unused electronic devices https://t.co/yG9WNpsXRL'"
Mashable,1192884989685317632,2019-11-08 19:21:58,b'@marcusgilmer One day!'
Mashable,1192880465604014081,2019-11-08 19:04:00,"b""Just because you might not have had the opportunity to learn ASL before, that doesn\xe2\x80\x99t mean you can't now https://t.co/iNanvGr85Z"""
Mashable,1192876610359353344,2019-11-08 18:48:41,"b'Good news Peter Thiel and Count Dracula, this company that sells young blood is back in business https://t.co/T7G1D0QCO5'"
Mashable,1192876187124559872,2019-11-08 18:47:00,"b""Thieves won't get away with stealing this smart wallet https://t.co/eHBgwWbbKj"""
Mashable,1192873670500388864,2019-11-08 18:37:00,"b'The more this camera sees, the smarter it becomes https://t.co/lijN0IOfK7'"
Mashable,1192871064390516736,2019-11-08 18:26:38,"b""Apple Store employee accused of sending himself photos from customer's phone\nhttps://t.co/aRz8M9jaiE"""
Mashable,1192868637486567424,2019-11-08 18:17:00,b'Keeping floors clean just got a lot easier https://t.co/irVQWlrLct'
Mashable,1192866120891392000,2019-11-08 18:07:00,"b""This is one the friendliest robots we've ever seen https://t.co/04PQ6VRUH9"""
Mashable,1192865575262937091,2019-11-08 18:04:50,"b""It's about time\n\nhttps://t.co/5kKaITEOSQ"""
Mashable,1192861087739400197,2019-11-08 17:47:00,b'Imagine never buying a plastic shampoo or shower gel bottle ever again https://t.co/k8Po0yZZQh'
Mashable,1192859111693701121,2019-11-08 17:39:09,b'Facebook gave Tinder and other dating apps special access to user data https://t.co/qJElIEUeod'
Mashable,1192858571119058944,2019-11-08 17:37:00,b'Can I be her when I grow up? https://t.co/RlWIo4qUi5'
Mashable,1192854931956551680,2019-11-08 17:22:32,"b""NASA's climbing robot is totally fearless https://t.co/rhIWuPBj0V"""
Mashable,1192853887130243073,2019-11-08 17:18:23,"b'12 gifts to give yourself, because why not https://t.co/kCyqBcvjxo'"
Mashable,1192853538101174273,2019-11-08 17:17:00,b'This floating vacuum cleaner could be the key to keeping plastic out of our oceans https://t.co/OiMhFYSUXB'
Mashable,1192851021757849601,2019-11-08 17:07:00,b'When you want the latest tech but still wanna be old school https://t.co/UoutP8qaOW'
Mashable,1192850267370377217,2019-11-08 17:04:00,b'Calling all Jims! Calling all Pams! https://t.co/SWJdNG1RFy'
Mashable,1192845988257386496,2019-11-08 16:47:00,b'Airbnb is reportedly making some changes after recent events https://t.co/HQP6YPinwF'
Mashable,1192843471641432064,2019-11-08 16:37:00,"b'""Yandex.Rover, can you pick up my McDonald\'s for me, please?"" https://t.co/esTRjFkDxs'"
Mashable,1192839373114478597,2019-11-08 16:20:43,b'Me grocery shopping from the office kitchen after everyone leaves on Friday  https://t.co/4EMrvAuqqv'
Mashable,1192838438489182208,2019-11-08 16:17:00,"b""Grab the printer and your captain's hats, because we're going boating! https://t.co/srEX3HWBl1"""
Mashable,1192837000002449408,2019-11-08 16:11:17,b'Bored taxpayer rebels and transforms the IRS hold music into something beautiful https://t.co/ObUIfRiwn7'
Mashable,1192835921814708224,2019-11-08 16:07:00,"b""What's in an iPhone? These scientists made an iPhone smoothie to find out https://t.co/x1SSIbnfao"""
Mashable,1192830888574377984,2019-11-08 15:47:00,b'This trash can crushes your garbage to save space https://t.co/SDmPNsP0K3'
Mashable,1192828372113489925,2019-11-08 15:37:00,b'Fall asleep anywhere with this wearable sleeping bag https://t.co/TimGocAlG7'
Mashable,1192825783603093505,2019-11-08 15:26:43,"b""Apple's new iOS update fixes dreaded multitasking bug\nhttps://t.co/rDv2wEGZoL"""
Mashable,1192823339015782400,2019-11-08 15:17:00,b'Imagine getting one of these while trick or treating https://t.co/3DSoSFAc4R'
Mashable,1192820822609551360,2019-11-08 15:07:00,"b""We wouldn't want this robot coming after us https://t.co/oidXCZNGEI"""
Mashable,1192820308740325382,2019-11-08 15:04:57,b'The lack of depth is noticeable \xe2\x80\x94 but its star is stunning.\nhttps://t.co/l1Spwjta7i'
Mashable,1192817550670778368,2019-11-08 14:54:00,b'Reddit working together \xf0\x9f\x91\x8f\xf0\x9f\x91\x8f\xf0\x9f\x91\x8f https://t.co/ieY8PI7EoM'
Mashable,1192815771287769088,2019-11-08 14:46:55,"b""Trevor Noah goes after the vaping industry, doesn't hold back https://t.co/mOiqgF3ZdQ https://t.co/SselG18vkF"""
Mashable,1192812517883408384,2019-11-08 14:34:00,"b""This digital art exhibit changes based on the visitor's mood https://t.co/eTz3So95n9"""
Mashable,1192809381227835393,2019-11-08 14:21:32,"b""Willem Dafoe delivers a monologue for the ages in intense clip from 'The Lighthouse'\nhttps://t.co/vIWa76KYKn https://t.co/6Hj3uG4DeN"""
Mashable,1192807484517433345,2019-11-08 14:14:00,b'Human-sized monster penguin. Enough said. https://t.co/5CERxE9VSK'
Mashable,1192804263929503744,2019-11-08 14:01:12,b'Aisling Bea sings Disney songs during podcast technical difficulties and just wow https://t.co/ecTUr24c7f https://t.co/f9ds9EaCoP'
Mashable,1192802451230994432,2019-11-08 13:54:00,"b""This ball can entertain your pets while you're away https://t.co/vQJjRg1hbP"""
Mashable,1192798580098117632,2019-11-08 13:38:37,"b""'Sesame Street' stars crash James Corden's show for a delightful musical opening\nhttps://t.co/RQ8NoFdHoA https://t.co/W0Ord0IbKw"""
Mashable,1192794901534171136,2019-11-08 13:24:00,b'This smart treadmill will help your cat get swole https://t.co/p9da8Ncgjz'
Mashable,1192792916009398272,2019-11-08 13:16:06,"b""Netflix's 'Let It Snow' is here to kick your holiday season off right\nhttps://t.co/Qj3duuFmua"""
Mashable,1192789868688134146,2019-11-08 13:04:00,"b'Guided by magnets, this tiny thread could one day enter your brain to clear blood clots https://t.co/7ucyl7bPjq'"
Mashable,1192789388612325376,2019-11-08 13:02:05,"b""Willem Dafoe rages at Robert Pattinson in intense clip from 'The Lighthouse'\nhttps://t.co/Uoln4TzLSV https://t.co/hX8OcgZCne"""
Mashable,1192787351824523269,2019-11-08 12:54:00,b'BMW just painted a car with the blackest black known to man https://t.co/R6ayoxyrbk'
Mashable,1192782318915731456,2019-11-08 12:34:00,"b'Porsche vs. Tesla, who you got? https://t.co/Lxv7fDOTsZ'"
Mashable,1192780807296958464,2019-11-08 12:27:59,b'Awwww. Throwback time. https://t.co/RvBGvupogz'
Mashable,1192777285503528960,2019-11-08 12:14:00,b'Turning orange peels into 3D printer filament https://t.co/spTLm133B6'
Mashable,1192773349337944064,2019-11-08 11:58:21,b'The horror master did not hold back. https://t.co/XBrNeV0C7M'
Mashable,1192772252221267969,2019-11-08 11:54:00,b'Note to self: Never drive in Pittsburgh https://t.co/lBsW9u39Oi'
Mashable,1192767219203100675,2019-11-08 11:34:00,"b'""Hmmm, Saturn still has rings, I see."" - me https://t.co/cVFHwIFiIn'"
Mashable,1192766732051595264,2019-11-08 11:32:04,"b'""I\xe2\x80\x99m not trying to sell you me. I\xe2\x80\x99m trying to sell you, you."" https://t.co/SxwI7ftqiX'"
Mashable,1192761184539365376,2019-11-08 11:10:01,b'.@Lin_Manuel and Google team up to share Puerto Rican art with the world https://t.co/w4WxtLKbon https://t.co/KQNJcUDwe5'
Mashable,1192759669602828288,2019-11-08 11:04:00,b'This could mean a lot for the future of revitalizing near-extinct species https://t.co/wt0Is1eNsq'
Mashable,1192755500795879424,2019-11-08 10:47:26,"b""Steve Carell's answers to Ellen's rapid-fire questions are hilariously stupid https://t.co/mvUcnnwSLX https://t.co/GBqN576JwP"""
Mashable,1192752119847292933,2019-11-08 10:34:00,b'Who needs scaffolding in the age of drones? https://t.co/Tf17AKrpSg'
Mashable,1192749842940006401,2019-11-08 10:24:57,"b""Man pleads guilty to stalking his ex using her car's built-in tracking app https://t.co/2Y0kx58tka https://t.co/rE4Ydf6rbR"""
Mashable,1192749603067715584,2019-11-08 10:24:00,b'Waking up to coffee is scientifically the best way to wake up. Probably https://t.co/j70mx3BIgZ'
Mashable,1192744570045419522,2019-11-08 10:04:00,"b'Rent is going up, so millennials are moving out https://t.co/CygHXbbZYM'"
Mashable,1192741925691904000,2019-11-08 09:53:29,"b""Michelle Obama assembles her 'Voting Squad'\n\nhttps://t.co/heBI3G0UQC https://t.co/Zfir5juzPd"""
Mashable,1192737020189130752,2019-11-08 09:34:00,b'Now you just need a camera to see who keeps eating your food https://t.co/GJD5XUQqFc'
Mashable,1192729470592880640,2019-11-08 09:04:00,"b""I wouldn't trust that hotel bed if I were you... https://t.co/WfxP0PyM8p"""
Mashable,1192724437092700160,2019-11-08 08:44:00,"b'This is literally a dream, no pun intended https://t.co/R8GGx8PByl'"
Mashable,1192720424959959041,2019-11-08 08:28:03,b'Planning to buy a Google Pixel 4? You should absolutely wait a few days https://t.co/DHUWiqidSx https://t.co/TvZOUl8Ehf'
Mashable,1192716887366492161,2019-11-08 08:14:00,b'This innovative thermometer could change the way we measure body temp https://t.co/sHl24SuYke'
Mashable,1192711854252077056,2019-11-08 07:54:00,"b""OK vegans, it's your time to shine https://t.co/QgbWNjmONZ"""
Mashable,1192704304546639872,2019-11-08 07:24:00,b'These smart glasses could help those with vision loss see again https://t.co/G4D1jANKl4'
Mashable,1192698561055657984,2019-11-08 07:01:10,b'Watch this adorable beluga whale play fetch with a football near the South Pole https://t.co/PTFsQtx1rA https://t.co/iYJ9ic9QTq'
Mashable,1192694238108147712,2019-11-08 06:44:00,"b'Because we need someone to create the next ""Fortnite"" https://t.co/vOSj3CEqe9'"
Mashable,1192684172051021824,2019-11-08 06:04:00,b'This autonomous truck is seriously cool https://t.co/4uVjdbVsjU'
Mashable,1192681655217065984,2019-11-08 05:54:00,b'Say goodbye to doggy bath time https://t.co/USpMc9HDq6'
Mashable,1192680820684840960,2019-11-08 05:50:41,"b""Adjust your expectations accordingly. (Or don't!) https://t.co/DhPVrPEpf2"""
Mashable,1192676622257643520,2019-11-08 05:34:00,"b'So like...no more cleaning our sheets, right? https://t.co/izOuwNzMKk'"
Mashable,1192672343790780417,2019-11-08 05:17:00,b'This bear is seriously cute and a seriously good teacher https://t.co/XGfISUiWvk'
Mashable,1192664794215505920,2019-11-08 04:47:00,b'These robots built a bridge all by themselves https://t.co/gbl8JYIT48'
Mashable,1192659761021538305,2019-11-08 04:27:00,b'We could watch these intricate wind sculptures all day long https://t.co/WhnGLADsJ9'
Mashable,1192654727793786880,2019-11-08 04:07:00,b'This robot is breaking the rules and drawing on walls https://t.co/7G0qUlMYlv'
Mashable,1192649694796750849,2019-11-08 03:47:00,"b'These metal animal sculptures are so realistic, you may need to do a double take https://t.co/ZyFMvKcZI2'"
Mashable,1192644661472419840,2019-11-08 03:27:00,b'These highway pillars are turning into vertical gardens to help fight air pollution https://t.co/p5Z497uCrl'
Mashable,1192639628345405440,2019-11-08 03:07:00,b'This suitcase could make traveling with a baby SO much easier \xf0\x9f\x91\xb6 https://t.co/ctKlNcXbHD'
Mashable,1192639210886483968,2019-11-08 03:05:20,"b""The show's lack of depth is noticeable \xe2\x80\x94 but its star is stunning. https://t.co/nr7JF5Ol9I"""
Mashable,1192634595088445440,2019-11-08 02:47:00,b'Finally! A better way to take those midday nap breaks https://t.co/8yjxJpAKWb'
Mashable,1192633293075861507,2019-11-08 02:41:49,b'They just need to make them a better shade of beige. https://t.co/UPFUJlmWdb'
Mashable,1192629561978167296,2019-11-08 02:27:00,"b""We can hardly believe these aren't photographs https://t.co/Dbm3kcYdW3"""
Mashable,1192626971899023362,2019-11-08 02:16:42,b'This burger with a face (and teeth!) is freaking everybody out https://t.co/r4LUJMmUUz'
Mashable,1192624528788115456,2019-11-08 02:07:00,b'Scientists are growing vegetables in Antarctica in preparation for space colonies https://t.co/7uKbVOdWAD'
Mashable,1192620333477613570,2019-11-08 01:50:19,"b""Deepfake of Arnold Schwarzenegger in 'No Country for Old Men' will mess you up https://t.co/KHu7ND9ASB"""
Mashable,1192619495824723969,2019-11-08 01:47:00,b'This AR headset will make you feel like you\xe2\x80\x99re in a sci-fi movie https://t.co/VoGd5nqr6D'
Mashable,1192614462466985986,2019-11-08 01:27:00,b'The handwriting of some of your favorite musicians are now available as fonts https://t.co/AwTkuOZova'
Mashable,1192613689666527232,2019-11-08 01:23:55,b'.@Lin_Manuel and Google team up to share Puerto Rican art with the world https://t.co/ysorKremfy https://t.co/ToxoioD61O'
Mashable,1192609429256052737,2019-11-08 01:07:00,b'Turn your hand into a computer mouse with this new wearable device https://t.co/sH4qpLLhW9'
Mashable,1192608039918014465,2019-11-08 01:01:28,b'Is this chicken sandwich better than Popeyes? https://t.co/QpiZFaeq0c https://t.co/Zb3nb76iVb'
Mashable,1192604396170825728,2019-11-08 00:47:00,b'This man scanned himself and then created the tallest 3D printed human sculpture https://t.co/nimEKKrrpi'
Mashable,1192602402203066373,2019-11-08 00:39:04,"b""Deepfake of Arnold Schwarzenegger in 'No Country for Old Men' will mess you up https://t.co/KMolJC4TeK"""
Mashable,1192599363048157187,2019-11-08 00:27:00,b'NASA researchers have found a way to grow wheat on the International Space Station https://t.co/m0QtajkXRV'
Mashable,1192596930611863552,2019-11-08 00:17:20,"b""Michelle Obama assembles her 'Voting Squad'\n\nhttps://t.co/wlO69J97Uq https://t.co/X4dqKxzB0L"""
Mashable,1192594329891684352,2019-11-08 00:07:00,"b""We'd like one of these in an adult size, please \xf0\x9f\x98\x8d https://t.co/PQDhIJ1AAJ"""
Mashable,1192590580204949506,2019-11-07 23:52:06,b'CES finally honors the first cannabis company with an innovation award https://t.co/THjXgHtAXV https://t.co/PdYV3YXfuM'
Mashable,1192589296617873409,2019-11-07 23:47:00,b'This female sushi chef explains why you almost never see women making sushi https://t.co/7TQO1FVwJe'
Mashable,1192584263562092544,2019-11-07 23:27:00,"b'From juggling to playing the guitar, these prosthetic fingers are helping people do the things they love https://t.co/dU1EhKEM8D'"
Mashable,1192582277525647363,2019-11-07 23:19:06,"b'Need to get in the zone? One flow researcher gushes over the power of weed, exercise, and coffee https://t.co/uoID2qxYq8'"
Mashable,1192579230401478657,2019-11-07 23:07:00,b'This road can charge vehicles as they drive on https://t.co/wprESpodGl'
Mashable,1192574531803787264,2019-11-07 22:48:20,b'Books to give activists as they prepare for the upcoming election\n\nhttps://t.co/1qTvZGua8f https://t.co/kEe7EfLpp6'
Mashable,1192574197203005440,2019-11-07 22:47:00,b'These minimalist sneakers are also super eco-friendly https://t.co/jjqMM0axlM'
Mashable,1192569164029931521,2019-11-07 22:27:00,b'This 3D-printed house took only 48 hours to finish https://t.co/AHznl37HF1'
Mashable,1192568709338058754,2019-11-07 22:25:11,"b""YouTuber attempts to create a chicken sandwich that's better than Popeyes https://t.co/j6g8bHnmrI https://t.co/j3TYHhCIZ7"""
Mashable,1192564130902937603,2019-11-07 22:07:00,"b""We're not quite sure how we feel about these videos https://t.co/OQWXhPgZKp"""
Mashable,1192562672082010112,2019-11-07 22:01:12,b'CES finally honors the first cannabis company with an innovation award https://t.co/XI8MU1IVdZ https://t.co/hoc3eiEr2t'
Mashable,1192559097830236160,2019-11-07 21:47:00,"b""Robots can now assemble Ikea furniture and we've never been more grateful for technology https://t.co/YbZX3PTt4U"""
Mashable,1192554064657231891,2019-11-07 21:27:00,b'This awesome coffee stirring device will help you cut down on plastic use https://t.co/CF2y8eB1QU'
Mashable,1192551908898197505,2019-11-07 21:18:26,b'.@Lin_Manuel and Google team up to share Puerto Rican art with the world https://t.co/D3YwpUKkiz https://t.co/p2hB7mYd6v'
Mashable,1192549031475654658,2019-11-07 21:07:00,b'Bored? Why not tour the moon? https://t.co/QWN09ljQLy'
Mashable,1192548337574174720,2019-11-07 21:04:14,"b'The LG G8X has a dual screen, but its best feature is the price https://t.co/30zwVKfcKN'"
Mashable,1192545798455799811,2019-11-07 20:54:09,b'Me trying to get through this year-long week unscathed https://t.co/7HXNtnBckC'
Mashable,1192543998314860544,2019-11-07 20:47:00,"b""Meet Daisy, Apple's recycling robot https://t.co/35zdideYmT"""
Mashable,1192542119065509889,2019-11-07 20:39:32,b'BritBox launches in the UK smack bang in the middle of the global streaming war https://t.co/IwhvDPHCAx https://t.co/3OHNQeH3KN'
Mashable,1192538965078921217,2019-11-07 20:27:00,b'These domes simulate the air quality of heavily polluted cities https://t.co/QiGgdApLpe'
Mashable,1192536039627403264,2019-11-07 20:15:22,"b'Now Juul will stop selling mint flavor, too https://t.co/MfKynXHIgL'"
Mashable,1192533932010545159,2019-11-07 20:07:00,b'These sneakers are fulfilling all of our nerdy dreams \xf0\x9f\x98\x8d https://t.co/o83WQSsRjL'
Mashable,1192532369154224129,2019-11-07 20:00:47,"b""Watch 'Hot Ones' host Sean Evans freak out celebrity guests by shaking bottles of hot sauce https://t.co/SESX2IFtpe https://t.co/SVdhD5sU5P"""
