Mashable,1185228789653094400,2019-10-18 16:18:58,"b""As 'Silicon Valley' ends, Silicon Valley itself is beyond satire\nhttps://t.co/VQhhRZX81x"""
Mashable,1185228293336981504,2019-10-18 16:17:00,"b'This sounds creepy, spooky, and kooky https://t.co/V3Kd0gss5o'"
Mashable,1185227522469965824,2019-10-18 16:13:56,b'How the celebrity hair we loved this decade shaped who we wanted to be\nhttps://t.co/e7gh6LLJMS'
Mashable,1185225776590917635,2019-10-18 16:07:00,b'This autonomous truck could totally transform the construction industry https://t.co/i1Rtc82H47'
Mashable,1185221505061396481,2019-10-18 15:50:01,"b'After mass shootings, Google told Congress his arrest was progress. But the truth is complicated.\xe2\x80\xa6 https://t.co/dSw2NR4yvn'"
Mashable,1185220743925325824,2019-10-18 15:47:00,b'The average worker would have to work 2.8M years to earn as much as Jeff Bezos https://t.co/miZz1oRNeF'
Mashable,1185220036966912001,2019-10-18 15:44:11,"b'Our sincerest condolences to anyone on their last Mango pod. Godspeed. Or should we say, Podspeed.'"
Mashable,1185219658087063553,2019-10-18 15:42:41,b'It\xe2\x80\x99s a sad day for Creme Br\xc3\xbbl\xc3\xa9e flavored Juul pod lovers. The wildly popular vape company has announced the suspens\xe2\x80\xa6 https://t.co/jJRjvAGY8D'
Mashable,1185219194994003968,2019-10-18 15:40:51,b'Juul suspended sales of its most delicious flavor pods https://t.co/qhRYxeSPUN'
Mashable,1185218227019886592,2019-10-18 15:37:00,"b""Looks like Google's coming for Apple's crown https://t.co/Sgh4OznxJ5"""
Mashable,1185216935681765376,2019-10-18 15:31:52,b'Report says new AirPods Pro could launch this month\xe2\x80\x94and be very expensive\nhttps://t.co/2FeElZx5cN https://t.co/5b5ENdLNay'
Mashable,1185213193817378824,2019-10-18 15:17:00,b'This nature-inspired wind turbine is shaped like a tree to blend in with its surroundings https://t.co/XzKAqYueN2'
Mashable,1185210779039141889,2019-10-18 15:07:24,"b""Here's every single time Dwight shouts 'Michael!' in 'The Office' https://t.co/dOV6Yq8iAh"""
Mashable,1185210677343842304,2019-10-18 15:07:00,b'Banana is the new leather https://t.co/ZSmfqK9ttN'
Mashable,1185205644220985344,2019-10-18 14:47:00,b'A robot bird that flies just like a real one https://t.co/iyKfkjyE6G'
Mashable,1185205544832962560,2019-10-18 14:46:36,"b""'Modern Love' is a good first date, but it'll let you down in the long run\nhttps://t.co/nMRnR8dlzo"""
Mashable,1185203127512944640,2019-10-18 14:37:00,b'No more traffic-causing construction https://t.co/2Osw5SLrV9'
Mashable,1185200130623979521,2019-10-18 14:25:05,b'How the celebrity hair we loved this decade shaped who we wanted to be\nhttps://t.co/tS2xDCkOSa'
Mashable,1185199414178127872,2019-10-18 14:22:14,b'How to (mostly) remove annoying Memoji from the iMessage keyboard\nhttps://t.co/dMHAqWBiZ0 https://t.co/YbIc0bjHuh'
Mashable,1185198094503182336,2019-10-18 14:17:00,b'These solar panels are printed from conductive ink and are way cheaper https://t.co/nUgGlQ3UV9'
Mashable,1185195577857826822,2019-10-18 14:07:00,b'This grill requires no fuel to cook all your food https://t.co/3b7pI3t5j8'
Mashable,1185194093795823618,2019-10-18 14:01:06,b'Everything coming to Hulu in November 2019\nhttps://t.co/IvfprB3maf'
Mashable,1185190544512897024,2019-10-18 13:47:00,b'These continue to terrify us https://t.co/KcutccDGVX'
Mashable,1185185511289192448,2019-10-18 13:27:00,b'This self-driving truck completed a coast-to-coast trip https://t.co/PveJp1jkop'
Mashable,1185183760062603264,2019-10-18 13:20:02,"b""'Zombieland: Double Tap,' the sequel to 2009's 'Zombieland,' might go bigger, but that doesn't mean it's better https://t.co/PkQX98lzN9"""
Mashable,1185183071718559744,2019-10-18 13:17:18,"b""'Modern Love' is a good first date, but it'll let you down in the long run\nhttps://t.co/1i5vQnwI8y"""
Mashable,1185181645495816194,2019-10-18 13:11:38,b'Everything coming to Hulu in November 2019\nhttps://t.co/rtJJpphrZL'
Mashable,1185180982581874688,2019-10-18 13:09:00,b'Meghan Markle opens up about the impact media scrutiny has had on her\nhttps://t.co/TOJFRqxbWh https://t.co/TdJN4OOKpP'
Mashable,1185180478338265089,2019-10-18 13:07:00,b'Finally your cat can take a road trip without freaking out https://t.co/q45y7qN8sS'
Mashable,1185179300573732864,2019-10-18 13:02:19,"b""Jim Mattis mocks Trump over 'world's most overrated general' comments https://t.co/nkWJLD0LZQ https://t.co/m7gxK2wm1g"""
Mashable,1185175445118939141,2019-10-18 12:47:00,b'Now you can explore the ocean without all the bulky equipment https://t.co/K89kEXDUAV'
Mashable,1185175379889344512,2019-10-18 12:46:44,"b""'Modern Love' is a good first date, but it'll let you down in the long run\nhttps://t.co/XFwlO78JFC https://t.co/ucVeZLSvm2"""
Mashable,1185170411799154694,2019-10-18 12:27:00,b'These giant hands could be your best travel buddy https://t.co/8zSe2gpvkt'
Mashable,1185168677773164545,2019-10-18 12:20:06,"b""You can't run and/or hide... https://t.co/yIC3kfV72q"""
Mashable,1185168552308957184,2019-10-18 12:19:36,b'What a day. https://t.co/6B6M6tzCYV'
Mashable,1185165378684686337,2019-10-18 12:07:00,b'This artist makes incredible optical illusion paintings https://t.co/rCkGbO6pQA'
Mashable,1185163673377091584,2019-10-18 12:00:13,b'Looking for Alaska is streaming on Hulu. We have feelings. https://t.co/l3JfGlvX4d'
Mashable,1185160345721065473,2019-10-18 11:47:00,"b""Scientists have unexpectedly discovered 'ultramassive' black holes that are most likely the largest in the universe https://t.co/16LLypiSn1"""
Mashable,1185156858396459009,2019-10-18 11:33:08,b'Awwwww. https://t.co/CpS7VNnwYu'
Mashable,1185155312384217088,2019-10-18 11:27:00,b'This wearable device turns you hand into a keyboard https://t.co/WFuoacJGbq'
Mashable,1185150279127203840,2019-10-18 11:07:00,b'These devices are vacuuming plastic from our oceans https://t.co/g0oz72HIoN'
Mashable,1185148697136500737,2019-10-18 11:00:43,b'The most dominant shark of the deep sea was tagged at depth for the first time https://t.co/DAc1UHKrQA https://t.co/gkL4Ru5kXI'
Mashable,1185145246059040770,2019-10-18 10:47:00,b'This futuristic collar is actually a 360\xc2\xb0 camera https://t.co/Mnhh1lfr9w'
Mashable,1185142370733568001,2019-10-18 10:35:34,"b""The internet loves it, but Stormi isn't into Kylie Jenner's 'Rise and Shine' song https://t.co/w0RdMFBbuo https://t.co/W7b8Z2mw7g"""
Mashable,1185140213128908800,2019-10-18 10:27:00,b'From window to balcony within seconds https://t.co/4pgL03CHZT'
Mashable,1185140212877283328,2019-10-18 10:27:00,b'No waves? No problem https://t.co/YFKzrzWOzT'
Mashable,1185137068512550912,2019-10-18 10:14:30,"b""So, not everyone's a fan.\nhttps://t.co/bX1ejDDK8s"""
Mashable,1185136968663031809,2019-10-18 10:14:06,"b""So, not everyone's a fan.\nhttps://t.co/BWEfLNYboc"""
Mashable,1185136127377903616,2019-10-18 10:10:46,b'Shaky California turns on its long-awaited quake alert app https://t.co/dQgMiixYfd https://t.co/Oj9F1dMq1O'
Mashable,1185135179704066048,2019-10-18 10:07:00,b'Who else NEEDS this table? https://t.co/ZNevoCJq2X'
Mashable,1185130146539429888,2019-10-18 09:47:00,"b'Kinetic sand videos are oh, so satisfying https://t.co/s8rlxYDnRZ'"
Mashable,1185129668657192961,2019-10-18 09:45:06,b'Ouch. Ouch. Ouch. https://t.co/Okk2OlHe4r'
Mashable,1185125113353691137,2019-10-18 09:27:00,"b""You'll never have to buy another pair of shoes again https://t.co/quCGgeqoy1"""
Mashable,1185120080251670528,2019-10-18 09:07:00,"b'Yes, FootGolf is a thing now https://t.co/ajRANrLtqQ'"
Mashable,1185115046961020928,2019-10-18 08:47:00,b'This company transforms old shipping containers into swimming pool https://t.co/wwYeu1Q6Jn'
Mashable,1185110013712457729,2019-10-18 08:27:00,b'These igloo shelters are helping the homeless survive low temperatures https://t.co/llEmZ6FmrE'
Mashable,1185099947433189377,2019-10-18 07:47:00,b'This pencil has a dual purpose https://t.co/Uaz0NDSZHk'
Mashable,1185097905474015232,2019-10-18 07:38:53,"b""Sorry, but Paul Rudd absolutely cannot tell you if Bill Murray is in the new 'Ghostbusters' https://t.co/9ov2SJjtqc https://t.co/SffyYUvMIk"""
Mashable,1185094914385809408,2019-10-18 07:27:00,b'These kids are running again with their new prosthetic limbs https://t.co/rBneYKlfPq'
Mashable,1185084847968194560,2019-10-18 06:47:00,b'Watching this foam transform is like construction magic https://t.co/cZg3bitmM5'
Mashable,1185079814715256832,2019-10-18 06:27:00,b'The future of self-driving taxis may be closer than you think https://t.co/v3KB6ZJsvM'
Mashable,1185069748478009344,2019-10-18 05:47:00,b'Watch these sculptures disappear before your eyes https://t.co/cdPCdVBglu'
Mashable,1185054649071439873,2019-10-18 04:47:00,b'This mat lets you walk on water https://t.co/4IfbGU09Qr'
Mashable,1185049615982301185,2019-10-18 04:27:00,b'Just what we needed: More screens https://t.co/3XKE8hKUWp'
Mashable,1185044582771261442,2019-10-18 04:07:00,b'This 3D printer was designed to build homes in developing countries https://t.co/0awFxUYWz1'
Mashable,1185039549543530496,2019-10-18 03:47:00,b'This ballerina is bringing the beauty of ballet to lower-income neighborhoods https://t.co/9vCRkHOLaF'
Mashable,1185034516257050624,2019-10-18 03:27:00,b'This unique artwork actually responds to movement https://t.co/r4lloDAWyy'
Mashable,1185029483218137088,2019-10-18 03:07:00,"b""Someone didn't totally think this through https://t.co/wu9oxQrb6h"""
Mashable,1185024450074464256,2019-10-18 02:47:00,b'These drones are being used to safely clean wind turbines https://t.co/aKAeEBEy6m'
Mashable,1185019416943022081,2019-10-18 02:27:00,"b'This Tesla competitor has 3 wheels and only costs $10,000 https://t.co/uNDTVYFYRS'"
Mashable,1185014383673409537,2019-10-18 02:07:00,"b'Monsters are taking over NYC, thanks to this artist https://t.co/UkG3kPBdGU'"
Mashable,1185009350542319616,2019-10-18 01:47:00,b'Your cycling actually powers this gym https://t.co/V7uVXpPArB'
Mashable,1185004317239103493,2019-10-18 01:27:00,b'These sculptures are not what they seem https://t.co/ed8cu9VZnh'
Mashable,1184999284254617601,2019-10-18 01:07:00,"b'MIT researchers built a remote-controlled, bionic spy fish https://t.co/5Lm3YHRkjU'"
Mashable,1184998476553297920,2019-10-18 01:03:47,b'Crowdsourced traffic is available for more Google Maps users https://t.co/pceVvuC5WL'
Mashable,1184994250951401473,2019-10-18 00:47:00,b'This rocking chair knits you a hat as you sway back and forth https://t.co/aN4U0sUKOv'
Mashable,1184991510250610695,2019-10-18 00:36:06,"b""Mark Zuckerberg keeps lying about Facebook's origin story https://t.co/8bfpkzJvqs"""
Mashable,1184989217920897026,2019-10-18 00:27:00,b'You can actually eat these plates https://t.co/QaeHKzYXM1'
Mashable,1184988726633598976,2019-10-18 00:25:03,"b""Dying to remove those memoji from your iPhone keyboard? Here's how to finally do it https://t.co/Uyop76woyO"""
Mashable,1184984184680415232,2019-10-18 00:07:00,"b'Forget planes, trains, and automobiles. THIS is how we wanna travel from now on https://t.co/JIRmYjK1Pb'"
Mashable,1184979151498944512,2019-10-17 23:47:00,b'These robots built a bridge all by themselves https://t.co/0gigfVoKLU'
Mashable,1184978383580606464,2019-10-17 23:43:57,b'Shaky California turns on its long-awaited quake alert app https://t.co/FK0j1tdYVg https://t.co/qJIsDVFaId'
Mashable,1184974118447386624,2019-10-17 23:27:00,b'These highway pillars are turning into vertical gardens to help fight air https://t.co/npa71aXwDt'
Mashable,1184972498657521664,2019-10-17 23:20:34,b'Just give her the Grammy now. https://t.co/gF8J88wFpY'
Mashable,1184969085257424898,2019-10-17 23:07:00,b'This robot is breaking the rules and drawing on walls https://t.co/1kpgDQXhbM'
Mashable,1184965795547373568,2019-10-17 22:53:55,"b""Watch Rep. Elijah Cummings' first House floor speech https://t.co/YpWFPkQSck https://t.co/qFRCsQxetp"""
Mashable,1184964052394463232,2019-10-17 22:47:00,b'We could watch these intricate wind sculptures all day long https://t.co/ekSxT7NOXa'
Mashable,1184959018919497728,2019-10-17 22:27:00,"b'These metal animal sculptures are so realistic, you may need to do a double take https://t.co/d6lK56GVrO'"
Mashable,1184957123593146375,2019-10-17 22:19:28,b'The most dominant shark of the deep sea was tagged at depth for the first time https://t.co/6kpFigLlLo https://t.co/YtXwlJGpXD'
Mashable,1184953985884536834,2019-10-17 22:07:00,"b""We can hardly believe these aren't photographs https://t.co/keUhIIG2Q8"""
Mashable,1184950079720964097,2019-10-17 21:51:28,b'Half of all active iPhones have made the leap to iOS 13 https://t.co/3Kx6pEPkri via @PCMag'
Mashable,1184948952497414144,2019-10-17 21:47:00,b'Scientists are growing vegetables in Antarctica in preparation for space colonies https://t.co/4U2N7ebILA'
Mashable,1184944567549939721,2019-10-17 21:29:34,b'How fandom won the 2010s and why it will keep on winning\nhttps://t.co/LvRvUYZZ3U'
Mashable,1184943919387144192,2019-10-17 21:27:00,b'This AR headset will make you feel like you\xe2\x80\x99re in a sci-fi movie https://t.co/WHpEgbTxMn'
Mashable,1184938886180433921,2019-10-17 21:07:00,b'The handwriting of some of your favorite musicians are now available as fonts https://t.co/mXna26r6DN'
Mashable,1184937961957347333,2019-10-17 21:03:19,"b""The new 'Dickinson' trailer casts Emily as a wild, feminist visionary\nhttps://t.co/SOABITNVaW"""
Mashable,1184933853137293312,2019-10-17 20:47:00,b'Turn your hand into a computer mouse with this new wearable device https://t.co/1mOOvddZqH'
Mashable,1184931301750726662,2019-10-17 20:36:51,"b""3 new and affordable tech items for music lovers from @Walmart's new onn. brand. https://t.co/MISOrGU2vh #ad https://t.co/5eKdlYKKiP"""
Mashable,1184930606112821255,2019-10-17 20:34:06,"b""Blood floods a family's basement and we could not be more horrified https://t.co/fhLUlnOVfb"""
Mashable,1184929289847877632,2019-10-17 20:28:52,"b""Here's Rihanna smoking a joint, rocking a bikini, and minding her business- all in slow motion. Let this be the ene\xe2\x80\xa6 https://t.co/VTuziqatuV"""
Mashable,1184928819938873344,2019-10-17 20:27:00,"b""This artist 'paints' using the sun \xf0\x9f\x98\xb1 https://t.co/h9BjAcCl8H"""
Mashable,1184927645470994437,2019-10-17 20:22:20,"b'Goodbye, mango, creme, fruit, and cucumber https://t.co/6x5n5FDxHz'"
Mashable,1184927497508524034,2019-10-17 20:21:44,"b""Stephen King's 'The Outsider' gets spooky HBO trailer\nhttps://t.co/rYAh6NVzR5"""
Mashable,1184926720748675072,2019-10-17 20:18:39,b'Person you\xe2\x80\x99re                Guy grating \nmaking fake               Parmesan cheese\nplans with                   ov\xe2\x80\xa6 https://t.co/OMdbrNbM31'
Mashable,1184923786874888196,2019-10-17 20:07:00,b'NASA researchers have found a way to grow wheat on the International Space Station https://t.co/18HboJAUVh'
Mashable,1184922405501837312,2019-10-17 20:01:30,b'Mark Zuckerberg says the real threat is TikTok and China\nhttps://t.co/0zYpNgXrsw https://t.co/JIUs1n6n1a'
Mashable,1184922051351666691,2019-10-17 20:00:06,b'Shaky California turns on its long-awaited quake alert app\n\nhttps://t.co/GLxnnYR3QB https://t.co/mHLSMvUFyI'
Mashable,1184918753638666240,2019-10-17 19:47:00,"b'From juggling to playing the guitar, these prosthetic fingers are helping people do the things they love https://t.co/f2drChA5O7'"
Mashable,1184916455286071296,2019-10-17 19:37:52,b'Robert Pattinson Batman movie adds Paul Dano as The Riddler (we love it!)\nhttps://t.co/vpkdPbCN72'
Mashable,1184916236909592576,2019-10-17 19:37:00,b'You love to see it https://t.co/YKKVmLxQCi'
Mashable,1184913720440279040,2019-10-17 19:27:00,b'This road can charge vehicles as they drive on https://t.co/q0DxnDC0OR'
Mashable,1184913347281600512,2019-10-17 19:25:31,b'Jennifer Aniston doesn\xe2\x80\x99t even need Boomerang to make a Boomerang  https://t.co/9nZgPWBivd'
Mashable,1184910298739810305,2019-10-17 19:13:24,"b""The new 'Dickinson' trailer casts Emily as a wild, feminist visionary\nhttps://t.co/y1ESAD3j8i"""
Mashable,1184908687195987971,2019-10-17 19:07:00,b'This 3D-printed house took only 48 hours to finish https://t.co/YsuxCX9Rhq'
Mashable,1184905024289345538,2019-10-17 18:52:26,b'How fandom won the 2010s and why it will keep on winning\nhttps://t.co/NINxjMJrOK'
Mashable,1184903654135873536,2019-10-17 18:47:00,"b""Robots can now assemble Ikea furniture and we've never been more grateful for technology https://t.co/u9tiJOBINK"""
Mashable,1184899081463894021,2019-10-17 18:28:50,b'Robert Pattinson Batman movie adds Paul Dano as The Riddler (we love it!)\nhttps://t.co/XqwDFWkx7f'
Mashable,1184898620912492546,2019-10-17 18:27:00,b'This awesome coffee stirring device will help you cut down on plastic use https://t.co/bfHf7DZMLf'
Mashable,1184893924302884864,2019-10-17 18:08:20,"b""Stephen King's 'The Outsider' gets spooky HBO trailer\nhttps://t.co/NaLI6tiZpy"""
Mashable,1184893587709935616,2019-10-17 18:07:00,"b""Meet Daisy, Apple's recycling robot https://t.co/ZUtKppeRG6"""
Mashable,1184891786159906817,2019-10-17 17:59:50,b'How fandom won the 2010s and why it will keep on winning\nhttps://t.co/DhzUoi2V8g'
Mashable,1184891612805107712,2019-10-17 17:59:09,b'Paul Rudd eating hot wings is what we needed rn https://t.co/JIwi1mwMBE'
Mashable,1184888554750697472,2019-10-17 17:47:00,"b""OK vegans, it's your time to shine https://t.co/ShYVbQXc1B"""
Mashable,1184886037958537218,2019-10-17 17:37:00,b'These smart glasses could help those with vision loss see again https://t.co/WeFwJKa8Io'
Mashable,1184883786737180676,2019-10-17 17:28:03,b'Facebook co-founder Chris Hughes has announced a fund to fight monopolies https://t.co/wFPTbMKPLu'
Mashable,1184881004944605184,2019-10-17 17:17:00,"b""Earth's darkest substance is absolutely insane and a little creepy https://t.co/nPjKWKaiRk"""
Mashable,1184878488345432065,2019-10-17 17:07:00,b'This may be the most unique pet ever https://t.co/cG9ojf6U4j'
Mashable,1184877754187157504,2019-10-17 17:04:05,"b""The Turkish president apparently threw Trump's ridiculous letter in the trash https://t.co/EQowrlm3rU"""
Mashable,1184873455164051457,2019-10-17 16:47:00,b'Would you try 3D-printed food? https://t.co/yVPNIrAj34'
Mashable,1184872201884966912,2019-10-17 16:42:01,"b""Watch Rep. Elijah Cummings' first House floor speech\n\nhttps://t.co/hfdcSYJzkZ https://t.co/cNMTWGf5ad"""
Mashable,1184870938652954624,2019-10-17 16:37:00,"b""We're not so patiently waiting for this song to drop https://t.co/2vSp6aMmpd"""
Mashable,1184865905349664768,2019-10-17 16:17:00,"b""Looks like Google's coming for Apple's crown https://t.co/0I0eLAmQ78"""
Mashable,1184865898357755904,2019-10-17 16:16:58,"b""'Marriage Story' full trailer is here to break your heart\nhttps://t.co/v9qIpZ0BPh"""
Mashable,1184863388813279232,2019-10-17 16:07:00,b'Wonder Woman herself is forming her own production company https://t.co/zTuQaPYjyY'
Mashable,1184860477911916545,2019-10-17 15:55:26,"b""Blood floods a family's basement and we could not be more horrified https://t.co/oU7CiVjwpm"""
Mashable,1184858355594076160,2019-10-17 15:47:00,"b'Whew. Not looking too good, Tesla https://t.co/iv2ErmHnsM'"
Mashable,1184855839229779970,2019-10-17 15:37:00,b'The average worker would have to work 2.8M years to earn as much as Jeff Bezos https://t.co/gS1J3ij5oD'
Mashable,1184855345505751040,2019-10-17 15:35:02,b'This Italian translator is all of us https://t.co/Qyj94SeXzM'
Mashable,1184853114840584195,2019-10-17 15:26:10,"b""Things we loved this decade that everyone else...didn't\nhttps://t.co/AiNCzOFj02"""
Mashable,1184850806148915201,2019-10-17 15:17:00,b'Imagine never buying a plastic shampoo or shower gel bottle ever again https://t.co/Xr8vQVXDVw'
Mashable,1184848289440485378,2019-10-17 15:07:00,b'Space is beautiful https://t.co/Yq4XA8WEhw'
Mashable,1184847800959488001,2019-10-17 15:05:03,"b""Don't worry about your extremely online devices spying on you. Worry about them dying unexpectedly. https://t.co/YBlteluLM3"""
Mashable,1184845983001305088,2019-10-17 14:57:50,"b""'Marriage Story' full trailer is here to break your heart\nhttps://t.co/diP9l2GYyZ"""
Mashable,1184843256200417280,2019-10-17 14:47:00,b'This anti-manspreading chair is absolutely brilliant https://t.co/FwLanjwJqZ'
Mashable,1184840739546529794,2019-10-17 14:37:00,b'Somehow this is not yet illegal https://t.co/fq5T57UdSc'
Mashable,1184836737819906049,2019-10-17 14:21:06,b'GoPro Hero 8 Review: The most stable GoPro ever https://t.co/bleklHrdCH https://t.co/sP0qCOKqZO'
Mashable,1184835706407084034,2019-10-17 14:17:00,"b'Food delivery robots? Yes, please! https://t.co/F2grnJZfsl'"
Mashable,1184834541799784448,2019-10-17 14:12:22,b'Samsung Galaxy S10 bug lets any fingerprint unlock it\nhttps://t.co/gBVM7l5jHI https://t.co/UGuh0IV7eL'
Mashable,1184833189845487616,2019-10-17 14:07:00,b'Someone reverse engineered the umbrella - and it totally works https://t.co/oeV33Y5xEy'
Mashable,1184829144296804353,2019-10-17 13:50:55,"b""Things we loved this decade that everyone else...didn't\nhttps://t.co/Uy1WmOWMuX"""
Mashable,1184828947739140097,2019-10-17 13:50:08,"b""The Turkish president apparently threw Trump's ridiculous letter in the trash https://t.co/hTjBu0bDfz"""
Mashable,1184828156743569408,2019-10-17 13:47:00,b'The moon looks even better in 4k https://t.co/a5TyV9j3bZ'
Mashable,1184825396707102720,2019-10-17 13:36:02,"b""'Maleficent: Mistress of Evil' is far from the fantasy we'd been wishing for\nhttps://t.co/fs48vv1sVU"""
Mashable,1184823123599908865,2019-10-17 13:27:00,b'These domes simulate the air quality of heavily polluted cities https://t.co/dzQfDNNN6M'
Mashable,1184818090363801600,2019-10-17 13:07:00,b'Your favorite pop culture icons were given a sneaker makeover thanks to this artist https://t.co/S4TYr8HlSc'
Mashable,1184813057362427904,2019-10-17 12:47:00,b'This AI software can predict and fill missing pieces in photos https://t.co/Vt15O3VRyk'
Mashable,1184809817476681728,2019-10-17 12:34:07,"b""'Maleficent: Mistress of Evil' delivers too little Maleficent and too much of everything else\nhttps://t.co/Y12EKggDnr"""
Mashable,1184808535215005696,2019-10-17 12:29:02,"b""If you can't stand one more episode of 'Paw Patrol,' try the delightful 'Molly of Denali'  https://t.co/mxmFLG3nYX"""
Mashable,1184808024042549248,2019-10-17 12:27:00,b'Researchers at MIT are now able to program water droplets and move them individually across surface https://t.co/jZRQholYVI'
Mashable,1184807308716576768,2019-10-17 12:24:09,b'A Brexit-free news channel has launched in the UK because we are all sooooooo tiredddddddd https://t.co/rqjyRXYZhH https://t.co/qQvXMgIlsE'
Mashable,1184802990785552385,2019-10-17 12:07:00,b'Here\xe2\x80\x99s the technology behind those mesmerizing drone light shows https://t.co/pRTERm5hwM'
Mashable,1184802086757847041,2019-10-17 12:03:24,"b""Jimmy Kimmel mocks Trump's mind-boggling letter to Turkey's president\nhttps://t.co/kFnNqbFu9v https://t.co/AqyThXduBp"""
Mashable,1184797957595398144,2019-10-17 11:47:00,b'SO COOL! https://t.co/F2LkBbfTWy'
Mashable,1184797574823366657,2019-10-17 11:45:28,"b""Lena Headey, Riz Ahmed, Benedict Cumberbatch say 'we are all hypocrites' about high-carbon lifestyles\xe2\x80\xa6 https://t.co/fRYCqkqEBI"""
Mashable,1184792924468285446,2019-10-17 11:27:00,b'This guy breathes new life into these old damaged paintings https://t.co/gZsIBkwBl6'
Mashable,1184787891291115521,2019-10-17 11:07:00,b'These water taxis could make moving around cities easier https://t.co/moK0p7VglG'
Mashable,1184782858226950144,2019-10-17 10:47:00,"b'The fashion industry is super wasteful, and this man has a solution https://t.co/xG6WiAzIS5'"
Mashable,1184780449744375810,2019-10-17 10:37:26,b'The most dominant shark of the deep sea was tagged at depth for the first time\n\nhttps://t.co/xh6fRGKLMf https://t.co/nbFVfAy8WI'
Mashable,1184777824969748483,2019-10-17 10:27:00,"b'Look ma, no hands! https://t.co/zWYtcg8H5t'"
Mashable,1184774794316832768,2019-10-17 10:14:57,b'Trevor Noah ruthlessly mocks Eric and Donald Trump Jr. over their nepotism self-owns\nhttps://t.co/DjitXzovJO https://t.co/zBl1GkAT0z'
Mashable,1184772791758925824,2019-10-17 10:07:00,b'Spraying this material on desert sand will turn it into fertile land https://t.co/bOfMLIco6F'
Mashable,1184772314392596481,2019-10-17 10:05:06,"b""Don't worry about your extremely online devices spying on you. Worry about them dying unexpectedly. https://t.co/gulO0LgTHm"""
Mashable,1184770271783337984,2019-10-17 09:56:59,"b'""Damn I jus passed out."" https://t.co/xZjPKZcKJJ'"
Mashable,1184767758619336704,2019-10-17 09:47:00,b'The Boston Dynamics robots just keep getting more and more terrifying https://t.co/WDuEeVBKht'
Mashable,1184764967955902465,2019-10-17 09:35:54,"b'Jennifer Aniston reacts to her new, record-breaking Instagram account\nhttps://t.co/vvnE4Su8i5 https://t.co/KgPFlVTpbm'"
Mashable,1184762725357875200,2019-10-17 09:27:00,b'You know you\xe2\x80\x99re getting old when you remember using these phones https://t.co/pNRqMmVSnP'
Mashable,1184757692323250176,2019-10-17 09:07:00,b'A new way of cycling is coming with airless tires that never go flat https://t.co/kaotJb9unx'
Mashable,1184752659107991553,2019-10-17 08:47:00,"b""These kids get to run around school for 15 minutes every day and it's improving their health https://t.co/cRAfiAy5kf"""
Mashable,1184747625993658369,2019-10-17 08:27:00,"b""Can't. Stop. Watching https://t.co/lru6kZhrGl"""
Mashable,1184738264449765376,2019-10-17 07:49:48,b'Donald Trump Jr. delivered a stunning self-own in a Fox News rant about nepotism https://t.co/q1IcZ2SRkR https://t.co/rMREzzg5WF'
