Mashable,1188460401899573251,2019-10-27 14:20:14,"b""Jason Momoa's surprise 'SNL' appearance almost brought the house down. https://t.co/EgsnMFh2wz https://t.co/A3xgBjtsX9"""
Mashable,1188459585050271745,2019-10-27 14:17:00,b'Strawberry robots forever \xf0\x9f\x8d\x93 https://t.co/1CZIBdwE1m'
Mashable,1188457068426158080,2019-10-27 14:07:00,b'This vase doubles as a fire extinguisher https://t.co/trr3LvLQ1d'
Mashable,1188453797036732417,2019-10-27 13:54:00,b'The Internet Archive released a ton of retro games for free https://t.co/i918XJfvJ3'
Mashable,1188451553100865541,2019-10-27 13:45:05,"b""Chance the Rapper gets murdery on 'Saturday Night Live' with delicious Tasty Toaster Tarts. https://t.co/XwEM4TksGV https://t.co/uDsqwOsopw"""
Mashable,1188448763842416640,2019-10-27 13:34:00,b'Water becomes magical with this gravity-defying device https://t.co/e0LaiPUbXp'
Mashable,1188445379412537345,2019-10-27 13:20:33,"b""Chance the Rapper gets hilariously confused by esports on 'Saturday Night Live'. https://t.co/RNIbjHQjlm https://t.co/oZQHbFfWzz"""
Mashable,1188441214212890624,2019-10-27 13:04:00,b'These cute little cones are not what they seem https://t.co/QbOXTEz3Gq'
Mashable,1188440230044557313,2019-10-27 13:00:05,"b""'Saturday Night Live' Weekend Update tackles Giuliani's butt-dial, Trump's bizarre Saturday tweets.\xe2\x80\xa6 https://t.co/QD6JDH1HcJ"""
Mashable,1188438697374564352,2019-10-27 12:54:00,"b""How's this for fitness motivation? https://t.co/b3f4BkjCK2"""
Mashable,1188436446128037888,2019-10-27 12:45:03,"b""Trump bonds with Bill Clinton (Darrell Hammond!!) and Mark Zuckerberg on 'Saturday Night Live'.\xe2\x80\xa6 https://t.co/avrKb945g5"""
Mashable,1188435697008611329,2019-10-27 12:42:04,"b'The rise of edible plastics, from whiskey pods to potato forks https://t.co/9He0qxU7iu'"
Mashable,1188433664629194754,2019-10-27 12:34:00,b'Calling all #StarWars fans https://t.co/j7V42619TG'
Mashable,1188428631246327808,2019-10-27 12:14:00,"b'In the farms of the future, tractors will no longer require human drivers https://t.co/etJua7Xec0'"
Mashable,1188423597796278272,2019-10-27 11:54:00,b'This robot fish will help us spy on shy sea creatures \xf0\x9f\x90\xa1 \xf0\x9f\x90\xa0 \xf0\x9f\x90\x9f https://t.co/xjqnZCnF8w'
Mashable,1188418564795125761,2019-10-27 11:34:00,b'This rocking chair knits you a hat as you sway back and forth https://t.co/znIpRLcTZP'
Mashable,1188411015140007936,2019-10-27 11:04:00,b'Is this the future of furniture design? https://t.co/6YvFUUG7N4'
Mashable,1188405981773881344,2019-10-27 10:44:00,b'This robot is super dexterous https://t.co/vWYhWNGTjt'
Mashable,1188403465325809664,2019-10-27 10:34:00,"b""This alpine skier tears down the slopes with the best of them - and she's legally blind https://t.co/wV6Y9pBWta"""
Mashable,1188398432106319872,2019-10-27 10:14:00,b'Now you can have your plate and eat it too https://t.co/sS36xW7Z2L'
Mashable,1188393398773747713,2019-10-27 09:54:00,"b""We've got little engineers in the making https://t.co/UmsovYzHLV"""
Mashable,1188385849177624577,2019-10-27 09:24:00,b'Who needs a car when you can use this bionic suit instead? https://t.co/WBnL0tCuRx'
Mashable,1188382111285370880,2019-10-27 09:09:09,b'How to recycle all of your Amazon packaging\n\nhttps://t.co/5Pw7GkOCAX https://t.co/4XFmbxh8AL'
Mashable,1188380816197537792,2019-10-27 09:04:00,b'Turn your selfies into art with this 3D AR makeup https://t.co/8cUwq3OpUl'
Mashable,1188375782709760001,2019-10-27 08:44:00,b'This AR app lets you type in a 3D space https://t.co/RmzKRElM7R'
Mashable,1188368232983478277,2019-10-27 08:14:00,"b""This robot's sole purpose is baking cakes https://t.co/ioJ6NVdYJQ"""
Mashable,1188360683366182912,2019-10-27 07:44:00,b'These drones could help protect endangered species https://t.co/4AzlciA85e'
Mashable,1188350616931913728,2019-10-27 07:04:00,b'These robots built a bridge all by themselves https://t.co/z2g6LeJZ1Q'
Mashable,1188343067167907840,2019-10-27 06:34:00,b'This AR app can translate sign language in real time https://t.co/RbwSr3CqAI'
Mashable,1188335517517172737,2019-10-27 06:04:00,b'We could watch these intricate wind sculptures all day long https://t.co/vBZeoqOFsy'
Mashable,1188327967706869760,2019-10-27 05:34:00,b'This robot is breaking the rules and drawing on walls https://t.co/si7uVbOibe'
Mashable,1188320418152607744,2019-10-27 05:04:00,b'NASA wants to break the sound barrier without all the noise https://t.co/z42vrPPBYJ'
Mashable,1188317901436129280,2019-10-27 04:54:00,"b'These metal animal sculptures are so realistic, you may need to do a double take https://t.co/aZNusvc2hr'"
Mashable,1188312868388659202,2019-10-27 04:34:00,b'These highway pillars are turning into vertical gardens to help fight air pollution https://t.co/8HMkSiHSmw'
Mashable,1188307834972360704,2019-10-27 04:14:00,b'This suitcase could make traveling with a baby SO much easier \xf0\x9f\x91\xb6 https://t.co/rk8ATRQSWP'
Mashable,1188302801849335814,2019-10-27 03:54:00,"b'Take a deep breath, and let these mesmerizing doodles calm your soul https://t.co/CNJzbFLVGE'"
Mashable,1188295252211142657,2019-10-27 03:24:00,b'Finally! A better way to take those midday nap breaks https://t.co/Xt44wA4IVm'
Mashable,1188290219138793472,2019-10-27 03:04:00,"b""We can hardly believe these aren't photographs https://t.co/8rTnNxSM2V"""
Mashable,1188285185705439233,2019-10-27 02:44:00,b'Serato pranked us good with this faux Tesla collaboration https://t.co/9fJQmQsmCG'
Mashable,1188282669265637376,2019-10-27 02:34:00,b'Now you can have a roommate without the commitment or the dirty dishes https://t.co/k5fZn6gEiO'
Mashable,1188277636079833088,2019-10-27 02:14:00,b'Technology + art = amazing clay sculptures https://t.co/8PnTp7Nhgg'
Mashable,1188270086257336320,2019-10-27 01:44:00,b'Scientists are growing vegetables in Antarctica in preparation for space colonies https://t.co/uTV3luFRj2'
Mashable,1188267569872015360,2019-10-27 01:34:00,b'Which robot would you root for? https://t.co/TM9EFyscni'
Mashable,1188260020221145090,2019-10-27 01:04:00,b'This AR headset will make you feel like you\xe2\x80\x99re in a sci-fi movie https://t.co/0PmOKYHKdD'
Mashable,1188257503450021888,2019-10-27 00:54:00,b'Spread the buzz \xe2\x80\x94 this beekeeping app could save bee populations (and your food) https://t.co/bu2QFawjNc'
Mashable,1188252470411169792,2019-10-27 00:34:00,b'The handwriting of some of your favorite musicians are now available as fonts https://t.co/s1nLqFpYwO'
Mashable,1188247437007155200,2019-10-27 00:14:00,b'Turn your hand into a computer mouse with this new wearable device https://t.co/j0wcd5yXUT'
Mashable,1188242404081451008,2019-10-26 23:54:00,b'This man scanned himself and then created the tallest 3D printed human sculpture https://t.co/O3QQe8Mlvj'
Mashable,1188237370832801792,2019-10-26 23:34:00,b'This space hotel is taking reservations for a cool $9.5 million https://t.co/bwpZt1DPQU'
Mashable,1188229821157007361,2019-10-26 23:04:00,b'This artist uses magnifying glasses and mirrors to paint with the sun https://t.co/QyKyfUfM3u'
Mashable,1188224787824500736,2019-10-26 22:44:00,"b'Jelly Mario is the trippy, slow motion version of your favorite game https://t.co/tFTEarix5j'"
Mashable,1188222271569170433,2019-10-26 22:34:00,b'These 5 helpful robots want to be your new best friend https://t.co/FVSdg6aOdq'
Mashable,1188214721767448582,2019-10-26 22:04:00,b'These adorable service pups spent a day at Disneyland https://t.co/fXFAYWN7Zl'
Mashable,1188212204950175746,2019-10-26 21:54:00,b'NASA researchers have found a way to grow wheat on the International Space Station https://t.co/q3sQSS3x76'
Mashable,1188212082862366723,2019-10-26 21:53:31,b'A neat little Easter egg for new Pixel 4 owners. https://t.co/RaHThlnlMD'
Mashable,1188207171827159040,2019-10-26 21:34:00,b'This female sushi chef explains why you almost never see women making sushi https://t.co/DgC0ql6VFE'
Mashable,1188202138477875200,2019-10-26 21:14:00,"b""We'd like one of these in an adult size, please \xf0\x9f\x98\x8d https://t.co/iPP8XdxZSo"""
Mashable,1188197361065037824,2019-10-26 20:55:01,b'This great dog driving a motorbike on the highway is so happy with life. https://t.co/NdWHBOQnyu https://t.co/vD1T07MVxY'
Mashable,1188197105380286464,2019-10-26 20:54:00,"b'From juggling to playing the guitar, these prosthetic fingers are helping people do the things they love https://t.co/nECiEuQevS'"
Mashable,1188192072441962498,2019-10-26 20:34:00,b'This road can charge vehicles as they drive on https://t.co/q4EjRsGDxS'
Mashable,1188184522690445312,2019-10-26 20:04:00,b'These minimalist sneakers are also super eco-friendly https://t.co/SZfMotc7GL'
Mashable,1188182005923532800,2019-10-26 19:54:00,b'These gardens are in some pretty unexpected places https://t.co/TPrhJhaPQD'
Mashable,1188179722565574658,2019-10-26 19:44:55,b'Jane Fonda continues to be a badass. https://t.co/BIOqU6qDme'
Mashable,1188176469639532544,2019-10-26 19:32:00,b'This cute robot is a hacker\xe2\x80\x99s ultimate nemesis https://t.co/OI3V1X2UDj'
Mashable,1188171939581329408,2019-10-26 19:14:00,b'This 3D-printed house took only 48 hours to finish https://t.co/f40Vl1ZzcX'
Mashable,1188171591965954050,2019-10-26 19:12:37,"b""Traditionally, rodents don't operate motor vehicles. It's mostly a human thing. https://t.co/4C5i715rRX"""
Mashable,1188166906680729600,2019-10-26 18:54:00,"b""We're not quite sure how we feel about these videos https://t.co/fqFMvo4j7n"""
Mashable,1188164658202632193,2019-10-26 18:45:04,"b'The search for answers continues, but hard data is starting to pile up. https://t.co/DrdqhOLBV5'"
Mashable,1188161873574846466,2019-10-26 18:34:00,"b""Robots can now assemble Ikea furniture and we've never been more grateful for technology https://t.co/5pak0tGEXU"""
Mashable,1188159814792351744,2019-10-26 18:25:49,b'Roaming charges are such a pain. Even for eagles. https://t.co/PAOjqgHTke'
Mashable,1188154323672264709,2019-10-26 18:04:00,b'Every good doggo needs one of these https://t.co/LAObXEr0EX'
Mashable,1188150045314600963,2019-10-26 17:47:00,"b'""Bye, bye, bye"" - Jessica Biel to NSYNC https://t.co/HMTiQnANrI'"
Mashable,1188147528761511937,2019-10-26 17:37:00,b'Who? Why? What? When? Where? How? https://t.co/7LKcQyIZxM'
Mashable,1188142495684685824,2019-10-26 17:17:00,"b'Oh, this 7-Up? Gonna cure my headache somehow https://t.co/yBN8IWlAvi'"
Mashable,1188139979136012288,2019-10-26 17:07:00,"b""The world's first flying motorcycle is gonna be a reality in 2020 https://t.co/INukVhWFl7"""
Mashable,1188134945874534401,2019-10-26 16:47:00,b'Welcome to Mario Kart IRL https://t.co/kki1PTDnCS'
Mashable,1188132429325840384,2019-10-26 16:37:00,"b'Yeah stars are pretty, but can you count them all up? https://t.co/5GyCxU0zdS'"
Mashable,1188132238824787970,2019-10-26 16:36:14,"b""Hell is 44,000 screaming World Series attendees doing the 'Baby Shark' dance. https://t.co/GxLpJQiqOt"""
Mashable,1188127396395962370,2019-10-26 16:17:00,b'Who needs scaffolding in the age of drones? https://t.co/0WUwoy4kxb'
Mashable,1188126914529103874,2019-10-26 16:15:05,b'Microsoft got a big win over Amazon to close out the week. https://t.co/TAlpn4ggDf'
Mashable,1188124879587074049,2019-10-26 16:07:00,"b""And now we're crying https://t.co/Y09WeAiTQT"""
Mashable,1188123147662516227,2019-10-26 16:00:07,b'Ryan Reynolds is totally chill about this. https://t.co/o5eqcCtCsw'
Mashable,1188119846455627776,2019-10-26 15:47:00,b'Why walk around the airport when you can ride your suitcase? https://t.co/VBxi8PK08r'
Mashable,1188117330007486464,2019-10-26 15:37:00,b'Say goodbye to doggy bath time https://t.co/8NPIemuGXq'
Mashable,1188112296775749633,2019-10-26 15:17:00,b'TIP \xf0\x9f\x91\x8f YOUR \xf0\x9f\x91\x8f UBER \xf0\x9f\x91\x8f DRIVER \xf0\x9f\x91\x8f https://t.co/0xU865Lm8F'
Mashable,1188109780088426496,2019-10-26 15:07:00,b'A Dutch sculptor spent 27 years building giant kinetic creatures https://t.co/TWQMODoFri'
Mashable,1188104747036753922,2019-10-26 14:47:00,"b""Do you ever sit there and think 'I could use another thumb'? https://t.co/xI6GMOS1QK"""
Mashable,1188102230290776064,2019-10-26 14:37:00,"b""Is this octopus the world's best escape artist? https://t.co/C8xwcWutZp"""
Mashable,1188097197100978179,2019-10-26 14:17:00,b'A new runway could be coming to an airport near you... in 2050 https://t.co/z9SjQor0T6'
Mashable,1188094680849735681,2019-10-26 14:07:00,b'The unique designs of European city streets are being turned into wearable art https://t.co/kAsOcGCpnQ'
Mashable,1188091409070526469,2019-10-26 13:54:00,"b""5 celebrities you probably forgot guest starred on 'Friends' https://t.co/LZK7xFoVIl"""
Mashable,1188086376316620801,2019-10-26 13:34:00,"b""When's the last time you cleaned your tech products? https://t.co/7kGqt7yzxq"""
Mashable,1188081342724091909,2019-10-26 13:14:00,b'Turn your selfies into art with this mini smartphone printer https://t.co/J98L6kl39M'
Mashable,1188073792909856768,2019-10-26 12:44:00,"b""Here's what you're doing wrong when it comes to recycling https://t.co/wgK8JmXd2T"""
Mashable,1188071276520210432,2019-10-26 12:34:00,b'This awesome coffee stirring device will help you cut down on plastic use https://t.co/GUCgZ0rHCP'
Mashable,1188066243170983942,2019-10-26 12:14:00,b'Bored? Why not tour the moon? https://t.co/dR1iOSdFHw'
Mashable,1188061209851060224,2019-10-26 11:54:00,"b""Meet Daisy, Apple's recycling robot https://t.co/cPdBF2Ypv4"""
Mashable,1188056177038544906,2019-10-26 11:34:00,b'Your workout just got a little more futuristic https://t.co/kdrnzktSyc'
Mashable,1188048627328925697,2019-10-26 11:04:00,b'These domes simulate the air quality of heavily polluted cities https://t.co/T5ehXq5CsW'
Mashable,1188043593887305730,2019-10-26 10:44:00,b'These sneakers are fulfilling all of our nerdy dreams \xf0\x9f\x98\x8d https://t.co/envOkK2T8K'
Mashable,1188038560731090945,2019-10-26 10:24:00,b'This AI software can predict and fill missing pieces in photos https://t.co/Q4lBi6EWCD'
Mashable,1188033527968882688,2019-10-26 10:04:00,b'Infants in developing countries can receive proper birth records thanks to this biometric tool https://t.co/vIFSuN8nox'
Mashable,1188031010912518149,2019-10-26 09:54:00,"b'The Cincinnati Zoo has saved more than 50,000 bees https://t.co/VPL3nk3v2O'"
Mashable,1188025977927897089,2019-10-26 09:34:00,b'\xe2\x80\x98Sonic the Hedgehog\xe2\x80\x99 is teaching AI how to learn https://t.co/1wKobKSdbD'
Mashable,1188018428558209027,2019-10-26 09:04:00,b'These VR gloves allow people who are blind to \xe2\x80\x9csee\xe2\x80\x9d art for the first time https://t.co/sZAdLKthrX'
Mashable,1188013394843979776,2019-10-26 08:44:00,b'This puffy robotic arm looks like Baymax https://t.co/SDZgQiyE9A'
Mashable,1188003328694849537,2019-10-26 08:04:00,b'Michael Phelps breaks down for us how he runs his Instagram account https://t.co/uPSYw9daCs'
Mashable,1187995778788331520,2019-10-26 07:34:00,"b""Desmond Is Amazing is the future and we're here for it https://t.co/R8laUh1kul"""
Mashable,1187990745615126529,2019-10-26 07:14:00,b'Now anyone can own a famous painting thanks to this AR app https://t.co/O1w4fXtyZG'
Mashable,1187985712429305857,2019-10-26 06:54:00,b'Say goodbye to building your furniture https://t.co/zFpxO9bzyZ'
Mashable,1187975646137475073,2019-10-26 06:14:00,b'This high-end gaming gear was designed by esports pros https://t.co/OtksApoJDX'
Mashable,1187968096432050176,2019-10-26 05:44:00,b'Researchers at MIT are now able to program water droplets and move them individually across surface https://t.co/F1He6fFYto'
Mashable,1187963063170781185,2019-10-26 05:24:00,b'You won\xe2\x80\x99t be able to resist virtual reality once you try on this headset https://t.co/ebgwdTGiM4'
Mashable,1187955513553637381,2019-10-26 04:54:00,b'Here\xe2\x80\x99s the technology behind those mesmerizing drone light shows https://t.co/Y5SasXVMh7'
Mashable,1187947963718492160,2019-10-26 04:24:00,"b'Watch not one, not two, but three giant submarines emerge from beneath the Arctic ice https://t.co/ds3HpMFDmb'"
Mashable,1187945447010308096,2019-10-26 04:14:00,b'This woman is shaking up the conservative world of auctioneering https://t.co/1XrLWyr8P0'
Mashable,1187938652472651777,2019-10-26 03:47:00,b'These water taxis could make moving around cities easier https://t.co/pqhsDnERWU'
Mashable,1187933619257405440,2019-10-26 03:27:00,"b'Look ma, no hands! https://t.co/UrPyPRkIT5'"
Mashable,1187928586101104641,2019-10-26 03:07:00,"b'The fashion industry is super wasteful, and this man has a solution https://t.co/nAgD69T3Tq'"
Mashable,1187923552927772672,2019-10-26 02:47:00,b'You know you\xe2\x80\x99re getting old when you remember using these phones https://t.co/f5A1MSGpK3'
Mashable,1187918519788343296,2019-10-26 02:27:00,b'A new way of cycling is coming with airless tires that never go flat https://t.co/78K0WiwWPk'
Mashable,1187913486573154304,2019-10-26 02:07:00,"b""These kids get to run around school for 15 minutes every day and it's improving their health https://t.co/ao4lws2AZX"""
Mashable,1187908453408346112,2019-10-26 01:47:00,"b""Can't. Stop. Watching https://t.co/9yq7XoHD9R"""
Mashable,1187903420440686592,2019-10-26 01:27:00,"b'This is how self-driving cars ""see"" what\'s going on around them https://t.co/ktovpYQ6kb'"
Mashable,1187898387061989382,2019-10-26 01:07:00,"b""We traveled to a recycling plant to see how our trash becomes another person's treasure https://t.co/GAJ3chh5WV"""
Mashable,1187893354052194304,2019-10-26 00:47:00,b'MIT researchers developed a wearable that can communicate with the voice in your head https://t.co/Y1nbUUWzgZ'
Mashable,1187888320728182784,2019-10-26 00:27:00,b'These glasses can help people with disabilities use technology without their hands https://t.co/96gkyUfyNf'
Mashable,1187883287563456512,2019-10-26 00:07:00,b'This artificial human cornea only takes 10 minutes to 3D print https://t.co/9jAXT9NkXp'
Mashable,1187878254507515904,2019-10-25 23:47:00,b'This city is 3D printing a tiny neighborhood of sustainable homes https://t.co/9lmZkBkQBQ'
Mashable,1187875759886614529,2019-10-25 23:37:05,"b""The next version of Tesla's Solar Roof is here https://t.co/RDd282iBZM"""
Mashable,1187873221263147008,2019-10-25 23:27:00,"b""This boy's life is changed when he is gifted color blindness glasses for the first time https://t.co/jTEeMYqnJG"""
Mashable,1187868959716052993,2019-10-25 23:10:04,"b""Donald Trump has a message for 'Tim Apple' about iPhone design https://t.co/TAVzMnRnET"""
Mashable,1187868188089958408,2019-10-25 23:07:00,b'The future of the internet could depend on submarine data centers https://t.co/ayaHPKnLRz'
Mashable,1187863154983870465,2019-10-25 22:47:00,b'These shoes are made out of an unexpected material... chewing gum off the streets https://t.co/nBvgx7P73L'
Mashable,1187861232709259265,2019-10-25 22:39:21,b'People are making fun of Rudy Giuliani butt-dialing a reporter https://t.co/WLYDDCnzhM'
Mashable,1187858121785364480,2019-10-25 22:27:00,b'This leg suit lets you sit anywhere without needing to grab a chair https://t.co/itzPtAyDVO'
Mashable,1187853088591233025,2019-10-25 22:07:00,"b""These sharks appear to 'glow' in the dark https://t.co/sRTSeiRwjr"""
Mashable,1187848055418167297,2019-10-25 21:47:00,b'A teenage millionaire built a real-life Dr. Octopus suit https://t.co/tfFRZt33kb'
Mashable,1187846344079302656,2019-10-25 21:40:12,b'A coalition of YouTubers is tackling the climate crisis https://t.co/ROEw6zZ54N'
Mashable,1187843022349918209,2019-10-25 21:27:00,b'This electronic \xe2\x80\x9cskin\xe2\x80\x9d can bring touch and pain to prosthetic hands https://t.co/AlUH0van2W'
Mashable,1187837989197701120,2019-10-25 21:07:00,b'This prosthetic ankle is a game-changer https://t.co/Spa6gy29UC'
Mashable,1187832956095582208,2019-10-25 20:47:00,b'We got to see how Microsoft tests their devices to death https://t.co/xfloY2Ab5A'
Mashable,1187832211590045702,2019-10-25 20:44:02,b'People are making fun of Rudy Giuliani butt-dialing a reporter https://t.co/zgJPgQd2Ye'
Mashable,1187827922847092736,2019-10-25 20:27:00,b'Space is dirty and this satellite could help us clean it up one day https://t.co/nlhm7o0sEC'
Mashable,1187825741972545542,2019-10-25 20:18:20,"b""Don't butt dial like Rudy Giuliani https://t.co/V0LoWDjyW1"""
Mashable,1187825297124663297,2019-10-25 20:16:34,b'Adobe exposed nearly 7.5 million Creative Cloud accounts to the public\nhttps://t.co/FYBISkreTy https://t.co/xn3NDDcZKZ'
Mashable,1187822889766014976,2019-10-25 20:07:00,b'The military is developing a shapeshifting wheel https://t.co/bolGqyFU0t'
Mashable,1187818363856310272,2019-10-25 19:49:01,"b""Kanye's 'Closed On Sunday' Chick-fil-A shoutout has cooked up a lot of memes #JesusIsKing https://t.co/6ztcoYFJJs"""
Mashable,1187817856551010304,2019-10-25 19:47:00,b'Not sure if we should be amazed or terrified https://t.co/euxJGYbM6D'
Mashable,1187814044184567814,2019-10-25 19:31:51,"b""Watch Mark Zuckerberg duck a question about including Breitbart in Facebook's News tab\nhttps://t.co/t5RX9xMOMW https://t.co/wvjJJJlzpw"""
Mashable,1187812823285542912,2019-10-25 19:27:00,b'These floating neighborhoods are affordable housing for students https://t.co/4Q1g5qC3L5'
Mashable,1187807790372401152,2019-10-25 19:07:00,b'A family of 5 now lives in this 3D printed home https://t.co/E5RDUoBNym'
Mashable,1187803326588555264,2019-10-25 18:49:16,"b'Facebook ad showing Lindsey Graham ""endorse"" the Green New Deal is a sign of what\'s to come https://t.co/ypYLjMkob1 https://t.co/R4JtfPVCFj'"
Mashable,1187802757027258368,2019-10-25 18:47:00,b'This woman is cleaning up the streets by turning old chewing gum into new rubber objects https://t.co/aXWM7k4Twu'
Mashable,1187799269987815425,2019-10-25 18:33:08,"b""'Call of Duty: Modern Warfare' tells a story about terrorism. It's not great.\nhttps://t.co/RD1kaxwB1e"""
Mashable,1187797724135067649,2019-10-25 18:27:00,"b'This robot has human-like fingers that perform immensely complex tasks, like unscrewing bottles https://t.co/SFVa0EILJJ'"
Mashable,1187793490488578048,2019-10-25 18:10:10,"b""'Call of Duty: Modern Warfare' tells a story about terrorism. It's not great.\nhttps://t.co/PlfLqw4bKi"""
Mashable,1187792690932400128,2019-10-25 18:07:00,b'This floating park is made entirely out of plastic debris https://t.co/lcDqGjRSED'
Mashable,1187787657595760640,2019-10-25 17:47:00,b'We know you wish you were as cool as they are https://t.co/8S4CZ76Zmh'
Mashable,1187785439136112640,2019-10-25 17:38:11,b'Celebrity birthdays are inspiring more and more people to donate to charities https://t.co/4asjCDTyXv'
Mashable,1187785140925358080,2019-10-25 17:37:00,b'Miami is prepping for flying cars https://t.co/7RlbIdhKTv'
Mashable,1187780107907108865,2019-10-25 17:17:00,b'This is an exercise craze we could get into https://t.co/LXnb4Abpm5'
Mashable,1187777591182123008,2019-10-25 17:07:00,b'Mars here we come! https://t.co/HbwofJAxoz'
Mashable,1187774922665418753,2019-10-25 16:56:24,b'Please look at this ridiculously photogenic puppy at the vet https://t.co/DfS5vahCtF https://t.co/Ca5kUAV03o'
Mashable,1187772558168465409,2019-10-25 16:47:00,b'Who run the Red Planet? GIRLS. https://t.co/Ue8nyft7KP'
Mashable,1187770041548193792,2019-10-25 16:37:00,"b'So like...no more cleaning our sheets, right? https://t.co/ARog9VXUpP'"
Mashable,1187769716334583808,2019-10-25 16:35:42,"b""Google just added a brand 'new' way to create calendar events https://t.co/6rXRhoJzBQ via @PCMag"""
Mashable,1187765008379154433,2019-10-25 16:17:00,"b""Looks like I'm not leaving my apartment this November https://t.co/4Yri8BkLue"""
Mashable,1187763909547220994,2019-10-25 16:12:38,b'Netflix and Spotify could one day send you emergency alerts\nhttps://t.co/wyuagPxk46 https://t.co/AmKRhGWSTJ'
Mashable,1187762492103188480,2019-10-25 16:07:00,b'The pop-up will give the option to read why the post was flagged https://t.co/hodxpU8p7s'
Mashable,1187758738939228161,2019-10-25 15:52:05,"b'This app wants to be like Instagram, but for litter https://t.co/BMyn0j1FBw'"
Mashable,1187757458661330944,2019-10-25 15:47:00,b'This bear is seriously cute and a seriously good teacher https://t.co/4rU8EXwgJy'
Mashable,1187754942049607681,2019-10-25 15:37:00,b'We still call it 9 Fast 9 Furious https://t.co/ij581PmxL8'
Mashable,1187749908998164480,2019-10-25 15:17:00,"b""Lizzo just took a DNA test and turns out she's 100% responding on Instagram https://t.co/iC25bYba1O"""
Mashable,1187747392184963072,2019-10-25 15:07:00,"b'Coffee addicts, this phone case will change your life https://t.co/GuOe3gSumO'"
Mashable,1187746320733351937,2019-10-25 15:02:44,b'7 of the best tech gifts you can find for under $20\nhttps://t.co/E1aO2bVl9r https://t.co/FyLTgD0CNQ'
Mashable,1187742359041146880,2019-10-25 14:47:00,"b""This treadmill is easy on your knees.... because it's underwater https://t.co/o9RdOHNHol"""
Mashable,1187741193410699264,2019-10-25 14:42:22,b'Google Pixelbook Go review: An excellent work laptop if you like ChromeOS https://t.co/7wWlg0OdXd https://t.co/T5JO1WsALN'
Mashable,1187739842475511808,2019-10-25 14:37:00,"b'Finally, someone has reinvented the crutches \xf0\x9f\x91\x8f https://t.co/I1OUtC7d2Z'"
Mashable,1187735326380441602,2019-10-25 14:19:03,b'Everything coming to HBO Now in November 2019\nhttps://t.co/W1Yx30dXsE'
Mashable,1187734809755488258,2019-10-25 14:17:00,b'This smart luggage is a suitcase AND a scooter https://t.co/qi1mfRSPV5'
Mashable,1187732292673753089,2019-10-25 14:07:00,b'Meet the loneliest robot whose sole purpose is to sort pebbles https://t.co/7cqbUbO0XH'
