Samsung,1192970058533724160,2019-11-09 01:00:00,"b""At this year's #SamsungAIForum, AI experts gathered together to discuss the future of AI and Samsung unveiled the l\xe2\x80\xa6 https://t.co/6SUJfK08j6"""
Samsung,1192721410021634048,2019-11-08 08:31:58,b'Samsung Electronics\xe2\x80\x99 Southeast Asia&amp;Oceania Headquarters and their family members participated in Samsung Love&amp;Care\xe2\x80\xa6 https://t.co/RDmEFU3K9c'
Samsung,1192626258112200704,2019-11-08 02:13:52,"b'Samsung holds ""Talent first"" as one of the core values that drives the company\'s success. See how the company striv\xe2\x80\xa6 https://t.co/iks9icXHgr'"
Samsung,1192607565672108033,2019-11-08 00:59:35,"b'Award-winning 46 new products, including 3 Best of Innovations, will be on display at #CES2020 \n\nhttps://t.co/plO3VYA9MF'"
Samsung,1190206851331309568,2019-11-01 10:00:00,b'Head of #SamsungAICenter in Moscow discusses the details of #telepresence and how it will transform people\xe2\x80\x99s travel\xe2\x80\xa6 https://t.co/FhUPLc9LJ8'
Samsung,1190093602212458496,2019-11-01 02:30:00,"b'Celebrating the 50th Anniversary, Samsung Electronics is now about to embark on a new journey toward a healthier an\xe2\x80\xa6 https://t.co/saIk2vXpOo'"
Samsung,1190070954690408449,2019-11-01 01:00:00,b'Setting up your smart home with #SmartThings and enjoying all the conveniences Samsung and partner devices have to\xe2\x80\xa6 https://t.co/m8SNWaohVF'
Samsung,1189889763114921984,2019-10-31 13:00:01,b'#Bixby is available on a variety of products and #SmartThings-connected devices. See here to discover how the platf\xe2\x80\xa6 https://t.co/KqNft8HaR5'
Samsung,1189799164126756865,2019-10-31 07:00:00,b'See how Samsung is leading a new era of connectivity and collaboration for businesses with extensive suite of mobil\xe2\x80\xa6 https://t.co/CRRbO5wDoO'
Samsung,1189761367537881088,2019-10-31 04:29:49,b'Winners of Samsung Mobile Design Competition for mobile accessory and wallpaper designs were announced at #SDC19. T\xe2\x80\xa6 https://t.co/WGQ3R0Iykn'
Samsung,1189705160286597120,2019-10-31 00:46:28,"b'[3Q Results (in KRW)] Sales: 62 trillion, operating profit: 7.78 trillion\nhttps://t.co/NP6C4PNGVq'"
Samsung,1189454056697126912,2019-10-30 08:08:40,b'This year\xe2\x80\x99s Samsung Developer Conference showcases technologies that will enable Samsung device users to unlock the\xe2\x80\xa6 https://t.co/EKYPJP0tDG'
Samsung,1189406575557038080,2019-10-30 05:00:00,b'Samsung unveiled One UI 2 as part of its ongoing commitment to ensuring that its technologies are accessible to all\xe2\x80\xa6 https://t.co/1f7A9LVKA4'
Samsung,1189383926252556293,2019-10-30 03:30:00,b'Samsung announced the Best of Galaxy Store Awards 2019 selections. Check out some of the winners from the Best of G\xe2\x80\xa6 https://t.co/oivRXC9DDk'
Samsung,1189368826095439872,2019-10-30 02:30:00,"b'Check out the product specifications of #GalaxyBookFlex and #GalaxyBookIon, world\xe2\x80\x99s first laptops with #QLED displa\xe2\x80\xa6 https://t.co/6L9I79zxxw'"
Samsung,1189361278449541121,2019-10-30 02:00:00,"b'Samsung showcases new ways for developers to scale their services across billions of devices through its extensive,\xe2\x80\xa6 https://t.co/0hkfInUv6d'"
Samsung,1189149884026216449,2019-10-29 12:00:00,"b'From cryptocurrency wallets to DApps, Samsung has been steadily building a variety of blockchain-powered services.\xe2\x80\xa6 https://t.co/ZYNfHAxiRI'"
Samsung,1189059460494290944,2019-10-29 06:00:41,b'Samsung has unveiled a number of programs to provide training in machine learning to people around the world in the\xe2\x80\xa6 https://t.co/CbSLlKPjbd'
Samsung,1189029088821989380,2019-10-29 04:00:00,b'Samsung has launched a dedicated webpage to allow readers to stay up to date with all the company news regarding th\xe2\x80\xa6 https://t.co/X0F5skxJUj'
Samsung,1188651600178335744,2019-10-28 03:00:00,b'A mysterious man from 1969 suddenly appears in present-day Seoul. Watch \xe2\x80\x9cThe Present\xe2\x80\x9d to see what present he brings\xe2\x80\xa6 https://t.co/oFNzL7ra7V'
Samsung,1187278049747853312,2019-10-24 08:02:00,"b'How do #AI and #5G work hand-in-hand to make the entire tech industry, stronger? Let\xe2\x80\x99s hear from the head of the\xe2\x80\xa6 https://t.co/K9JmKTtJdp'"
Samsung,1187254930198781952,2019-10-24 06:30:08,"b'Samsung unveiled the world\xe2\x80\x99s first selfie sent to space as part of #SpaceSelfie, a mission to give everyone the cha\xe2\x80\xa6 https://t.co/AxQfI69HhK'"
Samsung,1187171849765081094,2019-10-24 01:00:00,b'Samsung plans to rapidly expand the availability of 10+ GB LPDDR DRAM to address the increasing needs of global sma\xe2\x80\xa6 https://t.co/yq8FUDjddF'
Samsung,1187164300542173184,2019-10-24 00:30:00,"b'Samsung\xe2\x80\x99s Exynos 990 and Exynos Modem 5123 leverage 7nm- EUV technology, empowering tomorrow\xe2\x80\x99s mobile devices with\xe2\x80\xa6 https://t.co/BoJvMRJTbc'"
Samsung,1187156750442651650,2019-10-24 00:00:00,"b'Samsung\xe2\x80\x99s new-generation processors and memory solutions set to power innovation across mobile, home, data center,\xe2\x80\xa6 https://t.co/LdZuhyj1F7'"
Samsung,1186813263230582784,2019-10-23 01:15:06,"b'Samsung continues network leadership with the introduction of industry\xe2\x80\x99s first 5G integrated radio for 28GHz, expan\xe2\x80\xa6 https://t.co/OcDoEiFYbz'"
Samsung,1186460955883925504,2019-10-22 01:55:09,b'This year\xe2\x80\x99s Samsung Developer Conference will offer creators and developers an opportunity to get to know Samsung\xe2\x80\x99s\xe2\x80\xa6 https://t.co/RtAFwVfFgr'
Samsung,1186181113447768064,2019-10-21 07:23:10,b'\xf0\x9f\x87\xa8\xf0\x9f\x87\xa6\nhttps://t.co/Z8K3q0lNqF'
Samsung,1186102179741880320,2019-10-21 02:09:31,b'Head of #SamsungAICenter in New York discusses how #robots will fit into society in the future and what the #AI cen\xe2\x80\xa6 https://t.co/svWrbyuCBt'
Samsung,1184967827108712448,2019-10-17 23:02:00,b'Samsung shared the latest technology trends and strengthened cooperation within the foundry ecosystem at the first\xe2\x80\xa6 https://t.co/tOfErWAchM'
Samsung,1184635430467072000,2019-10-17 01:01:10,b'Samsung has maintained the no. 6 rank in #Interbrand\xe2\x80\x99s \xe2\x80\x9cBest Global Brands 2019\xe2\x80\x9d list with a brand value of $61.1 b\xe2\x80\xa6 https://t.co/c4lPpVKTPf'
Samsung,1184289874595049472,2019-10-16 02:08:03,"b'The #GalaxyFold\xe2\x80\x99s practical multitasking capabilities can streamline daily life, bringing you almost PC-like multit\xe2\x80\xa6 https://t.co/CkE0mENhmV'"
Samsung,1183963682310504448,2019-10-15 04:31:53,"b'Samsung will present new business opportunities with 4G LTE and 5G, demonstrating how these innovations can benefit\xe2\x80\xa6 https://t.co/Q8vlV9EW7J'"
Samsung,1183897715245076480,2019-10-15 00:09:45,"b'Samsung will deploy NFC-enabled contactless payment acceptance on mobile devices in partnership with Mobeewave, a p\xe2\x80\xa6 https://t.co/csyhrxqkvr'"
Samsung,1183570845714632705,2019-10-14 02:30:53,b'Join the Beta Program and enjoy the new One UI with #Android10 features before its official release #GalaxyS10\nhttps://t.co/LoucKY1LvP'
Samsung,1182477165415133187,2019-10-11 02:05:00,"b'Head of the #SamsungAICenter in Cambridge, UK, discusses how Samsung\xe2\x80\x99s #AI and hardware innovations will enrich peo\xe2\x80\xa6 https://t.co/qoJhg5H3ih'"
Samsung,1182212169263452161,2019-10-10 08:32:00,b'Samsung offers various foundry solutions that address the growing demand in the autonomous and electric vehicle mar\xe2\x80\xa6 https://t.co/EudglgvTgW'
Samsung,1181480985809969153,2019-10-08 08:06:32,b'Did you know that the Korean alphabet #Hangeul is widely considered the most scientific alphabet existing today? Yo\xe2\x80\xa6 https://t.co/NoLYpBFTr2'
Samsung,1181355097755832320,2019-10-07 23:46:18,b'Samsung Electronics announced its earnings guidance for the third quarter of 2019\nhttps://t.co/bU4KAsJ8LU'
Samsung,1181086754234781696,2019-10-07 06:00:00,"b'The new technology allows for the stacking of 12 #DRAM chips using more than 60,000 TSV holes, while maintaining th\xe2\x80\xa6 https://t.co/UZPnxtQm1q'"
Samsung,1181079204013789184,2019-10-07 05:30:00,"b'The #GoldenStatesWarriors #ChaseCenter \xe2\x80\x99s centerhung main videoboard adds up to 9,699 square feet of active video d\xe2\x80\xa6 https://t.co/3VQSktMobz'"
Samsung,1181073217282174981,2019-10-07 05:06:12,"b'The #GalaxyA90 #5G combines next-level connectivity with powerful features that let you capture, stream and share t\xe2\x80\xa6 https://t.co/zm3gz8YsI1'"
Samsung,1179939899014696960,2019-10-04 02:02:48,b'Head of #SamsungAICenter in Toronto discusses the future applications of #AI and the vision in which the AI acts as\xe2\x80\xa6 https://t.co/p6I3pz9yTZ'
Samsung,1179259844496257025,2019-10-02 05:00:31,b'Samsung #GalaxyS10 is the first smartphone to receive the \xe2\x80\x98Best Wi-Fi Innovation Award\xe2\x80\x99 #IntelligentWiFi #WiFi6\nhttps://t.co/Gt0AtEDZMF'
Samsung,1179214425166733312,2019-10-02 02:00:02,b'Samsung partnered with Italian luxury fashion brand #ColomboViaDellaSpiga for an exclusive showcase of\xe2\x80\xa6 https://t.co/1ylQq2EuDl'
Samsung,1179199319951282178,2019-10-02 01:00:00,b'#TheFrame will feature 52 new works of art by world-renowned Russian and European painters from the collection of t\xe2\x80\xa6 https://t.co/eLOmpKrrzE'
Samsung,1178942627892400128,2019-10-01 08:00:00,b'#SamsungInnovationCampus is a new education initiative to help young people around the globe gain academic and prof\xe2\x80\xa6 https://t.co/rBXuA6Q1wN'
Samsung,1178497190207074304,2019-09-30 02:30:00,b'Samsung\xe2\x80\x99s new air purifiers merge modern aesthetics with innovative technology to deliver fresh air through a power\xe2\x80\xa6 https://t.co/Rdgz4rG8WJ'
Samsung,1178492664812949504,2019-09-30 02:12:01,b'New exclusive #Fortnite Glow skin is now available on #SamsungGalaxy devices https://t.co/Ll1WhcMDdV https://t.co/goEQlTgpia'
Samsung,1177412690441932800,2019-09-27 02:40:35,b'What does #AI mean for the future of society? AI expert at #SamsungAICenter shares his insight on the various appli\xe2\x80\xa6 https://t.co/kiWKn8ZF9j'
Samsung,1177040785377615872,2019-09-26 02:02:46,"b'With the #GalaxyFold, you can get things done one-handed while on the go and enjoy the immersive experience and pro\xe2\x80\xa6 https://t.co/5oAEpQaRSi'"
Samsung,1176789181013491716,2019-09-25 09:22:59,"b'As a part of its decades-long commitment to sustainable innovation, Samsung has been combatting e-waste \nand promot\xe2\x80\xa6 https://t.co/eRK9GPGXtk'"
Samsung,1176330413960134656,2019-09-24 03:00:00,b'The #GalaxyS10 software update will allow users to unleash their creativity and be more productive with new feature\xe2\x80\xa6 https://t.co/NhEpZeJWnL'
Samsung,1176322863785226245,2019-09-24 02:30:00,"b'Samsung #ISOCELL Slim GH1 offers 43.7 megapixels in an extremely compact package, ideal for slim full-display smart\xe2\x80\xa6 https://t.co/GZ3j4pZQyF'"
Samsung,1176149722446336003,2019-09-23 15:02:00,b'Samsung\xe2\x80\x99s unparalleled modular #MicroLED technology will offer unrivaled visual experiences at the most influential\xe2\x80\xa6 https://t.co/tQPWKtkXc9'
Samsung,1176051480593199105,2019-09-23 08:31:37,"b'Packed with innovations and optimized for users\xe2\x80\x99 everyday lives, Samsung\xe2\x80\x99s new #GalaxyA20s lets you play and share\xe2\x80\xa6 https://t.co/yRWKpBISaA'"
Samsung,1174935177971154950,2019-09-20 06:35:50,b'Head of Samsung Research\xe2\x80\x99s AI Center in Seoul shares his insights regarding #AI development and what makes Samsung\xe2\x80\x99\xe2\x80\xa6 https://t.co/Sss4ybcSfJ'
Samsung,1174865761963302913,2019-09-20 02:00:00,b'Samsung Developer Conference 2019 will introduce new ways for developers and partners to engage with Samsung to cre\xe2\x80\xa6 https://t.co/QEiGj8EtFI'
Samsung,1174847934392762368,2019-09-20 00:49:09,b'Samsung is passionate about enabling young citizens the world over through youth education programs. Read on for de\xe2\x80\xa6 https://t.co/uuhcWri6gq'
Samsung,1174554549136179200,2019-09-19 05:23:21,"b""Industry's highest-performing SSDs integrate 3 key software innovations \xe2\x80\x93 'fail-in-place(FIP)', 'SSD virtualization\xe2\x80\xa6 https://t.co/a2ISu594GS"""
Samsung,1173568275495604225,2019-09-16 12:04:15,b'Samsung is proud to be announced as one of the first companies to hold the Wi-Fi CERTIFIED 6\xe2\x84\xa2 accreditation.\xe2\x80\xa6 https://t.co/dMNU0Kkujm'
Samsung,1173528878310027266,2019-09-16 09:27:42,"b'Upgrade alert! New features in Samsung Weather on the #GalaxyNote10 now includes weather alerts, videos and radar m\xe2\x80\xa6 https://t.co/CiwYGKrV3X'"
Samsung,1171951560529784833,2019-09-12 01:00:00,b'The #GalaxyTabS6 delivers a mobile device that\xe2\x80\x99s perfectly in sync with the needs and demands of today\xe2\x80\x99s artistic t\xe2\x80\xa6 https://t.co/XR8kijANRg'
Samsung,1171606779391700992,2019-09-11 02:09:58,b'Samsung KX located at the historic Coal Drops Yard in London\xe2\x80\x99s King\xe2\x80\x99s Cross district is where the technologies of t\xe2\x80\xa6 https://t.co/Xq1j19mwdS'
Samsung,1171317382209400832,2019-09-10 07:00:00,b'Samsung Mobile Division R&amp;D executives discuss how the category-defining #GalaxyFold establishes an all-new user-ex\xe2\x80\xa6 https://t.co/18A2pd7TUZ'
Samsung,1171234428732862464,2019-09-10 01:30:22,b'Hundreds of applications and services for the #GalaxyFold are now available in the Android ecosystem in the Google\xe2\x80\xa6 https://t.co/nqBMxux1yo'
Samsung,1170985194578485248,2019-09-09 09:00:00,b'Samsung\xe2\x80\x99s #IFA2019 booth is full of interactive exhibits showcasing the latest \xe2\x80\x98connected living\xe2\x80\x99 innovations. Expe\xe2\x80\xa6 https://t.co/xtVilLMzdH'
Samsung,1170925915611656192,2019-09-09 05:04:27,b'Samsung Town at #IFA2019 is comprised of interactive exhibits for visitors to get a hands-on look at Samsung\xe2\x80\x99s late\xe2\x80\xa6 https://t.co/bB0QZuknQJ'
Samsung,1170887425838575624,2019-09-09 02:31:31,"b'See how Samsung\xe2\x80\x99s smart kitchen appliances, driven by #AI and #IoT functionality, can seamlessly integrate into you\xe2\x80\xa6 https://t.co/ZYrX3xxujC'"
Samsung,1170162406057594880,2019-09-07 02:30:32,b'The wider application of #5G will usher us into the next major era of #InventionAge\nhttps://t.co/lQrwYLuMCZ'
Samsung,1169898030008606721,2019-09-06 09:00:00,b'Curious to know what are some of the most dynamic ideas and technologies that Samsung is showcasing at #IFA2019? Fi\xe2\x80\xa6 https://t.co/Wp5pZTI5s6'
Samsung,1169885295942090752,2019-09-06 08:09:24,"b'Samsung is paving the way for businesses to stay connected, securely and safely through extensive global partnershi\xe2\x80\xa6 https://t.co/PhxzvvIRxi'"
Samsung,1169872637067022338,2019-09-06 07:19:06,b'Enabling Samsung mobile devices to be used for contactless payments transactions with no additional equipment\xe2\x80\xa6 https://t.co/JXhaLun9G4'
Samsung,1169543190220812288,2019-09-05 09:30:00,b'Samsung\xe2\x80\x99s category-defining #GalaxyFold offers a brand new user experience. Get a hands-on look at its innovative f\xe2\x80\xa6 https://t.co/NoqEgaAVJe'
Samsung,1169536143815335937,2019-09-05 09:02:00,b'Introducing wide range of intelligent and connected products designed to meet the evolving lifestyle of consumers\xe2\x80\xa6 https://t.co/PCireVzESP'
Samsung,1169435240525266944,2019-09-05 02:21:03,b'New #GalaxyFold is a #categorydefining foldable device designed to inspire #firstofitskind user experience\nhttps://t.co/vwmVINhZGz'
Samsung,1169174010174656512,2019-09-04 09:03:00,"b'Unveiling new lifestyle appliances that combine modern design and state-of-the-art Samsung technologies, empowering\xe2\x80\xa6 https://t.co/IlmoHFH9Dj'"
Samsung,1169153905206398977,2019-09-04 07:43:07,"b'Expanding HDR10+ ecosystem with #8K content support, available on all UHD TV and 2019 8K TV models #QLEDTV\nhttps://t.co/sVYGWFQHU9'"
Samsung,1169127953810128896,2019-09-04 06:00:00,b'New Samsung KX experience space in London brings together local culture and Samsung-powered innovations with the gl\xe2\x80\xa6 https://t.co/5oLuYXA3XO'
Samsung,1169068267303886848,2019-09-04 02:02:49,"b'New mobile processor, the #Exynos980, combines the best-in-class connectivity with an integrated #5G modem and inte\xe2\x80\xa6 https://t.co/TOC01UKx3H'"
Samsung,1168707697635495937,2019-09-03 02:10:03,b'Introducing the latest addition to the #GalaxyA family with #5G connectivity #GalaxyA90\nhttps://t.co/k8PkRuwQQN'
Samsung,1168388337826033664,2019-09-02 05:01:02,b'Take a look at this round-up of hidden tips and tricks to help you make the most out of your #GalaxyNote10 or Note1\xe2\x80\xa6 https://t.co/qGf25lDv4b'
Samsung,1167935597517819905,2019-08-31 23:02:00,b'Helping ensure consumers have confidence in their newly purchased #8K TVs\nhttps://t.co/9UvI9bdosF'
Samsung,1167309196737433600,2019-08-30 05:32:54,b'\xf0\x9f\x87\xab\xf0\x9f\x87\xb7\nhttps://t.co/agSpk38kBS'
Samsung,1166885939928428544,2019-08-29 01:31:02,b'Bringing a home-based cardiac rehabilitation solution that is demonstrating promising results for better patient ou\xe2\x80\xa6 https://t.co/DrOp541P7h'
Samsung,1166642566239899648,2019-08-28 09:23:57,b'Opening a new era of kitchen design with the new customizable BESPOKE refrigerator lineup and the premium built-in\xe2\x80\xa6 https://t.co/0ZLhB1kJwL'
Samsung,1166532159638622209,2019-08-28 02:05:14,b'Here are the 10 functions and settings you should consider when setting up your new #GalaxyNote10\nhttps://t.co/jQukOKdXnD'
Samsung,1166501145415565312,2019-08-28 00:02:00,"b'mmWave frequency bands boost #5G technology to take immersive experience to new heights, raising the bar for racing\xe2\x80\xa6 https://t.co/yWyuY3xln9'"
Samsung,1165899416584110080,2019-08-26 08:10:56,b'Samsung is expanding the commitment with the UNDP to support the Sustainable Development Goals. Read on for details\xe2\x80\xa6 https://t.co/6AzbnqUBkF'
Samsung,1165809840016375808,2019-08-26 02:15:00,b'Helping keep away the post-vacation blues with a suite of meditation and #mindfulness features #SamsungHealth\xe2\x80\xa6 https://t.co/jAuu5e1e2G'
Samsung,1164507511270957057,2019-08-22 12:00:00,b'The #GalaxyNote10 and Galaxy Note10+ will be available in stores and online beginning August 23!\nhttps://t.co/1cAD63Qfg2'
Samsung,1164449767130189825,2019-08-22 08:10:33,"b'The new #GalaxyA50s and #GalaxyA30s are made even more powerful with a versatile camera, an uninterrupted infinity\xe2\x80\xa6 https://t.co/XfoM4JPnTv'"
Samsung,1163715325243740165,2019-08-20 07:32:08,b'World\xe2\x80\x99s first 240Hz RapidCurve\xe2\x84\xa2 gaming monitor with NVIDIA G-Sync Compatible delivers the most immersive gaming exp\xe2\x80\xa6 https://t.co/Kjo5VH4KZv'
Samsung,1163682151448993794,2019-08-20 05:20:19,"b'Samsung prioritizes improving the market competitiveness of its suppliers at all levels to create a healthy, sustai\xe2\x80\xa6 https://t.co/77qQnHWiK2'"
Samsung,1163466147154415616,2019-08-19 15:02:00,"b'The #GalaxyNote10 \xe2\x80\x99s Cinematic Infinity Display delivers rich, vivid colors for unmatched video quality, offering u\xe2\x80\xa6 https://t.co/fbkivmshlQ'"
Samsung,1162683613495713795,2019-08-17 11:12:29,"b'#DisplayMate recently described the Galaxy Note10+\xe2\x80\x99s screen as \xe2\x80\x9can excellent, top-tier, world-class smartphone disp\xe2\x80\xa6 https://t.co/mBw1v5gCYI'"
Samsung,1160899233223991296,2019-08-12 13:02:00,b'The new Galaxy Note10+ 5G has received the number 1 ranking on the #DxOMark for both front facing and rear facing c\xe2\x80\xa6 https://t.co/h76AUoKO2e'
Samsung,1160823704420438016,2019-08-12 08:01:52,b'Galaxy A10s delivers powerful performance and innovative features designed for the Era of Live. Check out the full\xe2\x80\xa6 https://t.co/ed4MrBpkTA'
Samsung,1160098459237703681,2019-08-10 08:00:00,"b'The S Pen now features S Pen Air actions letting users take pictures, zoom in and out and switch camera perspective\xe2\x80\xa6 https://t.co/5AYb01NczH'"
Samsung,1160007859385458688,2019-08-10 02:00:00,"b'In case you missed the jam-packed Unpacked event, watch the full video replay of the showcase right here\xe2\x80\xa6 https://t.co/aGdlL9f6Zn'"
Samsung,1159639899198222336,2019-08-09 01:37:51,b'#Exynos9825 #NextGenPower #SamsungExynos https://t.co/BeldCtej5H'
Samsung,1159631907115556864,2019-08-09 01:06:06,b'The #GalaxyNote10 #Unpacked event was a sight to behold. Check out the highlights of the event here #SamsungEvent \nhttps://t.co/M2ED3nzsCm'
Samsung,1159449675071553536,2019-08-08 13:01:58,"b'In celebration of International Cat Day, here are some tips for creating a purrfect clip of your feline friend \xf0\x9f\x90\xb1\xe2\x80\xa6 https://t.co/QYZpx8vRvT'"
Samsung,1159343482315714560,2019-08-08 06:00:00,b'New #GalaxyNote10 line empowers users to take the best-of-the-best technologies to the next level. Learn more here\nhttps://t.co/zETTe7rmrN'
Samsung,1159283085449416704,2019-08-08 02:00:00,b'#GalaxyNote10 and Note10+ are optimized to offer users a smartphone experience that\xe2\x80\x99s second to none. See some of t\xe2\x80\xa6 https://t.co/fZZOjqrWKa'
Samsung,1159267984080113665,2019-08-08 01:00:00,b'What are some of the most exciting new features of #GalaxyNote10?\nhttps://t.co/ylyJxKvycQ'
Samsung,1159245334746243072,2019-08-07 23:30:00,b'Samsung and UNDP will release an education and donation-based mobile application \xe2\x80\x98Samsung Global Goals\xe2\x80\x99 along with\xe2\x80\xa6 https://t.co/xPb7992R2y'
Samsung,1159237785116655617,2019-08-07 23:00:00,"b'New #GalaxyBookS is built to remove barriers and friction from your day with always-on #LTE connectivity, an ultra-\xe2\x80\xa6 https://t.co/1eK7H4BVLu'"
Samsung,1159222686410670080,2019-08-07 22:00:00,b'Exclusive #GalaxyWatchActive2 Under Armour Edition is designed to deliver unique experiences that help runners achi\xe2\x80\xa6 https://t.co/4QQvTKppxu'
Samsung,1159215682229157890,2019-08-07 21:32:10,b'Bringing the best of both #SamsungGalaxy and #Windows platforms in the #5G era\nhttps://t.co/pwxDyVar8r'
Samsung,1159211176930099200,2019-08-07 21:14:16,b'Take an up-close look at the new #GalaxyNote10 here\nhttps://t.co/EcwVHJoEs3'
Samsung,1159199112790716416,2019-08-07 20:26:20,b'Take note: the #GalaxyNote10 is here!\nhttps://t.co/7Nnhc421QM'
Samsung,1158830602390347776,2019-08-06 20:02:00,b'The countdown is on! Tune in to watch the action unfold live on August 7 @ 4 p.m. EDT #SamsungGalaxy #Unpacked\nhttps://t.co/XeYaNuXHwp'
Samsung,1158558914507468800,2019-08-06 02:02:24,"b'Samsung\xe2\x80\x99s 6th-generation V-NAND features the industry\xe2\x80\x99s fastest data transfer rate, capitalizing on the company\xe2\x80\x99s d\xe2\x80\xa6 https://t.co/9VGkt9d8Pk'"
Samsung,1158543936006131713,2019-08-06 01:02:53,"b'The latest Galaxy Watch Active2 takes personalized wellness to the next level, and lets you enjoy more flexibility\xe2\x80\xa6 https://t.co/ZyiGff4f61'"
Samsung,1158249575934615553,2019-08-05 05:33:12,b'Bringing the benefits of #5G to users in Romania - with #OrangeRomania\nhttps://t.co/ducl8eRWi3'
Samsung,1157214455069126657,2019-08-02 09:00:00,b'Take a look at a day in the life of a #GalaxyWatchActive user to see how the device is the perfect companion for th\xe2\x80\xa6 https://t.co/2fOThVpR8w'
Samsung,1157112947388194816,2019-08-02 02:16:39,b'How would you like to be woken up in the morning by your favorite #Hallyu star? #kpop #CelebAlarm #SamsungGalaxy\nhttps://t.co/svVjxqiOWb'
Samsung,1156822369450758144,2019-08-01 07:02:00,"b'FiRa Consortium is designed to grow the UWB ecosystem so new use cases for fine ranging capabilities can thrive, ul\xe2\x80\xa6 https://t.co/aggrClDjmy'"
Samsung,1156748180580524033,2019-08-01 02:07:12,b'Take an in-depth look at the 10 leading innovations of #SamsungGalaxy range that have redefined the smartphone expe\xe2\x80\xa6 https://t.co/VBXivxwIIG'
Samsung,1156565678637424640,2019-07-31 14:02:00,b'New #GalaxyTabS6 enriches the mobile experience by enabling users to express their ideas and get more done\nhttps://t.co/LLj9GJe51c'
Samsung,1156353370594009088,2019-07-30 23:58:22,"b'[2Q Results (in KRW)] Sales: 56.13 trillion, operating profit: 6.6 trillion\nhttps://t.co/YFiQb5QF2i'"
Samsung,1156203418605633536,2019-07-30 14:02:30,"b'Here is a sneak peek of the two new #SamsungGalaxy products that will allow for interconnectedness anytime, enablin\xe2\x80\xa6 https://t.co/Ua75DtlMbL'"
Samsung,1156114637890322433,2019-07-30 08:09:43,"b'Optimal for creating and consuming media, the new Galaxy A80 is the ideal companion for the content-creator living\xe2\x80\xa6 https://t.co/ocBDlFNV9w'"
Samsung,1156029660053962755,2019-07-30 02:32:03,"b'In light of his renowned expertise in computer architecture, Dr. Nam Sung Kim, SVP of Samsung\xe2\x80\x99s Memory Business, an\xe2\x80\xa6 https://t.co/CnG9HLv3TM'"
Samsung,1155746581171204098,2019-07-29 07:47:12,"b'Because it can be difficult for a user to accurately detail complex problem situations by verbal description, Samsu\xe2\x80\xa6 https://t.co/w8fzjQM1x3'"
Samsung,1154633749801254913,2019-07-26 06:05:12,b'Samsung researchers from Poland and China emerged as one of the leading teams at a contest held by #IEEE to identif\xe2\x80\xa6 https://t.co/17Xas4KDua'
Samsung,1153854816025579520,2019-07-24 02:30:00,b'Samsung\xe2\x80\x99s SSD partners with the gaming industry to provide gamers with a fully immersive game-playing environment\xe2\x80\xa6 https://t.co/zM9vhPP7rL'
Samsung,1153533951404851201,2019-07-23 05:15:00,b'Bringing a lifestyle ecosystem straight to users\xe2\x80\x99 wrists that is fully customizable and offers effortless usability\xe2\x80\xa6 https://t.co/X353qpvf1Y'
