gizmodo,1187157539504435200,2019-10-24 00:03:08,b'This uninhabited island is covered in rubber bands because birds think they\xe2\x80\x99re worms https://t.co/KwAawvyvf9 https://t.co/UkoOEIgvcK'
gizmodo,1187149819401441280,2019-10-23 23:32:27,b'FTC finally decides stalking apps may not be all that great https://t.co/4j3XqmR9Pz https://t.co/vAnWcp72fo'
gizmodo,1187147259684753409,2019-10-23 23:22:17,"b""First look at 'Sycamore,' Google's quantum computer https://t.co/gptPaZZptt https://t.co/sxG2RFrrjU"""
gizmodo,1187142806458064898,2019-10-23 23:04:35,"b""Scientists say they've ferreted out an experimental drug that might be a super flu killer https://t.co/IcVcUMPlew https://t.co/48ZOYqn4lD"""
gizmodo,1187136271900200960,2019-10-23 22:38:37,"b""The NASCAR crash compilation of Mark Zuckerberg's six-hour congressional testimony https://t.co/VwYcEpPVU4 https://t.co/2aV1hc2PYu"""
gizmodo,1187132865361993729,2019-10-23 22:25:05,"b'How posting memes could soon cost you $30,000 https://t.co/gAwygbkabg https://t.co/HqaMjNtFDR'"
gizmodo,1187126321421443072,2019-10-23 21:59:05,b'Fresh look at New Horizons data shows Pluto\xe2\x80\x99s \xe2\x80\x98far side\xe2\x80\x99 in unprecedented detail https://t.co/X2uIR7Yyte https://t.co/rTTRbDBFuG'
gizmodo,1187125220135591936,2019-10-23 21:54:42,"b""Republicans wielding phones 'compromised' classified room used for impeachment hearing https://t.co/VG6MQGNi1b https://t.co/QdzARTwsh0"""
gizmodo,1187117261884137472,2019-10-23 21:23:05,b'Internal cybersecurity memo: White House is bound to get hacked\nhttps://t.co/Adly4Tzi88 https://t.co/sVTZtDO1Eh'
gizmodo,1187111762107228160,2019-10-23 21:01:14,"b""What's a fair price for a Shrek baby? https://t.co/hjkGbU0HGi https://t.co/X8kSy1oErp"""
gizmodo,1187103415480008705,2019-10-23 20:28:04,"b""Congress explores why the oil industry's climate denial is a civil rights issue https://t.co/jVNhmJNVYR https://t.co/oQOb7hErBs"""
gizmodo,1187102540082614272,2019-10-23 20:24:35,"b""Republicans wielding phones 'compromised' classified room used for impeachment hearing https://t.co/R35PWGPW5c https://t.co/z0JtG0i1Lg"""
gizmodo,1187098547268866049,2019-10-23 20:08:43,b'Blackouts may soon be hitting California\xe2\x80\x94again https://t.co/K0cJun10G3 https://t.co/VHjaXmipJ9'
gizmodo,1187093094115753986,2019-10-23 19:47:03,b'FTC finally decides stalking apps may not be all that great https://t.co/QEdJMhbgnJ https://t.co/19O6c44UGc'
gizmodo,1187089928162889728,2019-10-23 19:34:28,"b""Axon brings license plate recognition to cops' dash cams\nhttps://t.co/U9eCaiwpMb https://t.co/OXRjEPxJAi"""
gizmodo,1187085072626864128,2019-10-23 19:15:10,"b'The Trump administration continues its twin, often intertwined wars against California and climate action\xe2\x80\xa6 https://t.co/YqWDifV5Hk'"
gizmodo,1187077211662237698,2019-10-23 18:43:56,"b'Scientists say their experimental drug knocks out the flu, in animal tests at least https://t.co/c4v8ggrerh https://t.co/WrMY8sh0K3'"
gizmodo,1187074462505680896,2019-10-23 18:33:01,b'The Fujifilm X-Pro3 is a love letter to street photography\nhttps://t.co/xptl0aRwH9 https://t.co/YjofgEonB7'
gizmodo,1187066477293297666,2019-10-23 18:01:17,"b""Google releases five 'digital wellbeing' experiments to curb your smartphone addiction \nhttps://t.co/p06fZE6MOe https://t.co/IR6H96nU5o"""
gizmodo,1187058878619508737,2019-10-23 17:31:05,"b""Axon brings license plate recognition to cops' dash cams\nhttps://t.co/is706iP5UU https://t.co/6BOeVrtyT0"""
gizmodo,1187055427927924736,2019-10-23 17:17:23,b'This uninhabited island is covered in rubber bands because birds think they\xe2\x80\x99re worms https://t.co/rzaZDDBVBo https://t.co/8ie56CdG7m'
gizmodo,1187039073220861952,2019-10-23 16:12:23,"b""Google releases five 'digital wellbeing' experiments to curb your smartphone addiction \nhttps://t.co/MKj2p9Bsmu https://t.co/JBD9CD0pUJ"""
gizmodo,1187036134112669698,2019-10-23 16:00:43,b'The Fujifilm X-Pro3 is a love letter to street photography\nhttps://t.co/O83q9mhEQQ https://t.co/M1qDpZIKY0'
gizmodo,1187032049787518980,2019-10-23 15:44:29,b'We made some burgers and tacos to see how Impossible 2.0 compares to real beef. https://t.co/GYgvRPt9uv'
gizmodo,1187025318483288065,2019-10-23 15:17:44,"b""What's a fair price for a Shrek baby? https://t.co/ggCCUvq8nN https://t.co/Z0iIO3yHcG"""
gizmodo,1187022511705378816,2019-10-23 15:06:35,b'Trump administration sues California for daring to address climate change https://t.co/0X7VgeQR8U https://t.co/gGiNCBi6Oy'
gizmodo,1187019678293659648,2019-10-23 14:55:19,b'PG&amp;E could turn power off again as California faces wildfire weather https://t.co/IC08djIemg https://t.co/one0KdAZKV'
gizmodo,1187016054511493121,2019-10-23 14:40:55,"b""This Garmin smartwatch is a beast that doesn't have a real reason to exist\nhttps://t.co/QPuelMZqqb https://t.co/6Nv62a9ER8"""
gizmodo,1187008464209530880,2019-10-23 14:10:46,b'Raytheon delivers first anti-drone laser weapon to U.S. Air Force https://t.co/rD6Mr38hdO https://t.co/UIWxfrf4Cc'
gizmodo,1186999420275040269,2019-10-23 13:34:49,"b""This Garmin smartwatch is a beast that doesn't have a real reason to exist\nhttps://t.co/yR4tE1F1Js https://t.co/nv3GaG3WJC"""
gizmodo,1186995882446807042,2019-10-23 13:20:46,"b""Here's what it means for a quantum computer to outperform a regular one. https://t.co/tHbFsTcj20"""
gizmodo,1186993898071232512,2019-10-23 13:12:53,"b'So what the hell is a quantum computer anyway, and how excited should you be? https://t.co/RxFpsf6CfR https://t.co/18ohapc87R'"
gizmodo,1186991826747772928,2019-10-23 13:04:39,b'Breaking: Google confirms achieving quantum supremacy https://t.co/KwCn5GtrXl https://t.co/p4rVDI9fNG'
gizmodo,1186981424244678656,2019-10-23 12:23:19,b'WeWork founder given $1.7 billion to LeaveWork https://t.co/dABL0mWlC4 https://t.co/NerHkkp8ig'
gizmodo,1186949905002180608,2019-10-23 10:18:04,b'Raytheon delivers first anti-drone laser weapon to U.S. Air Force https://t.co/D182OMOElB https://t.co/gZx6xdHUVs'
gizmodo,1186865243496034304,2019-10-23 04:41:39,"b'Just my opinion: the company offering $130,000 for the perfect robot face should choose Luigi\xe2\x80\xa6 https://t.co/pQojwFbmF7'"
gizmodo,1186837957480767488,2019-10-23 02:53:14,"b""Elon Musk on his space internet: 'Whoa, it worked' https://t.co/dN7Jipqv1b https://t.co/d5g6mXRuHx"""
gizmodo,1186829871462395905,2019-10-23 02:21:06,"b'Flame retardants are bad news, man https://t.co/L4cjhimwJ5 https://t.co/AR2P40o2vQ'"
gizmodo,1186826546113400832,2019-10-23 02:07:53,"b'Sheryl Sandberg: We let politicians lie in Facebook ads for the ""discourse,"" not the money https://t.co/GZfoMXIcyj https://t.co/XHbBgpKJc4'"
gizmodo,1186820098394382336,2019-10-23 01:42:16,"b""Microsoft's over-the-top VR rig lets you explore a virtual world while walking IRL https://t.co/IWzDSD1wVn https://t.co/1tJUmllgQK"""
gizmodo,1186812063206785030,2019-10-23 01:10:20,b'Bipartisan bill aims to make it easier to log off Facebook forever\nhttps://t.co/2kAvxuRP8Z https://t.co/9uvovGKSWg'
gizmodo,1186803974164357122,2019-10-23 00:38:11,"b""Maybe Big Oil's strategy of denying climate change and lying to investors wasn't such a good idea after all...\xe2\x80\xa6 https://t.co/bHoTgeedKG"""
gizmodo,1186795723347648513,2019-10-23 00:05:24,"b'Mark Zuckerberg to throw shit at wall, see what sticks https://t.co/5knDlcLIdh https://t.co/1N3meHYh3u'"
gizmodo,1186791356699684869,2019-10-22 23:48:03,b'The most bullshit health and wellness fads of the decade https://t.co/sCHuca6d78 https://t.co/ojMjrnsaAZ'
gizmodo,1186788345663381504,2019-10-22 23:36:05,b'Aye-ayes have been hiding a secret sixth finger this whole time https://t.co/3F6tOgR1Wh https://t.co/ce2WmenXFt'
gizmodo,1186780571273482245,2019-10-22 23:05:12,b'Get excited for a free year of Disney+ https://t.co/M5R7uwjcrN https://t.co/a5XYs8XwR8'
gizmodo,1186776609354911744,2019-10-22 22:49:27,"b""It's enough bad news to give you an ulcer... https://t.co/8LM0ljo8cN https://t.co/pRStapmbyn"""
gizmodo,1186772985023209472,2019-10-22 22:35:03,b'Why is Pete Buttigieg the Facebook candidate? https://t.co/GMVXu4bN55 https://t.co/fZf0QffO00'
gizmodo,1186771986397253632,2019-10-22 22:31:05,b'Increased air pollution under Trump is causing more premature deaths across the US https://t.co/LS6GjzdWq7 https://t.co/gjeTksqlg8'
gizmodo,1186766443033051136,2019-10-22 22:09:03,b'Bipartisan bill aims to make it easier to log off Facebook forever\nhttps://t.co/iV0A2UaLsl https://t.co/z1UXwntSfl'
gizmodo,1186764644234477571,2019-10-22 22:01:54,"b'Mark Zuckerberg to throw shit at wall, see what sticks https://t.co/MAkKhADSMK https://t.co/0A6tAYouXt'"
gizmodo,1186762045108248576,2019-10-22 21:51:35,"b""New study shows 'everybody on the planet' is exposed to toxic flame retardants https://t.co/QaXbjDgo5w https://t.co/5Mhg2NQW2V"""
gizmodo,1186758690684182528,2019-10-22 21:38:15,b'WeWork founder given $1.7 billion to LeaveWork https://t.co/MdqKoOHuYn https://t.co/EUxXOBqs1T'
gizmodo,1186756155953029126,2019-10-22 21:28:11,"b""Microsoft's wearable rig hides the real world behind a VR one https://t.co/sVJhrM34tM https://t.co/tLz8SHJsOL"""
gizmodo,1186752978868494336,2019-10-22 21:15:33,"b""Exxon isn't the only oil giant getting its ass sued https://t.co/o40bMtvhpm https://t.co/8sL5gkvK1U"""
gizmodo,1186741234842439680,2019-10-22 20:28:53,"b""Elon Musk on his space internet: 'Whoa, it worked' https://t.co/sTuPCTmtUz https://t.co/PIr54oVPmV"""
gizmodo,1186737502687825920,2019-10-22 20:14:03,"b""Facebook's business falls under microscope of 47 attorneys general https://t.co/n91WnSOdGP https://t.co/0JHNubs7El"""
gizmodo,1186724833431822337,2019-10-22 19:23:43,"b""Gmail's dark theme is finally here for Android 10\nhttps://t.co/q4j7VI5BdJ https://t.co/nnoMr59QLA"""
gizmodo,1186721387991519237,2019-10-22 19:10:01,b'TikTok boots dozens of ISIS accounts\nhttps://t.co/RRMS5X3brT https://t.co/oiYJJcZqWi'
gizmodo,1186713504310550529,2019-10-22 18:38:42,b'Recalled gun holster had one job: does the exact opposite https://t.co/biTl4zDU6W https://t.co/i131OYfISW'
gizmodo,1186705894710616065,2019-10-22 18:08:27,"b'The bacteria that cause stomach ulcers are becoming drug-resistant, too https://t.co/g94MkkBMvy https://t.co/IXseTjfrUB'"
gizmodo,1186701834414624773,2019-10-22 17:52:19,b'The most bullshit health and wellness fads of the decade https://t.co/xFIWgqvgLI https://t.co/B5zs6c8fk3'
gizmodo,1186697321301577728,2019-10-22 17:34:23,"b""Gmail's dark theme is finally here for Android 10\nhttps://t.co/FIvAUmaKBU https://t.co/vulmJMzXFs"""
gizmodo,1186694204002619393,2019-10-22 17:22:00,b'TikTok boots dozens of ISIS accounts\nhttps://t.co/cUWcMiCxOj https://t.co/Hcfloi8WtD'
gizmodo,1186687432944521216,2019-10-22 16:55:06,b'Aye-ayes have been hiding a secret sixth finger this whole time https://t.co/uhhS167TPa https://t.co/1AxeWkDbGa'
gizmodo,1186681906320072710,2019-10-22 16:33:08,b'Air pollution is increasing for the first time in a decade under Trump https://t.co/w7njSLC7xZ https://t.co/bNbNdqXShK'
gizmodo,1186666299344261121,2019-10-22 15:31:07,b'The 25 Apple Arcade games that make it worth the money https://t.co/8SccmWtOQh https://t.co/wlkhviV4xy'
gizmodo,1186663526217203713,2019-10-22 15:20:06,b'Recalled gun holster had one job: does the exact opposite https://t.co/0elFmiUzVS https://t.co/gZcClnuBx6'
gizmodo,1186660856152711172,2019-10-22 15:09:29,b'These rat-eating monkeys are a surprisingly effective form of pest control https://t.co/ZKXh8Ptpdf https://t.co/4qXeYvepGp'
gizmodo,1186658084166520832,2019-10-22 14:58:28,b'A free year of Disney+ is coming to Verizon customers https://t.co/7T9AybyZRZ https://t.co/YODUzy0pud'
gizmodo,1186655416819834882,2019-10-22 14:47:53,"b""The Camp Fire was the most destructive wildfire in California's history, all but destroying the town of Paradise. N\xe2\x80\xa6 https://t.co/aOlZT3wOEX"""
gizmodo,1186652329296191488,2019-10-22 14:35:36,"b""RT @whitneykimball: I'm thrilled to announce that today I'm joining @Gizmodo as a staff reporter! Open to tips, oddities, musings, gifs, ta\xe2\x80\xa6"""
gizmodo,1186649937192407040,2019-10-22 14:26:06,b'Amazon found to be selling loads of expired and inedible food https://t.co/z2jSW8TRXq https://t.co/3LEcYfAWFs'
gizmodo,1186625416993345536,2019-10-22 12:48:40,"b'NASA needs new strategies to protect the solar system from Earthly contamination, report finds\xe2\x80\xa6 https://t.co/yJTj0u8bgw'"
gizmodo,1186616805365833729,2019-10-22 12:14:27,b'The Hero8 Black is the GoPro I\xe2\x80\x99ve been waiting to see for years without realizing it. https://t.co/LTeJvMlUls'
gizmodo,1186501804768550912,2019-10-22 04:37:29,b'You lost how much on scooters? https://t.co/nxDDrEcWz6 https://t.co/drSGRfEy5l'
gizmodo,1186478808704176133,2019-10-22 03:06:06,"b""Report: WeWork delaying mass layoffs because it can't afford severance https://t.co/QP1X2DlFPN https://t.co/eoM7ggo2Hy"""
gizmodo,1186467769820286977,2019-10-22 02:22:14,"b'Just some real-life superbug horror here, nothing to worry about https://t.co/Bw05KF2KcA https://t.co/3Rbt6HH1L9'"
gizmodo,1186462287856582657,2019-10-22 02:00:27,"b'Zuckerberg: I feel responsible for the ""different ways"" Facebook has been used to cause, uh, ""effects""\xe2\x80\xa6 https://t.co/3uFWQUzXxq'"
gizmodo,1186446686861905920,2019-10-22 00:58:27,b'Researchers taught autonomous camera drones to film like a Hollywood director https://t.co/YEEt9egcQP https://t.co/7riDMNUS5y'
gizmodo,1186438933347028992,2019-10-22 00:27:39,b'Mysterious cases of paralysis in children may be caused by polio-like viruses https://t.co/ZdJtgWmKXe https://t.co/XQcWWG7Ce0'
gizmodo,1186430569716047873,2019-10-21 23:54:25,b'smol ozone hole https://t.co/Ck3VvYEG5s https://t.co/FsHF11qq3I'
gizmodo,1186424552445927424,2019-10-21 23:30:30,b'Amazon found to be selling loads of expired and inedible food https://t.co/D80qsupCaB https://t.co/upmv2XzfoF'
gizmodo,1186416352166400000,2019-10-21 22:57:55,b'These rat-eating monkeys are a surprisingly effective form of pest control https://t.co/0F7BdwBC2C https://t.co/vziICb2B6J'
gizmodo,1186408667916259329,2019-10-21 22:27:23,"b'It took just three weeks for superbug to resist last-resort drug, doctors say https://t.co/ZfF6AXWpB1 https://t.co/WkR46JHjDq'"
gizmodo,1186405387819462656,2019-10-21 22:14:21,b'The 25 Apple Arcade games that make it worth the money https://t.co/PGJVBYwVwo https://t.co/JCv9a5iqmG'
gizmodo,1186401305981607941,2019-10-21 21:58:08,b'WeWork gets a life raft: report https://t.co/8PZKfHUzoL https://t.co/LW8hWrnUF1'
gizmodo,1186395755361243137,2019-10-21 21:36:04,"b""Company that profits off political misinformation says it's going to do more to stop it https://t.co/3tWa6mltSX https://t.co/wBRiBG7jKV"""
gizmodo,1186391790879956995,2019-10-21 21:20:19,b'This is what you get when art and science collide https://t.co/L30qYtWTeb https://t.co/4EVRMVYuIg'
gizmodo,1186389255574245379,2019-10-21 21:10:15,b'makes you think https://t.co/MArD3mjMzA https://t.co/bE3w7dMNkD'
gizmodo,1186386453527433217,2019-10-21 20:59:07,"b'NASA needs new strategies to protect the solar system from Earthly contamination, report finds\xe2\x80\xa6 https://t.co/b4Y2zH7Y2d'"
gizmodo,1186384554812198913,2019-10-21 20:51:34,"b""The Camp Fire was the most destructive wildfire in California's history, all but destroying the town of Paradise. N\xe2\x80\xa6 https://t.co/G4aBD7aNbV"""
gizmodo,1186381452642062338,2019-10-21 20:39:14,b'Researchers taught autonomous camera drones to film like a Hollywood director https://t.co/7yZ4FhIZ4j https://t.co/1FUCWaxMPc'
gizmodo,1186373811031232513,2019-10-21 20:08:52,"b'2019 had the smallest ozone hole on record, no thanks to us https://t.co/icUqHVtahy https://t.co/LSlcnO7vEA'"
gizmodo,1186370077261750273,2019-10-21 19:54:02,b'Mysterious cases of paralysis in children may be caused by polio-like viruses https://t.co/Pdkv3cdapZ https://t.co/6M2XqdXyvs'
gizmodo,1186358219196776448,2019-10-21 19:06:55,b'DOJ rule gives green light to collect DNA from asylum-seekers and detained migrants\nhttps://t.co/2z49zXJs5h https://t.co/rEyaeNP9C6'
gizmodo,1186354509917896706,2019-10-21 18:52:11,b'Your Google Home and Alexa can be used to eavesdrop and phish for your passwords\nhttps://t.co/9NRN8Kg2h6 https://t.co/rGicYMgJ3W'
gizmodo,1186351920170127361,2019-10-21 18:41:53,"b'""I think I will always kind of be searching for Paradise in a way"" https://t.co/MxHA1pDvvb https://t.co/qhKQcGHzNV'"
gizmodo,1186348573740412936,2019-10-21 18:28:35,b'What will the internet look like in 2030? https://t.co/w1t7lto8UW https://t.co/3UFx3mA3ko'
gizmodo,1186341406845091841,2019-10-21 18:00:07,b'The 25 Apple Arcade games that make it worth the money https://t.co/W4qTGLjkea https://t.co/2BFyWAlvwk'
gizmodo,1186340091519746054,2019-10-21 17:54:53,b'Amazon found to be selling loads of expired and inedible food https://t.co/JqKEFRBArT https://t.co/PwzT10dT81'
gizmodo,1186336062802743296,2019-10-21 17:38:53,"b""Google says it will fix Pixel 4's face unlock fail 'in the coming months'\nhttps://t.co/I6q2N0vOUA https://t.co/Z3HffnV78r"""
gizmodo,1186328465819222017,2019-10-21 17:08:41,"b""Microsoft and AMD's Surface Laptop 3 is something special https://t.co/yuZjqeDwc6 https://t.co/rZ6sAtEauJ"""
gizmodo,1186324680220778496,2019-10-21 16:53:39,b'The Pixel 4 wins by being more human\nhttps://t.co/uUak8Yy1IP https://t.co/G0ntx8aKlP'
gizmodo,1186321692207001605,2019-10-21 16:41:46,b'Your Google Home and Alexa can be used to eavesdrop and phish for your passwords\nhttps://t.co/SB3N5WkugH https://t.co/K9ynyQi0YN'
gizmodo,1186318578892582914,2019-10-21 16:29:24,b'These roadside markers have a futuristic climate twist https://t.co/tCBNKlNF8p https://t.co/Mdsb5xEiCP'
gizmodo,1186315530011107334,2019-10-21 16:17:17,b'Catfish fetishists: The men who get off on getting scammed online https://t.co/5968ak2zQ3 https://t.co/RHKzcTvRIO'
gizmodo,1186311639152373764,2019-10-21 16:01:50,"b""Did President Trump give the middle finger to two female astronauts? Probably. And it wasn't the first time.\xe2\x80\xa6 https://t.co/4t3JgrLGeD"""
gizmodo,1186308652254273536,2019-10-21 15:49:57,b'DOJ rule gives green light to collect DNA from asylum-seekers and detained migrants\nhttps://t.co/RaAMdFla4T https://t.co/UWbYXBsTux'
gizmodo,1186302460811497473,2019-10-21 15:25:21,"b'Standing in the rubble of Paradise: life after the Camp Fire, one year later https://t.co/YDYcVtq2qZ https://t.co/O2SZ6Q90Rw'"
gizmodo,1186299001475387392,2019-10-21 15:11:36,"b""Google says it will fix Pixel 4's face unlock fail 'in the coming months'\nhttps://t.co/K0mzXo1c2L https://t.co/sYT3zBBEfM"""
gizmodo,1186296571194941445,2019-10-21 15:01:57,b'These rat-eating monkeys are a surprisingly effective form of pest control https://t.co/PPBq7HNP7d https://t.co/I8xQDpGl8K'
gizmodo,1186283433657585664,2019-10-21 14:09:45,b'What will the internet look like in 2030? https://t.co/auLxzdHilw https://t.co/8nwHqwhAll'
gizmodo,1186274014660050945,2019-10-21 13:32:19,"b""Kik's messaging app won't be killed off after all. https://t.co/enHckUzKBY https://t.co/ft9UVrBPiD"""
gizmodo,1186266015841292289,2019-10-21 13:00:32,b'The Pixel 4 wins by being more human\nhttps://t.co/n4pz2ZTudQ https://t.co/Sd9SAmxPUz'
gizmodo,1186265919041003520,2019-10-21 13:00:09,"b""Microsoft and AMD's Surface Laptop 3 is something special https://t.co/MqMppVZiof https://t.co/mZjL06zkQZ"""
gizmodo,1186251175731126272,2019-10-21 12:01:34,"b""Don't feel guilty for upgrading to the iPhone 11 https://t.co/xOeIycsCxL"""
gizmodo,1186244066792628224,2019-10-21 11:33:19,b'Did President Trump flash his middle finger to women astronauts in this viral video? https://t.co/ek49tKS7wI https://t.co/YfGcQNMBJJ'
gizmodo,1186235542104657920,2019-10-21 10:59:27,"b'China censorship, Facebook headcanon, Pixel 4, and Apple Beats: Best Gizmodo Stories of the Week.\xe2\x80\xa6 https://t.co/Spqmi0uLCZ'"
gizmodo,1186084569138847746,2019-10-21 00:59:32,"b'China censorship, Facebook headcanon, Pixel 4, and Apple Beats: Best Gizmodo Stories of the Week.\xe2\x80\xa6 https://t.co/yirXm4SaHW'"
gizmodo,1186042170555408391,2019-10-20 22:11:03,b'Add these 9 simple browser bookmarks to make your online life easier https://t.co/0cADmbcZQj https://t.co/OOx2R2VOdA'
gizmodo,1186029675811950593,2019-10-20 21:21:24,"b'Twitch ""Watch Parties"" let me stream movies to the viewers I don\'t have. https://t.co/1P4rTCdQoT https://t.co/a0KckJ0cbd'"
gizmodo,1186027088547123200,2019-10-20 21:11:07,"b""AMC: Fuck it, let's do streaming too\nhttps://t.co/rVYdn2pm7n https://t.co/9msyYBbYzJ"""
gizmodo,1186011991296614400,2019-10-20 20:11:08,b'Discovery of Bronze Age warrior\xe2\x80\x99s kit sheds new light on an epic prehistoric battle https://t.co/gNRMFvYW26 https://t.co/2vzwu1Ecet'
gizmodo,1185996895652667394,2019-10-20 19:11:09,b'Good news everyone! https://t.co/2ciMmGuFh4 https://t.co/p1xJm8HLPv'
gizmodo,1185981525155831808,2019-10-20 18:10:04,"b""Oh God, there's so much blood https://t.co/FstwgsWOwS https://t.co/FwmazDfStz"""
gizmodo,1185966425409757184,2019-10-20 17:10:04,"b'That new viral face app sucks, but it got one thing right. https://t.co/zK86hszMKJ https://t.co/XWiRZERAqM'"
gizmodo,1185951331107901440,2019-10-20 16:10:05,b'U.S. military will stop using floppy disks to operate its nuclear weapons system\nhttps://t.co/hejdRbStX2 https://t.co/FYtQuhEeyk'
gizmodo,1185936229159915523,2019-10-20 15:10:05,b'Apple finally made Beats look good https://t.co/omArvMcUI1 https://t.co/Jfoa8zza5b'
gizmodo,1185898797710397440,2019-10-20 12:41:20,b'This Brazillian woman holds the world record for the largest collection of assembled puzzles https://t.co/J04g8mPChr'
gizmodo,1185711869698424837,2019-10-20 00:18:33,"b""Google's smart home doorbell sounds terrifying (or, at least, it will soon). https://t.co/GkOJjykdwx"""
gizmodo,1185679543555756037,2019-10-19 22:10:06,b'Porn wins porn war https://t.co/41WrThONze https://t.co/tYKrUv8bgp'
gizmodo,1185664450478690306,2019-10-19 21:10:08,"b""Here's how to get Disney+ for $5 a month https://t.co/apnNWHClCl https://t.co/DFody6NYvQ"""
gizmodo,1185661812466958336,2019-10-19 20:59:39,"b""Facebook's top priority is totally its government-ordered privacy program. https://t.co/8e5INP1OiI https://t.co/PrTRRAJvFy"""
gizmodo,1185649333795987457,2019-10-19 20:10:04,"b""Hey, Reddit NSFW communities: Imgur's sick of your smut. https://t.co/PaxXYPsbv0 https://t.co/l6l2Rv7dn1"""
gizmodo,1185634003770056705,2019-10-19 19:09:09,"b""Elon Musk smoking Joe Rogan's weed somehow ended up costing taxpayers $5 million https://t.co/ruzs5w4edS https://t.co/tWoPgtRRGI"""
gizmodo,1185618884629598213,2019-10-19 18:09:04,b'The ultimate Game Boy clone perfectly plays every classic handheld game you ever loved https://t.co/4EBhbBS9xY https://t.co/iaISFOkGhw'
gizmodo,1185603786276069377,2019-10-19 17:09:04,"b""Even WeWork's phone booths reek of death https://t.co/AwFtoErPvX https://t.co/4ebGCGyIgV"""
gizmodo,1185588690359406592,2019-10-19 16:09:05,"b'Dormant for 500 years, a potentially deadly fault in California has started to move https://t.co/KlqOQtfby9 https://t.co/6zqweTByVy'"
gizmodo,1185573598662144001,2019-10-19 15:09:07,"b'Uh... the Army just contracted with Tom DeLonge\'s UFO group to study those ""alien alloys"" https://t.co/S0G5pG8YoE https://t.co/EWGQFp7035'"
gizmodo,1185552145581596674,2019-10-19 13:43:52,"b""Cosmic rays may have blasted gigantic sand dunes into existence on Saturn's moon Titan https://t.co/GbirkR0skP https://t.co/Vwn0kIEgiE"""
gizmodo,1185535970730487808,2019-10-19 12:39:36,b'Everything you need to know about gesture controls with the new Google Pixel 4 https://t.co/DoZWvxBPiB'
gizmodo,1185523059601690625,2019-10-19 11:48:18,"b""Help, I can't unsee these faux-flesh phone cases. https://t.co/Pg4Y4TDfSl https://t.co/gRjkCreW7d"""
gizmodo,1185500491347824646,2019-10-19 10:18:37,"b""Hey, Reddit NSFW communities: Imgur's sick of your smut. https://t.co/qnCqlyPUlw https://t.co/8N9BCQm5jk"""
gizmodo,1185394667459878913,2019-10-19 03:18:06,"b""Hey, Reddit NSFW communities: Imgur's sick of your smut. https://t.co/1hRkmxzIwU https://t.co/E5em0ACgAK"""
gizmodo,1185381168428007426,2019-10-19 02:24:28,b'Now scientists monitor stranded whales from space https://t.co/PL64SZPx9e https://t.co/cpSr18qzGd'
gizmodo,1185373169257009153,2019-10-19 01:52:41,"b""Maybe it's time to avoid using any talc-based baby powder... https://t.co/wrb3W24fEt https://t.co/Xv3gpOYApN"""
gizmodo,1185368807545671680,2019-10-19 01:35:21,"b'Shout out to Jane Fonda, who just keeps getting arrested for Earth https://t.co/ZaWBODSbw5 https://t.co/IszHnUoYuO'"
gizmodo,1185364201553960961,2019-10-19 01:17:03,"b'FAA says pilots complained of ""egregious"" issues with 737 Max in messages Boeing withheld\nhttps://t.co/l2WwScVjIK https://t.co/O9Ersd9yVL'"
gizmodo,1185356134007431168,2019-10-19 00:44:59,"b'Dormant for 500 years, a potentially deadly fault in California has started to move https://t.co/odFClv33Mr https://t.co/My1FZdh61O'"
gizmodo,1185347966158213123,2019-10-19 00:12:32,b'Things are looking pretty good for humpback whales https://t.co/Kqk4XsVeZz https://t.co/RoHsKDU0mJ'
gizmodo,1185344529093844993,2019-10-18 23:58:53,"b""We're not ready for the next pandemic https://t.co/o2DvcvjTcF https://t.co/83oI9xBcph"""
gizmodo,1185340433725046784,2019-10-18 23:42:36,"b""A year after Hurricane Michael, Florida's Gulf Coast faces Tropical Storm Nestor https://t.co/Hw7TOy6E6q https://t.co/Ujma7C3XxF"""
gizmodo,1185332068462612482,2019-10-18 23:09:22,"b'Uh... the Army just contracted with Tom DeLonge\'s UFO group to study those ""alien alloys"" https://t.co/9aHlF5IlDe https://t.co/VxrgjSKqX0'"
