gizmodo,1179766960780926980,2019-10-03 14:35:37,"b'Do you have what it takes to complete a 13,200 piece puzzle? Luiza Figueiredo can do that and more\xe2\x80\x94she\xe2\x80\x99s the Guinne\xe2\x80\xa6 https://t.co/inFi442LQi'"
gizmodo,1179758016347947010,2019-10-03 14:00:04,b'Microsoft doubles down https://t.co/7ZAwsojfvr https://t.co/e9tIT7T0lm'
gizmodo,1179757273222172672,2019-10-03 13:57:07,b'The Surface Pro X is a really big deal https://t.co/nFpoNBQJNK https://t.co/9b1ufivTit'
gizmodo,1179750155093979136,2019-10-03 13:28:50,b'The Surface Laptop 3 and Surface Pro 7 revamps are one port short of ideal\nhttps://t.co/uokUO4nWyk https://t.co/7GvkUqUbpT'
gizmodo,1179741589054398465,2019-10-03 12:54:48,"b""What Windows 10X is\xe2\x80\x94and why it's the future of Microsoft software https://t.co/2lEhCuX7rm https://t.co/1hjjPAR8QS"""
gizmodo,1179725220422324236,2019-10-03 11:49:45,b'A new Treasure Island is in the works from the director of How to Train Your Dragon https://t.co/ldLakRVhoD https://t.co/ReDkxf5ChC'
gizmodo,1179708843514830848,2019-10-03 10:44:40,b'The Hero8 Black is the GoPro I\xe2\x80\x99ve been waiting to see for years. https://t.co/dd7G3Dhd4N'
gizmodo,1179698432048541696,2019-10-03 10:03:18,"b""Facebook must delete content globally if it's considered defamatory in Europe, top EU court rules\xe2\x80\xa6 https://t.co/s21v7Uark6"""
gizmodo,1179656688556740608,2019-10-03 07:17:26,b'Florida Boomer caught on video cutting brake lines of public e-scooters https://t.co/bBAU0vC24Q https://t.co/gmCQ1WHPFf'
gizmodo,1179578492385742849,2019-10-03 02:06:42,"b'We made tacos and burgers using the new Impossible Burger ""meat"" https://t.co/6tiMDaJC8T'"
gizmodo,1179575766130003968,2019-10-03 01:55:52,b'Judge rules that supervised injection site planned in Philly is legal https://t.co/POtXR9NiNq https://t.co/eXJgStH1wJ'
gizmodo,1179569127754801152,2019-10-03 01:29:30,"b""California's firefighters are getting additional mental health resources in light of climate change\xe2\x80\xa6 https://t.co/D2V1IapeTd"""
gizmodo,1179555934324035584,2019-10-03 00:37:04,"b""Federal safety regulators say they're looking into reports of Tesla Smart Summon crashes https://t.co/4XdV00zQyg https://t.co/sIaYJqQLLI"""
gizmodo,1179550443694899202,2019-10-03 00:15:15,b'What it takes to be a world-record puzzler https://t.co/Oove7KWtxN https://t.co/QJOzXDQetG'
gizmodo,1179547557791457280,2019-10-03 00:03:47,b'A new Treasure Island is in the works from the director of How to Train Your Dragon https://t.co/0bE5wEFwdU https://t.co/8d6oAPPtg1'
gizmodo,1179543774390820866,2019-10-02 23:48:45,b'The sad truth about floppy-eared bunnies https://t.co/dCBbOBtIiW https://t.co/9kIQHLnAgm'
gizmodo,1179537157855305728,2019-10-02 23:22:27,b'U.S. plans to test DNA of immigrants in detention centers https://t.co/MKHlCBcXvh https://t.co/Vr32ZQxApd'
gizmodo,1179534433545834496,2019-10-02 23:11:38,b'WhatsApp vulnerability could have allowed attackers to hijack phones with malicious GIFs https://t.co/JVyikEjrpL https://t.co/JlGmspFcXc'
gizmodo,1179530834312912896,2019-10-02 22:57:20,"b""Brexit sparked a UK man's psychotic episode, doctors say https://t.co/znSP4SdH9u https://t.co/WbzXaR9goa"""
gizmodo,1179522440969510912,2019-10-02 22:23:59,b'Microsoft will still make it hard for you to repair its new repairable Surface laptop https://t.co/hEv7W7nEDR https://t.co/WIzIveWx64'
gizmodo,1179517687149543425,2019-10-02 22:05:05,"b""Turns out typing on a keyboard isn't that much faster than texting these days https://t.co/dvxQ84uZX4 https://t.co/OzVrVK80TE"""
gizmodo,1179514878647779334,2019-10-02 21:53:56,b'Judge rules that supervised injection site planned in Philly is legal https://t.co/1ojRQ6wrRn https://t.co/Oi1bTYuEM7'
gizmodo,1179508367393464320,2019-10-02 21:28:03,"b""A drop in the number of forest fires in the Amazon is likely due to the army's presence and some rain\xe2\x80\xa6 https://t.co/VV3BgZC9T7"""
gizmodo,1179501547144847360,2019-10-02 21:00:57,b'California is prioritizing mental health among firefighters as climate change worsens wildfires\xe2\x80\xa6 https://t.co/OUAxUTQtFm'
gizmodo,1179498832025051141,2019-10-02 20:50:10,b'Hurricane Lorenzo continues to be a meteorological oddity as it steers toward Ireland https://t.co/tpuiAOetWd https://t.co/y6Ya8Ls2ke'
gizmodo,1179495957437792267,2019-10-02 20:38:44,b'Study: Nuclear war between India and Pakistan would trigger global starvation https://t.co/v8axLDaU9G https://t.co/VfXImETlmu'
gizmodo,1179491704602337280,2019-10-02 20:21:50,b'What it takes to be a world-record puzzler https://t.co/VhR3lbtxuO https://t.co/2udOiVSuLO'
gizmodo,1179488464032718848,2019-10-02 20:08:58,b'Boeing engineer filed ethics complaint over scrapped 737 Max safety system\nhttps://t.co/1bwCXnHebg https://t.co/cEmuqDtctH'
gizmodo,1179483192891445249,2019-10-02 19:48:01,"b""The Surface Pro X's ARM-based SQ1 chip is the most important piece of tech to come out of today's #MicrosoftEvent\xe2\x80\xa6 https://t.co/phPcrgPTfD"""
gizmodo,1179479688835686400,2019-10-02 19:34:06,b'Would finding life on Mars really change anything? https://t.co/lU661r2Vkq https://t.co/K6YusluQ3e'
gizmodo,1179472059686117377,2019-10-02 19:03:47,b'Google is baking-in a tool to help break your terrible password habits https://t.co/Ftn26mLAOK https://t.co/2M5nuc2qmq'
gizmodo,1179467787590410240,2019-10-02 18:46:48,"b""Brexit sparked a UK man's psychotic episode, doctors say https://t.co/lpAb6yYlUm https://t.co/rqhnSYZZ0m"""
gizmodo,1179461410855804929,2019-10-02 18:21:28,b'11 clever uses for smart plugs that make them worth buying https://t.co/nLnn6NkVYA https://t.co/tVn7bHRN0Y'
gizmodo,1179453840430637056,2019-10-02 17:51:23,b'The Surface Pro X is a really big deal #MicrosoftEvent https://t.co/rgTWk8pF0V https://t.co/y6cBNG7GfF'
gizmodo,1179452212063473665,2019-10-02 17:44:55,b'The sad truth about floppy-eared bunnies https://t.co/voxP5IJXPX https://t.co/Nt031q0s5t'
gizmodo,1179447065358811139,2019-10-02 17:24:28,"b""Peter Thiel's VC fund to host conference for ideological 'heretics,' maybe summon a ghost or two\xe2\x80\xa6 https://t.co/GUGEd7F5MM"""
gizmodo,1179439008977506304,2019-10-02 16:52:27,b'Boeing engineer filed ethics complaint over scrapped 737 Max safety system\nhttps://t.co/2uO1R0zQIU https://t.co/Kcqrh58kRo'
gizmodo,1179433920036851712,2019-10-02 16:32:14,"b'Hurricane Lorenzo blasts the Azores, sets its sights on Ireland https://t.co/yD56GQWsMj https://t.co/eFMLjZDLam'"
gizmodo,1179430791962599425,2019-10-02 16:19:48,"b""The U.S. Air Force launched an unarmed nuclear missile this morning just hours after North Korea's latest missile t\xe2\x80\xa6 https://t.co/vkFbmDtpJZ"""
gizmodo,1179426712888791041,2019-10-02 16:03:35,"b'Fewer fires burned the Amazon in September, but deforestation continues https://t.co/wgLO2aJjpr https://t.co/mZaBwwkr0P'"
gizmodo,1179424049648287744,2019-10-02 15:53:00,"b""The Surface phone is real, and it's called the Duo #MicrosoftEvent https://t.co/pGLOsPpX2r https://t.co/J2qOMHyXsW"""
gizmodo,1179421011571331072,2019-10-02 15:40:56,"b""We're heading into the hands-on room to get our first look at all of the new products announced at today's\xe2\x80\xa6 https://t.co/FM9MRjgHOK"""
gizmodo,1179419889095852032,2019-10-02 15:36:28,"b""What we know about the Microsoft Surface Duo:\n\n- It's like a tinier version of the Neo, except it's also a phone.\n-\xe2\x80\xa6 https://t.co/DUWPxIpHDL"""
gizmodo,1179419191805386752,2019-10-02 15:33:42,"b""What we know about the Microsoft Surface Neo:\n\n- It's a foldable, dual-screen tablet.\n- It's 5.6mm thin, weighs les\xe2\x80\xa6 https://t.co/UzgKnofi76"""
gizmodo,1179417939436589056,2019-10-02 15:28:43,b'Look at these dual-screen buddies #MicrosoftEvent https://t.co/K3hKArZje8'
gizmodo,1179417342834597889,2019-10-02 15:26:21,"b""They're partnering with Google to bring Android to the Surface Duo #MicrosoftEvent https://t.co/TrRnlRrklh"""
gizmodo,1179416838939250689,2019-10-02 15:24:21,"b""The Surface Phone is real, and it's called Surface Duo #MicrosoftEvent https://t.co/99AzPvogtP"""
gizmodo,1179416389452480512,2019-10-02 15:22:34,b'Microsoft Surface Neo: Woah! #MicrosoftEvent https://t.co/KqkNN0mAC6 https://t.co/YLqsZSqq9h'
gizmodo,1179414314081492993,2019-10-02 15:14:19,"b'Check out the Surface Neo, with super-thin, super-small dual screens #MicrosoftEvent https://t.co/v50oWbpUM9'"
gizmodo,1179412940690251776,2019-10-02 15:08:52,"b""Turns out typing on a keyboard isn't that much faster than texting these days https://t.co/oXGtxvvoFF https://t.co/LplZLVJs4p"""
gizmodo,1179412676860108800,2019-10-02 15:07:49,b'Surface Neo you say? #MicrosoftEvent https://t.co/vrAhUzzVhW'
gizmodo,1179412012008460294,2019-10-02 15:05:10,b'Everything we know about the Surface Pro X:\n- Powered by a custom Surface SQ1 processor.\n- Weighs 1.68 pounds.\n- LT\xe2\x80\xa6 https://t.co/2l0hNAnB9e'
gizmodo,1179411441323069441,2019-10-02 15:02:54,"b""Here's what you need to know about the Microsoft Surface Earbuds:\n- Real-time captions with dictation that allows y\xe2\x80\xa6 https://t.co/W3S8QliYck"""
gizmodo,1179410271124758529,2019-10-02 14:58:15,b'AMD actually did it #MicrosoftEvent https://t.co/i92YnB1HYM https://t.co/UGBc0BKYnr'
gizmodo,1179409939757973516,2019-10-02 14:56:56,"b""We're also getting an Adobe Fresco demo on the Surface Pro X #MicrosoftEvent https://t.co/QzjRik0Ifw"""
gizmodo,1179408577468993536,2019-10-02 14:51:31,b'PEN!!!1! #MicrosoftEvent https://t.co/QRJQKy3zA0'
gizmodo,1179406291678171137,2019-10-02 14:42:26,"b'While we get that earbuds post together for you, Panos is back on stage talking about the Surface Pro X\xe2\x80\xa6 https://t.co/xvLWAh6w5C'"
gizmodo,1179405428691755009,2019-10-02 14:39:01,"b""We're digging into the new Surface Earbuds, which can translate in PowerPoint as you speak in real time.\xe2\x80\xa6 https://t.co/Pk8A4xl2SR"""
gizmodo,1179405045630210048,2019-10-02 14:37:29,"b""Here's what we know about the new Surface Pro 7:\n- USB-C port.\n- New studio mics for capturing better sound for voi\xe2\x80\xa6 https://t.co/YWTrAkoLbb"""
gizmodo,1179403626156056579,2019-10-02 14:31:51,b'All the new Microsoft Surface goodies announced today #MicrosoftEvent https://t.co/Omhnt3uwOP https://t.co/8lUvybskIw'
gizmodo,1179403321284726784,2019-10-02 14:30:38,"b""Here's what we know about the new Surface Laptop 3:\n- There's both a 13.5- and 15-inch model.\n- You can remove the\xe2\x80\xa6 https://t.co/uLO853OEDQ"""
gizmodo,1179401983247224833,2019-10-02 14:25:19,"b""Okay! Let's talk about the Surface Pro 7 #MicrosoftEvent https://t.co/YvsraWmdVA"""
gizmodo,1179401932802265088,2019-10-02 14:25:07,b'11 clever uses for smart plugs that make them worth buying https://t.co/Vil8sMYFms https://t.co/RFG5CAetG0'
gizmodo,1179400733751418880,2019-10-02 14:20:21,b'This Baby Boomer in Florida was caught on Ring surveillance video cutting the brake lines of e-scooters\xe2\x80\xa6 https://t.co/ynuILvoj8X'
gizmodo,1179400222994292736,2019-10-02 14:18:20,"b""We're rounding up all of the details about the new Surface Laptop, but here's a preview #MicrosoftEvent https://t.co/NNy5q0ijVG"""
gizmodo,1179398895606087683,2019-10-02 14:13:03,b'FIRST UP (finally): Surface Laptop! #MicrosoftEvent https://t.co/yj2qUOnYpm'
gizmodo,1179398423138750468,2019-10-02 14:11:10,b'this is immersive theater'
gizmodo,1179397957671686146,2019-10-02 14:09:19,"b""@evleaks each of us.... needs to hear what's being announced #MicrosoftEvent"""
gizmodo,1179396555977187328,2019-10-02 14:03:45,"b""@evleaks Let's sit with these rumors for a minute and see what we're going to get #MicrosoftEvent https://t.co/zurSUbATxy"""
gizmodo,1179396117823442946,2019-10-02 14:02:01,b'@evleaks We could also be seeing some AMD processors... #MicrosoftEvent https://t.co/ssUTNKolZa'
gizmodo,1179395902001307650,2019-10-02 14:01:09,"b""While we wait for the event to start, let's talk rumors: \n\nPhotos from noted leaker @evleaks may give insight into\xe2\x80\xa6 https://t.co/0lxmweOKB4"""
gizmodo,1179395455152726016,2019-10-02 13:59:23,"b""Good morning from the #MicrosoftEvent!\n\nFollow along with us here as we wait to see what's new in the world of Surf\xe2\x80\xa6 https://t.co/wjVqOjPfnu"""
gizmodo,1179394419209969664,2019-10-02 13:55:16,"b""Waiting for the #MicrosoftEvent to start? Here's some of what we think we'll see announced this morning\xe2\x80\xa6 https://t.co/g6b3infZW5"""
gizmodo,1179389744393965575,2019-10-02 13:36:41,b'.... including our social media editor'
gizmodo,1179385574018473984,2019-10-02 13:20:07,b'Twitter on mobile and web is back to normal but some users report Tweetdeck is still borked https://t.co/MUt5TODYfX https://t.co/Kna00BcyHR'
gizmodo,1179384041717616640,2019-10-02 13:14:02,"b""Microsoft's Surface event is starting in less than an hour. Here's some of what we're expecting to see today:\xe2\x80\xa6 https://t.co/LKFZEQRlLd"""
gizmodo,1179382213684744193,2019-10-02 13:06:46,b'Would finding life on Mars really change anything? https://t.co/SjHoFPIdyY https://t.co/K4Ad9vNxwn'
gizmodo,1179377533239861256,2019-10-02 12:48:10,"b""Peter Thiel's VC fund to host conference for ideological 'heretics,' maybe summon a ghost or two\xe2\x80\xa6 https://t.co/jZyKY4ENnt"""
gizmodo,1179370869958860800,2019-10-02 12:21:41,b'We may have been thinking about carbon pricing all wrong https://t.co/WJSVBl49PM https://t.co/UPCvt4UNyI'
gizmodo,1179367954019958784,2019-10-02 12:10:06,"b""U.S. Air Force tests unarmed nuclear missile following North Korea's latest missile launch https://t.co/yRGuPH3XIL https://t.co/6ccLdAWs9n"""
gizmodo,1179366153044549637,2019-10-02 12:02:57,b'Google is baking-in a tool to help break your terrible password habits https://t.co/SUk8r8JqSj https://t.co/XsV8J6FEHq'
gizmodo,1179362370608664576,2019-10-02 11:47:55,"b""It's the most wonderful time of the year https://t.co/66gONRQWTA https://t.co/esAVQWiwXT"""
gizmodo,1179357619590443008,2019-10-02 11:29:02,"b""Sure sounds like things aren't going well for Facebook's Libra cryptocurrency scheme https://t.co/NbMPik00Ke"""
gizmodo,1179351133707542529,2019-10-02 11:03:16,"b""It's not just you: Twitter and Tweetdeck experiencing technical problems around the world https://t.co/gVVw2P7Ds0 https://t.co/B7aBqX6Zko"""
gizmodo,1179346585987272704,2019-10-02 10:45:11,"b""Here are five reasons why you shouldn't feel guilty for upgrading to the iPhone 11 https://t.co/klzXwulNuq"""
gizmodo,1179343689480577024,2019-10-02 10:33:41,b'The trailer for Trick makes some bold proclamations about its place in horror https://t.co/5htU2BwcMl https://t.co/j6UTcuOBHb'
gizmodo,1179335525997649925,2019-10-02 10:01:15,b'Florida Boomer caught on video cutting brake lines of public e-scooters https://t.co/ESgWw60LET https://t.co/wWnkR3nPLn'
gizmodo,1179245690041622528,2019-10-02 04:04:16,"b'Trump administration takes the axe to federal marine life, invasive species advisory boards https://t.co/yPtq4dPJjU https://t.co/bTMAJ77FFI'"
gizmodo,1179193756362387462,2019-10-02 00:37:54,"b""Here's one for the Syfy channel\xe2\x80\x94a real-life fungnami https://t.co/teBd7RsnQT https://t.co/Oe1uhdQPg7"""
gizmodo,1179190157725097984,2019-10-02 00:23:36,b'The trailer for Trick makes some bold proclamations about its place in horror https://t.co/8Vn4Nx7V9Z https://t.co/INRzhrhnps'
gizmodo,1179185389246013446,2019-10-02 00:04:39,b'Carbon taxes are some of the bedrock of climate policy. We may be thinking about them backasswards\xe2\x80\xa6 https://t.co/80iCQiUqhF'
gizmodo,1179182579385344001,2019-10-01 23:53:29,"b""Appeals court upholds FCC's net neutrality repeal, says order wrongly banned states from passing own laws\xe2\x80\xa6 https://t.co/PNGg6AR0Ou"""
gizmodo,1179175271502667779,2019-10-01 23:24:27,"b""UPS gets FAA approval to run America's first drone delivery airline\nhttps://t.co/4TVvfKku6a https://t.co/BSXoXJJ6IA"""
gizmodo,1179166929262653441,2019-10-01 22:51:18,b'Global energy-related carbon emissions may rise due to an unexpected source https://t.co/uQZZ3n9q1g https://t.co/oY9gVYd8DX'
gizmodo,1179162110472982528,2019-10-01 22:32:09,"b""Trump campaign stole artist's music for new Facebook ad, record label says https://t.co/w9ps1mSDca https://t.co/OXBCebDm5b"""
gizmodo,1179158137145827329,2019-10-01 22:16:22,b'Human fetuses develop lizard-like body parts that disappear before birth https://t.co/W9n7qXbdVY https://t.co/HiKkekbjmd'
gizmodo,1179152735884718080,2019-10-01 21:54:54,"b""We tried out Nintendo's new game for the Switch that makes you get up and break a sweat. https://t.co/tohynJv5rr"""
gizmodo,1179149636755480576,2019-10-01 21:42:35,b'Fat Bear Week is back https://t.co/xXO6fY3hiw https://t.co/Z8aEa5ol6k'
gizmodo,1179146414250713092,2019-10-01 21:29:47,"b""A story about two tiny, fuzzy photos of a 'PlayStation 5 prototype' https://t.co/TA6mkHeiha https://t.co/JAaEkzyCwL"""
gizmodo,1179141391034781696,2019-10-01 21:09:49,b'Garmin adds a tacticool military-style option to its luxury smartwatch line https://t.co/cOhAWoN9AE https://t.co/UpeJdMrJ6c'
gizmodo,1179135464428756993,2019-10-01 20:46:16,"b""Looking to upgrade to the iPhone 11? Here's five things you need to know before dropping $700.\n\nMore here:\xe2\x80\xa6 https://t.co/3zqBW7b1h8"""
gizmodo,1179133273378902016,2019-10-01 20:37:34,"b'The new World War I movie ""1917"" was edited to be one continuous shot that plays in real-time\xe2\x80\xa6 https://t.co/kCJef3dGNt'"
gizmodo,1179130341438754816,2019-10-01 20:25:55,"b""UPS gets FAA approval to run America's first drone delivery airline\nhttps://t.co/K1h5CF1FD2 https://t.co/TOHwktiFIT"""
gizmodo,1179126633556566016,2019-10-01 20:11:11,b'A 1964 earthquake might have unleashed a deadly fungus on the Pacific Northwest https://t.co/LvuGpZgD7Z https://t.co/qKXQ9sor8e'
gizmodo,1179119025714073600,2019-10-01 19:40:57,b'A gigantic iceberg has broken off Antarctica https://t.co/L4RexI2qWX https://t.co/L9ItaYJ6w1'
gizmodo,1179116472448290821,2019-10-01 19:30:48,b'GoPro tries that 360-degree camera thing again https://t.co/zUbOu30tgC https://t.co/YJAed8NstW'
gizmodo,1179113851557691395,2019-10-01 19:20:23,"b""A story about two tiny, fuzzy photos of a 'PlayStation 5 prototype' https://t.co/GZl0FQO0xg https://t.co/hrmIkrnTxa"""
gizmodo,1179113843798269958,2019-10-01 19:20:21,b'Ex-Yahoo engineer pleads guilty to hacking thousands of accounts to search for nude photos\nhttps://t.co/XBPokXqOs3 https://t.co/h3ZGMmrbsx'
gizmodo,1179105666386010112,2019-10-01 18:47:52,b'Bosch hopes triggering explosions will actually make electric cars safer when they crash https://t.co/ZheE5QULWv https://t.co/fFvHhkcseZ'
gizmodo,1179099840824987653,2019-10-01 18:24:43,b'The right to repair busted appliances is getting a big boost in Europe\nhttps://t.co/BFFAVN2Omw https://t.co/TiiySpESYo'
gizmodo,1179097162019479554,2019-10-01 18:14:04,"b""Trump campaign stole artist's music for new Facebook ad, record label says https://t.co/8wEDoLhJCh https://t.co/iyh0zZZgqw"""
gizmodo,1179096211288154117,2019-10-01 18:10:17,"b""Leaked audio of Mark Zuckerberg reveals Facebook's plan to sue the U.S. government if Elizabeth Warren tries to bre\xe2\x80\xa6 https://t.co/9Tgx9W2WgI"""
gizmodo,1179093385895989251,2019-10-01 17:59:04,b'Garmin adds a tacticool military-style option to its luxury smartwatch line https://t.co/JZzLOO3gI6 https://t.co/aoOD0c4Fo4'
gizmodo,1179092453703462913,2019-10-01 17:55:22,b'Game subscriptions have never been cheaper https://t.co/0UBbq88M4W https://t.co/NyXbnHpmAy'
gizmodo,1179088906983071744,2019-10-01 17:41:16,"b""Microsoft's barrage of new Surface products come into focus\nhttps://t.co/GZbVBbeO1e https://t.co/5XntPrIwbS"""
gizmodo,1179085335994732544,2019-10-01 17:27:05,b'Worrying report shows global energy-related emissions may increase through 2050 https://t.co/PV3303rhTw https://t.co/0Ga0myOz4i'
gizmodo,1179082387369709569,2019-10-01 17:15:22,"b""GoPro Hero8 Black's big trick is disappearing behind the action https://t.co/BgsCuOWvsV https://t.co/geymP6UeKC"""
gizmodo,1179078676408877058,2019-10-01 17:00:37,"b'FCC cannot ban states from passing their own net neutrality rules, an appeals court ruled in a decision that upheld\xe2\x80\xa6 https://t.co/nfLMPsFRGe'"
gizmodo,1179075811145605120,2019-10-01 16:49:14,b'Weather whiplash is hitting the U.S. https://t.co/NGJofgKHM6 https://t.co/EdZwW9AENh'
gizmodo,1179073781463179265,2019-10-01 16:41:10,"b'The new World War I movie ""1917"" was edited to be one continuous shot that plays in real-time\xe2\x80\xa6 https://t.co/DnZ9ZRm87V'"
gizmodo,1179072915008102402,2019-10-01 16:37:43,"b'We want to hear ALL of your bad ideas. Join us on 10/4 at @caveatnyc for a night of absurd problem solving, with XK\xe2\x80\xa6 https://t.co/oJ4xYXAGjW'"
gizmodo,1179070300971061254,2019-10-01 16:27:20,b'The right to repair busted appliances is getting a big boost in Europe\nhttps://t.co/M3lso1bHjQ https://t.co/QURdb4vqXC'
gizmodo,1179067104588419072,2019-10-01 16:14:38,b'The new cheap iPad is better than ever https://t.co/XPE8YZT6Ej https://t.co/jtKD4Nj04H'
gizmodo,1179060001698205696,2019-10-01 15:46:24,b'Bosch hopes triggering explosions will actually make electric cars safer when they crash https://t.co/NjVUzwtf7Y https://t.co/WsCDcxvqQp'
gizmodo,1179057067916693504,2019-10-01 15:34:45,"b""Microsoft's barrage of new Surface products come into focus\nhttps://t.co/sSmb8v1k4j https://t.co/OWapN9xRBF"""
gizmodo,1179054216058490880,2019-10-01 15:23:25,b'GoPro gets weird with the Hero Max 360 camera https://t.co/pkaFvUINAw https://t.co/SBuJg3tstA'
gizmodo,1179049838949863424,2019-10-01 15:06:01,b'Ex-Yahoo engineer pleads guilty to hacking thousands of accounts to search for nude photos\nhttps://t.co/vxRX5SO0Tg https://t.co/DiUo0dgwp2'
gizmodo,1179044250526392320,2019-10-01 14:43:49,b'A gigantic iceberg has broken off Antarctica https://t.co/sTOdaEZJhi https://t.co/6INhdFU1Bf'
gizmodo,1179041605967331328,2019-10-01 14:33:19,b'Viral video shows Hong Kong Police shooting 18-year-old protester in the chest https://t.co/IkbJSoxLZN https://t.co/TbJmBEK5Ut'
gizmodo,1179038763667771393,2019-10-01 14:22:01,b'Game subscriptions have never been cheaper https://t.co/6MvTQfO3OH https://t.co/c59m3G8Prv'
gizmodo,1179031677613563904,2019-10-01 13:53:51,"b""Leaked Zuckerberg audio reveals Facebook's plan to sue the U.S. government if Elizabeth Warren tries to break up Bi\xe2\x80\xa6 https://t.co/CQRQSe7VV4"""
gizmodo,1179021853907673090,2019-10-01 13:14:49,"b""President Trump's lies are finally called out in rare statement from U.S. intelligence community watchdog\xe2\x80\xa6 https://t.co/teavccDkB0"""
gizmodo,1179020714705379328,2019-10-01 13:10:18,"b""GoPro's new Hero8 Black is like its predecessors\xe2\x80\x94but better. And that's what makes it great.\n\nMore here:\xe2\x80\xa6 https://t.co/vhOTdqWLq0"""
gizmodo,1179018901881004032,2019-10-01 13:03:05,"b""GoPro's new Hero8 Black is boring\xe2\x80\x94and that's what makes it great https://t.co/5UtXhGdTKR https://t.co/kPgIvu5qCd"""
gizmodo,1179012161357647873,2019-10-01 12:36:18,b'The case for learning to live with blocking the sun and sucking carbon out of the air https://t.co/teZnoGchFe https://t.co/P2DW4AXumc'
gizmodo,1178988934786899970,2019-10-01 11:04:01,b'Viral video shows Hong Kong Police shooting teen protester in the chest https://t.co/Jr2ZaaBrTu https://t.co/knwA3UOCCI'
gizmodo,1178982038877147136,2019-10-01 10:36:37,"b""Netflix's latest film is an award-winning animation about a severed hand, here's the trailer https://t.co/jdjohXSkuo https://t.co/N80CSRXkrv"""
gizmodo,1178965764642091008,2019-10-01 09:31:57,"b""President Trump's lies are finally called out in rare statement from U.S. intelligence community watchdog\xe2\x80\xa6 https://t.co/IrAA3LbjAD"""
gizmodo,1178938645757255680,2019-10-01 07:44:11,"b""Watch Steve Jobs assure Americans in 1981 that computers wouldn't be a privacy nightmare https://t.co/v3C33JXNub https://t.co/E5vUWlNNyy"""
gizmodo,1178883850740621312,2019-10-01 04:06:27,"b""Unruly airport cart tries to ram plane at O'Hare, is promptly sideswiped by worker driving another one\xe2\x80\xa6 https://t.co/h3009RGK1A"""
gizmodo,1178871247607865344,2019-10-01 03:16:22,b'Fake Lightning cables that can hijack connected devices are heading for mass production https://t.co/iJ1uEWs5CY https://t.co/Qb235j8eYc'
gizmodo,1178862277891624960,2019-10-01 02:40:43,"b""If you're working in America, your chances of getting enough sleep are steadily dropping over time, according to a\xe2\x80\xa6 https://t.co/MMFUPyLuy6"""
gizmodo,1178839128194129921,2019-10-01 01:08:44,b'Words With Friends data allegedly stolen in breach that could affect 218 million users\nhttps://t.co/QNvyCk8uod https://t.co/npxv1iWqHi'
gizmodo,1178833246618042373,2019-10-01 00:45:22,"b""Netflix's latest film is an award-winning animation about a severed hand, here's the trailer https://t.co/AcEjdsCix2 https://t.co/6BAJhaKYM1"""
gizmodo,1178825617539829760,2019-10-01 00:15:03,"b""Here's what the most recent FBI crime stats can actually tell us https://t.co/AVtZvQVWAR https://t.co/4PHmbkBD5b"""
gizmodo,1178811703724843010,2019-09-30 23:19:46,b'\xe2\x80\x98Magic mushroom\xe2\x80\x99 chemical harvested from bacteria for the first time https://t.co/ewWlSJPO1B https://t.co/EEpebU0wFt'
gizmodo,1178805424826585089,2019-09-30 22:54:49,b'What would it be like to live in an era of geoengineering? https://t.co/3HVbSldDFd https://t.co/QrcK874HUK'
gizmodo,1178802582346719232,2019-09-30 22:43:31,b'CVS and Walgreens pull heartburn drug Zantac from shelves over FDA carcinogen warning https://t.co/SQuOHyFGtm https://t.co/NuHDKvyVV2'
