gizmodo,1196605898501869568,2019-11-19 01:47:32,b'Democrats press for major election security boost as budget battle wages on https://t.co/WnNPz2DtxD https://t.co/oBeXE7JEuE'
gizmodo,1196597861644984321,2019-11-19 01:15:36,b'The state of the art in toilet technology Is lube\nhttps://t.co/ra4Jz2wDzE https://t.co/JsxfGWhdRm'
gizmodo,1196590230901538817,2019-11-19 00:45:17,b'TikTok owner reportedly expanding its empire into music subscriptions https://t.co/tygIfz2AS7 https://t.co/PSND5VQFkt'
gizmodo,1196581836941660160,2019-11-19 00:11:55,"b'Hey Roku, maybe user-created screensavers are a bad idea\nhttps://t.co/D0PnxUPHtx https://t.co/piRehx3xwo'"
gizmodo,1196574315388510209,2019-11-18 23:42:02,b'The future of Apple innovation is backwards https://t.co/iKJy664KLL'
gizmodo,1196569855127904258,2019-11-18 23:24:19,b'A chunk of the Amazon the size of Delaware and Rhode Island disappeared this year under Jair Bolsonaro\xe2\x80\xa6 https://t.co/KnrzS1NCGB'
gizmodo,1196566261787967489,2019-11-18 23:10:02,b'The state of the art in toilet technology Is lube\nhttps://t.co/GPWzDNwafk https://t.co/HMGC89PU27'
gizmodo,1196563505073336321,2019-11-18 22:59:05,b'Democrats press for major election security boost as budget battle wages on https://t.co/krcDUH16rU https://t.co/WOk9LIahIy'
gizmodo,1196561310923841537,2019-11-18 22:50:22,b'So this is the future of Apple innovation? https://t.co/ljXC6ezXH6'
gizmodo,1196555409848442880,2019-11-18 22:26:55,"b'Hey Roku, maybe user-created screensavers are a bad idea\nhttps://t.co/ehDco9ud4F https://t.co/pBto5tmrw7'"
gizmodo,1196552747233005570,2019-11-18 22:16:20,"b""Here's what to do if you want to use Google Stadia https://t.co/umxuSsFwZj https://t.co/eAb8cBI6J8"""
gizmodo,1196544668286226434,2019-11-18 21:44:14,b'Instagram investigating app that allowed users to peek into private accounts\nhttps://t.co/F9fnucTCWC https://t.co/qABIxHFzm4'
gizmodo,1196529555592372230,2019-11-18 20:44:11,"b""It's eagle cam time! https://t.co/UcU3D0D9dg https://t.co/0POFdQj3x0"""
gizmodo,1196520984402124800,2019-11-18 20:10:07,b'Conservation without considering people could be a disaster https://t.co/To1G2st1Mk https://t.co/Icj0235LOq'
gizmodo,1196513886951923714,2019-11-18 19:41:55,b'How to turn your smart speaker into a white noise generator https://t.co/nzvCsXBteR'
gizmodo,1196505962821144576,2019-11-18 19:10:26,"b'The Amazon is fucked under Bolsonaro, new data confirms https://t.co/mBNuc5qtmG https://t.co/8CzZ6u4J8x'"
gizmodo,1196502619709231105,2019-11-18 18:57:09,b'TikTok owner reportedly expanding its empire into music subscriptions https://t.co/R3yosFCuod https://t.co/3IVtNjmC5r'
gizmodo,1196499857726414849,2019-11-18 18:46:10,b'T-Mobile CEO John Legere is stepping down https://t.co/vfprkGgYlJ https://t.co/wrGzsKG7Nv'
gizmodo,1196489050670145541,2019-11-18 18:03:14,"b""Is your internet fast enough for Google Stadia? If not, there's still hope https://t.co/SSz8CIhyNf https://t.co/kusYx1F1qq"""
gizmodo,1196485349222076417,2019-11-18 17:48:31,b'Instagram investigating app that allowed users to peek into private accounts\nhttps://t.co/Zn6qK5i3E9 https://t.co/ICaVndTiSs'
gizmodo,1196482395245072387,2019-11-18 17:36:47,b'What causes foggy brain?\nhttps://t.co/QBiXov4p3l https://t.co/hpdXVzDlDd'
gizmodo,1196474645240782848,2019-11-18 17:05:59,b'Why we need to consider the human toll of conserving half the Earth https://t.co/YZkFhnKjZR https://t.co/i1FnJ56chT'
gizmodo,1196470950088388610,2019-11-18 16:51:18,"b""A woman's 'velvety' palms revealed her lung cancer https://t.co/aamPly2fJ4"""
gizmodo,1196456278505250818,2019-11-18 15:53:00,b'President Trump is terrified that banning flavored vapes might cost him votes https://t.co/v7sbRuEtsb https://t.co/tUdCpsX4Yi'
gizmodo,1196448376981774336,2019-11-18 15:21:36,b'How to turn your smart speaker into a white noise generator https://t.co/brG9tBU19o'
gizmodo,1196439429507928064,2019-11-18 14:46:03,b'T-Mobile CEO John Legere is stepping down https://t.co/5fatY3crnh https://t.co/AijKRnwfFu'
gizmodo,1196418361082679296,2019-11-18 13:22:20,b'What causes foggy brain?\nhttps://t.co/4h0BuHXA0x https://t.co/9B26tdY9rI'
gizmodo,1196394236641497088,2019-11-18 11:46:28,b'President Trump is terrified that banning flavored vapes might cost him votes https://t.co/VeNx2DZsyJ https://t.co/eUxfE8vCMs'
gizmodo,1196276667054002176,2019-11-18 03:59:17,b'Hemorrhaging WeWork is now fielding SEC probe according to a new report. https://t.co/EoD8m6qBuA'
gizmodo,1196261545245913089,2019-11-18 02:59:12,"b'This week, Gizmodo got the scoop on a new federal public comment system, reviewed the AirPods Pro and Disney Plus,\xe2\x80\xa6 https://t.co/AemvhuddPZ'"
gizmodo,1196234730422906880,2019-11-18 01:12:39,"b""On Monday, the Pentagon will add two weeks to Huawei's interim trading license with a longer extension currently in\xe2\x80\xa6 https://t.co/9p3WenCYXZ"""
gizmodo,1196214948436856832,2019-11-17 23:54:02,b'WeWork reportedly knew about its toxic phone booths for months\nhttps://t.co/Ulf4jwZh22 https://t.co/fYVMMzLQJG'
gizmodo,1196207748368805888,2019-11-17 23:25:26,b'https://t.co/Nn0fUVlM4b'
gizmodo,1196204827434459137,2019-11-17 23:13:49,b'Hemorrhaging WeWork is now fielding SEC probe according to a new report. https://t.co/QkCbESpWMv'
gizmodo,1196199850582433793,2019-11-17 22:54:03,"b""Thieves post photos of stolen cars to 'Mr. Dingers' Instagram account, go to prison https://t.co/Kigh9aPcoe https://t.co/4ASLsuNPf3"""
gizmodo,1196184748718280705,2019-11-17 21:54:02,b'The very best smart home gadgets https://t.co/J8IlrRFVjH https://t.co/gDWJyPqiji'
gizmodo,1196169404607803392,2019-11-17 20:53:04,b'Everything to know about Disney+ https://t.co/3THAS0DMhv https://t.co/zCtJQCGEpD'
gizmodo,1196154304467484673,2019-11-17 19:53:04,b'The best phones you can buy right now https://t.co/tMxCENXwd8 https://t.co/slOvto2Agm'
gizmodo,1196139194256637953,2019-11-17 18:53:01,"b""A brief explanation of Facebook's scary new iPhone bug https://t.co/d9V80BrI5r"""
gizmodo,1196124104014868481,2019-11-17 17:53:03,"b""I hope PayPal's dick falls off https://t.co/ryRyjrdXl3 https://t.co/vjSw1XCatc"""
gizmodo,1196108999214731264,2019-11-17 16:53:02,b'The flip phone is back with the new all-display Motorola Razr https://t.co/dO6e1w2uvB https://t.co/uzMSP8bIix'
gizmodo,1196093921018941440,2019-11-17 15:53:07,b'The best streaming service you can subscribe to right now https://t.co/5LKBQsQn4N https://t.co/yKA2P03g1H'
gizmodo,1196078564891860994,2019-11-17 14:52:06,b'Have some porn for your ears https://t.co/7WUzb109Nt https://t.co/u3hJrdBQv9'
gizmodo,1196010699534819328,2019-11-17 10:22:26,b'Microsoft will shut down its voice assistant Cortana in certain markets beginning January 31. https://t.co/OuVGiLNKxh'
gizmodo,1195860458831589376,2019-11-17 00:25:26,"b'So long, Cortana. https://t.co/yxanxSrhl7'"
gizmodo,1195852066964541442,2019-11-16 23:52:05,b'Mother who allegedly starved and pepper-sprayed her YouTuber children dies in hospital\nhttps://t.co/eFcDychKah https://t.co/fza6G5Vaei'
gizmodo,1195836963988881409,2019-11-16 22:52:04,"b""How to get your free year of Disney+ if you're a Verizon customer https://t.co/Kok3ANQ4S4 https://t.co/JjTg5tIuMG"""
gizmodo,1195821860828651521,2019-11-16 21:52:03,"b""Yep, there's a giant new MacBook Pro, and yep, Apple improved its keyboard https://t.co/XoLOVhvY3x https://t.co/CC4G6NM8ew"""
gizmodo,1195806771920752640,2019-11-16 20:52:06,b'We finally know what games are launching with Stadia https://t.co/fTkmEBzFM4 https://t.co/B1JXS7JHaY'
gizmodo,1195791670429855746,2019-11-16 19:52:05,b'The best way to send huge files to other people https://t.co/YfTaqfUmFr'
gizmodo,1195776356237361152,2019-11-16 18:51:14,"b""I'm willing to pay an obscene amount of money for this guy's brilliant pedestrian car horn invention\xe2\x80\xa6 https://t.co/i0bQdcqFh5"""
gizmodo,1195761206776217600,2019-11-16 17:51:02,"b'Polish Prime Minister implores Netflix to change Nazi documentary ""The Devil Next Door""\nhttps://t.co/DMQDPHT3OW https://t.co/uJsFmon0mp'"
gizmodo,1195761202871373824,2019-11-16 17:51:01,"b'Allow me to criticize the AirPods Pro, which I love https://t.co/mh0pzNazQf'"
gizmodo,1195731018692669440,2019-11-16 15:51:05,"b""Netflix's chosen fighter to take on Disney+ is, uh, Nickelodeon https://t.co/RuPgHJRQOH https://t.co/QFMLQpwO8B"""
gizmodo,1195715668336885760,2019-11-16 14:50:05,"b""Here's why Netflix is leaving some Roku and Samsung devices https://t.co/oNlKFVEV9u https://t.co/iKUHc2lbK2"""
gizmodo,1195709609425735682,2019-11-16 14:26:00,"b'Sorry, Hulu users, your Live TV plan just got a lot more expensive https://t.co/6r7I2lWeEN https://t.co/i6jUq3WVRD'"
gizmodo,1195698845331705857,2019-11-16 13:43:14,b'RIP iOS vaping apps https://t.co/JIoZlgAGST https://t.co/YwrcS7LK5h'
gizmodo,1195672157684150272,2019-11-16 11:57:11,"b""The first batch of data from NASA's Sun-visiting probe is now available to the public https://t.co/DLy0QYWEmY https://t.co/hX61zXBRMF"""
gizmodo,1195529109453049856,2019-11-16 02:28:46,"b""A woman's 'velvety' palms revealed her lung cancer https://t.co/qEGWl2CRzA"""
gizmodo,1195521258160566277,2019-11-16 01:57:34,"b""Google's had it up to here with the leaks, leaked email shows https://t.co/Ff2eMynwgp https://t.co/V7xitTkC9R"""
gizmodo,1195507804574035969,2019-11-16 01:04:06,"b""Bolivia's coup is the latest event to roil the world ahead of important international climate talks. Here's why it\xe2\x80\xa6 https://t.co/rLSopwIZ5W"""
gizmodo,1195499708594237440,2019-11-16 00:31:56,"b'China may be concealing organ harvesting through fake donation data, scientists report https://t.co/utUzgStf41 https://t.co/2XbNCH1Fut'"
gizmodo,1195495242537086976,2019-11-16 00:14:11,"b'You can now buy pretend food for your $2,900 Sony robot dog https://t.co/uXNZlR9vyU https://t.co/oSWQNLJtp7'"
gizmodo,1195488419591458824,2019-11-15 23:47:04,b'Pro-Trump goof dodges question on Trump impeachment tweets by taking obviously fake phone call\xe2\x80\xa6 https://t.co/jOzEddSEQw'
gizmodo,1195480460245295104,2019-11-15 23:15:27,"b'Twitter detail its political ad ban as civil rights groups ask, what about the Nazis? https://t.co/Lbo5cK2ABs https://t.co/z5cRqwu6Xm'"
gizmodo,1195477417030238208,2019-11-15 23:03:21,"b""The first batch of data from NASA's Sun-visiting probe is now available to the public https://t.co/MeUj9NOWPa https://t.co/Lp9iJeRWru"""
gizmodo,1195473064559026177,2019-11-15 22:46:04,"b'Cancer patients should be treated a lot more like astronauts, scientists argue https://t.co/zpRhP6ZMTZ'"
gizmodo,1195468613068771329,2019-11-15 22:28:22,"b""A woman's 'velvety' palms revealed her lung cancer https://t.co/x5nfVWpxxv"""
gizmodo,1195466068212494336,2019-11-15 22:18:16,"b'Google sure screws around with search results a lot, investigation finds\nhttps://t.co/bZDNBWoneV https://t.co/6hMSsPE2Yb'"
gizmodo,1195462901387202560,2019-11-15 22:05:40,"b""Google's had it up to here with the leaks, leaked email shows https://t.co/jj35WiM4OH https://t.co/UvwYpi4e0I"""
gizmodo,1195458894514020354,2019-11-15 21:49:45,"b""What will be missing at next month's climate talks https://t.co/zvivlsNBra https://t.co/WJhn0IUcHf"""
gizmodo,1195451647461396482,2019-11-15 21:20:57,"b'Netflix will revise Nazi documentary after Poland accuses it of ""rewriting history""\nhttps://t.co/aozSY2eFlN https://t.co/S97lwauGeo'"
gizmodo,1195445173918015488,2019-11-15 20:55:14,"b'You can now buy pretend food for your $2,900 Sony robot dog https://t.co/6dS44nGHJX https://t.co/tPXkv844XQ'"
gizmodo,1195439612191227906,2019-11-15 20:33:08,"b'Report: Here\'s how Tom DeLonge\'s UFO research group got those ""alien alloys"" https://t.co/JYzsl9qJfc https://t.co/WX9FXglK9e'"
gizmodo,1195431931548184577,2019-11-15 20:02:37,b'Just some extremely normal and fine shit https://t.co/6VBe3sruwA https://t.co/cyBCcljk78'
gizmodo,1195422712845520896,2019-11-15 19:25:59,"b'Google sure screws around with search results a lot, investigation finds\nhttps://t.co/ulQEa7P240 https://t.co/pCf6RnccAt'"
gizmodo,1195409720418480129,2019-11-15 18:34:21,b'The best way to send huge files to other people https://t.co/TCFDuLQPJG'
gizmodo,1195407142141988864,2019-11-15 18:24:06,b'Astronauts and cancer patients surprisingly have a lot in common https://t.co/T0molQ0K7K'
gizmodo,1195399437566259201,2019-11-15 17:53:30,"b'China may be concealing organ harvesting through fake donation data, scientists report https://t.co/g6e6lIKRqZ https://t.co/YrnVEcjC4n'"
gizmodo,1195391407785205762,2019-11-15 17:21:35,"b'Netflix will revise Nazi documentary after Poland accuses it of ""rewriting history""\nhttps://t.co/UUsztoGHVG https://t.co/EkrqnGNs5x'"
gizmodo,1195388264871612428,2019-11-15 17:09:06,"b""Some Arctic sea ice is behaving like it's mid-summer https://t.co/n8XsUbRo4X https://t.co/shjoPGVSeh"""
gizmodo,1195380195882078208,2019-11-15 16:37:02,"b'""This is an issue that I live, that I feel a sense of urgency on"" https://t.co/0sBH6NSCSz https://t.co/B4koxoyicz'"
gizmodo,1195355097200570376,2019-11-15 14:57:18,"b'Lawrence G. Paull, the Oscar-nominated visionary behind films like ""Blade Runner"" and ""Back to the Future,"" died th\xe2\x80\xa6 https://t.co/LZjLK0RVlo'"
gizmodo,1195348193615261697,2019-11-15 14:29:52,b'The best way to send huge files to other people https://t.co/QVMDgaZ6fJ'
gizmodo,1195334991259078656,2019-11-15 13:37:24,b'Cory Booker gets the link between climate change and prisons https://t.co/jYrhqrn589 https://t.co/1QKeCYgPkC'
gizmodo,1195322024257884161,2019-11-15 12:45:53,b'This Ohio bill gives students religious exemptions for facts. https://t.co/tNFE3kKsYa'
gizmodo,1195314160793530368,2019-11-15 12:14:38,"b""Congress is increasingly wary about NASA's 2024 Moon landing deadline https://t.co/IYul8UOima https://t.co/bfHZRgtI2e"""
gizmodo,1195306288416272384,2019-11-15 11:43:21,"b""It finally happened: Amazon took its first step in appealing the Pentagon's decision to give the $10 billion JEDI c\xe2\x80\xa6 https://t.co/Q4XHEaHe4l"""
gizmodo,1195215980479336448,2019-11-15 05:44:30,b'This Ohio bill gives students religious exemptions for facts. https://t.co/ark7iv20yK'
gizmodo,1195203906999115776,2019-11-15 04:56:31,"b""I hope PayPal's dick falls off https://t.co/8777zQ5LOD https://t.co/WcyRtD5sON"""
gizmodo,1195187754910519297,2019-11-15 03:52:20,"b'Rev CEO: ""We got a few things wrong""  https://t.co/WDOrIORuo4 https://t.co/QbhyQLQSFM'"
gizmodo,1195179965186297860,2019-11-15 03:21:23,"b'Scientists need 10,000 dog volunteers for very important research https://t.co/oHI6lXs163'"
gizmodo,1195176578558447617,2019-11-15 03:07:56,"b'Amazon cites ""unmistakable bias"" in challenge to Pentagon\'s $10 billion JEDI contract decision. https://t.co/j9O4pkmZOV'"
gizmodo,1195173098879885312,2019-11-15 02:54:06,b'AOC and Bernie just introduced the first plank of the Green New Deal in Congress https://t.co/3Q6LyUFLbp https://t.co/LpYuE7Cs1S'
gizmodo,1195168944270839808,2019-11-15 02:37:36,b'All hail our new ice disk overlord https://t.co/GO5J4Kt0ka https://t.co/BCMEwKGX1u'
gizmodo,1195160788513820673,2019-11-15 02:05:11,b'Researchers created holograms you can feel and hear https://t.co/bKt75iE98H https://t.co/F5RvxgrFk3'
gizmodo,1195153116620046341,2019-11-15 01:34:42,"b'So, is battery life gonna be a problem for the foldable Razr?\nhttps://t.co/V2O6zAyWxf https://t.co/c6xYQCbIzO'"
gizmodo,1195149212129869824,2019-11-15 01:19:11,b'FCC plans to scrap defective system used to post fake net neutrality comments https://t.co/EuciDcL30i'
gizmodo,1195141205492932609,2019-11-15 00:47:22,"b""Thieves post photos of stolen cars to 'Mr. Dingers' Instagram account, go to prison https://t.co/EJwC4rdQ9P https://t.co/8zS6pSbjDW"""
gizmodo,1195137728188493824,2019-11-15 00:33:33,b'Stunning fossil discovery uncovers the second-most primitive flying bird https://t.co/6ylvWt1vLy https://t.co/e9BkopKmWX'
gizmodo,1195134094126014464,2019-11-15 00:19:07,"b""I hope PayPal's dick falls off https://t.co/66TpQuoosU https://t.co/OCoMMCfGLW"""
gizmodo,1195131403643609089,2019-11-15 00:08:25,b'Have some porn for your ears https://t.co/5AZmM3rbqT https://t.co/G4TjAYXvQB'
gizmodo,1195127819380174848,2019-11-14 23:54:11,b'Private equity ghouls buy non-profit that handles .org domains\nhttps://t.co/9QsaiWZp49 https://t.co/uwcjEsmC3e'
gizmodo,1195124582254034944,2019-11-14 23:41:19,"b""We're losing the war against antibiotic resistance https://t.co/2pr9oNejej"""
gizmodo,1195120976163463168,2019-11-14 23:26:59,"b'Rev CEO: ""We got a few things wrong""  https://t.co/8QK4qni0hq https://t.co/Cfh6jBL7Ci'"
gizmodo,1195117712969736196,2019-11-14 23:14:01,"b'So, is battery life gonna be a problem for the foldable Razr?\nhttps://t.co/TnopSCDSwF https://t.co/NUvEPsrzxz'"
gizmodo,1195114447515332609,2019-11-14 23:01:03,b'Calling all good boys and girls https://t.co/s6Ucoj7x1o'
gizmodo,1195107224206684160,2019-11-14 22:32:20,"b'Hell yes, weird ice disk season is upon us https://t.co/nMJzFwZqta https://t.co/6UVv5lcUQx'"
gizmodo,1195104668034228224,2019-11-14 22:22:11,b'Researchers created holograms you can feel and hear https://t.co/vI1OXICWLV https://t.co/M3IIJJ4qBI'
gizmodo,1195104649390559234,2019-11-14 22:22:07,"b""Congress is increasingly wary about NASA's 2024 Moon landing deadline https://t.co/QCHd4JqXhg https://t.co/3CFaZ9wGg4"""
gizmodo,1195102528175775749,2019-11-14 22:13:41,"b"".@AOC and @BernieSanders' Green New Deal aims to change our relationship with public housing https://t.co/dm6CJJtspD https://t.co/zGcx6vWGi3"""
gizmodo,1195099544444448773,2019-11-14 22:01:49,b'FCC plans to scrap defective system used to post fake net neutrality comments https://t.co/RjEvf4AgNX https://t.co/GCPa8f0qjy'
gizmodo,1195094806969692165,2019-11-14 21:43:00,b'Filed to: irony is dead https://t.co/imFXcRHdZp https://t.co/F0guBAFj3h'
gizmodo,1195088017771442178,2019-11-14 21:16:01,b'Even New Jersey is handing Uber its own ass https://t.co/9M0Di4qJw8 https://t.co/E8B5zFOdhm'
gizmodo,1195083530495307776,2019-11-14 20:58:11,b'How the 2010s changed physics forever https://t.co/CftNTKTeDA https://t.co/UdjM1xA6iM'
gizmodo,1195079312728371200,2019-11-14 20:41:26,b'Researchers 3D-printed plastic cubes with complex patterns that make them bulletproof https://t.co/Y6Xs2eY1pj https://t.co/vdYQXlTI33'
gizmodo,1195071557493776386,2019-11-14 20:10:37,b'Private equity ghouls buy non-profit that handles .org domains\nhttps://t.co/ioy1SoCKU1 https://t.co/TYx1QWk1wa'
gizmodo,1195063742641377280,2019-11-14 19:39:34,"b""Fossil's new smartwatch is just the thing Pebble fans have been waiting for\nhttps://t.co/XqWajyLnj5 https://t.co/d0bcSLn5qj"""
gizmodo,1195059283051896832,2019-11-14 19:21:50,b'The climate crisis is a public health crisis https://t.co/6idN3gwxlw https://t.co/szLo6omhjK'
gizmodo,1195055175993569281,2019-11-14 19:05:31,b'The superbugs are beating us https://t.co/pGpyIYHvfk'
gizmodo,1195052601101946885,2019-11-14 18:55:17,b'Have some porn for your ears https://t.co/j6gGcz4WXi https://t.co/A0lEMZ8w50'
gizmodo,1195049197856317442,2019-11-14 18:41:46,b'Laser pointers: they\xe2\x80\x99re not just for taunting cats anymore https://t.co/XXQwA67jNC'
gizmodo,1195046379619586048,2019-11-14 18:30:34,"b'All the best video calling apps, ranked https://t.co/WOigLxko6R'"
gizmodo,1195043852526268416,2019-11-14 18:20:31,"b""Venice's regional council rejected climate bills. Then it flooded https://t.co/7TxTYsjwVZ https://t.co/9VuhDP3DKj"""
gizmodo,1195037600320495617,2019-11-14 17:55:41,b'Stunning fossil discovery uncovers the second-most primitive flying bird https://t.co/iYZ4jmlmDY https://t.co/BHNJyZJeDk'
gizmodo,1195029600478343168,2019-11-14 17:23:53,b'Even New Jersey is handing Uber its own ass https://t.co/yJsVSdkEk8 https://t.co/xff7IJFQFv'
gizmodo,1195025605097594880,2019-11-14 17:08:01,"b""Fossil's new smartwatch is just the thing Pebble fans have been waiting for\nhttps://t.co/1M19qvXBrL https://t.co/pcWuljUzRc"""
gizmodo,1195019962672439297,2019-11-14 16:45:36,b'Researchers 3D-printed plastic cubes with complex patterns that make them bulletproof https://t.co/qPGedIYbc7 https://t.co/rRnBUJFe80'
gizmodo,1195009398051094532,2019-11-14 16:03:37,b'@AndrewCouts any time'
gizmodo,1195007045176561664,2019-11-14 15:54:16,"b'@AndrewCouts yes, you learned that ""today"" and not when this was published https://t.co/S0f61uoXKK'"
gizmodo,1195001446380519425,2019-11-14 15:32:01,b'How the 2010s changed physics forever https://t.co/ss3H4LPFX9 https://t.co/e29hvkXGxe'
gizmodo,1194991264061644800,2019-11-14 14:51:33,"b""Netflix's chosen fighter to take on Disney+ is, uh, Nickelodeon https://t.co/PBVn8evuoJ https://t.co/p1BRzsmln5"""
gizmodo,1194985017996390401,2019-11-14 14:26:44,b'Watch wild fish chase a laser pointer https://t.co/yYo3l0MuyH'
gizmodo,1194982413455298560,2019-11-14 14:16:23,"b""The location for NASA's next Mars rover is even more intriguing than we realized https://t.co/gPBXm4ubJt https://t.co/wvn5f7Uopi"""
gizmodo,1194979318868463617,2019-11-14 14:04:05,"b'All the best video calling apps, ranked https://t.co/zp1dKr9sMV'"
gizmodo,1194929922596331521,2019-11-14 10:47:48,"b'Rep. Paul Gosar tweets conspiracy theory that ""Epstein didn\'t kill himself"" https://t.co/NrOrHHI1Ua https://t.co/qODAQtu6Qd'"
gizmodo,1194925740187369473,2019-11-14 10:31:11,b'The flip phone is back with the new all-display Motorola Razr https://t.co/fqNGJXxEbO https://t.co/bfqhP79TCE'
gizmodo,1194851076056457216,2019-11-14 05:34:30,b'Motorola is bringing back the flip phone with an all-display Razr device https://t.co/qcn4B6As6f https://t.co/FB4E3rJMvA'
gizmodo,1194824201015844864,2019-11-14 03:47:42,b'Now a senator is investigating the sexist Apple Card debacle https://t.co/jfxnWDmZpu https://t.co/mp2DO5pgch'
gizmodo,1194820900941713409,2019-11-14 03:34:36,"b""How America's most hateable cable provider could squash civil rights protections https://t.co/RiUqK77iZ1 https://t.co/Ph9WhNPa0h"""
gizmodo,1194812824171753472,2019-11-14 03:02:30,"b'GOP Rep. Paul Gosar inserts ""Epstein didn\'t kill himself"" conspiracy theory into impeachment tweets\xe2\x80\xa6 https://t.co/3TJuKVno9l'"
gizmodo,1194778858664452096,2019-11-14 00:47:32,b'Now a senator is investigating the sexist Apple Card debacle https://t.co/4kCRkuMn6N https://t.co/7KRAHhQxsk'
gizmodo,1194773445109792769,2019-11-14 00:26:01,"b""How America's most hateable cable provider could squash civil rights protections https://t.co/H3kJCo8DDM https://t.co/gD03wFUiIT"""
gizmodo,1194756276074549250,2019-11-13 23:17:48,b'Promising plant sciences breakthrough could lead to photosynthesis 2.0 https://t.co/aVbjCHLZPn https://t.co/eLc33SnzVz'
gizmodo,1194748533674586116,2019-11-13 22:47:02,"b""Forget credit cards, Google's looking to open its own checking accounts\nhttps://t.co/9ncxtmQzWV https://t.co/FzuDeBf4uO"""
gizmodo,1194740136518586370,2019-11-13 22:13:40,"b""The location for NASA's next Mars rover is even more intriguing than we realized https://t.co/qc8d3hfk9Q https://t.co/W5RFUNLWrI"""
gizmodo,1194733178562457600,2019-11-13 21:46:01,"b""Don't let the scary headlines get to you https://t.co/LUJDbIJwlI https://t.co/nZMSJz4b1K"""
gizmodo,1194725088433770498,2019-11-13 21:13:52,b'How to keep group chats from driving you mad https://t.co/36Mzipongr'
gizmodo,1194721493642559488,2019-11-13 20:59:35,b'Mother who allegedly starved and pepper-sprayed her YouTuber children dies in hospital\nhttps://t.co/OPjp2Vcbm4 https://t.co/nVURhRMQGw'
gizmodo,1194713551023288338,2019-11-13 20:28:01,"b'Judge blocks Trump administration from allowing 3D-printed guns, again https://t.co/HUkNUPfVId'"
gizmodo,1194708947070070785,2019-11-13 20:09:44,"b""Don't panic about the 'black death plague' https://t.co/bvKdJyxvJQ"""
gizmodo,1194701480244199427,2019-11-13 19:40:04,b'The very best smart home gadgets https://t.co/smt1gAT0E4 https://t.co/aFgE8TqQLi'
gizmodo,1194697382170152960,2019-11-13 19:23:46,"b""Forget credit cards, Google's looking to open its own checking accounts\nhttps://t.co/gAZ4MsMfNy https://t.co/3F508Skq0f"""
gizmodo,1194693181188853768,2019-11-13 19:07:05,b'Exceptional floods have inundated Venice https://t.co/qZ2fSYG8za https://t.co/ApCaMyTGUL'
gizmodo,1194684980208775170,2019-11-13 18:34:30,b'The AirPods Pro are nearly perfect https://t.co/Gmq1zONL5a https://t.co/2jZSQ20TL2'
gizmodo,1194681279159132164,2019-11-13 18:19:47,b'Promising plant sciences breakthrough could lead to photosynthesis 2.0 https://t.co/UWCJnkWIxk https://t.co/4xjxy3sy4h'
gizmodo,1194678168759783425,2019-11-13 18:07:26,"b""Yep, there's a giant new MacBook Pro, and yep, Apple improved its keyboard https://t.co/Lau5El4vXy https://t.co/ppcNbHk1xw"""
gizmodo,1194670270067425282,2019-11-13 17:36:02,"b'Allow me to criticize the AirPods Pro, which I love https://t.co/ofVMfVYSUS'"
gizmodo,1194663113309732864,2019-11-13 17:07:36,b'How to keep group chats from driving you mad https://t.co/ZoldHPa1CH'
gizmodo,1194656148533714944,2019-11-13 16:39:56,"b'Judge blocks Trump administration from allowing 3D-printed guns, again https://t.co/zgM5sIPPWR'"
gizmodo,1194652639910338562,2019-11-13 16:25:59,b'Mother who allegedly starved and pepper-sprayed her YouTuber children dies in hospital\nhttps://t.co/octQ5b1C3Y https://t.co/uTUCrhG3Hk'
gizmodo,1194640047535988736,2019-11-13 15:35:57,b'Venice under a state of emergency as historic high tides flood the city https://t.co/zxKHk5BEeF https://t.co/JZB7mg23LS'
gizmodo,1194636422961074176,2019-11-13 15:21:33,b'The very best smart home gadgets https://t.co/4uVlwybShy https://t.co/ClN1A1jdtm'
gizmodo,1194633859838595072,2019-11-13 15:11:22,"b'The first Trump impeachment hearing has begun. Watch live on YouTube, Facebook, and more. https://t.co/875eSKqlOG https://t.co/pbKgx72Wyp'"
