TechCrunch,1171513889357324289,2019-09-10 20:00:51,b'JobTeaser scores \xc2\xa345M for its graduate recruitment platform https://t.co/QgIXCClpht by @sohear https://t.co/cD6T2OkPGN'
TechCrunch,1171512565811146756,2019-09-10 19:55:35,b'RT @etherington: JAXA\xe2\x80\x99s HTV-8 launch is officially scrubbed for today - press conference at 6 AM JPT (about 1.5 hours from now) to find out\xe2\x80\xa6'
TechCrunch,1171507594789183488,2019-09-10 19:35:50,b'Apple will now let you pick your own band color with launch of \xe2\x80\x98Apple Watch Studio\xe2\x80\x99 https://t.co/FNvDtANZ2c by\xe2\x80\xa6 https://t.co/GdKpQEC51E'
TechCrunch,1171497394837446657,2019-09-10 18:55:18,b'Apple is releasing macOS Catalina in October https://t.co/CXR6IWGCtu by @romaindillet https://t.co/1o6BmYHRyY'
TechCrunch,1171496591380774914,2019-09-10 18:52:07,b'Why does the new iPhone 11 Pro have 3 cameras? https://t.co/vB2tuRp85u https://t.co/z60iSMNxBE'
TechCrunch,1171495838503161856,2019-09-10 18:49:07,"b'Apple intros the iPhone 11, iPhone 11 Pro, and iPhone 11 Pro Max https://t.co/ALH3UF2nZn #AppleEvent https://t.co/ITtYKUJp1F'"
TechCrunch,1171495785352941569,2019-09-10 18:48:55,b'iOS 13 will be available on September 19 https://t.co/ZkNW5UqbEK by @romaindillet https://t.co/t6powIVPqf'
TechCrunch,1171495640959868930,2019-09-10 18:48:20,b'Here\xe2\x80\x99s everything Apple announced today at the iPhone 11 event https://t.co/vlBfy7I7AK by @grg https://t.co/8ahf2NhfQd'
TechCrunch,1171494652677017603,2019-09-10 18:44:25,"b""That's a wrap! Thanks for following along with us. \n\nCatch up on the live blog here \xf0\x9f\x91\x89 https://t.co/2kYLctPeDr \n\nFul\xe2\x80\xa6 https://t.co/16b1axz0PD"""
TechCrunch,1171494227714269184,2019-09-10 18:42:43,"b'Apple 5th Avenue, NYC re-opens on September 20th with launch of new iPhones. Now largest Apple store in the world.\xe2\x80\xa6 https://t.co/sdGQvcOKpK'"
TechCrunch,1171493748275957760,2019-09-10 18:40:49,"b""Apple's most advanced iPhone yet, the iPhone 11 Pro, starts at $999. iPhone 11 Pro Max starts at $1,099.\xe2\x80\xa6 https://t.co/yJF9FXB0Oa"""
TechCrunch,1171492720931561482,2019-09-10 18:36:44,"b'RT @panzer: iPhone 11 Pro $999, iPhone 11 Pro Max $1099, Friday at 5am PDT. Shipping September 20th. iPhone 11 is $699. iPhone XR stays in\xe2\x80\xa6'"
TechCrunch,1171492222920880128,2019-09-10 18:34:45,b'Mike Bloomberg\xe2\x80\x99s philanthropic arm is shelling out $160 million to keep kids from vaping https://t.co/FtiJgY6Zru by\xe2\x80\xa6 https://t.co/780teYYyn2'
TechCrunch,1171492056260235265,2019-09-10 18:34:06,b'Uber lays off 435 people across engineering and product teams https://t.co/L92L4vVnFK by @meganrosedickey https://t.co/V4psWHK5pW'
TechCrunch,1171491200781565954,2019-09-10 18:30:42,"b'RT @panzer: New version of Filmic pro looks great. You can shoot with multiple cameras at the same time all in 4k, insane. Huge for filmmak\xe2\x80\xa6'"
TechCrunch,1171491142900150280,2019-09-10 18:30:28,b'\xe2\x9a\xa1\xef\xb8\x8f Apple Hardware Event 2019 #AppleEvent \nhttps://t.co/Vo9VdgcK5B'
TechCrunch,1171490136451768321,2019-09-10 18:26:28,b'All the weird stuff that happens to you after you close your round https://t.co/f7zK0RYU1E by @MattRodak @FundThatFlip'
TechCrunch,1171489889180717056,2019-09-10 18:25:29,"b'RT @panzer: Deep Fusion shoots 9 images, it pre shoots 4 long and 4 short exposure images into a buffer. Then when you press the shutter bu\xe2\x80\xa6'"
TechCrunch,1171489463186292737,2019-09-10 18:23:47,b'Catch up on all things #AppleEvent on our @Flipboard magazine! https://t.co/ST6KeTMYG0 https://t.co/FQRSjvflLa'
TechCrunch,1171489185905012738,2019-09-10 18:22:41,b'Apple introduces the A13 Bionic for the iPhone 11 https://t.co/YByvXtEQK4 by @romaindillet'
TechCrunch,1171488647910019075,2019-09-10 18:20:33,"b'Watch the first trailer for \xe2\x80\x98See\xe2\x80\x99, Apple\xe2\x80\x99s post-apocalyptic show starring Jason Momoa https://t.co/Bw95p2Jy43 by\xe2\x80\xa6 https://t.co/1czXI6HMu2'"
TechCrunch,1171487738245210112,2019-09-10 18:16:56,b'RT @panzer: A13 Bionic. 8.5 billion transistors. What does this mean for most people? Nothing. Nothing at all. What does it mean in the chi\xe2\x80\xa6'
TechCrunch,1171487553569972225,2019-09-10 18:16:12,b'Anyone else getting iTrypophobia?\n\n#AppleEvent https://t.co/Qxwpk5xUAs'
TechCrunch,1171487314846961665,2019-09-10 18:15:15,"b'iPhone 11 Pro new finishes, ""Midnight Green"", ""Space Grey"", Silver and Gold.\n\niPhone 11 6.5"" and 5.8"" models.\xe2\x80\xa6 https://t.co/Ou6ADwB8aN'"
TechCrunch,1171486332859768832,2019-09-10 18:11:21,"b'""For our customers that want the most sophisticated technology that really pushes the limits, we\'ve created somethi\xe2\x80\xa6 https://t.co/2KUzyCbyWG'"
TechCrunch,1171486086620540929,2019-09-10 18:10:22,"b'Is the new dual camera (ultra wide, night mode, optical 2x zoom out, bigger depth of field, slow mo selfies, 4K fro\xe2\x80\xa6 https://t.co/oZ5hKNj8se'"
TechCrunch,1171484871975260163,2019-09-10 18:05:33,b'This is the iPhone 11 https://t.co/6DF6BkzJlb by @jordanrcrook https://t.co/MCXIJKmijY'
TechCrunch,1171483169981288449,2019-09-10 17:58:47,"b""Apple's Night Mode looks solid. Image fusion and adaptive bracketing -- shorter and longer exposures -- melded toge\xe2\x80\xa6 https://t.co/PwdN0Zp2vt"""
TechCrunch,1171483120576557056,2019-09-10 17:58:35,b'Apple is launching a Research app that will allow U.S. consumers to participate in health studies\xe2\x80\xa6 https://t.co/a01PojZ7fB'
TechCrunch,1171481747084570627,2019-09-10 17:53:08,b'New wide and ultrawide cameras on the iPhone 11. \n\nUltrawide elongates subjects but keeps details.\xe2\x80\xa6 https://t.co/fJVN045Qs8'
TechCrunch,1171481313963958273,2019-09-10 17:51:24,"b""Here's the iPhone 11! \n\nDual camera model in multiple colors up first.\n\nWhite, frosty green, yellow, silver, black\xe2\x80\xa6 https://t.co/X7BGjyzTcq"""
TechCrunch,1171480927479848960,2019-09-10 17:49:52,"b'Apple Watch pricing $399/$499 cellular. Order today, September 20th in store.\n\nhttps://t.co/2kYLctPeDr #AppleEvent https://t.co/4ZBzE0BFtw'"
TechCrunch,1171479968720670722,2019-09-10 17:46:04,"b'Apple Watch Series 5 has an always on Retina display.\n\n100% recycled aluminum. Stainless steel in gold, space black\xe2\x80\xa6 https://t.co/sM1IAXTyjV'"
TechCrunch,1171476983508680705,2019-09-10 17:34:12,"b""We're getting the customary 'Apple Watch improved/warned me about my health' video segment.\n\nExamples of people wit\xe2\x80\xa6 https://t.co/env742D2hW"""
TechCrunch,1171476971252932610,2019-09-10 17:34:09,b'Apple debuts slightly bigger entry-level iPad https://t.co/91f0lV16Bi by @lucasmtny https://t.co/ovRDQxdImT'
TechCrunch,1171476713634578432,2019-09-10 17:33:08,b'Let\xe2\x80\x99s look inside Volkswagen\xe2\x80\x99s new ID.3 electric hatchback https://t.co/Z3wOlkWY6d by @kirstenkorosec https://t.co/FzXUYwthyK'
TechCrunch,1171476073726373888,2019-09-10 17:30:35,"b""iPad 7th generation, $329.\n\nEducation pricing is $299.\n\nOrder today, shipping 'end of month'\xe2\x80\xa6 https://t.co/qWrutIflyz"""
TechCrunch,1171474506486968320,2019-09-10 17:24:21,"b'Apple TV+ to launch November 1 for $4.99/month, one year free comes with select Apple devices https://t.co/Z3YhWBK7m8 by @sarahintampa'"
TechCrunch,1171473797423124482,2019-09-10 17:21:32,"b'Starting today, when you buy an iPhone, iPad, Mac or AppleTV you get 1 year free of AppleTV+\xe2\x80\xa6 https://t.co/vusgjo0Al3'"
TechCrunch,1171472343710855171,2019-09-10 17:15:46,b'Apple Arcade launches later this month for $4.99/mo https://t.co/PIK4qV20et by @lucasmtny'
TechCrunch,1171471816142884866,2019-09-10 17:13:40,b'Apple Arcade is available as of September 19th in over 150 countries. Over 100 new games coming to the catalogue. $\xe2\x80\xa6 https://t.co/tpAGJNUeZq'
TechCrunch,1171469880383590403,2019-09-10 17:05:58,"b""Anne Thai is out to talk Apple Arcade. We're seeing the Apple Arcade tab now.\n\nIt's getting top line presence in th\xe2\x80\xa6 https://t.co/GZeky8sMHT"""
TechCrunch,1171469318602706949,2019-09-10 17:03:45,"b'Cook starts out banging the integrated hardware, software and services drum.\n\nhttps://t.co/2kYLctPeDr #AppleEvent https://t.co/9XIuOddYwT'"
TechCrunch,1171468582284214272,2019-09-10 17:00:49,b'Coinbase announces USDC Bootstrap Fund to support DeFi projects https://t.co/LwvWdsGLSc by @romaindillet https://t.co/hDsF8ByQgB'
TechCrunch,1171468552991150080,2019-09-10 17:00:42,"b""The Apple logo has been slowly changing colors this whole time. New iPhone colors? Apple microdosing? The sky's the\xe2\x80\xa6 https://t.co/4goy9OtCpd"""
TechCrunch,1171468231950786566,2019-09-10 16:59:25,"b""Apple fans, we're about to start. \n\nFollow along for live updates here on Twitter or on our live blog here\xf0\x9f\x8d\x8f:\xe2\x80\xa6 https://t.co/tuw3jsaOeb"""
TechCrunch,1171466663562076160,2019-09-10 16:53:12,b'RT @TechCrunch: Live from Apple\xe2\x80\x99s iPhone 11 event https://t.co/PKfDeSuBM8 by @bheater and @panzer https://t.co/Znkj6Tad5E'
TechCrunch,1171466470884134917,2019-09-10 16:52:26,b'The Wikimedia Foundation taps $2.5M from Craig Newmark to beef up its security https://t.co/lnsh2yDHJH by\xe2\x80\xa6 https://t.co/5QdFnp0Bqn'
TechCrunch,1171466147507499008,2019-09-10 16:51:09,b'HashiCorp announces fully managed service mesh on Azure https://t.co/TOaJhWDjJD by @ron_miller https://t.co/wpCL6zhjsP'
TechCrunch,1171466041311952896,2019-09-10 16:50:43,"b'RT @annaescher: \xf0\x9f\xa6\x84\xf0\x9f\x87\xa7\xf0\x9f\x87\xb7New LatAm unicorn alert\xf0\x9f\x87\xa7\xf0\x9f\x87\xb7\xf0\x9f\xa6\x84\n\nQuintoAndar, a Brazilian property tech marketplace, has raised $250M led by SoftBank at a +$\xe2\x80\xa6'"
TechCrunch,1171465893890539521,2019-09-10 16:50:08,b'Volta Charging raises another $20 million to expand ad-supported EV charging network https://t.co/t4SgEhSHqB by\xe2\x80\xa6 https://t.co/objUt1DelE'
TechCrunch,1171464933352960001,2019-09-10 16:46:19,"b""Buckle your seatbelts! we're less than 15 mins away from the #AppleEvent follow all of the live upates here: https://t.co/4HoIjmKxVa"""
TechCrunch,1171463024009334785,2019-09-10 16:38:44,"b'What top enterprise VCs are thinking, using data effectively, ethics, Light, and Flipkart https://t.co/hwlPpQVTBy'"
TechCrunch,1171462655325790208,2019-09-10 16:37:16,b'Daily Crunch: Stripe launches a credit card https://t.co/VIivQ0yqTE by @anthonyha https://t.co/pwl1oI25RQ'
TechCrunch,1171459240352870400,2019-09-10 16:23:42,"b'Mozilla launches a VPN, brings back the Firefox Test Pilot program https://t.co/dLyrb3TkrQ by @fredericl https://t.co/F7nFGpnLPs'"
TechCrunch,1171458865138814977,2019-09-10 16:22:12,b'Watch JAXA\xe2\x80\x99s HTV-8 mission launch aboard a Mitsubishi Heavy Industries H-IIB rocket live https://t.co/WgfnL3hABk by\xe2\x80\xa6 https://t.co/nBqQzWhkwH'
TechCrunch,1171454000492769280,2019-09-10 16:02:52,b'Aerospace Corp CEO Steve Isakowitz to talk how to raise non-dilutive capital at Disrupt SF this Oct\xe2\x80\xa6 https://t.co/ObNhSygoNi'
TechCrunch,1171453913557397510,2019-09-10 16:02:32,b'Google brings Cloud Dataproc to Kubernetes https://t.co/Mx1GjHcW3k by @fredericl https://t.co/akNbEROdMn'
TechCrunch,1171453646992601090,2019-09-10 16:01:28,"b'Nextdoor adds new funding from Mary Meeker\xe2\x80\x99s Bond, closes growth round at $170M https://t.co/1R8boHjCWP by\xe2\x80\xa6 https://t.co/fnoB5D1Omq'"
TechCrunch,1171442501552496648,2019-09-10 15:17:11,"b'RT @KateClarkTweets: I talked to @briannekimmel about her debut SaaS fund, Work Life Ventures: https://t.co/GlUOpdN6Um'"
TechCrunch,1171438828587892736,2019-09-10 15:02:35,"b'HashiCorp expands Terraform free version, adds paid tier for SMBs https://t.co/BqpSvyHh52 by @ron_miller https://t.co/WmBAsT8f6J'"
TechCrunch,1171438789366972416,2019-09-10 15:02:26,b'Payments giant Stripe debuts a credit card in its latest step into the financing fray https://t.co/Hvls0QYH0N by\xe2\x80\xa6 https://t.co/3jsrHpCf1t'
TechCrunch,1171432948446326786,2019-09-10 14:39:13,b'Rivian lands $350 million investment from Cox Automotive https://t.co/VY0y3UImSG by @kirstenkorosec https://t.co/GivSmVJnZb'
TechCrunch,1171430349517152256,2019-09-10 14:28:54,b'Twenty and Mappen merge to help users hang out IRL https://t.co/vEP238DATs by @jordanrcrook https://t.co/jkAAoNL0KX'
TechCrunch,1171423703566962688,2019-09-10 14:02:29,b'Work Life Ventures raises $5M for debut enterprise SaaS seed fund https://t.co/qXBsi7wrMP by @kateclarktweets https://t.co/iBLZ6VMBN5'
TechCrunch,1171423558561648640,2019-09-10 14:01:55,b'Smart grocery cart startup Caper bags $10 million https://t.co/GKKuAK70va by @lucasmtny https://t.co/VQBMzyP1Ir'
TechCrunch,1171423082667532288,2019-09-10 14:00:01,"b""TechCrunch's Brian Heater and Darrell Etherington talk through the new phones and features rumored to be announced\xe2\x80\xa6 https://t.co/Ql8Klbq99X"""
TechCrunch,1171420199813341185,2019-09-10 13:48:34,b'Facebook tightens policies around self-harm and suicide https://t.co/AAPODT2FA4 by @sarahintampa'
TechCrunch,1171420022255886336,2019-09-10 13:47:51,"b'Europe\xe2\x80\x99s antitrust chief, Margrethe Vestager, set for expanded role in next Commission https://t.co/WQQySJOy6q by\xe2\x80\xa6 https://t.co/q4P4VnzEz1'"
TechCrunch,1171414972540342279,2019-09-10 13:27:47,b'New investment firm wants to change the way we fund early stage companies \xe2\x80\x94 from New Hampshire\xe2\x80\xa6 https://t.co/NhRrflCUUW'
TechCrunch,1171411231271526400,2019-09-10 13:12:55,b'Snyk grabs $70M more to detect security vulnerabilities in open source code and containers https://t.co/0AJZn1ChAm\xe2\x80\xa6 https://t.co/5J5bPTLGvl'
TechCrunch,1171409021565317120,2019-09-10 13:04:09,b'McDonald\xe2\x80\x99s acquires Apprente to bring voice technology in drive-thrus https://t.co/fcCHtTfaGh by @anthonyha https://t.co/rR75BIBihJ'
TechCrunch,1171408655822008320,2019-09-10 13:02:41,b'Q-CTRL raises $15M for software that reduces error and noise in quantum computing hardware https://t.co/2zSGaSL4Yk by @ingridlunden'
TechCrunch,1171408359200841728,2019-09-10 13:01:31,b'Live from Apple\xe2\x80\x99s iPhone 11 event https://t.co/PKfDeSuBM8 by @bheater and @panzer https://t.co/Znkj6Tad5E'
TechCrunch,1171395651751612417,2019-09-10 12:11:01,b'Latest Adobe tool helps marketers work directly with customer journey data by @ron_miller https://t.co/DOBMgPbrGQ https://t.co/Ue9E1rEIvt'
TechCrunch,1171393218723946498,2019-09-10 12:01:21,b'The Polaroid Lab uses the light from your phone\xe2\x80\x99s screen to turn digital photos into Polaroids\xe2\x80\xa6 https://t.co/MQ18z1p12A'
TechCrunch,1171358591628009473,2019-09-10 09:43:45,b'InMobi\xe2\x80\x99s Glance raises $45M to expand outside of India https://t.co/kiCQiMadxd by @refsrc'
TechCrunch,1171332769370320897,2019-09-10 08:01:09,b'Pento raises $2.8M seed round for its payroll SaaS https://t.co/krW1Etw3ze by @sohear https://t.co/sIf5EA1P5M'
TechCrunch,1171322720904253440,2019-09-10 07:21:13,b'SimShine raises $8 million for home security cameras that use edge computing https://t.co/cBq1Nz1NKu by\xe2\x80\xa6 https://t.co/ELO2lv8Uh3'
TechCrunch,1171317950718062592,2019-09-10 07:02:16,b'Watch Apple unveil the new iPhone live right here https://t.co/Gy4EREx6W2 by @romaindillet https://t.co/BKq5pOz2em'
TechCrunch,1171308320931450880,2019-09-10 06:24:00,"b""TechCrunch's Brian Heater and Darrell Etherington talk through the new phones and features rumored to be announced\xe2\x80\xa6 https://t.co/UcnVhlvHw6"""
TechCrunch,1171305094039646208,2019-09-10 06:11:10,b'Huawei drops lawsuit over equipment seized by the U.S. government https://t.co/dYtGywrdoZ by @catherineshu https://t.co/TlyMvVMAiy'
TechCrunch,1171283334770700298,2019-09-10 04:44:43,b'Jack Ma officially retires as Alibaba\xe2\x80\x99s chairman https://t.co/aZ6X7CJnNd by @catherineshu https://t.co/nki3Rg0uY3'
TechCrunch,1171258239595491330,2019-09-10 03:04:59,b'Paytm\xe2\x80\x99s annual loss doubles to $549M https://t.co/gslklYSXjG by @refsrc https://t.co/7Z9EpFE5iq'
TechCrunch,1171257548441346049,2019-09-10 03:02:15,b'SoftBank mints QuintoAndar a new unicorn in Latin American real estate tech https://t.co/4bRrQavqK4 by @annaescher'
TechCrunch,1171234552741629953,2019-09-10 01:30:52,b'Troubles keep mounting for the We Company as Softbank reportedly calls for shelving the IPO https://t.co/hoYIICNTTV\xe2\x80\xa6 https://t.co/fZJs7D6Jyy'
TechCrunch,1171205011528982528,2019-09-09 23:33:29,b'Mark Russinovich of Microsoft talks with us about competing with @Google at #TCEnterprise https://t.co/yMaIGZME0p'
TechCrunch,1171203306821210112,2019-09-09 23:26:42,"b""Recently, @Apple's Susan Prescott talks business expansion with us at #TCEnterprise https://t.co/pz8CGyzBpf"""
TechCrunch,1171195788439035904,2019-09-09 22:56:50,b'Target\xe2\x80\x99s personalized loyalty program launches nationwide next month https://t.co/BUa0wwFC5J by @sarahintampa https://t.co/6NPnHz6llR'
TechCrunch,1171180278838173696,2019-09-09 21:55:12,b'FDA says Juul \xe2\x80\x98ignored the law\xe2\x80\x99 and warns it may take action https://t.co/ozblLAN726 https://t.co/Ck1ZFDnzLV'
TechCrunch,1171179207478644737,2019-09-09 21:50:57,b'Shopify buys warehouse automation tech developer 6 River Systems for $450 million https://t.co/VAuy1stxpk by\xe2\x80\xa6 https://t.co/YhxYcFymZH'
TechCrunch,1171177744375386112,2019-09-09 21:45:08,"b'Foundation Capital, now 24 years old, just closed its ninth fund with $350 million in capital commitments\xe2\x80\xa6 https://t.co/uWxnZkLEy0'"
TechCrunch,1171161642538868741,2019-09-09 20:41:09,b'International students face immigration hurdles under Trump https://t.co/XWnmb2QDAG https://t.co/2vSubqVW8U'
TechCrunch,1171149405715652608,2019-09-09 19:52:31,"b'Volkswagen reveals its mass-market ID.3, an electric car with up to 341 miles of range https://t.co/LPUCawmfYm by\xe2\x80\xa6 https://t.co/Wyak69PIMM'"
TechCrunch,1171143256933109760,2019-09-09 19:28:05,"b'Why am I seeing this ad? AI, ML &amp; human error in advertising https://t.co/veLRbjaZQs'"
TechCrunch,1171142920231149568,2019-09-09 19:26:45,"b'With its Kubernetes bet paying off, Cloud Foundry double down on developer experience https://t.co/fBLOlJarcb by @fredericl'"
TechCrunch,1171141699592171520,2019-09-09 19:21:54,"b'Annual Extra Crunch members get 100,000 Brex Rewards points upon credit card signup https://t.co/LpmtNVO866'"
TechCrunch,1171135255836803072,2019-09-09 18:56:18,"b'Annual Extra Crunch members get 100,000 Brex Rewards points upon credit card signup https://t.co/QaSiZ5Kubf by\xe2\x80\xa6 https://t.co/yk0mM0lwur'"
TechCrunch,1171129000548294656,2019-09-09 18:31:26,b'Forty nine states and the District of Columbia are pushing an antitrust investigation against Google https://t.co/LVtFQ8KLFA by @jshieber'
TechCrunch,1171117196183031808,2019-09-09 17:44:32,b'Workout app Fitplan adds Alex Rodriguez as a trainer\xe2\x80\xa6 and an investor https://t.co/mQPbkFZ3AQ by @jshieber https://t.co/DpUgFxbzGv'
TechCrunch,1171114935386038273,2019-09-09 17:35:33,"b'The CEO of Naspers \xe2\x80\x94 one of the world\xe2\x80\x99s most powerful, and lowest flying, investment firms \xe2\x80\x94 is coming to Disrupt\xe2\x80\xa6 https://t.co/yvSVWItC9C'"
TechCrunch,1171109909028622338,2019-09-09 17:15:35,b'Root Insurance valuation hits $3.65 billion in latest round led by DST Global and Coatue https://t.co/qdKDCs7D0K by\xe2\x80\xa6 https://t.co/9VhoFkET42'
TechCrunch,1171099184751108103,2019-09-09 16:32:58,"b'Why am I seeing this ad? AI, ML &amp; human error in advertising https://t.co/uHDdsBzfZQ'"
TechCrunch,1171099126228029440,2019-09-09 16:32:44,b'Daily Crunch: Joi Ito resigns from MIT Media Lab https://t.co/GKA5aGeMF8 by @anthonyha https://t.co/1YQF4xlHRw'
TechCrunch,1171098662006661127,2019-09-09 16:30:53,b'Microsoft debuts a new version of its To Do app as Wunderlist founder expresses remorse https://t.co/Jg6vhmVCiV by\xe2\x80\xa6 https://t.co/DOTG5kwr6c'
TechCrunch,1171096676519546881,2019-09-09 16:23:00,"b""TechCrunch's Brian Heater and Darrell Etherington talk through the new phones and features rumored to be announced\xe2\x80\xa6 https://t.co/t9s5SXCMgU"""
TechCrunch,1171086112506486784,2019-09-09 15:41:01,b'Apple tweaks its App Store algorithm as antitrust investigations loom https://t.co/HV67rseY8C by @sarahintampa https://t.co/oYTyUr3vuK'
TechCrunch,1171080090450632706,2019-09-09 15:17:05,b'Adarga closes \xc2\xa35M Series A funding for its Palantir-like AI platform https://t.co/6YKNYLISAS by @mikebutcher https://t.co/arCyu0gFrI'
TechCrunch,1171076116918034433,2019-09-09 15:01:18,"b'New: A bug in Telegram failed to delete ""unsent"" photos and videos from a user\'s phone. https://t.co/owzxV0LyEl by\xe2\x80\xa6 https://t.co/E8FXb4qQSR'"
TechCrunch,1171074885554233346,2019-09-09 14:56:24,b'Syte snaps up $21.5M for its smartphone-based visual search engine for e-commerce https://t.co/e12DnPuc0W by\xe2\x80\xa6 https://t.co/tAf4MCDGRR'
TechCrunch,1171057798639169536,2019-09-09 13:48:31,b'Spotify users can now share music and podcasts to Snapchat https://t.co/Hi5LbwnniP by @sarahintampa https://t.co/LMcf9srgJR'
TechCrunch,1171053317885181954,2019-09-09 13:30:42,b'YC-backed Brave Care raises $5 million for pediatric urgent care clinics https://t.co/9LMuKfNYBS by @jordanrcrook https://t.co/K5EWGfKZ7m'
TechCrunch,1171045874828566528,2019-09-09 13:01:08,b'Fitbit Versa 2 review https://t.co/0aXlkU6AOi by @bheater https://t.co/SsN9ZFmEM7'
TechCrunch,1171044187975954433,2019-09-09 12:54:26,"b'Drivetime nabs $11M from Makers Fund, Amazon and Google to build voice-based games for drivers\xe2\x80\xa6 https://t.co/fPnKQW5cZm'"
TechCrunch,1171030840647663623,2019-09-09 12:01:23,b'Google Nest Hub Max review https://t.co/8q41w7mVP9 by @bheater https://t.co/NvH5r5ZJv8'
TechCrunch,1171002041671573504,2019-09-09 10:06:57,b'AppZen nabs $50M to build AI tools for expenses and other finance team work https://t.co/MI6W1RnvHI by @ingridlunden https://t.co/ecnDDwBuY9'
TechCrunch,1170970726091972608,2019-09-09 08:02:31,b'Uizard scores $2.8M seed round for its app wireframe to prototype dev tool https://t.co/Qpu2ayAHxW by @sohear https://t.co/QcnhFUNsDb'
TechCrunch,1170970475582783489,2019-09-09 08:01:31,b'The Vivaldi browser lands on Android https://t.co/MbIFTlk8uH by @fredericl https://t.co/8TVFRuryuV'
TechCrunch,1170959027527987200,2019-09-09 07:16:02,b'DHL expands Africa eShop online retail app to 34 countries https://t.co/eMNL3e7s5p by @jakerbright https://t.co/NDgUPYPKB5'
TechCrunch,1170958120920801281,2019-09-09 07:12:26,b'Freeda raises another $16 million for its media brand for women https://t.co/EvURnvExd5 by @romaindillet https://t.co/s6zEIXFHDR'
TechCrunch,1170954000369356801,2019-09-09 06:56:03,"b'American tariffs are having a bigger impact on U.S.-based Amazon vendors than their competitors in China, according\xe2\x80\xa6 https://t.co/6AAzmoarjd'"
TechCrunch,1170940441220538368,2019-09-09 06:02:10,b'Spendesk raises $38.4 million for its corporate card and expense service https://t.co/5FoJ7IPmYM by @romaindillet https://t.co/1sFbrJaC4X'
TechCrunch,1170926032708411393,2019-09-09 05:04:55,b'Good Capital launches to close the funding gap for early-stage Indian startups https://t.co/XAcbknNzs8 by @refsrc'
TechCrunch,1170925370020958208,2019-09-09 05:02:17,"b'Volocopter raises $55M led by Volvo owner Geely, sets 3-year timeline for its flying taxi service\xe2\x80\xa6 https://t.co/I9Uh2my27D'"
TechCrunch,1170902144775532544,2019-09-09 03:30:00,"b""TechCrunch's Brian Heater and Darrell Etherington talk through the new phones and features rumored to be announced\xe2\x80\xa6 https://t.co/Ed6J9Hz2WL"""
TechCrunch,1170842861178212352,2019-09-08 23:34:25,b'HackerOne just closed a new round of funding that brings its total funding to $110 million https://t.co/MKTZNQVQ7B\xe2\x80\xa6 https://t.co/Zf4fll2XIe'
TechCrunch,1170827226662785024,2019-09-08 22:32:18,b'Matt Cauble on changing consumption with Soylent and Kin https://t.co/qJmU0f9c58 by @AMLG23 https://t.co/36FQwFtqKP'
TechCrunch,1170795945115758597,2019-09-08 20:28:00,"b'Kite Hill, cofounded by the creator of Impossible Foods, looks to be gaining traction, too https://t.co/Ku6UG09bYh\xe2\x80\xa6 https://t.co/ptI4iRTmyB'"
TechCrunch,1170781910144081920,2019-09-08 19:32:14,"b'As college football attendance slumps, new ways to ticket may hold an answer https://t.co/2uvBxl1F0U by @@stagggggg https://t.co/g9scHMLzim'"
TechCrunch,1170756315167240192,2019-09-08 17:50:31,b'Would we miss the Media Lab if it were gone? by @rezendi https://t.co/exudK3r1dd https://t.co/ftzfjA1r7g'
TechCrunch,1170668656801603584,2019-09-08 12:02:12,b'Week in Review: Facebook\xe2\x80\x99s newest feature might be arriving too late https://t.co/8Md0r67mIt by @lucasmtny https://t.co/TKa4qOZ4Gv'
TechCrunch,1170635069066764294,2019-09-08 09:48:44,b'Fairphone 3 is a normal smartphone with ethical shine https://t.co/6OxXL9uV8B by @riptari https://t.co/xAslMofin4'
TechCrunch,1170436278963384321,2019-09-07 20:38:49,b'Joi Ito resigns as MIT Media Lab head in wake of Jeffrey Epstein reporting https://t.co/PhqtWyamwc by @bheater https://t.co/rXeciZ4NXR'
TechCrunch,1170397847327596545,2019-09-07 18:06:06,"b'After Epstein, it\xe2\x80\x99s time for the Valley to find a moral view on capital https://t.co/w4nmppyiLY https://t.co/QzntdazRCQ'"
TechCrunch,1170396369447792643,2019-09-07 18:00:14,"b'Original Content podcast: Amazon\xe2\x80\x99s \xe2\x80\x98Carnival Row\xe2\x80\x99 mixes fairies, politics and murder https://t.co/gV8s8kPXKm by\xe2\x80\xa6 https://t.co/QTcfudobw9'"
TechCrunch,1170365690638827521,2019-09-07 15:58:19,"b'Wikipedia blames malicious DDOS attack after site goes down across Europe, Middle East https://t.co/CFKCymZzcQ by\xe2\x80\xa6 https://t.co/XnmwL4tY2z'"
