TechCrunch,1177756128857542657,2019-09-28 01:25:17,"b'Tesla, Elon Musk violated labor laws, judge rules https://t.co/acx68k9rKb by @kirstenkorosec https://t.co/iomSTtYdgY'"
TechCrunch,1177735223909289990,2019-09-28 00:02:13,"b""RT @lucasmtny: What if the Facebook of Facebook's VR platform isn't made by Facebook?\n\nhttps://t.co/gp5znFSVwD"""
TechCrunch,1177722275153547265,2019-09-27 23:10:46,"b'As vape lung death toll mounts, CDC investigators warn against \xe2\x80\x98informal\xe2\x80\x99 THC sources https://t.co/ZVLAHHeCqO'"
TechCrunch,1177721840984367106,2019-09-27 23:09:02,"b'As vape lung death toll mounts, CDC investigators warn against \xe2\x80\x98informal\xe2\x80\x99 THC sources https://t.co/eGjuoD0qj6 https://t.co/oJXWs8ihWP'"
TechCrunch,1177695007186329605,2019-09-27 21:22:24,b'Cracking the code on podcast advertising for customer acquisition https://t.co/QUY1JNCAOb'
TechCrunch,1177690252112285696,2019-09-27 21:03:31,b'SpaceX\xe2\x80\x99s orbital Starship prototype comes together ahead of update event https://t.co/2niX9T5BTa'
TechCrunch,1177686085838757889,2019-09-27 20:46:57,b'Cracking the code on podcast advertising for customer acquisition https://t.co/KOCtyJ8cHT by @ihavetoeatthat @lpshaw'
TechCrunch,1177685203533357056,2019-09-27 20:43:27,b'SpaceX\xe2\x80\x99s orbital Starship prototype comes together ahead of update event https://t.co/VglBOiVxNE by @etherington https://t.co/9KufRW8oVD'
TechCrunch,1177683546993053697,2019-09-27 20:36:52,b'Not all is predictable on Facebook\xe2\x80\x99s social Horizon https://t.co/OKeWTU70n3'
TechCrunch,1177680810867970049,2019-09-27 20:26:00,b'We chatted with Boosted CEO Jeff Russakow and CTO John Ulmen to discuss what went into making the startup\xe2\x80\x99s fast an\xe2\x80\xa6 https://t.co/TKGZLJN0k0'
TechCrunch,1177675714998484998,2019-09-27 20:05:45,"b""Not all is predictable on Facebook's social Horizon https://t.co/2DVtUz34pe by @lucasmtny"""
TechCrunch,1177668624544346114,2019-09-27 19:37:34,b'Logitech acquires popular game streaming tool Streamlabs for around $89M https://t.co/k876Dcn5vs'
TechCrunch,1177660458456813568,2019-09-27 19:05:07,b'Daily Crunch: Facebook hides Like counts https://t.co/pwvmnjhIvF'
TechCrunch,1177658038121111554,2019-09-27 18:55:30,b'Daily Crunch: Facebook hides Like counts https://t.co/WfXa8tY88G by @anthonyha https://t.co/64ZR6ctZpB'
TechCrunch,1177652366545506304,2019-09-27 18:32:58,b'Get your immigration questions answered by expert lawyer Sophie Alcorn at Disrupt SF https://t.co/Ahntm6OeZ4'
TechCrunch,1177651323388473345,2019-09-27 18:28:49,b'Get your immigration questions answered by expert lawyer Sophie Alcorn at Disrupt SF https://t.co/GbraQFuzTN https://t.co/3FYKvAyUib'
TechCrunch,1177646888612454400,2019-09-27 18:11:12,"b'DeadHappy, the UK pay-as-you-go life insurance provider, raises \xc2\xa34M Series A https://t.co/pl2nBJ17Eo'"
TechCrunch,1177639332179562498,2019-09-27 17:41:10,b'Nintendo\xe2\x80\x99s more portable Switch gets matching 8BitDo controllers https://t.co/hY27ZzxzPA'
TechCrunch,1177636762983833606,2019-09-27 17:30:58,b'Good news! Apple has fixed the third-party keyboard bug it disclosed earlier this week. Go install iOS 13.1.1 now.\xe2\x80\xa6 https://t.co/npB5ydE4VV'
TechCrunch,1177631623455612929,2019-09-27 17:10:33,b'Get your pitchdeck analyzed by top investors and experts at Disrupt SF next week https://t.co/wrtHzth51E'
TechCrunch,1177623698729312256,2019-09-27 16:39:03,b'Google will soon open a cloud region in Poland https://t.co/H01AycbAFh'
TechCrunch,1177619200229220352,2019-09-27 16:21:11,b'Why Maxar CTO Walter Scott thinks now is the time to address the orbital traffic boom https://t.co/VfU8OewoIg'
TechCrunch,1177617908689788928,2019-09-27 16:16:03,b'Google will soon open a cloud region in Poland https://t.co/xA1gKZAeLa by @fredericl https://t.co/UwY0u4LWSJ'
TechCrunch,1177614914594193408,2019-09-27 16:04:09,b'Why Maxar CTO Walter Scott thinks now is the time to address the orbital traffic boom https://t.co/66DKPJi9rF @etherington'
TechCrunch,1177614193501069313,2019-09-27 16:01:17,b'Get your pitchdeck analyzed by top investors and experts at Disrupt SF next week https://t.co/o91rptHfQu https://t.co/sDQ5WP9zLm'
TechCrunch,1177611372265426945,2019-09-27 15:50:04,b'TC\xe2\x80\x99s Greg Epstein and Kate Clark talk mental health startups and the \xe2\x80\x98Cult of the Founder\xe2\x80\x99 https://t.co/b8N7udLLxX'
TechCrunch,1177607534879920128,2019-09-27 15:34:49,b'Nintendo\xe2\x80\x99s more portable Switch gets matching 8BitDo controllers https://t.co/9PvwgpnZiQ by @bheater https://t.co/2XF1MbzmpB'
TechCrunch,1177603403322724353,2019-09-27 15:18:24,"b""Tech Ethics News Roundup: Mental health startups, WeWork and the 'Cult of the Founder' https://t.co/UonglMY6Z6 by\xe2\x80\xa6 https://t.co/iOFHukGKdQ"""
TechCrunch,1177601569526878209,2019-09-27 15:11:07,b'HTC\xe2\x80\x99s new CEO Yves Maitre is coming to Disrupt San Francisco https://t.co/m37bVR3Cn5'
TechCrunch,1177599231626010625,2019-09-27 15:01:50,b'HTC\xe2\x80\x99s new CEO Yves Maitre is coming to Disrupt San Francisco https://t.co/CAd4oQLSMP by @bheater https://t.co/bzKSxHeVpf'
TechCrunch,1177593918386577408,2019-09-27 14:40:43,b'The Galaxy Fold is now available for purchase in the US https://t.co/7nkd8X24AV'
TechCrunch,1177589476425699330,2019-09-27 14:23:04,b'YouTube Music will be preinstalled on Android 10 and new Android 9 devices https://t.co/Y6MnyoTGaD'
TechCrunch,1177587873308139526,2019-09-27 14:16:42,b'YouTube Music will be preinstalled on Android 10 and new Android 9 devices https://t.co/tJv5Dgr9cO by @sarahintampa https://t.co/WtErH6KwyG'
TechCrunch,1177587828202622977,2019-09-27 14:16:31,b'The Galaxy Fold is now available for purchase in the US https://t.co/m05rTWsJOw by @bheater https://t.co/1fRatOyjMx'
TechCrunch,1177585450883698688,2019-09-27 14:07:04,b'Director Ang Lee explains why he built a digital Will Smith in \xe2\x80\x98Gemini Man\xe2\x80\x99 https://t.co/STf5MSI7zc'
TechCrunch,1177577750833618945,2019-09-27 13:36:28,"b'Peloton, WeWork, Vox, Bodega, Kapwing and oh boy are we tired https://t.co/FuLylGNVOA'"
TechCrunch,1177569968034131973,2019-09-27 13:05:33,"b'To curb lobbying power, Elizabeth Warren wants to reinstate the Office of Technology Assessment https://t.co/68Zqf88xWs'"
TechCrunch,1177569272811311109,2019-09-27 13:02:47,"b'To curb lobbying power, Elizabeth Warren wants to reinstate the Office of Technology Assessment\xe2\x80\xa6 https://t.co/xaAzRWRggz'"
TechCrunch,1177569161037451264,2019-09-27 13:02:20,"b'Peloton, WeWork, Vox, Bodega, Kapwing and oh boy are we tired https://t.co/2HAoVXHncL by @kateclarktweets and @alex https://t.co/wsMbG3fcac'"
TechCrunch,1177568951099895809,2019-09-27 13:01:30,b'Director Ang Lee explains why he built a digital Will Smith in \xe2\x80\x98Gemini Man\xe2\x80\x99 https://t.co/eS2iYxTK5w by @anthonyha https://t.co/43HNkiOxGW'
TechCrunch,1177562171179450368,2019-09-27 12:34:34,"b'Last year\xe2\x80\x99s Gatwick drone attack involved at least two drones, say police https://t.co/KDlB6ziniz'"
TechCrunch,1177562136349949952,2019-09-27 12:34:26,"b'Last year\xe2\x80\x99s Gatwick drone attack involved at least two drones, say police https://t.co/9sX2R64bzI by @riptari https://t.co/hjRIiGFGN2'"
TechCrunch,1177556423036874756,2019-09-27 12:11:43,"b'DeadHappy, the UK pay-as-you-go life insurance provider, raises \xc2\xa34M Series A https://t.co/Ybc6URAxtT by @sohear https://t.co/rGokixaJos'"
TechCrunch,1177545303748165632,2019-09-27 11:27:32,b'Worried about a \xe2\x80\x98no deal\xe2\x80\x99 brexit? UK startups should check this guide https://t.co/eEWvReKteO'
TechCrunch,1177541631031033856,2019-09-27 11:12:57,b'Worried about a \xe2\x80\x98no deal\xe2\x80\x99 brexit? UK startups should check this guide https://t.co/bwFrsR4ee1 by @riptari https://t.co/PD8Z4Yk7K0'
TechCrunch,1177540360383471618,2019-09-27 11:07:54,b'Why startups exhibit in Startup Alley at Disrupt Berlin 2019 https://t.co/2aacbVFmnQ https://t.co/UpERZFTnZe'
TechCrunch,1177540159597944834,2019-09-27 11:07:06,b'Why startups exhibit in Startup Alley at Disrupt Berlin 2019 https://t.co/7K2JSaapUd'
TechCrunch,1177459608975134721,2019-09-27 05:47:01,b'One day left to get featured at TechCrunch Disrupt Berlin\xe2\x80\x99s Startup Battlefield https://t.co/Xcfc0DhMJK by\xe2\x80\xa6 https://t.co/UU5RGf4Srq'
TechCrunch,1177459572182700035,2019-09-27 05:46:52,b'One day left to get featured at TechCrunch Disrupt Berlin\xe2\x80\x99s Startup Battlefield https://t.co/ALOHqlAriP'
TechCrunch,1177393668761669634,2019-09-27 01:25:00,b'We chatted with Boosted CEO Jeff Russakow and CTO John Ulmen to discuss what went into making the startup\xe2\x80\x99s fast an\xe2\x80\xa6 https://t.co/pcVCbfaG9b'
TechCrunch,1177382549175361537,2019-09-27 00:40:49,b'DARPA aims to make networks 100 times speedier with FastNIC https://t.co/62Cc4QJAcS'
TechCrunch,1177382270233169920,2019-09-27 00:39:42,b'DARPA aims to make networks 100 times speedier with FastNIC https://t.co/o2oJuWJBGe https://t.co/z0BXHMf6uE'
TechCrunch,1177367914741141507,2019-09-26 23:42:39,b'Latin America Roundup: Softbank bets on Brazillian unicorns and Konfio raises $250M for lending plans https://t.co/yRVWAYKgLo'
TechCrunch,1177362011979575296,2019-09-26 23:19:12,b'Latin America Roundup: Softbank bets on Brazillian unicorns and Konfio raises $250M for lending plans\xe2\x80\xa6 https://t.co/Qulmf5mUb0'
TechCrunch,1177359956623921153,2019-09-26 23:11:02,b'GoodRx is coming for subscription prescription services with the launch of GoodRx Care https://t.co/b9Fvg6fnOu'
TechCrunch,1177354583284338688,2019-09-26 22:49:41,b'GoodRx is coming for subscription prescription services with the launch of GoodRx Care https://t.co/YB543sxfAx by\xe2\x80\xa6 https://t.co/PkJDwuuPX4'
TechCrunch,1177351955162832897,2019-09-26 22:39:14,b'MediaRadar\xe2\x80\x99s new product helps event organizers maximize sales https://t.co/a1vSkU6y6l'
TechCrunch,1177344237052006401,2019-09-26 22:08:34,b'Justice Department has issued draft rules on using consumer genetic data in investigations https://t.co/rfVp8gmutd'
TechCrunch,1177343991823699971,2019-09-26 22:07:36,b'Justice Department has issued draft rules on using consumer genetic data in investigations https://t.co/nrd1AfS3SA\xe2\x80\xa6 https://t.co/UStlFFELAU'
TechCrunch,1177338147333689344,2019-09-26 21:44:22,"b'At the sixth annual Pear Demo Day, weather balloons, branded credit cards, and lots of top degrees https://t.co/jLGTgeF7Ek'"
TechCrunch,1177330528338481153,2019-09-26 21:14:06,"b""Peloton goes public: 'We are seeing volume and interest in Peloton explode,\xe2\x80\x99 says company president on listing day\xe2\x80\xa6 https://t.co/bgHnjQhqXv"""
TechCrunch,1177327915735879693,2019-09-26 21:03:43,b'Privacy in a digital world https://t.co/K9rVJkgFBd'
TechCrunch,1177327435882336263,2019-09-26 21:01:49,b'Privacy in a digital world https://t.co/OYHvVibwIV https://t.co/7Y0sAHV4Zy'
TechCrunch,1177326604126687240,2019-09-26 20:58:30,"b'At the sixth annual Pear Demo Day, weather balloons, branded credit cards, and lots of top degrees\xe2\x80\xa6 https://t.co/raw8s6QhAL'"
TechCrunch,1177323246057873408,2019-09-26 20:45:10,"b'\xe2\x80\x98We are seeing volume and interest in Peloton explode,\xe2\x80\x99 says company president on listing day https://t.co/BHBFo1HLkg'"
TechCrunch,1177318651499810833,2019-09-26 20:26:54,"b'DoorDash confirms data breach affected 4.9 million customers, workers and merchants https://t.co/vLB55td9f1'"
TechCrunch,1177314709994950658,2019-09-26 20:11:14,b'Facebook tries hiding Like counts to fight envy https://t.co/8A57I10sUi'
TechCrunch,1177312039938809861,2019-09-26 20:00:38,b'Facebook tries hiding Like counts to fight envy https://t.co/hoNvOaFArQ by @joshconstine https://t.co/6l3m2s9PAD'
TechCrunch,1177310390541328384,2019-09-26 19:54:05,"b'Tesla V10.0 car software update adds Smart Summon, Netflix/YouTube, Spotify, karaoke and more https://t.co/7VXCxOoirX'"
TechCrunch,1177309152445685760,2019-09-26 19:49:09,"b'Tesla V10.0 car software update adds Smart Summon, Netflix/YouTube, Spotify, karaoke and more\xe2\x80\xa6 https://t.co/R5klxQUsHv'"
TechCrunch,1177306266068238336,2019-09-26 19:37:41,b'Dating app maker Match sued by FTC for fraud https://t.co/MLAIKTdKSH'
TechCrunch,1177298581897826305,2019-09-26 19:07:09,b'Apple\xe2\x80\x99s new \xe2\x80\x98For All Mankind\xe2\x80\x99 trailer focuses on the people dealing with a Soviet space race win https://t.co/18OWIFxwj4'
TechCrunch,1177297700926185476,2019-09-26 19:03:39,b'Dating app maker Match sued by FTC for fraud https://t.co/X75mvWdkeu by @sarahintampa https://t.co/Lmnh4wJFmP'
TechCrunch,1177296488147431424,2019-09-26 18:58:50,b'Apple\xe2\x80\x99s new \xe2\x80\x98For All Mankind\xe2\x80\x99 trailer focuses on the people dealing with a Soviet space race win\xe2\x80\xa6 https://t.co/JizgcNJIz5'
TechCrunch,1177294267389292545,2019-09-26 18:50:01,b'Europe shows the way in online privacy https://t.co/mX8oVptsNo'
TechCrunch,1177290267898077185,2019-09-26 18:34:07,b'Europe shows the way in online privacy https://t.co/ZJ81km2iIt by @alimitchell'
TechCrunch,1177286137490153472,2019-09-26 18:17:42,"b'The Kobalt EC-1, Part IV: Kobalt\xe2\x80\x99s edge in changing the music industry https://t.co/v7doHmpTCw by @epeckham'"
TechCrunch,1177285046727634944,2019-09-26 18:13:22,b'25+ launches from Uber\xe2\x80\x99s big event https://t.co/gqsVSX83Sd by @JoshConstine https://t.co/k73xyc2luT'
TechCrunch,1177280246237630465,2019-09-26 17:54:18,b'Oculus CTO: \xe2\x80\x98We missed an opportunity\xe2\x80\x9d with Gear VR https://t.co/G9UKAFLU8M by @lucasmtny'
TechCrunch,1177274931589124096,2019-09-26 17:33:11,b'Daily Crunch: Amazon announces new Alexa devices https://t.co/3upCTkNTmo by @anthonyha https://t.co/C6meVpBj2q'
TechCrunch,1177272553263575042,2019-09-26 17:23:44,b'Israeli VC Pico Venture Partners closes on $80M https://t.co/OlgaUXkC3o by @kateclarktweets https://t.co/Jf06d4hvxB'
TechCrunch,1177272333943353344,2019-09-26 17:22:51,b'Uber Incubator launches to develop new products and services https://t.co/3GO8qCe6ll by @meganrosedickey https://t.co/TbTUbuuze0'
TechCrunch,1177268551050256384,2019-09-26 17:07:49,b'Uber is adding the ability to text 911 in-app https://t.co/gksH0X3xEx by @meganrosedickey https://t.co/CM5rnON8Bg'
TechCrunch,1177265463698612229,2019-09-26 16:55:33,b'My Galaxy Fold display is damaged after a day https://t.co/w7uEPGYeuP by @bheater https://t.co/QshF4I8iXM'
TechCrunch,1177265096608931841,2019-09-26 16:54:06,"b'App Annie acquires analytics firm Libring, bringing ad tech-related insights to its platform\xe2\x80\xa6 https://t.co/xUJjnknUIU'"
TechCrunch,1177264030991339520,2019-09-26 16:49:52,b'The future of Uber depends on promoting Eats https://t.co/gqsVSX83Sd by @JoshConstine https://t.co/QJNSbdQUHr'
TechCrunch,1177257107713921024,2019-09-26 16:22:21,b'The time is right for Apple to buy Sonos https://t.co/bq7mZ2pmRU by @etherington https://t.co/Z9aoNqGSVi'
TechCrunch,1177253535869820930,2019-09-26 16:08:09,b'The Google Assistant can now control your Xbox One https://t.co/sjRI7gvyUN by @fredericl https://t.co/I9QBp28XmZ'
TechCrunch,1177252059604824064,2019-09-26 16:02:17,b'Breaking a sweat with Nintendo\xe2\x80\x99s Ring Fit Adventure https://t.co/4xf5slojxT by @bheater https://t.co/WsIb8Rai60'
TechCrunch,1177252022787203072,2019-09-26 16:02:09,b'Learn how to help build a sustainable gig economy at Disrupt SF https://t.co/0bOZZBLjVK https://t.co/qU4WeqPA5E'
TechCrunch,1177250541283397638,2019-09-26 15:56:15,b'Beyond Pricing raises $42M to tell you what to charge on Airbnb https://t.co/oyDeoZ40bb by @joshconstine https://t.co/qigXJuk010'
TechCrunch,1177249423816056833,2019-09-26 15:51:49,b'Terminal raises $17M led by 8VC to source and build remote teams of engineers https://t.co/1nQFiOXYim by @ingridlunden'
TechCrunch,1177245201733234688,2019-09-26 15:35:02,"b'Serial founder @dcancel to share people-first, SaaS insights at Disrupt SF next week https://t.co/Hnh8aZUMKD'"
TechCrunch,1177243728324550656,2019-09-26 15:29:11,b'Alexa developers can now personalize their skills by recognizing the user\xe2\x80\x99s voice https://t.co/gMA0Wus61P'
TechCrunch,1177240180669001728,2019-09-26 15:15:05,b'Alexa developers can now personalize their skills by recognizing the user\xe2\x80\x99s voice https://t.co/96VAt8IqKb by\xe2\x80\xa6 https://t.co/9YH4tQoZvT'
TechCrunch,1177237161231495168,2019-09-26 15:03:05,b'OnePlus 7T arrives with Android 10 in October for $599 https://t.co/qNPM7TBNJe by @bheater https://t.co/iOugyPOGbp'
TechCrunch,1177231476011741184,2019-09-26 14:40:30,b'Amazon makes it easier for smart home devices to alert customers to low supply levels https://t.co/Yd7qoVlNpK by\xe2\x80\xa6 https://t.co/sIn3qu4AX8'
TechCrunch,1177230109339725824,2019-09-26 14:35:04,b'Battlefield vets StrongSalt (formerly OverNest) announces $3M seed round https://t.co/EBN4sBx2HF by @ron_miller https://t.co/EeMBHjrrap'
TechCrunch,1177229263004721153,2019-09-26 14:31:42,"b'Serial founder David Cancel to share people-first, SaaS insights at Disrupt SF next week https://t.co/ltt0Bpxj1y https://t.co/uRz2wgCJnM'"
TechCrunch,1177229199721074688,2019-09-26 14:31:27,b'Entrepreneurs Roundtable Accelerator introduces 12 new startups at demo day https://t.co/pHRpV0J6qs by @jordanrcrook https://t.co/4HowvD3zlQ'
TechCrunch,1177222678006120448,2019-09-26 14:05:32,b'https://t.co/Q6WY6m5P6R raises $11.4M to help developers observe and debug their apps https://t.co/KTVYLrpr3N by\xe2\x80\xa6 https://t.co/SObsULjdSI'
TechCrunch,1177222548662231040,2019-09-26 14:05:01,b'RT @ExtraCrunch: We\xe2\x80\x99ve come a long way with voice-based interfaces in the last several years https://t.co/KVFTxQj0SB'
TechCrunch,1177221868845223936,2019-09-26 14:02:19,b'Mercury banks $20M for its banking service aimed at startups https://t.co/9DLqM00Yjj by @ingridlunden'
TechCrunch,1177221798544297984,2019-09-26 14:02:03,b'Package Free picks up $4.5 million to scale sustainable CPG products https://t.co/WTdWkQcbUt by @jordanrcrook https://t.co/FuXHnbTN8U'
TechCrunch,1177221603018584065,2019-09-26 14:01:16,b'Airbus-owned Voom brings its on-demand helicopter service to the U.S. with SF Bay Area launch\xe2\x80\xa6 https://t.co/IesnVhvrEp'
TechCrunch,1177220792129609729,2019-09-26 13:58:03,"b'Apple\xe2\x80\x99s iOS and iPadOS 13 support multiple PS4 or Xbox One controllers, which could be huge for Arcade\xe2\x80\xa6 https://t.co/L01yWCHHlf'"
TechCrunch,1177218927308546048,2019-09-26 13:50:38,b'Amazon Echo gets more family-friendly https://t.co/XjSrc2U7yA'
TechCrunch,1177218681673322497,2019-09-26 13:49:40,b'Facebook secures exclusive digital rights for ICC cricket events https://t.co/Ro9oEzxvP2'
TechCrunch,1177217558048583681,2019-09-26 13:45:12,b'Everything Amazon announced at its Alexa event https://t.co/a9ei4wNcMM by \n@sarahintampa'
TechCrunch,1177214192195125249,2019-09-26 13:31:49,b'Verizon lights up 5G in (parts of) NYC https://t.co/DvkiovOSeg by @bheater https://t.co/9pNw1Ht843'
TechCrunch,1177206492686147584,2019-09-26 13:01:13,b'Tribe leads $12M Series A into Teampay to make managing employee expenses painless https://t.co/hatjaLDPXz https://t.co/IBNy8fJrPV'
TechCrunch,1177199042398511104,2019-09-26 12:31:37,b'Nigeria\xe2\x80\x99s CcHub acquires Kenya\xe2\x80\x99s iHub to create mega Africa incubator https://t.co/hEqGRE2Tb3 by @JakeRBright https://t.co/ikD2IDJLNu'
TechCrunch,1177198878770286599,2019-09-26 12:30:58,"b'Voter manipulation on social media now a global problem, report finds https://t.co/vZASY0U4x5 by @riptari https://t.co/GVOlUqExMd'"
TechCrunch,1177176704999051266,2019-09-26 11:02:52,b'Paro raises $10 million series B to offer corporate finance expertise on demand https://t.co/z46xAox4bb https://t.co/ge5qNz6fJt'
TechCrunch,1177167537303445504,2019-09-26 10:26:26,b'Code slingers: Apply to the Hackathon at Disrupt Berlin 2019 https://t.co/fdhEKGf30j'
TechCrunch,1177161959810183169,2019-09-26 10:04:16,"b'YouTuber Caspar Lee co-founds Influencer marketing platform, raises \xc2\xa33M Series A https://t.co/x2sX8nQQTR by\xe2\x80\xa6 https://t.co/xlqoXyMNMR'"
TechCrunch,1177161732688470017,2019-09-26 10:03:22,"b'Summer wants to vanquish student loans for borrowers, and now has $10M to do it https://t.co/c5XmxOj8bR https://t.co/agag9iidJd'"
TechCrunch,1177153506802851841,2019-09-26 09:30:41,"b'Project A, the Berlin-based VC, raises $200M fund to back seed and Series A European startups https://t.co/4G5pb16ygY by @sohear'"
TechCrunch,1177135713042796547,2019-09-26 08:19:58,b'Facebook secures exclusive digital rights for ICC cricket events https://t.co/tiEzqxXxQt by @refsrc https://t.co/o2SMfxjKaT'
TechCrunch,1177133748678250498,2019-09-26 08:12:10,b'Luminance CEO Emily Foges joins us at Disrupt Berlin https://t.co/GVqAIFhegb by @romaindillet https://t.co/ZE7fYuMhAP'
TechCrunch,1177133403428274177,2019-09-26 08:10:48,b'India\xe2\x80\x99s Darwinbox raises $15M to bring its HR tech platform to more Asian markets https://t.co/H3ISWk6JAA by @refsrc'
TechCrunch,1177103450791919616,2019-09-26 06:11:46,b'Indonesia\xe2\x80\x99s ride-hailing giant Gojek launches video streaming service GoPlay https://t.co/dkBtFaPcHu by @refsrc https://t.co/8AIYVpIHe1'
TechCrunch,1177102764792516608,2019-09-26 06:09:03,"b'Gogoro launches its newest electric vehicle, a lightweight scooter called Viva https://t.co/tnrN6EOVeO by\xe2\x80\xa6 https://t.co/U1jBlepjmk'"
TechCrunch,1177087165987246080,2019-09-26 05:07:04,b'Amazon Echo gets more family-friendly: https://t.co/mL1AA2hNNh by @sarahintampa'
TechCrunch,1177054549464551424,2019-09-26 02:57:27,"b'Vested, a newly minted startup, aims to help startup employees understand precisely when to buy their options\xe2\x80\xa6 https://t.co/xmbP84wNi6'"
TechCrunch,1177030969389395969,2019-09-26 01:23:45,"b'RT @ExtraCrunch: CEO ouster, looming layoffs and devaluation turn WeWork into cautionary tale https://t.co/2MNj6QYwYO'"
TechCrunch,1177025099309953027,2019-09-26 01:00:26,b'Everything Amazon announced at its Alexa event today https://t.co/a9ei4wNcMM by @sarahintampa https://t.co/lrn6eHTc0Z'
TechCrunch,1177009402232152065,2019-09-25 23:58:03,"b'CEO ouster, looming layoffs and devaluation turn WeWork into cautionary tale https://t.co/Q0aTHfteiR'"
TechCrunch,1176986762775805952,2019-09-25 22:28:06,b'Hands-on with Oculus Link: Rift who? https://t.co/0ENasOxhdl by @lucasmtny https://t.co/ngT3Bm5BJ8'
TechCrunch,1176985062161571841,2019-09-25 22:21:20,"b""When VCs are dying to get into your round, they'll give you more terms like voting control. When your company is ho\xe2\x80\xa6 https://t.co/sl9nBvMtyt"""
TechCrunch,1176981436383076352,2019-09-25 22:06:56,"b'Using AI to improve dentistry, VideaHealth gets a $5.4 million polish https://t.co/sUxYN8VOyG by @jshieber https://t.co/dQWDh9p2dZ'"
TechCrunch,1176972815658115072,2019-09-25 21:32:41,b'Spanish startup Elma gets $3.2M for a digital-first health insurance play https://t.co/OXw3MuzyiM by @riptari https://t.co/5HjvuqCsG6'
TechCrunch,1176969656839655425,2019-09-25 21:20:07,"b'Ears-on with Amazon\xe2\x80\x99s new Echo earbuds, framebuds, and ringbud https://t.co/8aF5lZFRqG https://t.co/8zoolgJSm7'"
TechCrunch,1176968108596056064,2019-09-25 21:13:58,"b'RT @KateClarkTweets: Scoop: Remember Bodega, the company that endured weeks of ridicule for its culturally insensitive name? Now known as @\xe2\x80\xa6'"
TechCrunch,1176967230392848385,2019-09-25 21:10:29,"b'Bodega, once dubbed \xe2\x80\x98America\xe2\x80\x99s most hated startup,\xe2\x80\x99 has quietly raised millions https://t.co/ue7Zcp96ID by\xe2\x80\xa6 https://t.co/mS4V2kHHGT'"
TechCrunch,1176965681566420993,2019-09-25 21:04:20,"b'JUMP, Lime, Scoot and Spin receive permits to operate scooters in SF https://t.co/5G2XP49i5r by @meganrosedickey https://t.co/LLEoXwONFU'"
TechCrunch,1176963072323461122,2019-09-25 20:53:58,b'Is Amazon\xe2\x80\x99s Alexa ready to leave home and become a wearable voice assistant? https://t.co/rpK3Qu0aCD by @etherington https://t.co/NTHUAq6cU1'
TechCrunch,1176961832990494721,2019-09-25 20:49:02,b'Meal replacement company Soylent adds mint chocolate flavor https://t.co/xBef1ttWQy by @jshieber https://t.co/xkiHgivfZ9'
TechCrunch,1176953777443749894,2019-09-25 20:17:01,b'Symantec\xe2\x80\x99s Sheila Jordan named to Slack\xe2\x80\x99s board of directors https://t.co/FM0C8Kt0ur by @kateclarktweets https://t.co/VAIysaQYOH'
TechCrunch,1176946285481463808,2019-09-25 19:47:15,b'Announcing the custom contests for the TC Hackathon at Disrupt SF https://t.co/YGEyQeO8G3 https://t.co/7dMCSZGjPu'
TechCrunch,1176933222648897538,2019-09-25 18:55:21,b'Oculus shows off its latest next-generation headset prototypes https://t.co/gPAtu9DDMg by @lucasmtny https://t.co/ZyAUPkFm49'
TechCrunch,1176932695676526593,2019-09-25 18:53:15,b'How Amazon is closing out competitors by opening up voice https://t.co/4ygIrjW6yJ by @ingridlunden'
TechCrunch,1176932170339889152,2019-09-25 18:51:10,b'Your guide to WeWork\xe2\x80\x99s CEO shuffle https://t.co/GPMsOabfjn by @kateclarktweets and @alex https://t.co/q0ZdiXmU9T'
TechCrunch,1176930857812221952,2019-09-25 18:45:57,b'Amazon wants to put microphones into your rings and glasses https://t.co/3li5oMdc8L by @fredericl https://t.co/6KNyV26t0M'
TechCrunch,1176930507352920064,2019-09-25 18:44:33,"b'RT @ExtraCrunch: How to sell a startup for a $1B, Automattic, WeWork craziness, Kobalt, Netflix, Blackstone, and ClimateTech https://t.co/r\xe2\x80\xa6'"
TechCrunch,1176927811652792325,2019-09-25 18:33:51,b'Oculus and Respawn announce a Nazi-killing VR shooter https://t.co/yCw5MrxS6f by @lucasmtny https://t.co/osY79ayMp7'
