TechCrunch,1186492816907816960,2019-10-22 04:01:46,b'FT launches a new consulting arm focused on helping businesses use consumer data https://t.co/KW5k0gizCZ by\xe2\x80\xa6 https://t.co/VXCGiGSSfr'
TechCrunch,1186459869320220672,2019-10-22 01:50:50,b'Here\xe2\x80\x99s the very last trailer for Star Wars: The Rise of Skywalker https://t.co/tzQTOSlPX9 by @grg https://t.co/KvjI6rT2rd'
TechCrunch,1186447714357338112,2019-10-22 01:02:32,"b'Through partnerships and a new software toolkit, Nvidia looks to surf the 5G wave https://t.co/CYY3KmHCTj by\xe2\x80\xa6 https://t.co/HJ5Cl6PLf8'"
TechCrunch,1186401661515907073,2019-10-21 21:59:33,b'India moves closer to regulating internet services as it fears \xe2\x80\x98unimaginable disruption to democracy\xe2\x80\x99\xe2\x80\xa6 https://t.co/S8yCx6TMSy'
TechCrunch,1186400709211840513,2019-10-21 21:55:45,b'\xe2\x80\x9cPeople fix things. Tech doesn\xe2\x80\x99t fix things.\xe2\x80\x9d https://t.co/muzNJqDUKn https://t.co/Xd3a3LYlI8'
TechCrunch,1186372341162528769,2019-10-21 20:03:02,b'Report: SoftBank is taking control of WeWork at an ~$8B valuation https://t.co/6A9KDup4rd by @kateclarktweets https://t.co/sVZrZCKNZX'
TechCrunch,1186372092343865344,2019-10-21 20:02:03,b'6 tips founders need to know about securing their startup https://t.co/7xvZuKFpOu by @zackwhittaker https://t.co/yTphu5URRK'
TechCrunch,1186365204285788162,2019-10-21 19:34:40,b'NASA\xe2\x80\x99s Jim Bridenstine says 2035 is doable for human landing on Mars \xe2\x80\x93 provided budget is there\xe2\x80\xa6 https://t.co/r3hwEvPinQ'
TechCrunch,1186362235872010242,2019-10-21 19:22:53,"b'The Station: Volvo evolves, Skip trips and touchscreen tech https://t.co/ahj6zZGvtX by @kirstenkorosec https://t.co/pAfFswSOTD'"
TechCrunch,1186360394232803328,2019-10-21 19:15:34,b'Daily Crunch: We review the Pixel 4 https://t.co/rfrwTX6r2I by @anthonyha https://t.co/q0z4pV98RT'
TechCrunch,1186356302672478208,2019-10-21 18:59:18,b'Is there room for a U.S. equivalent to China\xe2\x80\x99s #1 news app? https://t.co/SysdiXfWTS by @catherineshu https://t.co/0mZHJcco11'
TechCrunch,1186355652475703296,2019-10-21 18:56:43,b'RT @ExtraCrunch: TechCrunch wants to talk to the best cybersecurity investors in the world. Have you worked with a great VC in the space? L\xe2\x80\xa6'
TechCrunch,1186354967394902016,2019-10-21 18:54:00,b'Alcide is a code to production security company for workloads running on Kubernetes #TCDisrupt https://t.co/Q8HOAxQA83'
TechCrunch,1186350837125308423,2019-10-21 18:37:35,b'New Facebook features fight election lies everywhere but ads https://t.co/x9vVTbfS62 by @joshconstine https://t.co/8Ic8M2z9l3'
TechCrunch,1186350719370031105,2019-10-21 18:37:07,b'Twitch hires former Zynga exec Doug Scott as Chief Marketing Officer https://t.co/MTuvgSM76z by @sarahintampa https://t.co/GKuwzUdUdI'
TechCrunch,1186335572979109889,2019-10-21 17:36:56,"b'RT @KateClarkTweets: Scoop: Superhuman founder Rahul Vohra is pitching LPs on a $4M fund, citing the email service\'s ""aspirational brand an\xe2\x80\xa6'"
TechCrunch,1186335416905011203,2019-10-21 17:36:19,b'Superhuman founder seeks to raise debut venture fund https://t.co/M3aHCMvzre by @kateclarktweets https://t.co/KVbPbTR7L6'
TechCrunch,1186330031477477377,2019-10-21 17:14:55,b'Microsoft acquires Mover to help with Microsoft 365 cloud migration https://t.co/Sc8gAnJNjM by @ron_miller https://t.co/ROjjmU4NQV'
TechCrunch,1186329092288925697,2019-10-21 17:11:11,b'Shine Bathroom raises $750K for a smart home add-on that flushes away your toilet doldrums https://t.co/6l0EVpQHlt\xe2\x80\xa6 https://t.co/AKzdbO6LT5'
TechCrunch,1186326753515622401,2019-10-21 17:01:53,b'Africa: more gazelles at home than unicorn IPOs abroad https://t.co/n83Ko9v8DX by @JakeRBright https://t.co/5mIXEw8UJO'
TechCrunch,1186323659142696960,2019-10-21 16:49:35,b'YouTube founder secretly building sports fan game GreenPark https://t.co/iE7Fqo8LT0 by @joshconstine https://t.co/eILsJO29wD'
TechCrunch,1186320515465711617,2019-10-21 16:37:06,b'Sydney\xe2\x80\x99s AirTree Ventures closes $275M fund as Aussie unicorns gather pace https://t.co/PGV2CLNNUo by @mikebutcher https://t.co/7Rt1g4j1Av'
TechCrunch,1186320257713090560,2019-10-21 16:36:04,b'Moon\xe2\x80\x99s browser extension lets you pay with bitcoin on Amazon https://t.co/0A8KVqHgLX by @romaindillet https://t.co/B5zZNyldUe'
TechCrunch,1186315614463418369,2019-10-21 16:17:37,b'Nielsen says it can now measure Amazon Prime Video https://t.co/YZydZsUOmN by @sarahintampa https://t.co/MgUC7bV0I4'
TechCrunch,1186309787732066305,2019-10-21 15:54:28,b'Apple\xe2\x80\x99s control over the App Store is no longer sustainable https://t.co/NS6Hn3JydW by @romaindillet https://t.co/0RZvBwk4sG'
TechCrunch,1186300406957248515,2019-10-21 15:17:12,b'Netflix to raise $2 billion in debt to fund more content spending. https://t.co/Vawau7E2dJ'
TechCrunch,1186298837352222720,2019-10-21 15:10:57,"b'Digital ad spend reached $57.9B in the first half of 2019, but growth has slowed (IAB report)\xe2\x80\xa6 https://t.co/8OAWlRSCBX'"
TechCrunch,1186285206254313475,2019-10-21 14:16:47,"b'RT @zackwhittaker: New: NordVPN, a widely used VPN provider, says it was hacked. https://t.co/8PUWkyEaP2'"
TechCrunch,1186285197916024832,2019-10-21 14:16:45,b'Veteran enterprise exec Bob Stutz is heading back to SAP https://t.co/7B135gsGyO by @ron_miller'
TechCrunch,1186280709465530371,2019-10-21 13:58:55,b'AT&amp;T TV Now streaming service gets yet another price hike https://t.co/dJ9GSfqpi0 by @sarahintampa https://t.co/N77DA1bMOa'
TechCrunch,1186270916164104197,2019-10-21 13:20:00,b'Don\xe2\x80\x99t miss out: Apply for the TC Hackathon at Disrupt Berlin 2019 https://t.co/wV9nhjhldT'
TechCrunch,1186266585079730176,2019-10-21 13:02:48,"b'The Surface Pro 7 is a competent upgrade with USB-C, refreshed processors, but little else that\xe2\x80\x99s new\xe2\x80\xa6 https://t.co/36LphApJn1'"
TechCrunch,1186266334658809856,2019-10-21 13:01:48,b'Pixel 4 review: Google ups its camera game https://t.co/aXZJxQfjSv by @bheater https://t.co/69uONtl8Q1'
TechCrunch,1186264118577242114,2019-10-21 12:53:00,b'Rocket Lab aims to deliver small satellites to the Moon and beyond https://t.co/eQIyvrX8LN by @etherington https://t.co/WgUgWPp9mh'
TechCrunch,1186243651153858560,2019-10-21 11:31:40,b'Spiff pitches a way to automate sales commissions calculations https://t.co/8vDshyP3dR by @jshieber https://t.co/YdRLsTX38r'
TechCrunch,1186187066146807808,2019-10-21 07:46:49,b'Commercetools raises $145M from Insight for Shopify-style e-commerce APIs for large enterprises https://t.co/3zvf5Ds5tn by @ingridlunden'
TechCrunch,1186155825280290816,2019-10-21 05:42:41,b'Gojek founder and CEO Nadiem Makarim resigns to join Indonesian cabinet; Soelistyo and Aluwi to be new co-CEOs\xe2\x80\xa6 https://t.co/YlMyJqXInL'
TechCrunch,1186059647255486469,2019-10-20 23:20:30,"b'In a big reversal, Libra reportedly could peg its cryptocurrencies to national currencies https://t.co/IkNu4udGPq b\xe2\x80\xa6 https://t.co/0rF3FAtFEi'"
TechCrunch,1186047672668565509,2019-10-20 22:32:55,b'Should we rethink the politics of \xe2\x80\x98blocking\xe2\x80\x99? https://t.co/zo7s7I03pD https://t.co/RPdHPEtPKZ'
TechCrunch,1186025785062236160,2019-10-20 21:05:57,b'Original Content podcast: \xe2\x80\x98El Camino\xe2\x80\x99 provides a quiet coda to \xe2\x80\x98Breaking Bad\xe2\x80\x99 https://t.co/tDMmkKtl8O by @anthonyha\xe2\x80\xa6 https://t.co/CP4faCiAeD'
TechCrunch,1186024505740804097,2019-10-20 21:00:52,b'Former Oracle co-CEO Mark Hurd has passed away https://t.co/0hGSzQ9F0k'
TechCrunch,1185990566074564609,2019-10-20 18:46:00,b'Voxel51 is a built in AI platform that lets users extract insights from video #TCDisrupt https://t.co/85jsWjc3D5'
TechCrunch,1185988615375073283,2019-10-20 18:38:15,b'The Los Angeles Fire Department wants more drones https://t.co/5iEfcReus4 by @jshieber https://t.co/fv4LO8Fj0H'
TechCrunch,1185958177877217288,2019-10-20 16:37:18,b'Max-Q: This week in space https://t.co/Xgj2mIV31e by @etherington https://t.co/WqaHoOp98t'
TechCrunch,1185954569899139072,2019-10-20 16:22:58,b'Week in Review: The web\xe2\x80\x99s free speech conundrum https://t.co/WWFkaPEmOo by @lucasmtny https://t.co/mqpEauYLwM'
TechCrunch,1185911581646970880,2019-10-20 13:32:08,"b'China Roundup: Tencent\xe2\x80\x99s NBA test, TikTok parent deepens education push https://t.co/kq99IJNIMh by @ritacyliao https://t.co/ns4TPKfkf7'"
TechCrunch,1185903890857938945,2019-10-20 13:01:35,"b""Facebook isn't free speech, it's algorithmic amplification optimized for outrage by @rezendi https://t.co/ikc8SZGUq7"""
TechCrunch,1185680384002052098,2019-10-19 22:13:27,"b'IPOs are the beginning, not the end https://t.co/kDxFgB9EEY by @fredericl https://t.co/3pqUcUTEmx'"
TechCrunch,1185658991470399488,2019-10-19 20:48:26,"b'MediaLab acquires messaging app Kik, expanding its app portfolio https://t.co/7r1GloDhD1 by @jshieber https://t.co/on26SEGCJC'"
TechCrunch,1185639529702707208,2019-10-19 19:31:06,b'How Unity built the world\xe2\x80\x99s most popular game engine https://t.co/ee8KaancS8'
TechCrunch,1185624906622472193,2019-10-19 18:33:00,b'Sparkle makes biodegradable sanitary pads that are plastic and chemical free #TCDisrupt https://t.co/5i4zEiajrt'
TechCrunch,1185616976892321793,2019-10-19 18:01:29,"b'This Week in Apps: League of Legends goes mobile, Tim Cook talks to China and more https://t.co/Mc6yPCBR9G by\xe2\x80\xa6 https://t.co/jWiVMr6KTW'"
TechCrunch,1185609314842677249,2019-10-19 17:31:02,b'HuffPost is reportedly on the auction block https://t.co/iQQ3ZVcykQ by @jshieber https://t.co/1r9k8w5r0l'
TechCrunch,1185597991194943490,2019-10-19 16:46:03,b'The new iPhone is ugly https://t.co/7YQDtYwK5L https://t.co/GzFjWx5Raa'
TechCrunch,1185573365656031232,2019-10-19 15:08:11,"b'RT @zackwhittaker: New: Mercedes-Benz car owners have said the app, which lets you remotely track, start/stop and lock/unlock your car, was\xe2\x80\xa6'"
TechCrunch,1185547270944645120,2019-10-19 13:24:30,b'HTC releases a cheaper blockchain phone https://t.co/5KsSvNlVHf by @bheater https://t.co/NhWd7LQtKt'
TechCrunch,1185526374498480129,2019-10-19 12:01:28,"b'Startups Weekly: The unicorn from down under, an Uber TV show and All Raise\xe2\x80\x99s expansion https://t.co/Fw9ZJgCJJd by\xe2\x80\xa6 https://t.co/OaVW0k6bOg'"
TechCrunch,1185351849957908480,2019-10-19 00:27:58,"b'Apple\xe2\x80\x99s China stance makes for strange political alliances, as AOC and Ted Cruz slam the company\xe2\x80\xa6 https://t.co/J3sUl5pzaC'"
TechCrunch,1185336286493708291,2019-10-18 23:26:07,b'AI is helping scholars restore ancient Greek texts on stone tablets https://t.co/JRexMacVbZ https://t.co/xJ2JFN847K'
TechCrunch,1185320570898059266,2019-10-18 22:23:40,b'Adam Neumann planned for his children and grandchildren to control WeWork https://t.co/d5u2ySvcMQ by @cookie https://t.co/15wxaF0wb4'
TechCrunch,1185306182300385282,2019-10-18 21:26:30,"b""NASA's first-ever all-woman spacewalk was a success https://t.co/3HBMsn20ed https://t.co/2Sqc0gVzZt"""
TechCrunch,1185302204032475143,2019-10-18 21:10:41,b'VR/AR startup valuations reach $45 billion (on paper) https://t.co/CtWSgo3Ylw by @DigiCapitalist https://t.co/iSYY1Lijcj'
TechCrunch,1185301067833188352,2019-10-18 21:06:11,b'Tilting Point acquires game monetization startup Gondola https://t.co/8tCvL6oMnn by @anthonyha https://t.co/DgQxICIIel'
TechCrunch,1185288509512470528,2019-10-18 20:16:16,b'Where are US fintech\xe2\x80\x99s next billion-dollar startups? https://t.co/fnvXWECiQL by @jshieber https://t.co/gLGoh562GQ'
TechCrunch,1185267178930626560,2019-10-18 18:51:31,b'Alphabet\xe2\x80\x99s Wing begins making first commercial drone deliveries in the U.S. https://t.co/ahxpqA5isn by @etherington https://t.co/iJ4Vbx6IV2'
TechCrunch,1185265664442937355,2019-10-18 18:45:30,b'Daily Crunch: Zuckerberg has thoughts on free speech https://t.co/44fRpNgG2s by @anthonyha https://t.co/ZW6UlJjud0'
TechCrunch,1185265142101106689,2019-10-18 18:43:25,b'Just in: Harley-Davidson has resumed production of the LiveWire \xe2\x80\x94 @kirstenkorosec. https://t.co/xUXjgh4dC7'
TechCrunch,1185260254059098112,2019-10-18 18:24:00,b'Moodbit wants to reform the HR tech industry by focusing on employees emotions #TCDisrupt https://t.co/83FNOYmvvN'
TechCrunch,1185259191553970177,2019-10-18 18:19:46,b'Who will own the future of transportation? https://t.co/VDsVu2K5xv by @kirstenkorosec https://t.co/1TxjG4rzmr'
TechCrunch,1185252933987909633,2019-10-18 17:54:55,b'$35B face data lawsuit against Facebook will proceed https://t.co/DJoZhY495R by @joshconstine https://t.co/NfTTM9dbw9'
TechCrunch,1185250691973091328,2019-10-18 17:46:00,"b'Bloomberg Beta, now six years old, closes its third $75 million fund https://t.co/QapzfD9xB0 by @cookie https://t.co/Pas0fpfI51'"
TechCrunch,1185225973006061568,2019-10-18 16:07:47,b'YellowHeart allows musicians and concert organizers to take more control of resold tickets https://t.co/8MTGez8NoC\xe2\x80\xa6 https://t.co/Zuhn3mdOBp'
TechCrunch,1185225692784390145,2019-10-18 16:06:40,b'Exclusive: 2019 HAX report reveals hardware startup trends https://t.co/ciTPvSMk69 by @mjburnsy https://t.co/so0v13uxOW'
TechCrunch,1185224809522892800,2019-10-18 16:03:09,b'Former Oracle co-CEO Mark Hurd has passed away https://t.co/VeN26uL9mt by @cookie https://t.co/lq1KIouXCK'
TechCrunch,1185209868304769024,2019-10-18 15:03:47,"b'RT @zackwhittaker: Exclusive: Researchers have released a set of long-awaited decryption tools for Stop (Djvu), one of the most active rans\xe2\x80\xa6'"
TechCrunch,1185206386214555648,2019-10-18 14:49:57,"b'On this week\xe2\x80\x99s #equitypod: @saranormous, @Kateclarktweets and @Alex  are curious if the Softbank implosions will br\xe2\x80\xa6 https://t.co/46pLyoH3VR'"
TechCrunch,1185201707585814528,2019-10-18 14:31:21,b'Three of the best tackle the thorny issue of Brexit for startups at Disrupt Berlin https://t.co/cBbJQzF216 by\xe2\x80\xa6 https://t.co/kaYss9k9l4'
TechCrunch,1185199870258417664,2019-10-18 14:24:03,b'RT @ExtraCrunch: How Unity built the world\xe2\x80\x99s most popular game engine https://t.co/fJHM1PY2wo'
TechCrunch,1185191979858235393,2019-10-18 13:52:42,b'Report: T-Mobile partners with Jeffrey Katzenberg\xe2\x80\x99s mobile streaming service Quibi https://t.co/YBMhSVRVef by\xe2\x80\xa6 https://t.co/eFFmhQROr0'
TechCrunch,1185179278578597888,2019-10-18 13:02:14,b'Greylock GP Sarah Guo is as bullish on SaaS as ever https://t.co/en7WpJUbg0 by @alex and @kateclarktweets https://t.co/go2DLPaxOc'
TechCrunch,1185154744609857536,2019-10-18 11:24:44,b'Volvo creates a dedicated business for autonomous industrial and commercial transport https://t.co/Hk1YCrXsF7 by\xe2\x80\xa6 https://t.co/41jMpyuUv7'
TechCrunch,1185146544011517955,2019-10-18 10:52:09,b'Japan will participate in NASA\xe2\x80\x99s Lunar Gateway project for the Artemis program https://t.co/0Qt1GbOVAX by\xe2\x80\xa6 https://t.co/jJbiTCx4Im'
TechCrunch,1185139905145593857,2019-10-18 10:25:46,b'Watch NASA\xe2\x80\x99s first ever all-woman spacewalk live https://t.co/3HBMsn20ed by @etherington https://t.co/nEm8IcaZD2'
TechCrunch,1185103615238774784,2019-10-18 08:01:34,b'Last few hours to apply: TC Top Picks @ Disrupt Berlin 2019 https://t.co/J0kktpQX3E https://t.co/myw9YMvyD3'
TechCrunch,1185091118603689984,2019-10-18 07:11:55,b'Mobile game startup Madbox raises $16.5 million after 100 million downloads https://t.co/BDUrSQbrIR by @romaindillet https://t.co/m0fUI8dKAl'
TechCrunch,1185067051779538944,2019-10-18 05:36:17,b'Kenyan telco Safaricom\xe2\x80\x99s Alpha incubator faces uncertain future https://t.co/95tqP2RcJG by @JakeRBright https://t.co/qtZaCocHaS'
TechCrunch,1184994954180988930,2019-10-18 00:49:47,b'Catalan separatists have tooled up with a decentralized app for civil disobedience https://t.co/RhCqyGvtpV by\xe2\x80\xa6 https://t.co/fgQZQi53B9'
TechCrunch,1184991348304338945,2019-10-18 00:35:28,b'Swarm gets green light from FCC for its 150-satellite constellation https://t.co/goikxNINUY https://t.co/b54MWSQhxm'
TechCrunch,1184981748653940738,2019-10-17 23:57:19,b'Airbnb\xe2\x80\x99s WeWork problem https://t.co/lSrzj7as7A by @kateclarktweets https://t.co/5MUsIgZgLn'
TechCrunch,1184978221328154624,2019-10-17 23:43:18,b'Getting press for your startup: the true role of communications https://t.co/GwfFT2MQZh'
TechCrunch,1184970265526198272,2019-10-17 23:11:41,"b'Every state but Alaska has reported vape lung victims, now numbering 1,479 nationwide https://t.co/wACxcXfpuC https://t.co/Qrd7Y44JY9'"
TechCrunch,1184969360546418690,2019-10-17 23:08:05,b'Nintendo Switch hits another sales milestone https://t.co/o6HR0m46G8 by @lucasmtny https://t.co/dYMMTQOT3N'
TechCrunch,1184959129519034368,2019-10-17 22:27:26,b'Getting press for your startup: the true role of communications https://t.co/M3Hn6blVU5 https://t.co/UUoJbUpG6J'
TechCrunch,1184937679206731779,2019-10-17 21:02:12,b'The battle to become the Mexican Nubank just started https://t.co/qVPcRUsoaE https://t.co/b6KhVUJ7AL'
TechCrunch,1184922403798999043,2019-10-17 20:01:30,"b'Atlassian acquires Code Barrel, makers of Automation for Jira https://t.co/ceeSoT9FS7 by @fredericl https://t.co/t3Mf8UJkY1'"
TechCrunch,1184917914010435585,2019-10-17 19:43:40,b'Update: Turns out yet another NVIDIA Shield streaming device leaked today: https://t.co/4FzCeGBbxm https://t.co/Tg2x1IW9Q4'
TechCrunch,1184916641718722560,2019-10-17 19:38:36,b'Bosch\xe2\x80\x99s new \xe2\x80\x98ear\xe2\x80\x99 for the Space Station\xe2\x80\x99s Astrobee robot will let it \xe2\x80\x98hear\xe2\x80\x99 potential mechanical issues\xe2\x80\xa6 https://t.co/5z46RFzGrF'
TechCrunch,1184911612765003776,2019-10-17 19:18:37,b'How Unity built the world\xe2\x80\x99s most popular game engine https://t.co/E99vTkLeSO by @epeckham https://t.co/avN2rvtsrr'
TechCrunch,1184909669573246976,2019-10-17 19:10:54,"b'Zubale, founded in Mexico City last year by two HBS grads, just raised $4.4 million to put locals to work over thei\xe2\x80\xa6 https://t.co/HucOha5Q1k'"
TechCrunch,1184909425418657792,2019-10-17 19:09:56,b'New NVIDIA Shield Android TV streaming device leaks via Amazon listing https://t.co/4FzCeGBbxm by @etherington https://t.co/MCBtRKI2IV'
TechCrunch,1184897456707952641,2019-10-17 18:22:22,b'HBO Max scores all 21 Studio Ghibli films https://t.co/PLXw7i0PBR by @lucasmtny https://t.co/OkK7BPhxql'
TechCrunch,1184896104363692033,2019-10-17 18:17:00,b'Greyparrot is building computer vision systems for the waste management industry #TCDisrupt https://t.co/JfrUrRXUJC'
TechCrunch,1184889176623321089,2019-10-17 17:49:28,b'Zuckerberg on Chinese censorship: Is that the internet we want? https://t.co/cbp3HbSGuG by @joshconstine https://t.co/26H4To4HtB'
TechCrunch,1184885001462005760,2019-10-17 17:32:53,"b'Google Maps adds more Waze-like features, including driving incident reports https://t.co/K6Zied3Nhk by\xe2\x80\xa6 https://t.co/a9M4dJncpT'"
TechCrunch,1184877589363613697,2019-10-17 17:03:25,"b'Juul will stop selling mango, creme, fruit and cucumber pod flavors https://t.co/60JDnKmuTb by @meganrosedickey https://t.co/66bafh9Csg'"
TechCrunch,1184877376360058883,2019-10-17 17:02:35,b'Luna Display now supports older Macs as a secondary screen https://t.co/nngxAVj2vl by @bheater https://t.co/iNQqUlyKNE'
TechCrunch,1184873682365272065,2019-10-17 16:47:54,b'Tesla gets green light to start producing EVs in China https://t.co/iS4rkiMxCy by @kirstenkorosec https://t.co/oab9Hq2O1v'
TechCrunch,1184869832455536641,2019-10-17 16:32:36,"b'The Information will launch Ticker, a tech news app that costs $29 per year https://t.co/OMH7Z4pSNe by @anthonyha https://t.co/Gb2JuKwu8X'"
TechCrunch,1184866040049745928,2019-10-17 16:17:32,b'\xe2\x80\x98Cloud kitchens\xe2\x80\x99 is an oxymoron https://t.co/FGLSUbiC0J https://t.co/KJ1M76dN3U'
TechCrunch,1184864207105335297,2019-10-17 16:10:15,b'MIT develops a way for robots to grasp and manipulate objects much faster https://t.co/kzidCJ31Pr by @etherington https://t.co/QquwKgGexW'
TechCrunch,1184847323123335168,2019-10-17 15:03:09,b'Latest IBM partnership looks to improve seafood safety with blockchain https://t.co/3BLfrly1bT by @ron_miller https://t.co/6GV7BewYWV'
TechCrunch,1184847176175947776,2019-10-17 15:02:34,b'Exclusive: Popular video downloading app Snaptube has been caught serving invisible ads and charging users for prem\xe2\x80\xa6 https://t.co/6Xsmqktars'
TechCrunch,1184845696974745600,2019-10-17 14:56:42,b'Logitech\xe2\x80\x99s MX Master 3 mouse and MX Keys keyboard should be your setup of choice https://t.co/RGJR8hqaDe by\xe2\x80\xa6 https://t.co/qEEer6bhrZ'
TechCrunch,1184839692115759104,2019-10-17 14:32:50,"b'Farewell, Google Clips https://t.co/8vSaHUcQJH by @bheater https://t.co/jrRGFyeKhI'"
TechCrunch,1184833779560538112,2019-10-17 14:09:20,b'Snapchat goes after retailers and DTC brands with new Dynamic Ads https://t.co/wtuXc8LN3v by @sarahintampa https://t.co/fnmRMPCuhj'
TechCrunch,1184831731133759488,2019-10-17 14:01:12,"b'Sentons launches SurfaceWave, a processor and tech to create software-defined surfaces that supercharge touch and g\xe2\x80\xa6 https://t.co/y7t8mysL7T'"
TechCrunch,1184831352056766464,2019-10-17 13:59:42,"b'Samsung confirms glaring S10 fingerprint reader flaw, promises fix https://t.co/1qQYeFBGdf by @bheater https://t.co/GHaKWba7rG'"
TechCrunch,1184830674752200705,2019-10-17 13:57:00,b'ArsenalBio emerges from stealth with $85 million and a dream team to fight cancer https://t.co/hV1kaYUqFC by\xe2\x80\xa6 https://t.co/75yKWBokm5'
TechCrunch,1184817844476928000,2019-10-17 13:06:01,b'Ekos announces $8M Series A to build software for craft breweries https://t.co/zBeTVNEjhF by @ron_miller'
TechCrunch,1184816991254790144,2019-10-17 13:02:38,b'Microsoft accessibility grants go out to companies aiming to improve tech for the disabled https://t.co/TJlf7V4fCP https://t.co/Aq0cFvaW8g'
TechCrunch,1184816689550155776,2019-10-17 13:01:26,b'Work management platform Asana launches new automation tools https://t.co/NzS8KA0bX2 by @fredericl https://t.co/yVcOQpSDUu'
TechCrunch,1184801980075655168,2019-10-17 12:02:59,b'Galileo Financial raises $77 million for its fintech services that were 19 years in the making\xe2\x80\xa6 https://t.co/UuvqV8BACV'
TechCrunch,1184771438806556673,2019-10-17 10:01:37,b'Pendo scores $100M Series E investment on $1 billion valuation https://t.co/sVLAbobjv3 by @ron_miller'
TechCrunch,1184769050083254272,2019-10-17 09:52:08,b'How to radically change finance through startups at TechCrunch Disrupt Berlin https://t.co/tzI5PW0HDK https://t.co/ZopzXdtw4N'
TechCrunch,1184735663607996418,2019-10-17 07:39:28,"b'TruTag raises $7.5 million Series C for tiny, edible barcodes that can be placed on pills, food and vaping systems\xe2\x80\xa6 https://t.co/3RFpEbBzl3'"
TechCrunch,1184733179640516609,2019-10-17 07:29:35,b'TikTok makes education push in India https://t.co/Livvw87L0B by @refsrc https://t.co/uaQAKMr9mY'
TechCrunch,1184729933039337472,2019-10-17 07:16:41,b'Winnow raises $12M Series B for its food waste solution for commercial kitchens https://t.co/Fvxw6Vihq8 by @sohear https://t.co/HiB368crXL'
TechCrunch,1184725977307537408,2019-10-17 07:00:58,b'Proportunity raises \xc2\xa32M seed for its \xe2\x80\x98help to buy\xe2\x80\x99-style property lending https://t.co/RU54AZdyKh by @sohear https://t.co/hoAkg9RVxR'
TechCrunch,1184703741569748993,2019-10-17 05:32:37,"b'Nigeria\xe2\x80\x99s #StopRobbingUs campaign could spur tech advocacy group, CEOs say https://t.co/cKZkWhPvjU by @JakeRBright https://t.co/INeqTlJYLu'"
TechCrunch,1184691255797788678,2019-10-17 04:43:00,"b'Zoho launches Catalyst, a new developer platform with a focus on microservices https://t.co/r9GElr3SlZ by @fredericl https://t.co/qflSRqpxVZ'"
TechCrunch,1184675229131558912,2019-10-17 03:39:19,b'Edge computing startup Pensando comes out of stealth mode with a total of $278 million in funding\xe2\x80\xa6 https://t.co/dXouY2d3NU'
TechCrunch,1184646882259296256,2019-10-17 01:46:41,b'Rocket Lab successfully launches fifth Electron rocket this year https://t.co/FjDp7XAXOE by @etherington https://t.co/HvDno2JMVQ'
TechCrunch,1184630173490143234,2019-10-17 00:40:17,"b'RT @zackwhittaker: Two years ago, a hacker group told me they broke into a massive dark web child porn site that had thousands of users. Tu\xe2\x80\xa6'"
TechCrunch,1184626501603483654,2019-10-17 00:25:41,b'Labor leaders and startup founders talk how to build a sustainable gig economy https://t.co/2whT7l5cMW by @ArmanTabatabai'
TechCrunch,1184619171981623296,2019-10-16 23:56:34,b'Watch Rocket Lab\xe2\x80\x99s next Electron rocket launch live https://t.co/sXmiGpulfK by @etherington https://t.co/ngyw4dk0Sa'
TechCrunch,1184614865484308480,2019-10-16 23:39:27,b'Shoe companies Rothy\xe2\x80\x99s and Steve Madden are at each other\xe2\x80\x99s throats https://t.co/pMPl9joxKn by @cookie https://t.co/6nIYUAfvZC'
TechCrunch,1184610206698881026,2019-10-16 23:20:56,b'MyGate raises $56M to bring its security management service to more gated communities in India\xe2\x80\xa6 https://t.co/yuWzwxiz0K'
TechCrunch,1184607492010983424,2019-10-16 23:10:09,b'Feast your eyes on the first interstellar comet ever directly observed https://t.co/j9Fkd7rztC'
TechCrunch,1184599517087326210,2019-10-16 22:38:28,b'Amazon\xe2\x80\x99s Echo gets a decent-sounding refresh https://t.co/Ce4bPRlkzp by @bheater https://t.co/f7vbvCCvWj'
TechCrunch,1184588046806765568,2019-10-16 21:52:53,b'Feast your eyes the first interstellar comet ever directly observed https://t.co/j9Fkd79YC4 https://t.co/BjAOYTKS4U'
TechCrunch,1184576743136550912,2019-10-16 21:07:58,b'The FrankOne is a simple and portable coffee brewing gadget https://t.co/tNITRzT3TW https://t.co/yBwcBxqgJY'
