,subreddit,title,timestamp
0,Android,ben yutuberim,2018-06-30 16:02:36
1,Android,Google Pay prepares integrating Google Pay Send features into the main app,2018-06-30 16:17:01
2,Android,New subreddit regarding smartphone forensics,2018-06-30 16:27:53
3,Android,"Watch ""HTC U12 PLUS Durability Test! A Clear Phone w/ No Buttons..."" On YouTube",2018-06-30 16:34:29
4,Android,App for maintaining lists of apps?,2018-06-30 16:47:22
5,Android,Google Photos App Help,2018-06-30 16:55:31
6,Android,Build Your Own Android IDE Using Syntax View (GitHub),2018-06-30 17:01:14
7,Android,Google is still using a really old keyboard interface inside Android messages emoji selector..,2018-06-30 17:16:14
8,Android,Four Alleged Xiaomi Mi Mix 3 Leaked Renders Show Massive Upgrade,2018-06-30 17:30:27
9,Android,Xiaomi Mi 8 Dual Frequency GPS Better Than Others Or Marketing Hype?,2018-06-30 17:35:15
10,Android,The mobile airbag may be coming to save your phone,2018-06-30 17:36:32
11,Android,Why do iPhone photos 'just look better' despite similar specs and dxomark scores?,2018-06-30 17:44:01
12,Android,How to create the perfect ad with audience targeting,2018-06-30 17:50:05
13,Android,Anyway to access my phone's hard-drive according to these constraints?,2018-06-30 17:51:18
14,Android,Where should i ask questions about Google chat/RCS?,2018-06-30 17:53:56
15,Android,تحميل تطبيق بيريسكوب periscope لبث فيديو مباشر و متابعة اخبار العالم,2018-06-30 18:12:03
16,Android,It’s that time of season for some new adidas,2018-06-30 18:13:04
17,Android,How to Install Android on PC,2018-06-30 18:17:17
18,Android,Photos disappearing when taken using camera shortcut,2018-06-30 18:19:16
19,Android,How/can I access WiFi/Bluetooth/etc. settings with one swipe on 5.0+?,2018-06-30 18:33:48
20,Android,Geekbench 4 benchmark confirms the snapdragon 835 for the RED Hydrogen One,2018-06-30 18:42:42
21,Android,Made the switch from apple to Android today,2018-06-30 18:46:55
22,Android,Isoland 2: Ashes of Time Gameplay (Android iOS),2018-06-30 19:11:05
23,Android,Need help with phone replacement options,2018-06-30 19:13:21
24,Android,Piano Kids,2018-06-30 19:19:40
25,Android,How is the Nexus 6P holding up ?,2018-06-30 19:22:31
26,Android,[Flash File] Accent A420 Firmware Download [Stock Rom],2018-06-30 19:31:15
27,Android,Sony's NeW Earbuds are Bite-Sized Noise Killers(With a catch),2018-06-30 19:34:06
28,Android,Sony's New Earbuds are Bite-Sized Noise Killers(With a catch),2018-06-30 19:34:45
29,Android,moto z problem,2018-06-30 19:36:43
30,Android,Remap game controller buttons to media playback,2018-06-30 19:51:21
31,Android,Why is Poweramp EQ different than system EQ?,2018-06-30 19:59:52
32,Android,Idle Crafting Empire,2018-06-30 20:02:18
33,Android,Huawei p20 pro case,2018-06-30 20:14:15
34,Android,NekoAnki: a gamified flashcard learning software,2018-06-30 20:15:16
35,Android,"World of Warships Blitz 1.0.0 на ПК (первый взгляд, установка управления)",2018-06-30 20:21:08
36,Android,Huawei P20 Pro Case,2018-06-30 20:24:50
37,Android,Samsung forces users to update their handsets,2018-06-30 20:25:48
38,Android,"If I delete my Google Payments profile, can I still access my previously purchased content?",2018-06-30 20:26:28
39,Android,Are there any launchers that support Android P's gesture navigation?,2018-06-30 20:26:29
40,Android,Modify battery saver?,2018-06-30 20:28:29
41,Android,Spotify Lite available on Google Play!,2018-06-30 20:34:31
42,Android,Looking for help with a bricked Huawei Mediapad M3,2018-06-30 20:36:49
43,Android,More information on unlocked devices using UP RCS on TMobile or just maybe more confusion.,2018-06-30 20:37:10
44,Android,Apps Updating... constantly,2018-06-30 20:37:59
45,Android,Beware of the car (Android iOS) Gameplay HD,2018-06-30 20:40:20
46,Android,Can anyone tell me how useful the Samsung Dex pad is? Amazon has it for $69 ($30 Off),2018-06-30 20:43:51
47,Android,"Not sure if this is the right sub but can anyone help me recover a video on a G7 after the police took my phone, switched off backup to cloud, deleted the vid, and emptied the trash? It was a video of them assaulting me.",2018-06-30 20:54:08
48,Android,Toy Odyssey: The Lost and Found (iOS/Android) Gameplay,2018-06-30 21:06:01
49,Android,Phone recomendations.,2018-06-30 21:21:29
50,Android,YouTube Picture in Picture Mode Rolls in the United States - Android News,2018-06-30 21:35:13
51,Android,Need help with Samsung galaxy tab S3. Bought a micro sd card and it won’t let me make it the main download storage.,2018-06-30 21:57:30
52,Android,TwitPoet - An app to generate poems from Twitter (and post them!),2018-06-30 22:10:29
53,Android,Android 8.0 Doesnt mirror cast to roku - any fixes?,2018-06-30 22:12:25
54,Android,Information and help about magisk and snapchat,2018-06-30 22:14:47
55,Android,Instagram stories not fitting on my 18:9 screen?,2018-06-30 22:19:36
56,Android,Update to Google Messages allows you to send texts from web browser,2018-06-30 22:35:16
57,Android,Digging through samsung galaxy s9+ 965U,2018-06-30 22:54:50
58,Android,New Chrome Tabs view?,2018-06-30 23:04:07
59,Android,Adblock on YouTube,2018-06-30 23:28:52
60,Android,[Flash File] Accent Speed A2 Firmware Download [Stock Rom],2018-06-30 23:31:28
61,Android,New Google Maps redesign. Are you using it yet?,2018-06-30 23:37:43
62,Android,Upgraded to Android 8.0 now openvpn won't pass traffic,2018-06-30 23:39:50
63,Android,Kick the Buddy,2018-07-01 00:12:25
64,Android,PaperKarma: worth it?,2018-07-01 01:06:05
65,Android,Xiaomi pulled the Mi A1's Android 8.1 Oreo update - Android Authority,2018-07-01 01:11:21
66,Android,[CRITICAL BUG] In Google Play Store 10.7.17+ allows to use every paid application as free (broken LVL),2018-07-01 01:12:13
67,Android,For Those Who Like Samsung Phones...,2018-07-01 01:14:38
68,Android,Critical bug in Google Play Store 10.7.17+ allows to use every paid application as free (broken LVL),2018-07-01 01:22:25
69,Android,[Flash File] Accent Cameleon C5 Firmware Download [Stock Rom],2018-07-01 01:31:22
70,Android,Anyone know what happened to FCC Speed test app?,2018-07-01 01:34:22
71,Android,A New Android Debugging Tool — Pandora,2018-07-01 02:24:43
72,Android,New Google Celebrity Answers !,2018-07-01 02:46:09
73,Android,[Flash File] Advan i6A Firmware Download [Stock Rom],2018-07-01 03:31:25
74,Android,New Android user looking for recommended apps,2018-07-01 03:33:27
75,Android,Vidmate Mobile App,2018-07-01 04:29:13
76,Android,What launchers do you primarily use?,2018-07-01 04:39:54
77,Android,Chrome Duplex now has proper bottom navigation with no duplicates on latest Chrome Dev build.,2018-07-01 04:42:57
78,Android,[Update: APK download] Uber is piloting a Lite version of its rider app in India,2018-07-01 05:24:40
79,Android,Smartphones in 2018: the half year report,2018-07-01 05:29:21
80,Android,Corrupt Pixel 2 XL Photos,2018-07-01 05:34:39
81,Android,تحميل لعبة الملك لودو اخر اصدار Ludo King لعبة الليدو الحديثة,2018-07-01 07:55:04
82,Android,Need Phone Recommendations around 300$,2018-07-01 07:55:50
83,Android,SOS app suggestion,2018-07-01 08:05:10
84,Android,Nokia 1 review: Stepping into 2018 with hardware from 2011,2018-07-01 08:54:11
85,Android,Funny Android 7.1.2 bug.,2018-07-01 08:57:15
86,Android,[Flash File] Advan S4Z Plus Firmware Download [Stock Rom],2018-07-01 09:31:06
87,Android,Google Podcasts,2018-07-01 10:27:10
88,Android,LTE flaw lets attackers hijack your browsing session and spy on the websites you visit,2018-07-01 10:30:40
89,Android,Sunday Rant/Rage (Jul 01 2018) - Your weekly complaint thread!,2018-07-01 11:11:44
90,Android,Redmi 2 Prime Bootloop Fix /Unbrick / Stuck on logo (2018) | Hindi,2018-07-01 11:15:43
91,Android,Time Card Template for Excel - Get it for Free at Boomr,2018-07-01 11:19:35
92,Android,Mag2GO PRO APP CREATOR FREE LIMITED TIME[$99.00 Free!],2018-07-01 11:24:07
93,Android,[Flash File] Advan S55 Firmware Download [Stock Rom],2018-07-01 11:31:21
94,Android,Spain-vs-Russia Live,2018-07-01 11:35:00
95,Android,Sengoku Asuka ZERO,2018-07-01 11:52:25
96,Android,5 Reasons Why You Need To Buy the Huawei P20 Pro!,2018-07-01 12:52:14
97,Android,"WhatsApp sent me a Cease and Desist letter for simple notification manager app and may ban similar apps such as Tasker, PushBullet",2018-07-01 12:55:50
98,Android,Getting sex invites on calendar?!,2018-07-01 13:12:30
99,Android,I found a system crashing bug on Mi A1 Stock 8.1.0,2018-07-01 13:13:06
100,Android,[Flash File] Advan S7C Firmware Download [Stock Rom],2018-07-01 13:32:01
101,Android,Help!,2018-07-01 13:34:20
102,Android,Vidmate APK Download | #1 Best Video Downloading App For Android,2018-07-01 13:35:45
103,Android,Found a bootlooping Android-powered vending machine,2018-07-01 13:52:13
105,Android,Will a refurbished Note 8 be significantly cheaper in 2 months or about the same?,2018-07-01 14:43:19
106,Android,"Apparently, haptic engine is not an important feature!",2018-07-01 14:46:27
107,Android,What are some good reasons major/minor to not buy the Nokia 7+?,2018-07-01 14:51:43
108,Android,I need advice on what to do next,2018-07-01 14:57:45
109,Android,We Need You! Seeking Help For Beta Testing For Popbox,2018-07-01 15:10:45
110,Android,[Flash File] Advan S5Q Firmware Download [Stock Rom],2018-07-01 15:31:26
111,Android,Restore Contacts,2018-07-01 15:49:31
112,Android,Anyone else notice that their S7 Actives got faster after updating to Oreo?,2018-07-01 15:52:59
113,Android,How to Enable Safe Mode on Samsung Galaxy J1,2018-07-01 16:16:29
114,Android,"My Google Nexus 10 has 26 software updates, any way for me to bypass to the most recent?",2018-07-01 16:22:03
115,Android,[Question] Fast charging stopped working on my Galaxy S6,2018-07-01 16:26:11
116,Android,Un-deleteable image on my 7.0 Android phone. Any help?,2018-07-01 16:33:03
117,Android,This might be the name of new Red OnePlus 6,2018-07-01 16:38:52
118,Android,Google support is trying to tell me I forgot my phone pattern,2018-07-01 16:50:07
119,Android,تحميل تطبيق كيبورد جوجل Gboard يدعم اللغة العربية للاندرويد,2018-07-01 16:55:19
120,Android,I have stopped updating my galaxy s8 does it cause any problem to my phone?,2018-07-01 17:03:40
121,Android,Help making the switch,2018-07-01 17:03:56
122,Android,I have an S8 Edge. Where are my choices for custom text notifications?,2018-07-01 17:12:14
123,Android,Huawei mate ten lite constantly drop mobile data.,2018-07-01 17:29:59
124,Android,Cannot connect Android Auto to 2016 Ford Escape from Pixel 2,2018-07-01 17:39:50
125,Android,DragonSoul – Online RPG,2018-07-01 17:52:23
126,Android,Play store search filters?,2018-07-01 17:59:59
127,Android,Pokémon Quest is better on mobile than the Switch,2018-07-01 18:04:23
128,Android,Keepass2Android is supporting Oreo AutoFill feature,2018-07-01 18:20:29
129,Android,Help! I took a 3 min. video but it won't load and the preview is grey. Ut froze as I was taping. Is there any way to retrieve it?,2018-07-01 18:22:38
130,Android,Under the microscope: Analyzing the Xiaomi Mi 8 performance,2018-07-01 18:27:30
131,Android,What does bloggers used app in securing their notes and ideas?,2018-07-01 18:29:33
132,Android,"Daughter's 2017 Nokia Android is screwing up, and restarting ever a minut or so, no matter the actions on screen.",2018-07-01 18:33:07
133,Android,"I live Algeria, which would you choose out of an LG G5, LG V10, sony Xperia Z5, HTC one M9 and a Huawei P9 if they had the same price tag and why ?",2018-07-01 18:41:28
134,Android,Moto One Android Smartphone Spotted In White Color Variant,2018-07-01 18:47:13
135,Android,Hot Girls HD Wallpapers 2018,2018-07-01 18:52:16
137,Android,"LPT: While in a call, using Google Voice, you can press 4 on the keypad to begin recording the call.",2018-07-01 18:56:00
138,Android,Need a recommendation for a good budget android,2018-07-01 18:58:35
139,Android,"Using Google news to follow the Wc 2018, and really like how google designed the sports section there. But one question: is it possible to get notifications of The world cup from the google news? Like match alerts and goal alerts??",2018-07-01 19:08:32
140,Android,[Flash File] Advan S5J Plus Firmware Download [Stock Rom],2018-07-01 19:31:38
141,Android,LG V40 Smartphone To Launch With 5 Cameras - Techno Now,2018-07-01 19:31:50
142,Android,Miraculous Ladybug &amp; Cat Noir – The Official Game,2018-07-01 19:32:24
143,Android,TIL you can subscribe to an image search result via Google Assistant,2018-07-01 19:39:53
144,Android,封神問情,2018-07-01 19:52:09
145,Android,Anti Virus (AVG PRO) Problems Will Factory Reset fix?,2018-07-01 20:12:18
146,Android,Has a company ever actually sued an indie dev for use of copyrighted content?,2018-07-01 20:15:45
147,Android,Why does cheaper phones or less famous brand have so hugh battery,2018-07-01 20:26:23
148,Android,Please help! Is my Samsung A5 being hacked?,2018-07-01 20:28:06
149,Android,Skype might be working on new layout supporting Dual-Screen devices!,2018-07-01 20:34:01
150,Android,"Moved to another country, can't install apps from Google Play Store",2018-07-01 20:42:39
151,Android,People goinf from Android to iPhone - what was the most surprising (in a negative sense) change you weren't expecting?,2018-07-01 20:46:23
152,Android,Cheers App: Good Dating App,2018-07-01 20:52:08
153,Android,Android home screen layout,2018-07-01 21:11:51
154,Android,At-a-Glance widget not working for cancelled flights,2018-07-01 21:12:32
155,Android,"New Billing Fraud Android Apps Infect At Least 50,000 Devices",2018-07-01 21:14:42
156,Android,Navigation Gestures with Animations,2018-07-01 21:16:27
157,Android,10 best meditation apps for Android,2018-07-01 21:22:02
158,Android,[Flash File] Advan S4P Firmware Download [Stock Rom],2018-07-01 21:31:18
159,Android,RCS Universal Profile rolling out on T-Mobile,2018-07-01 21:45:24
160,Android,Raw Vegan Psychic | Free Mobile App,2018-07-01 21:48:43
161,Android,Jet – Shopping Made Easier,2018-07-01 21:52:38
162,Android,I am looking for a custom rom for my LG V20,2018-07-01 21:56:25
163,Android,"Which app allows me to view 2 pictures side by side, or top and bottom that are in my image gallery?",2018-07-01 22:03:27
164,Android,"Dynamically change KCAL color calibration, is there an app?",2018-07-01 22:04:11
165,Android,iPhone users can't see my texts in group chats,2018-07-01 22:30:49
166,Android,"Anyone ever have issues with the Android System ""Power Supply"" notification popping up and then the phone won't charge at all?",2018-07-01 22:33:47
167,Android,"Windows Phone-like Launcher for Android gets a major update, now let's the user customize Notification live tiles and more",2018-07-01 22:34:29
168,Android,New Method: Bypass Google Account Samsung Tested on Android 8.0- Android 7.0,2018-07-01 22:40:31
169,Android,Back Online green bar?,2018-07-01 22:42:20
170,Android,Bikini Girls Wallpaper,2018-07-01 22:47:19
171,Android,Notifications when the display is off,2018-07-01 22:54:03
172,Android,4-Minute video: How to make a simple app that displays your coordinates,2018-07-01 23:07:02
173,Android,[Flash File] Advan i7 Plus Firmware Download [Stock Rom],2018-07-01 23:31:32
174,Android,"Now that Substratum is compatible with Rooted P, can we build a list of the themes compatible for use?",2018-07-01 23:44:25
175,Android,Deadpool Simulator 2018,2018-07-01 23:57:22
176,Android,2018 FIFA World Cup Russia Official App,2018-07-02 00:47:10
177,Android,Galaxy s8+ seems to have undetectable malware? Should I root?,2018-07-02 01:10:04
178,Android,Popular FastKey Launcher Pulled From Google Play Store,2018-07-02 01:13:12
179,Android,MMS images say failed to download when I click download. And suggestions?,2018-07-02 01:32:32
180,Android,[Flash File] Advan S7A Firmware Download [Stock Rom],2018-07-02 02:23:18
181,Android,Huawei Y7 Prime 2018 LDN-L21 Google Account Bypass Without PC,2018-07-02 02:25:26
182,Android,How long until Google changes the name of Google Play?,2018-07-02 03:13:56
183,Android,"OnePlus announces red OnePlus 6, available next week.",2018-07-02 03:14:14
184,Android,Automatic Workout Tracking Battery Drain,2018-07-02 03:30:16
185,Android,"So, whatever happened to that Spotify redesign?",2018-07-02 03:34:36
186,Android,"[Review &amp; Giveaway] Wireless Headphone, Computer Keyboards and Mouse! US only.",2018-07-02 03:39:12
187,Android,Red OnePlus 6 announced for July 10th release,2018-07-02 03:39:19
188,Android,All Samsung Nougat Google Account Bypass Without PC 2018 in Urdu / Hindi,2018-07-02 03:48:19
189,Android,Tattoo Design App Photo Editor,2018-07-02 03:57:28
190,Android,What are some solid android launchers available?,2018-07-02 04:00:38
191,Android,Apps that make your smartphone smarter,2018-07-02 04:16:23
192,Android,Multiple monitor setup,2018-07-02 04:23:20
193,Android,"New tech, Save your phone from falling damages, Completely.",2018-07-02 04:52:43
194,Android,Brazil vs Mexico Live Stream Watch Live Free,2018-07-02 05:08:04
195,Android,I don't want work email notifications on weekends,2018-07-02 05:20:36
196,Android,Usage tracking app?,2018-07-02 05:22:43
197,Android,"is there an app or feature, to press the back button and have it automatically dial 911?",2018-07-02 05:24:21
198,Android,7 best use full android app to use daily life.,2018-07-02 05:24:41
199,Android,News by The Times of India Newspaper – India News,2018-07-02 06:07:09
200,Android,"Gboard testing smart replies for Snapchat, WhatsApp, more",2018-07-02 06:47:15
201,Android,Best Smartphones 2018: Which One I Should Buy,2018-07-02 06:52:24
202,Android,The numerous benefits of the EZ Notes Organizer for Android Smartphones (including Privacy),2018-07-02 07:06:57
203,Android,Video Status Song – 30 Seconds Status Video,2018-07-02 07:07:20
204,Android,Plz do this,2018-07-02 07:13:21
205,Android,Huawei Y7 Prime LDN-L21 Google Account Bypass Without PC,2018-07-02 07:18:51
206,Android,Giveaway by technical hacks,2018-07-02 07:19:58
207,Android,odd notification behaviour,2018-07-02 07:35:10
208,Android,Watch Live Cricket through Android App.,2018-07-02 07:49:27
209,Android,MX Player developer's response regarding the addition of,2018-07-02 07:52:29
210,Android,Game for kids - shape match learning,2018-07-02 07:54:08
211,Android,Are there any reliable FRP resets available?,2018-07-02 08:02:40
212,Android,MX Player developer's response regarding the addition of a streaming service to the app,2018-07-02 08:03:15
213,Android,OnePlus 6 Red Edition With Glossy Red Finish Launched In India,2018-07-02 08:16:55
214,Android,Homtom ZOJI Z9 Flagship Rugged Smartphone,2018-07-02 08:17:12
215,Android,Beelink GT1 Ultimate Android TV Box Unboxing and Review,2018-07-02 08:30:58
216,Android,Android Browser w/ Zoom Capabilites?,2018-07-02 08:49:27
217,Android,Launchers,2018-07-02 08:53:10
218,Android,"Samsung Galaxy On6 launched in India for Rs 14,490",2018-07-02 09:10:31
219,Android,Samsung's Galaxy Note 9 Has A Nasty Surprise,2018-07-02 09:16:01
220,Android,Mibox 3 oreo update problems,2018-07-02 09:20:18
221,Android,Android P Update Rollout for Nokia Phones May Start in August.,2018-07-02 09:21:33
222,Android,Samsung Galaxy On6 Smartphone Launched In India via Flipkart,2018-07-02 09:21:56
223,Android,Samsung Galaxy On6 - 6 Things to know before buying,2018-07-02 09:50:32
224,Android,the OPPO Find X automatically pulls back camera part after detecting its being dropped,2018-07-02 10:16:59
225,Android,Mifare 1k crack?,2018-07-02 10:25:44
226,Android,Best Ad blocker for Android?,2018-07-02 10:37:36
227,Android,OnePlus 7 is Coming To Destroy All Flagships Next Year,2018-07-02 10:52:06
228,Android,I don't think the assistant subscription works well,2018-07-02 11:06:23
229,Android,PSA: Google Play Store 10.7.17+ is breaking license verification for many apps,2018-07-02 11:10:14
230,Android,IPhone is more superior,2018-07-02 11:11:23
231,Android,Moronic Monday (Jul 02 2018) - Your weekly questions thread!,2018-07-02 11:12:10
232,Android,OneDrive sync doesn't separate content by folder,2018-07-02 11:14:59
233,Android,Looking for New Phone,2018-07-02 11:38:41
234,Android,Can I use ROM that are made for SM-E500H on my SM-e700F?,2018-07-02 11:41:45
235,Android,"Struggling smartphone maker HTC to slash 1,500 jobs in Taiwan",2018-07-02 11:59:50
236,Android,How do you turn off the screen?,2018-07-02 12:10:00
237,Android,Vivo’s new sensor tech could be the future of face unlock,2018-07-02 12:16:04
238,Android,OnePlus 6 comes in a new Color Variant(Red): price and release date,2018-07-02 12:26:47
239,Android,极光VPN（永久免费）,2018-07-02 12:27:22
240,Android,LG V35 ThinQ Pre-Orders Offer From BHPhoto Gives Free Daydream View VR Headset,2018-07-02 12:34:16
241,Android,Android app development services,2018-07-02 12:40:52
242,Android,Rowhammer Variant 'RAMpage' Targets Android Devices All Over Again,2018-07-02 12:46:06
243,Android,Nokia 3.1 launched in US for $159,2018-07-02 12:52:01
244,Android,Honor 8 Asking for SD Card Password after Restart,2018-07-02 12:59:06
245,Android,Which phone has the best ui design?,2018-07-02 13:11:30
246,Android,"G-Meter, GPS Torque &amp; Hp Dyno Free Download Limited Time",2018-07-02 13:12:53
247,Android,New search font in Google maps,2018-07-02 13:15:02
248,Android,hurray!!! Got Placed In MNC Company after completed My Android Course Training in Ahmedabad completely......,2018-07-02 13:26:22
249,Android,5 Best Android Apps You Must Know,2018-07-02 13:28:34
250,Android,How can I turn off keyboard notification with swiftkey and voice keyboard,2018-07-02 13:37:52
251,Android,What do you think is the best SMS app for Android?,2018-07-02 13:42:41
252,Android,Which big phone manufacturer has fast android updates and long update support?,2018-07-02 13:44:04
253,Android,Non-Stop Errors using Android Messages for PC...Anyone run into this?,2018-07-02 14:04:11
254,Android,Help me find which app provides filters like this?,2018-07-02 14:11:27
255,Android,[Help] Storage full but the numbers don't add up,2018-07-02 14:12:15
256,Android,How to flash any MTK phone with Smartphone Flash Tool [SP Flash Tool],2018-07-02 14:23:35
257,Android,Brave Introduces Beta of Private Tabs with Tor for Enhanced Privacy while Browsing,2018-07-02 14:25:38
258,Android,Huawei's smartwatch patent shows built-in Bluetooth earphones inside the watch,2018-07-02 14:27:47
259,Android,Castbox adds silence trimming,2018-07-02 14:32:54
260,Android,What are some of the best free/relatively cheap YouTube clients that are able to play videos in the background.,2018-07-02 14:38:06
261,Android,Xiaomi Mi Mix 3 Leaked Images Spotted Online - Techno Now,2018-07-02 14:48:06
262,Android,Considering switching back to Hangouts for SMS -- is Google keeping it alive or will Hangouts-like features be in Messages?,2018-07-02 14:57:52
263,Android,"Exynos 9810 Problems, Samsung Not Wanting To Make A Fix, And What Can We Do To Fight",2018-07-02 14:58:08
264,Android,Android Messages for Web Dark Theme :),2018-07-02 14:58:18
265,Android,Spellsword Cards: Demontide Android Gameplay,2018-07-02 15:03:38
266,Android,Moto G5 Plus Update,2018-07-02 15:11:26
267,Android,Huu Ndio Muonekano na Sifa za Tecno Spark 2,2018-07-02 15:14:58
268,Android,"Future Smartphone cases might come with built in ""airbags""",2018-07-02 15:23:25
269,Android,Android grid task switcher,2018-07-02 15:25:42
270,Android,Pokémon Quest (iOS Android) Gameplay,2018-07-02 15:25:51
271,Android,[Update: 'Only admins can send' feature also added] WhatsApp's new group features are rolling out to everyone [APK Download],2018-07-02 15:28:35
272,Android,Transmit Spotify via fm,2018-07-02 15:40:46
273,Android,New phone (~£200-250),2018-07-02 15:40:54
274,Android,Play Store Redesign,2018-07-02 15:47:55
275,Android,Train Escape: Hidden Adventure Android Gameplay,2018-07-02 15:51:23
276,Android,New Nokia 7+ or 11 month old Samsung Galaxy S8?,2018-07-02 16:07:39
277,Android,Flash CPB Files on any Android Smartphone using YGDP Tool,2018-07-02 16:23:19
278,Android,How the New Android Messages Actually Compares to iMessage,2018-07-02 16:47:50
279,Android,Started using Android messages - notifications are too quick,2018-07-02 16:48:57
280,Android,Does Huawei p9 phone have NFC?,2018-07-02 16:57:02
281,Android,Some quality cases i found on Ebay for my Galaxy S8.,2018-07-02 17:01:08
282,Android,Any updates on the Messenger redesign?,2018-07-02 17:01:30
283,Android,[News] Android P preview 4 out now,2018-07-02 17:01:37
284,Android,Android P Beta 3 is now available,2018-07-02 17:02:27
285,Android,Firefox for Android problem,2018-07-02 17:04:01
287,Android,Android Security Bulletin—July 2018,2018-07-02 17:09:56
288,Android,Latest Play Store update breaks license verification for paid apps,2018-07-02 17:13:32
289,Android,Some quality cases for a cheap price for your Galaxy S8 and S8 Actives,2018-07-02 17:13:38
290,Android,July Factory Images released,2018-07-02 17:17:53
291,Android,Spotify is testing a slimmed-down version of its app designed for emerging markets,2018-07-02 17:19:14
292,Android,PdaNet question,2018-07-02 17:27:31
293,Android,Intel Nuvision TM785A520L PLZ HELP!!,2018-07-02 17:29:54
294,Android,Has anyone switched from iphone to android and gotten out of the iMessage ecosystem?,2018-07-02 17:33:04
295,Android,Which is better.,2018-07-02 17:33:06
296,Android,Whatever happened to the FB messenger redesign?,2018-07-02 17:33:26
297,Android,"Android P Developer Preview 4, Beta 3 Goes Live for Pixel and Pixel 2!",2018-07-02 17:35:01
298,Android,Android P Developer Preview 4 is now available,2018-07-02 17:35:13
299,Android,Any good wooden cases for moto z2 series?,2018-07-02 17:36:51
300,Android,Apple AirPods – Wireless Headset with Mic,2018-07-02 17:44:55
