,subreddit,title,timestamp
301,Android,Here’s everything new in Android P Developer Preview 4 [Gallery],2018-07-02 17:48:34
302,Android,Google releases ‘near-final’ Android P beta,2018-07-02 17:49:19
303,Android,Can i root?,2018-07-02 17:53:50
304,Android,What’s New in Android P Developer Preview 4?,2018-07-02 17:56:03
305,Android,Millions of users' data leaked through misconfigured Firebase backends,2018-07-02 17:56:14
306,Android,Follow up: Whatsapp Cease and Desist FULL LETTER + self-help group discord invitation,2018-07-02 17:57:56
307,Android,It looks like Digital Wellness won't come out till 9.1/Fall?,2018-07-02 18:00:47
308,Android,Essential rolls out July security patch and a new Android P Beta,2018-07-02 18:13:35
309,Android,DP4 - Device theme is not automatic now. Has separate options for Light and Dark : AndroidPreviews,2018-07-02 18:15:34
310,Android,Any verizon phones similar (better) to s4?,2018-07-02 18:29:08
311,Android,Lock screen notification readability,2018-07-02 18:29:37
312,Android,Thousands of Apps Leak Sensitive Data via Misconfigured Firebase Backends,2018-07-02 18:32:51
313,Android,NOTORIOUS 99: BATTLE ROYALE ANDROID GAMEPLAY,2018-07-02 18:32:53
314,Android,Nokia Phones May Get Android P Update Starting August 2018,2018-07-02 18:45:05
315,Android,"[Mishaal Rahman] So in the latest Android P DP4/Beta 3, there are images for a cake, cheese, and pizza in SystemUIGoogle &amp; SettingsGoogle. I have no idea why they're there and they aren't referenced in the code either.",2018-07-02 18:56:23
316,Android,"In the latest Android P DP4/Beta 3, there are images for a cake, cheese, and pizza in SystemUIGoogle &amp; SettingsGoogle. I have no idea why they're there and they aren't referenced in the code either.",2018-07-02 18:57:51
317,Android,Google Pixel Support refused to uphold their 2-year warranty due to lack of inventory.,2018-07-02 19:03:40
318,Android,"Mishaal Rahman: So in the latest Android P DP4/Beta 3, there are images for a cake, cheese, and pizza in SystemUIGoogle &amp; SettingsGoogle. I have no idea why they're there and they aren't referenced in the code either",2018-07-02 19:04:59
319,Android,Help unbricking tablet,2018-07-02 19:16:19
320,Android,"Facebook, Google manipulate users to share personal data despite GDPR",2018-07-02 19:29:15
321,Android,برنامج سباي فون التجسس على الجوال مجانا برابط مباشر Spy Phone,2018-07-02 19:48:07
322,Android,Google launches Android P Beta 3 with near-final system behaviors,2018-07-02 19:50:17
323,Android,Google reportedly allows outside app developers to read people's Gmails,2018-07-02 19:53:16
325,Android,This is what Samsung’s next tablet might look like,2018-07-02 19:54:34
326,Android,Where to get a skin for my Lenovo yoga book,2018-07-02 19:55:35
327,Android,Android n00b - One of my biggest complaints so far.,2018-07-02 20:16:23
328,Android,Why won't SD Maid delete empty folders in my music collection on SD card?,2018-07-02 20:18:28
329,Android,Reviews,2018-07-02 20:22:33
330,Android,[Flash File] Asus ZenFone 5 ZE620KL Firmware Download [Stock Rom],2018-07-02 20:23:26
331,Android,Android P DP4 gesture app switcher now has full-width slider and larger previews,2018-07-02 20:27:39
332,Android,Alternatives to Samsung Focus?,2018-07-02 20:36:29
333,Android,What is the best Android mobile phone available now,2018-07-02 20:54:36
334,Android,Google Camera 5.3 prepares to add correction for wide-angle distortion on faces,2018-07-02 21:00:55
335,Android,Exclusive: Samsung Galaxy Tab S4 Official Render Confirms Design Rumors | Androidheadlines.com,2018-07-02 21:19:07
336,Android,"Android P's new ""smart text selection"" from Recents UI worked on Pixel XL first generation for a few seconds after OTA update",2018-07-02 21:39:39
337,Android,I need an app to ...,2018-07-02 21:46:37
338,Android,LG V30 ThinQ question about passlock!,2018-07-02 22:01:09
339,Android,تحميل ماسنجر لايت الجديد للاندرويد 2018 Messenger Lite apk,2018-07-02 22:03:25
340,Android,Is it possible to use a keyboard on any app?,2018-07-02 22:07:54
341,Android,"Dear god I'm going to snap, Google Assistant issues",2018-07-02 22:15:46
342,Android,How to hack,2018-07-02 22:16:41
343,Android,Take a look at the new clock icon on DP4,2018-07-02 22:54:16
344,Android,Just received a YouTube TV trail in Canada. 40$ per month.,2018-07-02 23:03:08
345,Android,WANTED - nested tasks list with alarms,2018-07-02 23:20:28
346,Android,Question about LG's update reliability,2018-07-02 23:26:36
347,Android,Android Auto command change?,2018-07-02 23:40:03
348,Android,Instagram now targets Nougat!,2018-07-02 23:43:45
349,Android,Is there an Android app that is both a dash cam and OBDII Reader?,2018-07-02 23:51:58
350,Android,Does anyone know which of these codenames is the proper download for an LG G3 D852 from Resurrection Remix? I noticed it was supported from a different site. But have no idea which one is which.,2018-07-02 23:56:43
351,Android,Samsung S9 with Dual Sim or Google Pixel with Fi for a year of traveling internationally?,2018-07-03 00:10:26
352,Android,[Flash File] Asus ZenFone 4 Selfie Pro ZD552KL Firmware FOTA Download [Stock Rom],2018-07-03 00:23:14
353,Android,Facebook is shutting down a teen app it bought eight months ago,2018-07-03 00:24:26
354,Android,Gmail app developers have been reading your emails - The Verge,2018-07-03 01:01:17
355,Android,Google Duplex: A Sneak Peek At Future of Artificial Intelligence,2018-07-03 01:09:00
356,Android,Samsung phones are spontaneously texting users’ photos to random contacts without their permission,2018-07-03 01:20:44
357,Android,After all these years.,2018-07-03 01:37:15
358,Android,Is Night Mode in Android Preview 4 the true black mode for system UI?,2018-07-03 01:41:50
359,Android,"Google Camera v5.3 prepares RAW support (again), corrections for wide-angle distortion, and possibly multi-channel audio [APK Teardown]",2018-07-03 01:42:36
360,Android,Baidu Denies Recording Conversations In the Background on Vivo NEX,2018-07-03 01:45:25
361,Android,"[Review &amp; Giveaway] FREE Wireless Headphones, Computer Keyboards and Mouse. US only",2018-07-03 01:45:52
362,Android,New YouTube Home UI?,2018-07-03 01:51:51
363,Android,Pixel C no OTA,2018-07-03 01:57:03
364,Android,Followers Assistant,2018-07-03 01:57:03
365,Android,Looking for people to compare and contrast the LG G7 versus the Samsung S9+ versus the OnePlus 6,2018-07-03 02:04:07
366,Android,Instagram introduces youre all caught up feature,2018-07-03 02:16:57
367,Android,Cross platform Photo Search App using Flutter (Android),2018-07-03 02:17:00
368,Android,Anyone's messaging app working very slow the past few months?,2018-07-03 02:24:59
369,Android,Android P Beta 3: Dark Mode Is Here!,2018-07-03 02:39:30
370,Android,Build Cross platform apps for android and ios using Flutter,2018-07-03 02:48:33
371,Android,[S7 Active] Has anyone had issues with swype since the latest update?,2018-07-03 02:49:41
372,Android,Fire HD 10 for Work,2018-07-03 02:50:00
373,Android,"Android experts: if you can handle activities, services, and intents, we have hundreds of top tech companies that'd like to talk to you. Try our multiple-choice Android questions and see your matches.",2018-07-03 03:05:18
374,Android,"I don't know if anyone noticed this in Android P DP4 yet, but when you swipe up on the pill to bring up multitasking, you can continue to swipe up for the app drawer.",2018-07-03 03:36:01
375,Android,La Stratégie Secrète pour Gagner jusqu'a 1000 Euro par Moi!!!,2018-07-03 03:59:57
376,Android,"Is there any good, updated and safe store that can replace Play Store?",2018-07-03 04:17:08
377,Android,Question about installing firmware from other device,2018-07-03 04:25:39
378,Android,Mobisoft Infotech Named a App Development Leader on Clutch,2018-07-03 04:30:22
379,Android,VPN-狸猫vpn全球网络加速器,2018-07-03 04:37:16
381,Android,Discord app turns media audio to shit,2018-07-03 04:45:26
382,Android,9 Best iPhone X wireless chargers to simplify your life,2018-07-03 04:46:11
383,Android,OTP Detection should be built into Gboard and not Messages,2018-07-03 04:46:15
384,Android,Qualcomm Snapdragon 845 sources now available on the Code Aurora Forums,2018-07-03 04:47:15
385,Android,"Google Says It Doesn't Go Through Your Inbox Anymore, But It Lets Other Apps Do It",2018-07-03 05:07:54
386,Android,vivo x21 (china unicom) wont allow for google play to work,2018-07-03 05:11:57
387,Android,Android P beta 3 / DP4 by Tim Schofield,2018-07-03 05:46:13
388,Android,Best Smartphones under $100: Best to Buy,2018-07-03 05:48:14
389,Android,Amazon Prime Day 2018 starts from July 16th With 36 hours Deals,2018-07-03 06:42:06
390,Android,"Okay, this is really starting to get ridiculous. How do we stop these malicious ads?",2018-07-03 06:43:47
391,Android,blue bubbles on apps - what is it? how to remove it?,2018-07-03 07:01:07
392,Android,Live Streaming And Webcasting Solution,2018-07-03 07:01:19
393,Android,Why do my apps keep crashing!?!?!?,2018-07-03 07:03:56
394,Android,A Bug in Samsung's Default Texting App Is Sending Random Pics to Other People,2018-07-03 07:05:13
395,Android,How to Turn On Dark Mode in Android P,2018-07-03 07:17:13
396,Android,Best Methods for App Monetization Every Developer Should Know,2018-07-03 07:21:57
397,Android,How can change my google play country account.. i have been struggling with this for a while now 🙆🏻‍♂️ wish if it was as easy as apple account,2018-07-03 07:23:35
398,Android,Install all Chrome extensions in your android.,2018-07-03 07:25:46
399,Android,"ZTE Axon 9 Concept, First Look Rumor and Specification",2018-07-03 07:31:59
400,Android,Android Beta Update not working.,2018-07-03 07:33:30
401,Android,[x-post] [Note8] Random vibrations,2018-07-03 07:47:33
402,Android,OnePlus Phones Spare Parts Price in India,2018-07-03 07:49:40
403,Android,Fortnite for Android with download link,2018-07-03 07:52:36
404,Android,How to Factory Reset Samsung Phone and Tablet? • u/DataKit,2018-07-03 07:53:18
405,Android,x-post: The single best new feature in iOS 12. • r/iphone /s,2018-07-03 07:54:06
406,Android,10 Unique Android Features That You May Be Missing For Long,2018-07-03 07:54:26
407,Android,تحميل برنامج رقم امريكي للاندرويد TextNow تفعيل واتس اب برقم امريكي,2018-07-03 07:55:28
408,Android,Is One plus bullet earphones fast pairing enabled?,2018-07-03 08:11:47
409,Android,Note 8 vs S9+ vs pixel 2xl or wait for new pixel?,2018-07-03 08:31:59
410,Android,Honor 10 GT with 8 GB RAM launching on July 24,2018-07-03 08:38:49
411,Android,"Does YouTube Music have music-versions of songs, or does it play the music video version?",2018-07-03 08:45:40
412,Android,SD 660 vs SD 835,2018-07-03 09:02:16
413,Android,Gmail app developers have been reading your emails,2018-07-03 09:06:49
414,Android,Android is now (has been for a bit) available for Raspberry Pi!,2018-07-03 09:21:17
415,Android,Able to use Android as a2dp sink?,2018-07-03 09:59:36
416,Android,Galaxy s9 plus case that hides edges,2018-07-03 10:01:09
417,Android,"Galaxy Note 9 &amp;amp; Galaxy Tab S4 Leaks - Latest Renders, Bluetooth S Pen",2018-07-03 10:05:51
418,Android,Android version of CoinBos app V1.4 is available now,2018-07-03 10:45:21
419,Android,BlackBerry KEY2: Short Video Guide Tour to Get to Know More About It,2018-07-03 10:52:42
420,Android,Past Year WACE papers with answer,2018-07-03 10:53:54
421,Android,Hit Devil Bear Defence Homeland Android Gameplay,2018-07-03 11:03:30
422,Android,"New Android P beta is 'very close', 'near-final' but also just 'early'",2018-07-03 11:10:45
423,Android,Honor 10 GT With 8GB of RAM and GPU Turbo Announced in China,2018-07-03 11:22:32
424,Android,Looney Tunes Dash Android Gameplay,2018-07-03 11:23:09
425,Android,Huawei Launches Honor 10 GT Its First Ever 8GB RAM Smartphone,2018-07-03 11:32:22
426,Android,"This Week in F-Droid, Week 26 (x-post /r/fdroid)",2018-07-03 11:37:16
427,Android,New RAMpage exploit revives Rowhammer attack to root Android devices,2018-07-03 11:45:56
428,Android,Famly - A care taker app designed for family,2018-07-03 11:48:17
429,Android,Suppose I dismiss a notification but then change my mind and want it back. How might one do that?,2018-07-03 11:59:29
430,Android,Photo recovery,2018-07-03 12:00:10
431,Android,OnePlus 6 Red - Getting it Just Right,2018-07-03 12:04:01
432,Android,"[Update: Working for some, and there seems to be a hidden setting] Android P Overview screen no longer allows for text selection or image copying in DP4",2018-07-03 12:07:16
433,Android,"Private Telegram, Public Strife - The precarious future of messaging apps",2018-07-03 12:26:29
434,Android,There's a new low battery notification with time to shutdown estimates in DP4!,2018-07-03 12:29:39
435,Android,Are there any launchers that allow multiple profiles like a desktop?,2018-07-03 12:34:40
436,Android,What’s new in Android P Beta 3 🔥🔥🔥🔥,2018-07-03 12:47:20
437,Android,Note 8 vs OP 6,2018-07-03 13:05:07
438,Android,Spotify Lite Untuk Android Telah Meluncurkan Versi Beta,2018-07-03 13:20:12
439,Android,Need help for Capstone Project Ideas,2018-07-03 13:32:40
440,Android,Are there any apps that map hardware buttons to an specified screen area as a touch key?,2018-07-03 13:38:33
441,Android,"Hands On With the Red OnePlus 6, Early OnePlus Prototypes",2018-07-03 13:43:41
442,Android,Microsoft launcher doesnt stay active,2018-07-03 13:44:01
443,Android,Galaxy S9+ not swipe to unlock or lockscreen displayed.,2018-07-03 13:47:19
444,Android,Does a launcher that looks like Windows 95 exist?,2018-07-03 13:49:11
445,Android,"DP4 - Is anyone else seeing these ""quick contact"" buttons in the app drawer?",2018-07-03 14:05:11
446,Android,What is a good (android) app that I can leave open on my phone while in landscape mode that will show me trending posts without me having to touch it?,2018-07-03 14:28:45
447,Android,"Clear ""other"" menory easily?",2018-07-03 14:37:17
448,Android,Wakelock Detector Help,2018-07-03 14:37:23
449,Android,My alarm only vibrated this morning - no sound. A test alarm after did the same thing until I rebooted my phone. Is this an Android-wide problem?,2018-07-03 14:44:21
450,Android,"Samsung Galaxy S6 gets June Security update in India, Still no Oreo - Android News and Leaks",2018-07-03 14:47:52
451,Android,Anyone else having trouble turning Google Assistant off?,2018-07-03 14:48:58
452,Android,"Leaked pictures show off Samsung’s Android Go phone, but no stock Android",2018-07-03 14:50:31
453,Android,Check these cool Accessories for Samsung,2018-07-03 15:07:42
454,Android,Is it possible to port this app into iOS? It would help my new business greatly.,2018-07-03 15:08:46
455,Android,"Just bought thr homtom ht70, Android 7.0 (I am new to android)",2018-07-03 15:14:33
456,Android,What's New in Android P Beta 3/Developer Preview 4 (DP4)?,2018-07-03 15:19:59
457,Android,Viber question - Can someone see if i checked if they are online on Viber?,2018-07-03 15:22:38
458,Android,Vivo V7+ Re-branded Version Vivo Z10 Smartphone Launched in India,2018-07-03 15:26:57
459,Android,No chin/bottom bezel on Red OnePlus 6? New Trailer shows image of almost Fullscreen OP6,2018-07-03 15:49:35
460,Android,Virus or port forwarding issue? His phone is calling people and won't stop.,2018-07-03 15:52:41
461,Android,Samsung S7 Active: Android 8.0.0 issues,2018-07-03 15:58:29
462,Android,TIL you can pin match scores using Chrome.,2018-07-03 15:59:19
463,Android,"Pixel 2 XL: Google Pay not working, SafetyNet says CTS profile mismatch, but I've Never Rooted. I've flashed official Android P builds, now on DP4. Re-locked bootloader but still broken.",2018-07-03 16:03:55
464,Android,Flashing country's stock rom without rooting,2018-07-03 16:04:35
465,Android,"Samsung's Android Go phone won't run stock Android, revealed in leaked photos",2018-07-03 16:10:33
466,Android,Is it possible to block ALL phone calls except from those on my contact list?,2018-07-03 16:15:41
467,Android,Motorola Moto G6 and G6 Play review,2018-07-03 16:21:34
468,Android,Huawei p20 lite or Honor 7x?,2018-07-03 16:22:38
469,Android,"The Brilliant Twisted Survival Game, 60 Seconds Atomic Adventure is Getting New Content!",2018-07-03 16:37:29
470,Android,Struggling for days with rooting. I've failed at life. Please help. Galaxy S6 Verizon,2018-07-03 16:47:33
471,Android,Crazy Stunt Bike Racing: Tricky Impossible Tracks,2018-07-03 16:49:47
472,Android,"LineageOS 15.1 now available for Moto Z2 Force, Xperia XA2, and more",2018-07-03 16:52:46
473,Android,Samsung's New Smartphone Android Go Won't Run Stock Android,2018-07-03 16:54:27
474,Android,War of Zombies - Heroes Android Gameplay,2018-07-03 17:00:16
475,Android,Looking to upgrade from my galaxy s6,2018-07-03 17:00:45
476,Android,Congrats to the new Android Excellence apps and games on Google Play,2018-07-03 17:01:56
477,Android,Sony 1000xm2 Firmware 2.01 with Google Assistant Now Rolling Out,2018-07-03 17:04:40
478,Android,CLONE ARMIES (ANDROID/IOS) GAMEPLAY,2018-07-03 17:11:03
479,Android,Samsung,2018-07-03 17:14:35
480,Android,Will requesting a refund get you banned from the app?,2018-07-03 17:17:09
481,Android,[PSA] The imgur app is consuming gigabytes of background data,2018-07-03 17:17:09
482,Android,How to disable samsung galaxy screenshot policy?,2018-07-03 17:33:57
483,Android,Notifications: Is it possible to turn them off and on based on location or time of day?,2018-07-03 18:09:43
484,Android,[Flash File] Blackview A20 Pro Firmware Download [Stock Rom],2018-07-03 18:23:15
485,Android,Samsung phones are randomly sending photos to contacts,2018-07-03 18:42:56
486,Android,Exclusive: Pictures reveal Samsung’s Android Go smartphone won’t run stock Android,2018-07-03 18:43:20
487,Android,[Android Development] How to tell when your app enters the foreground or background [Tutorial],2018-07-03 18:47:30
488,Android,Suggestion,2018-07-03 18:48:25
489,Android,YouTube has now autoplay feature on homepage!,2018-07-03 18:53:51
490,Android,"Galaxy Note 9’s S Pen Hits FCC, Confirming Bluetooth",2018-07-03 19:01:14
491,Android,Samsung s9 (exynos) battery life help,2018-07-03 19:02:41
492,Android,AT&amp;T Unlimited Data 4G LTE Plan* $29.99 a month*For Hotspots / Tablets/ Phones | eBay,2018-07-03 19:03:34
493,Android,Top 10 Action games for Android offline - MUST CHECK,2018-07-03 19:09:41
494,Android,Youtube random video playing?,2018-07-03 19:10:46
495,Android,LG G7 ThinQ review,2018-07-03 19:18:28
496,Android,Android Security Bulletin—July 2018 | Android Open Source Project,2018-07-03 19:19:46
497,Android,How do i play these games,2018-07-03 19:26:42
498,Android,OxygenOS Open Beta 13/11 - Project Treble is here for the OP5 and OP5T,2018-07-03 19:33:18
499,Android,"Why Reddit search is so bad ? Everytime i search something on Reddit i never get relavent results. I always had to Google to find a post on Reddit. Check the screenshots i have attached. I'm a newbie, Any help would be greatly helpful. Thank you",2018-07-03 19:35:44
