id,selftext,subreddit,timestamp
aoe9m0,"Looking to buy a 128gb phone via T-mobile out right through the samsung website, and I have a military discount code. The catch is the code is only good for 15 minutes and its says ""up to 40 percent off"". That doesnt tell me anything. I need an actual percent of what I'd get off on said phone otherwise I'm going to my carrier to see if they can give me a better off. Has anyone used a military discount on said phone or know how much it would be?",samsung,2019-02-08 07:41:31
aoeb1n,"Galaxy S10e: 5.8 inch- 142.5x70.5x8.1mm Galaxy S10: 6.1 inch- 149.9x71.6x8.1mm Galaxy S10+: 6.4 inch- 157.0x75.3x8.1mm  Like it? Samsung is going after the XR! 

https://twitter.com/ishanagarwal24/status/1093772420572504065",samsung,2019-02-08 07:48:21
aoeq9y,"I bought a samsung note 8 dual sim 64gb, after using the phone for few days i notice that there is white spot in the phone, it is not visible if you are using the phone, only visible in a black screen with finger print mark and it really bothers me.

I went to samsung service center and ask them what is the white dot and they have told me that they cannot see anything wrong in the phone and the dot that im seeing is not affecting the performance of the phone, im asking them what is it but they cannot also explain and they don’t want to consider it as a warranty claim! [phone image ](https://imgur.com/a/LYXATbk)

I need help!! Please advise me! What will i do!",samsung,2019-02-08 09:01:41
aoevih,"Is this a common thing that's happened to most users or is it a glitch on my phone?

After I've updated, I notice the sound quality isn't as good as it was previous update. Theres less bass and sounds more clangy, also the volume is either too loud or too low on some games.

I've played around with the sound settings and Dolby atmos, seems to be the same.

Is there a fix to this or we gotta wait and hope that Samsung fixes this in the next update?",samsung,2019-02-08 09:26:54
aoey5e,,samsung,2019-02-08 09:39:32
aof35s,,samsung,2019-02-08 10:03:03
aofv50,,samsung,2019-02-08 12:03:08
aog4ix,,samsung,2019-02-08 12:38:19
aogmbj,,samsung,2019-02-08 13:42:37
aoh58v,,samsung,2019-02-08 14:43:01
aoh5ev,"My wife lost all of her photos when her phone randomly factory reset and I am trying to recover, but since rooting is basically not happening with this phone, is there any way I can recover these pictures? \*They were not backed up on any cloud\*",samsung,2019-02-08 14:43:32
aohcbq,,samsung,2019-02-08 15:02:12
aohgzc,"I took a video with my mom’s phone that has great sentimental value. I told her to send it to me later, but then for some reason, she restored her whole phone when she was switching phones, and everything’s been wiped. I checked her Google Drive and Google Photos for a backup, but I came up with nothing. Is it gone forever? Is there some tool, anything I can do to get it back? 

Not sure if this is the best place to ask this, please redirect me to the right sub if that’s the case. Also, please don’t spam me with links to random scammy virus-laden internet software. 

Please and thank you. Any information would be great. ",samsung,2019-02-08 15:15:35
aohvo6,"Hi Samsung community! I wanted to get some thoughts and opinions because this is my first Samsung product. I bought an unlocked Galaxy S9 direct from Samsung.com with the hopes that I would be getting updates sooner, rather than later, than the carrier-locked models. Lo and behold, it has now been a month since Samsung released the Pie / One UI update, and amazingly, it seems all the carrier devices have received updates. You would think the manufacturer, who clearly was able to provide the updates to the carriers over a month ago, would be able to update their own devices a bit sooner. Furthermore, I am still on the November 2018 security patch, and it's February!  
 
Seriously making me question buying a Samsung product again, if they are going to hurt users like this. ",samsung,2019-02-08 15:57:13
aoi9b5,,samsung,2019-02-08 16:33:42
aoid9x,,samsung,2019-02-08 16:44:18
aoih64,"My setup: Google Pixel 2, Galaxy Watch

I recently had to reset my Galaxy Watch, at which point I discovered that the Samsung Health data doesn't get sync'd from your phone to the watch when you re-pair. Not only that, but my step data was now out of sync (the watch showing a different # than the Health app on my phone). So I reset the storage &amp; cache on the Health Android app, which got things back in sync as far as steps, but all my sleep data and previous step data is gone. Turns out that Samsung Health will not sync this data to your Samsung account, despite there being a ""Sync Now"" option in the app, which always responds with ""Service unavailable. Try later.""

So basically, your health data is completely volatile and if you happen to reset either your watch and/or your phone, it's gone forever. What the heck, Samsung?!",samsung,2019-02-08 16:54:26
aoj1i6,"Brought my s9plus into the Samsung Experience store for repair under warranty just to replace the charging port. But they HAVE to take the screen protector off to look at the phone. Why ? 
I asked for a replacement but no they don’t do that or sell accessories in this giant store. 
Apple replaces it for you

I’m so mad because I just put this one on. I get it it’s only like $10 but it was a quality one   Like where am I supposed to get another so quickly and risk messing up my screen again. ",samsung,2019-02-08 17:47:54
aoj3bl,This has to be an intentional nod to John Romero's DOOM. Has anyone else noticed this?,samsung,2019-02-08 17:52:35
aok98c,"Hey guys just a quick question. I put my watch to charge at work but forgot about it, now it'll stay there unfya Monday morning. Is there any risk to this? Does it harm the battery? Will it start a fire or something? Sorry I'm just worried, thanks in advanced!",samsung,2019-02-08 19:45:04
aokdbv,"Hey guys just a quick question. I put my watch to charge at work but forgot about it, now it'll stay there until Monday morning. Is there any risk to this? Does it harm the battery? Will it start a fire or something? Sorry I'm just worried, thanks in advanced!",samsung,2019-02-08 19:55:53
aokylg,"So, a bit of an odd case. Pictures here : [https://imgur.com/a/nc1XKs5](https://imgur.com/a/nc1XKs5)

&amp;#x200B;

I bought this brand new 970 EVO from [Amazon.de](https://Amazon.de) in Germany, and I received the box all right.

&amp;#x200B;

It was plastic wrapped, I had to cut it open. Then the seal of Samsung with a QR code was on it and I had to cut it open. Now, I could feel something was moving freely in the box.

&amp;#x200B;

And actually inside were only two things: a weird RAM and a plastic case to protect it. The case was closed with the RAM outside of it, bumping around in the cardboard box. It has some stains on it, and it's not even a Samsung brand. 

&amp;#x200B;

Weird part is that the RAM actually fits in the cover. And there are no papers of any sort in the box, just that.",samsung,2019-02-08 20:52:06
aoltug,"I dropped a Samsung Galaxy S7 into some water about 10 minutes ago. After I took it out it worked for a while but then it shut down. When I tried to turn it back on it started vibrating slightly and wouldn't turn on. I turned it on once and it was on safe mode. Then it restarted again, the lock screen glitched out and now it is still vibrating slightly and the screen is stuck green. What is wrong with my phone? Does anyone know how to fix it?",samsung,2019-02-08 22:18:19
aom1nk,,samsung,2019-02-08 22:40:48
aome8c,"Idk if this is the right place to post this, but I have a Verizon Note 8, and the Samsung brand wireless fast charger (it says 'fast charge' on the charging pad), and it's no longer fast charging. I have left everything as it was out of the box, so I haven't swapped out any cables or anything. Only switching outlets which hasn't done anything.

It still works, it just charges at regular speed. My phone says ""charging wirelessly"" now any time I put it on there. I googled and couldn't find too much about the issue so I'm wondering if anybody here has had a similar experience or knows how to fix it.

Thanks in advance!",samsung,2019-02-08 23:16:21
aomi9d,"So I just knew that smart things let's you automate your devices, I was so excited because I could set it up so that I would set my TV to automatically tune in to the morning news, however I was extremely disappointed when I found out the automation Is extremely limited only letting you change things such as image settings and audio settings, I was wondering if there was a way to have more complex automations with my Samsung smart TV.
Thank you ",samsung,2019-02-08 23:28:28
aoo2ej,Well it's official! Today I received my flight and hotel information from Samsung and the company they used to book everything... I know most of you will be watching unpacked online but I was curious if any of you would be interested in me up loading pictures and or video of hands on with the new phones and of course whatever phone they end up giving us? (Not sure what version of the S10 it'll be.),samsung,2019-02-09 02:29:57
aooryh,,samsung,2019-02-09 04:01:15
aoov3a,"Samsung NU8000 Any good considering buying it, If not good reccomend me one

&amp;#x200B;

&amp;#x200B;

[https://www.bestbuy.com/site/samsung-55-class-led-nu8000-series-2160p-smart-4k-uhd-tv-with-hdr/6199827.p?skuId=6199827](https://www.bestbuy.com/site/samsung-55-class-led-nu8000-series-2160p-smart-4k-uhd-tv-with-hdr/6199827.p?skuId=6199827)",samsung,2019-02-09 04:12:26
aopaaz,"I have the Samsung Galaxy S9+ LED View Wallet Case and I am having problems with it. Notifications stopped appearing on the cover and I have notifications turned on for it. It only shows the time with it now... I also can't seem to find the app anymore as it has disappeared from my phone. I've tried search for it but can't find it. Why is this happening? 

I paid 50$ for this case for this to happen? It is fairly new. I've only had it for a few weeks. Please help.",samsung,2019-02-09 05:09:48
aoq04n,,samsung,2019-02-09 06:55:53
aoq9m8,,samsung,2019-02-09 07:39:48
aoqaew,,samsung,2019-02-09 07:43:37
aoqb53,I am very interested to use MST feature on Galaxy Note 9. I tried installing the Samsung Pay app on my Nepali model and it always say Cannot connect to network. I was wondering if this can be fixed by flashing firmware of those country where S Pay is supported such as India. Also does my bank need to support S Pay to pay using MST?,samsung,2019-02-09 07:46:53
aoqhvk,"I want to plug in a usb mouse and keyboard to my tablet and not sure if it will work

I was looking on amazon and found this one [https://www.amazon.com/Charging-Thunderbolt-Multiport-Compatible-ChromeBook/dp/B07FLXJKPP](https://www.amazon.com/Charging-Thunderbolt-Multiport-Compatible-ChromeBook/dp/B07FLXJKPP)

Will it work? if not could you give a link to one that will? Thank You.

Link to exact tablet: [https://www.samsung.com/global/galaxy/galaxy-tab-s3/](https://www.samsung.com/global/galaxy/galaxy-tab-s3/)",samsung,2019-02-09 08:21:39
aoqpb0,[removed],samsung,2019-02-09 08:59:17
aoqx2j,"Well, I did some tests today, the Note 9 is just as bad as when I first bought it. This, along with the s8 plus Exynos (not sure about the s9 plus as I haven't used it) are some of the absolute worst optimized phones I've ever used.

&amp;#x200B;

I currently have 2 other high end samsung devices both of which if we ignore loading times COMPLETELY outperform this pile of junk. These devices are an S8 Snapdragon (NOT plus) and Tab S4 Snapdragon tablet. 

&amp;#x200B;

The scrolling in online apps on this phone is downright AWFUL (this also refers to the s8 plus Exynos. If you're wondering what the story with the S8 plus is and why don't have it, I bought it prior to the note cuz I wanted a bigger screen which I returned because I thought it was faulty and bought the note, both brand new. S8 Plus was from amazon, note 9 was from an official local phone store)

First and foremost, the scrolling itself is way too fast, sensitive and the acceleration is downright horrible. You barely touch the screen and it goes flying. Second of all, the way content is loaded is absolutely ridiculous. With almost every app that I tested it on, there were always elements whose frames or placeholders DID NOT load up prior to me reaching them when I start scrolling resulting in jitter when they did load up. Both, my tab s4 and my s8 loaded everything's frames and exact place holders with most apps prior to reaching them. So when I start scrolling it resulted in a much smoother experience with minimal jitter 

Also the note 9 had LOWER fps than both the s8 and tab s4 when loading up certain apps such as twitter and google playstore and scrolling down at medium speed immediately. Some games also loaded slower on the note 9 as well.

&amp;#x200B;

The apps I tested today were:

*\*\*\* The test was simply open the app, quickly go to its most overloaded page and start scrolling down at a slow - medium rate (loading the apps is ignored because the note 9 wins all of them)*

**Twitter Trending / Search page** \- Note 9 - lowest FPS most jitter

**Playstore home page** \- Note 9 - lowest FPS most jitter

**Netflix home page** \- Note 9 lowest fps, S8 most jitter

**Google Chrome wwe, paypal, google search and a few others** \- worst overall performance on the Note 9

**Samsung Browser** \- best performance on the note 9 (pretty much one of the only things that loads up faster and performs faster)

**Prime Video** \- lowest FPS on tab s4, most jitter on tab s4

**Reddit Trending page** \- lowest FPS on note 9, most jitter on note 9

&amp;#x200B;

I patiently waited for the One UI update just to see if they were going to fix this stupidity but it seems that it never will be. The note 9 and the S8 plus Exynoss have something at their core, whether its their drivers or whatever, it doesn't really matter. Instead of working on a skin for brand new UI, maybe Samsung should actually focus on their hardware and actually test their stuff, not in the way all those clueless phone VS phone youtubers do where they only test the most general stuff - mostly loading times, cameras and battery life. To someone who doesnt own other high end devices this will not be an issue at all or something they notice but to me it is a huge issue. It is not logical or acceptable for a phone that cost me about 50% more than the s8 (when I first bought it) and tab s4 to be performing worse with ANYTHING. It is acceptable for it to be even equal. It should be noticeably faster, smoother etc. with absolutely everything and there is not a single excuse other than absolute laziness, classlessness and lack of knowledge and experience of these so-called developers. 

&amp;#x200B;

I am getting rid of this piece of trash and most likely never purchasing another note or plus phone made by samsung. I'd rather stick with the s8 with the smaller display and no spen rather than wanting to stab myself every time I'm holding my phone.

&amp;#x200B;

I really don't care what anyone has to say either. This is not bad luck, I've tested other Note 9s, I gave Samsung time and they didn't change a thing. In fact Android Pie I believe has made the phones slower if anything. I really don't give a single F about battery life. Unless you can offer me butter smoother performance I can care less if you're battery lasts a week. And I wouldnt be surprised if this thing Im complaining about is not getting fixed simply to ensure that the plus models and notes get noticeably more battery than the default models. ",samsung,2019-02-09 09:38:12
aorlev,Around 2016 Samsung officials claimed to move away from Android and move towards tizen. Is this still in progress or did they decided to nnot go this way?,samsung,2019-02-09 11:34:09
aosej7,"Any issues using both assistants at the same time? Currently on an lg, using google, will be switching back to samsung soon and am wondering if i can use both. Google for 1 operation and bixby for another.",samsung,2019-02-09 13:40:42
aotcbp,"Hi there guys!

I've been using Samsung notes on my Tab S3 and I really like it so far. However, I honestly don't know what is to come in the Samsung Notes pipeline, so I wanted to post a few questions here. Currently I am using 3.0.1.8.

1. ***Will Samsung Notes have a vector engine?*** Currently, there is a raster engine, and therefore you cannot really zoom in anywhere. I was wondering if they have any plans to convert the raster engine into a vector engine. It would also be great to be able to zoom into places.
2. ***Will it ever support Notes Playback?*** One thing that I really like about Notability on the iPad pro is that you have the ability to write down stuff, while at the same time be able to record your voice. This is really quite interesting because essentially, you can record yourself learning something new. Is this in the works, or is there any plan to introduce this in later versions.
3. ***Can I change the background color?*** I'd really love to be able to change the background of the pages in Samsung Notes. Is this going to be ever possible? Is this a part of their backlog?
4. ***Infinite Canvas support?*** I understand that there is a lot of wisdom in having a fixed width page, but it would be nice to be able to create something on an infinite canvas, especially when drawing a mind-map. I am right now using Sketchbook pro to draw things, and then import them into Samsung Notes, but its not the best way to go about things.
5. ***View Notes Online?*** I would really like to be able to share notes with other people who do not have Samsung Notes. This is a real problem for me right now, because I keep having to share PDFs, that get cut in the middle of nowhere.",samsung,2019-02-09 15:38:34
aotodo,,samsung,2019-02-09 16:15:19
aousuh,,samsung,2019-02-09 18:07:38
aouvlo,"I got a like-new (probably unused or used very little) running 6.0.1 that when it works, works perfectly... Then there are those times (quite often) that all UI's/apps just completely freezes... I mean everything, to the point where neither the app or system functions like home and back button etc works...

... I have Avast Mobile Security, and boosts ram and clean junk files all the time, so it shouldn't be a ram issue.
I've also only used it less than a month, so it's factory restored to a ""fresh state"".

Does anyone know what might cause this, if it-s a software issue and how to solve it?",samsung,2019-02-09 18:15:25
aov0cm,"Hello, I work in a retail store and I have to add the retail mode to the Samsung tablets we got in store. I'm having a problem with the SM-T580 (Tab A 2016). The tablet's firmware is currently on Oreo, and when installing the Retail Mode Demo on the tablet, the software just keeps crashing. I've tried to bring the tablet's firmware back to Marshmallow using Odin mode, with no success as it constantly fails. Would there be a workaround to make the Retail Demo work since I'm guessing the firmware is too recent to run the Retail APK.",samsung,2019-02-09 18:28:26
aov9p6,"For a year ago I could swipe down the top menu and choose with Bluetooth connected item I would send the sound to.

My car is connected, but for most of the time I use noise cancelation headphones. And when I have them on and go driving the sound switches to the car. But because the soundsystem is of the sound disappears. The I could swipe down and pick my headphones again.

Yeah I could remove the connection to my car but then when I don't have the headphones I have a new problem when receiving a call.

Is there a way I'm missing where I fast can change the output on the fly.

My phone is the Samsung Note 9.

I really hope simeone has a fix :)",samsung,2019-02-09 18:52:27
aovk47,Hey all I’m about to get a Galaxy S9+. I like Samsung and had the S5 and the S6 Active but had to use an iPhone for work reasons. Now that I’m finally coming back I’m a little rusty on my Android OS. Which is the generally preferred one? Pros and cons? Thanks guys,samsung,2019-02-09 19:19:20
aovrs3,,samsung,2019-02-09 19:39:15
aovstb,I'm always seeing photos in portrait mode on Galaxy phone but I'm not sure if there's like a specific Samsung branded name for it.,samsung,2019-02-09 19:41:50
aovxot,"Literally almost every time a text is sent, it calls the other person. If the screen is locked immediately, it will still send the call. Even if they hit send and then don’t touch the phone at all otherwise, it will call. I can’t find anything on any forums and no one at Sprint/Samsung can figure out what’s wrong either. ",samsung,2019-02-09 19:52:46
aox339,,samsung,2019-02-09 21:41:08
aoxga3,"All over the internet, the interface on Samsung phones is labelled as some kind of cancer that ruins an otherwise amazing device. People always say things like ""oh this would be so much better if it ran stock Android."" Am I the only one who really likes the Samsung UI? As someone coming from a Pixel XL, stock Android is really overrated. The UI is bland, there are no features to be seen, and it feels like I'm using an iPhone. Heck stock doesn't even have a Vooce Recorder or a decent file manager out of the box. As for Bixby, I quite like the page on the home screen and the assistant itself is getting there. So what's with all the hate? What are your thoughts?",samsung,2019-02-09 22:17:50
aoxp1z,I want to have the samsung experience only. No google at all. I have adhell. I typed google and disabled every package which is related to google. I left some so the phone is still functioning. What else can I do?,samsung,2019-02-09 22:42:28
aoymi8,Is there one?  Thanks...,samsung,2019-02-10 00:20:20
aoynpp,"Last I read people believed the S10E would have an in screen fingerprint reader, turns out it will be in the power button on the side. Reverse wireless charging is confirmed and I got to see it in action, It is amazing if the S10 is plugged in it will charge both devices at the same time at the same rate. Bixby button is re-mappable and the new UI is really an improvement. Anything else I can confirm? Oh and I don't have an NDA so ask away.",samsung,2019-02-10 00:24:08
aozngs,"Hey guys, im a bit confused.... Does my S9 get the update the last since it is an unlocked phone? I bought it directly from Samsung thinking it'd get the updates first. However its uh.. still on some December update. I was wondering if it was because of my carrier (ATnT in the US). If anyone got info, lmk!",samsung,2019-02-10 02:20:00
ap0f8k,,samsung,2019-02-10 03:55:52
ap0pa4,,samsung,2019-02-10 04:32:20
ap0zci,"Is there any benefit from buying directly from Samsung vs buying from the carrier, I have Verizon if that matters. Are updates pushed out at the same time?",samsung,2019-02-10 05:10:32
ap1eh0,"I have a Samsung 4k smart tv from 2015. Is there an app to view IP based security cams, or a Ring doorbell? The web browser on the TV seems to choke on them and I haven't found any smart apps for the tv.",samsung,2019-02-10 06:11:59
ap1ll0,,samsung,2019-02-10 06:43:46
ap1pow,,samsung,2019-02-10 07:02:33
ap1s5j,"I was always a Samsung guy, but my wife convinced me to give iPhone a try a few yrs ago. So, I did. And after a couple years with the iPhone 6, I decided to come back home to good ole Android. I got the S9 a few months ago and, while I do love it, there are a couple of things about it that really bug me. The main issue I have with it is that there's a limit to how many notifications it will show you at any given time. Once you reach the maximum number of notifications you won't see any new notifications added to the list until you clear it. Otherwise no new notifications will show. You'll hear them come in but you won't see them. In iOS this problem doesn't exist. You can have an infinite amount of notifications to scroll thru without ever clearing them out and the latest notification will ALWAYS show up at the top of the list. Furthermore, it organizes the notifications by date and timestamp, so you never have to wonder when a given notification came in. 

This is extremely aggravating because now I have to constantly be clearing the notification list to be sure I'm not missing any important texts or alerts. There has to be a way around this, but none of my research has turned up an answer yet. Reddit is my last resort. Does anybody know anything about this?


Thank you in advance..

",samsung,2019-02-10 07:14:14
ap1v9b,Sprint note 9 user. Downloaded and installed pie today and I switched to the Samsung Japanese keyboard and it wouldn't let me switch back. When I tried to switch back it would freeze and crash. Had to disable Japanese and downloaded a new keyboard. Never happened before the update today.,samsung,2019-02-10 07:29:53
ap21l1,"Hey guys,
Im planning on upgrading from my current samsung s6 to one of these phones. Which one is the better phone. I need help deciding. Im able to get both phones for about $500 each. Thanks in advance :)",samsung,2019-02-10 08:02:29
ap25jg,"I’ve got a 4K Samsung Blu-ray player connected to a Samsung 4K Q7FN. Whenever I watch movies or TV shows the blacks are so dark it’s almost impossible to see, even in scenes that are slightly dark it’s like it spreads it around the area and all the detail is lost except for very white objects like sunlight or faces and etc.  
  
I plugged my Xbox One X into the TV and it works fine without the deep blacks.  
  
What setting do I need to change to stop this?  
  
This isn’t a brightness setting. Even at max brightness and backlight it’s still the same. I have a feeling some sort of other setting is making the blacks extremely pronounced (maybe trying to simulate an OLED display? Not sure).",samsung,2019-02-10 08:23:13
ap2glu,,samsung,2019-02-10 09:22:16
ap2l82,,samsung,2019-02-10 09:47:31
ap2wzi,,samsung,2019-02-10 10:48:20
ap3hrz,,samsung,2019-02-10 12:28:45
