id,selftext,subreddit,timestamp
alrq82,,samsung,2019-01-31 17:16:53
alryid,,samsung,2019-01-31 17:37:10
alrz0n,,samsung,2019-01-31 17:38:37
als0bk,"Probably a question that no one knows yet, but will the 5G model be able to use 4G? There's no projection date to add 5G in my city through any carrier this year. **WHY BUY IT THAN?** The features! That said if the phone doesn't work unless connected to WiFi than yes that is a pretty stupid purchase.",samsung,2019-01-31 17:41:49
als23t,"Did anyone else get the latest S9+ Update? It seems to have changed the whole interface of the phone.

Does anyone know what's new about it?
",samsung,2019-01-31 17:46:09
als4on,"Hey guys, long post incoming. If anyone has advice for how to get this problem resolved I would love to here it because I am beyond frustrated at this point. 

So about a year ago, I purchased a UN75MU6070 4k Tv. I was planning on waiting to get a better version, but the timing ended up being right and the price looked great (I was wrong on that). The first time I turned on the TV, everything looked great. I didn't have any 4k content to play on it yet, but Netflix shows and upscaled blu-rays looked awesome and I was very happy. A couple months later, my wife bought me a 4k Blu Ray player, and I purchased my first 4k BluRay. 

Now I don't know that this TV has what is called ""true HDR"", but it does have an approximation that makes colors richer. However, when I would watch a movie with HDR, the colors looked...off. In the highlights, everything looked too washed out, and in the shadows, everything looked flat and like it had no contrast. [Here](https://imgur.com/KBuwzik) are [some](https://imgur.com/XuarVkW) [comparison](https://imgur.com/8RfgrEL) shots. I know it's hard to tell from a phone picture, but you can see that the colors, brightness and contrast are very messed up when you see how the eye looks between HDR and SDR. 

I submitted a request for assistance and the rep had me update my firmware: this didn't change anything. Next, I called again, and the rep told me that the problem was HDR+. Even though the description on the setting itself says it automatically determines if HDR content is displaying and turns itself on or off, I took this as a possible solution. Turning it off did nothing to fix the problems.

I called a couple more times and talked to reps that tried to help but were unable to, until they finally sent out a local repair tech to look at the tv. By this point, I had gotten 4k netflix, and I could see the same problem with HDR content from that app, so I knew that this wasn't a Blu Ray player problem, it was a TV problem. Here are a [couple](https://imgur.com/DqtsRk8) [pictures](https://imgur.com/30uOIdA) that show the HDR problem on an episode of Black Mirror. It's a little hard to tell from the phone photos, but if you look at the skin highlights, you can see how blown out they are, and there is a sickly pink to orange hue that happens in bright lighting on skin tones.

So, when the tech came out, they looked at the problem, saw that it was an issue, and tried some things to try to fix it. As it was still messed up, I called again to Samsung to see if they knew what to do, and they sent the repair shop out a second time. This time they changed out the motherboard - which did not fix the issue. I called a third time, and they sent out the tech again. This time he was on the phone with samsung, and they had the tech do a video chat with Samsung support to show them what the problem is. They determined it was an HDR+ problem and it would need to be turned off when HDR content was played to have the problem go away (even though I showed them this wasn't the case). The TV repair guy was apologetic and said to call Samsung again and let them know it  had not been resolved. 

So I call again, Samsung sends out the same tech a 4th time. He has now been out to my house (which is about 30 miles from his shop) 3 times before, and I know he is frustrated with how things are proceeding, as his hands are tied unless Samsung determines there is a problem to fix. This time, he is on the phone with the rep for about 2 hours with me there giving him information about the problem. 

At the end of this call, the rep determines that there is not an issue with the TV, it must be color settings within the app and Blu Ray player that need to be adjusted to fix the problem. The TV Repair guy had gone through and used his scopes and patterns to tune the TVs colors as much as he could through settings, and it looked great SDR content, but once I put on HDR content, the problem persisted. 

So now that Samsung had again determined that the TV was not the problem, I called again, admittedly frustrated this time. I spoke with a rep and told them as calmly as I could that there WAS a problem, and Samsung either needed to replace the TV, figure out what the problem was an how to fix it, or tell me to kick rocks and I could just not buy Samsung again. This rep checked into it, and said that the only way to start an exchange was to have the TV repair shop come out AGAIN and determine the problem wasn't fixable.

I didn't really have a choice, so I told them this was fine. I waited for a call from the local shop. 3 days. 5 days. A week. Finally, I called them to see when they were going to schedule an appointment and talked to the guy I had been working with. He let me know he was in contact with Samsung to make sure this was the final time he would be sent for the same TV (which I definitely agreed with) and he would get back to me when they confirmed that officially. So I waited. 3 days. 5 days. Another week. 

Finally, Samsung called me and asked if the repair shop had set up a service visit. I said no and told them about him wanting to make sure this is the last time. The Samsung rep said they would reach out and get this process moving. Two more days pass. Same call, Samsung wants to know if I have a service visit set up. Explained it again. Samsung will call them. Two more days, same call. I tell them the service hadn't been set up, and this time the rep says, ""At this point, how about we just cancel the service visit and exchange your TV directly."" VICTORY! I tell him this is great, he has me send in my receipt by email with the serial #, etc. 

I get an email from Samsung a few days later saying that my case is open and a return has been requested for my device - here is the link to track your case. Fantastic, I'll only be reloading this website every 2 hours. Then, cut to this morning. I check the portal to see my case's progress and see [this](https://imgur.com/H8D0oTa). So I call Samsung and they let me know that my return has been denied because the last tech determined that the TV is not defective (it is) so they can't do an exchange. I told the customer service rep this is unacceptable, and he said he can send out another local repair center to look at the tv, but it's hard to override the Samsung techs because they ""know when there is a problem or not"". 

So that's where I'm at. I'm waiting for a 4th repair visit where Samsung will probably determine AGAIN there is no problem, and I will most likely be left with a tv that looks absolutely awful on HDR content. Lesson learned, I will not be purchasing Samsung products in the future after this product and customer service experience. If anyone has any suggestions, please let me know. I've googled for months and not found any problems like mine, and every fix I've done has not fixed the image. 

Thank you guys for reading my long rant, and buy some other company's TVs!",samsung,2019-01-31 17:52:53
als8l0,,samsung,2019-01-31 18:02:15
alsam6,Has anyone tried taking notes on a tablet and reading them on their phone or vice versa? For some reason the size of the writing always gets messed up for me.,samsung,2019-01-31 18:07:27
alsu4a,"Now don't get me wrong - the building quality is great.  I did have to contact customer support once, however, because my S7's screen would turn to static randomly. But no problem, they sent a replacement. (Which I know isn't at all everyone's experience)

But the software *sucks*. And I've been realizing this more and more every Android update, and One UI has pushed me over the edge. On top of all the bloatware that came with my S9 out of the box, there were 3 additional applications installed after the update; Yahoo Sports, Yahoo News, and some other (useless) Samsung app. All of which you could uninstall so, no big deal, right? The new app switcher looks nice and all, but the animations are wanky and buggy asf. I only get a nice, smooth animation while exiting an app half of the time, and on top of that the corners suddenly go from squared to curved a noticable amount of time after the animation is over. Also, apps have a habit of jumping to the right side of the screen, than going back to their appropriate size, where they should be. When I click back on the app, the text, for example, appears about an inch below where it's supposed to be, then suddenly jumps to it's correct location. It's noticable and it looks *horrible*. Sure you can flash a ROM, but I don't want to void my warranty in case something does happen  - and you shouldn't have to fix stuff like this bs out of the box, anyways. I'd rather put up with a slider, rumored to be on the One Plus 7, than this for how much I use the front camera. And it's even more tempting to do so when I could trade my S9 in and only have to pay $50 (or less) for a OP7 when it does come out. There's also several other bugs I've noticed while using One UI for under a hour now. Ex: My friend texts me asking if I want to come to his house for the Superbowl. I replied with ""Yeah, I'll see."" I exit the app and get a text notification from ""Preston"" (me) with ""Yeah, I'll see."" I only have myself as a contact under ""my profile"" (which is by default), and this was using Samsung Messages. I waited months since the Android P release for this steaming pile of garbage, so it's not like these bugs are excusable. Samsung's software seems to get worse and worse with every major update. I've always have been more fond of Stock Android, and if the OP7 has wireless charging and a OLED screen (that looks good) I'm going be done in.",samsung,2019-01-31 18:56:05
alt2co,"I thought in this price range it couldnt be shittier. (I have experienced it with other manufacturers). I installed the Pie. 1 It looks like a toy. 2 It is FUCKIN laggy just like my 2-3 year old Galaxy A3. And there is no way to revert it back to stock in an offical way. I am familiar with ODIN and shit, but wouldnt wanna risk it. Thanks Samsung never ever again buying from you. Releasing an update in such a shitty working condition.",samsung,2019-01-31 19:16:22
alt3sh,,samsung,2019-01-31 19:20:07
aluar4,,samsung,2019-01-31 21:12:13
alus8u,"Today I bought the Samsung Galaxy S9+ (64GB, T-Mobile). I did this because with the T-Mobile option, you get a supposed $420 discount if you trade in the Pixel. Anyone tries this before? 

My Pixel is in extremely good condition but I've read stories on here with Samsung playing games and not accepting phones in good condition. ",samsung,2019-01-31 21:58:34
alvasg,,samsung,2019-01-31 22:47:32
alvdno,"I got One UI on my S9, it seems like the option to turn off icon frames is gone, and the ""Contacts in custom list"" (or whatever it is where you could view your contacts from selected groups) feature, are they really gone or am I just looking in the wrong place? ",samsung,2019-01-31 22:55:24
alvdqa,,samsung,2019-01-31 22:55:35
alweq4,"Intro:

First things first, when I upgraded from my Note8 to the Note9 I've had issues with the procurement process. I normally go through Best Buy Mobile but this time in order to get a \~$400 trade in credit I had to go through Samsung directly which tied to my Verizon account. That said, I had a bunch of issues actually getting the websites to talk to each other and had several phone/emails until finally someone found me a workaround (and apparently a lot of people were having issues). Few weeks later I got an email that the trade in credit was declined for the additional amount (\~$200 difference, if memory serves) and there was nothing they could do about it. So I'm already feeling ripped off/cheated (I have screenshots and all to prove it, worked those up to management teams who approved and then others ultimately declined).

&amp;#x200B;

That's not even the main part...

&amp;#x200B;

Yesterday I get a generic email from Samsung Customer Support (same team I was working with on above) about my request being received (which I never submitted??). Today I get phone call (Caller ID: Samsung Electronics Canada Inc.) and a gentleman who starts by explaining the reason for his call which went something like this...

&amp;#x200B;

""I'm not sure if you have noticed, but you haven't been getting billed by Verizon lately for your device payments and therefore we haven't been receiving those funds""

I go to look at my Verizon bill and he's correct, I did not see any device installments for the Note9 on recent bills. I hear people in the call center having the same conversation with other customers which aligns with him telling me...

""This is a known issue we're trying to work through with Verizon but the only resolutions are one of two things: 1) Return the device to us and receive a \~$500 credit or 2) pay us the full remaining balance of $500 and keep the device.

So I'm totally caught off guard at this point. The deal when I signed the contract was a monthly installment that would be paid through Verizon which was initially what was going on. I start explaining how I'm not surprised this is the case because we knew early on their systems weren't communicating with one another. I asked what they're doing for customers because this is clearly not an acceptable ask. He said he can offer me the option to keep the freebies (wireless charger and phone case (if I decide to keep the phone)). I begin laughing as does he and he explains he's aware of the obvious insanity of that offer but that's all they're allowed to do. 

&amp;#x200B;

I ask how I would even go about paying if I wanted to and he made it sound like I would call Verizon, pay the total, and they pay Samsung (this makes no sense, because that's the challenge they said they're having in the first place was getting payment from Verizon). He suggested I call Verizon, confirm the story is legit (and he's not a fraud), and then follow through with them. To which I suggested, he have them call me, we figure out how to get installments working again, and we keep on keeping on, otherwise, not my problem. I also mentioned that I'm not paying anyone other than Verizon because that was not the arrangement. 

They've already breached the original agreement I made from the get-go and now they're asking for in-full payment. I am mind boggled this is happening and also that I couldn't find anything online about this from others yet. 

  
Question, what would you do? Am I in the wrong if I don't call Verizon/Samsung and pay them $500 to even up? Is there any potential this impacts credit scores or anything caused by Samsung? I'd imagine not because I don't have credit or anything setup with them... I feel this is something they should be working with Verizon on. Oh also, I noticed on Verizon's website that I'm eligible for an upgrade which insinuates the device is paid off, so that kind of holds true to his story but also means that as far as Verizon is concerned, I own the device out right... ",samsung,2019-02-01 00:58:50
alyr9o,"There are a couple words I've drunkenly accepted like it auto replaces ""you"" to ""youi"" when I swipe on Samsung keyboard.  I have a galaxy s8 and use the default keyboard. I want to remove some of the incorrect suggestions I have put in. ",samsung,2019-02-01 05:26:14
alz0fl,"After I opted into the One UI beta, my Samsung+ app either crashes immediately, doesn't launch at all, or does, the throws a red screen with it basically telling me ""Ya goofed, noob"". Help. ",samsung,2019-02-01 05:59:28
alze6q,,samsung,2019-02-01 06:52:10
alzhrw,,samsung,2019-02-01 07:06:31
alzjmp,,samsung,2019-02-01 07:14:02
alzlat,"For those who have it, how has your battery life held up after the One UI update? I feel like Samsung is notorious for major battery life drops after their updates.",samsung,2019-02-01 07:21:14
alznxq,"It wasn't on my phone. I installed it. Now I can't uninstall it. This can't possibly be the desired outcome.  
  
How do I uninstall the app that I literally just installed 2 days ago?",samsung,2019-02-01 07:32:26
alzv3z,Hi guys. I bought a samsjng gear watch yesterday. Charged it to 100% and so far the batters is at 37% after 5 hours.. i reset to factory and still same issue. Anyone had the issue before and figured it out? I'm pretty dissapointed so far,samsung,2019-02-01 08:04:08
alzzcs,,samsung,2019-02-01 08:24:14
am0027,,samsung,2019-02-01 08:27:21
am03w7,"Recently  bought a 43 inch NU7122 and was wondering if i could make it support a  keyboard and mouse. I know it lacks Bluetooth but couldn't i add a  dongle? Or is there a better solution?

I would also like to ad a controller in the future for some Steam Link playing.

This model has the old style remote; if i buy the smarter remote would it work?

Thanks.",samsung,2019-02-01 08:46:07
am07d5,,samsung,2019-02-01 09:02:36
am0fwm,"I got this phone from Canada as a gift. First boot up was normal for a brand new phone but after setting everything up, I noticed that the notices and benefits in the Samsung Members app were all for the Canadian region. How do I fix this? Will using an unlocked Canadian Note 8 in SE asia mean I'll have a hard time updating to Pie? If not, will I get the update the same time as Canada or my region? Will security patches get delayed for me? 

Last security patch was for November 2018. Is that the last patch for SM-N950W? I might be missing out on something here....",samsung,2019-02-01 09:43:21
am0gl5,"Hi, I just got a Note 9 after not using Android phones for several years. So the question in the title may be really stupid but I've Googled around for an answer for a while and I can't find it. I want to be able to check my notifications and the time and stuff and use Samsung Pay without pressing the power button. Right now when I tap the screen and try to do this nothing happens. Thank you. ",samsung,2019-02-01 09:46:32
am0h5w,,samsung,2019-02-01 09:49:12
am0nq4,"What the title says. I am currently in South Korea, and if anyone has ever been here, then you know they like giving out Emergency Warnings about almost everything. Problem is, that unlike as on my previous Moto Z, on the S9+ with Android Pie, I CANNOT MUTE EMERGENCY ALERTS FOR ANYTHING! This is INCREDIBLY ANNOYING as my Phone is the ONLY ONE in the Subway that is blaring with that stupid beeping sound. So how do I turn it off? I am so close to removing all emergency provider apps with the Bloatware Remover app, I know it isn't a good idea but Samsung leaves me no choice since the upgrade from 8.0 to 9.0!!! 😡",samsung,2019-02-01 10:18:53
am1dqt,,samsung,2019-02-01 12:10:27
am1pcl,"Hiya! 
I'm having a major issue with my Note8. It is not recieving calls from my work. I work for a local domestic violence organization so when they call the number is protected (×××)000-0000 is what it comes up as. However since getting my note8, I never get the calls. They arent going to voicemail either. My work says they get a busy tone when they try to call me. I took my phone to tmobile and they had no idea what to do. Ive looked at forums and my block unknown callers is turned off, and I even have the 000-000-0000 number saved as a contact. Still nothing. Does anyone have any other ideas that may help? Please! ",samsung,2019-02-01 12:52:35
am1qoo,,samsung,2019-02-01 12:57:20
am1ulb,"Hello All!   


Can you please suggest how can i sync the Samsung notes and reminders with my Laptop.   
I am looking to be able to edit it on the windows.   


Thanks in advance. ",samsung,2019-02-01 13:10:39
am1yd4,"Hi.

&amp;#x200B;

I have an collega who bought a Samsung UE65JS8505T a few month ago and his cat have alredy chewed over the ne-connect cable. 

I try to find a new one for him, but I can't find anything connected directly to this TV model. It my be that the this model-name is only in Scandinavia and the TV has an other original model-number at Samsung.

I have tried to search around the net for the cable and what I can find googeling this TV is:

 BN39-02014A,  BN39-02015A and BN39-02248A.

I know that the one-oonnect cable is differen from model to mode as my Samsung TV uses an other ""connection"". 

&amp;#x200B;

Can anyone help me?

&amp;#x200B;",samsung,2019-02-01 13:23:46
am24vv,,samsung,2019-02-01 13:45:19
am27b7,"So I've seen some posts of people suggesting to do a factory reset after upgrading to Pie and One UI. 

What all will be lost if I do this? I've backed up my phone via the settings but am still worried I'm going to lose my photos or Samsung Pass data, etc. 

Will I be OK? ",samsung,2019-02-01 13:53:13
am2873,I love my phone but the battery is so severely degraded and Samsung won't do anything besides replace it for about $70. The phone would have to be mailed in because I don't live anywhere near a Samsung service center but they did send me a shipping label.,samsung,2019-02-01 13:56:07
am2s2v,,samsung,2019-02-01 14:54:19
am3bak,"I bought my S9+ in Spain, but I now live in Canada. The Samsung pay region is stuck in Spain. My Samsung account is set to Canada, but everything related to Samsung Pay is set to Spain. Any help?",samsung,2019-02-01 15:45:57
am3kjo,,samsung,2019-02-01 16:09:55
am3sff,My grandma had gotten a gift for christmas two years ago (samsung smart tv 40+in . over the weekend she said she can hear the tv but no picture what so ever i tried switching hdmi cables and turning on and off she doesnt really drive anymore and needs a fix for her tv ASAP thanks in advance,samsung,2019-02-01 16:29:44
am3tar,,samsung,2019-02-01 16:31:55
am476g,,samsung,2019-02-01 17:06:17
am4a42,,samsung,2019-02-01 17:13:33
am4ohy,,samsung,2019-02-01 17:49:18
am4uyi,"Your S10 prices, according to leaks, are just as bad as iPhone. More worth the buck than iPhones are, but regardless. $894 for the S10 lite? 
$1024 for the S10? $1400 for the S10+? And the highest model, S10+ 1TB storage, is $1800. I don't really know who you think your average consumer is or how much they make at their job, but that kind of money for a phone is outrageous.  I hope to see these ALL lowered.",samsung,2019-02-01 18:04:54
am54qv,,samsung,2019-02-01 18:29:28
am5fkt,,samsung,2019-02-01 18:56:35
am5mgf,"So I woke up late this morning, because the alarm on my phone didn't go off. When I picked up my phone, I was prompted to enter my PIN code. It wasn't my usual lock screen. I immediately felt like something was wrong, but I didn't know what else to do. Not really thinking too hard, I put in my password. 


And then, blue screen. Followed by the words ""erasing"".


I panicked, but I couldn't do anything. After some tense 15 minutes, I was restoring as much as possible.


Is this a glitch? My phone was on the floor beside my bed, charging. Did I somehow accidentally reset it in my sleep? Am I just an idiot?


I restored what I could, but I lost everything from January--  my photos in both my Samsung cloud *and* in my Google photos, and all of my Samsung notes. I don't even *know* how to start the erasing process. If I wanted to reset my phone, I couldn't.


So, any ideas what happened?",samsung,2019-02-01 19:14:06
am631l,,samsung,2019-02-01 19:56:52
am6hka,,samsung,2019-02-01 20:35:36
am6o8v,I have a Samsung galaxy a7 and when I got it it had rounded corners. Can I disable them and get sharp corners like a normal heckling phone? The rounded corners are ugli.,samsung,2019-02-01 20:54:05
am746h,,samsung,2019-02-01 21:37:43
am7857,[removed],samsung,2019-02-01 21:48:48
am9dor,After hearing people talk about how the notification LED on the S10 will become history. I wonder if Samsung would use LED around the camera hole as the notification LED similar to that of the Samsung A8S?,samsung,2019-02-02 01:43:07
am9lrv,"ok so at&amp;t was the first major US carrier to get the Android Pie with Samsung One UI update, i love everything about the UI so far but i have come to notice that when using the camera you can no longer record video in pro mode and i spent about a solid 45 minutes trying to figure out how to record in 4k. Generally i record in 1920x1080/60fps and i no longer see that option anymore either, im not sure if this is something that samsung missed before launch or maybe its there and im just doing something wrong which i doubt with the amount of time i spent messing with the camera settings. hopefully someone can shed some light on this...thanks in advance for the help...",samsung,2019-02-02 02:08:40
ama6qd,Why the hell doesn't Samsung update their unlocked phones first? I have an unlocked s9+ and I'm hearing about all my friends on carrier locked phones getting their Android 9 update. It seems stupid that I buy a device directly from Samsung and get important updates last. I've used Samsung for a while but I'm disappointed right now. ,samsung,2019-02-02 03:18:57
amaf8d,,samsung,2019-02-02 03:48:47
