subreddit,title,timestamp
samsung,"Just as S6's lack of SD card support, Samsung seems to fuck it off every 4 years or so.",2019-08-08 01:28:32
samsung,Internal Audio,2019-08-08 01:56:46
samsung,"Daily Tech Support / WSIB Thread - August 08, 2019",2019-08-08 01:57:59
samsung,"US pre-orders: if you reserved, search your emails for Samsung! Your pre order should be open!",2019-08-08 02:35:46
samsung,"Samsung Galaxy S10e, S10 &amp; S10+ Price&amp; Pre-Orders",2019-08-08 03:11:12
samsung,Samsung upgrade program how it works?,2019-08-08 03:41:18
samsung,Samsung Is a Truly Amazing Company,2019-08-08 03:48:45
samsung,Package disabler pro for Samsung devices gone from the play store?,2019-08-08 04:08:25
samsung,Samsung Galaxy M20s Details,2019-08-08 04:10:06
samsung,Samsung health is my favorite feature of theirs. So nice to see my results.,2019-08-08 04:21:09
samsung,"Samsung Galaxy Note 10 Colors - First Look (Aura Glow, Aura Red, Aura Pink, &amp; MORE)",2019-08-08 04:21:32
samsung,I'm swapping to iPhone,2019-08-08 04:25:37
samsung,"Samsung Galaxy Note10 and Galaxy Note10+ Pre-Order Price, Availability",2019-08-08 04:26:32
samsung,Samsung Soundbar no longer turns on with Samsung TV - Ideas?,2019-08-08 04:30:54
samsung,Samsung offering up to $200 credit at Samsung site,2019-08-08 04:34:36
samsung,"Let's face it, Note 10/+ missing the headphone jack means that most flagship consumers adapt rather than vote with their wallets",2019-08-08 04:39:26
samsung,Does anyone else feel like the note 9 was revolutionary and the note 10 is just another phone?,2019-08-08 04:42:39
samsung,The r/Samsung Discord - Single out and enter this world of Samsung Enthusiasts. Approaching two-thousand members.,2019-08-08 04:43:47
samsung,Impresiile Samsung GALAXY NOTE 10/10 Plus in Primele VIDEO,2019-08-08 05:01:17
samsung,Samsung better not repet what they did to the Note 10 to the s11,2019-08-08 05:25:40
samsung,"Samsung Galaxy Tab A SM-T290 8"" 2019 Overview - My Tablet Guide",2019-08-08 05:30:31
samsung,Payment method,2019-08-08 05:54:29
samsung,"Note 10 preorder error, free Galaxy watch",2019-08-08 06:04:03
samsung,Samsung Galaxy Note 10+ Lanuched with 5G Support But No Headphone Jack,2019-08-08 06:18:15
samsung,What Samsung should have done with the note series.,2019-08-08 06:22:38
samsung,In the Microsoft Store? Why? What kind of agreement does Samsung have with Microsoft now? is it the end of Samsung?!,2019-08-08 06:38:11
samsung,Samsung out there desteoying peoples life - translation in comments,2019-08-08 06:43:27
samsung,"Okay Samsung, you made all great innovations. But... WHO IS GOING TO PUT THE PHONE SCREEN ON THE CEMENT WITHOUT COVERS TO CHARGE THE BUDS????",2019-08-08 06:49:29
samsung,MST Chip on Note 10,2019-08-08 07:17:22
samsung,New Samsung S11 leaked three phase Hyper fast charge,2019-08-08 07:51:05
samsung,An open letter to Samsung.,2019-08-08 08:55:59
samsung,So no preorder bonus for europeans ?,2019-08-08 09:12:55
samsung,A question for all you 1080p bashers,2019-08-08 09:49:37
samsung,Note 10 and the first look at Samsung Galaxy Note 10 +: modest overhauls come at a high price,2019-08-08 09:54:21
samsung,Samsung removed the Bixby button in Galaxy Note 10 &amp; Note 10+,2019-08-08 10:40:19
samsung,Brampton man allegedly burned by Samsung phone.,2019-08-08 11:32:33
samsung,How do I completely transfer my files from my broken Samsung G5-31H to my computer?,2019-08-08 11:34:01
samsung,Note 10 vs. S10,2019-08-08 12:09:11
samsung,Samsung's naming choice was bad imo,2019-08-08 12:20:11
samsung,"Import other Notes into ""Samsung Notes""",2019-08-08 12:21:48
samsung,Note10+ Out of stock,2019-08-08 12:37:26
samsung,Download Samsung Galaxy Note 10 Stock Wallpapers,2019-08-08 12:38:40
samsung,Samsung Note 10 - DREAM! Buy - Xiaomi) https://bit.ly/2ZT3QP2,2019-08-08 12:40:44
samsung,Samsung galaxy note 10,2019-08-08 12:43:48
samsung,PENIBIL! Samsung STERGE Reclamele in care a RAS de iPhone,2019-08-08 12:51:19
samsung,"Thank you Samsung Turkey. 11399 Turkish Lira is €1900 or $2100 and that's just the LTE version. We don't have a 512 GB or 5G option here. Also they are just giving €125 Under Armour coupon and Buds as pre order gift. For comparison, minimum wage here in Turkey is €422.",2019-08-08 12:53:52
samsung,Did Samsung totally forget about the Heart Rate and Blood Pressure sensor on all Note 10 models?,2019-08-08 12:57:12
samsung,Samsung Note 8 Back Glass,2019-08-08 13:18:46
samsung,Galaxy J260t1 Themes?,2019-08-08 13:20:10
samsung,Samsung trade-in for galaxy note 10,2019-08-08 13:29:57
samsung,Anybody else really enjoy the vertical camera aesthetic?,2019-08-08 13:45:11
samsung,Quick question about Samsung Finance,2019-08-08 13:58:39
samsung,Latest Samsung news,2019-08-08 14:22:07
samsung,How long does Samsung take to refund a cancelled preorder?,2019-08-08 14:27:40
samsung,Samsung is deleting Apple trolling videos,2019-08-08 14:45:02
samsung,Has anyone realized that the resolution quality of Samsung phones has gone down after the last update despite being WQHD+?,2019-08-08 15:27:31
samsung,Samsung please don't take out the headphone jack...,2019-08-08 15:44:50
samsung,New DeX features will come to older Samsung Flagships according to leak,2019-08-08 15:52:03
samsung,"Galaxy Note 10 with Samsung DeX for PC, Link to Windows, and PlayGalaxy Link",2019-08-08 16:15:51
samsung,Is the bundled charger in note 9 a USB 2.0 OR 3.0?,2019-08-08 16:27:59
samsung,Tech help with samsung soundbar HW-M550,2019-08-08 16:40:15
samsung,It is ridiculous that Samsung doesn't have a Guest or Private mode anymore.,2019-08-08 16:52:08
samsung,Samsung Galxy s10+ issues,2019-08-08 17:06:57
samsung,Using $150 Samsung Pre-order credit on Galaxy Buds?,2019-08-08 17:45:03
samsung,Can I trade-in with samsung with my refurbished phone?,2019-08-08 18:14:32
samsung,"Samsung Takes Down Its Ads That Mocked Apple for Removing the Headphone Jack After Note 10, Note 10 Plus Launch",2019-08-08 18:18:18
samsung,Samsung users when the Apple got rid of the headphone jack vs them now,2019-08-08 18:24:34
samsung,loyal fans holding back will have to upgrade eventually. Samsung will make more profit from wireless accessories in the long run.,2019-08-08 18:25:45
samsung,Unpopular opinion: people are overreacting about the headphone jack,2019-08-08 18:47:16
samsung,Would you think differently of the Note10e if it had a flat screen?,2019-08-08 18:51:15
samsung,Samsung Galaxy Note 10 launch: big screens and stylus air gestures,2019-08-08 19:00:08
samsung,"Oh well, what have you done samsung..",2019-08-08 19:09:02
samsung,Is it worth upgrading samsung S8 to S10?,2019-08-08 19:21:16
samsung,Why the removal of the headphone jack in the Note line is a disservice to its intended audience.,2019-08-08 19:28:12
samsung,Note 10 vs other screens PPI,2019-08-08 20:34:48
samsung,Samsung galaxy tab A questions?,2019-08-08 20:36:22
samsung,My phone has screen burn. Anyways to help it? (Samsung Galaxy s8),2019-08-08 20:46:01
samsung,Samsung is becoming Apple..,2019-08-08 21:02:43
samsung,Does the Note 10+ have Samsung Pay? And does it support the Dex Station and Pad?,2019-08-08 21:38:26
samsung,About the note 10,2019-08-08 21:38:30
samsung,Will the S11 have a Headphone Jack and MicroSD Card Slot?,2019-08-08 21:57:50
samsung,Samsung Note 10 (2019) (1200$) vs Samsung Note Edge (2014) (Launch 947$ Now ~100$) Thoughts?,2019-08-08 22:01:53
samsung,"Samsung Internet Browser vs Google Chrome, and why?",2019-08-08 22:09:05
samsung,Samsung Internet Browser vs Google Chrome,2019-08-08 22:10:02
samsung,Buttons on note 10,2019-08-08 22:23:57
samsung,How do I disable Samsung Internet?,2019-08-08 22:33:13
samsung,&gt;Samsung Note 10 (2019) (1200$) vs Samsung Note Edge (2014) (Launch 947$ Now ~100) Thoughts?,2019-08-08 22:36:43
samsung,Wallpaper Samsung galaxy note 10,2019-08-08 22:47:55
samsung,Is Samsung TV Plus free?,2019-08-08 22:51:48
samsung,Couldn’t opt in to Samsung Upgrade,2019-08-08 23:00:07
samsung,How has One UI Changed samsung compared to iOS?,2019-08-08 23:31:34
samsung,Samsung TV HDMI 2/AnyNet+ Problem,2019-08-08 23:52:26
samsung,When someone finds out the Samsung note 10 is worse and uglier than the s10,2019-08-08 23:56:05
samsung,Join the r/Samsung Discord Server!,2019-08-09 01:22:49
samsung,"Official Samsung Cases for Galaxy Note 10 (LED, Rugged, Leather, &amp; More)",2019-08-09 01:23:55
samsung,Samsung is making too many phones,2019-08-09 01:47:24
samsung,IPhone calendar sync to Samsung Home Hub calendar?,2019-08-09 01:51:13
samsung,"Daily Tech Support / WSIB Thread - August 09, 2019",2019-08-09 01:58:04
samsung,How can I buy a new Samsung Galaxy s10 but specify the snapdragon 855 version not the Exynos version,2019-08-09 02:03:24
samsung,Going to buy Samsung Galaxy note 10？ Pick up your screen protector and case here,2019-08-09 02:13:33
samsung,What do you the the Samsung S10e will cost in a year from now/black Friday.,2019-08-09 04:31:48
samsung,Can i trade in Pixel for Samsung Note 10+?,2019-08-09 04:32:50
samsung,Samsung GALAXY NOTE 10 Plus vs S10 Plus – Compartia Gigantilor (VIDEO),2019-08-09 05:05:30
samsung,Bixby is just malware,2019-08-09 05:09:38
samsung,"There's this tiny black shadow smudge in the bottom right of my Samsung 1080p LED HDTV. Can I remove it somehow? It's really distracting, I also have no warrenty. Help?",2019-08-09 05:09:53
samsung,"I am surprised at all the hate the note 10+ is getting. I think they did a great job, and I cannot wait to get mine.",2019-08-09 06:31:08
samsung,"Samsung removes headphone jack, takes down commercials mocking Apple for removing headphone jack [Louis Rossmann]",2019-08-09 06:31:53
samsung,Samsung ads mocking iPhones quietly deleted as it follows Apple’s example,2019-08-09 09:35:01
samsung,Does the Note 10 have MST (Samsung Pay)?,2019-08-09 09:42:57
samsung,Does the Note 10 have MST (Samsung Pay)?,2019-08-09 09:44:18
samsung,Top-tier marketing Samsung,2019-08-09 10:11:55
samsung,No preorder incentive for Note 10 in UK.,2019-08-09 10:13:45
samsung,Anyone know where I can get wholesale B2B Samsung phones in Europe for a decent price?,2019-08-09 10:20:31
samsung,Samsung Galaxy Note 10 Unveiled at the Unpacked Event 2019,2019-08-09 10:33:12
samsung,Vestea GROZAVA despre Samsung GALAXY S11 ce a UIMIT Fanii,2019-08-09 11:02:22
samsung,Samsung Galaxy Note Conference,2019-08-09 11:54:15
samsung,Best Selfless Award goes to Samsung,2019-08-09 12:25:11
samsung,How can I buy a new Samsung Galaxy s10 but specify the snapdragon 855 version not the Exynos version,2019-08-09 13:16:31
samsung,Compare Best Price Samsung Galaxy A50,2019-08-09 13:25:49
samsung,Where is the best place to buy a Note 9?,2019-08-09 13:32:24
samsung,How Can I get The snapdragon samsung s10 instead of the exynos version,2019-08-09 13:34:53
samsung,"Why does the Note 10+ say 5G beside on the Samsung US site it because I thought that the Note 10+ 5G was a higher end model being sold for $1300 USD rather, while the Note 10+ was being sold for $1100 USD. Is this a mistake or is the Note 10+ capable of 5G.",2019-08-09 13:58:44
samsung,Samsung Knox - Android P,2019-08-09 14:07:52
samsung,samsung pls fix ur unsubscribe email feature,2019-08-09 14:14:05
samsung,[POLL]As of now Will you consider another Company than Samsung for your next Smartphone?,2019-08-09 14:22:08
samsung,"Rant all you want about Note 10/+, but nothing would change unless everyone is boycotting the series, though I don't see that happening.",2019-08-09 14:25:16
samsung,Discussion: Upgrade from Note 8 to Note 10+ opinions,2019-08-09 14:39:04
samsung,Help! I have a Samsung J3 2018. And it doesn't seem to want to download MMS attachments via the Messanger app.,2019-08-09 15:07:24
samsung,Samsung has removed some of its old ads that mocked Apple,2019-08-09 15:36:37
