subreddit,title,timestamp
samsung,Samsung MZ7TE250HMHP - 250GB Solid State Disk (SSD) MZ-7TE250,2019-08-01 07:22:12
samsung,Design Book Handy Tasche Hülle Etui Schutz Auswahl 5 für Samsung Galaxy S10 Plus,2019-08-01 07:42:24
samsung,2 Toner Cartridge Replace for Samsung MLT-D2092L SCX-4824 SCX-4824FN SCX-4825FN,2019-08-01 07:57:19
samsung,Samsung GALAXY NOTE 10 IMPRESIONEAZA intr-o noua Imagine,2019-08-01 08:03:14
samsung,Design Book Handy Tasche Hülle Etui Schutz für Samsung Galaxy S9 Plus Auswahl 4,2019-08-01 08:12:11
samsung,Android (Samsung Galaxy A50) best way to charge!?,2019-08-01 08:12:31
samsung,Samsung SmartThings Starter kit - White,2019-08-01 08:22:39
samsung,Samsung highlights a decade of Galaxy innovations in a new infographic,2019-08-01 08:42:12
samsung,Hama Displayschutz Full-Screen für SAMSUNG Galaxy S8,2019-08-01 08:42:24
samsung,Samsung Galaxy Note10 Plus 5G Leaked in a final render,2019-08-01 08:53:15
samsung,RETRO COVER SCOCCA RICAMBIO COMPATIBILE CON SAMSUNG GALAXY S8 COPRI BATTERIA ORO,2019-08-01 08:57:26
samsung,DISPLAY SCHERMO LCD TOUCH COMPATIBILE CON SAMSUNG GALAXY S10e SM-G970 NERO SERVI,2019-08-01 09:12:06
samsung,SAMSUNG GALAXY TAB A 10.1 (2016) SM-T585 BLACK (SCHWARZ) 32 GB,2019-08-01 09:22:25
samsung,Samsung A70 or pixel 3a?,2019-08-01 11:07:28
samsung,Samsung tab S2 issues..help?,2019-08-01 11:54:46
samsung,(No) Alternative launchers on A5 (2017),2019-08-01 12:24:55
samsung,Want to know more about the Samsung Galaxy Note 10. Check out this video,2019-08-01 12:45:14
samsung,Buy Catalyst® Impact Protection Case for Samsung Galaxy Smart Phones - Catalyst Case CA,2019-08-01 13:03:39
samsung,What Samsung devices do you have?,2019-08-01 15:40:40
samsung,Galaxy Watch Active 2 &amp; Samsung Galaxy Note 10 Plus Live Images leak,2019-08-01 16:21:08
samsung,Welcome to the club Samsung,2019-08-01 16:31:36
samsung,Galaxy Watch Active 2 &amp; Samsung Galaxy Note 10 Plus Live Images leak,2019-08-01 16:35:06
samsung,Samsung only has itself to blame for spoiling its product launch events,2019-08-01 16:40:27
samsung,samsung pc studio is obsolete,2019-08-01 17:37:28
samsung,PSA - Disabling Usage Data Access PROBLEMS,2019-08-01 18:33:50
samsung,Samsung GALAXY NOTE 10/10 Plus – Iata PRIMUL Hands-on VIDEO,2019-08-01 18:36:19
samsung,Every time i open up Samsung Pay it says its not working. I have tried everything. Can someone Help?,2019-08-01 19:03:41
samsung,"Samsung S10 Plus Charger Port Issue, Had it Inspected Locally per Samsung, Now Samsung says send it in for evaluation. Wait what?",2019-08-01 20:07:48
samsung,Should I use Samsung Upgrade to get Note 10 Plus?,2019-08-01 20:19:06
samsung,Beeping when I put volume up w/ headphones. Need help!,2019-08-01 21:12:21
samsung,How much should it cost to replace a Samsung s9 screen? Is $300 a scam?,2019-08-01 22:25:09
samsung,Galaxy s10 price with activation vs without,2019-08-01 22:32:01
samsung,Help with Iconx vs Galaxybuds,2019-08-01 23:09:10
samsung,Samsung A70 Notification of Social Media Apps,2019-08-01 23:19:05
samsung,Samsung is testing the Exynos 9630 mid-range chipset,2019-08-02 00:50:02
samsung,"Daily Tech Support / WSIB Thread - August 02, 2019",2019-08-02 01:58:06
samsung,Unacceptable Instagram Stories Quality - S9 and S10,2019-08-02 02:42:40
samsung,Clientii cu Telefoanele Samsung au parte de o VESTE GROZAVA,2019-08-02 05:03:43
samsung,Switch to Samsung from iPhone about 3 months ago loving everything so far although everybody I know has iPhone when pictures are sent to me via Samsung's messager they are very distorted and pixelated is there a setting I can activate make pictures come in clear?,2019-08-02 05:14:33
samsung,Purchasing a Samsung S10+ on Samsung.com/us,2019-08-02 05:20:54
samsung,Samsung tab s6 windows,2019-08-02 07:12:08
samsung,Why does my Samsung A10e show media on the internet as mildly pixelated,2019-08-02 07:35:53
samsung,Why does my Samsung a10e show media on social media apps and internet as mildly pixelated,2019-08-02 07:45:51
samsung,Samsung Tablet,2019-08-02 08:26:34
samsung,Is there a way to move normal bookmarks to Secret Mode in Samsung Internet app? I tried many things but couldn't get it to work.,2019-08-02 08:28:51
samsung,Samsung galaxy s9 plus moisture detected in the port,2019-08-02 08:45:10
samsung,Buy Catalyst® Impact Protection Phone Case for Samsung Galaxy Phones - Catalyst Lifestyle,2019-08-02 11:08:11
samsung,Samsung GALAXY NOTE 10 ar fi mai IEFTIN decat Credeai,2019-08-02 12:36:55
samsung,My opinion on the Note 11,2019-08-02 13:23:13
samsung,My opinion on the Note 10,2019-08-02 13:27:15
samsung,Does Samsung hw j355 soundbar have any way to prevent volume settings from being deleted when unit powers off?,2019-08-02 14:44:43
samsung,Give me something worth upgrading to,2019-08-02 15:00:52
samsung,"I just love my #GalaxyS8. it's still powerful, great for mobile photography and so on. #GalaxyPower #Samsung",2019-08-02 15:05:07
samsung,[Request] Screen Lock and Tizen Watches,2019-08-02 15:24:43
samsung,[Update][Oreo] Samsung Music Dark Theme Update for Android Oreo and lower!!,2019-08-02 16:12:56
samsung,SAMSUNG GALAXY ZERO TRAILER,2019-08-02 17:29:09
samsung,Backup pictures on sd-card,2019-08-02 18:00:27
samsung,What is making my samsung phone abruptly shuts off and loses its battery life even when it is recently charged?,2019-08-02 18:25:27
samsung,"Looking to upgrade my old tablet to the Samsung Tablet s4, stuck between buying factory new or ""like new"" from ebay",2019-08-02 18:42:45
samsung,Samsung Galaxy Note 10 and Samsung Galaxy Note 10 Plus Price Leaked,2019-08-02 20:12:41
samsung,"Random chime, no notifcation.",2019-08-02 20:35:02
samsung,Samsung messages apk,2019-08-02 21:36:52
samsung,Samsung A50,2019-08-02 23:05:18
samsung,DBrand Confirms Samsung Galaxy S10 design.,2019-08-03 00:43:17
samsung,Samsung J7 not turning on,2019-08-03 01:37:54
samsung,"Daily Tech Support / WSIB Thread - August 03, 2019",2019-08-03 01:57:51
samsung,Samsung Galaxy Note 10 vs Galaxy Note 10 Plus specs comparison,2019-08-03 05:35:05
samsung,New to Samsung and want some help!,2019-08-03 08:43:57
samsung,Google contacts,2019-08-03 11:54:03
samsung,"Samsung Galaxy s9 , still worth buying in 2019?",2019-08-03 12:35:32
samsung,Is the Samsung Galaxy Smartwatch Worth Buying?,2019-08-03 12:45:51
samsung,Samsung Galaxy s9 still worth buying in 2019,2019-08-03 12:50:25
samsung,Samsung Note 10 Event- Timings and how to watch live stream.,2019-08-03 13:00:28
samsung,Buying a Samsung smart watch,2019-08-03 13:03:25
samsung,Samsung Galaxy Note 10 vs Galaxy Note 10 Plus specs comparison,2019-08-03 14:00:18
samsung,Samsung va LANSA un nou Telefon cu o Tehnologie SURPRIZA,2019-08-03 15:01:06
samsung,"Use Android Pie 9.0 features effectively with Samsung Smartphones. Android Pie is packed with all sorts of new features, including a brand-new gesture navigation system, upgraded UI elements and this is undoubtedly the best Android version till date.",2019-08-03 17:02:14
samsung,"My Samsung s9, which I have had for around 9 months now, has a battery issue. Every day the battery will gradually run down like every phone but when it reaches anywhere from 15% to 10% battery it suddenly switches off with a battery level of 0%. Does anyone know why this might be?",2019-08-03 17:28:54
samsung,The new Samsung Update for my Galaxy S7 edge has made my phone unusable. I can't afford a new phone right now..... UGHHHH!!!,2019-08-03 18:17:58
samsung,Anyone know if Samsung will accept broken screens for the Note 10 Trade In Promotion?,2019-08-03 20:03:55
samsung,Whens the best time to buy the Samsung Tab s4?,2019-08-03 21:06:59
samsung,Samsung Galaxy j6+,2019-08-03 21:33:43
samsung,This just hit me. Why doesn't/isn't an option to upgrade from Android 8 to Android 9 (Pie) on SAMSUNG NOTE 8???,2019-08-03 21:48:46
samsung,"i accidently put the ""sim card needle"" into the mic holes of my A70 will i be okay?",2019-08-03 22:40:54
samsung,"His and Her's. I've been Team Samsung for about 6 years now. I decided to go with the S10+ instead of going with the upcoming note 10. I've had the last 3 Notes and yeah I liked em, I just didn't use the spen enough. I just converted my wife from the iPhone side too.",2019-08-03 23:16:04
samsung,S9+ vs S10e. Which to get?,2019-08-04 00:09:46
samsung,"It's Shot on Samsung Sunday, Share your best photo's in this thread! - [Ends Monday at 00:00 UTC]",2019-08-04 00:16:43
samsung,Samsung S8 charging port broke,2019-08-04 00:23:46
samsung,Samsung Galaxy Note 10 and Samsung Galaxy Note 10 Plus Price Leaked,2019-08-04 01:07:22
samsung,Biggest Samsung Digital Plaza I have ever seen,2019-08-04 01:56:21
samsung,"Daily Tech Support / WSIB Thread - August 04, 2019",2019-08-04 01:58:08
samsung,"Deleted Samsung notes app cause I'm an idiot, please help.",2019-08-04 02:10:16
samsung,Looking for advice on removing Samsung pay on my A5,2019-08-04 02:50:07
samsung,Refurbished Samsung Watch,2019-08-04 03:21:56
samsung,S10+ or Note 10...,2019-08-04 04:12:03
samsung,Should I buy the Samsung tablet S4,2019-08-04 04:34:20
samsung,S10e case recommendations,2019-08-04 05:03:28
samsung,But Samsung... I don't wanna go up the STAIR more.,2019-08-04 05:03:51
samsung,Is it possible to purchase themes with Samsung reward points?,2019-08-04 05:25:59
samsung,Why are Samsung users considered more conservative than iPhone users in South Korea?,2019-08-04 08:30:57
samsung,Should Samsung invest in making there own software?,2019-08-04 09:35:48
samsung,Samsung GALAXY S10 aduce Samsung Intr-o Situatie DISPERATA,2019-08-04 10:01:34
samsung,How does the multi task work on the Samsung One UI,2019-08-04 10:28:08
samsung,Samsung TV advice,2019-08-04 10:28:48
samsung,S10 PLUS,2019-08-04 11:09:30
samsung,Samsung Wireless Charger,2019-08-04 11:42:41
samsung,"Help please, theres chat text with and upward arrow and the navigation has seemed to duplicate itself! Samsung galaxy s9, Evie launcher",2019-08-04 12:41:10
samsung,Samsung Galaxy Fit,2019-08-04 12:43:00
samsung,Samsung galaxy fit advice,2019-08-04 13:04:03
samsung,Sound on newer Smartphones worse than older ones?,2019-08-04 14:23:00
samsung,"Beautiful SAMSUNG CURVED 24"" monitor just for 110€ 😁",2019-08-04 14:27:12
samsung,Flights,2019-08-04 17:07:18
samsung,Why do Samsung phones no longer come in gold?,2019-08-04 17:15:49
samsung,Can I use any USB-Type C Charger with my S9?,2019-08-04 18:29:35
samsung,"Best apps for Samsung smart TV apps. There are hundreds of Samsung smart TV apps, so many new Apps releasing all the time, it’s hard to choose which apps are worth downloading. But, living among dilemmas, I have chosen the top 12 best Smart TV apps for Samsung.",2019-08-04 20:19:51
samsung,Samsung Galaxy Note 10 Plus Case,2019-08-04 20:37:29
samsung,What is driving me away from Samsung phones...,2019-08-04 21:00:24
samsung,"If sales are poor enough, can we force samsung to bring back the headphone jack and SD cardslot?",2019-08-04 22:56:33
samsung,/r/samsung hit 80K subscribers yesterday,2019-08-04 23:50:44
samsung,Taking a screenshot on a Samsung smart tv?,2019-08-05 00:55:34
samsung,"Daily Tech Support / WSIB Thread - August 05, 2019",2019-08-05 01:57:52
samsung,I just bought a new Samsung TV. I'm trying to wall mount it on the wall mount that I already had. Should 2 of the spacers stick out more than the other two? Is this correct? Please answer.,2019-08-05 02:34:59
samsung,Best Samsung Tablet for school ?,2019-08-05 04:44:38
samsung,Samsung GALAXY NOTE 10 NU ARE vreo Sansa in fata Huawei MATE 30 PRO,2019-08-05 05:10:20
samsung,Anyone knows what happened to S Note and it's amazing features? Now we are stuck with a watered-down Samsung Notes version?,2019-08-05 05:18:31
samsung,Question about International samsung galaxy s10e in US.,2019-08-05 05:34:52
samsung,"Samsung A20 Price Cut in a Limited Period Offer, Now Starts at $159.99",2019-08-05 05:37:00
samsung,Samsung Pay on the A series devices,2019-08-05 07:17:01
samsung,Samsung Looks To Open Large-Format Experience Stores in India,2019-08-05 07:17:16
samsung,"Dhërmi, Albania (taken with S10+, edited with Samsung Editor)",2019-08-05 08:06:02
samsung,Samsung will increase the production of mining chips - The Cryptonomist,2019-08-05 08:36:04
samsung,My Samsung Galaxy A50 keeps crashing,2019-08-05 11:46:10
samsung,Review Samsung Galaxy S10e,2019-08-05 12:24:27
samsung,Help with samsung galaxy buds,2019-08-05 12:56:03
samsung,Samsung Music has now Dark theme for old OS Android systems,2019-08-05 13:21:28
samsung,Samsung Galaxy Active 2 comes with optional LTE connectivity,2019-08-05 14:37:04
samsung,Is this the right place to ask?,2019-08-05 15:11:27
samsung,Official firmware Samsung Galaxy 2019,2019-08-05 15:21:07
samsung,"Tab S4, S5E or Tab S6",2019-08-05 15:44:03
samsung,Samsung Galaxy A5 2017 Battery Drain,2019-08-05 16:49:49
samsung,Is warranty support always this difficult?,2019-08-05 16:51:31
samsung,Samsung Galaxy Tab S6: Detailed Review [August 2019],2019-08-05 17:13:55
samsung,Galaxy tab s4 question,2019-08-05 17:16:18
samsung,Galaxy Watch owners: how often do you upgrade?,2019-08-05 17:21:16
samsung,Samsung Galaxy A50,2019-08-05 17:59:07
samsung,Spring Samsung Galaxy A50 Box,2019-08-05 18:20:49
samsung,Samsung Q60R 2019 disable Bluetooth? Can't find it anywhere,2019-08-05 18:58:30
samsung,Royally screwed up Samsung Family Hub Fridge,2019-08-05 19:41:32
samsung,Daily Deal: 49% off (renewed) Samsung Galaxy Watch 46mm,2019-08-05 22:10:37
samsung,I got the samsung galaxy active but...,2019-08-05 22:16:02
samsung,Samsung Night Mode is insane!,2019-08-05 23:09:05
samsung,Samsung TVs and integration with phones and tablets,2019-08-06 00:18:11
samsung,Samsung u-level concerns,2019-08-06 00:26:29
samsung,"Daily Tech Support / WSIB Thread - August 06, 2019",2019-08-06 01:57:56
samsung,"Wallpaper Tuesday - August 06, 2019",2019-08-06 02:10:22
samsung,samsung card (like apple card),2019-08-06 03:20:22
samsung,Crack in Samsung NU8000. Black line vertical and horizontal on screen,2019-08-06 03:36:40
samsung,Samsung tellin it like it is,2019-08-06 04:54:37
samsung,"12"" Galaxy Tab S6?!?!?!",2019-08-06 05:12:26
samsung,What kind of wireless charger did you choose for your Samsung Galaxy note 10?,2019-08-06 05:56:52
samsung,Samsung Galaxy J6,2019-08-06 06:49:20
samsung,Samsung Galaxy S10 (Prism White) Online - Specs &amp; Price at Samsung India,2019-08-06 06:50:42
samsung,"Samsung Galaxy Note10 Release On 7th August,2019.",2019-08-06 07:14:03
samsung,Samsung Galaxy S10 512GB (Prism White) Online at Samsung India,2019-08-06 07:36:00
samsung,Auto wifi sign-in,2019-08-06 07:57:40
samsung,accidently deleted a bunch of videos I want retrieved,2019-08-06 08:41:13
samsung,S10 5G or Note 10+?,2019-08-06 09:18:46
samsung,Telefoanele Samsung sunt MAI RAPIDE decat iPhone si cele Huawei,2019-08-06 09:38:33
samsung,Samsung Galaxy Note 10 Rumors about price and specifications,2019-08-06 09:50:28
samsung,Do Samsung Experience stores in UK have the watches on demo?,2019-08-06 12:37:21
samsung,Fitness tracker that will combine samsung watch / samsung health with others like Fitbit and apple.,2019-08-06 12:52:07
samsung,Best Samsung Smart TV Apps.,2019-08-06 14:00:06
samsung,Would it be possible to activate Samsung photo gallery cloud share without the phone?,2019-08-06 14:16:36
samsung,Plz help my Samsung J8 infinity lights up automatically and apps lag,2019-08-06 14:22:53
samsung,"Samsung GALAXY S12. OFICIAL, Prima Schimbare EXCLUSIVA Anuntata",2019-08-06 14:48:56
samsung,Watch Samsung Galaxy Note 10 Unpacked Event Live 2019 Here,2019-08-06 14:54:27
samsung,samasung galaxy j7,2019-08-06 15:08:14
samsung,Samsung Buds,2019-08-06 15:21:42
samsung,"Right, interesting one here, apparently ages ago there was a huge Samsung pen and my mate had it “apparently”, no one believed him so he got his mum to draw a picture of it (below) if anyone could give me any context if it was real or not I’d appreciate it.",2019-08-06 15:25:04
samsung,Samsung a50 shattered camera glass,2019-08-06 15:37:38
samsung,Does anyone know the width of the stand of the SAMSUNG QLED QE65Q9FN? I cannot find anything online and this type is not available in the shop nearby my home. Thanks in advance!!,2019-08-06 15:53:40
samsung,"Okay Samsung, we need to talk about us and our relationship. (Rant) (s10)",2019-08-06 16:14:40
samsung,"Before you buy a Galaxy phone, be aware that Samsung has been steadily disabling/destroying features on its older phones with each ""android security update""",2019-08-06 16:34:04
samsung,Samsung Galaxy S10 keeps restarting,2019-08-06 16:38:44
samsung,"[Update 2: Launching within 2 years] Samsung licenses AMD Radeon graphics technology for smartphones, brings 1 month free Hatch game streaming to the Galaxy S10 5G",2019-08-06 16:47:58
samsung,Tips and tricks?,2019-08-06 16:57:14
samsung,Samsung GALAXY NOTE 10. SPECIFICATII Tehnice FINALE si COMPLETE,2019-08-06 17:01:51
samsung,I love the Galaxy phones but I have a problem with the icons on the S9 and S10 series. The icons look like a 5 year old drew them. They look bad. One of the reasons I got a Galaxy was because the icons and system was so modern and sophisticated. But Samsung went a step in the wrong direction.,2019-08-06 17:05:24
samsung,Is there a diffrence between Samsung galaxy korean vs usa version? On ebay korean is cheaper ?,2019-08-06 17:14:30
samsung,Is there a diffrence between Samsung galaxy phones Korean vs USA version? On ebay Korean is cheaper ?,2019-08-06 17:24:52
samsung,Sound on newer phones worse than on older ones?,2019-08-06 17:55:37
samsung,"Leaked Samsung marketing materials confirm two Note 10 sizes, new S Pen features, and more",2019-08-06 18:40:50
samsung,How do I stop my phone giving me this reminder every day? Sometimes I get it 3 times an hour... get the hint: I dont want to use 'my' Samsung account.,2019-08-06 18:41:11
samsung,Samsung Galaxy M30 Price in Bangladesh 2019 &amp; Full Specification,2019-08-06 19:03:30
samsung,Arrival Of Exynos 9825 On August 7 Has Been Teased By Samsung,2019-08-06 19:57:05
samsung,Cannot go back to a flat screen phone display..,2019-08-06 20:37:12
samsung,SAMSUNG GALAXY TAB - S4 or S5e,2019-08-06 20:53:13
samsung,how fast do u have to pre order till the phone sells out,2019-08-06 20:56:55
samsung,What (if anything) is Samsung giving in exchange for Note 7's now?,2019-08-06 21:46:30
samsung,What's the big pro for the samsung watches?,2019-08-06 22:35:39
samsung,Samsung s10 Dolby Atmos ( Sound quality and effects),2019-08-06 22:51:14
samsung,Samsung Discord,2019-08-06 23:31:35
samsung,Samsung Galaxy Note 10 Leaks Release date and Price | TechCham,2019-08-06 23:58:25
samsung,Just spoke to Samsung support..,2019-08-07 00:20:24
samsung,Samsung now has the UFS Memory card on their website,2019-08-07 00:21:08
samsung,Samsung Galaxy Note10 – Everything You Need To Know!,2019-08-07 01:17:27
samsung,Join the r/Samsung Discord! Especially now to discuss the upcoming Note 10 Unpacked Event with the server's 1600 members as it happens.,2019-08-07 01:43:48
samsung,"Daily Tech Support / WSIB Thread - August 07, 2019",2019-08-07 01:58:14
samsung,Is it possible to mirror an iPhone to my samsung smart tv for free without a computer?,2019-08-07 03:03:25
samsung,No Double tap to lock feature in Samsung M30?,2019-08-07 03:37:46
samsung,Some tech questions.,2019-08-07 04:00:29
samsung,Procesorul Samsung GALAXY NOTE 10 Anuntat + o Noua Imagine,2019-08-07 05:01:26
samsung,"I've never gotten Samsung pass set up, its always just this :( I've had the S10+ since the month after it came out",2019-08-07 05:07:12
samsung,Samsung Financing Upgrade Question,2019-08-07 05:34:49
samsung,Samsung Galaxy S10+ (Prism Black) Online - Specs &amp; Price at Samsung India,2019-08-07 07:31:28
samsung,Samsung Galaxy S10e - Camera photos disappeared from Gallery app (and phone itself),2019-08-07 08:54:45
samsung,Samsung Galaxy Note10 Price + Specifications Leaked!,2019-08-07 09:33:00
samsung,Samsung Galaxy S10+ (Prism Blue) Online - Specs &amp; Price at Samsung India,2019-08-07 10:19:25
samsung,Is the Samsung Galaxy Fit any good for small wrists?,2019-08-07 10:21:32
samsung,Samsung Customer Support royally screwed me,2019-08-07 11:39:22
samsung,Multipack background wallpapers with own images from gallery?,2019-08-07 11:46:56
samsung,Stop Note 9 from deleting background app cache,2019-08-07 11:53:41
samsung,Captured with Samsung Galaxy A50 live focus,2019-08-07 11:56:12
samsung,Samsung S series vs. Note series. Which one is the flagship?,2019-08-07 12:39:03
samsung,Samsung S series vs Note series. Which is the flagship?,2019-08-07 12:51:32
samsung,Does it matter witch HDMI-port I use for my PS4 Pro?,2019-08-07 13:50:43
samsung,"Apart from the launch of Galaxy Note 10, who else are waiting for the song that samsung chooses for its TV commercial. I have been fan of those fron the S10..",2019-08-07 14:21:41
samsung,Samsung.,2019-08-07 14:35:55
samsung,Samsung 65“ 4K UHD smart-TV UE65RU7105,2019-08-07 14:37:59
samsung,Galaxy Note 10 launch.,2019-08-07 14:39:39
samsung,BUMPER FOR SAMSUNG GALAXY A50,2019-08-07 14:49:42
samsung,Samsung S10e Samsung/Google Pay won't allow card,2019-08-07 15:02:46
samsung,Was going to tell my aunt to get the XS Max from her Note 5 but ... this Note 10 came out of nowhere,2019-08-07 15:22:31
samsung,OpenSignal: Samsung phones often beat the latest iPhones in download speed,2019-08-07 15:41:31
samsung,Samsung Galaxy Tab S6 vs Apple Ipad Pro 2019,2019-08-07 16:35:55
samsung,The Amount Of Phone Models Samsung Has In Their Lineup Is Kind Of Crazy...,2019-08-07 16:38:32
samsung,Snapchat super zoomed in on a70?,2019-08-07 16:45:01
samsung,Samsung Galaxy Note 10 - Top Features,2019-08-07 16:45:50
samsung,"Samsung S10e.... what does the ""e"" stand for? Any guesses?",2019-08-07 17:52:15
samsung,Unlocked Samsung Galaxy S10's getting July security patch,2019-08-07 18:25:15
samsung,Samsung akg headphones,2019-08-07 18:49:53
samsung,Samsung screws us over again!,2019-08-07 18:59:25
samsung,Samsung GALAXY NOTE 10 LIVE VIDEO STREAM de la Lansare,2019-08-07 19:01:33
samsung,Recommended screen protectors for Samsung phones? (Specifically a J3),2019-08-07 19:11:02
samsung,Can you check your exact elevation on a Samsung Galaxy phone?,2019-08-07 19:12:14
samsung,Samsung big bottom,2019-08-07 19:16:31
samsung,Samsung live stream is up,2019-08-07 19:30:24
samsung,Unpacked Bingo happening in the Samsung Discord. Join in,2019-08-07 19:43:00
samsung,4 small hands on details about the note 10 and +,2019-08-07 20:04:06
samsung,Note 10 is live on the samsung website,2019-08-07 20:07:50
samsung,SAMSUNG GALAXY NOTE 10!,2019-08-07 20:11:57
samsung,Samsung announce Galaxy Note 10,2019-08-07 20:16:54
samsung,The galaxy note 10 is a joke,2019-08-07 20:21:35
samsung,Galaxy watch vs other wear os watches,2019-08-07 20:24:44
samsung,"Samsung Note 10 And Note 10+ Unveiled With QHD+, SD855+ Armor, UFS 3.0, And Switchable Apertures",2019-08-07 20:36:05
samsung,Samsung Note 10: Unveiling,2019-08-07 20:44:45
samsung,Quite disappointed in Samsung,2019-08-07 20:49:43
samsung,Rip Headphone Jack,2019-08-07 20:53:11
samsung,Note 10 event,2019-08-07 21:04:15
samsung,Need help finding a case that fits,2019-08-07 21:13:15
samsung,When Samsung announced that the Note 10 will have no headphone jack.,2019-08-07 21:16:08
samsung,Samsung Galaxy Book S: Unveiling,2019-08-07 21:16:35
samsung,The Samsung event really captured the essence of how I like to charge my watch,2019-08-07 21:27:23
samsung,Galaxy Note 10 Rant,2019-08-07 21:28:14
samsung,Note 10 Plus - This is legit,2019-08-07 21:29:04
samsung,questions about Samsung phones/ Note 10,2019-08-07 21:32:46
samsung,Samsung Note 10 Official TVC: Next Level Power,2019-08-07 21:33:58
samsung,Why Samsung KILLED Headphone Jack on Galaxy Note 10,2019-08-07 21:37:41
samsung,"With the Note 10+ more powerful than a lot of laptops, Samsung needs to bring out a DeX+ with dual monitor support",2019-08-07 21:39:30
samsung,How I designed the new S-Pen for the new Galaxy Note 10.,2019-08-07 21:53:44
samsung,Samsung: Releases a new phone My sub box:,2019-08-07 21:57:44
samsung,The Main issue with the Note 10,2019-08-07 22:03:03
samsung,Dear Samsung bring back the headphone jack. Please.,2019-08-07 22:03:03
samsung,Pre ordered but not email!,2019-08-07 22:05:35
samsung,What is the Best Samsung Galaxy Note 10 Glass Screen Protector,2019-08-07 22:10:08
samsung,Note 10 Dual sim,2019-08-07 22:12:18
samsung,Samsung DeX on PC,2019-08-07 22:13:20
samsung,Looks like Samsung also ditched the HR/SpO2/Blood Pressure sensor,2019-08-07 22:33:39
samsung,Samsung lease,2019-08-07 22:51:49
samsung,The Note 9 is my favorite Samsung phone of all time and I believe Samsung truly messed up with the Note 10 family.,2019-08-07 23:06:51
samsung,Anybody know if the Note10/Note10+ Pre-Orders will offer a gift like Note9 last year???,2019-08-07 23:21:17
samsung,Is Samsung Flow dead?,2019-08-07 23:35:49
samsung,Help clear up confusion on the new Notes,2019-08-07 23:47:03
samsung,Samsung Event: Everything that was announced,2019-08-07 23:48:52
samsung,Samsung Galaxy Note 10 and Galaxy Note10 Plus Launched,2019-08-07 23:49:17
samsung,Note 10 T-Mobile Compatibility,2019-08-07 23:53:12
samsung,How to set up Samsung Pass for logins,2019-08-08 00:00:13
samsung,Note 10 possibly starting a downfall?,2019-08-08 00:05:52
samsung,My Samsung store has something in store... Taken 6.30am SGT time,2019-08-08 00:07:48
samsung,Couldn't add Upgrade program! And didn't get 24 months 0% apr.,2019-08-08 00:07:51
samsung,"Galaxy Note 10 Battery - are you serious, Samsung?",2019-08-08 00:12:21
samsung,"For those who've already pre-ordered,",2019-08-08 00:22:31
samsung,Samsung Dex,2019-08-08 00:30:25
samsung,All Screen Phone???,2019-08-08 00:33:44
samsung,Note10 preorder items sold out,2019-08-08 01:09:33
samsung,"Congratulations, Samsung.",2019-08-08 01:28:12
