subreddit,title,timestamp
samsung,Join the r/Samsung Discord! Especially now to discuss the upcoming Note 10 Unpacked Event with the server's 1600 members as it happens.,2019-08-07 01:43:48
samsung,"Daily Tech Support / WSIB Thread - August 07, 2019",2019-08-07 01:58:14
samsung,Is it possible to mirror an iPhone to my samsung smart tv for free without a computer?,2019-08-07 03:03:25
samsung,No Double tap to lock feature in Samsung M30?,2019-08-07 03:37:46
samsung,Some tech questions.,2019-08-07 04:00:29
samsung,Procesorul Samsung GALAXY NOTE 10 Anuntat + o Noua Imagine,2019-08-07 05:01:26
samsung,"I've never gotten Samsung pass set up, its always just this :( I've had the S10+ since the month after it came out",2019-08-07 05:07:12
samsung,Samsung Financing Upgrade Question,2019-08-07 05:34:49
samsung,Samsung Galaxy S10+ (Prism Black) Online - Specs &amp; Price at Samsung India,2019-08-07 07:31:28
samsung,Samsung Galaxy S10e - Camera photos disappeared from Gallery app (and phone itself),2019-08-07 08:54:45
samsung,Samsung Galaxy Note10 Price + Specifications Leaked!,2019-08-07 09:33:00
samsung,Samsung Galaxy S10+ (Prism Blue) Online - Specs &amp; Price at Samsung India,2019-08-07 10:19:25
samsung,Is the Samsung Galaxy Fit any good for small wrists?,2019-08-07 10:21:32
samsung,Samsung Customer Support royally screwed me,2019-08-07 11:39:22
samsung,Multipack background wallpapers with own images from gallery?,2019-08-07 11:46:56
samsung,Stop Note 9 from deleting background app cache,2019-08-07 11:53:41
samsung,Captured with Samsung Galaxy A50 live focus,2019-08-07 11:56:12
samsung,Samsung S series vs. Note series. Which one is the flagship?,2019-08-07 12:39:03
samsung,Samsung S series vs Note series. Which is the flagship?,2019-08-07 12:51:32
samsung,Does it matter witch HDMI-port I use for my PS4 Pro?,2019-08-07 13:50:43
samsung,"Apart from the launch of Galaxy Note 10, who else are waiting for the song that samsung chooses for its TV commercial. I have been fan of those fron the S10..",2019-08-07 14:21:41
samsung,Samsung.,2019-08-07 14:35:55
samsung,Samsung 65“ 4K UHD smart-TV UE65RU7105,2019-08-07 14:37:59
samsung,Galaxy Note 10 launch.,2019-08-07 14:39:39
samsung,BUMPER FOR SAMSUNG GALAXY A50,2019-08-07 14:49:42
samsung,Samsung S10e Samsung/Google Pay won't allow card,2019-08-07 15:02:46
samsung,Was going to tell my aunt to get the XS Max from her Note 5 but ... this Note 10 came out of nowhere,2019-08-07 15:22:31
samsung,OpenSignal: Samsung phones often beat the latest iPhones in download speed,2019-08-07 15:41:31
samsung,Samsung Galaxy Tab S6 vs Apple Ipad Pro 2019,2019-08-07 16:35:55
samsung,The Amount Of Phone Models Samsung Has In Their Lineup Is Kind Of Crazy...,2019-08-07 16:38:32
samsung,Snapchat super zoomed in on a70?,2019-08-07 16:45:01
samsung,Samsung Galaxy Note 10 - Top Features,2019-08-07 16:45:50
samsung,"Samsung S10e.... what does the ""e"" stand for? Any guesses?",2019-08-07 17:52:15
samsung,Unlocked Samsung Galaxy S10's getting July security patch,2019-08-07 18:25:15
samsung,Samsung akg headphones,2019-08-07 18:49:53
samsung,Samsung screws us over again!,2019-08-07 18:59:25
samsung,Samsung GALAXY NOTE 10 LIVE VIDEO STREAM de la Lansare,2019-08-07 19:01:33
samsung,Recommended screen protectors for Samsung phones? (Specifically a J3),2019-08-07 19:11:02
samsung,Can you check your exact elevation on a Samsung Galaxy phone?,2019-08-07 19:12:14
samsung,Samsung big bottom,2019-08-07 19:16:31
samsung,Samsung live stream is up,2019-08-07 19:30:24
samsung,Unpacked Bingo happening in the Samsung Discord. Join in,2019-08-07 19:43:00
samsung,4 small hands on details about the note 10 and +,2019-08-07 20:04:06
samsung,Note 10 is live on the samsung website,2019-08-07 20:07:50
samsung,SAMSUNG GALAXY NOTE 10!,2019-08-07 20:11:57
samsung,Samsung announce Galaxy Note 10,2019-08-07 20:16:54
samsung,The galaxy note 10 is a joke,2019-08-07 20:21:35
samsung,Galaxy watch vs other wear os watches,2019-08-07 20:24:44
samsung,"Samsung Note 10 And Note 10+ Unveiled With QHD+, SD855+ Armor, UFS 3.0, And Switchable Apertures",2019-08-07 20:36:05
samsung,Samsung Note 10: Unveiling,2019-08-07 20:44:45
samsung,Quite disappointed in Samsung,2019-08-07 20:49:43
samsung,Rip Headphone Jack,2019-08-07 20:53:11
samsung,Note 10 event,2019-08-07 21:04:15
samsung,Need help finding a case that fits,2019-08-07 21:13:15
samsung,When Samsung announced that the Note 10 will have no headphone jack.,2019-08-07 21:16:08
samsung,Samsung Galaxy Book S: Unveiling,2019-08-07 21:16:35
samsung,The Samsung event really captured the essence of how I like to charge my watch,2019-08-07 21:27:23
samsung,Galaxy Note 10 Rant,2019-08-07 21:28:14
samsung,Note 10 Plus - This is legit,2019-08-07 21:29:04
samsung,questions about Samsung phones/ Note 10,2019-08-07 21:32:46
samsung,Samsung Note 10 Official TVC: Next Level Power,2019-08-07 21:33:58
samsung,Why Samsung KILLED Headphone Jack on Galaxy Note 10,2019-08-07 21:37:41
samsung,"With the Note 10+ more powerful than a lot of laptops, Samsung needs to bring out a DeX+ with dual monitor support",2019-08-07 21:39:30
samsung,How I designed the new S-Pen for the new Galaxy Note 10.,2019-08-07 21:53:44
samsung,Samsung: Releases a new phone My sub box:,2019-08-07 21:57:44
samsung,The Main issue with the Note 10,2019-08-07 22:03:03
samsung,Dear Samsung bring back the headphone jack. Please.,2019-08-07 22:03:03
samsung,Pre ordered but not email!,2019-08-07 22:05:35
samsung,What is the Best Samsung Galaxy Note 10 Glass Screen Protector,2019-08-07 22:10:08
samsung,Note 10 Dual sim,2019-08-07 22:12:18
samsung,Samsung DeX on PC,2019-08-07 22:13:20
samsung,Looks like Samsung also ditched the HR/SpO2/Blood Pressure sensor,2019-08-07 22:33:39
samsung,Samsung lease,2019-08-07 22:51:49
samsung,The Note 9 is my favorite Samsung phone of all time and I believe Samsung truly messed up with the Note 10 family.,2019-08-07 23:06:51
samsung,Anybody know if the Note10/Note10+ Pre-Orders will offer a gift like Note9 last year???,2019-08-07 23:21:17
samsung,Is Samsung Flow dead?,2019-08-07 23:35:49
samsung,Help clear up confusion on the new Notes,2019-08-07 23:47:03
samsung,Samsung Event: Everything that was announced,2019-08-07 23:48:52
samsung,Samsung Galaxy Note 10 and Galaxy Note10 Plus Launched,2019-08-07 23:49:17
samsung,Note 10 T-Mobile Compatibility,2019-08-07 23:53:12
samsung,How to set up Samsung Pass for logins,2019-08-08 00:00:13
samsung,Note 10 possibly starting a downfall?,2019-08-08 00:05:52
samsung,My Samsung store has something in store... Taken 6.30am SGT time,2019-08-08 00:07:48
samsung,Couldn't add Upgrade program! And didn't get 24 months 0% apr.,2019-08-08 00:07:51
samsung,"Galaxy Note 10 Battery - are you serious, Samsung?",2019-08-08 00:12:21
samsung,"For those who've already pre-ordered,",2019-08-08 00:22:31
samsung,Samsung Dex,2019-08-08 00:30:25
samsung,All Screen Phone???,2019-08-08 00:33:44
samsung,Note10 preorder items sold out,2019-08-08 01:09:33
samsung,"Congratulations, Samsung.",2019-08-08 01:28:12
samsung,"Just as S6's lack of SD card support, Samsung seems to fuck it off every 4 years or so.",2019-08-08 01:28:32
samsung,Internal Audio,2019-08-08 01:56:46
samsung,"Daily Tech Support / WSIB Thread - August 08, 2019",2019-08-08 01:57:59
samsung,"US pre-orders: if you reserved, search your emails for Samsung! Your pre order should be open!",2019-08-08 02:35:46
samsung,"Samsung Galaxy S10e, S10 &amp; S10+ Price&amp; Pre-Orders",2019-08-08 03:11:12
samsung,Samsung upgrade program how it works?,2019-08-08 03:41:18
samsung,Samsung Is a Truly Amazing Company,2019-08-08 03:48:45
samsung,Package disabler pro for Samsung devices gone from the play store?,2019-08-08 04:08:25
samsung,Samsung Galaxy M20s Details,2019-08-08 04:10:06
samsung,Samsung health is my favorite feature of theirs. So nice to see my results.,2019-08-08 04:21:09
samsung,"Samsung Galaxy Note 10 Colors - First Look (Aura Glow, Aura Red, Aura Pink, &amp; MORE)",2019-08-08 04:21:32
samsung,I'm swapping to iPhone,2019-08-08 04:25:37
samsung,"Samsung Galaxy Note10 and Galaxy Note10+ Pre-Order Price, Availability",2019-08-08 04:26:32
samsung,Samsung Soundbar no longer turns on with Samsung TV - Ideas?,2019-08-08 04:30:54
samsung,Samsung offering up to $200 credit at Samsung site,2019-08-08 04:34:36
samsung,"Let's face it, Note 10/+ missing the headphone jack means that most flagship consumers adapt rather than vote with their wallets",2019-08-08 04:39:26
samsung,Does anyone else feel like the note 9 was revolutionary and the note 10 is just another phone?,2019-08-08 04:42:39
samsung,The r/Samsung Discord - Single out and enter this world of Samsung Enthusiasts. Approaching two-thousand members.,2019-08-08 04:43:47
samsung,Impresiile Samsung GALAXY NOTE 10/10 Plus in Primele VIDEO,2019-08-08 05:01:17
samsung,Samsung better not repet what they did to the Note 10 to the s11,2019-08-08 05:25:40
samsung,"Samsung Galaxy Tab A SM-T290 8"" 2019 Overview - My Tablet Guide",2019-08-08 05:30:31
samsung,Payment method,2019-08-08 05:54:29
samsung,"Note 10 preorder error, free Galaxy watch",2019-08-08 06:04:03
samsung,Samsung Galaxy Note 10+ Lanuched with 5G Support But No Headphone Jack,2019-08-08 06:18:15
samsung,What Samsung should have done with the note series.,2019-08-08 06:22:38
samsung,In the Microsoft Store? Why? What kind of agreement does Samsung have with Microsoft now? is it the end of Samsung?!,2019-08-08 06:38:11
samsung,Samsung out there desteoying peoples life - translation in comments,2019-08-08 06:43:27
samsung,"Okay Samsung, you made all great innovations. But... WHO IS GOING TO PUT THE PHONE SCREEN ON THE CEMENT WITHOUT COVERS TO CHARGE THE BUDS????",2019-08-08 06:49:29
samsung,MST Chip on Note 10,2019-08-08 07:17:22
samsung,New Samsung S11 leaked three phase Hyper fast charge,2019-08-08 07:51:05
samsung,An open letter to Samsung.,2019-08-08 08:55:59
samsung,So no preorder bonus for europeans ?,2019-08-08 09:12:55
samsung,A question for all you 1080p bashers,2019-08-08 09:49:37
samsung,Note 10 and the first look at Samsung Galaxy Note 10 +: modest overhauls come at a high price,2019-08-08 09:54:21
samsung,Samsung removed the Bixby button in Galaxy Note 10 &amp; Note 10+,2019-08-08 10:40:19
samsung,Brampton man allegedly burned by Samsung phone.,2019-08-08 11:32:33
samsung,How do I completely transfer my files from my broken Samsung G5-31H to my computer?,2019-08-08 11:34:01
samsung,Note 10 vs. S10,2019-08-08 12:09:11
samsung,Samsung's naming choice was bad imo,2019-08-08 12:20:11
samsung,"Import other Notes into ""Samsung Notes""",2019-08-08 12:21:48
samsung,Note10+ Out of stock,2019-08-08 12:37:26
samsung,Download Samsung Galaxy Note 10 Stock Wallpapers,2019-08-08 12:38:40
samsung,Samsung Note 10 - DREAM! Buy - Xiaomi) https://bit.ly/2ZT3QP2,2019-08-08 12:40:44
samsung,Samsung galaxy note 10,2019-08-08 12:43:48
samsung,PENIBIL! Samsung STERGE Reclamele in care a RAS de iPhone,2019-08-08 12:51:19
samsung,"Thank you Samsung Turkey. 11399 Turkish Lira is €1900 or $2100 and that's just the LTE version. We don't have a 512 GB or 5G option here. Also they are just giving €125 Under Armour coupon and Buds as pre order gift. For comparison, minimum wage here in Turkey is €422.",2019-08-08 12:53:52
samsung,Did Samsung totally forget about the Heart Rate and Blood Pressure sensor on all Note 10 models?,2019-08-08 12:57:12
samsung,Samsung Note 8 Back Glass,2019-08-08 13:18:46
samsung,Galaxy J260t1 Themes?,2019-08-08 13:20:10
samsung,Samsung trade-in for galaxy note 10,2019-08-08 13:29:57
samsung,Anybody else really enjoy the vertical camera aesthetic?,2019-08-08 13:45:11
samsung,Quick question about Samsung Finance,2019-08-08 13:58:39
samsung,Latest Samsung news,2019-08-08 14:22:07
samsung,How long does Samsung take to refund a cancelled preorder?,2019-08-08 14:27:40
samsung,Samsung is deleting Apple trolling videos,2019-08-08 14:45:02
samsung,Has anyone realized that the resolution quality of Samsung phones has gone down after the last update despite being WQHD+?,2019-08-08 15:27:31
samsung,Samsung please don't take out the headphone jack...,2019-08-08 15:44:50
samsung,New DeX features will come to older Samsung Flagships according to leak,2019-08-08 15:52:03
samsung,"Galaxy Note 10 with Samsung DeX for PC, Link to Windows, and PlayGalaxy Link",2019-08-08 16:15:51
samsung,Is the bundled charger in note 9 a USB 2.0 OR 3.0?,2019-08-08 16:27:59
samsung,Tech help with samsung soundbar HW-M550,2019-08-08 16:40:15
samsung,It is ridiculous that Samsung doesn't have a Guest or Private mode anymore.,2019-08-08 16:52:08
samsung,Samsung Galxy s10+ issues,2019-08-08 17:06:57
samsung,Using $150 Samsung Pre-order credit on Galaxy Buds?,2019-08-08 17:45:03
samsung,Can I trade-in with samsung with my refurbished phone?,2019-08-08 18:14:32
samsung,"Samsung Takes Down Its Ads That Mocked Apple for Removing the Headphone Jack After Note 10, Note 10 Plus Launch",2019-08-08 18:18:18
samsung,Samsung users when the Apple got rid of the headphone jack vs them now,2019-08-08 18:24:34
samsung,loyal fans holding back will have to upgrade eventually. Samsung will make more profit from wireless accessories in the long run.,2019-08-08 18:25:45
samsung,Unpopular opinion: people are overreacting about the headphone jack,2019-08-08 18:47:16
samsung,Would you think differently of the Note10e if it had a flat screen?,2019-08-08 18:51:15
samsung,Samsung Galaxy Note 10 launch: big screens and stylus air gestures,2019-08-08 19:00:08
samsung,"Oh well, what have you done samsung..",2019-08-08 19:09:02
samsung,Is it worth upgrading samsung S8 to S10?,2019-08-08 19:21:16
samsung,Why the removal of the headphone jack in the Note line is a disservice to its intended audience.,2019-08-08 19:28:12
samsung,Note 10 vs other screens PPI,2019-08-08 20:34:48
samsung,Samsung galaxy tab A questions?,2019-08-08 20:36:22
samsung,My phone has screen burn. Anyways to help it? (Samsung Galaxy s8),2019-08-08 20:46:01
samsung,Samsung is becoming Apple..,2019-08-08 21:02:43
samsung,Does the Note 10+ have Samsung Pay? And does it support the Dex Station and Pad?,2019-08-08 21:38:26
samsung,About the note 10,2019-08-08 21:38:30
samsung,Will the S11 have a Headphone Jack and MicroSD Card Slot?,2019-08-08 21:57:50
samsung,Samsung Note 10 (2019) (1200$) vs Samsung Note Edge (2014) (Launch 947$ Now ~100$) Thoughts?,2019-08-08 22:01:53
samsung,"Samsung Internet Browser vs Google Chrome, and why?",2019-08-08 22:09:05
samsung,Samsung Internet Browser vs Google Chrome,2019-08-08 22:10:02
samsung,Buttons on note 10,2019-08-08 22:23:57
samsung,How do I disable Samsung Internet?,2019-08-08 22:33:13
samsung,&gt;Samsung Note 10 (2019) (1200$) vs Samsung Note Edge (2014) (Launch 947$ Now ~100) Thoughts?,2019-08-08 22:36:43
samsung,Wallpaper Samsung galaxy note 10,2019-08-08 22:47:55
samsung,Is Samsung TV Plus free?,2019-08-08 22:51:48
samsung,Couldn’t opt in to Samsung Upgrade,2019-08-08 23:00:07
samsung,How has One UI Changed samsung compared to iOS?,2019-08-08 23:31:34
samsung,Samsung TV HDMI 2/AnyNet+ Problem,2019-08-08 23:52:26
samsung,When someone finds out the Samsung note 10 is worse and uglier than the s10,2019-08-08 23:56:05
samsung,Join the r/Samsung Discord Server!,2019-08-09 01:22:49
samsung,"Official Samsung Cases for Galaxy Note 10 (LED, Rugged, Leather, &amp; More)",2019-08-09 01:23:55
samsung,Samsung is making too many phones,2019-08-09 01:47:24
samsung,IPhone calendar sync to Samsung Home Hub calendar?,2019-08-09 01:51:13
samsung,"Daily Tech Support / WSIB Thread - August 09, 2019",2019-08-09 01:58:04
samsung,How can I buy a new Samsung Galaxy s10 but specify the snapdragon 855 version not the Exynos version,2019-08-09 02:03:24
samsung,Going to buy Samsung Galaxy note 10？ Pick up your screen protector and case here,2019-08-09 02:13:33
samsung,What do you the the Samsung S10e will cost in a year from now/black Friday.,2019-08-09 04:31:48
samsung,Can i trade in Pixel for Samsung Note 10+?,2019-08-09 04:32:50
samsung,Samsung GALAXY NOTE 10 Plus vs S10 Plus – Compartia Gigantilor (VIDEO),2019-08-09 05:05:30
samsung,Bixby is just malware,2019-08-09 05:09:38
samsung,"There's this tiny black shadow smudge in the bottom right of my Samsung 1080p LED HDTV. Can I remove it somehow? It's really distracting, I also have no warrenty. Help?",2019-08-09 05:09:53
samsung,"I am surprised at all the hate the note 10+ is getting. I think they did a great job, and I cannot wait to get mine.",2019-08-09 06:31:08
samsung,"Samsung removes headphone jack, takes down commercials mocking Apple for removing headphone jack [Louis Rossmann]",2019-08-09 06:31:53
samsung,Samsung ads mocking iPhones quietly deleted as it follows Apple’s example,2019-08-09 09:35:01
samsung,Does the Note 10 have MST (Samsung Pay)?,2019-08-09 09:42:57
samsung,Does the Note 10 have MST (Samsung Pay)?,2019-08-09 09:44:18
samsung,Top-tier marketing Samsung,2019-08-09 10:11:55
samsung,No preorder incentive for Note 10 in UK.,2019-08-09 10:13:45
samsung,Anyone know where I can get wholesale B2B Samsung phones in Europe for a decent price?,2019-08-09 10:20:31
samsung,Samsung Galaxy Note 10 Unveiled at the Unpacked Event 2019,2019-08-09 10:33:12
samsung,Vestea GROZAVA despre Samsung GALAXY S11 ce a UIMIT Fanii,2019-08-09 11:02:22
samsung,Samsung Galaxy Note Conference,2019-08-09 11:54:15
samsung,Best Selfless Award goes to Samsung,2019-08-09 12:25:11
samsung,How can I buy a new Samsung Galaxy s10 but specify the snapdragon 855 version not the Exynos version,2019-08-09 13:16:31
samsung,Compare Best Price Samsung Galaxy A50,2019-08-09 13:25:49
samsung,Where is the best place to buy a Note 9?,2019-08-09 13:32:24
samsung,How Can I get The snapdragon samsung s10 instead of the exynos version,2019-08-09 13:34:53
samsung,"Why does the Note 10+ say 5G beside on the Samsung US site it because I thought that the Note 10+ 5G was a higher end model being sold for $1300 USD rather, while the Note 10+ was being sold for $1100 USD. Is this a mistake or is the Note 10+ capable of 5G.",2019-08-09 13:58:44
samsung,Samsung Knox - Android P,2019-08-09 14:07:52
samsung,samsung pls fix ur unsubscribe email feature,2019-08-09 14:14:05
samsung,[POLL]As of now Will you consider another Company than Samsung for your next Smartphone?,2019-08-09 14:22:08
samsung,"Rant all you want about Note 10/+, but nothing would change unless everyone is boycotting the series, though I don't see that happening.",2019-08-09 14:25:16
samsung,Discussion: Upgrade from Note 8 to Note 10+ opinions,2019-08-09 14:39:04
samsung,Help! I have a Samsung J3 2018. And it doesn't seem to want to download MMS attachments via the Messanger app.,2019-08-09 15:07:24
samsung,Samsung has removed some of its old ads that mocked Apple,2019-08-09 15:36:37
samsung,"Photo confirms massive 6,000 mAh battery coming to Samsung phones",2019-08-09 15:37:23
samsung,Tapa Batería para Samsung Galaxy J7 2017 J730F Trasera NegroCristal de la,2019-07-31 16:03:29
samsung,Samsung Galaxy Xcover 3 (SM-G389F) Smartphone Unlocked,2019-07-31 16:15:00
samsung,Samsung Galaxy Tab S6 Launched with New S Pen and UD fingerprint,2019-07-31 16:16:51
samsung,Ersatz TV Fernbedienung für Samsung HG28NB677BFXZA Fernseher,2019-07-31 17:03:49
samsung,Samsung Galaxy Note Edge scalendar to PC backup,2019-07-31 17:15:17
samsung,Ersatz TV Fernbedienung für Samsung LH46OLBPPGC Fernseher,2019-07-31 17:18:28
samsung,Funda Cover IN Silicone Fashion Híbrido para Samsung Galaxy S7 Edge S8 S9 Plus,2019-07-31 17:28:39
samsung,Samsung GT-C3350 - Steel Grey mobile phone,2019-07-31 17:38:36
samsung,Samsung Galaxy S6 Edge SM-G928F - 32 GB- Negro zafiro. Libre.,2019-07-31 17:48:35
samsung,"Taken with Samsung Galaxy S10; Space Needle, Seattle WA. Wide angle, photo optimizer in night mode.",2019-07-31 18:00:24
samsung,Samsung 4GB 2Rx8 PC3 10600R Memory Module - M393B5273CH0-CH9-Refurbished,2019-07-31 18:08:51
samsung,Samsung Galaxy A50 USA Release Question,2019-07-31 18:21:37
samsung,SAMSUNG PS-WTZ315 HOME CINEMA THEATRE SURROUND SOUND SUBWOOFER 3OHM,2019-07-31 18:27:50
samsung,Samsung Pay Touch app turns your Galaxy smartphone into a PoS terminal,2019-07-31 18:40:10
samsung,Samsung T5 500 GB Cable.,2019-07-31 18:41:22
samsung,Samsung Galaxy Tab S6 hands-on impressions,2019-07-31 18:41:59
samsung,Samsung 2GB 2RX8 PC3 10600R Memory Module - HMT125R7TFR8C-H9-Refurbished,2019-07-31 18:52:06
samsung,Auriculares inalámbricos Bluetooth V4.2 impermeables para iPhone Samsung Android,2019-07-31 19:02:41
samsung,Pink Days | REPRODUCTOR BLU RAY SAMSUNG BD-J4500R 4956496,2019-07-31 19:12:38
samsung,Samsung Upgrade Program Note 9 To Note 10,2019-07-31 19:22:57
samsung,Samsung Galaxy A5 2017 SM-A520F 32GB Blue Mist Unlocked Smartphone,2019-07-31 19:42:18
samsung,Samsung Pay Touch app turns your Galaxy smartphone into a PoS terminal.......means point of sale not piece of shit.,2019-07-31 19:57:05
samsung,7611-Smartphone Samsung Galaxy A5 2016,2019-07-31 19:57:34
samsung,Flex Dock Carga Datos Micro USB Microfono para Samsung Galaxy Note 3 N9000 N9005,2019-07-31 20:12:35
samsung,Samsung M393B1K70CH0-CH9 8 GB PC3-10600 ECC SERVER RAM 1333Mhz DDR3 SDRAM,2019-07-31 20:22:33
samsung,"SAMSUNG UE32D5520 37"" 40"" 46"" Mainboard -REPAIR SERVICE ONLY- Please read first",2019-07-31 20:32:36
samsung,Cable Flex Conector de CargaMicro para Samsung Galaxy S2 I9100 I9100P,2019-07-31 20:47:36
samsung,Just wtf Samsung,2019-07-31 20:47:54
samsung,Gold Bluetooth Wireless Earphones Earbud Headphones USB Charge iPhone Samsung UK,2019-07-31 21:12:11
samsung,OtterBox Defender Belt Case Cover For iPhone 7/8 10 X/XS XS MAX Samsung s8 s9,2019-07-31 21:37:16
samsung,Samsung Note 10 here are all their colors at release new Colour leaks,2019-07-31 21:47:28
samsung,Night Mode Camera?,2019-07-31 21:49:24
samsung,AURICOLARI CUFFIE BLUETOOTH 5.0 WIRELESS UNIVERSALE SMARTPHONE HUAWEI SAMSUNG,2019-07-31 21:57:42
samsung,SAMSUNG HD TVkey für Satellit TV Key 6 Monate HDPlus gratis NEU und OVP,2019-07-31 22:17:56
samsung,Samsung Galaxy S7 edge - 32GB - BLACK (O2) POOR CONDITION WORKS 372,2019-07-31 22:37:32
samsung,"Samsung S5e 10.5"" Android 9.0 Plata 6GB Tableta Micro-Sd Y",2019-07-31 22:47:38
samsung,My mon wants me to get a $150-$200 iPhone specifically BECAUSE it can do less than the $60 Samsung phone I have right now (namely emulation).,2019-07-31 22:48:04
samsung,Samsung Galaxy S7 edge SM-G935F - 32GB - Black (Unlocked) POOR CONDITION 374,2019-07-31 23:07:18
samsung,Samsung Galaxy S7 edge SM-G935F - 32GB - Rose Gold (Unlocked) POOR CONDITION 375,2019-07-31 23:17:39
samsung,Samsung Galaxy A20 review,2019-07-31 23:20:40
samsung,Piezas de Repuesto Cámara Parte Trasera Flexible Atrás para Samsung Galaxy S8,2019-07-31 23:37:13
samsung,DA47-00301B Samsung Refrigerator Thermal Fuse assy,2019-07-31 23:57:16
samsung,Samsung S7 Edge - 32GB - Black (Unlocked) AVERAGE CONDITION GRADE C 380,2019-08-01 00:12:30
samsung,Mobilize Shatterproof Case Teléfono Samsung Galaxy J6 2018 Negro NE550687416,2019-08-01 00:22:27
samsung,BN96-16796A SAMSUNG UE40D61005KXXU SPEAKERS,2019-08-01 00:42:17
samsung,Samsung Galaxy S10 Color Negro (Prism Black) Banda LTE / WiFi Dual Sim 128 G,2019-08-01 00:57:37
samsung,Micro-SD Evo Plus Memory Card for Samsung S7 S7 S8 S8 S9 S9 Plus Mobile -,2019-08-01 01:27:29
samsung,Carcasa Integral Rígido antes Trasero Samsung Galaxy S6 Edge - Transparente,2019-08-01 01:37:39
samsung,T-Con Tcon TV Samsung UE50HU6900SXXN 30947B 673X6 11NT350 50inch,2019-08-01 01:52:29
samsung,"Daily Tech Support / WSIB Thread - August 01, 2019",2019-08-01 01:58:11
samsung,Arae Samsung S8 Phone CaseSamsung Galaxy S8 Case With Card Slots And WalletRos,2019-08-01 02:12:31
samsung,Sennheiser Cx 5.00G Auriculares In-Ear para Samsung Galaxy Blanco,2019-08-01 02:37:38
samsung,NEW! Samsung ET-FG950CTEGWW S8 Screen Predector Transparen,2019-08-01 02:52:08
samsung,Lüfter Kühler FAN version 2 für Samsung NP550P5C-S03DE NP550P7C-S0BDE,2019-08-01 03:12:18
samsung,Tira de led smart TV samsung modelo: UE42F5300AWX Cables Conexión TFT LCD Plas,2019-08-01 03:27:49
samsung,Does the S10 have a universal search function?,2019-08-01 03:30:07
samsung,Bateria Para Samsung S10 Plus G9750 4100 mAh,2019-08-01 03:52:14
samsung,Samsung GT-S3650 Falmouth Tapa Batería más Colores Negro Fucsia Fucsia Estampado,2019-08-01 04:07:45
samsung,PolarCell Akku für Samsung Corby 2 II GT-S3850 Star 3 III GT-S5220 Batterie Accu,2019-08-01 04:22:17
samsung,Pantalla Táctil Samsung Galaxy Tab 2 P3110 Negro - IR-Shop,2019-08-01 04:32:35
samsung,Para Samsung Galaxy J3 2017 J330 J330F J330FN Pantalla táctil digitalizador LCD,2019-08-01 04:42:32
samsung,Pantalla Original Display Lcd Tactil Para Samsung A70 A705 Negro GH82-19747A,2019-08-01 04:52:33
samsung,Design Book Handy Tasche SVH-Fantasy Hülle Cover Case für Samsung Galaxy J1 2016,2019-08-01 05:02:56
samsung,"Problemele Samsung GALAXY S10 CRESC, iata Cat de GRAVE Sunt",2019-08-01 05:05:13
samsung,Ersatz TV Fernbedienung für Samsung QM65H Fernseher,2019-08-01 05:22:26
samsung,Samsung - Original MLT-D204S Toner schwarz 3.000 Seiten (MLT-D204S/ELS) fÃ NEU,2019-08-01 05:42:37
samsung,Samsung Galaxy Note 10 pre-register open at Best Buy,2019-08-01 05:55:18
samsung,Pantalla Original Completa Samsung Galaxy S8 G950F Plata GH97-20457B,2019-08-01 06:02:15
samsung,Kit 27 für Samsung PL 420 S Plattenspieler Record Player,2019-08-01 06:12:23
samsung,"Samsung Galaxy Tab 3 P5210 10.1"" WiFi Black",2019-08-01 06:22:23
samsung,"Samsung galaxy A50 fingerprint sensor always showing ""Make sure to cover the entire display "" while registering.",2019-08-01 06:23:31
samsung,BN94-02519A MAIN PCB FOR SAMSUNG LE32B530P7WXXU,2019-08-01 06:32:47
samsung,Slim Solar 2xUSB Power Bank Charger 300000mAh For Samsung iPhones Tablet UK,2019-08-01 06:52:39
samsung,Samsung - MLT-D111S - Schwarz - Original - Tonerpatrone - für ProXpress M40 NEU,2019-08-01 07:12:07
