subreddit,title,timestamp
samsung,ONE UI icons,2018-11-11 00:40:22
samsung,Samsung Gear S3 Frontier vs Samsung Galaxy Smartwatch This Black Friday?,2018-11-11 03:10:03
samsung,Galaxy S9+ can't take RAW long-exposures.,2018-11-11 04:06:21
samsung,Dark mode any samsung,2018-11-11 04:15:21
samsung,Just got my S9+. I love it but the wall adapter is beeping when its plugged into the Samsung wireless charging dock. Its driving me nuts,2018-11-11 04:23:53
samsung,Samsung running IOS could save apple and smartphone market,2018-11-11 05:12:45
samsung,Yet Another “Making the Switch” Post: I have questions,2018-11-11 06:49:31
samsung,How do I make playlists on my computer then transfer them to the Samsung Music app?,2018-11-11 07:49:32
samsung,I need opinion on Samsung TV,2018-11-11 08:47:00
samsung,oneplus 6t or note 9 for 50-100 bucks more ?,2018-11-11 11:37:55
samsung,Samsung Keyboard prediction not working. Please help (Details in comments),2018-11-11 13:35:41
samsung,"Just purchased a new Samsung q6f. Using the universal remote to control my cable box and Apple TV 4K. Does anybody have a list of buttons/actions for Apple TV? Also, I’m able to control my cable box(Cin Bell Fioptics), but can’t figure out how to turn the box on and off. Any ideas?",2018-11-11 13:47:53
samsung,Samsung pay fingerprint and pin not working so I cant pay for anything. How do I fix this?,2018-11-11 15:59:23
samsung,Is it a good choice to buy a Samsung tablet? Will my purchased games from iPhone be transferred to Samsung? Thanks!,2018-11-11 16:03:27
samsung,After taking a short 6 week break and using an iPhone XS Max I’m switching back to the Note9 + Galaxy Watch (smaller) today.,2018-11-11 16:21:32
samsung,Touchscreen Issue,2018-11-11 16:58:05
samsung,3 (+1) questions for Galaxy A8 2018 owners here.,2018-11-11 17:22:56
samsung,Samsung Q7 trouble updating app,2018-11-11 17:54:14
samsung,"Samsung to release the Foldable phone in the first half of 2019, will make over one million units",2018-11-11 18:05:09
samsung,Is There Something Wrong With Samsung Batteries?,2018-11-11 18:08:53
samsung,S9 bundles?,2018-11-11 18:26:04
samsung,multiple images on lock screen,2018-11-11 18:48:32
samsung,Samsung galaxy J3 keeps reseting only when I play games,2018-11-11 20:37:15
samsung,Does anyone know of a good privacy case with camera sliders?,2018-11-11 23:19:46
samsung,"I added some events to my samsung calendar and I found out that you could add cool stickers. So I did. But when I tried to add an event for the next month, i couldn't. The ""sticker"" symbol was just gone. I really want to add sticker to my events...",2018-11-12 01:03:33
samsung,Free application for screen mirroring from Samsung Galaxy S5 to a Fuego Smart TV (without cables or any hardware)?,2018-11-12 02:49:33
samsung,Android System is killing my battery; can I fix this?,2018-11-12 03:06:15
samsung,Anybody know how to get samsung one UI on s9 + beta version in Canada?,2018-11-12 03:33:18
samsung,Anybody know how to get samsung one UI on s9 + beta version in Canada?,2018-11-12 03:43:16
samsung,Samsung Micro Sd Card Not Functioning,2018-11-12 03:59:42
samsung,"New Smartwatch for 2018 holidays, looking to shop Samsung!",2018-11-12 04:52:26
samsung,Samsung HW-K850 Soundbar issues.,2018-11-12 05:19:11
samsung,Samsung GALAXY X - Decizia RADICALA Anuntata de catre Presedintele Companiei,2018-11-12 07:30:52
samsung,"Samsung W2019 Android Flip Phone With Dual Super AMOLED Displays, Side-Mounted Fingerprint Sensor Launched: Specifications, Features - TechMasair",2018-11-12 08:02:16
samsung,"Samsung to launch its first Foldable Phone in March, may cost around $1,770",2018-11-12 09:29:47
samsung,HOUSSES SAMSUNG GALAXY A8 2018,2018-11-12 11:18:01
samsung,"SAMSUNG W2019 Android Flip Phone With Dual Super AMOLED Displays, Specifications, Features - TechMasair",2018-11-12 11:25:07
samsung,S8 Bluetooth headphones notification disappeared,2018-11-12 11:33:40
samsung,Iata ce Veste PROASTA privind Samsung GALAXY S10 a fost Anuntata Astazi,2018-11-12 12:56:12
samsung,Samsung will surprise Apple with this News,2018-11-12 13:15:57
samsung,"Samsung.com login lands on ""page not available"" when I use MacOS",2018-11-12 13:53:25
samsung,Samsung Launched W2019 With Dual Screen,2018-11-12 14:00:58
samsung,Cloudy morning. Dew. Recording with Samsung J5 2017 (Full HD 1920 x 1080 30fps),2018-11-12 14:17:52
samsung,"Samsung GALAXY F. PRETUL si DATA de LANSARE, au fost Dezvaluite in mod OFICIAL",2018-11-12 14:19:08
samsung,Top 10 Samsung Best Smartphones in 2018-19 | You Should Buy !,2018-11-12 14:47:02
samsung,Samsung S3 restarting,2018-11-12 15:37:15
samsung,"Samsung Infinity Flex Display is only a snippet of what the future holds. But if you missed it, here’s what went down at #SDC18 in San Francisco. Samsung Mobile Learn more: http://smsng.co/oneUI_y",2018-11-12 15:41:20
samsung,Samsung Foldable Smartphone Launched in March 2019,2018-11-12 15:50:42
samsung,samsung+ 11.2.1 and tab s3 (sm-t820),2018-11-12 16:07:49
samsung,Samsung USB Driver Download for Mobile Phones,2018-11-12 17:39:24
samsung,How can i get my phone agenda back?,2018-11-12 18:33:42
samsung,Samsung S10 - Dual sim,2018-11-12 19:44:44
samsung,Samsung Music Is Impossible!!,2018-11-12 20:47:27
samsung,Samsung Foldable Galaxy Phone is the most expensive phone ever!,2018-11-12 20:54:41
samsung,Samsung cloud - pictures blurry and can't download,2018-11-13 00:56:05
samsung,I’m upgrading my iPhone 8 in about 1 week.,2018-11-13 01:50:40
samsung,Why do Galaxy phones have crappy front camera quality?,2018-11-13 04:38:53
samsung,"Every day for the past week, my smart TV has been disconnecting from the wifi. Is there a solution for this?",2018-11-13 05:40:51
samsung,"Samsung GALAXY X. OFICIAL, Design-ul REAL a fost ASCUNS, cum ar ARATA in Realitate (VIDEO)",2018-11-13 06:02:37
samsung,Cable Chargeur pour Samsung Galaxy A8 2018,2018-11-13 06:22:56
samsung,My Samsung Gear S3 is acting up,2018-11-13 06:59:37
samsung,"My mother bought this Samsung Galaxy SII not long after my 11th birthday. After early seven years later, and I am currently almost eighteen, this phone still charges up to 100 per cent with the original battery.",2018-11-13 07:05:20
samsung,Samsung GALAXY S10 - Schimbare IMPORTANTA pentru a Implementa o Baterie URIASA,2018-11-13 07:27:20
samsung,"This Samsung Galaxy S2 was bought by my mother not long after my eleventh birthday nearly seven years ago. Now, the phone still charges up to 100% with the original battery.",2018-11-13 07:35:51
samsung,Samsung TV's line up + r/bullshitadvertising,2018-11-13 08:10:07
samsung,samsung is claiming to deliver 1 million foldable phones in 2019,2018-11-13 10:03:47
samsung,"Samsung Galaxy J4+ review: Feature heavy, but camera, display found lacking",2018-11-13 11:48:12
samsung,Samsung Qi Certified Fast Charge Wireless Charging Convertible Stand/Pad is 40% off,2018-11-13 11:53:13
samsung,"Samsung GALAXY S10 are Primele SPECIFICATII Dezvaluite in Exclusivitate, iata care sunt!",2018-11-13 12:31:36
samsung,Samsung’s One UI Beta Program: Android Pie for Samsung Devices,2018-11-13 12:32:03
samsung,Samsung Gives First Glimpse of Foldable Phone,2018-11-13 13:08:11
samsung,Samsung Portable SSD T5 Software vs. Mac OS Time Machine,2018-11-13 13:14:05
samsung,Not sure if I bought a fake.,2018-11-13 14:40:08
samsung,Samsung Launched Dual Screen Smartphone W2019 with amazing Features,2018-11-13 14:43:36
samsung,how to buy the new samsung with a loan,2018-11-13 16:22:29
samsung,What is the most battery efficient way to connect my S9+ to my Gear S2?,2018-11-13 16:38:51
samsung,"Samsung Galaxy S10 will have Infinity-O display, ultrasonic fingerprint scanner.",2018-11-13 17:08:13
samsung,How long do you think before Samsung can become independent of companies like Google?,2018-11-13 17:32:32
samsung,Samsung introduces Galaxy S9 and Galaxy S9 Ice Blue Gradient color variant smartphone,2018-11-13 17:52:53
samsung,Samsung galaxy s8 plus keeps trying to backup with samsung cloud.,2018-11-13 18:05:21
samsung,"Is it possible to join the Samsung Beta Testing Programme outside of U.S., Germany, Korea, China, France, India, Poland, Spain, and the U.K.",2018-11-13 18:11:20
samsung,Lockscreen randomly changed,2018-11-13 18:52:03
samsung,Samsung GALAXY X - Secretul URIAS care a fost ASCUNS in Timpul Prezentarii Oficiale,2018-11-13 19:02:54
samsung,November update question,2018-11-13 19:44:47
samsung,Fast charging,2018-11-13 19:55:14
samsung,Curious about Galaxy/Android security,2018-11-13 20:16:48
samsung,Increase internal storage on J7 and A6 possible?,2018-11-13 20:50:09
samsung,Samsung Notebook 9,2018-11-13 22:22:05
samsung,DXOMark reviews the Google Samsung Galaxy Note 9,2018-11-13 22:46:44
samsung,Sorry to be the bearer of bad news - S10 Infinity O screen and no headphone jack,2018-11-13 23:30:56
samsung,How can I update my Samsung Keyboard app on my Galaxy S8.,2018-11-14 01:01:57
samsung,The Samsung Galaxy S7 is nearly three years old and still can take amazing photographs.,2018-11-14 02:02:23
samsung,finally left Apple and went Samsung 👌,2018-11-14 02:04:36
samsung,[HELP] how do I enable wireless charging on my Samsung Galaxy S8 active?,2018-11-14 02:08:24
samsung,[Other] Fuck Facebook mobile,2018-11-14 02:18:05
samsung,Samsung Galaxy A9,2018-11-14 02:29:48
samsung,Can someone explain to me why Samsung keep making their customer service lie to us ?,2018-11-14 02:34:44
samsung,Samsung W2019 Vs Samsung Galaxy Note 9 Specifications Comparisons,2018-11-14 03:32:30
samsung,Samsung Galaxy Note FE Replacement Battery in VIET NAM,2018-11-14 04:30:55
samsung,The new Samsung Exynos 9820 comes with support for 8K@30fps and 4K@150fps!!!!,2018-11-14 04:31:47
samsung,Samsung GALAXY S9 - SURPRIZA ASCUNSA in Android 9 pe care o vei DORI in iPhone,2018-11-14 06:04:39
samsung,Samsung customer support - bit of a scam?,2018-11-14 09:08:58
samsung,Samsung - Acesta este Produsul NEASTEPTAT Dezvaluit OFICIAL de catre Companie,2018-11-14 13:00:49
samsung,Unlocked S9+ support ATT wifi calling?,2018-11-14 13:18:09
samsung,Samsung S8 - Can't place phone calls on new Android Update 8.0.0,2018-11-14 13:59:46
samsung,Is the Samsung Q6F worth it?,2018-11-14 14:24:13
samsung,"Samsung contact's picture disappeared, does it mean they blocked me?",2018-11-14 15:40:14
samsung,Getting a new Samsung today...,2018-11-14 15:45:22
samsung,charging station for samsung?,2018-11-14 16:09:55
samsung,Xiaomi Mi Band 3 compatibility with samsung,2018-11-14 16:51:52
samsung,Got my Note 8's screen replaced under warranty for screen burn in 👍,2018-11-14 17:27:14
samsung,CAND se LANSEAZA Samsung GALAXY S10 a fost Dezvaluit OFICIAL chiar de catre Companie,2018-11-14 18:02:05
samsung,Samsung Exynos 9820: Five reasons Galaxy S10 just won,2018-11-14 18:27:04
samsung,Refund time for carrier financing (verizon),2018-11-14 20:03:56
samsung,Note 9 or pixel 3 xl?,2018-11-14 21:58:13
samsung,What are the best Samsung tablets and why?,2018-11-14 22:44:10
samsung,"2 Samsungs: Can't answer incoming calls. Phone rings, but call answer screen doesn't open.",2018-11-14 23:04:17
samsung,Good Samsung tablets for drawing?,2018-11-14 23:30:22
samsung,How do I download stock firmware for my Note 3?,2018-11-14 23:41:33
samsung,Wireless charger for S7 Edge,2018-11-14 23:56:37
samsung,Got my Note 8's screen replaced under warranty for screen burn in 👍,2018-11-15 00:14:25
samsung,Is Samsung's customer service division that bad??,2018-11-15 03:44:46
samsung,"Any knowledge about this? I know what a bootloader is as an avid Linux user, but am unsure what the best course of action would be. Samsung S7 Edge, international unlocked (GSM).",2018-11-15 03:53:08
samsung,"I have no Smartphone of any sort, can i still use a Samsung smart watch?",2018-11-15 04:05:32
samsung,My Samsung Galaxy S7 Edge has been making loud siren-like noise,2018-11-15 04:54:19
samsung,Samsung to Come Up with Dual Foldable Display Design,2018-11-15 04:59:05
samsung,Samsung Offering HBO GO As A Gift In Its Smart TVs.,2018-11-15 08:22:34
samsung,Is this an original Samsung battery? (gs7),2018-11-15 09:38:48
samsung,Samsung GALAXY S10 are Confirmate OFICIAL Doua NOI Functii EXCLUSIVE pentru Clienti,2018-11-15 10:00:59
samsung,"Samsung Galaxy A9, world's first four-camera phone, said to launch on November 20 in India: Expected price, specifications",2018-11-15 11:01:36
samsung,Samsung Folder 2 Android Version,2018-11-15 11:08:00
samsung,I'm really torn about the hole everyone says is gonna be on the S10...,2018-11-15 12:26:31
samsung,Are the Samsung Icon X worth their price? If not what alternatives do you know of? Not looking to spend a great deal just want some decent wireless earphones without breaking the bank.,2018-11-15 12:35:20
samsung,Android 9 si Vestea URIASA pentru Telefoanele Samsung GALAXY S9 Anuntata Astazi,2018-11-15 12:36:33
samsung,A Samsung phone user that barely uses Samsung software ... These are the only Samsung apps and services that i use on my GALAXY S9 plus,2018-11-15 12:56:28
samsung,VESA plate for my Samsung monitor,2018-11-15 13:18:19
samsung,Samsung galaxy s10 confirmed and a8 range update,2018-11-15 13:46:53
samsung,My phone is not switching on,2018-11-15 14:22:27
samsung,"Samsung GALAXY X - UIMITOR, va fi mai TARE decat iPhone XS si ORICE Telefon Android",2018-11-15 14:32:21
samsung,Early Black Friday Samsung 65NU8000 Flat 65” 4K UHD 8 Series Smart TV 2018 now 23% off,2018-11-15 15:01:11
samsung,My Google Inspired Galaxy S9 Plus Android Experience,2018-11-15 15:02:05
samsung,I am sold on 10 bit | Finally a phone worth spending $1000 | Looks like Samsung is going all out on the S10,2018-11-15 15:22:58
samsung,Cannot boot alternate OS - Galaxy Book2,2018-11-15 16:31:12
samsung,The first details of Samsung Galaxy S10 come out,2018-11-15 17:47:29
samsung,Free Themes Going Away...?,2018-11-15 17:59:36
samsung,Do the S-Pens for the Note 8/9 work with the Samsung Galaxy Tab s3?,2018-11-15 18:31:29
samsung,"Finally, Samsung One UI Beta update is here in the US.",2018-11-15 19:36:16
samsung,A survey of Samsung Galaxy users and their experience with dropping their phones!,2018-11-15 19:40:51
samsung,Just A Warning: Avoid Samsung Powerbots,2018-11-15 19:47:05
samsung,"Is my ""profile sharing"" visible to non-Samsung users and does blocking a contact stop them from seeing your profile?",2018-11-15 20:14:01
samsung,Which keyboards available for the Note 8 can dictate punctuation?,2018-11-15 21:56:55
samsung,[Discussion] Can the Gear Fit2 Pro use Google Fit?,2018-11-15 23:00:58
samsung,Samsung introduces 512 GB EVO PLUS SD CARD!,2018-11-15 23:12:14
samsung,New samsung theme policy,2018-11-15 23:36:32
samsung,Do All Samsung Phones Have This Annoying Yellow Tint?,2018-11-16 00:04:22
samsung,"Anyone know why Samsung sent an update to block me from adjusting brightness when I'm using vpn or private hosts files to block ads? It is like they are baby sitting me in my own phone and want me to help to first turn off VPN, think it is time for 1+1 Phone.",2018-11-16 01:28:53
samsung,Samsung will only allow free themes to be used for 14 days starting with Android 9 Pie update - The Verge,2018-11-16 02:00:00
samsung,Please tell me there is a way,2018-11-16 02:07:31
samsung,Best Portable Bluetooth Speakers connect with Samsung,2018-11-16 04:08:57
samsung,[Help] A question about output on a Samsung Galaxy Camera 2,2018-11-16 04:45:17
samsung,My Samsung Galaxy S7 Edge has randomly been making loud siren-like noise...,2018-11-16 05:09:11
samsung,Requesting Info on Samsung Galaxy 8 Black Friday Deals,2018-11-16 06:03:22
samsung,Samsung gear watchface,2018-11-16 08:12:53
samsung,Samsung S9&amp;GW or Note 9 combo...Firstworldproblems,2018-11-16 08:45:43
samsung,Samsung S8+ 64GB for 299.99 usd,2018-11-16 09:19:41
samsung,Samsung GALAXY S10 - Primele IMAGINI OFICIALE ne Dezvaluit cum ar ARATA Design-ul FINAL,2018-11-16 10:42:32
samsung,Samsung Galaxy Tab S4 and Knox,2018-11-16 12:36:11
samsung,Samsung A7 2018. Power Button Question,2018-11-16 13:04:43
samsung,"Samsung U43M5500 HDMI no signal, getting red power icon instead! Help!",2018-11-16 14:48:34
samsung,Samsung One UI looking slick!,2018-11-16 15:11:15
samsung,Who is exactly a fan of the curved screen?,2018-11-16 15:12:50
samsung,Samsung T5 Portable SSD - 500GB - USB 3.1 External SSD (MU-PA500B/AM) cut off 12%,2018-11-16 15:12:52
samsung,Samsung teases its exciting all-screen Galaxy S10 design again,2018-11-16 15:15:47
samsung,Samsung note9 unable to send Gifs in text messages.,2018-11-16 15:26:12
samsung,Planul MISTERIOS pentru Samsung GALAXY X al Companiei a fost Dezvaluit de catre CEO-ul Sau,2018-11-16 15:34:14
samsung,Linux working on Samsung Dex 😃,2018-11-16 16:06:39
samsung,Samsung GALAXY S9 - Vestea GROZAVA Privind Android 9 pentru aceste Telefoane,2018-11-16 19:11:57
samsung,"Samsung Galaxy J6 Frp Bypass,Google Account Verification #AndroidUnlock",2018-11-16 19:37:05
samsung,Samsung One UI First Look on a S9,2018-11-16 19:58:26
samsung,Guess who beat Samsung to make a foldable tablet? Apple of course,2018-11-16 20:32:03
samsung,Samsung oneui wallpaper,2018-11-16 22:10:52
samsung,Purchasing a Galaxy S9+ on Verizon,2018-11-16 23:34:06
samsung,How do i get my folders to show up on this screen in Samsung cloud? I have about 12 folders of pictures saved to internal memory but they dont show up here,2018-11-17 00:57:46
samsung,Updating software on older phone? [Galaxy S6 ACTIVE],2018-11-17 01:11:55
samsung,Samsung Note 5 battery life issues,2018-11-17 01:40:31
samsung,Anybody know what this dark spot could be on the bottom and how to fix it? I have a Samsung 4K TV curved 55 inch I've had it for 2 years.,2018-11-17 02:08:13
samsung,Samsung phones (s9) auto word correct/replace Problems,2018-11-17 02:22:29
samsung,Samsung pay app capabilities question,2018-11-17 04:44:45
samsung,One UI beta help,2018-11-17 05:46:55
samsung,Soundbar woes with KS8500,2018-11-17 08:05:11
samsung,One UI Kit. (Properly credited Samsung and kit was solely made to help designers get a glimpse of UI).,2018-11-17 09:41:26
samsung,What kind of charger cable can I buy?,2018-11-17 09:51:04
samsung,S3 Froniter watch question,2018-11-17 10:11:26
samsung,Fingerprint scanner,2018-11-17 10:34:10
samsung,"My Samoogle Collection - Samsung Galaxy S9+, Samsung Galaxy Tab S4, Samsung Chromebox (running Chromium OS) on 24"" Samsung screen, Samsung Chromebook Pro, Samsung 4-in-1 Multifunction Printer/Scanner/Copier/Fax",2018-11-17 11:37:14
samsung,Samsung Knox can't access server,2018-11-17 14:27:40
samsung,Consumer Reports 2019 Buyers Guide. Samsung runs it until iPhone 8 at number 6,2018-11-17 19:02:39
samsung,5 reasons Samsung Galaxy Watch will change the way you live,2018-11-17 20:06:09
samsung,J3 star case suggestions??,2018-11-17 23:58:48
samsung,Streaming on old samsung smart tv?,2018-11-18 01:23:25
samsung,Buy S9+ on Black Friday deal or wait until cyber Monday.,2018-11-18 01:43:13
samsung,Samsung nu6900 turns off screen when connected to htpc no matter what after 15 minutes.,2018-11-18 02:52:52
samsung,First images and specifications : Infinity-O display for Samsung Galaxy S10,2018-11-18 04:58:42
samsung,Gear Iconx,2018-11-18 05:38:28
samsung,Samsung GALAXY NOTE 10 - Noul Ecran GIGANT pentru Telefoan a fost CONFIRMAT,2018-11-18 07:06:29
samsung,Samsing Experience Current Build,2018-10-31 16:32:24
samsung,Huawei for the record of world's first 7nm mobile processor!,2018-10-31 16:33:54
samsung,SAMSUNG GETTING HATE FROM YOUTUBERS!!,2018-10-31 17:01:04
samsung,Fake News 🤦🏾‍♂️,2018-10-31 18:03:31
samsung,Does anyone know why an oil painting like affect happens when taking pictures on the S9? This is my first time owning a Samsung after switching from the 7plus; which took a great picture.,2018-10-31 18:09:11
samsung,samsung 10000mah+ battery phone would be a big move!,2018-10-31 19:26:46
samsung,Never had a non-Samsung phone,2018-10-31 19:39:47
samsung,The Frame TV,2018-10-31 20:10:30
samsung,Samsung backed uBreakiFix unable to offer silver Note 9 replacement parts,2018-11-01 00:11:41
samsung,"Specific samsung TV for sale at my post exchange, I need to find out if its google home compatible. Google cant find the model at all.",2018-11-01 01:21:18
samsung,"[Help] Using a Wifi-only media Galaxy S9, how do I remove the ""No Sim - Emergency Calls Only"" from the notifications bar and lock screen bar?",2018-11-01 01:56:30
samsung,Help: Samsung J7 and blue light filter apps,2018-11-01 03:11:23
samsung,I'm thinking about upgrading from my current device to either a Samsung S9+ or the Note 9. I'd like to know few things from long time Samsung users.,2018-11-01 03:12:15
samsung,Samsung MU800 PS4 Pro Black Screen Issue,2018-11-01 06:52:33
samsung,Samsung GALAXY S10 - Prima Imagine ne Prezinta cum ar ARATA NOUL Design al Telefonului,2018-11-01 07:28:03
samsung,Samsung Galaxy S9 Slow-Motion 960 fps,2018-11-01 07:50:48
samsung,Have you done this with Samsung Galaxy S8?,2018-11-01 10:10:40
samsung,Samsung C27HG70 terrible overshoot,2018-11-01 10:35:21
samsung,Samsung a anuntat NOI Telefoane UIMITOARE pentru 2019 care vor ATACA Seria iPhone XS,2018-11-01 10:37:41
samsung,Samsung Galaxy J6 Plus Vs Samsung Galaxy A6s Comparisons,2018-11-01 12:16:09
samsung,Few questions in my mind before to a Samsung Galaxy s9+ or Note 9.,2018-11-01 13:03:22
samsung,Samsung GALAXY S9 - Functia SPECIALA care va fi Oferita cu Lansarea Android 9,2018-11-01 13:14:18
samsung,"Phone stuck on Samsung logo suddenly, cannot fix",2018-11-01 13:34:45
samsung,Am I the only one who thinks that marshmallow is the best version of android for samsung phones ? Especially the s7/s7 edge.,2018-11-01 15:01:58
samsung,Samsung GALAXY X - Iata ce ANUNT URIAS a fost Facut de catre un Director al Companiei,2018-11-01 15:24:56
samsung,Where is the best place to find a genuine samsung s9 charger?,2018-11-01 17:39:08
samsung,Samsung Galaxy Tab S suddenly goes to black WHAM,2018-11-01 17:43:37
samsung,Help with MHL/HDMI.,2018-11-01 18:04:53
samsung,Difficulties with Samsung Customer Support,2018-11-01 18:22:19
samsung,"I have a Problem at my samsung galaxy s9, that theres a popup that says i have to login to my samsung account, but it doesnt works when i type in my login information. I tried to reset my password but it still dont works.hlp",2018-11-01 18:27:57
samsung,Memory on Samsung s7 edge,2018-11-01 18:29:01
samsung,Samsung denying the warranty of replaced screen which extends upon the 12 month warranty of phone.,2018-11-01 18:29:13
samsung,An email from samsung offering £1101 discount on a new galaxy device,2018-11-01 18:48:55
samsung,Samsung j6 2018 review and unboxing,2018-11-01 20:31:49
samsung,S9 volume buttons stuck,2018-11-01 21:41:22
samsung,Samsung S7 suspected chemical leak,2018-11-01 21:47:43
samsung,Samsung nu8000 auto dimming issue,2018-11-01 21:55:23
samsung,How do i put songs from my Macbook Pro to my Samsung A8? (without paying for an app),2018-11-01 22:45:31
samsung,Just a quick question! What’s better the new iPhone so Samsung S9 and why?,2018-11-02 02:48:21
samsung,Samsung Discontinuing Soundcamp!,2018-11-02 04:00:49
samsung,"Samsung - Telefonul CIUDAT, care Costa 3000 de DOLARI arata cat de STUPID Gandeste Compania",2018-11-02 07:39:49
samsung,Samsung QE75Q6FN OR UE75NU8000,2018-11-02 08:19:11
samsung,"Screen issue with my samsung monitor, can someone tell me how to fix this?",2018-11-02 09:05:05
samsung,Fantastic but unknown samsung app,2018-11-02 10:37:09
samsung,Save 8% on Samsung LC27H711QENXZA C27H711 27-Inch WQHD QLED Curved Monitor (360 Degree Design),2018-11-02 12:43:49
samsung,Samsung a Inregistrat o SCADERE URIASA in Vanzarile de Smartphone-uri in T3 2018,2018-11-02 12:52:22
samsung,Warranty question,2018-11-02 15:21:56
samsung,"Samsung GALAXY S10 - Iata ce Schimbare MAJORA, Dorita de TOTI Fanii, a fost CONFIRMATA",2018-11-02 15:46:47
samsung,Tab S4 vs New IPad Pro?,2018-11-02 16:11:57
samsung,Screen mirroring problem,2018-11-02 17:18:53
samsung,Samsung has some of the worst customer service I've seen. Be careful with your trade ins.,2018-11-02 17:39:30
samsung,Is there a good third party app for the front facing camera?,2018-11-02 18:08:23
samsung,Samsung MU800 PS4 Pro Black Screen Issue,2018-11-02 18:53:02
samsung,Problem with the S8+ 😑,2018-11-02 19:53:23
samsung,Help me,2018-11-02 23:42:01
samsung,Really need help,2018-11-03 01:40:45
samsung,Samsung Galaxy A9 (2018) is About to Launch in India- Price and Storage Revealed,2018-11-03 06:05:50
samsung,Samsung - Decizie de ULTIMA ORA Luata pentru Telefoanul ASTEPTAT de Toata LUMEA!,2018-11-03 07:01:53
samsung,Samsung Galaxy Frontier S3 is available at a discounted rate of 246 USD in my country. I'm thinking of buying it. Is it worth it?,2018-11-03 07:12:21
samsung,SAMSUNG CHARGEUR À INDUCTION STAND. RAPIDE RAPIDE,2018-11-03 07:30:21
samsung,Samsung's applications sync with others ?,2018-11-03 08:23:47
samsung,Regretting Samsung abandoning NX cameras,2018-11-03 09:48:07
samsung,Burn in question,2018-11-03 12:17:20
samsung,iPhone XR vs Samsung Galaxy Note 9 Speed Test,2018-11-03 14:07:52
samsung,Apple Watch(es) Vs Samsung Watch(es),2018-11-03 15:17:46
samsung,Hated Samsung for many years. Bought S9+ yesterday.,2018-11-03 15:22:30
samsung,Why other phone companies doesn't copy samsung edge screen but they copy notch?,2018-11-03 15:41:59
samsung,Samsung GALAXY S10 - Iata ce Functie MAJORA va LIPSI din Noul Model de Smartphone,2018-11-03 17:01:57
samsung,Sent S8 for repair - came back with new SIM.... that works.,2018-11-03 17:22:14
samsung,Samsung galaxy note 5. Is there anything I can do to stop the progression of this spot in the screen? It started out tiny and now its much bigger.,2018-11-03 18:10:22
samsung,Samsung TV life span?,2018-11-03 18:15:08
samsung,AKG Samsung Earbuds,2018-11-03 18:48:33
samsung,Edge lighting settings not saving,2018-11-03 19:47:10
samsung,Best way to use headphones with Samsung TV? (NU8000?),2018-11-03 20:33:00
