subreddit,title,timestamp
samsung,"Samsung Galaxy J4+ review: Feature heavy, but camera, display found lacking",2018-11-13 11:48:12
samsung,Samsung Qi Certified Fast Charge Wireless Charging Convertible Stand/Pad is 40% off,2018-11-13 11:53:13
samsung,"Samsung GALAXY S10 are Primele SPECIFICATII Dezvaluite in Exclusivitate, iata care sunt!",2018-11-13 12:31:36
samsung,Samsung’s One UI Beta Program: Android Pie for Samsung Devices,2018-11-13 12:32:03
samsung,Samsung Gives First Glimpse of Foldable Phone,2018-11-13 13:08:11
samsung,Samsung Portable SSD T5 Software vs. Mac OS Time Machine,2018-11-13 13:14:05
samsung,Not sure if I bought a fake.,2018-11-13 14:40:08
samsung,Samsung Launched Dual Screen Smartphone W2019 with amazing Features,2018-11-13 14:43:36
samsung,how to buy the new samsung with a loan,2018-11-13 16:22:29
samsung,What is the most battery efficient way to connect my S9+ to my Gear S2?,2018-11-13 16:38:51
samsung,"Samsung Galaxy S10 will have Infinity-O display, ultrasonic fingerprint scanner.",2018-11-13 17:08:13
samsung,How long do you think before Samsung can become independent of companies like Google?,2018-11-13 17:32:32
samsung,Samsung introduces Galaxy S9 and Galaxy S9 Ice Blue Gradient color variant smartphone,2018-11-13 17:52:53
samsung,Samsung galaxy s8 plus keeps trying to backup with samsung cloud.,2018-11-13 18:05:21
samsung,"Is it possible to join the Samsung Beta Testing Programme outside of U.S., Germany, Korea, China, France, India, Poland, Spain, and the U.K.",2018-11-13 18:11:20
samsung,Lockscreen randomly changed,2018-11-13 18:52:03
samsung,Samsung GALAXY X - Secretul URIAS care a fost ASCUNS in Timpul Prezentarii Oficiale,2018-11-13 19:02:54
samsung,November update question,2018-11-13 19:44:47
samsung,Fast charging,2018-11-13 19:55:14
samsung,Curious about Galaxy/Android security,2018-11-13 20:16:48
samsung,Increase internal storage on J7 and A6 possible?,2018-11-13 20:50:09
samsung,Samsung Notebook 9,2018-11-13 22:22:05
samsung,DXOMark reviews the Google Samsung Galaxy Note 9,2018-11-13 22:46:44
samsung,Sorry to be the bearer of bad news - S10 Infinity O screen and no headphone jack,2018-11-13 23:30:56
samsung,How can I update my Samsung Keyboard app on my Galaxy S8.,2018-11-14 01:01:57
samsung,The Samsung Galaxy S7 is nearly three years old and still can take amazing photographs.,2018-11-14 02:02:23
samsung,finally left Apple and went Samsung 👌,2018-11-14 02:04:36
samsung,[HELP] how do I enable wireless charging on my Samsung Galaxy S8 active?,2018-11-14 02:08:24
samsung,[Other] Fuck Facebook mobile,2018-11-14 02:18:05
samsung,Samsung Galaxy A9,2018-11-14 02:29:48
samsung,Can someone explain to me why Samsung keep making their customer service lie to us ?,2018-11-14 02:34:44
samsung,Samsung W2019 Vs Samsung Galaxy Note 9 Specifications Comparisons,2018-11-14 03:32:30
samsung,Samsung Galaxy Note FE Replacement Battery in VIET NAM,2018-11-14 04:30:55
samsung,The new Samsung Exynos 9820 comes with support for 8K@30fps and 4K@150fps!!!!,2018-11-14 04:31:47
samsung,Samsung GALAXY S9 - SURPRIZA ASCUNSA in Android 9 pe care o vei DORI in iPhone,2018-11-14 06:04:39
samsung,Samsung customer support - bit of a scam?,2018-11-14 09:08:58
samsung,Samsung - Acesta este Produsul NEASTEPTAT Dezvaluit OFICIAL de catre Companie,2018-11-14 13:00:49
samsung,Unlocked S9+ support ATT wifi calling?,2018-11-14 13:18:09
samsung,Samsung S8 - Can't place phone calls on new Android Update 8.0.0,2018-11-14 13:59:46
samsung,Is the Samsung Q6F worth it?,2018-11-14 14:24:13
samsung,"Samsung contact's picture disappeared, does it mean they blocked me?",2018-11-14 15:40:14
samsung,Getting a new Samsung today...,2018-11-14 15:45:22
samsung,charging station for samsung?,2018-11-14 16:09:55
samsung,Xiaomi Mi Band 3 compatibility with samsung,2018-11-14 16:51:52
samsung,Got my Note 8's screen replaced under warranty for screen burn in 👍,2018-11-14 17:27:14
samsung,CAND se LANSEAZA Samsung GALAXY S10 a fost Dezvaluit OFICIAL chiar de catre Companie,2018-11-14 18:02:05
samsung,Samsung Exynos 9820: Five reasons Galaxy S10 just won,2018-11-14 18:27:04
samsung,Refund time for carrier financing (verizon),2018-11-14 20:03:56
samsung,Note 9 or pixel 3 xl?,2018-11-14 21:58:13
samsung,What are the best Samsung tablets and why?,2018-11-14 22:44:10
samsung,"2 Samsungs: Can't answer incoming calls. Phone rings, but call answer screen doesn't open.",2018-11-14 23:04:17
samsung,Good Samsung tablets for drawing?,2018-11-14 23:30:22
samsung,How do I download stock firmware for my Note 3?,2018-11-14 23:41:33
samsung,Wireless charger for S7 Edge,2018-11-14 23:56:37
samsung,Got my Note 8's screen replaced under warranty for screen burn in 👍,2018-11-15 00:14:25
samsung,Is Samsung's customer service division that bad??,2018-11-15 03:44:46
samsung,"Any knowledge about this? I know what a bootloader is as an avid Linux user, but am unsure what the best course of action would be. Samsung S7 Edge, international unlocked (GSM).",2018-11-15 03:53:08
samsung,"I have no Smartphone of any sort, can i still use a Samsung smart watch?",2018-11-15 04:05:32
samsung,My Samsung Galaxy S7 Edge has been making loud siren-like noise,2018-11-15 04:54:19
samsung,Samsung to Come Up with Dual Foldable Display Design,2018-11-15 04:59:05
samsung,Samsung Offering HBO GO As A Gift In Its Smart TVs.,2018-11-15 08:22:34
samsung,Is this an original Samsung battery? (gs7),2018-11-15 09:38:48
samsung,Samsung GALAXY S10 are Confirmate OFICIAL Doua NOI Functii EXCLUSIVE pentru Clienti,2018-11-15 10:00:59
samsung,"Samsung Galaxy A9, world's first four-camera phone, said to launch on November 20 in India: Expected price, specifications",2018-11-15 11:01:36
samsung,Samsung Folder 2 Android Version,2018-11-15 11:08:00
samsung,I'm really torn about the hole everyone says is gonna be on the S10...,2018-11-15 12:26:31
samsung,Are the Samsung Icon X worth their price? If not what alternatives do you know of? Not looking to spend a great deal just want some decent wireless earphones without breaking the bank.,2018-11-15 12:35:20
samsung,Android 9 si Vestea URIASA pentru Telefoanele Samsung GALAXY S9 Anuntata Astazi,2018-11-15 12:36:33
samsung,A Samsung phone user that barely uses Samsung software ... These are the only Samsung apps and services that i use on my GALAXY S9 plus,2018-11-15 12:56:28
samsung,VESA plate for my Samsung monitor,2018-11-15 13:18:19
samsung,Samsung galaxy s10 confirmed and a8 range update,2018-11-15 13:46:53
samsung,My phone is not switching on,2018-11-15 14:22:27
samsung,"Samsung GALAXY X - UIMITOR, va fi mai TARE decat iPhone XS si ORICE Telefon Android",2018-11-15 14:32:21
samsung,Early Black Friday Samsung 65NU8000 Flat 65” 4K UHD 8 Series Smart TV 2018 now 23% off,2018-11-15 15:01:11
samsung,My Google Inspired Galaxy S9 Plus Android Experience,2018-11-15 15:02:05
samsung,I am sold on 10 bit | Finally a phone worth spending $1000 | Looks like Samsung is going all out on the S10,2018-11-15 15:22:58
samsung,Cannot boot alternate OS - Galaxy Book2,2018-11-15 16:31:12
samsung,The first details of Samsung Galaxy S10 come out,2018-11-15 17:47:29
samsung,Free Themes Going Away...?,2018-11-15 17:59:36
samsung,Do the S-Pens for the Note 8/9 work with the Samsung Galaxy Tab s3?,2018-11-15 18:31:29
samsung,"Finally, Samsung One UI Beta update is here in the US.",2018-11-15 19:36:16
samsung,A survey of Samsung Galaxy users and their experience with dropping their phones!,2018-11-15 19:40:51
samsung,Just A Warning: Avoid Samsung Powerbots,2018-11-15 19:47:05
samsung,"Is my ""profile sharing"" visible to non-Samsung users and does blocking a contact stop them from seeing your profile?",2018-11-15 20:14:01
samsung,Which keyboards available for the Note 8 can dictate punctuation?,2018-11-15 21:56:55
samsung,[Discussion] Can the Gear Fit2 Pro use Google Fit?,2018-11-15 23:00:58
samsung,Samsung introduces 512 GB EVO PLUS SD CARD!,2018-11-15 23:12:14
samsung,New samsung theme policy,2018-11-15 23:36:32
samsung,Do All Samsung Phones Have This Annoying Yellow Tint?,2018-11-16 00:04:22
samsung,"Anyone know why Samsung sent an update to block me from adjusting brightness when I'm using vpn or private hosts files to block ads? It is like they are baby sitting me in my own phone and want me to help to first turn off VPN, think it is time for 1+1 Phone.",2018-11-16 01:28:53
samsung,Samsung will only allow free themes to be used for 14 days starting with Android 9 Pie update - The Verge,2018-11-16 02:00:00
samsung,Please tell me there is a way,2018-11-16 02:07:31
samsung,Best Portable Bluetooth Speakers connect with Samsung,2018-11-16 04:08:57
samsung,[Help] A question about output on a Samsung Galaxy Camera 2,2018-11-16 04:45:17
samsung,My Samsung Galaxy S7 Edge has randomly been making loud siren-like noise...,2018-11-16 05:09:11
samsung,Requesting Info on Samsung Galaxy 8 Black Friday Deals,2018-11-16 06:03:22
samsung,Samsung gear watchface,2018-11-16 08:12:53
samsung,Samsung S9&amp;GW or Note 9 combo...Firstworldproblems,2018-11-16 08:45:43
samsung,Samsung S8+ 64GB for 299.99 usd,2018-11-16 09:19:41
samsung,Samsung GALAXY S10 - Primele IMAGINI OFICIALE ne Dezvaluit cum ar ARATA Design-ul FINAL,2018-11-16 10:42:32
samsung,Samsung Galaxy Tab S4 and Knox,2018-11-16 12:36:11
samsung,Samsung A7 2018. Power Button Question,2018-11-16 13:04:43
samsung,"Samsung U43M5500 HDMI no signal, getting red power icon instead! Help!",2018-11-16 14:48:34
samsung,Samsung One UI looking slick!,2018-11-16 15:11:15
samsung,Who is exactly a fan of the curved screen?,2018-11-16 15:12:50
samsung,Samsung T5 Portable SSD - 500GB - USB 3.1 External SSD (MU-PA500B/AM) cut off 12%,2018-11-16 15:12:52
samsung,Samsung teases its exciting all-screen Galaxy S10 design again,2018-11-16 15:15:47
samsung,Samsung note9 unable to send Gifs in text messages.,2018-11-16 15:26:12
samsung,Planul MISTERIOS pentru Samsung GALAXY X al Companiei a fost Dezvaluit de catre CEO-ul Sau,2018-11-16 15:34:14
samsung,Linux working on Samsung Dex 😃,2018-11-16 16:06:39
samsung,Samsung GALAXY S9 - Vestea GROZAVA Privind Android 9 pentru aceste Telefoane,2018-11-16 19:11:57
samsung,"Samsung Galaxy J6 Frp Bypass,Google Account Verification #AndroidUnlock",2018-11-16 19:37:05
samsung,Samsung One UI First Look on a S9,2018-11-16 19:58:26
samsung,Guess who beat Samsung to make a foldable tablet? Apple of course,2018-11-16 20:32:03
samsung,Samsung oneui wallpaper,2018-11-16 22:10:52
samsung,Purchasing a Galaxy S9+ on Verizon,2018-11-16 23:34:06
samsung,How do i get my folders to show up on this screen in Samsung cloud? I have about 12 folders of pictures saved to internal memory but they dont show up here,2018-11-17 00:57:46
samsung,Updating software on older phone? [Galaxy S6 ACTIVE],2018-11-17 01:11:55
samsung,Samsung Note 5 battery life issues,2018-11-17 01:40:31
samsung,Anybody know what this dark spot could be on the bottom and how to fix it? I have a Samsung 4K TV curved 55 inch I've had it for 2 years.,2018-11-17 02:08:13
samsung,Samsung phones (s9) auto word correct/replace Problems,2018-11-17 02:22:29
samsung,Samsung pay app capabilities question,2018-11-17 04:44:45
samsung,One UI beta help,2018-11-17 05:46:55
samsung,Soundbar woes with KS8500,2018-11-17 08:05:11
samsung,One UI Kit. (Properly credited Samsung and kit was solely made to help designers get a glimpse of UI).,2018-11-17 09:41:26
samsung,What kind of charger cable can I buy?,2018-11-17 09:51:04
samsung,S3 Froniter watch question,2018-11-17 10:11:26
samsung,Fingerprint scanner,2018-11-17 10:34:10
samsung,"My Samoogle Collection - Samsung Galaxy S9+, Samsung Galaxy Tab S4, Samsung Chromebox (running Chromium OS) on 24"" Samsung screen, Samsung Chromebook Pro, Samsung 4-in-1 Multifunction Printer/Scanner/Copier/Fax",2018-11-17 11:37:14
samsung,Samsung Knox can't access server,2018-11-17 14:27:40
samsung,Consumer Reports 2019 Buyers Guide. Samsung runs it until iPhone 8 at number 6,2018-11-17 19:02:39
samsung,5 reasons Samsung Galaxy Watch will change the way you live,2018-11-17 20:06:09
samsung,J3 star case suggestions??,2018-11-17 23:58:48
samsung,Streaming on old samsung smart tv?,2018-11-18 01:23:25
samsung,Buy S9+ on Black Friday deal or wait until cyber Monday.,2018-11-18 01:43:13
samsung,Samsung nu6900 turns off screen when connected to htpc no matter what after 15 minutes.,2018-11-18 02:52:52
samsung,First images and specifications : Infinity-O display for Samsung Galaxy S10,2018-11-18 04:58:42
samsung,Gear Iconx,2018-11-18 05:38:28
