subreddit,title,timestamp
samsung,About to buy Samsung View,2018-11-03 21:26:19
samsung,"Hello everyone, I bought the 55 inch 2018 UHD 4k samsung TV and can't access hulu live television or profiles.",2018-11-03 21:58:30
samsung,What is the current status of rooting the Samsung S8?,2018-11-03 23:13:47
samsung,Problem about Always on Display,2018-11-03 23:33:21
samsung,Samsung UI,2018-11-04 01:13:21
samsung,Some questions about this S8 Plus on Amazon...,2018-11-04 01:43:57
samsung,Samsung Galaxy S9 Sd card,2018-11-04 02:14:31
samsung,Are you a Samsung owner and looking to become a Samsung Expert? Figured I'd share my channel with you. Courtesy of Samsung Trainer.,2018-11-04 02:43:12
samsung,brand new note 9!!!,2018-11-04 03:56:51
samsung,What is the best Samsung phone &lt; €350,2018-11-04 10:38:16
samsung,Samsung health global challenge - Are these real?,2018-11-04 12:01:07
samsung,My Samsung fridge (a 4 door flex) keeps sending notification since this morning that its door is left open. The only thing is my fridge doors are closed. I can’t seem to be able to fix this! Anyone know how?,2018-11-04 12:28:25
samsung,Control+F like search feature in Samsung phones?,2018-11-04 12:43:50
samsung,samsung removed youtube 1440p from galaxy tab s?,2018-11-04 13:43:50
samsung,Samsung s7 slow compared to similar year iPhone,2018-11-04 14:07:07
samsung,Save $100 on Samsung C32HG70 32-Inch HDR QLED Curved Gaming Monitor (144Hz / 1ms) Model C32HG70QQN,2018-11-04 14:53:27
samsung,"Samsung Galaxy Note 9 Factory Unlocked with 6.4"" Screen and 128GB (U.S. Warranty), Midnight Black Is At Lowest Price Ever",2018-11-04 16:04:45
samsung,"Samsung Galaxy Note 9 Factory Unlocked with 6.4"" Screen and 128GB (U.S. Warranty), Midnight Black Is At Lowest Price Ever",2018-11-04 16:28:43
samsung,Do you need Odin to update a Samsung Galaxy S3?,2018-11-04 18:07:55
samsung,Are there two types of Samsung accounts?,2018-11-04 18:37:31
samsung,An issue with accessing data from Phone,2018-11-04 19:30:53
samsung,"I think the Oleophobic coating on my Note 9 has worn off, help",2018-11-04 23:01:09
samsung,Is the Samsung A8 compatible with Gear VR,2018-11-05 00:40:37
samsung,Samsung foldable phone is hinted!,2018-11-05 01:48:40
samsung,Question about getting some sort of remote control for my galaxy S2 tablet,2018-11-05 02:20:49
samsung,"Didn’t love the S9, planning to return it.",2018-11-05 03:25:39
samsung,Samsung Premium Care,2018-11-05 03:54:58
samsung,Samsung premium care,2018-11-05 04:06:27
samsung,Samsung exclusive in-game skin,2018-11-05 04:19:05
samsung,I LOVE my s9 - post for anyone considering switchung to android.,2018-11-05 05:03:05
samsung,Best Samsung Marketing App to improve performace and ram overtime!,2018-11-05 06:09:40
samsung,Recover Data on/off switch Samsung S9,2018-11-05 08:35:07
samsung,Samsung GALAXY NOTE 9 - Iata ce NOU Model SPECIAL a fost Dezvaluit Inaintea Lansarii,2018-11-05 10:32:11
samsung,How to Power all Your Apps on Samsung Smartphone with MTN mPulse Data Plan via Max VPN,2018-11-05 10:47:01
samsung,Samsung Level In Anc Earphones,2018-11-05 13:01:13
samsung,annoying pill notifications,2018-11-05 13:47:01
samsung,"Why doesn't Samsung use a screensaver on ""demo"" mode?",2018-11-05 14:25:12
samsung,Samsung Support,2018-11-05 14:34:20
samsung,Samsung Focus S,2018-11-05 17:52:48
samsung,Samsung GALAXY X - Anuntul IMPORTANT Facut de catre Companie pentru Fanii Sai,2018-11-05 18:01:36
samsung,Samsung Focus S- 7 years old and still smooth and responsive,2018-11-05 18:40:12
samsung,"Samsung S8 has very slow connection. My sim card works perfectly fine, and is super fast on my other phone. The settings are set to 3G/LTE. Does anyone else have this problem?",2018-11-05 20:59:24
samsung,"Hey Samsung, make up your mind.",2018-11-05 21:41:57
samsung,Samsung S8 Black Screen,2018-11-05 22:05:53
samsung,"Unless Samsung is trolling us, a folding Galaxy phone is finally coming this week",2018-11-05 22:10:07
samsung,OMG! Thieves Can Easily Hack Your Samsung S8!,2018-11-05 22:12:50
samsung,Galaxy S7 wont boot,2018-11-05 23:22:18
samsung,Does anyone knows what happened to my samsung tv.,2018-11-05 23:38:58
samsung,"Trying to enable ""format as internal"" 3 days of agony...",2018-11-06 00:00:45
samsung,Samsung Does Slow Down Phones!,2018-11-06 01:13:18
samsung,S8 plus screenburn,2018-11-06 01:51:15
samsung,Note Taking,2018-11-06 02:28:54
samsung,"Do anyone knows when Samsung will update their flagship phones the new Android version of Pie? Or Samsung Experience 10? Is there's a community to sign up for beta, I have a Samsung Galaxy Note 8.",2018-11-06 04:04:21
samsung,Can I damage my Samsung using these codes or is it safe to use?,2018-11-06 05:05:26
samsung,Samsung INFINITY Flex - Telefonul cu care Samsung vrea sa Faca UITAT iPhone,2018-11-06 06:02:28
samsung,samsung latest soundbar news,2018-11-06 06:07:01
samsung,iPhone 8 Plus to Samsung?,2018-11-06 09:13:59
samsung,[Easy Steps] Samsung Galaxy S9 Wont Turn on,2018-11-06 09:31:41
samsung,"Samsung Note9 keyboard, can I remove the "".com"" button that keeps appearing?",2018-11-06 09:55:13
samsung,Samsung POWERbot R7040 Robot Vacuum is 30% off,2018-11-06 09:59:52
samsung,TSPN1: Samsung Galaxy Note 9 Vs Huawei Honor Magic 2 Comparisons,2018-11-06 11:19:02
samsung,Samsung TV LA40R71BDX overscan,2018-11-06 11:28:18
samsung,"Samsung GALAXY F - Anuntul Oficial privind Prezentarea, iata ce vom vedea Maine",2018-11-06 12:31:18
samsung,Idea for samsung ad overflow-put bixby on lockscreen with custom ui ad based,2018-11-06 13:44:00
samsung,Samsung A8,2018-11-06 14:50:59
samsung,Samsung GALAXY S10 Teaser ARATA Telefonul la care TOATA LUMEA VISEAZA (VIDEO),2018-11-06 15:02:48
samsung,how to fix any software problem in samsung galaxy j4/ unroot/ flash stock rom,2018-11-06 15:09:43
samsung,Samsung TV help (Why is TV PLUS on by Default),2018-11-06 16:02:34
samsung,What can we expect from tomorrow Samsung Developer Conference event ?,2018-11-06 16:18:19
samsung,Note 9 trade up program issues. Ughh.,2018-11-06 16:24:02
samsung,Help!!!,2018-11-06 17:41:52
samsung,Samsung Galaxy S10’s Exynos 9820 may have dual NPUs.,2018-11-06 17:43:25
samsung,Samsung Is Releasing A New Foldable Smartphone,2018-11-06 18:10:43
samsung,Samsung Tab S2 Not Working,2018-11-06 19:39:16
samsung,Samsung talking Android Pie beta this week may dispatch same day,2018-11-06 19:56:27
samsung,Do USB-C audio earbuds work on the Note 8?,2018-11-06 20:40:57
samsung,Can someone please make a complete Dark Theme for the S9/S9+?,2018-11-06 21:49:18
samsung,Samsung Galaxy S10 tendrá también procesador AI - GeekZus,2018-11-06 22:41:31
samsung,IR Blaster needs to be added on next Galaxy Smart Phone,2018-11-06 23:08:56
samsung,My Samsung J3's back button won't work,2018-11-06 23:36:58
samsung,"Samsung, Cant disable voicemail Notifications. Very Annoying...",2018-11-07 00:00:10
samsung,Samsung Galaxy Home smart-speaker likely to be presented tomorrow at Samsung Developer Conference 2018,2018-11-07 00:13:10
samsung,Verizon Samsung Galaxy S9+ System Update 6,2018-11-07 00:47:24
samsung,HELP!! SAMSUNG S8 REMOVES APPS FROM HOME SCREEN ON RESTART,2018-11-07 01:00:54
samsung,Samsung Galaxy S7 in 2018/2019,2018-11-07 02:27:03
samsung,Everytime i scroll left or right from the corner of my phone this happens.....do yall know which app causes this or is it a feature of samsung? ( i use a samsung j7 prime btw),2018-11-07 02:28:29
samsung,Can you connect the 2018 Samsung Gear Icon X with a device other than a phone ?,2018-11-07 02:30:44
samsung,Streamen von Apple Musik auf Samsung Galaxy S8,2018-11-07 03:10:57
samsung,2012 ES- series television keeps getting SmartHub updates?,2018-11-07 04:15:30
samsung,Is my samsung TV hacked???,2018-11-07 04:29:33
samsung,Question about Samsung Galaxy a5 sd cards.,2018-11-07 04:48:50
samsung,Samsung to uncover a few highlights of foldable telephone this week ],2018-11-07 06:03:58
samsung,Samsung Face un ANUNT MAJOR Privind Lansarea Android 9 pentru Telefoane,2018-11-07 07:23:42
samsung,Why cant i use paypal as an option fir samsung pay on my gear sport?,2018-11-07 08:28:45
samsung,Best Screen Protector For Samsung Galaxy S9 &amp; S9 Plus,2018-11-07 08:58:56
samsung,Samsung GALAXY S10 - PREMIERA UIMITOARE pentru a Ramane in TOP in LUPTA cu Huawei,2018-11-07 09:01:47
samsung,"Samsung Galaxy A9, Quad Cameras?",2018-11-07 11:56:32
samsung,The US Samsung site is ready for Black Friday!,2018-11-07 13:04:04
samsung,HELP!!! SAMSUNG S8 REMOVES ALL SD APPS FROM HOME SCREEN ON RESTART,2018-11-07 14:00:21
samsung,Save 44% on Samsung Qi Certified Fast Charge Wireless Charging Convertible Stand/Pad - US Version - Black - EP-PG950TBEGUS,2018-11-07 14:35:26
samsung,Phones: Experiences / thoughts about the screen edge in a drop?,2018-11-07 14:50:04
samsung,Just got the gear s3,2018-11-07 14:56:32
samsung,Samsung Developer Conference 2018 Opening Keynote Livestream. Going to start in 2 hours.,2018-11-07 15:51:27
samsung,How to get free wallpapers on samsung themes,2018-11-07 16:02:01
samsung,Samsung GALAXY X - Iata cum poti vedea LIVE Prezentarea Noului Telefon Pliabil (VIDEO),2018-11-07 16:22:20
samsung,Question about s8/s9 earphones,2018-11-07 17:49:02
samsung,Best Samsung for $150-$300,2018-11-07 18:19:36
samsung,Samsung One UI Open Beta,2018-11-07 19:17:07
samsung,Samsung annouced the new one Ui,2018-11-07 19:18:04
samsung,Samsung galaxy s10 hinted im dying for that green colour.,2018-11-07 19:39:32
samsung,Samsung galaxy s10 hinted im dying for that green colour.,2018-11-07 19:39:43
samsung,Samsung galaxy s10 hinted im dying for that green colour.,2018-11-07 19:39:51
samsung,"Samsung Developer Conference - Foldable phone, Infinity-U ; Infinity-V ; Infinity-O screen technologies",2018-11-07 19:47:27
samsung,Samsung Folding Phone Reveal,2018-11-07 19:50:04
samsung,Samsung gives sneak peek of foldable phone,2018-11-07 19:52:19
samsung,Samsung INFINITY FLEX - ASA ARATA Telefonul Pliabil care a fost PREZENTAT OFICIAL (VIDEO),2018-11-07 20:00:42
samsung,Samsung gives sneak peek of foldable phone (disguised in box),2018-11-07 20:02:26
samsung,Looking for a microSD for my Samsung Galaxy S7.,2018-11-07 20:19:00
samsung,Note 9 and Gear VR,2018-11-07 20:40:00
samsung,How to sign up for One UI beta,2018-11-07 20:41:34
samsung,Samsung announces notches,2018-11-07 21:48:07
samsung,My Samsung A7 is blurring my photos unless flash is on. How can I fix this?,2018-11-07 21:48:59
samsung,One ui,2018-11-07 22:01:30
samsung,"Is the new samsung One UI coming to s8, s8 plus, note 8 phones?",2018-11-07 22:20:50
samsung,"Dolby Vision, HDR, QLED, OLED, and Nits brightness",2018-11-07 22:43:18
samsung,"[Help] Tab S4 - Dex and HDMI ""Samsung Dex not avaliable while cover open""",2018-11-07 23:09:17
samsung,Samsung will put notches on its future phones,2018-11-07 23:13:16
samsung,S8 wont get One UI according to this arricle,2018-11-07 23:14:04
samsung,Samsung Galaxy S10 seen in public.,2018-11-07 23:53:33
samsung,Help: How to turn down the brightness of my Samsung monitor while it's in eyesaver mode?,2018-11-08 00:10:07
samsung,"Ice Universe Tweets About Samsung Trademarks for ""Infinity"" Displays",2018-11-08 00:12:14
samsung,Note 9 Samsung Messages app issue,2018-11-08 00:27:30
samsung,My Samsung mobile device collection,2018-11-08 01:39:27
samsung,Samsung is not giving me back my tablet,2018-11-08 02:28:30
samsung,Download Samsung One UI Wallpaper here. (Album link in comment),2018-11-08 03:27:17
samsung,My Samsung 65 UHD Smart TV is chromecast enabled... so why can’t I cast from MoviesAnywhere to it?,2018-11-08 03:35:15
samsung,"ASA Vor ARATA Primele Telefoane Samsung care vor avea DECUPAJ in Ecran, de care Compania Radea",2018-11-08 06:05:09
samsung,Mid Range Phone From Samsung,2018-11-08 06:28:23
samsung,Samsung Foldable Smartphone Prototype Teases - It's Official!,2018-11-08 07:16:10
samsung,SAMSUNG GALAXY X - Acestea sunt SPECIFICATIILE OFICIALE ale Telefonului Pliabil,2018-11-08 07:26:57
samsung,Samsung built a robot butt just to test its smartphones' durability,2018-11-08 07:32:42
samsung,Music for SDC,2018-11-08 08:54:43
samsung,SAMSUNG GALAXY S9 - A fost Anuntat OFICIA CAND se LANSEAZA Android 9 pentru Clienti,2018-11-08 09:02:36
samsung,"In pics: Samsung unveils Infinity Flex, the much-awaited 'foldable' phone",2018-11-08 09:45:08
samsung,Joining One UI Beta Program with VPN?,2018-11-08 10:29:22
samsung,Samsung embraces the notch with new Infinity Displays.,2018-11-08 11:07:20
samsung,Samsung Bixby gets an API for third-party services support.,2018-11-08 11:08:17
samsung,One UI beta sign up,2018-11-08 12:26:40
samsung,"Samsung Galaxy Tab A 10.1"" worth it?",2018-11-08 13:39:49
samsung,Galaxy S10 could look radically different from any other Samsung smartphone...2018,2018-11-08 14:36:48
samsung,Samsung Tab S3 still worth it?,2018-11-08 14:42:17
samsung,Samsung Watch disconnecting,2018-11-08 15:03:09
samsung,"Samsung Anunta ONE UI, NOUA Interfata pentru Telefoanele cu Sistem Android",2018-11-08 15:25:29
samsung,Installing Samsung Members,2018-11-08 15:41:14
samsung,"Guys little help here please. I wanna buy a Samsung tablet. In your opinion: Samsung galaxy tab E (wifi and 3g) 9.6"" 1gb ram Or Samsung galaxy tab A (just wifi connection) 10.1"" 2gb ram",2018-11-08 15:42:51
samsung,Remapping Bixby button to back?,2018-11-08 16:17:30
samsung,Samsung 2018 Model Stereo to Surround Upmixing?,2018-11-08 16:23:33
samsung,Why does Samsung not give android to countries on the same dates?,2018-11-08 16:23:49
samsung,"Samsung announced ‘One UI’, its new mobile UX",2018-11-08 16:23:54
samsung,Samsung galaxy x folding smartphone revealed. - TechMasair,2018-11-08 17:55:52
samsung,Samsung GALAXY S10 - One UI Dezvaluie SECRETUL ASCUNS de catre Compania Samsung,2018-11-08 19:01:50
samsung,Merge Files?,2018-11-08 19:55:37
samsung,Samsung Galaxy S9,2018-11-08 21:23:28
samsung,Samsung announces Infinity Flex Display for foldable smartphones VIDEO,2018-11-08 21:27:39
samsung,Need help deciding between Samsung QLED models.,2018-11-08 21:58:33
samsung,Anyone know what's the best way to watch 4K content from a Samsung Galaxy S phone (7 or 9) on a big screen 4K UHDTV ?,2018-11-08 21:58:35
samsung,Once again Samsung rips off Apply by stealing the original idea for the bendable phone! Have you no shame Samsung?,2018-11-09 01:28:08
samsung,I’m thinking about switching from iPhone to Samsung (I am an 8 year iPhone user currently with iPhone X) I would switch to the galaxy S9. Is there anything I should know about android or be aware of before the switch? Never used a Samsung device before. Thanks!,2018-11-09 01:34:29
samsung,Looks like Samsung didn't get the memo lol,2018-11-09 01:43:32
samsung,"If you block a number on Samsung, will the person know if they call or text you in the future?",2018-11-09 05:25:48
samsung,Need help! Should I keep this Samsung Galaxy S9+ or give it back?,2018-11-09 05:46:21
samsung,Just got OREO on my samsung galaxy J7 2017,2018-11-09 06:01:38
samsung,Samsung - Primele Informatii despre CAT COSTA si CAND e LANSAREA Samsung GALAXY X,2018-11-09 07:26:21
samsung,Samsung galaxy x folding smartphone revealed. - TechMasair,2018-11-09 07:44:08
samsung,"News: Linux on Dex beta, Linux is finally coming to Samsung Galaxy.",2018-11-09 07:54:46
samsung,"Gee I can't wait to visit there, thanks Samsung!",2018-11-09 08:46:56
samsung,"Gee I can't wait to visit, thanks Samsung!",2018-11-09 09:16:22
samsung,"""The message is accurate, from a senior Samsung official"" - Ice Universe via Twitter.",2018-11-09 09:33:41
samsung,Download Samsung One UI Wallpaper in High Quality,2018-11-09 11:37:16
samsung,"""S8 will be getting One UI confirmed by a senior Samsung Official"" -Ice universe on twitter",2018-11-09 12:34:20
samsung,Why One UI is better than Samsung Experience and iOS 12,2018-11-09 12:57:25
samsung,US phone used internationally haz a sad,2018-11-09 14:03:20
samsung,Is there any method for getting One UI when you are not selected for the beta?,2018-11-09 14:23:43
samsung,Does the Bixby Speaker stand a chance against Google Home?,2018-11-09 15:18:40
samsung,"Samsung officially launched W2019 with dual camera, dual screen, and side fingerprint sensor",2018-11-09 15:57:03
samsung,Getting Samsung advertisements as notifications.,2018-11-09 16:03:09
samsung,[Help] Galaxy J5 Prime's screen won't turn on after locked,2018-11-09 17:44:28
samsung,"Samsung Innovation of the year,its Incredible ,world First Fold-able smartphone with fold-able display",2018-11-09 19:36:27
samsung,Get this email from Samsungcloud.com in Portuguese. I don't use Samsung cloud or speak Portuguese. What is this?,2018-11-09 22:08:32
samsung,Samsung HW-K950 Rear speakers?? How much could I sell them for,2018-11-10 01:59:36
samsung,Problem Receiving Text Messages,2018-11-10 02:40:45
samsung,Samsung sAMOLED's 1080p vs 1440p. A closer look at pentile displays.,2018-11-10 03:42:26
samsung,Galaxy S9+ Help: auto answer,2018-11-10 04:56:41
samsung,Bixby news source,2018-11-10 05:15:14
samsung,Unofficial Leaks Of Samsung Galaxy S10,2018-11-10 06:27:43
samsung,Samsung GALAXY S8 - Vestea GROZAVA Anuntata pentru Android 9 si TOTI Utilizatorii,2018-11-10 07:02:07
samsung,Looking for buyer's advice: Getting the Samsung S8 Note vs the S9 Note,2018-11-10 07:43:55
samsung,Samsung One UI,2018-11-10 08:45:48
samsung,Samsung Galaxy Tab S4 keeps turning off randomly,2018-11-10 09:54:46
samsung,Here’s how to join the Samsung One UI beta program!!,2018-11-10 13:16:52
samsung,[Help] My J5 Prime's screen takes more than 1 minute to wake after pressing the power/home button.,2018-11-10 13:49:49
samsung,"Yesterday night I could play movies from my HDD on my Samsung TV. Today I get the message ""Not supported audio data.""",2018-11-10 15:13:13
samsung,Opinions about the upcoming Android Go phone by Samsung?,2018-11-10 15:46:07
samsung,"Current Note 9 bundle on Samsungs website question (charger, headphones, case, DeX)",2018-11-10 15:58:54
samsung,Need help,2018-11-10 16:23:58
samsung,Weird problem Samsung A8,2018-11-10 16:26:52
samsung,Forgot Pin,2018-11-10 16:58:21
samsung,Iata ce ANUNT IMPROTANT privind Samsung GALAXY S10 a fost Facut Azi de catre Samsung,2018-11-10 17:02:02
samsung,Buy UN55NU7100 or Wait for the Black Friday (Canada),2018-11-10 17:28:31
samsung,I was told Samsung phones are foldable now,2018-11-10 17:46:21
samsung,Need samsung health friends,2018-11-10 18:28:17
samsung,Is samsung pass a good way to log into my apps?,2018-11-10 18:47:36
samsung,Can't use vpn anymore. I have a galaxy a8 (2018) runing android oreo (8.0) with samsung experience 9.0. I used a vpn with the always-on vpn setting on (not from the vpn provider) and now i can't connect to any vpns beacuse of this setting and i cant turn it off beacuse it shows that i have no vpns.,2018-11-10 20:22:32
samsung,Fake Samsung gear iconx,2018-11-10 20:23:07
samsung,Hulu and Samsung 6 question.,2018-11-10 20:58:32
samsung,Ghosting/blurry/pixelated figures on samsung 4k NU6900,2018-11-10 23:44:58
samsung,One Ui Beta in Canada..?,2018-11-10 23:57:24
samsung,Replacement spen for tab s4,2018-11-11 00:00:08
samsung,Samsung NU7100 Restarts/crashes?,2018-11-11 00:00:12
samsung,Read recipts with Samsung's messages app,2018-11-11 00:06:10
samsung,Q9fn,2018-11-11 00:25:48
samsung,ONE UI icons,2018-11-11 00:40:22
samsung,Samsung Gear S3 Frontier vs Samsung Galaxy Smartwatch This Black Friday?,2018-11-11 03:10:03
samsung,Galaxy S9+ can't take RAW long-exposures.,2018-11-11 04:06:21
samsung,Dark mode any samsung,2018-11-11 04:15:21
samsung,Just got my S9+. I love it but the wall adapter is beeping when its plugged into the Samsung wireless charging dock. Its driving me nuts,2018-11-11 04:23:53
samsung,Samsung running IOS could save apple and smartphone market,2018-11-11 05:12:45
samsung,Yet Another “Making the Switch” Post: I have questions,2018-11-11 06:49:31
samsung,How do I make playlists on my computer then transfer them to the Samsung Music app?,2018-11-11 07:49:32
samsung,I need opinion on Samsung TV,2018-11-11 08:47:00
samsung,oneplus 6t or note 9 for 50-100 bucks more ?,2018-11-11 11:37:55
samsung,Samsung Keyboard prediction not working. Please help (Details in comments),2018-11-11 13:35:41
samsung,"Just purchased a new Samsung q6f. Using the universal remote to control my cable box and Apple TV 4K. Does anybody have a list of buttons/actions for Apple TV? Also, I’m able to control my cable box(Cin Bell Fioptics), but can’t figure out how to turn the box on and off. Any ideas?",2018-11-11 13:47:53
samsung,Samsung pay fingerprint and pin not working so I cant pay for anything. How do I fix this?,2018-11-11 15:59:23
samsung,Is it a good choice to buy a Samsung tablet? Will my purchased games from iPhone be transferred to Samsung? Thanks!,2018-11-11 16:03:27
samsung,After taking a short 6 week break and using an iPhone XS Max I’m switching back to the Note9 + Galaxy Watch (smaller) today.,2018-11-11 16:21:32
samsung,Touchscreen Issue,2018-11-11 16:58:05
samsung,3 (+1) questions for Galaxy A8 2018 owners here.,2018-11-11 17:22:56
samsung,Samsung Q7 trouble updating app,2018-11-11 17:54:14
samsung,"Samsung to release the Foldable phone in the first half of 2019, will make over one million units",2018-11-11 18:05:09
samsung,Is There Something Wrong With Samsung Batteries?,2018-11-11 18:08:53
samsung,S9 bundles?,2018-11-11 18:26:04
samsung,multiple images on lock screen,2018-11-11 18:48:32
samsung,Samsung galaxy J3 keeps reseting only when I play games,2018-11-11 20:37:15
samsung,Does anyone know of a good privacy case with camera sliders?,2018-11-11 23:19:46
samsung,"I added some events to my samsung calendar and I found out that you could add cool stickers. So I did. But when I tried to add an event for the next month, i couldn't. The ""sticker"" symbol was just gone. I really want to add sticker to my events...",2018-11-12 01:03:33
samsung,Free application for screen mirroring from Samsung Galaxy S5 to a Fuego Smart TV (without cables or any hardware)?,2018-11-12 02:49:33
samsung,Android System is killing my battery; can I fix this?,2018-11-12 03:06:15
samsung,Anybody know how to get samsung one UI on s9 + beta version in Canada?,2018-11-12 03:33:18
samsung,Anybody know how to get samsung one UI on s9 + beta version in Canada?,2018-11-12 03:43:16
samsung,Samsung Micro Sd Card Not Functioning,2018-11-12 03:59:42
samsung,"New Smartwatch for 2018 holidays, looking to shop Samsung!",2018-11-12 04:52:26
samsung,Samsung HW-K850 Soundbar issues.,2018-11-12 05:19:11
samsung,Samsung GALAXY X - Decizia RADICALA Anuntata de catre Presedintele Companiei,2018-11-12 07:30:52
samsung,"Samsung W2019 Android Flip Phone With Dual Super AMOLED Displays, Side-Mounted Fingerprint Sensor Launched: Specifications, Features - TechMasair",2018-11-12 08:02:16
samsung,"Samsung to launch its first Foldable Phone in March, may cost around $1,770",2018-11-12 09:29:47
samsung,HOUSSES SAMSUNG GALAXY A8 2018,2018-11-12 11:18:01
samsung,"SAMSUNG W2019 Android Flip Phone With Dual Super AMOLED Displays, Specifications, Features - TechMasair",2018-11-12 11:25:07
samsung,S8 Bluetooth headphones notification disappeared,2018-11-12 11:33:40
samsung,Iata ce Veste PROASTA privind Samsung GALAXY S10 a fost Anuntata Astazi,2018-11-12 12:56:12
samsung,Samsung will surprise Apple with this News,2018-11-12 13:15:57
samsung,"Samsung.com login lands on ""page not available"" when I use MacOS",2018-11-12 13:53:25
samsung,Samsung Launched W2019 With Dual Screen,2018-11-12 14:00:58
samsung,Cloudy morning. Dew. Recording with Samsung J5 2017 (Full HD 1920 x 1080 30fps),2018-11-12 14:17:52
samsung,"Samsung GALAXY F. PRETUL si DATA de LANSARE, au fost Dezvaluite in mod OFICIAL",2018-11-12 14:19:08
samsung,Top 10 Samsung Best Smartphones in 2018-19 | You Should Buy !,2018-11-12 14:47:02
samsung,Samsung S3 restarting,2018-11-12 15:37:15
samsung,"Samsung Infinity Flex Display is only a snippet of what the future holds. But if you missed it, here’s what went down at #SDC18 in San Francisco. Samsung Mobile Learn more: http://smsng.co/oneUI_y",2018-11-12 15:41:20
samsung,Samsung Foldable Smartphone Launched in March 2019,2018-11-12 15:50:42
samsung,samsung+ 11.2.1 and tab s3 (sm-t820),2018-11-12 16:07:49
samsung,Samsung USB Driver Download for Mobile Phones,2018-11-12 17:39:24
samsung,How can i get my phone agenda back?,2018-11-12 18:33:42
samsung,Samsung S10 - Dual sim,2018-11-12 19:44:44
samsung,Samsung Music Is Impossible!!,2018-11-12 20:47:27
samsung,Samsung Foldable Galaxy Phone is the most expensive phone ever!,2018-11-12 20:54:41
samsung,Samsung cloud - pictures blurry and can't download,2018-11-13 00:56:05
samsung,I’m upgrading my iPhone 8 in about 1 week.,2018-11-13 01:50:40
samsung,Why do Galaxy phones have crappy front camera quality?,2018-11-13 04:38:53
samsung,"Every day for the past week, my smart TV has been disconnecting from the wifi. Is there a solution for this?",2018-11-13 05:40:51
samsung,"Samsung GALAXY X. OFICIAL, Design-ul REAL a fost ASCUNS, cum ar ARATA in Realitate (VIDEO)",2018-11-13 06:02:37
samsung,Cable Chargeur pour Samsung Galaxy A8 2018,2018-11-13 06:22:56
samsung,My Samsung Gear S3 is acting up,2018-11-13 06:59:37
samsung,"My mother bought this Samsung Galaxy SII not long after my 11th birthday. After early seven years later, and I am currently almost eighteen, this phone still charges up to 100 per cent with the original battery.",2018-11-13 07:05:20
samsung,Samsung GALAXY S10 - Schimbare IMPORTANTA pentru a Implementa o Baterie URIASA,2018-11-13 07:27:20
samsung,"This Samsung Galaxy S2 was bought by my mother not long after my eleventh birthday nearly seven years ago. Now, the phone still charges up to 100% with the original battery.",2018-11-13 07:35:51
samsung,Samsung TV's line up + r/bullshitadvertising,2018-11-13 08:10:07
samsung,samsung is claiming to deliver 1 million foldable phones in 2019,2018-11-13 10:03:47
