subreddit,title,timestamp
samsung,Samsung Premium Care is Broken for some Customers,2018-10-15 00:02:14
samsung,For people that have switched from Apple to Samsung..,2018-10-15 01:01:44
samsung,People who switched from iPhone to Samsung,2018-10-15 01:50:03
samsung,Buy new Samsung Galaxy J6+ Red version and download Nova Prime Laumcher. What do you think? Awesome?,2018-10-15 02:03:55
samsung,Samsung S7 Edge Unlock,2018-10-15 02:20:23
samsung,My first and last time with Samsung,2018-10-15 04:01:20
samsung,Samsung Insights Program,2018-10-15 05:45:44
samsung,Samsung MST feature only on Samsung Pay?,2018-10-15 08:11:03
samsung,Samsung Foldable Phone All Set to bring to The Market,2018-10-15 08:30:17
samsung,"So, did the 4x Fun event take place?",2018-10-15 09:11:57
samsung,"Switching back from iPhone to Samsung, best way to sync photos with macbook?",2018-10-15 09:27:47
samsung,Samsung GALAXY NOTE 10 va fi Lansat cu un Ecran MAI MARE decat cel al iPhone XS Max,2018-10-15 09:41:28
samsung,Samsung smart TV and NDLA with Popcorn time,2018-10-15 10:48:06
samsung,Samsung Galaxy Tab S4 - Apps?,2018-10-15 11:14:05
samsung,Exploding is a feature not a bug right?,2018-10-15 11:46:35
samsung,Samsung GALAXY S9 Update aduce o MARE Schimbare Pentru Telefoanele Clientilor,2018-10-15 13:29:40
samsung,Samsung Note 9 Waterproof case transpatent diving in 3 meters deepth.,2018-10-15 13:45:24
samsung,[Help] Samsung galaxy S8 screen turning on &amp; off repeatedly,2018-10-15 14:26:34
samsung,Samsung Galaxy Watch Price Drops To New Lowest Price Ever,2018-10-15 14:33:06
samsung,Help? Samsung S7 power saving mode.,2018-10-15 16:02:00
samsung,"Hey Samsung, weren't two cameras enough?",2018-10-15 16:17:26
samsung,Samsung ue40nu7120 is at a good tv?,2018-10-15 16:19:52
samsung,Would you recommend the S9 enoxys version?,2018-10-15 16:25:50
samsung,Tips and ideas for samsung dex,2018-10-15 19:21:04
samsung,Intelligent Scan,2018-10-15 19:23:44
samsung,Snap a photo - close phone - look for it later - it's gone (Note 8),2018-10-15 20:06:46
samsung,Samsung browser,2018-10-15 21:53:28
samsung,Dear Samsung,2018-10-15 23:58:59
samsung,Dear Samsung:,2018-10-16 00:20:31
samsung,S9+ super slow recording. Why is there a 0.4sec limit?,2018-10-16 00:54:36
samsung,Samsung Translation WTF,2018-10-16 01:50:14
samsung,"Note 9. Samsung unlocked phones in general, voicemail recommendations.",2018-10-16 01:52:23
samsung,Fix for Samsung Smart TV not connecting to your home wifi when every other device connects just fine.,2018-10-16 02:12:38
samsung,Fast Charge vs. Quick Charge (Qualcomm QC2/3) on Samsung phones (S7 and up).,2018-10-16 02:49:50
samsung,"Disabling ""converting to multimedia message..."" message",2018-10-16 02:59:04
samsung,Samsung TV (ln-s4051d) turning off randomly,2018-10-16 03:14:26
samsung,Samsung Galaxy S8 top part of my screen has dropped responding,2018-10-16 05:46:51
samsung,Save 49%off Samsung Qi Certified Fast Charge Wireless Charger Stand,2018-10-16 05:51:04
samsung,S9 and external Jack mic not working,2018-10-16 08:51:23
samsung,Samsung GALAXY Note 9 Inregistreaza Vanzari Mai MICI decat Cele ale Note 8,2018-10-16 11:06:20
samsung,The new galaxy watch really hurt and give scratches !,2018-10-16 12:19:10
samsung,samsung Q9 Qled tv,2018-10-16 12:36:13
samsung,Your view on Samsung Gear VR w/Controller (2017) SM-R325NZVAXAR (US Version w/Warranty)?,2018-10-16 14:09:28
samsung,Samsung Galaxy J7 not connecting to wifi,2018-10-16 14:24:12
samsung,Galaxy Watch STILL No Verizon LTE version? What is the deal?,2018-10-16 15:04:39
samsung,S8 or S9 for someone that is not changing phones often?,2018-10-16 15:20:38
samsung,Samsung GALAXY F are un RIVAL foarte IMPORTANT Dezvoltat de catre Compania Apple,2018-10-16 16:13:30
samsung,"I've got a samsung Galaxy J530F, which is the amoled version of the J5. Would I be able to use a normal version of the J5 TFT display when replacing the screen?",2018-10-16 16:46:46
samsung,Help needed for boot loop issue with s6 edge .,2018-10-16 17:06:02
samsung,Phone won't send messages.,2018-10-16 18:38:33
samsung,Best Stylus for Note 8 / Tab S3 / Book 10.6?,2018-10-16 18:44:23
samsung,S7 Edge+ is getting slower - any fixes?,2018-10-16 18:51:40
samsung,Samsung S9: Samsung and Google cloud settings missing (greyed out),2018-10-16 19:52:27
samsung,"Flat screen S9, S9 plus and Note 9?",2018-10-16 21:10:59
samsung,Samsung Says My Address is Invalid,2018-10-16 21:27:04
samsung,Updates on S3 Watches,2018-10-16 21:29:41
samsung,Amazon Video not working in Canada on Bluray player,2018-10-17 00:04:55
samsung,"Samsung phone does not connect to computer, only charges",2018-10-17 00:44:27
samsung,Save 27%off Samsung Gear S3 Frontier Smartwatch (Bluetooth),2018-10-17 01:07:28
samsung,How to Export Spotify Playlists to Samsung Tablet Series,2018-10-17 05:43:57
samsung,How to stream to an older Samsung smart tv?,2018-10-17 06:19:37
samsung,Prediction for s10,2018-10-17 06:20:18
samsung,Samsung Gear S3 Battery Issues (Frontier),2018-10-17 06:36:36
samsung,help me fins the samsung songs,2018-10-17 09:16:44
samsung,Samsung creator contest - concept,2018-10-17 09:22:13
samsung,Samsung DM65E-BC 65 Inch display with Touch and Whiteboard,2018-10-17 10:45:17
samsung,How to use A6+ dual camera,2018-10-17 11:27:59
samsung,"Advice/Opinion on Samsung Galaxy A5, fast or not?",2018-10-17 14:24:04
samsung,Samsung: Warranty Gone Terribly Wrong,2018-10-17 16:20:07
samsung,"Did the Samsung Galaxy Note9 sell better than the new iPhones? Best Buy data says yes, for now [News]",2018-10-17 16:23:41
samsung,Recovering data on a samsung S7,2018-10-17 16:24:30
samsung,Samsung GALAXY S10 NU va Prelua Schimbarea PROASTA din Telefoanele iPhone XS,2018-10-17 16:35:51
samsung,Iphone sends me weird messages. Why? (I have a samsung galaxy s8),2018-10-17 16:47:23
samsung,What's with samsung earphones stop working after a few months of use?,2018-10-17 20:25:02
samsung,My samsung galaxy J7 sky ignores the Screen timeout setting,2018-10-17 20:46:54
samsung,Review of Samsung IG935 Earphones,2018-10-17 21:00:54
samsung,"Seriously, Samsung, I don't need another voice assistant",2018-10-18 01:36:23
samsung,Got an email from Samsung yesterday stating they got the screen to repair my phone. Any idea how long it will take them to fix and mail it back to me? I have a flight next saturday.,2018-10-18 02:06:23
samsung,Can you notice your Samsung phone battery life decrease just from simply using WQHD+ instead of FHD+?,2018-10-18 02:13:47
samsung,Is there a way to anonymously make a Samsung TV buffer from my Galaxy S8? I wanna mess with this guy.,2018-10-18 02:50:56
samsung,Shoud I buy Gear S3 Frontier,2018-10-18 03:41:58
samsung,Samsung S9 vertical and horizontal lines,2018-10-18 05:35:24
samsung,Save 39% off Samsung Qi Certified Fast Charge Wireless Charger Stand,2018-10-18 06:19:56
samsung,Samsung s3 classic and frontier,2018-10-18 08:12:27
samsung,Best Deals on Samsung Note9,2018-10-18 10:41:36
samsung,Iata ce Noutati SECRETE ale Android 9 pentru Samsung GALAXY Note 9 au fost Descoperite (VIDEO),2018-10-18 11:49:53
samsung,Samsung Gear S3 question,2018-10-18 14:34:24
samsung,MLB TV not available for download on Samsung Smart TV?,2018-10-18 15:19:20
samsung,looking for info on Samsung Galaxy Watches,2018-10-18 16:30:05
samsung,Note 9 Won't Wirelessly Charge with Burkley Leather Case,2018-10-18 16:30:07
samsung,how do i root my tablet,2018-10-18 16:33:01
samsung,Need a new messaging app,2018-10-18 16:37:25
samsung,Samsung DeX Pad is 30% off,2018-10-18 16:59:51
samsung,LTE issues,2018-10-18 17:04:21
samsung,"Save 30% on Samsung DeX Pad Desktop Experience for Samsung Galaxy Note8, GS8, GS8+, GS9, and GS9+ W/Fast Charge USB-C Wall Charger (US Version with Warranty)",2018-10-18 17:07:08
samsung,Anyone that hasn't used samsung pay help? Just need to add a card and use this promo code! Dont need to use the app at all just add the card! Any help would be greatly appreciated:) *note it's for samsung elite app*,2018-10-18 17:13:34
samsung,"hi! switching carries, need new phone, have a question!",2018-10-18 17:59:45
samsung,Samsung GALAXY S10: ASA va fi Integrat NOUL Cititor de Amprente in Ecranul Telefonului,2018-10-18 18:13:16
samsung,Samsung will not repair brand new monitor,2018-10-18 20:13:40
samsung,"When charging my Samsung S7 Edge, the rose gold rim becomes charged.",2018-10-18 20:35:56
samsung,Pictures from Samsung Camera on Mac,2018-10-18 20:51:57
samsung,Samsung s9+ issues,2018-10-18 21:45:54
samsung,Samsung Galaxy S8 - Buyer Beware!,2018-10-19 00:41:33
samsung,Samsung pay won't work on my gear s3 frontier,2018-10-19 01:51:06
samsung,How to hard reset a Samsung Flight II without password?,2018-10-19 01:59:12
