subreddit,title,timestamp
samsung,Samsung note ui changes,2018-10-11 15:51:33
samsung,Ahhh Samsung,2018-10-11 16:16:22
samsung,Samsung Galaxy A9 World’s 1st Smartphone With 4 Rear Cameras,2018-10-11 16:31:45
samsung,Clearly not notified,2018-10-11 16:34:37
samsung,Need help trying to track Samsung Galaxy S8,2018-10-11 16:50:54
samsung,Samsung Galaxy S10 Art Design is Breathtaking - Beautiful New Concept,2018-10-11 17:08:08
samsung,Samsung Galaxy A9 2018 is the World’s First Phone With 4 Rear Cameras,2018-10-11 17:30:39
samsung,Samsung a IRONIZAT DUR Compania Google dupa LANSAREA Seriei de Telefoane Pixel 3,2018-10-11 17:47:15
samsung,Little jab from Samsung about Google's new pixel phone having a notch.,2018-10-11 17:47:29
samsung,Samsung Double-your-Trade-In-Value Promo clarification,2018-10-11 17:56:40
samsung,Samsung Galaxy Note 9,2018-10-11 18:54:14
samsung,I won a free wireless charger using Samsung Pay points!,2018-10-11 19:11:02
samsung,Galaxy GT-P7500 Tablet custom firmware?,2018-10-11 19:14:46
samsung,Please tell me this isn't true...,2018-10-11 20:05:13
samsung,Groupme app giving error on Samsung mini 3,2018-10-11 20:11:04
samsung,How to make picture size smaller on smart TV?,2018-10-11 20:14:07
samsung,AT&amp;T Galaxy S8 stuck on Android 7.0,2018-10-11 21:26:03
samsung,Samsung Health serving me skin care ads??,2018-10-11 22:13:53
samsung,Samsung Galaxy S9 removes widgets when my phone ia restarted. And other issues.,2018-10-11 22:21:15
samsung,"Samsung Galaxy A9, The First Smartphone With Four Cameras on the back",2018-10-11 22:37:18
samsung,Do not purchase third party quick chargers for Samsung devices. (Explanation in comments),2018-10-11 23:14:21
samsung,I can't find Smart Manager on my Samsung Galaxy J7 V. Is it there? What takes its place if it's not?,2018-10-12 00:37:24
samsung,Will my phone qualify for double trade value?,2018-10-12 02:47:41
samsung,"I laugh every time people say Samsung phones are crappy, but they are the company that are not following the trends",2018-10-12 05:35:25
samsung,LED indicator problems,2018-10-12 06:27:04
samsung,Samsung says its foldable phone is also a tablet that fits in your pocket - The Verge,2018-10-12 10:54:32
samsung,Software!,2018-10-12 11:20:58
samsung,Samsung USA store Terrible customer service,2018-10-12 13:07:12
samsung,Can I get a battery replacement for my S6 at an official samsung store?,2018-10-12 13:29:52
samsung,Samsung W2019 images appeared on TENAA,2018-10-12 13:38:28
samsung,need help with my s8.,2018-10-12 13:56:19
samsung,Samsung TV: Autorun Last App doesn't reload YouTube TV app automatically,2018-10-12 14:26:32
samsung,DO NOT REMOVE THE HEADPHONE JACK PLEASE!,2018-10-12 14:59:43
samsung,"Samsung Galaxy A9 (2018) with 4 Rear Camera, Snapdragon 660 processor and 3,800mAh battery launched, Price and Availability Revealed",2018-10-12 15:22:24
samsung,"Samsung Galaxy Note9 Factory Unlocked Phone with 6.4"" Screen and 128GB (U.S. Warranty), Ocean Blue at lowest price ever",2018-10-12 15:24:05
samsung,Samsung GALAXY Note 9 UMILESTE iPhone XS Max in Testul Autonomiei Bateriei (VIDEO),2018-10-12 15:34:49
samsung,Samsung mobile app sucks!,2018-10-12 15:46:24
samsung,Podcast on Samsung Tv,2018-10-12 16:25:19
samsung,How do I delete the address for a single website that keep showing up in the IE search bar on my Samsung S5,2018-10-12 17:55:31
samsung,Is Samsung Galaxy A8 Plus Water-Proof????,2018-10-12 18:39:48
samsung,Has anyone here tried making a switch from Google Keep to Samsung Notes?,2018-10-12 18:48:43
samsung,Samsung Licenses 5G Polar Coding Technology Developed by UC San Diego Engineers,2018-10-12 22:44:47
samsung,"[Samsung Galaxy Note 9 and DeX] Sharing and comparing experiences, tips, app-recommendations and complaints",2018-10-12 22:56:50
samsung,Help with Samsung Music App,2018-10-12 23:21:17
samsung,Is there a way I can get higher than android 8.0.0 on my samsung galaxy s9? Any suggestions or is it possible?,2018-10-13 01:31:21
samsung,Netflix Issues,2018-10-13 01:35:28
samsung,Does Samsung does its double trade value deal more than once?,2018-10-13 03:53:48
samsung,Samsung GALAXY Phoenix este Raspunsul Companiei Samsung pentru Telefonul iPhone XR,2018-10-13 06:41:54
samsung,Samsung Launched The World’s First Smartphone With 4 Cameras,2018-10-13 06:54:49
samsung,Samsung music app had a glitch. I think im in love,2018-10-13 07:25:40
samsung,New to samsung themes.. need help,2018-10-13 08:35:03
samsung,I'm looking at getting a new phone and the Note 9 caught my eye however as next year will be the Note 10 are people expecting this to have some huge changes and be a significant upgrade due to being a big anniversary for the phone?,2018-10-13 11:06:10
samsung,Galaxy S9 Plus 5 months Later After The Buzz Review 9just Being Honest),2018-10-13 13:21:24
samsung,Photo auto filter comparison (note 9) Google photos vs Samsung photo editor,2018-10-13 15:10:40
samsung,Ads appearing on my samsung s9,2018-10-13 15:13:48
samsung,Way to delete samsung pre installed apps?,2018-10-13 15:25:14
samsung,I won? Holy crap i won a Samsung pay prize!,2018-10-13 15:26:51
samsung,I finally figured it how to disable Bixby! THANK YOU SAMSUNG!,2018-10-13 16:22:33
samsung,Last week i connected to VPN(USA) and got this update from Nougat on my J5Pro.😍 Samsung Experience is so much smoother than shitty TouchWiz.. P.S- I'm from Asia.,2018-10-13 17:04:13
samsung,"Long time Apple user looking to get a Samsung phone for the first time, any recommendations?",2018-10-13 17:27:54
samsung,What sound settings do you use on your Samsung phone?,2018-10-13 17:42:54
samsung,Apps randomly crashing.,2018-10-13 18:19:48
samsung,Easy free $5.00 and 2500 points linking Paypal to Samsung Pay,2018-10-13 19:16:11
samsung,Samsung Galaxy S10 Review | Inbox Therapy,2018-10-13 19:57:12
samsung,Question about this $300 off trade-in deal,2018-10-13 19:59:23
samsung,Is there any differences between the Samsung fast wireless chargers?,2018-10-13 21:27:33
samsung,Samsung Galaxy S7 Edge died over night?,2018-10-13 22:43:46
samsung,[HELP] Samsung Galaxy S5 Neo won't start,2018-10-13 23:36:55
samsung,Samsung Galaxy Note 9: Possible to get stock Android on it?,2018-10-13 23:48:42
samsung,"Full screen S8, S9 and Note 9 Tutorial (Please upvote so others can see)",2018-10-13 23:59:54
samsung,"My Galaxy S6 Edge not charging, wirelessly or otherwise",2018-10-14 01:19:40
samsung,Anyone have a tablet,2018-10-14 01:50:38
samsung,Gear s3 sturdy enough?,2018-10-14 03:37:53
samsung,Samsung Galaxy Tab A youtube app question.,2018-10-14 03:50:14
samsung,Samsung Foldable Phone will be a Tablet That fits in the Pocket,2018-10-14 04:54:10
samsung,How do i get rid of the samsung pay thing at the bottom of my screen?,2018-10-14 05:38:27
samsung,"Question about my Samsung Galaxy s9 repair, at repair center. Long post.",2018-10-14 06:14:11
samsung,A7 auto brightness not working properly,2018-10-14 07:53:58
samsung,"Pretty awesome battery life I must say. Samsung Galaxy A5 2017, using dark theme to safe battery",2018-10-14 08:53:58
samsung,How could i sync Samsung Internet with Firefox?,2018-10-14 09:20:30
samsung,Samsung GALAXY S10 va fi ULTIMUL din Seria de Telefoane care mai vine cu o Functie SPECIALA,2018-10-14 10:09:10
samsung,"Ive been seeing all these samsung pay prizes and i was wondering, how do i do that? I cant find anything to do wuth prizes or points",2018-10-14 12:03:08
samsung,"[Help] Samsung galaxy a5 2016 ""Link you copied"" in Chrome",2018-10-14 12:19:49
samsung,"Samsung UN65NU8500 Curved 65"" 4K UHD 8 Series Smart LED TV (2018) Is On Sale At Lowest Price Ever",2018-10-14 13:24:21
samsung,Samsung NU8000 wi-fi issue,2018-10-14 13:41:20
samsung,Recover deleted texts,2018-10-14 13:45:36
samsung,Does Gear 360 legitimately work without a Samsung smart phone?,2018-10-14 13:57:32
samsung,The Samsung galaxy Note 9....Have a lot at it,2018-10-14 14:11:44
samsung,Should I upgrade?,2018-10-14 14:40:34
samsung,My Samsung Smart TV takes five minutes to “prepare TV” for streaming.,2018-10-14 16:03:11
samsung,Can Samsung Smart View be used to mirror a phone screen to a PC?,2018-10-14 16:05:52
samsung,Who's excited about Pie?,2018-10-14 17:13:24
samsung,Samsung UE40J6282 - change subtitle color on usb,2018-10-14 18:17:14
samsung,Would you like to see Galaxy S10 and all the new Samsung phones run Stock Android?,2018-10-14 19:20:16
samsung,Samsung DeX wont unlock,2018-10-14 20:26:36
samsung,What are your favorite cases?,2018-10-14 22:52:38
samsung,Can you get Apple Music on a Samsung Note?,2018-10-14 23:31:38
samsung,Samsung s9 cases,2018-10-15 00:02:06
samsung,Samsung Premium Care is Broken for some Customers,2018-10-15 00:02:14
samsung,For people that have switched from Apple to Samsung..,2018-10-15 01:01:44
samsung,People who switched from iPhone to Samsung,2018-10-15 01:50:03
samsung,Buy new Samsung Galaxy J6+ Red version and download Nova Prime Laumcher. What do you think? Awesome?,2018-10-15 02:03:55
samsung,Samsung S7 Edge Unlock,2018-10-15 02:20:23
samsung,My first and last time with Samsung,2018-10-15 04:01:20
samsung,Samsung Insights Program,2018-10-15 05:45:44
samsung,Samsung MST feature only on Samsung Pay?,2018-10-15 08:11:03
samsung,Samsung Foldable Phone All Set to bring to The Market,2018-10-15 08:30:17
samsung,"So, did the 4x Fun event take place?",2018-10-15 09:11:57
samsung,"Switching back from iPhone to Samsung, best way to sync photos with macbook?",2018-10-15 09:27:47
samsung,Samsung GALAXY NOTE 10 va fi Lansat cu un Ecran MAI MARE decat cel al iPhone XS Max,2018-10-15 09:41:28
samsung,Samsung smart TV and NDLA with Popcorn time,2018-10-15 10:48:06
samsung,Samsung Galaxy Tab S4 - Apps?,2018-10-15 11:14:05
samsung,Exploding is a feature not a bug right?,2018-10-15 11:46:35
samsung,Samsung GALAXY S9 Update aduce o MARE Schimbare Pentru Telefoanele Clientilor,2018-10-15 13:29:40
samsung,Samsung Note 9 Waterproof case transpatent diving in 3 meters deepth.,2018-10-15 13:45:24
samsung,[Help] Samsung galaxy S8 screen turning on &amp; off repeatedly,2018-10-15 14:26:34
samsung,Samsung Galaxy Watch Price Drops To New Lowest Price Ever,2018-10-15 14:33:06
samsung,Help? Samsung S7 power saving mode.,2018-10-15 16:02:00
samsung,"Hey Samsung, weren't two cameras enough?",2018-10-15 16:17:26
samsung,Samsung ue40nu7120 is at a good tv?,2018-10-15 16:19:52
samsung,Would you recommend the S9 enoxys version?,2018-10-15 16:25:50
samsung,Tips and ideas for samsung dex,2018-10-15 19:21:04
samsung,Intelligent Scan,2018-10-15 19:23:44
samsung,Snap a photo - close phone - look for it later - it's gone (Note 8),2018-10-15 20:06:46
samsung,Samsung browser,2018-10-15 21:53:28
samsung,Dear Samsung,2018-10-15 23:58:59
samsung,Dear Samsung:,2018-10-16 00:20:31
samsung,S9+ super slow recording. Why is there a 0.4sec limit?,2018-10-16 00:54:36
samsung,Samsung Translation WTF,2018-10-16 01:50:14
samsung,"Note 9. Samsung unlocked phones in general, voicemail recommendations.",2018-10-16 01:52:23
samsung,Fix for Samsung Smart TV not connecting to your home wifi when every other device connects just fine.,2018-10-16 02:12:38
samsung,Fast Charge vs. Quick Charge (Qualcomm QC2/3) on Samsung phones (S7 and up).,2018-10-16 02:49:50
samsung,"Disabling ""converting to multimedia message..."" message",2018-10-16 02:59:04
samsung,Samsung TV (ln-s4051d) turning off randomly,2018-10-16 03:14:26
samsung,Samsung Galaxy S8 top part of my screen has dropped responding,2018-10-16 05:46:51
samsung,Save 49%off Samsung Qi Certified Fast Charge Wireless Charger Stand,2018-10-16 05:51:04
samsung,S9 and external Jack mic not working,2018-10-16 08:51:23
samsung,Samsung GALAXY Note 9 Inregistreaza Vanzari Mai MICI decat Cele ale Note 8,2018-10-16 11:06:20
samsung,The new galaxy watch really hurt and give scratches !,2018-10-16 12:19:10
samsung,samsung Q9 Qled tv,2018-10-16 12:36:13
samsung,Your view on Samsung Gear VR w/Controller (2017) SM-R325NZVAXAR (US Version w/Warranty)?,2018-10-16 14:09:28
samsung,Samsung Galaxy J7 not connecting to wifi,2018-10-16 14:24:12
samsung,Galaxy Watch STILL No Verizon LTE version? What is the deal?,2018-10-16 15:04:39
samsung,S8 or S9 for someone that is not changing phones often?,2018-10-16 15:20:38
samsung,Samsung GALAXY F are un RIVAL foarte IMPORTANT Dezvoltat de catre Compania Apple,2018-10-16 16:13:30
samsung,"I've got a samsung Galaxy J530F, which is the amoled version of the J5. Would I be able to use a normal version of the J5 TFT display when replacing the screen?",2018-10-16 16:46:46
samsung,Help needed for boot loop issue with s6 edge .,2018-10-16 17:06:02
samsung,Phone won't send messages.,2018-10-16 18:38:33
samsung,Best Stylus for Note 8 / Tab S3 / Book 10.6?,2018-10-16 18:44:23
samsung,S7 Edge+ is getting slower - any fixes?,2018-10-16 18:51:40
samsung,Samsung S9: Samsung and Google cloud settings missing (greyed out),2018-10-16 19:52:27
samsung,"Flat screen S9, S9 plus and Note 9?",2018-10-16 21:10:59
samsung,Samsung Says My Address is Invalid,2018-10-16 21:27:04
samsung,Updates on S3 Watches,2018-10-16 21:29:41
samsung,Amazon Video not working in Canada on Bluray player,2018-10-17 00:04:55
samsung,"Samsung phone does not connect to computer, only charges",2018-10-17 00:44:27
samsung,Save 27%off Samsung Gear S3 Frontier Smartwatch (Bluetooth),2018-10-17 01:07:28
samsung,How to Export Spotify Playlists to Samsung Tablet Series,2018-10-17 05:43:57
samsung,How to stream to an older Samsung smart tv?,2018-10-17 06:19:37
samsung,Prediction for s10,2018-10-17 06:20:18
samsung,Samsung Gear S3 Battery Issues (Frontier),2018-10-17 06:36:36
samsung,help me fins the samsung songs,2018-10-17 09:16:44
samsung,Samsung creator contest - concept,2018-10-17 09:22:13
samsung,Samsung DM65E-BC 65 Inch display with Touch and Whiteboard,2018-10-17 10:45:17
samsung,How to use A6+ dual camera,2018-10-17 11:27:59
samsung,"Advice/Opinion on Samsung Galaxy A5, fast or not?",2018-10-17 14:24:04
samsung,Samsung: Warranty Gone Terribly Wrong,2018-10-17 16:20:07
samsung,"Did the Samsung Galaxy Note9 sell better than the new iPhones? Best Buy data says yes, for now [News]",2018-10-17 16:23:41
samsung,Recovering data on a samsung S7,2018-10-17 16:24:30
samsung,Samsung GALAXY S10 NU va Prelua Schimbarea PROASTA din Telefoanele iPhone XS,2018-10-17 16:35:51
samsung,Iphone sends me weird messages. Why? (I have a samsung galaxy s8),2018-10-17 16:47:23
samsung,What's with samsung earphones stop working after a few months of use?,2018-10-17 20:25:02
samsung,My samsung galaxy J7 sky ignores the Screen timeout setting,2018-10-17 20:46:54
samsung,Review of Samsung IG935 Earphones,2018-10-17 21:00:54
samsung,"Seriously, Samsung, I don't need another voice assistant",2018-10-18 01:36:23
samsung,Got an email from Samsung yesterday stating they got the screen to repair my phone. Any idea how long it will take them to fix and mail it back to me? I have a flight next saturday.,2018-10-18 02:06:23
samsung,Can you notice your Samsung phone battery life decrease just from simply using WQHD+ instead of FHD+?,2018-10-18 02:13:47
samsung,Is there a way to anonymously make a Samsung TV buffer from my Galaxy S8? I wanna mess with this guy.,2018-10-18 02:50:56
samsung,Shoud I buy Gear S3 Frontier,2018-10-18 03:41:58
samsung,Samsung S9 vertical and horizontal lines,2018-10-18 05:35:24
samsung,Save 39% off Samsung Qi Certified Fast Charge Wireless Charger Stand,2018-10-18 06:19:56
samsung,Samsung s3 classic and frontier,2018-10-18 08:12:27
samsung,Best Deals on Samsung Note9,2018-10-18 10:41:36
samsung,Iata ce Noutati SECRETE ale Android 9 pentru Samsung GALAXY Note 9 au fost Descoperite (VIDEO),2018-10-18 11:49:53
samsung,Samsung Gear S3 question,2018-10-18 14:34:24
samsung,MLB TV not available for download on Samsung Smart TV?,2018-10-18 15:19:20
samsung,looking for info on Samsung Galaxy Watches,2018-10-18 16:30:05
samsung,Note 9 Won't Wirelessly Charge with Burkley Leather Case,2018-10-18 16:30:07
samsung,how do i root my tablet,2018-10-18 16:33:01
samsung,Need a new messaging app,2018-10-18 16:37:25
samsung,Samsung DeX Pad is 30% off,2018-10-18 16:59:51
samsung,LTE issues,2018-10-18 17:04:21
samsung,"Save 30% on Samsung DeX Pad Desktop Experience for Samsung Galaxy Note8, GS8, GS8+, GS9, and GS9+ W/Fast Charge USB-C Wall Charger (US Version with Warranty)",2018-10-18 17:07:08
samsung,Anyone that hasn't used samsung pay help? Just need to add a card and use this promo code! Dont need to use the app at all just add the card! Any help would be greatly appreciated:) *note it's for samsung elite app*,2018-10-18 17:13:34
samsung,"hi! switching carries, need new phone, have a question!",2018-10-18 17:59:45
samsung,Samsung GALAXY S10: ASA va fi Integrat NOUL Cititor de Amprente in Ecranul Telefonului,2018-10-18 18:13:16
samsung,Samsung will not repair brand new monitor,2018-10-18 20:13:40
samsung,"When charging my Samsung S7 Edge, the rose gold rim becomes charged.",2018-10-18 20:35:56
samsung,Pictures from Samsung Camera on Mac,2018-10-18 20:51:57
samsung,Samsung s9+ issues,2018-10-18 21:45:54
samsung,Samsung Galaxy S8 - Buyer Beware!,2018-10-19 00:41:33
samsung,Samsung pay won't work on my gear s3 frontier,2018-10-19 01:51:06
samsung,How to hard reset a Samsung Flight II without password?,2018-10-19 01:59:12
samsung,IMPORTANT QUESTION,2018-10-19 03:40:03
samsung,"New to Samsung, need help",2018-09-30 16:06:08
samsung,"Samsung service center told me this is normal because note 9 captures ""large amount of light""",2018-09-30 16:13:11
samsung,Samsung Galaxy s8+ Burn in Advice,2018-09-30 16:25:52
samsung,Can someone help clarify Note 9 in terms of CDMA vs GSM? Specifics below.,2018-09-30 17:19:19
samsung,"AirPods on Android/Samsung, do you lose sound quality?",2018-09-30 18:32:08
samsung,Disable Bixby on Samsung Experience 10?,2018-09-30 20:01:39
samsung,Samsung s9 plus and note 9 reception,2018-09-30 20:49:09
samsung,Anyone know how to change the vacuum tubes in the Samsung DA-E750 audio dock?,2018-09-30 21:18:26
samsung,Am I able to add an amazon gift card to my samsung pay account?,2018-09-30 22:43:56
samsung,Samsung s8/s9 region lock on custom flashed android?,2018-09-30 23:06:45
samsung,Where do pdf files get saved on the samsung S9 and how do I delete them?,2018-10-01 01:17:39
samsung,Save 10% with coupon on Samsung Gear S3 Frontier Bluetooth Watch with Built-in GPS Dark Gray (SM-R760NDAAXAR) with Wireless Charger Bundle + Wrist Band Silver + 1 Year Extended Warranty,2018-10-01 02:48:21
samsung,Themes now unusable,2018-10-01 06:44:53
samsung,What is the best Samsung to get right now that is cheap in price?,2018-10-01 06:54:53
samsung,Samsung NU7100 Series 7 Smart TV Timeshift (in Australia),2018-10-01 07:38:34
samsung,Get Samsung Galaxy S8 Plus Mobile Phone Accessories Online in the UK,2018-10-01 08:58:30
samsung,Get Samsung Galaxy Note 7 Mobile Phone Accessories Online in the UK,2018-10-01 09:10:50
samsung,Samsung GALAXY S10 si Huawei MATE 20 Pro vor fi mai SLABE decat iPhone XS si XS Max,2018-10-01 09:43:40
samsung,S7 stuck on samsung logo during boot,2018-10-01 10:12:21
samsung,How does the Galaxy watch work with apps?,2018-10-01 10:57:50
samsung,Te most popular Samsung Smartphone at the moment...,2018-10-01 11:03:59
samsung,Is there a way to get the default Samsung Message app to work on a computer too? Can you run it though a browser?,2018-10-01 11:19:19
samsung,Facing issues while transferring files to laptop,2018-10-01 13:54:12
samsung,Is anyone else having this issue?,2018-10-01 14:41:43
samsung,Samsung Note 9 Delivery?,2018-10-01 15:24:04
samsung,My experience with the Note 9 so far.,2018-10-01 16:11:41
samsung,"What's the earliest samsung phone with fastcharge support, micro sd support and replaceable battery?",2018-10-01 16:33:29
samsung,Best OLED displays in the market,2018-10-01 16:56:02
samsung,SAMSUNG GALAXY A7 2018 REVIEW HANDS ON,2018-10-01 19:10:58
samsung,Thank you so much Samsung for the great customer support!,2018-10-01 19:20:14
samsung,"Broke my S6, only have $200 to replace it",2018-10-01 19:30:46
samsung,Samsung LFD (Large Format Displays,2018-10-01 20:32:56
samsung,Samsung's customer service is a joke,2018-10-01 20:36:48
samsung,"Hey /r/samsung, do you get HDR on your Netflix app? And how does it look?",2018-10-01 21:45:49
samsung,Sidesync/Note8,2018-10-01 22:38:08
samsung,"Bought a ""un60ku6270f"" Samsung tv from Sam's Club just under 2 years ago and now no power",2018-10-01 23:22:22
samsung,Still no galaxy skin. This is ridiculous.,2018-10-01 23:42:16
samsung,Samsung Kids has a 50% off subscription promo... but no way to redeem it?,2018-10-01 23:43:23
samsung,Samsung charger is the only charger that can fast charge the device?,2018-10-02 00:44:59
samsung,Samsung Q8 Settings issues,2018-10-02 00:52:46
samsung,Help: Samsung NU7100 TV - connecting to NAS?,2018-10-02 01:01:14
samsung,Two questions. Does uber or lyft work on the galaxy watch? Is At&amp;t a compatible carrier for the watch?,2018-10-02 02:04:02
samsung,RIP Galaxy A Series (2014 - 2018),2018-10-02 02:05:01
samsung,"Samsung Tab A 8"" takes FOREVER to charge",2018-10-02 04:26:37
samsung,Samsung GALAXY Note 9 are Viteze 4G LTE care sunt SUPERIOARE celor Oferite de iPhone XS/Max,2018-10-02 05:41:44
samsung,Session expired...Processing failed?,2018-10-02 06:18:18
samsung,Un Prim Clip VIDEO Ne arata Cum s-ar puta Plia Samsung GALAXY X cu Ecranul sau Flexibil,2018-10-02 06:27:11
samsung,Samsung working to make DeX connections wireless,2018-10-02 06:48:17
samsung,"Samsung are PROBLEME foarte MARI cu Smartphone-urile, Iata ce ANUNT a fost Facut Astazi",2018-10-02 10:32:58
samsung,"Iata ce fel de Functii pot fi Activate pe Samsung GALAXY S8 la 1 an dupa Lansare, iar Apple nu Permite ceva Similar pe iPhone",2018-10-02 11:38:48
samsung,PRIMELE Specificatii pentru Samsung GALAXY S10 au fost DEZVALUITE Inaintea Lansarii,2018-10-02 12:11:46
samsung,Samsung Notes,2018-10-02 14:29:53
samsung,"Can I get some advice on which smartphone to buy (Galaxy S9, S9+, Note 9)?",2018-10-02 14:44:32
samsung,Android Version?,2018-10-02 15:16:35
samsung,SAMSUNG: How to contact the real technical support?,2018-10-02 16:30:04
samsung,"Samsung Galaxy Note9 Factory Unlocked Phone with 6.4"" Screen and 128GB, Ocean Blue with Bluetooth Cord-free Fitness Earbuds and Charger Stand - $ 929 @Amazon",2018-10-02 16:38:32
samsung,New Samsung Galaxy A7 Review 24MP+24MP 3 Back Camera Specification,2018-10-02 17:02:20
samsung,"In the Samsung health app, what does an orange dot mean on the different categories (stress, heart rate, ect)?",2018-10-02 17:08:41
samsung,Ordering Samsung Products by the internet is a JOKE!!!!!,2018-10-02 17:24:29
samsung,How to Unlock Samsung Galaxy S9 (SM-G960) and S9 (G965) For Other Netwo...,2018-10-02 17:40:59
samsung,Samsung keyboard shortcuts don't work with auto-capitalization,2018-10-02 18:30:39
samsung,Gear iconx 2018 sound unbalanced between earbuds SOLVED,2018-10-02 18:31:52
samsung,Will Gear Sport (and other older Samsung smartwatches) get update?,2018-10-02 19:52:38
samsung,Apple VS Samsung | Koreans Answer | Koreaboo Studios,2018-10-02 20:03:59
samsung,Bootloader unlock on an S9,2018-10-02 21:22:24
samsung,Strange noise when looking for source,2018-10-02 22:03:44
samsung,Samsung lanza SDK para desarrollo de terceros con el S Pen,2018-10-02 23:46:05
samsung,Major Performance Issues (sorry this is so long),2018-10-02 23:46:28
samsung,How often does Samsung change deals on their website for the S9/S9+/Note?,2018-10-03 00:22:18
samsung,"Samsung Gear Sport Smartwatch (Bluetooth), Black, SM-R600NZKAXAR – US Version with Warranty (17% off)",2018-10-03 00:25:05
samsung,Replacement Battery for Samsung Galaxy S8 Active??,2018-10-03 02:00:04
samsung,Galaxy Tab S4?,2018-10-03 02:06:22
samsung,Need help i upgraded to oreo and i don't like it how do i go back to nougat without bricking my phone?,2018-10-03 02:30:49
samsung,Just bought a galaxy tab s4 but need help with a case,2018-10-03 02:38:19
samsung,Note 9 order uk,2018-10-03 02:40:46
samsung,Unlock Samsung Galaxy S9,2018-10-03 04:37:32
samsung,"Samsung GALAXY Note 9 Ramane REGE in fata iPhone XS, dar are si Unele PUNCTE SLABE",2018-10-03 06:55:32
samsung,Has anyone been to a Samsung store to get phone fixed under warranty?,2018-10-03 08:34:51
samsung,[HELP] Replacement rubber padding for Samsung earphones,2018-10-03 09:33:14
samsung,"[Galaxy s9 plus] samsung account session ""expired""",2018-10-03 11:17:42
samsung,How To Activate HBO Go On Samsung Smart TV?,2018-10-03 11:36:48
samsung,Samsung Galaxy S10’s Leaked Cam Specs : Yes It has Triple Camera,2018-10-03 11:41:46
samsung,Disable automatic update checking for Samsung apps?,2018-10-03 12:11:38
samsung,Samsung GALAXY X ar fi GROZAV daca ar ARATA ca acest Smartphone Pliabil Sony (VIDEO),2018-10-03 12:32:14
samsung,Wrong country,2018-10-03 13:56:00
samsung,How can we add our info in samsung pass after not accepting at once?,2018-10-03 16:50:04
samsung,Samsung GALAXY S8 Asa poti Instala NOUA Interfata a Android 9 Chiar Acum (VIDEO),2018-10-03 18:28:51
samsung,Should i buy a Samsung watch? If so which one?,2018-10-03 18:46:19
samsung,Samsung shipping costs,2018-10-03 19:26:06
samsung,No Emergency Alerts without Samsung Messages?,2018-10-03 20:50:46
samsung,Should I update? What will happen?,2018-10-03 21:27:26
samsung,Why isn't samsung releasing goodlock for all the countries?,2018-10-03 21:57:13
samsung,The Samsung Note 9 Promo,2018-10-03 22:49:47
samsung,Samsung back at it again,2018-10-03 23:44:21
samsung,Thought of a Samsung joke on apple,2018-10-03 23:47:35
samsung,Samsung shipping repairs,2018-10-04 00:28:50
samsung,Galaxy Watch Issues,2018-10-04 00:32:03
samsung,My friend’s review of Samsung S9,2018-10-04 01:20:47
samsung,Samsung Galaxy Tab 3 lite SM-T110 and OTG cable,2018-10-04 01:45:31
samsung,For all the hockey lovers who also have a Samsung.,2018-10-04 02:14:56
samsung,Samsung Health Friends Add me!,2018-10-04 02:16:47
