subreddit,title,timestamp
samsung,"New to Samsung, need help",2018-09-30 16:06:08
samsung,"Samsung service center told me this is normal because note 9 captures ""large amount of light""",2018-09-30 16:13:11
samsung,Samsung Galaxy s8+ Burn in Advice,2018-09-30 16:25:52
samsung,Can someone help clarify Note 9 in terms of CDMA vs GSM? Specifics below.,2018-09-30 17:19:19
samsung,"AirPods on Android/Samsung, do you lose sound quality?",2018-09-30 18:32:08
samsung,Disable Bixby on Samsung Experience 10?,2018-09-30 20:01:39
samsung,Samsung s9 plus and note 9 reception,2018-09-30 20:49:09
samsung,Anyone know how to change the vacuum tubes in the Samsung DA-E750 audio dock?,2018-09-30 21:18:26
samsung,Am I able to add an amazon gift card to my samsung pay account?,2018-09-30 22:43:56
samsung,Samsung s8/s9 region lock on custom flashed android?,2018-09-30 23:06:45
samsung,Where do pdf files get saved on the samsung S9 and how do I delete them?,2018-10-01 01:17:39
samsung,Save 10% with coupon on Samsung Gear S3 Frontier Bluetooth Watch with Built-in GPS Dark Gray (SM-R760NDAAXAR) with Wireless Charger Bundle + Wrist Band Silver + 1 Year Extended Warranty,2018-10-01 02:48:21
samsung,Themes now unusable,2018-10-01 06:44:53
samsung,What is the best Samsung to get right now that is cheap in price?,2018-10-01 06:54:53
samsung,Samsung NU7100 Series 7 Smart TV Timeshift (in Australia),2018-10-01 07:38:34
samsung,Get Samsung Galaxy S8 Plus Mobile Phone Accessories Online in the UK,2018-10-01 08:58:30
samsung,Get Samsung Galaxy Note 7 Mobile Phone Accessories Online in the UK,2018-10-01 09:10:50
samsung,Samsung GALAXY S10 si Huawei MATE 20 Pro vor fi mai SLABE decat iPhone XS si XS Max,2018-10-01 09:43:40
samsung,S7 stuck on samsung logo during boot,2018-10-01 10:12:21
samsung,How does the Galaxy watch work with apps?,2018-10-01 10:57:50
samsung,Te most popular Samsung Smartphone at the moment...,2018-10-01 11:03:59
samsung,Is there a way to get the default Samsung Message app to work on a computer too? Can you run it though a browser?,2018-10-01 11:19:19
samsung,Facing issues while transferring files to laptop,2018-10-01 13:54:12
samsung,Is anyone else having this issue?,2018-10-01 14:41:43
samsung,Samsung Note 9 Delivery?,2018-10-01 15:24:04
samsung,My experience with the Note 9 so far.,2018-10-01 16:11:41
samsung,"What's the earliest samsung phone with fastcharge support, micro sd support and replaceable battery?",2018-10-01 16:33:29
samsung,Best OLED displays in the market,2018-10-01 16:56:02
samsung,SAMSUNG GALAXY A7 2018 REVIEW HANDS ON,2018-10-01 19:10:58
samsung,Thank you so much Samsung for the great customer support!,2018-10-01 19:20:14
samsung,"Broke my S6, only have $200 to replace it",2018-10-01 19:30:46
samsung,Samsung LFD (Large Format Displays,2018-10-01 20:32:56
samsung,Samsung's customer service is a joke,2018-10-01 20:36:48
samsung,"Hey /r/samsung, do you get HDR on your Netflix app? And how does it look?",2018-10-01 21:45:49
samsung,Sidesync/Note8,2018-10-01 22:38:08
samsung,"Bought a ""un60ku6270f"" Samsung tv from Sam's Club just under 2 years ago and now no power",2018-10-01 23:22:22
samsung,Still no galaxy skin. This is ridiculous.,2018-10-01 23:42:16
samsung,Samsung Kids has a 50% off subscription promo... but no way to redeem it?,2018-10-01 23:43:23
samsung,Samsung charger is the only charger that can fast charge the device?,2018-10-02 00:44:59
samsung,Samsung Q8 Settings issues,2018-10-02 00:52:46
samsung,Help: Samsung NU7100 TV - connecting to NAS?,2018-10-02 01:01:14
samsung,Two questions. Does uber or lyft work on the galaxy watch? Is At&amp;t a compatible carrier for the watch?,2018-10-02 02:04:02
samsung,RIP Galaxy A Series (2014 - 2018),2018-10-02 02:05:01
samsung,"Samsung Tab A 8"" takes FOREVER to charge",2018-10-02 04:26:37
samsung,Samsung GALAXY Note 9 are Viteze 4G LTE care sunt SUPERIOARE celor Oferite de iPhone XS/Max,2018-10-02 05:41:44
samsung,Session expired...Processing failed?,2018-10-02 06:18:18
samsung,Un Prim Clip VIDEO Ne arata Cum s-ar puta Plia Samsung GALAXY X cu Ecranul sau Flexibil,2018-10-02 06:27:11
samsung,Samsung working to make DeX connections wireless,2018-10-02 06:48:17
samsung,"Samsung are PROBLEME foarte MARI cu Smartphone-urile, Iata ce ANUNT a fost Facut Astazi",2018-10-02 10:32:58
samsung,"Iata ce fel de Functii pot fi Activate pe Samsung GALAXY S8 la 1 an dupa Lansare, iar Apple nu Permite ceva Similar pe iPhone",2018-10-02 11:38:48
samsung,PRIMELE Specificatii pentru Samsung GALAXY S10 au fost DEZVALUITE Inaintea Lansarii,2018-10-02 12:11:46
samsung,Samsung Notes,2018-10-02 14:29:53
samsung,"Can I get some advice on which smartphone to buy (Galaxy S9, S9+, Note 9)?",2018-10-02 14:44:32
samsung,Android Version?,2018-10-02 15:16:35
samsung,SAMSUNG: How to contact the real technical support?,2018-10-02 16:30:04
samsung,"Samsung Galaxy Note9 Factory Unlocked Phone with 6.4"" Screen and 128GB, Ocean Blue with Bluetooth Cord-free Fitness Earbuds and Charger Stand - $ 929 @Amazon",2018-10-02 16:38:32
samsung,New Samsung Galaxy A7 Review 24MP+24MP 3 Back Camera Specification,2018-10-02 17:02:20
samsung,"In the Samsung health app, what does an orange dot mean on the different categories (stress, heart rate, ect)?",2018-10-02 17:08:41
samsung,Ordering Samsung Products by the internet is a JOKE!!!!!,2018-10-02 17:24:29
samsung,How to Unlock Samsung Galaxy S9 (SM-G960) and S9 (G965) For Other Netwo...,2018-10-02 17:40:59
samsung,Samsung keyboard shortcuts don't work with auto-capitalization,2018-10-02 18:30:39
samsung,Gear iconx 2018 sound unbalanced between earbuds SOLVED,2018-10-02 18:31:52
samsung,Will Gear Sport (and other older Samsung smartwatches) get update?,2018-10-02 19:52:38
samsung,Apple VS Samsung | Koreans Answer | Koreaboo Studios,2018-10-02 20:03:59
samsung,Bootloader unlock on an S9,2018-10-02 21:22:24
samsung,Strange noise when looking for source,2018-10-02 22:03:44
samsung,Samsung lanza SDK para desarrollo de terceros con el S Pen,2018-10-02 23:46:05
samsung,Major Performance Issues (sorry this is so long),2018-10-02 23:46:28
samsung,How often does Samsung change deals on their website for the S9/S9+/Note?,2018-10-03 00:22:18
samsung,"Samsung Gear Sport Smartwatch (Bluetooth), Black, SM-R600NZKAXAR – US Version with Warranty (17% off)",2018-10-03 00:25:05
samsung,Replacement Battery for Samsung Galaxy S8 Active??,2018-10-03 02:00:04
samsung,Galaxy Tab S4?,2018-10-03 02:06:22
samsung,Need help i upgraded to oreo and i don't like it how do i go back to nougat without bricking my phone?,2018-10-03 02:30:49
samsung,Just bought a galaxy tab s4 but need help with a case,2018-10-03 02:38:19
samsung,Note 9 order uk,2018-10-03 02:40:46
samsung,Unlock Samsung Galaxy S9,2018-10-03 04:37:32
samsung,"Samsung GALAXY Note 9 Ramane REGE in fata iPhone XS, dar are si Unele PUNCTE SLABE",2018-10-03 06:55:32
samsung,Has anyone been to a Samsung store to get phone fixed under warranty?,2018-10-03 08:34:51
samsung,[HELP] Replacement rubber padding for Samsung earphones,2018-10-03 09:33:14
samsung,"[Galaxy s9 plus] samsung account session ""expired""",2018-10-03 11:17:42
samsung,How To Activate HBO Go On Samsung Smart TV?,2018-10-03 11:36:48
samsung,Samsung Galaxy S10’s Leaked Cam Specs : Yes It has Triple Camera,2018-10-03 11:41:46
samsung,Disable automatic update checking for Samsung apps?,2018-10-03 12:11:38
samsung,Samsung GALAXY X ar fi GROZAV daca ar ARATA ca acest Smartphone Pliabil Sony (VIDEO),2018-10-03 12:32:14
samsung,Wrong country,2018-10-03 13:56:00
samsung,How can we add our info in samsung pass after not accepting at once?,2018-10-03 16:50:04
samsung,Samsung GALAXY S8 Asa poti Instala NOUA Interfata a Android 9 Chiar Acum (VIDEO),2018-10-03 18:28:51
samsung,Should i buy a Samsung watch? If so which one?,2018-10-03 18:46:19
samsung,Samsung shipping costs,2018-10-03 19:26:06
samsung,No Emergency Alerts without Samsung Messages?,2018-10-03 20:50:46
samsung,Should I update? What will happen?,2018-10-03 21:27:26
samsung,Why isn't samsung releasing goodlock for all the countries?,2018-10-03 21:57:13
samsung,The Samsung Note 9 Promo,2018-10-03 22:49:47
samsung,Samsung back at it again,2018-10-03 23:44:21
samsung,Thought of a Samsung joke on apple,2018-10-03 23:47:35
samsung,Samsung shipping repairs,2018-10-04 00:28:50
samsung,Galaxy Watch Issues,2018-10-04 00:32:03
samsung,My friend’s review of Samsung S9,2018-10-04 01:20:47
samsung,Samsung Galaxy Tab 3 lite SM-T110 and OTG cable,2018-10-04 01:45:31
samsung,For all the hockey lovers who also have a Samsung.,2018-10-04 02:14:56
samsung,Samsung Health Friends Add me!,2018-10-04 02:16:47
samsung,[Note 9] S-Note and Samsung Notes. How to switch Action Memo back?,2018-10-04 04:44:36
samsung,Samsung NU8000 65 inch Backlight Bleed,2018-10-04 05:27:52
samsung,I cannot log in to my samsung account it keeps processing failed. Annoying because i keep getting notified to log in.,2018-10-04 06:29:09
samsung,Samsung GS9+ Voice-to-Text feature has invariably performed shittily for me. Anyone else experiencing similar frustrations?,2018-10-04 06:40:44
samsung,When did Samsung get so good with battery life?,2018-10-04 08:25:38
samsung,Is there a lay to fix that?,2018-10-04 10:50:37
samsung,Iata ce Numar IMPRESIONANT de Telefoane are Samsung in Proces de Dezvoltare pentru Lansare,2018-10-04 11:47:14
samsung,Galaxy Tab S4 Issues,2018-10-04 12:49:04
samsung,Anyone know about the class action lawsuit over defective ice makers?,2018-10-04 13:31:02
samsung,New T&amp;C means Samsung can delete backups?,2018-10-04 13:34:08
samsung,tips and tricks in Samsung J7 max and all other mid to high end Samsung devices,2018-10-04 14:18:19
samsung,Samsung GALAXY X are Anuntata Prezentarea Primelor Informatii OFICIALE de catre un Reprezentant Samsung,2018-10-04 14:22:18
samsung,iPhone User tries out the Samsung Galaxy Note 9.,2018-10-04 14:39:18
samsung,Bixby - I don't want to hate you,2018-10-04 14:59:07
samsung,More details about Samsung foldable phone found in leaked Android Pie build,2018-10-04 15:19:21
samsung,Samsung A10s Leaked with 10 Cameras! [PS: Check watermark],2018-10-04 15:58:58
samsung,Screen lock glitch on Samsung Galaxy S9 (Dangerous),2018-10-04 16:40:26
samsung,Android.process.acore keeps stopping and flashes this message on the screen constantly.,2018-10-04 16:48:08
samsung,Screen lock glitch on Samsung Galaxy S9 (Dangerous),2018-10-04 17:04:09
samsung,Samsung GALAXY S9 are Prezentata IN PREMIERA Interfata pe care o Ofera in Android 9 (VIDEO),2018-10-04 17:11:29
samsung,Screen Lock Glitch on Samsung Galaxy S9 (Dangerous),2018-10-04 17:21:57
samsung,Samsung Galaxy S8 Super Slow Motion Update Rollout Begins + AR EMOJIS,2018-10-04 17:31:40
samsung,Question about the Samsung upgrade program,2018-10-04 17:41:26
samsung,Samsung Galaxy Tab S3 - WiFi issues?,2018-10-04 17:48:28
samsung,The Best Screen Protector For Samsung Curved Displays,2018-10-04 20:09:18
samsung,"Samsung Health Global Challenge, Avocodo October",2018-10-04 23:44:36
samsung,Keep on keeping the headphone jack Samsung 😀,2018-10-05 01:06:29
samsung,What happened to Samsung pay?,2018-10-05 01:47:03
samsung,Quad-Cam Samsung Galaxy A9 is coming,2018-10-05 03:33:47
samsung,After having this thing snap in half (from a 1ft drop while secured in my phone) a week after getting the phone. Called Samsung and them saying its my fault and they are not gonna pay for it. Look what came in for free today!,2018-10-05 05:00:11
samsung,Switched to Note9 after 4 years of iPhone,2018-10-05 05:26:33
samsung,Samsung ANUNTA PROFIT RECORD in Ciuda PROBLEMELOR cu Vanzarile de Smartphone-uri,2018-10-05 05:42:05
samsung,What's the cheapest price for an old Samsung galaxy model?,2018-10-05 05:45:21
samsung,What are the perfect features you'd love to see in the stock samsung keyboard?,2018-10-05 06:24:48
samsung,Cool Samsung Galaxy S7 livery,2018-10-05 06:25:08
samsung,Samsung S9 Battery Health,2018-10-05 07:36:26
samsung,Samsung Hmd Odyssey Windows Mixed Reality Headset with 2 Wireless Controllers (XE800ZAA-HC1US) is 20% off,2018-10-05 08:49:42
samsung,Do you believe Samsung will have a Proper and useful ecosystem like Apple or Google in the future?,2018-10-05 10:42:36
samsung,Note 8 wired screen mirroring,2018-10-05 10:51:21
samsung,Resolution not fit for Instagram help,2018-10-05 11:27:48
samsung,Hidden meanings behind the Samsung logo?,2018-10-05 12:09:01
samsung,Samsung confirms missing ‘move to/out of Secure Folder’ options issue,2018-10-05 12:37:32
samsung,"Should I go Note 9 or S10, when it releases?",2018-10-05 12:55:46
samsung,Samsung GALAXY X - Iata ce SECRET IMPORTANT al Ecranului a fost Dezvaluit!,2018-10-05 14:06:54
samsung,Samsung GALAXY Note 9 NU a AJutat Samsung sa EVITE un ESEC Serios in T3 2018,2018-10-05 15:37:24
samsung,My phone texts a random group when I text 1 person,2018-10-05 16:01:54
samsung,Samsung Galaxy S8 ridiculous offer (29990 INR / 400 $),2018-10-05 18:38:47
samsung,"Samsung UE55MU8005T, artifacts on screen",2018-10-05 18:57:25
samsung,Bixby is an intrusive piece of shit. Can't change the button. Cant DISABLE the button. And volume control doesn't work on it.,2018-10-05 20:54:02
samsung,Looking for EVO 970 owners,2018-10-05 22:18:58
samsung,Question for owners of the Samsung nu8000 who have spectrum TV.,2018-10-06 01:51:21
samsung,iPhone User tries to make Samsung look worse than Apple but fails miserably.,2018-10-06 02:53:23
samsung,Unable to add Uber app to Samsung Secure Folder,2018-10-06 03:58:35
samsung,Samsung GALAXY S10 este Salvarea de care are Nevoie Samsung pentru a-si SPALA RUSINEA,2018-10-06 06:01:56
samsung,Watch the Samsung note fe unboxing!!!,2018-10-06 07:35:27
samsung,Hey guys does anyone know if you need to be signed in with samsung cloud for it to auto backup your phone data?,2018-10-06 09:01:32
samsung,Just switched from iOS,2018-10-06 13:45:25
samsung,Hidden meaning behind the “A” in the Samsung logo?,2018-10-06 13:56:44
samsung,Should i buy S9 (Really good offer by Amazon),2018-10-06 15:04:30
samsung,Samsung Galaxy S7 Edge update today,2018-10-06 17:06:09
samsung,UE590 hdmi splitter?,2018-10-06 17:32:22
samsung,My review of Note 9 after a month,2018-10-06 17:44:46
samsung,Apps that follow the Samsung Experience visual style.,2018-10-06 18:42:51
samsung,How can someone sell a new 512Gb Note 9 for $999 on ebay? How are they making money? example in link below,2018-10-06 19:57:48
samsung,Sling tv app not getting AirTV channels,2018-10-06 21:09:42
samsung,Temperature Resistance Between Samsung and iPhone,2018-10-06 21:55:34
samsung,My samsung s8+ wont detect any other wifi networks other than my university wifi,2018-10-07 00:32:38
samsung,All my emojis are turning into question marks!!,2018-10-07 02:18:50
samsung,IconX 2018 wingtips,2018-10-07 04:50:03
samsung,Samsung GALAXY S10 va avea o Noua Functie COPIATA de la iPhone XS si Huawei MATE 20,2018-10-07 06:02:15
samsung,Bixby voice 2.0 on samsung s9,2018-10-07 09:02:45
samsung,Photo I took on a Samsung Note9,2018-10-07 10:37:35
samsung,Samsung is holding your data hostage until you buy a new phone.,2018-10-07 10:45:03
samsung,Samsung premium care headache,2018-10-07 11:29:33
samsung,Samsung Galaxy S9 Review New super slow motion feature : Perfectly made ...,2018-10-07 12:41:00
samsung,Samsung Note 2 screen replacement,2018-10-07 14:43:01
samsung,"Common Samsung galaxy problems, Solved",2018-10-07 16:46:30
samsung,Online purchases.,2018-10-07 17:37:03
samsung,Question about the samsung 360 camera,2018-10-07 17:46:52
samsung,Samsung H850 soundbar vs Bose St300,2018-10-07 18:21:49
samsung,Gear s3 frontier help.,2018-10-07 18:28:11
samsung,Using the 2x upgrade promotion to get s9 plus,2018-10-07 18:39:36
samsung,Samsung Galaxy Note 9 Battery Life...,2018-10-07 19:07:55
samsung,Samsung Q9FN faulty panel?,2018-10-07 19:11:05
samsung,Trying out Samsung Health... I don't think these proportions are right. Does someone know why this seems inaccurate?,2018-10-07 19:35:34
samsung,Q6F vs Q7F,2018-10-07 20:08:42
samsung,.Mov files on Samsung s8,2018-10-07 21:05:27
samsung,Gear IconX (2018) Charging Case Broken Latch,2018-10-07 22:13:54
samsung,i think my camera might be broken,2018-10-08 00:03:15
samsung,Ninja commercial,2018-10-08 00:56:42
samsung,Hoping this won't get deleted as I'm hoping to get some direction or help in general... Desperately looking for the legs/stand for my Samsung UN55KS8500 TV.,2018-10-08 01:54:05
samsung,Gear S3 Music Cover Art Not Showing Up,2018-10-08 02:51:59
samsung,"S8 charging port melted/burnt, won't charge. Is there a warranty even if I bought it used from a third party?",2018-10-08 02:54:30
samsung,Save 20% on Samsung Gear VR w/Controller (2017) SM-R325NZVAXAR (US Version w/Warranty),2018-10-08 03:03:42
samsung,Recommendations for Galaxy s9+ screen protectors?,2018-10-08 04:33:38
samsung,Samsung Galaxy A7 (2018) Review | First Triple Camera Phone From Samsung,2018-10-08 05:00:52
samsung,Is this Samsung TV an LED?,2018-10-08 05:24:12
samsung,"I love my GW but I noticed that Samsung health in N9 and GW are not connected. I started workout manually in app and noticed it didn't activate in watch so I activated it manually in watch too. Ended up with ""two workouts"". Omg...",2018-10-08 06:39:31
samsung,"Could someone talk to me, an iPhone user, about what to expect with a Galaxy S8?",2018-10-08 07:25:17
samsung,Planning to switch from iphone 6s to samsung galaxy s9,2018-10-08 08:27:59
samsung,Soft silicone case for the A8,2018-10-08 08:40:35
samsung,Issue with my Gear Icon X 2018 and Samsung Customer Service,2018-10-08 10:58:11
samsung,Samsung Hmd Odyssey Windows Mixed Reality Headset with 2 Wireless Controllers (XE800ZAA-HC1US) is 20% off,2018-10-08 11:43:42
samsung,Took my Samsung S9 to Amsterdam.,2018-10-08 12:48:11
samsung,What does the second camera actually do on the 9+?,2018-10-08 13:46:35
samsung,Noile Culori pentru Samsung GALAXY S10 au fost CONFIRMATE Inaintea Lansarii Telefonului,2018-10-08 15:31:34
samsung,Does the Samsung mu6400(UK)/7000(US) support Dolby vision?,2018-10-08 16:27:42
samsung,You can now access your Samsung cloud files on any browser!,2018-10-08 16:31:53
samsung,"Oh wow!.. Tired of your iPhone X? Samsung will give $600 for it, if you buy Galaxy Note 9, S9",2018-10-08 17:12:11
samsung,If anyone is good with understand apps on the samsung PM I have a question!,2018-10-08 17:34:44
samsung,Samsung Suddenly 'Confirms' New Galaxy's Nasty Surprise - I am still focusing on the S10,2018-10-08 17:37:49
samsung,4G/LTE standby time S9 Plus,2018-10-08 18:24:49
samsung,I have a Samsung nu7100. looking into google/alexa. Either work well with this TV?,2018-10-08 18:43:13
samsung,Best wireless charger suggestions?,2018-10-08 19:36:43
samsung,Cinematic video and pictures shit with the Samsung Galaxy subscribe to the link below or follow on IG @davianex,2018-10-08 19:49:53
samsung,Everytime i turn on my samsung tv it looks like this (without the black lines lol) any ideas why? Sometimes the screen is just green.,2018-10-08 21:35:28
samsung,Galaxy S9 Screen Bleed?,2018-10-08 23:43:15
samsung,Samsung Galaxy tab s4 third party keyboard cases,2018-10-09 00:49:57
samsung,New Samsung Smart TV Not Compatible with YouTube TV. How Can I Be Sure of Getting a Replacement that is Compatible?,2018-10-09 01:15:16
samsung,I think I need a new TV. Has anyone had this issue where an image burns in on any of their Samsung TV’s? The model in the picture is the KU6300,2018-10-09 01:39:14
samsung,This really annoys me about phones (not sure if only Samsung has this),2018-10-09 02:05:57
samsung,Here’s an early look at the new Android skin that Samsung is bringing to the Galaxy Note 9,2018-10-09 03:16:55
samsung,"""Samsung Lag""",2018-10-09 05:56:17
samsung,Samsung GALAXY F are un ANUNT foarte IMPORTANT Privind LANSAREA Pregatita de catre Samsung,2018-10-09 06:26:42
samsung,Help with Samsung music interrupt,2018-10-09 06:34:07
samsung,Download Galaxy Note 9 Android 9.0 Pie Beta based on Samsung Experience 10,2018-10-09 08:37:54
samsung,HILARIOUS! This was the FIRST SAMSUNG phone,2018-10-09 08:52:43
samsung,VR headset suggestions for Samsung Galaxy S8,2018-10-09 10:53:58
samsung,Samsung Galaxy Oxygen Release Date - Full Review,2018-10-09 11:10:28
samsung,Samsung GALAXY Note 9 - Primele Imagini ne Dezvaluie CUM va ARATA cu Android 9,2018-10-09 12:23:59
samsung,I got these headphones with my Samsung Galaxy S7. What are they called and where is the best place to get them? Thanks!,2018-10-09 13:36:47
samsung,Samsung Galaxy S10 breaks cover as three models get official approval ahead of release date,2018-10-09 14:17:42
samsung,Help with connectivity on Samsung smart tv,2018-10-09 14:29:59
samsung,Samsung Galaxy S10 &amp; S7 - Full Phone Specifications Price &amp; Features - Info Technology Ideas,2018-10-09 16:56:19
samsung,Samsung GALAXY S10 are Modelele CERTIFICATE OFICIAL Inainte de a fi Prezentate,2018-10-09 17:01:36
samsung,Dark Background in Samsung Notes on Tab S3,2018-10-09 18:54:21
samsung,Samsung Trade In Plan,2018-10-09 19:53:29
samsung,Samsung Trade In lies and recourse.,2018-10-09 19:54:40
samsung,Multiple Questions,2018-10-09 20:50:09
samsung,Is Samsung A7(2018) worth the price?,2018-10-09 20:54:14
samsung,After watching some of the early reviews about Pixel 3XL,2018-10-09 21:49:07
samsung,Legit or Fake Samsung Fast Charger?,2018-10-09 22:21:34
samsung,any there any downsides to samsung tv upgrade program?,2018-10-09 22:27:39
samsung,Nova or Samsung Experience for Battery life?,2018-10-09 22:41:06
samsung,Bought a new Galaxy S8 and the box seems to be missing some things,2018-10-10 01:29:02
samsung,One of the many reasons why Samsung fucks,2018-10-10 02:47:56
samsung,Galaxy Watch or Gear S3 to pair with my Note 8,2018-10-10 02:59:31
samsung,Samsung s9 plus or IPhone X,2018-10-10 04:48:19
samsung,"Samsung Galaxy s8 sensor's not working after August security patch update, any idea what can i do about it?",2018-10-10 05:49:06
samsung,Samsung S9 Questions,2018-10-10 05:53:31
samsung,My Samsung galaxy s8's screen has extreme burn-ins.,2018-10-10 06:20:40
samsung,My review of the Samsung A8 Mobile Phone - For the price I think it has plenty to offer.,2018-10-10 06:35:46
samsung,What do you user to insure your note 9? Or other smart devices,2018-10-10 08:23:28
samsung,2 things Samsung should definitely keep up,2018-10-10 10:55:36
samsung,Help! Alternative to Samsung Charging Duo?,2018-10-10 11:15:08
samsung,Iata ce Functii GROZAVE sunt Anuntate pentru Camera Samsung GALAXY S9 in Actualizarea Android 9,2018-10-10 11:16:41
samsung,Samsung to Remove the Headphone Jack from Upcoming Galaxy Smartphones,2018-10-10 11:33:02
samsung,Why can't I play/see 60 fps video on Android YouTube app? Note9 Exynos 128gb,2018-10-10 13:19:57
samsung,Samsung T5 Portable SSD - 500GB - USB 3.1 External SSD (MU-PA500B/AM) is 15% off,2018-10-10 14:55:57
samsung,Why Samsung i trusted you!,2018-10-10 15:04:30
samsung,Could anyone tell me if this phone is eligible for the samsung trade in promotion?,2018-10-10 15:04:47
samsung,Samsung Galaxy J8 Ãzellikleri iÃ§in kÄ±sa bilgiler derledik,2018-10-10 15:11:54
samsung,"Samsung Galaxy J4, is it available in Europe?",2018-10-10 15:41:07
samsung,Samsung A9 leaked pictures show that they really did put 4 cameras on the back.,2018-10-10 15:42:23
samsung,Three Samsung Galaxy S10 models certified in China : Are you wait for this smartphone,2018-10-10 15:42:59
samsung,What’s worth it: buying a S9 now or waiting for the S10?,2018-10-10 16:21:47
samsung,"PSA - secure folder users, update Samsung gallery.",2018-10-10 16:25:27
samsung,Will bixby be on s6?,2018-10-10 17:08:44
samsung,[Help] TWRP for the Grand Prime,2018-10-10 17:34:21
samsung,New Samsung UE43M5670AU. Half of the screen is purple &amp; green. Anyone got any ideas why? Only LAN is connected,2018-10-10 18:08:44
samsung,Anyone having this issue with their Samsung tv?,2018-10-10 18:13:25
samsung,Samsung j120fn,2018-10-10 18:14:17
samsung,What's the absolute cheapest you can get the Samsung S9 for?,2018-10-10 19:13:22
samsung,Question about Secure folder,2018-10-10 21:10:29
samsung,Will the Gear watch being constantly connected drain the battery a lot?,2018-10-10 23:44:55
samsung,Samsung nailed it with their recent promotions for the S9 to coincide with the Pixel 3 announcements.,2018-10-11 00:47:46
samsung,Worthwhile upgrade.,2018-10-11 01:02:01
samsung,Samsung October Event,2018-10-11 03:05:43
samsung,For some reason my samsung S8 run into this problem. IDK If It’s virus or I broke my screen,2018-10-11 04:01:41
samsung,Samsung GALAXY S11 - Prima MARE DEZAMAGIRE a fost Anuntata pentru Fanii Samsung,2018-10-11 05:05:32
samsung,S8+ burn in Premium care,2018-10-11 06:42:07
samsung,Samsung Galaxy Tab S4 for Games,2018-10-11 06:52:56
samsung,Manage S9 with Best Samsung Galaxy S9 Manager,2018-10-11 07:30:23
samsung,"Samsung a LANSAT PRIMUL Smartphone cu 4 CAMERE PRINCIPALE, Uimind Industria Smartphone",2018-10-11 09:38:39
samsung,The new Samsung music app is terrible,2018-10-11 10:44:53
samsung,Samsung Galaxy Note 5,2018-10-11 11:03:51
samsung,What was the best Samsung phone ever?,2018-10-11 11:11:42
samsung,"Samsung launches the GalaxyA9 (2018), A quad camera smartphone",2018-10-11 11:11:49
samsung,"Galaxy Tab S3, Chromecast &amp; subtitles",2018-10-11 11:54:36
samsung,Samsung GALAXY NOTE 9: NOI PROBLEME Raportate de Clienti care au Cumparat Telefoanele,2018-10-11 13:14:36
samsung,iPhone XS Max vs Samsung S9 Plus - Speed Test! Which is Faster? https://youtu.be/EqrjJHEKwxo,2018-10-11 13:53:49
samsung,Samsung Galaxy S9 Unlocked Smartphone - Lilac Purple - US Warranty at lowest price ever,2018-10-11 14:19:55
samsung,Launchers?,2018-10-11 15:14:26
samsung,Samsung Galaxy S9 Unlocked Smartphone - Lilac Purple - US Warranty at lowest price ever,2018-10-11 15:17:28
samsung,Samsung support is a joke. They can't even be bothered to read an email.,2018-10-11 15:33:24
