subreddit,title,timestamp
samsung,Samsing Experience Current Build,2018-10-31 16:32:24
samsung,Huawei for the record of world's first 7nm mobile processor!,2018-10-31 16:33:54
samsung,SAMSUNG GETTING HATE FROM YOUTUBERS!!,2018-10-31 17:01:04
samsung,Fake News 🤦🏾‍♂️,2018-10-31 18:03:31
samsung,Does anyone know why an oil painting like affect happens when taking pictures on the S9? This is my first time owning a Samsung after switching from the 7plus; which took a great picture.,2018-10-31 18:09:11
samsung,samsung 10000mah+ battery phone would be a big move!,2018-10-31 19:26:46
samsung,Never had a non-Samsung phone,2018-10-31 19:39:47
samsung,The Frame TV,2018-10-31 20:10:30
samsung,Samsung backed uBreakiFix unable to offer silver Note 9 replacement parts,2018-11-01 00:11:41
samsung,"Specific samsung TV for sale at my post exchange, I need to find out if its google home compatible. Google cant find the model at all.",2018-11-01 01:21:18
samsung,"[Help] Using a Wifi-only media Galaxy S9, how do I remove the ""No Sim - Emergency Calls Only"" from the notifications bar and lock screen bar?",2018-11-01 01:56:30
samsung,Help: Samsung J7 and blue light filter apps,2018-11-01 03:11:23
samsung,I'm thinking about upgrading from my current device to either a Samsung S9+ or the Note 9. I'd like to know few things from long time Samsung users.,2018-11-01 03:12:15
samsung,Samsung MU800 PS4 Pro Black Screen Issue,2018-11-01 06:52:33
samsung,Samsung GALAXY S10 - Prima Imagine ne Prezinta cum ar ARATA NOUL Design al Telefonului,2018-11-01 07:28:03
samsung,Samsung Galaxy S9 Slow-Motion 960 fps,2018-11-01 07:50:48
samsung,Have you done this with Samsung Galaxy S8?,2018-11-01 10:10:40
samsung,Samsung C27HG70 terrible overshoot,2018-11-01 10:35:21
samsung,Samsung a anuntat NOI Telefoane UIMITOARE pentru 2019 care vor ATACA Seria iPhone XS,2018-11-01 10:37:41
samsung,Samsung Galaxy J6 Plus Vs Samsung Galaxy A6s Comparisons,2018-11-01 12:16:09
samsung,Few questions in my mind before to a Samsung Galaxy s9+ or Note 9.,2018-11-01 13:03:22
samsung,Samsung GALAXY S9 - Functia SPECIALA care va fi Oferita cu Lansarea Android 9,2018-11-01 13:14:18
samsung,"Phone stuck on Samsung logo suddenly, cannot fix",2018-11-01 13:34:45
samsung,Am I the only one who thinks that marshmallow is the best version of android for samsung phones ? Especially the s7/s7 edge.,2018-11-01 15:01:58
samsung,Samsung GALAXY X - Iata ce ANUNT URIAS a fost Facut de catre un Director al Companiei,2018-11-01 15:24:56
samsung,Where is the best place to find a genuine samsung s9 charger?,2018-11-01 17:39:08
samsung,Samsung Galaxy Tab S suddenly goes to black WHAM,2018-11-01 17:43:37
samsung,Help with MHL/HDMI.,2018-11-01 18:04:53
samsung,Difficulties with Samsung Customer Support,2018-11-01 18:22:19
samsung,"I have a Problem at my samsung galaxy s9, that theres a popup that says i have to login to my samsung account, but it doesnt works when i type in my login information. I tried to reset my password but it still dont works.hlp",2018-11-01 18:27:57
samsung,Memory on Samsung s7 edge,2018-11-01 18:29:01
samsung,Samsung denying the warranty of replaced screen which extends upon the 12 month warranty of phone.,2018-11-01 18:29:13
samsung,An email from samsung offering £1101 discount on a new galaxy device,2018-11-01 18:48:55
samsung,Samsung j6 2018 review and unboxing,2018-11-01 20:31:49
samsung,S9 volume buttons stuck,2018-11-01 21:41:22
samsung,Samsung S7 suspected chemical leak,2018-11-01 21:47:43
samsung,Samsung nu8000 auto dimming issue,2018-11-01 21:55:23
samsung,How do i put songs from my Macbook Pro to my Samsung A8? (without paying for an app),2018-11-01 22:45:31
samsung,Just a quick question! What’s better the new iPhone so Samsung S9 and why?,2018-11-02 02:48:21
samsung,Samsung Discontinuing Soundcamp!,2018-11-02 04:00:49
samsung,"Samsung - Telefonul CIUDAT, care Costa 3000 de DOLARI arata cat de STUPID Gandeste Compania",2018-11-02 07:39:49
samsung,Samsung QE75Q6FN OR UE75NU8000,2018-11-02 08:19:11
samsung,"Screen issue with my samsung monitor, can someone tell me how to fix this?",2018-11-02 09:05:05
samsung,Fantastic but unknown samsung app,2018-11-02 10:37:09
samsung,Save 8% on Samsung LC27H711QENXZA C27H711 27-Inch WQHD QLED Curved Monitor (360 Degree Design),2018-11-02 12:43:49
samsung,Samsung a Inregistrat o SCADERE URIASA in Vanzarile de Smartphone-uri in T3 2018,2018-11-02 12:52:22
samsung,Warranty question,2018-11-02 15:21:56
samsung,"Samsung GALAXY S10 - Iata ce Schimbare MAJORA, Dorita de TOTI Fanii, a fost CONFIRMATA",2018-11-02 15:46:47
samsung,Tab S4 vs New IPad Pro?,2018-11-02 16:11:57
samsung,Screen mirroring problem,2018-11-02 17:18:53
samsung,Samsung has some of the worst customer service I've seen. Be careful with your trade ins.,2018-11-02 17:39:30
samsung,Is there a good third party app for the front facing camera?,2018-11-02 18:08:23
samsung,Samsung MU800 PS4 Pro Black Screen Issue,2018-11-02 18:53:02
samsung,Problem with the S8+ 😑,2018-11-02 19:53:23
samsung,Help me,2018-11-02 23:42:01
samsung,Really need help,2018-11-03 01:40:45
samsung,Samsung Galaxy A9 (2018) is About to Launch in India- Price and Storage Revealed,2018-11-03 06:05:50
samsung,Samsung - Decizie de ULTIMA ORA Luata pentru Telefoanul ASTEPTAT de Toata LUMEA!,2018-11-03 07:01:53
samsung,Samsung Galaxy Frontier S3 is available at a discounted rate of 246 USD in my country. I'm thinking of buying it. Is it worth it?,2018-11-03 07:12:21
samsung,SAMSUNG CHARGEUR À INDUCTION STAND. RAPIDE RAPIDE,2018-11-03 07:30:21
samsung,Samsung's applications sync with others ?,2018-11-03 08:23:47
samsung,Regretting Samsung abandoning NX cameras,2018-11-03 09:48:07
samsung,Burn in question,2018-11-03 12:17:20
samsung,iPhone XR vs Samsung Galaxy Note 9 Speed Test,2018-11-03 14:07:52
samsung,Apple Watch(es) Vs Samsung Watch(es),2018-11-03 15:17:46
samsung,Hated Samsung for many years. Bought S9+ yesterday.,2018-11-03 15:22:30
samsung,Why other phone companies doesn't copy samsung edge screen but they copy notch?,2018-11-03 15:41:59
samsung,Samsung GALAXY S10 - Iata ce Functie MAJORA va LIPSI din Noul Model de Smartphone,2018-11-03 17:01:57
samsung,Sent S8 for repair - came back with new SIM.... that works.,2018-11-03 17:22:14
samsung,Samsung galaxy note 5. Is there anything I can do to stop the progression of this spot in the screen? It started out tiny and now its much bigger.,2018-11-03 18:10:22
samsung,Samsung TV life span?,2018-11-03 18:15:08
samsung,AKG Samsung Earbuds,2018-11-03 18:48:33
samsung,Edge lighting settings not saving,2018-11-03 19:47:10
samsung,Best way to use headphones with Samsung TV? (NU8000?),2018-11-03 20:33:00
samsung,About to buy Samsung View,2018-11-03 21:26:19
samsung,"Hello everyone, I bought the 55 inch 2018 UHD 4k samsung TV and can't access hulu live television or profiles.",2018-11-03 21:58:30
samsung,What is the current status of rooting the Samsung S8?,2018-11-03 23:13:47
samsung,Problem about Always on Display,2018-11-03 23:33:21
samsung,Samsung UI,2018-11-04 01:13:21
samsung,Some questions about this S8 Plus on Amazon...,2018-11-04 01:43:57
samsung,Samsung Galaxy S9 Sd card,2018-11-04 02:14:31
samsung,Are you a Samsung owner and looking to become a Samsung Expert? Figured I'd share my channel with you. Courtesy of Samsung Trainer.,2018-11-04 02:43:12
samsung,brand new note 9!!!,2018-11-04 03:56:51
samsung,What is the best Samsung phone &lt; €350,2018-11-04 10:38:16
samsung,Samsung health global challenge - Are these real?,2018-11-04 12:01:07
samsung,My Samsung fridge (a 4 door flex) keeps sending notification since this morning that its door is left open. The only thing is my fridge doors are closed. I can’t seem to be able to fix this! Anyone know how?,2018-11-04 12:28:25
samsung,Control+F like search feature in Samsung phones?,2018-11-04 12:43:50
samsung,samsung removed youtube 1440p from galaxy tab s?,2018-11-04 13:43:50
samsung,Samsung s7 slow compared to similar year iPhone,2018-11-04 14:07:07
samsung,Save $100 on Samsung C32HG70 32-Inch HDR QLED Curved Gaming Monitor (144Hz / 1ms) Model C32HG70QQN,2018-11-04 14:53:27
samsung,"Samsung Galaxy Note 9 Factory Unlocked with 6.4"" Screen and 128GB (U.S. Warranty), Midnight Black Is At Lowest Price Ever",2018-11-04 16:04:45
samsung,"Samsung Galaxy Note 9 Factory Unlocked with 6.4"" Screen and 128GB (U.S. Warranty), Midnight Black Is At Lowest Price Ever",2018-11-04 16:28:43
samsung,Do you need Odin to update a Samsung Galaxy S3?,2018-11-04 18:07:55
samsung,Are there two types of Samsung accounts?,2018-11-04 18:37:31
samsung,An issue with accessing data from Phone,2018-11-04 19:30:53
samsung,"I think the Oleophobic coating on my Note 9 has worn off, help",2018-11-04 23:01:09
samsung,Is the Samsung A8 compatible with Gear VR,2018-11-05 00:40:37
samsung,Samsung foldable phone is hinted!,2018-11-05 01:48:40
samsung,Question about getting some sort of remote control for my galaxy S2 tablet,2018-11-05 02:20:49
samsung,"Didn’t love the S9, planning to return it.",2018-11-05 03:25:39
samsung,Samsung Premium Care,2018-11-05 03:54:58
samsung,Samsung premium care,2018-11-05 04:06:27
samsung,Samsung exclusive in-game skin,2018-11-05 04:19:05
samsung,I LOVE my s9 - post for anyone considering switchung to android.,2018-11-05 05:03:05
samsung,Best Samsung Marketing App to improve performace and ram overtime!,2018-11-05 06:09:40
samsung,Recover Data on/off switch Samsung S9,2018-11-05 08:35:07
samsung,Samsung GALAXY NOTE 9 - Iata ce NOU Model SPECIAL a fost Dezvaluit Inaintea Lansarii,2018-11-05 10:32:11
samsung,How to Power all Your Apps on Samsung Smartphone with MTN mPulse Data Plan via Max VPN,2018-11-05 10:47:01
samsung,Samsung Level In Anc Earphones,2018-11-05 13:01:13
samsung,annoying pill notifications,2018-11-05 13:47:01
samsung,"Why doesn't Samsung use a screensaver on ""demo"" mode?",2018-11-05 14:25:12
samsung,Samsung Support,2018-11-05 14:34:20
samsung,Samsung Focus S,2018-11-05 17:52:48
samsung,Samsung GALAXY X - Anuntul IMPORTANT Facut de catre Companie pentru Fanii Sai,2018-11-05 18:01:36
samsung,Samsung Focus S- 7 years old and still smooth and responsive,2018-11-05 18:40:12
samsung,"Samsung S8 has very slow connection. My sim card works perfectly fine, and is super fast on my other phone. The settings are set to 3G/LTE. Does anyone else have this problem?",2018-11-05 20:59:24
samsung,"Hey Samsung, make up your mind.",2018-11-05 21:41:57
samsung,Samsung S8 Black Screen,2018-11-05 22:05:53
samsung,"Unless Samsung is trolling us, a folding Galaxy phone is finally coming this week",2018-11-05 22:10:07
samsung,OMG! Thieves Can Easily Hack Your Samsung S8!,2018-11-05 22:12:50
samsung,Galaxy S7 wont boot,2018-11-05 23:22:18
samsung,Does anyone knows what happened to my samsung tv.,2018-11-05 23:38:58
samsung,"Trying to enable ""format as internal"" 3 days of agony...",2018-11-06 00:00:45
samsung,Samsung Does Slow Down Phones!,2018-11-06 01:13:18
samsung,S8 plus screenburn,2018-11-06 01:51:15
samsung,Note Taking,2018-11-06 02:28:54
samsung,"Do anyone knows when Samsung will update their flagship phones the new Android version of Pie? Or Samsung Experience 10? Is there's a community to sign up for beta, I have a Samsung Galaxy Note 8.",2018-11-06 04:04:21
samsung,Can I damage my Samsung using these codes or is it safe to use?,2018-11-06 05:05:26
samsung,Samsung INFINITY Flex - Telefonul cu care Samsung vrea sa Faca UITAT iPhone,2018-11-06 06:02:28
samsung,samsung latest soundbar news,2018-11-06 06:07:01
samsung,iPhone 8 Plus to Samsung?,2018-11-06 09:13:59
samsung,[Easy Steps] Samsung Galaxy S9 Wont Turn on,2018-11-06 09:31:41
samsung,"Samsung Note9 keyboard, can I remove the "".com"" button that keeps appearing?",2018-11-06 09:55:13
samsung,Samsung POWERbot R7040 Robot Vacuum is 30% off,2018-11-06 09:59:52
samsung,TSPN1: Samsung Galaxy Note 9 Vs Huawei Honor Magic 2 Comparisons,2018-11-06 11:19:02
samsung,Samsung TV LA40R71BDX overscan,2018-11-06 11:28:18
samsung,"Samsung GALAXY F - Anuntul Oficial privind Prezentarea, iata ce vom vedea Maine",2018-11-06 12:31:18
samsung,Idea for samsung ad overflow-put bixby on lockscreen with custom ui ad based,2018-11-06 13:44:00
samsung,Samsung A8,2018-11-06 14:50:59
samsung,Samsung GALAXY S10 Teaser ARATA Telefonul la care TOATA LUMEA VISEAZA (VIDEO),2018-11-06 15:02:48
samsung,how to fix any software problem in samsung galaxy j4/ unroot/ flash stock rom,2018-11-06 15:09:43
samsung,Samsung TV help (Why is TV PLUS on by Default),2018-11-06 16:02:34
samsung,What can we expect from tomorrow Samsung Developer Conference event ?,2018-11-06 16:18:19
samsung,Note 9 trade up program issues. Ughh.,2018-11-06 16:24:02
samsung,Help!!!,2018-11-06 17:41:52
samsung,Samsung Galaxy S10’s Exynos 9820 may have dual NPUs.,2018-11-06 17:43:25
samsung,Samsung Is Releasing A New Foldable Smartphone,2018-11-06 18:10:43
samsung,Samsung Tab S2 Not Working,2018-11-06 19:39:16
samsung,Samsung talking Android Pie beta this week may dispatch same day,2018-11-06 19:56:27
samsung,Do USB-C audio earbuds work on the Note 8?,2018-11-06 20:40:57
samsung,Can someone please make a complete Dark Theme for the S9/S9+?,2018-11-06 21:49:18
samsung,Samsung Galaxy S10 tendrá también procesador AI - GeekZus,2018-11-06 22:41:31
samsung,IR Blaster needs to be added on next Galaxy Smart Phone,2018-11-06 23:08:56
samsung,My Samsung J3's back button won't work,2018-11-06 23:36:58
samsung,"Samsung, Cant disable voicemail Notifications. Very Annoying...",2018-11-07 00:00:10
samsung,Samsung Galaxy Home smart-speaker likely to be presented tomorrow at Samsung Developer Conference 2018,2018-11-07 00:13:10
samsung,Verizon Samsung Galaxy S9+ System Update 6,2018-11-07 00:47:24
samsung,HELP!! SAMSUNG S8 REMOVES APPS FROM HOME SCREEN ON RESTART,2018-11-07 01:00:54
samsung,Samsung Galaxy S7 in 2018/2019,2018-11-07 02:27:03
samsung,Everytime i scroll left or right from the corner of my phone this happens.....do yall know which app causes this or is it a feature of samsung? ( i use a samsung j7 prime btw),2018-11-07 02:28:29
samsung,Can you connect the 2018 Samsung Gear Icon X with a device other than a phone ?,2018-11-07 02:30:44
samsung,Streamen von Apple Musik auf Samsung Galaxy S8,2018-11-07 03:10:57
samsung,2012 ES- series television keeps getting SmartHub updates?,2018-11-07 04:15:30
samsung,Is my samsung TV hacked???,2018-11-07 04:29:33
samsung,Question about Samsung Galaxy a5 sd cards.,2018-11-07 04:48:50
samsung,Samsung to uncover a few highlights of foldable telephone this week ],2018-11-07 06:03:58
samsung,Samsung Face un ANUNT MAJOR Privind Lansarea Android 9 pentru Telefoane,2018-11-07 07:23:42
samsung,Why cant i use paypal as an option fir samsung pay on my gear sport?,2018-11-07 08:28:45
samsung,Best Screen Protector For Samsung Galaxy S9 &amp; S9 Plus,2018-11-07 08:58:56
samsung,Samsung GALAXY S10 - PREMIERA UIMITOARE pentru a Ramane in TOP in LUPTA cu Huawei,2018-11-07 09:01:47
samsung,"Samsung Galaxy A9, Quad Cameras?",2018-11-07 11:56:32
samsung,The US Samsung site is ready for Black Friday!,2018-11-07 13:04:04
samsung,HELP!!! SAMSUNG S8 REMOVES ALL SD APPS FROM HOME SCREEN ON RESTART,2018-11-07 14:00:21
samsung,Save 44% on Samsung Qi Certified Fast Charge Wireless Charging Convertible Stand/Pad - US Version - Black - EP-PG950TBEGUS,2018-11-07 14:35:26
samsung,Phones: Experiences / thoughts about the screen edge in a drop?,2018-11-07 14:50:04
samsung,Just got the gear s3,2018-11-07 14:56:32
samsung,Samsung Developer Conference 2018 Opening Keynote Livestream. Going to start in 2 hours.,2018-11-07 15:51:27
samsung,How to get free wallpapers on samsung themes,2018-11-07 16:02:01
samsung,Samsung GALAXY X - Iata cum poti vedea LIVE Prezentarea Noului Telefon Pliabil (VIDEO),2018-11-07 16:22:20
samsung,Question about s8/s9 earphones,2018-11-07 17:49:02
samsung,Best Samsung for $150-$300,2018-11-07 18:19:36
samsung,Samsung One UI Open Beta,2018-11-07 19:17:07
samsung,Samsung annouced the new one Ui,2018-11-07 19:18:04
samsung,Samsung galaxy s10 hinted im dying for that green colour.,2018-11-07 19:39:32
samsung,Samsung galaxy s10 hinted im dying for that green colour.,2018-11-07 19:39:43
samsung,Samsung galaxy s10 hinted im dying for that green colour.,2018-11-07 19:39:51
samsung,"Samsung Developer Conference - Foldable phone, Infinity-U ; Infinity-V ; Infinity-O screen technologies",2018-11-07 19:47:27
samsung,Samsung Folding Phone Reveal,2018-11-07 19:50:04
samsung,Samsung gives sneak peek of foldable phone,2018-11-07 19:52:19
samsung,Samsung INFINITY FLEX - ASA ARATA Telefonul Pliabil care a fost PREZENTAT OFICIAL (VIDEO),2018-11-07 20:00:42
samsung,Samsung gives sneak peek of foldable phone (disguised in box),2018-11-07 20:02:26
samsung,Looking for a microSD for my Samsung Galaxy S7.,2018-11-07 20:19:00
samsung,Note 9 and Gear VR,2018-11-07 20:40:00
samsung,How to sign up for One UI beta,2018-11-07 20:41:34
samsung,Samsung announces notches,2018-11-07 21:48:07
samsung,My Samsung A7 is blurring my photos unless flash is on. How can I fix this?,2018-11-07 21:48:59
samsung,One ui,2018-11-07 22:01:30
samsung,"Is the new samsung One UI coming to s8, s8 plus, note 8 phones?",2018-11-07 22:20:50
samsung,"Dolby Vision, HDR, QLED, OLED, and Nits brightness",2018-11-07 22:43:18
samsung,"[Help] Tab S4 - Dex and HDMI ""Samsung Dex not avaliable while cover open""",2018-11-07 23:09:17
samsung,Samsung will put notches on its future phones,2018-11-07 23:13:16
samsung,S8 wont get One UI according to this arricle,2018-11-07 23:14:04
samsung,Samsung Galaxy S10 seen in public.,2018-11-07 23:53:33
samsung,Help: How to turn down the brightness of my Samsung monitor while it's in eyesaver mode?,2018-11-08 00:10:07
samsung,"Ice Universe Tweets About Samsung Trademarks for ""Infinity"" Displays",2018-11-08 00:12:14
samsung,Note 9 Samsung Messages app issue,2018-11-08 00:27:30
samsung,My Samsung mobile device collection,2018-11-08 01:39:27
samsung,Samsung is not giving me back my tablet,2018-11-08 02:28:30
samsung,Download Samsung One UI Wallpaper here. (Album link in comment),2018-11-08 03:27:17
samsung,My Samsung 65 UHD Smart TV is chromecast enabled... so why can’t I cast from MoviesAnywhere to it?,2018-11-08 03:35:15
samsung,"ASA Vor ARATA Primele Telefoane Samsung care vor avea DECUPAJ in Ecran, de care Compania Radea",2018-11-08 06:05:09
samsung,Mid Range Phone From Samsung,2018-11-08 06:28:23
samsung,Samsung Foldable Smartphone Prototype Teases - It's Official!,2018-11-08 07:16:10
samsung,SAMSUNG GALAXY X - Acestea sunt SPECIFICATIILE OFICIALE ale Telefonului Pliabil,2018-11-08 07:26:57
samsung,Samsung built a robot butt just to test its smartphones' durability,2018-11-08 07:32:42
samsung,Music for SDC,2018-11-08 08:54:43
samsung,SAMSUNG GALAXY S9 - A fost Anuntat OFICIA CAND se LANSEAZA Android 9 pentru Clienti,2018-11-08 09:02:36
samsung,"In pics: Samsung unveils Infinity Flex, the much-awaited 'foldable' phone",2018-11-08 09:45:08
samsung,Joining One UI Beta Program with VPN?,2018-11-08 10:29:22
samsung,Samsung embraces the notch with new Infinity Displays.,2018-11-08 11:07:20
samsung,Samsung Bixby gets an API for third-party services support.,2018-11-08 11:08:17
samsung,One UI beta sign up,2018-11-08 12:26:40
samsung,"Samsung Galaxy Tab A 10.1"" worth it?",2018-11-08 13:39:49
samsung,Galaxy S10 could look radically different from any other Samsung smartphone...2018,2018-11-08 14:36:48
samsung,Samsung Tab S3 still worth it?,2018-11-08 14:42:17
samsung,Samsung Watch disconnecting,2018-11-08 15:03:09
samsung,"Samsung Anunta ONE UI, NOUA Interfata pentru Telefoanele cu Sistem Android",2018-11-08 15:25:29
samsung,Installing Samsung Members,2018-11-08 15:41:14
samsung,"Guys little help here please. I wanna buy a Samsung tablet. In your opinion: Samsung galaxy tab E (wifi and 3g) 9.6"" 1gb ram Or Samsung galaxy tab A (just wifi connection) 10.1"" 2gb ram",2018-11-08 15:42:51
samsung,Remapping Bixby button to back?,2018-11-08 16:17:30
samsung,Samsung 2018 Model Stereo to Surround Upmixing?,2018-11-08 16:23:33
samsung,Why does Samsung not give android to countries on the same dates?,2018-11-08 16:23:49
samsung,"Samsung announced ‘One UI’, its new mobile UX",2018-11-08 16:23:54
samsung,Samsung galaxy x folding smartphone revealed. - TechMasair,2018-11-08 17:55:52
samsung,Samsung GALAXY S10 - One UI Dezvaluie SECRETUL ASCUNS de catre Compania Samsung,2018-11-08 19:01:50
samsung,Merge Files?,2018-11-08 19:55:37
samsung,Samsung Galaxy S9,2018-11-08 21:23:28
samsung,Samsung announces Infinity Flex Display for foldable smartphones VIDEO,2018-11-08 21:27:39
samsung,Need help deciding between Samsung QLED models.,2018-11-08 21:58:33
samsung,Anyone know what's the best way to watch 4K content from a Samsung Galaxy S phone (7 or 9) on a big screen 4K UHDTV ?,2018-11-08 21:58:35
samsung,Once again Samsung rips off Apply by stealing the original idea for the bendable phone! Have you no shame Samsung?,2018-11-09 01:28:08
samsung,I’m thinking about switching from iPhone to Samsung (I am an 8 year iPhone user currently with iPhone X) I would switch to the galaxy S9. Is there anything I should know about android or be aware of before the switch? Never used a Samsung device before. Thanks!,2018-11-09 01:34:29
samsung,Looks like Samsung didn't get the memo lol,2018-11-09 01:43:32
samsung,"If you block a number on Samsung, will the person know if they call or text you in the future?",2018-11-09 05:25:48
samsung,Need help! Should I keep this Samsung Galaxy S9+ or give it back?,2018-11-09 05:46:21
samsung,Just got OREO on my samsung galaxy J7 2017,2018-11-09 06:01:38
samsung,Samsung - Primele Informatii despre CAT COSTA si CAND e LANSAREA Samsung GALAXY X,2018-11-09 07:26:21
samsung,Samsung galaxy x folding smartphone revealed. - TechMasair,2018-11-09 07:44:08
samsung,"News: Linux on Dex beta, Linux is finally coming to Samsung Galaxy.",2018-11-09 07:54:46
samsung,"Gee I can't wait to visit there, thanks Samsung!",2018-11-09 08:46:56
samsung,"Gee I can't wait to visit, thanks Samsung!",2018-11-09 09:16:22
samsung,"""The message is accurate, from a senior Samsung official"" - Ice Universe via Twitter.",2018-11-09 09:33:41
samsung,Download Samsung One UI Wallpaper in High Quality,2018-11-09 11:37:16
samsung,"""S8 will be getting One UI confirmed by a senior Samsung Official"" -Ice universe on twitter",2018-11-09 12:34:20
samsung,Why One UI is better than Samsung Experience and iOS 12,2018-11-09 12:57:25
samsung,US phone used internationally haz a sad,2018-11-09 14:03:20
samsung,Is there any method for getting One UI when you are not selected for the beta?,2018-11-09 14:23:43
samsung,Does the Bixby Speaker stand a chance against Google Home?,2018-11-09 15:18:40
samsung,"Samsung officially launched W2019 with dual camera, dual screen, and side fingerprint sensor",2018-11-09 15:57:03
samsung,Getting Samsung advertisements as notifications.,2018-11-09 16:03:09
samsung,[Help] Galaxy J5 Prime's screen won't turn on after locked,2018-11-09 17:44:28
samsung,"Samsung Innovation of the year,its Incredible ,world First Fold-able smartphone with fold-able display",2018-11-09 19:36:27
samsung,Get this email from Samsungcloud.com in Portuguese. I don't use Samsung cloud or speak Portuguese. What is this?,2018-11-09 22:08:32
samsung,Samsung HW-K950 Rear speakers?? How much could I sell them for,2018-11-10 01:59:36
samsung,Problem Receiving Text Messages,2018-11-10 02:40:45
samsung,Samsung sAMOLED's 1080p vs 1440p. A closer look at pentile displays.,2018-11-10 03:42:26
samsung,Galaxy S9+ Help: auto answer,2018-11-10 04:56:41
samsung,Bixby news source,2018-11-10 05:15:14
samsung,Unofficial Leaks Of Samsung Galaxy S10,2018-11-10 06:27:43
samsung,Samsung GALAXY S8 - Vestea GROZAVA Anuntata pentru Android 9 si TOTI Utilizatorii,2018-11-10 07:02:07
samsung,Looking for buyer's advice: Getting the Samsung S8 Note vs the S9 Note,2018-11-10 07:43:55
samsung,Samsung One UI,2018-11-10 08:45:48
samsung,Samsung Galaxy Tab S4 keeps turning off randomly,2018-11-10 09:54:46
samsung,Here’s how to join the Samsung One UI beta program!!,2018-11-10 13:16:52
samsung,[Help] My J5 Prime's screen takes more than 1 minute to wake after pressing the power/home button.,2018-11-10 13:49:49
samsung,"Yesterday night I could play movies from my HDD on my Samsung TV. Today I get the message ""Not supported audio data.""",2018-11-10 15:13:13
samsung,Opinions about the upcoming Android Go phone by Samsung?,2018-11-10 15:46:07
samsung,"Current Note 9 bundle on Samsungs website question (charger, headphones, case, DeX)",2018-11-10 15:58:54
samsung,Need help,2018-11-10 16:23:58
samsung,Weird problem Samsung A8,2018-11-10 16:26:52
samsung,Forgot Pin,2018-11-10 16:58:21
samsung,Iata ce ANUNT IMPROTANT privind Samsung GALAXY S10 a fost Facut Azi de catre Samsung,2018-11-10 17:02:02
samsung,Buy UN55NU7100 or Wait for the Black Friday (Canada),2018-11-10 17:28:31
samsung,I was told Samsung phones are foldable now,2018-11-10 17:46:21
samsung,Need samsung health friends,2018-11-10 18:28:17
samsung,Is samsung pass a good way to log into my apps?,2018-11-10 18:47:36
samsung,Can't use vpn anymore. I have a galaxy a8 (2018) runing android oreo (8.0) with samsung experience 9.0. I used a vpn with the always-on vpn setting on (not from the vpn provider) and now i can't connect to any vpns beacuse of this setting and i cant turn it off beacuse it shows that i have no vpns.,2018-11-10 20:22:32
samsung,Fake Samsung gear iconx,2018-11-10 20:23:07
samsung,Hulu and Samsung 6 question.,2018-11-10 20:58:32
samsung,Ghosting/blurry/pixelated figures on samsung 4k NU6900,2018-11-10 23:44:58
samsung,One Ui Beta in Canada..?,2018-11-10 23:57:24
samsung,Replacement spen for tab s4,2018-11-11 00:00:08
samsung,Samsung NU7100 Restarts/crashes?,2018-11-11 00:00:12
samsung,Read recipts with Samsung's messages app,2018-11-11 00:06:10
samsung,Q9fn,2018-11-11 00:25:48
