,User,Date,Tweets
1065,gizmodo,2019-10-15 21:29:02,Taco Bell recalls millions of pounds of beef due to reports of metal shavings 
1066,gizmodo,2019-10-15 21:27:07,We compared the new Pixel 4s radarpowered gesture controls with the LG G8 ThinQ While the Pixel 4s gestures m 
1067,gizmodo,2019-10-15 21:20:36,Discovery of Bronze Age warriors kit sheds new light on an epic prehistoric battle  
1068,gizmodo,2019-10-15 21:09:28,In recent years oil has felt like an inevitability The new wave of climate activism has punctured that notion 
1069,gizmodo,2019-10-15 20:57:55,Could the Pixelbook Go be the best Chromebook of the year  
1070,gizmodo,2019-10-15 20:44:58,RT  Loved working with  on this comic about space junk 
1071,gizmodo,2019-10-15 20:43:09,Election security experts testify from Illinois a top target of Russias 2016 meddling  
1072,gizmodo,2019-10-15 20:29:55,Google Pixel 4 The best camera phone goes double  
1073,gizmodo,2019-10-15 19:54:36,AMC Fuck it lets do streaming too 
1074,gizmodo,2019-10-15 19:30:32,The Pixelbook Go may walk the fine line between high design and great value  
1075,gizmodo,2019-10-15 19:26:33,Every exciting Google Assistant feature announced today  
1076,gizmodo,2019-10-15 18:35:29,Apple finally made Beats look good  
1077,gizmodo,2019-10-15 18:23:42,What are we going to do with all this space junk  
1078,gizmodo,2019-10-15 18:08:10,Climate rage is working  
1079,gizmodo,2019-10-15 17:48:15,Everything Google announced today madebygoogle  
1080,gizmodo,2019-10-15 16:52:35,Aerial laser scans uncover hidden early capital of the Khmer Empire  
1081,gizmodo,2019-10-15 16:33:47,Extinction Rebellion protests continue in London despite city police ban  
1082,gizmodo,2019-10-15 16:24:41,but unfortunately theyre not cleared by the FCC yet So youll be waiting until sometime in spring 2020 to ge 
1083,gizmodo,2019-10-15 16:23:11,Meet the Pixel Buds 2 Heres what you need to know Theyre truly wireless Longrange Bluetooth will free you 
1084,gizmodo,2019-10-15 16:02:16,The US will finally stop ignoring the forever chemicals poisoning our water  
1085,gizmodo,2019-10-15 15:44:36,AMC Fuck it lets do streaming too 
1086,gizmodo,2019-10-15 15:15:52,Google Pixel 4 The best camera phone goes double  
1087,gizmodo,2019-10-15 15:14:38,Every exciting Google Assistant feature announced today  
1088,gizmodo,2019-10-15 15:09:20,Welp thats all we have for now Were headed upstairs to go play with devicesKeep your eyes on Gizmodo for our 
1089,gizmodo,2019-10-15 15:06:07,Its all inside you You just go do it Its all thereAnnie Leibovitzs advice for taking good phone photos madebygoogle
1090,gizmodo,2019-10-15 15:04:30,Shot by Annie Leibovitz on the Google Pixel 4 madebygoogle 
1091,gizmodo,2019-10-15 15:01:23,The Google Nest Mini can now hang on your wall like a piece of art thats always listening to you 
1092,gizmodo,2019-10-15 15:01:12,Annie Leibovitz is here and shes been using a Pixel 4 madebygoogle 
1093,gizmodo,2019-10-15 15:00:00,The tldr on the Pixel 4 camera madebygoogle 
1094,gizmodo,2019-10-15 14:59:37,But stay tuned for software updates madebygoogle
1095,gizmodo,2019-10-15 14:59:06,What cant we capture with Pixel 4Capture both the full moon and a moonlit landscape madebygoogle 
1096,gizmodo,2019-10-15 14:57:32,New Google Nest Wifi brings mesh nodes that double as smart speakers  
1097,gizmodo,2019-10-15 14:56:45,Heres a new night sight shot allegedly taken on a Pixel 4 madebygoogle 
1098,gizmodo,2019-10-15 14:55:43,The Pixelbook Go is a smaller cheaper Googlemade Chromebook  
1099,gizmodo,2019-10-15 14:53:26,Live HDR will supposedly give you a what you see is what you get look at your photos in the viewfinder madebygoogle
1100,gizmodo,2019-10-15 14:53:02,We think telephoto is more importantGoogle is being sassy about machine learning improving zoomed pics madebygoogle
1101,gizmodo,2019-10-15 14:52:09,Look at that zoooooom and dont crop to zoom madebygoogle 
1102,gizmodo,2019-10-15 14:50:52,Heres the raw vs HDR photos taken on Pixel 4 madebygoogle 
1103,gizmodo,2019-10-15 14:50:08,Computational photography time Not quite a camera bump either madebygoogle
1104,gizmodo,2019-10-15 14:49:27,It comes in 3 colors black white and orangeIt also comes in 2 sizesThe Pixel 4 starts at 799 is available 
1105,gizmodo,2019-10-15 14:46:52,Hello 90hz refresh rate madebygoogle
1106,gizmodo,2019-10-15 14:46:26,You can also use the recorder on Airplane mode because everything is done ondeviceYou can also search for speci 
1107,gizmodo,2019-10-15 14:44:59,Theres a new audio recorder that uses AI to transcribe live as you record madebygoogle 
1108,gizmodo,2019-10-15 14:44:02,We have a responsibility to keep your personal information safe and secure madebygoogle 
1109,gizmodo,2019-10-15 14:42:55,Shes now walking through using Google Assistant to find concert tickets just using her voice madebygoogle
1110,gizmodo,2019-10-15 14:42:01,Privacy had to be builtin from the start You can turn motion sense on or off at any time All of the sensors da 
1111,gizmodo,2019-10-15 14:41:25,You can even quiet an alarm on the Pixel 4 by reaching for the phone when it goes off madebygoogle
1112,gizmodo,2019-10-15 14:40:53,It can sense through materials its extremely sensitive for motion madebygoogle
1113,gizmodo,2019-10-15 14:40:27,As expected Pixel 4 will have gestures and better Face Unlock madebygoogle 
1114,gizmodo,2019-10-15 14:39:35,Google updates Pixel Buds and theyre truly wireless this time  
1115,gizmodo,2019-10-15 14:38:51,Pixel 4 is the first phone with radar capabilities madebygoogle
1116,gizmodo,2019-10-15 14:37:54,Sabrina Ellis is here to talk about ambient computing oh yea and the Pixel 4 madebygoogle 
1117,gizmodo,2019-10-15 14:37:10,And now its PIXEL TIME madebygoogle
1118,gizmodo,2019-10-15 14:36:50,Nest Wifi will be available November 4 and cost either 269 2 pack or 349 3 pack You can preorder today 
1119,gizmodo,2019-10-15 14:35:25,Google says its also working with more thirdparty smart device makers to speed up the setup process and eliminate 
1120,gizmodo,2019-10-15 14:34:22,Its called Nest Wifi and consists of two devices a primary router and a Nest Point which extends your wifi ran 
1121,gizmodo,2019-10-15 14:33:34,the irony of Google talking about wifi when the wifi at the event is bad
1122,gizmodo,2019-10-15 14:33:00,Finally onto a new Google wifi solution madebygoogle
1123,gizmodo,2019-10-15 14:32:33,Google is also improving sound detection to identify things like smoke alarms or call alarms so that your smart de 
1124,gizmodo,2019-10-15 14:31:34,Nest aware will be available for one monthly rate no matter how many devices you haveTwo plans at 6 and 12 a 
1125,gizmodo,2019-10-15 14:30:17,Its a home intercom or alert system or even a phone using Google Duo madebygoogle
1126,gizmodo,2019-10-15 14:29:44,Its available in a new blue color and will come with a wall mount madebygoogle
1127,gizmodo,2019-10-15 14:28:55,The Nest Mini will be available for 50 replacing the Google Home Mini madebygoogle 
1128,gizmodo,2019-10-15 14:27:18,Partners need to pass a security review before requesting access to your Nest and Google devices madebygoogle
1129,gizmodo,2019-10-15 14:26:49,Our focus is on making wholehome solutions Is the segue into talking about privacy its personal Its your 
1130,gizmodo,2019-10-15 14:25:42,The Pixelbook Go features a quiet keyboard and Chrome OSComes in black and not pink and it starts at 649 
1131,gizmodo,2019-10-15 14:24:27,Hello Pixelbook Go madebygoogle 
1132,gizmodo,2019-10-15 14:22:22, madebygoogle 
1133,gizmodo,2019-10-15 14:20:59,What if you didnt need to upgrade a bulky new gaming console every few yearsHello Stadia madebygoogle 
1134,gizmodo,2019-10-15 14:20:00,A nod to Nests energy saving features allowing consumers to save enough energy to power Denver madebygoogle 
1135,gizmodo,2019-10-15 14:19:13,All of the new Nest products launching in 2019 contain recycled plastics madebygoogle 
1136,gizmodo,2019-10-15 14:18:22,On stage now Ivy Ross speaking about sustainability and design philosophyRight now were truly looking at sus 
1137,gizmodo,2019-10-15 14:16:03,We believe Google has the ability and responsiblity to make change Osterloh says in a nod to sustainabilityThe 
1138,gizmodo,2019-10-15 14:14:29,This is really speeding along  onto privacy You can even ask Assistant to forget the last thing you said to it 
1139,gizmodo,2019-10-15 14:13:13,The Pixel Buds 2 will be available in Spring 2020 for 179 madebygoogle 
1140,gizmodo,2019-10-15 14:11:21,Talking about longrange Bluetooth  leave your phone in the locker at the gym or inside when youre in the yard 
1141,gizmodo,2019-10-15 14:09:16,Baratunde Thurston is now on video to chat about the Pixel Buds 2 The lady in the video asks him What is tinier 
1142,gizmodo,2019-10-15 14:07:47,Itll even be available on Pixel madebygoogle
1143,gizmodo,2019-10-15 14:07:17,Stadia will be available on November 19 madebygoogle 
1144,gizmodo,2019-10-15 14:05:56,Lots of talk about help being in the air with ambient technology like Google Assistant madebygoogle 
1145,gizmodo,2019-10-15 14:04:14,New Pixel phones buds Chromebook Nest products and Stadia pics flashed up on screen No watch madebygoogle 
1146,gizmodo,2019-10-15 14:03:31,Baratunde Thurston is in the house to talk about Google products this morning madebygoogle
1147,gizmodo,2019-10-15 14:02:50,Were starting off with a video clearly shot on a phone Were CHANGING LIVES here or something madebygoogle 
1148,gizmodo,2019-10-15 14:01:24,Apple finally made Beats look good  
1149,gizmodo,2019-10-15 13:59:55,Live from New York City its madebygoogle 
1150,gizmodo,2019-10-15 13:59:05,The MadeByGoogle event is starting Follow along with our liveblog or here as we livetweet  
1151,gizmodo,2019-10-15 13:55:28,How to watch Googles Pixel 4 event MadeByGoogle  
1152,gizmodo,2019-10-15 13:46:03,President Trump is now running Facebook ads using a racial slur  
1153,gizmodo,2019-10-15 13:40:38,Everything were expecting to see at madebygoogle  
1154,gizmodo,2019-10-15 13:40:36,Okay we finally made it in Sitting down with a weirdly grainy aai bowl editors note HOW CAN IT BE GRAINY and g 
1155,gizmodo,2019-10-15 13:30:09,How to watch Googles Pixel 4 event MadeByGoogle  
1156,gizmodo,2019-10-15 13:16:03,Our MadeByGoogle event liveblog is right here  
1157,gizmodo,2019-10-15 13:13:55,Good morning New York Were waiting in yet another line to get into todays madebygoogle eventWe know were 
1158,gizmodo,2019-10-15 13:10:05,How to watch Googles Pixel 4 event
1159,gizmodo,2019-10-15 13:02:06,Heres everything were expecting from todays madebygoogle event  
1160,gizmodo,2019-10-15 12:45:40,In an unprecedented move London police ban Extinction Rebellion climate protests throughout the entire city 
1161,gizmodo,2019-10-15 11:05:43,Trump campaign running Facebook ads with racial slur  
1162,gizmodo,2019-10-15 04:08:24,Congress wants answers on who sent millions of provaping posts from bot accounts  
1163,gizmodo,2019-10-15 03:11:21,ABC News aired a fake Syria bombing video thats actually from a Kentucky gun demonstration  
1164,gizmodo,2019-10-15 01:42:16,Zuckerberg I only wined and dined rightwingers to um engage in a meaningful exchange of ideas 
1165,gizmodo,2019-10-15 01:28:35,Good news everyone  
1166,gizmodo,2019-10-15 01:08:05,Xbox introduces content filters to help purge your life of toxic trolls 
1167,gizmodo,2019-10-14 23:08:43,A study that linked shorter lifespans to CRISPR baby mutation has been retracted  
1168,gizmodo,2019-10-14 22:53:33,San Francisco is getting sick of all your dumbass disruption  
1169,gizmodo,2019-10-14 22:41:14,Google buries the hatchet with Yubico brings physical security keys with USBC 
1170,gizmodo,2019-10-14 22:27:28,Could an electrical equipment malfunction be behind the Saddleridge Fire  
1171,gizmodo,2019-10-14 22:17:03,Microsoft Xbox introduces content filters to help purge your life of toxic trolls 
1172,gizmodo,2019-10-14 22:01:02,The UK just passed a major renewable energy milestonebut theres a catch  
1173,gizmodo,2019-10-14 21:44:24,Toxic algae blooms really have become more intense study finds  
1174,gizmodo,2019-10-14 21:31:52,We cant talk about Typhoon Hagibis without talking about climate change  
1175,gizmodo,2019-10-14 21:01:04,RT  Havent been keeping up with Fortnite Well good news you havent missed muchexcept oh right the whole game is a black hol
1176,gizmodo,2019-10-14 20:59:16,Uber lays off 350 more employees in latest blood sacrifice  
1177,gizmodo,2019-10-14 20:27:34,Google buries the hatchet with Yubico brings physical security keys with USBC 
1178,gizmodo,2019-10-14 20:19:08,Safari in iOS 13 sends Chinese users browsing data to censorshipfriendly Tencent 
1179,gizmodo,2019-10-14 20:06:37,Apocalypse in the making Authorities to use drones and snipers to kill infected North Korean pigs 
1180,gizmodo,2019-10-14 19:51:33,At Standing Rock for example had there been meaningful consultation and proper environmental impact statements d 
1181,gizmodo,2019-10-14 19:33:29,ABC News broadcasts fake Syria bombing video thats actually from a Kentucky military show in 2017 
1182,gizmodo,2019-10-14 19:21:59,Uber lays off 350 more employees in latest blood sacrifice  
1183,gizmodo,2019-10-14 19:10:36,The UK just more power from renewables than fossil fuels for the first time since 1882  
1184,gizmodo,2019-10-14 18:59:23,A study that linked shorter lifespans to CRISPR baby mutation has been retracted  
1185,gizmodo,2019-10-14 18:48:02,Even WeWorks phone booths reek of death  
1186,gizmodo,2019-10-14 18:36:26,Typhoon Hagibis is Japans latest multibillion dollar disaster  
1187,gizmodo,2019-10-14 18:25:20,Safari in iOS 13 sends Chinese users browsing data to censorshipfriendly Tencent 
1188,gizmodo,2019-10-14 18:14:07,San Francisco is getting sick of all your dumbass disruption  
1189,gizmodo,2019-10-14 17:45:27,Can you give yourself a panic attack  
1190,gizmodo,2019-10-14 17:31:30,Nubia Z20 First Look Are two screens really better than one 
1191,gizmodo,2019-10-14 16:59:42,Heres how to get Disney for 5 a month  
1192,gizmodo,2019-10-14 16:39:49,Even WeWorks phone booths reek of death  
1193,gizmodo,2019-10-14 16:32:00,RT  Here is the frankly ridiculous list of everything coming to Disney at launch  
1194,gizmodo,2019-10-14 16:23:49,Apocalypse in the making Authorities to use drones and snipers to kill infected North Korean pigs 
1195,gizmodo,2019-10-14 15:55:09,ABC News broadcasts fake Syria bombing video thats actually from a Kentucky military show in 2017 
1196,gizmodo,2019-10-14 15:51:34,We are nations what environmental justice looks like for indigenous people  
1197,gizmodo,2019-10-14 15:20:21,Nubia Z20 First Look Are two screens really better than one 
1198,gizmodo,2019-10-14 15:01:28,Everything we know about the fake mass shooting video screened at Trumps Miami resort  
1199,gizmodo,2019-10-14 14:10:11,Can you give yourself a panic attack  
1200,gizmodo,2019-10-14 11:02:22,Everything we know about the mass shooting video screened at Trumps Miami resort  
1201,gizmodo,2019-10-14 01:18:06,California bans deepfakes in porn and politics 
1202,gizmodo,2019-10-14 00:18:02,Nikon Z50 First Look Nikons more affordable and compact mirrorless option is here 
1203,gizmodo,2019-10-13 23:18:07,STDs in America hit another record high in 2018  
1204,gizmodo,2019-10-13 22:18:05,Humans have a salamanderlike ability to regenerate damaged body parts study finds  
1205,gizmodo,2019-10-13 21:18:03,Whats going to happen with Bitcoin 
1206,gizmodo,2019-10-13 20:17:04,Over 150000 Americans have rare DNA fluke and dont know it study of 23andme data finds  
1207,gizmodo,2019-10-13 19:17:04,How the last woolly mammoths met their demise on a remote Arctic island  
1208,gizmodo,2019-10-13 18:17:06,Ruins of 5000yearold megalopolis uncovered in Israel  
1209,gizmodo,2019-10-13 17:17:05,The trickledown disaster of automation  
1210,gizmodo,2019-10-13 16:17:03,12 things you can do in macOS Catalina that you couldnt before 
1211,gizmodo,2019-10-13 15:17:07,The working persons guide to the industry that might kill your company  
1212,gizmodo,2019-10-13 14:55:37,The writers of Deadpool offer some thoughtful words on the characters hopeful MCU future  
1213,gizmodo,2019-10-13 14:17:07,Intel finally seems to be taking hardcore PC gamers seriously  
1214,gizmodo,2019-10-13 03:17:03,Instagram Goes Dark  
1215,gizmodo,2019-10-13 03:00:00,Facebooks being sued over lookalike logo andwell 
1216,gizmodo,2019-10-13 02:16:04,Abandoned SD card labeled homicide provides road map to real murder 
1217,gizmodo,2019-10-13 01:16:07,Heres how to get Disney for 5 a month  
1218,gizmodo,2019-10-13 00:16:04,Your Roku is an ad factory  
1219,gizmodo,2019-10-12 23:43:51,At least one dead after hotel partially collapses in New Orleans 
1220,gizmodo,2019-10-12 23:27:04,Huh Bill Gates sure hung out with Jeffrey Epstein a lot more than he admitted  
1221,gizmodo,2019-10-12 23:16:05,Essential debuts phone just cut in half and with a creepy backstory  
1222,gizmodo,2019-10-12 22:16:04,You can connect an Iomega Zip drive to your Apple Watch like its 1994  
1223,gizmodo,2019-10-12 21:46:17,Senator Elizabeth Warrens new Facebook ads make false claims to put the platforms ad policy on blast 
1224,gizmodo,2019-10-12 21:16:03,Oktoberfest escooter debacle hundreds of drunken riders lose their drivers licenses 
1225,gizmodo,2019-10-12 20:46:43,Advisory board members axed by Trumps EPA are preparing their own pollution report  
1226,gizmodo,2019-10-12 20:16:06,Sony seems ridiculously proud of the PS5s SSD  
1227,gizmodo,2019-10-12 20:13:48,Warrens new Facebook ads make false claimsand thats the whole damn point  
1228,gizmodo,2019-10-12 13:28:27,Google is funding climate change denialism  
1229,gizmodo,2019-10-12 02:29:21,Ancient Egyptian industrial zone uncovered in Luxors Valley of the Monkeys  
1230,gizmodo,2019-10-12 01:56:55,Google Facebook and Twitter tell Biden campaign they wont remove defamatory Trump ad 
1231,gizmodo,2019-10-12 01:26:28,Hubble sees our galaxy sucking up a mysterious amount of gas  
1232,gizmodo,2019-10-12 00:53:47,How Alexei Leonov survived his harrowing first spacewalk  
1233,gizmodo,2019-10-12 00:21:33,Google talks a good climate game but its also pouring money into groups that spout climate denial 
1234,gizmodo,2019-10-12 00:05:01,The writers of Deadpool offer some thoughtful words on the characters hopeful MCU future  
1235,gizmodo,2019-10-11 23:33:36,Libras ship is sinking as multiple major partners abandon Facebooks troubled cryptocurrency 
1236,gizmodo,2019-10-11 23:20:34,WeWork could run out of money next month report  
1237,gizmodo,2019-10-11 23:07:03,The slowmotion crisis of automation  
1238,gizmodo,2019-10-11 22:35:09,Google Facebook and Twitter tell Biden campaign they wont remove defamatory Trump ad 
1239,gizmodo,2019-10-11 22:32:03,Hubble sees our galaxy sucking up a mysterious amount of gas  
1240,gizmodo,2019-10-11 22:21:44,How Alexei Leonov survived his harrowing first spacewalk  
1241,gizmodo,2019-10-11 22:11:00,Nurses at New Jersey hospital fed patients Benadryl to avoid work whistleblower lawsuit alleges 
1242,gizmodo,2019-10-11 21:51:20,Libras ship is sinking as multiple major partners abandon Facebooks troubled cryptocurrency 
1243,gizmodo,2019-10-11 21:33:22,California power outage wreaks havoc at research labs  
1244,gizmodo,2019-10-11 21:01:13,Disaster recovery has a dark side  
1245,gizmodo,2019-10-11 20:29:48,Greta didnt win the Nobel Peace Prize but then this isnt the time for awards Its time for work 
1246,gizmodo,2019-10-11 19:59:46,Walmarts loss is Ubers gain  
1247,gizmodo,2019-10-11 19:29:09,Elon Musk NASA can share SpaceXs IP with literally anybody No charge 
1248,gizmodo,2019-10-11 18:59:03,Ancient Egyptian industrial zone uncovered in Luxors Valley of the Monkeys  
1249,gizmodo,2019-10-11 18:45:57,Google is funding climate change denialism  
1250,gizmodo,2019-10-11 18:35:03,The trickledown disaster of automation  
1251,gizmodo,2019-10-11 18:24:04,The Pixel 4 has been leaked to death so heres everything else we know about Made By Google 2019 
1252,gizmodo,2019-10-11 17:52:54,Nurses at New Jersey hospital fed patients Benadryl to avoid work whistleblower lawsuit alleges 
1253,gizmodo,2019-10-11 17:39:17,A smooth ride and builtin tracking make Cannondales Treadwell a bike for the rest of us  
1254,gizmodo,2019-10-11 17:06:52,Greta Thunberg didnt win the Nobel Peace Prize Good  
1255,gizmodo,2019-10-11 16:55:57,The Pixel 4 has been leaked to death so heres everything else we know about Made By Google 2019 
1256,gizmodo,2019-10-11 16:24:38,California wildfire season is here as the Saddleridge Fire explodes near Los Angeles  
1257,gizmodo,2019-10-11 16:06:36,President Trump joins Twitch the latest social media platform to be soiled by his racist bullshit 
1258,gizmodo,2019-10-11 15:54:38,Walmarts loss is Ubers gain  
1259,gizmodo,2019-10-11 15:42:57,I have rights how undocumented workers are exploited during disaster recovery  
1260,gizmodo,2019-10-11 15:30:10,A smooth ride and builtin tracking make Cannondales Treadwell a bike for the rest of us  
1261,gizmodo,2019-10-11 15:26:27,Elon Musk NASA can share SpaceXs IP with literally anybody No charge 
1262,gizmodo,2019-10-11 15:12:35,California power outage wreaks havoc at research labs  
1263,gizmodo,2019-10-11 11:35:14,President Trumps racist bullshit now available on Twitch  
1264,gizmodo,2019-10-11 03:07:39,Check out NASAs look for the next lunar landing  
1265,gizmodo,2019-10-11 01:28:20,Social inequality marriage habits and other clues to Bronze Age life revealed in new study  
1266,gizmodo,2019-10-11 00:55:20,Tim Cook explains why Apple sold out Hong Kong protestors doubles down 
1267,gizmodo,2019-10-11 00:41:28,Digital activists take aim at video game companies over China censorship  
1268,gizmodo,2019-10-11 00:10:51,Just some normal October weather  
1269,gizmodo,2019-10-10 23:47:59,The little blue pill might be able to help with a different kind of bone problem someday  
1270,gizmodo,2019-10-10 23:27:24,More than 1100 people have been arrested around the globe as part of a week of climate protests 
1271,gizmodo,2019-10-10 22:55:25,Jeremy Hammond former WikiLeaks source held in contempt for refusing to testify to grand jury 
1272,gizmodo,2019-10-10 22:43:53,85 percent of Americans dont know who this is and Im extremely jealous  
1273,gizmodo,2019-10-10 22:24:07,Tim Cook explains why Apple sold out Hong Kong protestors doubles down 
1274,gizmodo,2019-10-10 22:13:47,Two weeks after Amazon made its Climate Pledge it joined Big Oil for its Accelerate Production 40 event 
1275,gizmodo,2019-10-10 21:42:05,Digital activists take aim at video game companies over China censorship  
1276,gizmodo,2019-10-10 21:10:26,Dyson kills electric car development saying its too hard to make a profit  
1277,gizmodo,2019-10-10 20:39:23,Report finds nearly twothirds of Americas birds vulnerable to extinction from climate change 
1278,gizmodo,2019-10-10 20:08:48,A recordsetting blizzard is set to blast the Midwest  
1279,gizmodo,2019-10-10 19:55:27,Over 150000 Americans have rare DNA fluke and dont know it study of 23andme data finds  
1280,gizmodo,2019-10-10 19:42:55,Abandoned SD card labeled homicide provides road map to real murder 
1281,gizmodo,2019-10-10 19:23:33,Viagra might someday enhance bone marrow transplants  
1282,gizmodo,2019-10-10 19:08:19,RT  Extinction Rebellion brought a boat into the heart of Times Square on Thursday morning leading to the arrest of 60 peopleT
1283,gizmodo,2019-10-10 19:04:05,Steams Remote Play Together will add online multiplayer support to localonly games
1284,gizmodo,2019-10-10 18:57:38,Extinction Rebellion activists delay flights in London and snarl traffic in New York  
1285,gizmodo,2019-10-10 18:45:14,Jeremy Hammond former WikiLeaks source is held in contempt after refusing to testify before a federal grand jury 
1286,gizmodo,2019-10-10 18:35:30,Chinese citizens will have to scan their faces to get internet access and new phone numbers 
1287,gizmodo,2019-10-10 18:22:07,Social inequality marriage habits and other clues to Bronze Age life revealed in new study  
1288,gizmodo,2019-10-10 18:10:34,Two weeks after Amazon made its Climate Pledge it joined Big Oil for its Accelerate Production 40 event 
1289,gizmodo,2019-10-10 17:55:29,Dyson kills electric car development saying its too hard to make a profit  
1290,gizmodo,2019-10-10 17:37:04,MIT confirms a bridge Leonardo da Vinci designed 500 years ago was an ancient engineering marvel 
1291,gizmodo,2019-10-10 17:04:08,Steams Remote Play Together will add online multiplayer support to localonly games 
1292,gizmodo,2019-10-10 16:52:17,Chinese citizens will have to scan their faces to get internet access and new phone numbers 
1293,gizmodo,2019-10-10 16:33:09,Abandoned SD card labeled homicide provides road map to real murder 
1294,gizmodo,2019-10-10 16:23:33,85 percent of Americans dont know who this is and Im extremely jealous  
1295,gizmodo,2019-10-10 16:06:06,The working persons guide to the industry that might kill your company  
1296,gizmodo,2019-10-10 15:32:37,Over 150000 Americans have rare DNA fluke and dont know it study of 23andme data finds  
1297,gizmodo,2019-10-10 15:22:03,Report finds nearly twothirds of Americas birds vulnerable to extinction from climate change 
1298,gizmodo,2019-10-10 15:14:00,Apple sells out prodemocracy protesters in Hong Kong to appease Chinese government  
1299,gizmodo,2019-10-10 15:02:06,I tried to avoid the eye doctor with this gadget and failed miserably 
1300,gizmodo,2019-10-10 14:30:33,MIT confirms a bridge Leonardo da Vinci designed 500 years ago was an ancient engineering marvel 
1301,gizmodo,2019-10-10 14:01:02,How to put limits on your bingewatching and get your life back  
1302,gizmodo,2019-10-10 13:27:54,I tried to avoid the eye doctor with this gadget and failed miserably 
