,User,Date,Tweets
2515,gizmodo,2019-09-10 12:53:18,Loophole that lets people share your private Instagram pics and stories isnt a hackbut still heads up 
2516,gizmodo,2019-09-10 12:32:13,Its AppleEvent day Heres what were expecting to see  
2517,gizmodo,2019-09-10 12:14:12,Meet the Cold Dragon of the North Winds a gigantic Canadian pterosaur  
2518,gizmodo,2019-09-10 12:03:21,New Polaroid prints photos off your smartphones screen without Bluetooth wifi or cables  
2519,gizmodo,2019-09-10 11:06:18,George Soros praises President Trumps action against Huawei which will definitely confuse MAGAholes 
2520,gizmodo,2019-09-10 02:47:39,Federal appeals court rules that duh scraping public data doesnt violate hacking laws  
2521,gizmodo,2019-09-10 02:01:43,A FaceOff remake is in the works  
2522,gizmodo,2019-09-10 00:26:13,Everyone chill with more gun control including gun owners  
2523,gizmodo,2019-09-10 00:00:00,Acupuncturist went too deep punctured patients lungs 
2524,gizmodo,2019-09-09 23:29:23,Apple improves App Store search by handicapping its own apps 
2525,gizmodo,2019-09-09 23:18:04,Donald Trumps bad tweet is tearing NOAA apart  
2526,gizmodo,2019-09-09 23:06:11,Apple Card also an Apple Knife  
2527,gizmodo,2019-09-09 22:50:17,A FaceOff remake is in the works  
2528,gizmodo,2019-09-09 22:36:06,What to expect from Apples big 2019 iPhone event  
2529,gizmodo,2019-09-09 22:24:06,Amazon office workers plan to strike over companys inaction on climate change 
2530,gizmodo,2019-09-09 22:12:04,Acupuncturist went too deep punctured patients lungs 
2531,gizmodo,2019-09-09 22:04:16,Juul is in deep shit with the FDA for claiming its vape products were safer than cigarettes  
2532,gizmodo,2019-09-09 21:37:43,The best wildlife photos of 2019 reveal natures beauty and ferocity  
2533,gizmodo,2019-09-09 21:06:03,Apple improves App Store search by handicapping its own apps 
2534,gizmodo,2019-09-09 20:48:42,I made amazing images of galaxies and nebulas in minutes using this idiotproof automatic telescope 
2535,gizmodo,2019-09-09 20:17:50,Survey finds nearly everyone wants more gun control including gun owners  
2536,gizmodo,2019-09-09 19:57:28,RT  Google employees say their careers were stymied after reporting harassment and discrimination  
2537,gizmodo,2019-09-09 19:48:34,Whats the best medicine  
2538,gizmodo,2019-09-09 19:23:35,The plan to use Fitbit data to stop mass shootings is one of the scariest proposals yet  
2539,gizmodo,2019-09-09 19:09:52,Leaks and code clues suggest Google has more nifty camera features planned for Pixel 4 
2540,gizmodo,2019-09-09 18:58:34,Nintendo is experimenting with ways to make the Switchs JoyCons even more fragile  
2541,gizmodo,2019-09-09 18:40:33,Amazon office workers plan to strike over companys inaction on climate change 
2542,gizmodo,2019-09-09 18:20:57,50 Attorneys General target Google with sweeping antitrust investigation  
2543,gizmodo,2019-09-09 17:46:02,On Jonathan Franzens extremely dumb climate take  
2544,gizmodo,2019-09-09 17:15:21,Apple and Foxconn accused of breaking labor laws in China to produce iPhones  
2545,gizmodo,2019-09-09 16:59:04,Apple Card also an Apple Knife  
2546,gizmodo,2019-09-09 16:49:49,Japanese clerk allegedly stole over 1300 credit cards by instantly memorizing all the numbers 
2547,gizmodo,2019-09-09 16:35:44,Hurricane Dorian caused an oil spill that could be a socioeconomic tragedy  
2548,gizmodo,2019-09-09 15:55:22,The best wildlife photos of 2019 reveal natures beauty and ferocity  
2549,gizmodo,2019-09-09 15:44:05,Nintendo is experimenting with ways to make the Switchs JoyCons even more fragile  
2550,gizmodo,2019-09-09 15:36:23,Apple Card also an Apple Knife  
2551,gizmodo,2019-09-09 15:26:05,Leaks and code clues suggest Google has more nifty camera features planned for Pixel 4 
2552,gizmodo,2019-09-09 15:03:58,What to expect from Apples big 2019 iPhone event  
2553,gizmodo,2019-09-09 14:44:18,Ban rich white guys from sharing their thoughts on climate change  
2554,gizmodo,2019-09-09 14:28:03,I made amazing images of galaxies and nebulas in minutes using this idiotproof automatic telescope 
2555,gizmodo,2019-09-09 13:37:59,Japanese clerk allegedly stole over 1300 credit cards by instantly memorizing all the numbers 
2556,gizmodo,2019-09-09 13:13:58,Whats the best medicine  
2557,gizmodo,2019-09-09 11:33:48,Apple and Foxconn accused of breaking labor laws in China to produce iPhones  
2558,gizmodo,2019-09-09 02:46:58,Australian internet providers ordered to block eight sites found hosting Christchurch footage 
2559,gizmodo,2019-09-09 02:15:33,NOAA told its scientists to keep their mouths shuts about Trumps false forecast  
2560,gizmodo,2019-09-09 00:50:35,Healing crystals Hurricane Dorian and a 14000 gamer chair best Gizmodo stories of the week 
2561,gizmodo,2019-09-08 23:30:53,Australian internet providers ordered to block eight sites found hosting Christchurch footage 
2562,gizmodo,2019-09-08 23:17:18,NOAA told its scientists to keep their mouths shuts about Trumps false forecast  
2563,gizmodo,2019-09-08 22:55:30,Report trace amounts of uranium found by inspectors at Iranian site  
2564,gizmodo,2019-09-08 20:00:22,MIT built a Theranos for plants  
2565,gizmodo,2019-09-08 01:49:39,Wikipedia goes dark across Europe Middle East after DDOS attack  
2566,gizmodo,2019-09-08 01:18:56,The BBC joins up with Google Facebook and Twitter to try to tackle misinformation online  
2567,gizmodo,2019-09-08 00:24:00,MIT Media Lab director Joichi Ito resigns after financial ties to Jeffrey Epstein revealed  
2568,gizmodo,2019-09-07 23:52:06,DHS to ramp up social media monitoring of people entering the country  
2569,gizmodo,2019-09-07 23:20:22,The BBC joins up with Google Facebook and Twitter to try to tackle misinformation online  
2570,gizmodo,2019-09-07 21:17:27,Microsofts interns made a musical and its only a little weird  
2571,gizmodo,2019-09-07 20:46:25,Wikipedia goes dark across Europe Middle East after DDOS attack  
2572,gizmodo,2019-09-07 20:15:35,Theres something more powerful than Qi wireless charging and it could soon power your blender 
2573,gizmodo,2019-09-07 19:09:46,Why xkcd creator Randall Munroe wrote the worlds most extreme How to book  
2574,gizmodo,2019-09-07 18:26:56,Philly news anchor sues Facebook Reddit after her photo shows up in dating erectile dysfunction ads 
2575,gizmodo,2019-09-07 16:57:25,Microsofts interns made a musical and its only a little weird  
2576,gizmodo,2019-09-07 16:26:16,Theres something more powerful than Qi wireless charging and it could soon power your blender 
2577,gizmodo,2019-09-07 16:15:21,First a rainbow logo now a rainbow cube Apple what does it all mean  
2578,gizmodo,2019-09-07 14:09:47,Why xkcd creator Randall Munroe wrote the worlds most extreme How to book  
2579,gizmodo,2019-09-07 12:03:54,Google confirms DOJ scrutiny says it must hand over antitrust records  
2580,gizmodo,2019-09-07 06:06:00,Watch this absolute legend catch an iPhone in midair while riding a roller coaster  
2581,gizmodo,2019-09-07 04:05:17,Google confirms DOJ scrutiny says it must hand over antitrust records  
2582,gizmodo,2019-09-07 02:59:57,Here we are litigating stale wrong tweets from nearly a week ago on a Friday night  
2583,gizmodo,2019-09-07 02:49:00,A woman in her 70s may be the oldest new mom ever after giving birth to twins  
2584,gizmodo,2019-09-07 02:37:54,Apple can feel its reputation for bulletproof security slipping through its fingers 
2585,gizmodo,2019-09-07 02:24:14,Corals may be facing another threat thanks to climate change  
2586,gizmodo,2019-09-07 01:51:35,The answer to life the universe and everything finally cracked  
2587,gizmodo,2019-09-07 00:20:50,Google bans ads for experimental medical treatments 
2588,gizmodo,2019-09-06 23:36:11,In dangerous move NOAA debases itself in the name of Trumps bad tweet  
2589,gizmodo,2019-09-06 23:11:16,So to be distracted from the smell of death by the smell of oil was quite a transition  
2590,gizmodo,2019-09-06 22:40:21,A woman in her 70s may be the oldest new mom ever after giving birth to twins  
2591,gizmodo,2019-09-06 22:28:50,DOJ is illegally withholding records about phone location data collection lawsuit claims  
2592,gizmodo,2019-09-06 22:16:42,Deadly vaping illness could be related to vitamin E New York health officials say  
2593,gizmodo,2019-09-06 22:04:53,Apple can feel its reputation for bulletproof security slipping through its fingers 
2594,gizmodo,2019-09-06 21:46:02,Google bans ads for experimental medical treatments 
2595,gizmodo,2019-09-06 21:31:04,The answer to life the universe and everything finally cracked  
2596,gizmodo,2019-09-06 21:23:20,Russian startup Muffin Computer Wants to keep your smartphone cozy on cold days 
2597,gizmodo,2019-09-06 21:11:22,Climate change could be ruining the greatest orgy in the world 
2598,gizmodo,2019-09-06 20:59:20,You can always count on Fossil to bring a million smartwatches to a party 
2599,gizmodo,2019-09-06 20:26:24,Russian startup Muffin Computer wants to keep your smartphone cozy on cold days 
2600,gizmodo,2019-09-06 20:15:42,HAPPENING NOW Watch live as India attempts to land its Vikram probe on the Moon  
2601,gizmodo,2019-09-06 20:12:39,What to expect from Apples big 2019 iPhone event  
2602,gizmodo,2019-09-06 20:01:22,The Blob is back and its already messing up the Pacific Ocean food chain  
2603,gizmodo,2019-09-06 19:35:29,American Airlines mechanic charged with sabotaging flight 
2604,gizmodo,2019-09-06 19:17:38,You can always count of Fossil to bring a million smartwatches to a party 
2605,gizmodo,2019-09-06 19:02:25,Watch live as India attempts to land its Vikram probe on the Moon  
2606,gizmodo,2019-09-06 18:56:02,DOJ is illegally withholding records about phone location data collection lawsuit claims  
2607,gizmodo,2019-09-06 18:45:40,Facebooks antitrust problems just got worse  
2608,gizmodo,2019-09-06 18:32:41,5G is forcing hundreds of TV channels to change how they broadcast  
2609,gizmodo,2019-09-06 18:00:30,Deadly vaping illness could be related to vitamin E New York health officials say  
2610,gizmodo,2019-09-06 17:46:17,Report Apple wont let Siri say feminism  
2611,gizmodo,2019-09-06 17:31:47,Bow down to the king of the headphones 
2612,gizmodo,2019-09-06 17:00:06,What to expect from Apples big 2019 iPhone event  
2613,gizmodo,2019-09-06 16:40:55,Hawaiis Kilauea volcano unexpectedly triggered a gigantic phytoplankton bloom  
2614,gizmodo,2019-09-06 16:23:27,American Airlines mechanic charged with sabotaging flight 
2615,gizmodo,2019-09-06 15:27:45,A supercharged marine heat wave is roasting the Pacific  
2616,gizmodo,2019-09-06 14:56:09,5G is forcing hundreds of TV channels to change how they broadcast  
2617,gizmodo,2019-09-06 14:40:02,Report Apple wont let Siri say feminism  
2618,gizmodo,2019-09-06 14:36:15,Watch this absolute legend catch an iPhone in midair while riding a roller coaster  
2619,gizmodo,2019-09-06 14:18:01,Facebooks antitrust problems just got worse  
2620,gizmodo,2019-09-06 13:57:52,The Moto One Zoom goes bold on style and big on cameras  
2621,gizmodo,2019-09-06 13:33:23,Would you lay your life on the line for your Motorola 
2622,gizmodo,2019-09-06 13:20:44,LGs new dualscreen phone is the perfect phone for multitasking But its not exactly a phone with two screensyou 
2623,gizmodo,2019-09-06 12:52:03,No NASA did not say its developing its own cryptocurrency  
2624,gizmodo,2019-09-06 12:42:13,Newly discovered Japanese duckbilled dinosaur was a Cretaceous beach bum  
2625,gizmodo,2019-09-06 12:10:47,Rings partnerships with police has senator demanding answers  
2626,gizmodo,2019-09-06 11:49:12,Sony cashes in on nostalgia with 40thanniversary Walkman now cassettefree  
2627,gizmodo,2019-09-06 11:35:06,The new Doctor Sleep movie blends elements from both the King and Kubrick versions of The Shining 
2628,gizmodo,2019-09-06 11:09:00,Influential coalition with 15 million members calls for an outright ban on facial recognition 
2629,gizmodo,2019-09-06 10:38:04,Absolute legend catches iPhone in midair while riding roller coaster  
2630,gizmodo,2019-09-06 05:51:32,Sony cashes in on nostalgia with 40thanniversary Walkman now cassettefree  
2631,gizmodo,2019-09-06 03:59:27,Scientists behind first black hole image win 3 million breakthrough prize  
2632,gizmodo,2019-09-06 03:29:06,Rooster kills Australian woman  
2633,gizmodo,2019-09-06 03:17:45,Jon Favreau still has hope SpiderMan could go back in the MCU but hes one of the few  
2634,gizmodo,2019-09-06 03:03:38,Rings partnerships with police has senator demanding answers  
2635,gizmodo,2019-09-06 02:49:44,Superfund sites risk contamination as Hurricane Dorian pummels the Southeast  
2636,gizmodo,2019-09-06 02:38:55,No NASA did not say its developing its own cryptocurrency  
2637,gizmodo,2019-09-06 02:19:49,Oh god people really are antivaxxing their pets  
2638,gizmodo,2019-09-06 02:09:37,Apple Music is in your browser now because services are king  
2639,gizmodo,2019-09-06 01:40:54,Facebook throttles satirical womens site Reductress for sharing clickbait 
2640,gizmodo,2019-09-06 01:13:30,What kind of soup is this  
2641,gizmodo,2019-09-06 00:51:06,Bizarre disappearance of large underwater observatory baffles scientists  
2642,gizmodo,2019-09-06 00:34:05,Influential coalition with 15 million members calls for an outright ban on facial recognition 
2643,gizmodo,2019-09-06 00:30:00,There are few phone fans as passionate as the Motorola King of UruguayFelipe Berhau fell in love with Motorola w 
2644,gizmodo,2019-09-06 00:23:57,Mouthwash cancels out key benefits of exercise  
2645,gizmodo,2019-09-06 00:09:30,Why fast food is the ticking time bomb of job automation  
2646,gizmodo,2019-09-05 23:59:07,The new Doctor Sleep movie blends elements from both the King and Kubrick versions of The Shining 
2647,gizmodo,2019-09-05 23:46:00,NYC sues TMobile over rampant abusive sales tactics at Metro stores  
2648,gizmodo,2019-09-05 23:34:30,Picture if you will the person who buys this 14000 gamer chair 
2649,gizmodo,2019-09-05 23:15:05,Jon Favreau still has hope SpiderMan could go back in the MCU but hes one of the few  
2650,gizmodo,2019-09-05 23:12:07,No NASA did not say its developing its own cryptocurrency  
2651,gizmodo,2019-09-05 23:09:45,LG heard you like phone screens 
2652,gizmodo,2019-09-05 22:55:06,United and Southwest will allow passengers to optout of 737 flights  
2653,gizmodo,2019-09-05 22:41:42,New research is final blow to an HIV cure that wasnt  
2654,gizmodo,2019-09-05 22:31:06,Facebook throttles satirical womens site Reductress for sharing clickbait 
2655,gizmodo,2019-09-05 22:22:14,LGs new dualscreen phone is like two phones in one  
2656,gizmodo,2019-09-05 22:09:00,Oh god people really are antivaxxing their pets  
2657,gizmodo,2019-09-05 21:52:26,Apple Music is in your browser now because services are king  
2658,gizmodo,2019-09-05 21:50:37,The ClimateTownHall gave some muchneeded attention to issues around justice but was it enough 
2659,gizmodo,2019-09-05 21:35:14,Sennheisers new Momentum Wireless are still king of the headphones but that doesnt mean we dont have gripes wit 
2660,gizmodo,2019-09-05 21:30:54,Joe Biden got grilled at last nights ClimateTownHall showing the politics of old will not fly in 2019 
2661,gizmodo,2019-09-05 21:18:07,The EPA is pausing operations at toxic sites as Hurricane Dorian lashes the Southeast  
2662,gizmodo,2019-09-05 21:05:08,Picture if you will the person who buys this 14000 gamer chair 
2663,gizmodo,2019-09-05 20:57:01,Snakehunt continues after threefoot python escapes inside high school 
2664,gizmodo,2019-09-05 20:33:06,Rooster kills Australian woman  
2665,gizmodo,2019-09-05 20:30:08,Scientists behind first black hole image win 3 million breakthrough prize  
2666,gizmodo,2019-09-05 20:28:05,Newly discovered Japanese duckbilled dinosaur was a Cretaceous beach bum  
2667,gizmodo,2019-09-05 20:17:40,Mouthwash cancels out key benefits of exercise  
2668,gizmodo,2019-09-05 20:03:30,Why is it so hard for Apple to put Touch ID back in a phone  
2669,gizmodo,2019-09-05 19:48:16,What kind of soup is this  
2670,gizmodo,2019-09-05 19:35:49,Why fast food is the ticking time bomb of job automation  
2671,gizmodo,2019-09-05 19:15:46,Facebook to users Get fucked  
2672,gizmodo,2019-09-05 18:45:02,17 things you can do in Android 10 that you couldnt do before  
2673,gizmodo,2019-09-05 18:29:00,New research is final blow to an HIV cure that wasnt  
2674,gizmodo,2019-09-05 18:10:34,Can you spot the upgrades on the new Samsung Galaxy Fold  
2675,gizmodo,2019-09-05 17:38:38,NYC sues TMobile over rampant abusive sales tactics at Metro stores  
2676,gizmodo,2019-09-05 17:24:24,Chinese government reportedly hacks telecoms and smartphones to track Uyghur population  
2677,gizmodo,2019-09-05 17:13:18,CNNs ClimateTownHall finally aired climate changes dirty secret  
2678,gizmodo,2019-09-05 16:50:08,Hurricane Dorian batters the Carolinas leaving 200000 without power  
2679,gizmodo,2019-09-05 16:34:27,Large underwater observatory disappears without a trace baffling scientists  
2680,gizmodo,2019-09-05 16:14:09,Withings didnt forget the Move ECG Its just been trapped in regulation hell  
2681,gizmodo,2019-09-05 16:10:08,Why is it so hard for Apple to put Touch ID back in a phone  
2682,gizmodo,2019-09-05 15:55:58,The story behind the most heated moment of CNNs ClimateTownHall  
2683,gizmodo,2019-09-05 15:45:58,RT  in the summer of 2017 the lowest point of Travis Kalanicks life he sat down to write a letter to employees admitting his
2684,gizmodo,2019-09-05 15:37:05,Snakehunt continues after threefoot python escapes inside high school 
2685,gizmodo,2019-09-05 15:26:41,From a cyber ops facility to daycare heres the list of everything being delayed to pay for President Trumps stup 
2686,gizmodo,2019-09-05 15:13:53,Nokia reminds us dumb phones can still be good in 2019  
2687,gizmodo,2019-09-05 15:01:52,Nokia put a huge 48MP camera on its newest midrange phone  
2688,gizmodo,2019-09-05 14:43:40,Can you spot the upgrades on the new Samsung Galaxy Fold  
2689,gizmodo,2019-09-05 14:33:44,After years of ugly watches Garmins got some fresh styles  
2690,gizmodo,2019-09-05 14:21:34,Facebook to users Get fucked  
2691,gizmodo,2019-09-05 14:17:20,Sennheisers new Momentum Wireless are still king of the headphones  
2692,gizmodo,2019-09-05 14:03:55,Philips gave into the hipsters and made Hue filament smart lights  
2693,gizmodo,2019-09-05 13:46:52,17 things you can do in Android 10 that you couldnt do before  
2694,gizmodo,2019-09-05 13:39:19,TCLs new soundbar uses acoustic tricks to bring you cheap Dolby Atmos  
2695,gizmodo,2019-09-05 13:28:15,IFA fucks  
2696,gizmodo,2019-09-05 13:17:26,The expensive new Sonos Move Bluetooth speaker baffles me in many ways  
2697,gizmodo,2019-09-05 11:47:47,Heres every project being delayed to pay for President Trumps idiotic border wall  
2698,gizmodo,2019-09-05 11:35:15,What do your favorite Star Wars characters look like as bugs You never thought about it before but now youre curi 
2699,gizmodo,2019-09-05 10:34:21,Seeing It Chapter 2 this weekend is the only way to see the new trailer for Birds of Prey  
2700,gizmodo,2019-09-05 10:04:06,After years of ugly watches Garmins got some fresh styles  
2701,gizmodo,2019-09-05 09:03:04,Sennheisers Momentum Wireless keep their crown  
2702,gizmodo,2019-09-05 08:37:05,Sennheisers new Momentum Wireless are still king of the headphones  
2703,gizmodo,2019-09-05 07:03:03,Philips gave into the hipsters and made Hue filament smart lights  
2704,gizmodo,2019-09-05 04:29:50,Trumps Energy Department swoops in to save us from the tyranny of more efficient lightbulbs  
2705,gizmodo,2019-09-05 02:46:19,Samsung Galaxy Fold to launch in Korea on Sept 6 no official US release date listed yet  
2706,gizmodo,2019-09-05 02:05:14,Hi Jeremy Renner app Bye Jeremy Renner app  
2707,gizmodo,2019-09-05 01:48:21,Incredible fossils link ancient creature to earliest footprints on Earth  
2708,gizmodo,2019-09-05 01:16:46,Analysis of Denisovan fossil reveals a distinctly humanlike finger  
2709,gizmodo,2019-09-05 00:46:06,What do your favorite Star Wars characters look like as bugs You never thought about it before but now youre curi 
2710,gizmodo,2019-09-05 00:28:00,Seeing It Chapter 2 this weekend is the only way to see the new trailer for Birds of Prey  
2711,gizmodo,2019-09-05 00:12:23,Online depression tests are collecting and sharing your data  
2712,gizmodo,2019-09-05 00:00:21,Have you seen this infamous knifesnatching crow 
2713,gizmodo,2019-09-04 23:46:20,We live in hell  
2714,gizmodo,2019-09-04 23:34:54,Michigan becomes the first state to ban the sale of flavored ecigs  
2715,gizmodo,2019-09-04 23:17:25,Sediment cores full of plastic Yup thats right  
2716,gizmodo,2019-09-04 23:03:06,Margaret Atwood fans rejoice as Amazon completely screws other retailers  
2717,gizmodo,2019-09-04 22:47:06,Exposed server contained phone numbers of hundreds of millions of Facebook users  
2718,gizmodo,2019-09-04 22:07:47,A rat study finds that acupuncture can treat alcohol addiction in rats  
2719,gizmodo,2019-09-04 21:35:40,Presidential candidates are building off of Jay Inslees open source climate plan  
2720,gizmodo,2019-09-04 21:09:59,The new magic number for gaming laptops is 300Hz 
2721,gizmodo,2019-09-04 20:55:13,How mesh messaging apps work and why you might need one 
2722,gizmodo,2019-09-04 20:40:07,Margaret Atwood fans rejoice as Amazon completely screws other retailers  
2723,gizmodo,2019-09-04 20:29:02,Have you seen this infamous knifesnatching crow 
2724,gizmodo,2019-09-04 20:22:43,Scientists are concerned Hurricane Dorian isnt just a humanitarian disaster It could be an ecological one too 
2725,gizmodo,2019-09-04 20:11:12,A note on our use of encrypted communication  
2726,gizmodo,2019-09-04 19:59:05,Incredible fossils link ancient creature to earliest footprints on Earth  
2727,gizmodo,2019-09-04 19:55:42,Twitter has temporarily turned off its tweetbySMS feature following second major account hack 
2728,gizmodo,2019-09-04 19:44:26,Online depression tests are collecting and sharing your data  
2729,gizmodo,2019-09-04 19:30:17,NYC subway workers are very very tired of picking up your lost AirPods 
2730,gizmodo,2019-09-04 19:17:50,Would you die for a Motorola phone  
2731,gizmodo,2019-09-04 18:59:06,Analysis of Denisovan fossil reveals a distinctly humanlike finger  
2732,gizmodo,2019-09-04 18:51:20,Heres a cheaper alternative to the Kindle Oasis  
2733,gizmodo,2019-09-04 18:35:45,The new magic number for gaming laptops is 300Hz 
2734,gizmodo,2019-09-04 18:32:32,RT  Car Talks long goodbye  
2735,gizmodo,2019-09-04 18:23:21,A rat study finds that acupuncture can treat alcohol addiction in rats  
2736,gizmodo,2019-09-04 18:10:15,Plastics could mark the start of a geological era  
2737,gizmodo,2019-09-04 17:57:41,Michigan becomes the first state to ban the sale of flavored ecigs  
2738,gizmodo,2019-09-04 17:46:02,Jay Inslee is casting a long green shadow over the 2020 race  
2739,gizmodo,2019-09-04 17:14:23,Chlo Grace Moretzs Twitter hacked apparently by same group that took over Jack Dorseys  
2740,gizmodo,2019-09-04 16:56:12,Bad kitty  
2741,gizmodo,2019-09-04 16:14:02,Would you die for a Motorola phone  
2742,gizmodo,2019-09-04 15:50:24,The Light Phone 2 wants to save you from the internet  
2743,gizmodo,2019-09-04 15:39:22,Hurricane Dorian may have caused a critically endangered bird to go extinct  
2744,gizmodo,2019-09-04 15:28:07,School buildings are now being designed with places to hide from mass shooters  
2745,gizmodo,2019-09-04 15:26:33,Heres a cheaper alternative to the Kindle Oasis  
2746,gizmodo,2019-09-04 15:19:11,NYC subway workers are very very tired of picking up your lost AirPods 
2747,gizmodo,2019-09-04 14:59:18,Meet the scientists training native critters how to survive Australias feral cat invasion  
2748,gizmodo,2019-09-04 14:22:17,RT  One of tonights Nintendo Direct announcements has leaked early and its a big one Overwatch is coming to Switch next month h
2749,gizmodo,2019-09-04 14:16:53,How mesh messaging apps work and why you might need one 
2750,gizmodo,2019-09-04 13:04:02,Rokus new soundbar is also a Roku  
2751,gizmodo,2019-09-04 12:34:05,This new Logitech mouse has a magnetic wheel that feels like magic  
2752,gizmodo,2019-09-04 12:10:03,The Light Phone 2 wants to save you from the internet  
2753,gizmodo,2019-09-04 12:01:32,Asus packed a 4000 Nvidia GPU into a laptop  
2754,gizmodo,2019-09-04 11:30:09,Razers tiny powerful laptop finally gets real graphics  
2755,gizmodo,2019-09-04 11:03:27,How schools are being designed to minimize the number of deaths during a mass shooting  
2756,gizmodo,2019-09-04 07:07:06,This new Logitech mouse has a magnetic wheel that feels like magic  
2757,gizmodo,2019-09-04 04:32:38,More than half the nations state attorneys general could sign on to antitrust inquiry against Google 
2758,gizmodo,2019-09-04 04:04:02,Razers tiny powerful laptop finally gets real graphics  
2759,gizmodo,2019-09-04 03:22:03,Report Amazon really wants to scan your soft soft hands  
2760,gizmodo,2019-09-04 02:44:32,Cory Booker wants to create a firstofitskind Environmental Justice Fund  
2761,gizmodo,2019-09-04 02:34:02,Government agency known for its bonkers tech now tasked with solving fake news  
2762,gizmodo,2019-09-04 02:02:13,Facebook We will halfheartedly apply our rules against fake profiles to the feds too  
2763,gizmodo,2019-09-04 01:02:20,SpaceX says a bug prevented it from receiving warning of possible satellite collision  
2764,gizmodo,2019-09-03 23:53:38,Tesla malfunction locks out owners who depended on app for entry forces them to scramble for keys 
2765,gizmodo,2019-09-03 23:35:59,Hurricane Dorian is headed to the USand some prisons are right in its path  
2766,gizmodo,2019-09-03 23:04:31,Government agency known for its bonkers tech now tasked with solving fake news  
