,User,Date,Tweets
1796,gizmodo,2019-09-27 05:17:14,Uber to launch even more safety features its needed for a while now  
1797,gizmodo,2019-09-27 01:32:33,Facebooks newest testing drops the Like count so now how will I quantify my selfworth  
1798,gizmodo,2019-09-27 00:21:54,Its so Charlie Brown for him to end up in all these damn horror movies  
1799,gizmodo,2019-09-27 00:10:18,The forest fires in Bolivia are killing millions of animals  
1800,gizmodo,2019-09-26 23:58:11,Facebooks Sheryl Sandberg hears concerns of civil rights leaders but offers no promises  
1801,gizmodo,2019-09-26 23:26:52,Amazon execs AirPod gaffe is more disgusting than you think  
1802,gizmodo,2019-09-26 22:57:24,Wanna visit the Galpagos Islands It could soon cost you a lot more  
1803,gizmodo,2019-09-26 22:25:19,Apple wants to freak you out  
1804,gizmodo,2019-09-26 22:05:34,Chiara Sacchi is one of the 16 kids asking the world to recognize climate change as a childrens rights crisis Thi 
1805,gizmodo,2019-09-26 21:51:53,DoorDash breach exposed the private data of 49 million people so change your password immediately 
1806,gizmodo,2019-09-26 21:21:03,Facebooks Sheryl Sandberg hears concerns of civil rights leaders but offers no promises  
1807,gizmodo,2019-09-26 21:07:46,RT  Chiara Sacchi is one of the 16 kidsincluding  five countries in a groundbreaking climate complaint
1808,gizmodo,2019-09-26 21:01:02,Immigration officials are using Google Translate to decide refugees fate report 
1809,gizmodo,2019-09-26 20:29:29,Report US Justice Department to open Facebook antitrust investigation 
1810,gizmodo,2019-09-26 19:59:07,Amazon execs AirPod gaffe is more disgusting than you think  
1811,gizmodo,2019-09-26 19:49:17,Immigration officials are using Google Translate to decide refugees fate report 
1812,gizmodo,2019-09-26 19:44:01,RT  If you hate Memojis popping up in your iPhones emoji menu heres how to disable them for good  ht
1813,gizmodo,2019-09-26 19:37:34,Archaeologists are learning more about who and what lived in this famous Siberian cave  
1814,gizmodo,2019-09-26 19:28:35,Its a bird Its a plane Well its not just ONE plane its the worlds largest collection of scale model airp 
1815,gizmodo,2019-09-26 19:07:02,Bolivias forest fires have left more than 2 million animals dead  
1816,gizmodo,2019-09-26 18:54:56,You dont even have to look at the screen to use this onehanded phone keyboard  
1817,gizmodo,2019-09-26 18:27:07,Smartphones are just tiny TVs anyway 
1818,gizmodo,2019-09-26 18:11:42,Why 17 year old Chiara Sacchi filed a landmark climate complaint against five countriesincluding her own 
1819,gizmodo,2019-09-26 17:50:46,Nintendos Ring Fit Adventure had me huffin and puffin  
1820,gizmodo,2019-09-26 17:39:20,Apple wants to freak you out  
1821,gizmodo,2019-09-26 17:26:35,White House abused highly classified computer system whistleblower complaint claims  
1822,gizmodo,2019-09-26 17:16:03,Report US Justice Department to open Facebook antitrust investigation 
1823,gizmodo,2019-09-26 17:05:53,OnePlus 7T Review A refreshing reset of expectations 
1824,gizmodo,2019-09-26 16:53:09,The clever trick powering the new Apple Watchs alwayson display  
1825,gizmodo,2019-09-26 16:40:26,Wanna visit the Galpagos Islands It could soon cost you a lot more  
1826,gizmodo,2019-09-26 16:24:19,Nintendos Ring Fit Adventure had me huffin and puffin  
1827,gizmodo,2019-09-26 16:12:24,Its about time theres a 55Inch smartphone 
1828,gizmodo,2019-09-26 16:04:44,Was Boris Johnson trying to quote Winston Churchill during his dystopian chicken speech at the UN 
1829,gizmodo,2019-09-26 15:48:26,You dont even have to look at the screen to use this onehanded phone keyboard  
1830,gizmodo,2019-09-26 15:32:13,We want to hear ALL of your bad ideas Join us on 104 at  for a night of absurd problem solving with XK 
1831,gizmodo,2019-09-26 15:00:12,OnePlus 7T Review A refreshing reset of expectations 
1832,gizmodo,2019-09-26 14:40:01,White House abused highly classified computer system whistleblower complaint claims  
1833,gizmodo,2019-09-26 13:37:06,Every single piece of hardware Amazon announced yesterday  
1834,gizmodo,2019-09-26 13:23:29,The clever trick powering the new Apple Watchs alwayson display  
1835,gizmodo,2019-09-26 13:07:00,Archaeologists are learning more about who and what lived in this famous Siberian cave  
1836,gizmodo,2019-09-26 12:33:41,The Director of National Intelligence will testify about the whistleblower complaint against President Trump at 90 
1837,gizmodo,2019-09-26 10:32:47,Was Boris Johnson trying to quote Winston Churchill during his dystopian chicken speech at the UN 
1838,gizmodo,2019-09-26 09:36:25,Jeff Bezos How about just letting Amazon draft any possible facial recognition laws  
1839,gizmodo,2019-09-26 09:05:18,Watch the Director of National Intelligence testify about the whistleblower complaint against President Trump on Yo 
1840,gizmodo,2019-09-26 04:31:42,OK so who went to all the trouble of making this eerily realistic but probably fake Trump pee tape 
1841,gizmodo,2019-09-26 02:28:18,Facebook has banked nearly 16 million from SPLC designated hate groups since May 2018  
1842,gizmodo,2019-09-26 01:12:24,Amazons favorite new word is privacy but does it even know the meaning  
1843,gizmodo,2019-09-26 00:34:13,Every single piece of hardware Amazon announced today  
1844,gizmodo,2019-09-26 00:19:20,Babies in prehistoric Europe drank animal milk from ceramic sippy cups  
1845,gizmodo,2019-09-25 23:48:38,Dating site Match knowingly profited off romance scammers FTC suit claims  
1846,gizmodo,2019-09-25 23:17:52,Creator of labradoodles says he unleashed Frankensteins monster 
1847,gizmodo,2019-09-25 22:54:38,Video game preservationist finds rare prototype N64 controller and the joystick that shouldve been 
1848,gizmodo,2019-09-25 22:44:23,A lifelong love with flight led to this mans recordbreaking collection of model airplanes  
1849,gizmodo,2019-09-25 22:17:53,Amazons favorite new word is privacy but does it even know the meaning  
1850,gizmodo,2019-09-25 22:07:44,A woman may have gotten broken heart syndrome after eating too much wasabi at a wedding  
1851,gizmodo,2019-09-25 21:51:36,Match knowingly profited off romance scammers FTC suit claims  
1852,gizmodo,2019-09-25 21:41:05,The Trump administration is so desperate to drill in the Arctic that its turned to climate denial 
1853,gizmodo,2019-09-25 21:28:18,I had reached peak goose  
1854,gizmodo,2019-09-25 21:13:07,Creator of labradoodles says he unleashed Frankensteins monster 
1855,gizmodo,2019-09-25 21:08:28,Every single piece of hardware Amazon announced today  
1856,gizmodo,2019-09-25 20:56:25,Whoops Google Says Mysterious Wave of Unbootable Macs Is Their Bad  
1857,gizmodo,2019-09-25 20:44:01,Facebooks Horizon is a new VR social network inspired by Spielbergs worst movie  
1858,gizmodo,2019-09-25 20:31:57,Sprint took millions in federal subsidies for service it didnt provide FCC says  
1859,gizmodo,2019-09-25 20:05:56,Megabots throws in the towel and puts battle robots on eBay 
1860,gizmodo,2019-09-25 19:10:49,The new Apple Watch is the best one yetthanks to a major OS upgrade 
1861,gizmodo,2019-09-25 19:00:14,A lifelong love with flight led to this mans recordbreaking collection of model airplanes  
1862,gizmodo,2019-09-25 18:42:29,Video game preservationist finds rare prototype N64 controller and the joystick that shouldve been 
1863,gizmodo,2019-09-25 18:27:13,All the way that Amazon is fixing Alexa  
1864,gizmodo,2019-09-25 17:49:01,A woman may have gotten broken heart syndrome after eating too much wasabi at a wedding  
1865,gizmodo,2019-09-25 17:13:08,Babies in prehistoric Europe drank animal milk from ceramic sippy cups  
1866,gizmodo,2019-09-25 17:01:39,The new Apple Watch is the best one yetthanks to a major OS upgrade 
1867,gizmodo,2019-09-25 16:33:35,There is not a climate crisis Trump administration spouts brazen bullshit to justify Arctic drilling 
1868,gizmodo,2019-09-25 16:23:08,Juul Labs announced that its CEO has resigned and the company will stop all advertising  
1869,gizmodo,2019-09-25 16:11:58,Megabots throws in the towel and puts battle robots on eBay 
1870,gizmodo,2019-09-25 16:01:35,A birdwatchers review of Untitled Goose Game  
1871,gizmodo,2019-09-25 15:40:33,Whoops Google Says Mysterious Wave of Unbootable Macs Is Their Bad  
1872,gizmodo,2019-09-25 14:30:29,British Prime Minister Boris Johnson has warned of pinkeyed Terminators and limbless chickens of the future in 
1873,gizmodo,2019-09-25 12:23:35,Sprint took millions in federal subsidies for service it didnt provide FCC says  
1874,gizmodo,2019-09-25 12:13:22,Apples callblocking feature may be a little TOO good  
1875,gizmodo,2019-09-25 12:03:04,Juul CEO resigns company announces it will stop all advertising  
1876,gizmodo,2019-09-25 11:16:02,A new IPCC report shows the extreme impacts that humancaused climate change will haveand is already havingon eve 
1877,gizmodo,2019-09-25 10:38:25,Unprecedented conditions will rule the oceans by midcentury due to humancaused climate change a new report find 
1878,gizmodo,2019-09-25 10:34:46,Boris Johnson warns of pinkeyed Terminators and limbless chickens in absolutely bonkers UN speech 
1879,gizmodo,2019-09-25 08:07:36,Clive Palmer an Australian billionaire and dumb baby is threatening to sue a comedian for photoshopping him to lo 
1880,gizmodo,2019-09-25 04:38:23,Data analytics giant Comscore former CEO settle with SEC for cooking the books  
1881,gizmodo,2019-09-25 02:51:50,Massachusetts Gov Charlie Baker orders 4 month ban on sale of all yes all vaping products 
1882,gizmodo,2019-09-25 02:33:12,Pesticides not sonic weapons may have made diplomats in Cuba sick preliminary study finds  
1883,gizmodo,2019-09-25 02:02:23,Newly discovered interstellar comet has an official name 2IBorisov  
1884,gizmodo,2019-09-25 01:31:07,Skies are red in Indonesia as forest fires rage  
1885,gizmodo,2019-09-25 01:10:03,Greta Thunbergs message has never been about her Its been about human rights from the beginning 
1886,gizmodo,2019-09-25 00:38:01,Stop what youre doing and upgrade to iOS 131 right now 
1887,gizmodo,2019-09-25 00:26:45,Police say woman bit camels balls The camel did nothing wrong 
1888,gizmodo,2019-09-24 23:55:55,US military issues warning to troops about incel violence at Joker screenings  
1889,gizmodo,2019-09-24 23:24:58,Google contractors in Pennsylvania join Steelworkers union  
1890,gizmodo,2019-09-24 22:53:57,Happy 20th anniversary West Nile virus  
1891,gizmodo,2019-09-24 22:40:59,Pesticides not sonic weapons may have made diplomats in Cuba sick preliminary study finds  
1892,gizmodo,2019-09-24 22:30:47,Corals from Hawaii to the Caribbean are at risk of mass bleaching  
1893,gizmodo,2019-09-24 22:16:51,Apples callblocking feature may be a little too good  
1894,gizmodo,2019-09-24 22:04:54,Why HPs 4500 workstation laptop is such a beautiful beast  
1895,gizmodo,2019-09-24 21:45:06,Police say woman bit camels balls The camel did nothing wrong 
1896,gizmodo,2019-09-24 21:32:37,US military issues warning to troops about incel violence at Joker screenings  
1897,gizmodo,2019-09-24 21:22:19,This isnt about Greta cowards  
1898,gizmodo,2019-09-24 20:59:57,Kik kills off messaging app to focus on cryptocurrency amidst rising company chaos 
1899,gizmodo,2019-09-24 20:49:37,Goodbye Mr WeWork man  
1900,gizmodo,2019-09-24 20:31:11,Google contractors in Pennsylvania unionize  
1901,gizmodo,2019-09-24 20:19:05,Forest fires are turning Indonesia into Mars  
1902,gizmodo,2019-09-24 20:07:31,Adobes fantastic iPad app for drawing and painting is finally available  
1903,gizmodo,2019-09-24 19:25:14,Spot Boston Dynamics robot dog is finally available for sale  
1904,gizmodo,2019-09-24 19:13:17,The Russians know why there was a hole in a Soyuz spacecraft docked to the ISS but they wont tell NASA why 
1905,gizmodo,2019-09-24 19:01:58,Why HPs 4500 workstation laptop is such a beautiful beast  
1906,gizmodo,2019-09-24 18:51:53,Newly discovered interstellar comet has an official name 2IBorisov  
1907,gizmodo,2019-09-24 18:37:34,Twenty years ago West Nile invaded the USand its been winning ever since  
1908,gizmodo,2019-09-24 18:11:53,Facebook just coughed up close to 1 billion for a company that makes brainreading wristbands 
1909,gizmodo,2019-09-24 17:59:07,Apples callblocking feature may be a little too good  
1910,gizmodo,2019-09-24 17:53:07,Goodbye Mr WeWork man  
1911,gizmodo,2019-09-24 17:53:07,We want to hear ALL of your bad ideas Join us on 104 at  for a night of absurd problem solving with XK 
1912,gizmodo,2019-09-24 17:42:25,Google wins EU case over right to be forgotten laws  
1913,gizmodo,2019-09-24 17:29:27,Stop what youre doing and upgrade to iOS 131 right now 
1914,gizmodo,2019-09-24 17:16:46,Hot oceans are raising the risk of coral bleaching around the globe  
1915,gizmodo,2019-09-24 16:59:16,Adobes fantastic iPad app for drawing and painting is finally available  
1916,gizmodo,2019-09-24 16:32:48,The screen on Xiaomis latest concept phone just keeps going and going and going  
1917,gizmodo,2019-09-24 16:01:13,All the ways you can try and fix a sticky MacBook keyboard  
1918,gizmodo,2019-09-24 15:49:46,The Russians know why there was a hole in a Soyuz spacecraft docked to the ISS but they wont tell NASA why 
1919,gizmodo,2019-09-24 15:37:02,Spot Boston Dynamics robot dog is finally available for sale  
1920,gizmodo,2019-09-24 15:26:43,Australian billionaire Clive Palmer is threatening to sue for defamation over this photoshop of him as President Tr 
1921,gizmodo,2019-09-24 14:47:05,The screen wraps alllllllll the way around on Xiaomis latest concept phone 
1922,gizmodo,2019-09-24 14:21:42,Facebook just coughed up close to 1 billion for a company that makes brainreading wristbands 
1923,gizmodo,2019-09-24 13:24:24,Google wins EU case over right to be forgotten laws  
1924,gizmodo,2019-09-24 12:57:55,Whats the main difference between the iPhone 11 and iPhone 11 Pro Actually there are four Heres what you need 
1925,gizmodo,2019-09-24 12:42:13,All the ways you can try and fix a sticky MacBook keyboard  
1926,gizmodo,2019-09-24 11:31:48,Billionaire threatens to sue YouTuber for calling him Fatty McFuckhead and photoshopping him as Trumps baby 
1927,gizmodo,2019-09-24 11:00:28,Apple will keep on making Mac Pros in Texas after scoring trade war exemptions  
1928,gizmodo,2019-09-24 04:20:13,Australian state to use smartphone detection cams to catch and fine distracted drivers  
1929,gizmodo,2019-09-24 02:37:04,If youre in NYC on October 4th join us at  for a night devoted to the most contrived solutions to munda 
1930,gizmodo,2019-09-24 02:25:51,Report Juuls massive vape cloud of trouble grows with feds launching criminal investigation 
1931,gizmodo,2019-09-24 01:51:39,Were losing Arctic sea iceand thats bad news for the planet  
1932,gizmodo,2019-09-24 00:22:59,A braininfecting virus carried by mosquitoes is spreading far and wide this year  
1933,gizmodo,2019-09-24 00:06:26,Netflix turns negative  
1934,gizmodo,2019-09-23 23:44:50,Climate change is a childrens rights issue Heres why  
1935,gizmodo,2019-09-23 23:31:32,Researchers found a good reason to attach a nail gun to a flying drone  
1936,gizmodo,2019-09-23 23:13:00,If you missed Greta Thunbergs climate speech before the United Nations earlier today weve got you covered 
1937,gizmodo,2019-09-23 22:41:57,Leaker claims Alexapowered earbuds are Amazons next big device 
1938,gizmodo,2019-09-23 22:19:47,Trump showed up to the UN climate meetings after all for 15 whole minutes  
1939,gizmodo,2019-09-23 22:02:35,Netflix turns negative  
1940,gizmodo,2019-09-23 21:51:39,Ikea expands its augmented reality app lets you fill an entire room with virtual Swedish furniture 
1941,gizmodo,2019-09-23 21:40:22,Leaker claims Alexapowered earbuds are Amazons next big device 
1942,gizmodo,2019-09-23 21:29:21,Can you overdose on weed  
1943,gizmodo,2019-09-23 21:18:08,Arctic sea ice hits second lowest extent in satellite record  
1944,gizmodo,2019-09-23 21:12:50,RT  Wrote about my hunt for aliens 
1945,gizmodo,2019-09-23 21:10:18,RIP Pizol glacier  
1946,gizmodo,2019-09-23 20:56:04,Snapchat reportedly has a dossier of dirt on Facebook to share with the feds  
1947,gizmodo,2019-09-23 20:46:06,Researchers found a good reason to attach a nail gun to a flying drone  
1948,gizmodo,2019-09-23 20:35:04,New videos suggest the Nintendo Switch Lite might have a drift problem too  
1949,gizmodo,2019-09-23 20:25:00,A braininfecting virus carried by mosquitoes is spreading far and wide this year  
1950,gizmodo,2019-09-23 20:08:44,A Nevada law that fines companies for selling private data is about to go into effect  
1951,gizmodo,2019-09-23 19:41:25,In her own words why teen climate activist  is suing the world for violating her rights 
1952,gizmodo,2019-09-23 19:10:57,Your Professor Chonkers really does form a bond with you study finds  
1953,gizmodo,2019-09-23 18:58:00,DJIs 120 smartphone stabilizer shouldnt be this good  
1954,gizmodo,2019-09-23 18:38:02,RT   is one of the 16 kids suing five countries in a groundbreaking climate lawsuit announced on Monday Heres w
1955,gizmodo,2019-09-23 18:15:24,How dare you Watch Greta Thunbergs full heartwrenching UN climate speech  
1956,gizmodo,2019-09-23 17:55:43,I stormed Area 51 where memes abducted reality  
1957,gizmodo,2019-09-23 17:41:12,New research promises electric car batteries that last for a million miles  
1958,gizmodo,2019-09-23 17:27:05,New videos suggest the Nintendo Switch Lite might have a drift problem too  
1959,gizmodo,2019-09-23 17:22:06,Trump endures nearly 15 whole minutes of UN Climate Summit  
1960,gizmodo,2019-09-23 17:04:05,16 kids including  sue five countries in groundbreaking climate lawsuit  
1961,gizmodo,2019-09-23 16:43:15,Ikea expands its augmented reality app lets you fill an entire room with virtual Swedish furniture 
1962,gizmodo,2019-09-23 16:26:47,Google changing privacy protections for assistant plans to autodelete more of your audio data 
1963,gizmodo,2019-09-23 16:14:59,Disney CEO explains Twitter perfectly Why am I doing this Why do I endure this pain  
1964,gizmodo,2019-09-23 16:04:28,BREAKING 16 young people including  are suing five of the worlds major carbon polluters 
1965,gizmodo,2019-09-23 15:57:17,The Samsung Galaxy Fold finally goes on sale this week again 
1966,gizmodo,2019-09-23 15:47:12,DJIs 100 smartphone stabilizer shouldnt be this good  
1967,gizmodo,2019-09-23 15:37:03,The Swiss just held a funeral for a dead glacier  
1968,gizmodo,2019-09-23 15:14:59,Cats really do bond with their humans study finds  
1969,gizmodo,2019-09-23 14:45:55,Google changing privacy protections for Assistant plans to autodelete more of your audio data 
1970,gizmodo,2019-09-23 14:35:01,You cant overdose on weed right  
1971,gizmodo,2019-09-23 14:24:14,New research promises electric car batteries that last for a million miles  
1972,gizmodo,2019-09-23 14:00:33,The Samsung Galaxy Fold finally goes on sale this week again 
1973,gizmodo,2019-09-23 11:50:23,Disney CEO explains Twitter perfectly Why am I doing this Why do I endure this pain  
1974,gizmodo,2019-09-23 00:42:28,Area 51 Impossible burger and duck gifs best Gizmodo stories of the week  
1975,gizmodo,2019-09-22 23:00:38,UN report warns that five year period ending in 2019 is hottest on record  
1976,gizmodo,2019-09-22 19:13:32,World Health Organization says Tanzania is withholding info on suspected Ebola cases  
1977,gizmodo,2019-09-22 13:27:39,We will rise to the challenge we will hold those who are the most responsible for this crisis accountable and we 
1978,gizmodo,2019-09-22 10:21:52,For me it was very important to do something and doing it alone was the only way  
1979,gizmodo,2019-09-21 23:54:41,Huawei says Mate 30 series bootloader will be unlockable allowing easier access to Google apps 
1980,gizmodo,2019-09-21 21:54:42,Twitter bans Saudi official implicated in Khashoggi murder hundreds of other proSaudi accounts 
1981,gizmodo,2019-09-21 20:12:25,TiVo reportedly rolling out preroll ads that play before users can watch recorded video  
1982,gizmodo,2019-09-21 17:11:44,This is only the beginning young people demand justice at New Yorks ClimateStrike  
1983,gizmodo,2019-09-21 16:21:28,Fridays ClimateStrike through the eyes of a student photojournalist  
1984,gizmodo,2019-09-21 14:16:01,Do you remember  
1985,gizmodo,2019-09-21 12:03:44,Why families were on strike this Friday ClimateStrike   
1986,gizmodo,2019-09-21 11:30:52,We stormed it I was part of history last nightInsider footage of the storming of Area 51 
1987,gizmodo,2019-09-21 03:18:09,Google reportedly claimed to have achieved quantum supremacy a major milestone  
1988,gizmodo,2019-09-21 02:34:06,We stormed it I was part of history last nightInsider footage of the storming of Area 51 
1989,gizmodo,2019-09-21 02:26:21,Germany is taking climate action but some say its not enough  
1990,gizmodo,2019-09-21 01:47:16,YouTube faces angry mob again CEO promises to rethink new verification policy 
1991,gizmodo,2019-09-21 01:31:45,Spooky black hole on Jupiter is just a big shadow  
1992,gizmodo,2019-09-21 00:59:31,Walmart bans ecigs continues to sell things that definitely kill people 
1993,gizmodo,2019-09-21 00:45:23,Worse than previously reported the Facebook story  
1994,gizmodo,2019-09-21 00:31:45,Farewell forever Three Mile Island  
1995,gizmodo,2019-09-21 00:16:04,Google says its achieved quantum supremacy a worldfirst report  
1996,gizmodo,2019-09-21 00:01:43,I feel like I cant look her in the eye and tell her I did nothing when she was born ClimateStrike 
1997,gizmodo,2019-09-20 23:58:39,Renewable energy is growing  
1998,gizmodo,2019-09-20 23:40:26,Tinders horny streaming series for Gen Z exposes your terrible soul  
1999,gizmodo,2019-09-20 23:25:58,Google gives Chrome better tab management and deeper customization 
2000,gizmodo,2019-09-20 23:11:02,YouTube faces angry mob again CEO promises to rethink new verification policy 
2001,gizmodo,2019-09-20 22:56:01,Busted 10 million tech support scam that preyed on the elderly  
2002,gizmodo,2019-09-20 22:37:26,Germanys new 60 billion climate package does the bare minimum  
2003,gizmodo,2019-09-20 22:22:09,Walmart bans eCigs continues to sell things that definitely kill people 
2004,gizmodo,2019-09-20 22:01:06,The next Surface Laptop might have a powerful surprise  
2005,gizmodo,2019-09-20 21:37:58,FBI served secret subpoenas to a video game developer antivirus maker and more 
2006,gizmodo,2019-09-20 21:37:57,RT  Todays ClimateStrike is over in NYC but the fight for our planet continues Keep reading  for ever
2007,gizmodo,2019-09-20 21:06:35,The news app thats testing a promising way to build in privacy from the ground up 
2008,gizmodo,2019-09-20 20:57:00,RT   is finally on stage She says at least 250000 people are out in New York alone ClimateStrike 
2009,gizmodo,2019-09-20 20:55:40,RT  We are not sacrificing our education for politicians to take selfies with us and tell us that they really really like what w
2010,gizmodo,2019-09-20 20:54:49,This nightmare game was designed by a dentist in MS Paint 
2011,gizmodo,2019-09-20 20:31:56,iPhone 11 The Gizmodo Review  
2012,gizmodo,2019-09-20 20:07:41,Worse than previously reported the Facebook story  
2013,gizmodo,2019-09-20 19:57:03,RIP to a real one Three Mile Island nuclear power plant shuts down last reactor  
2014,gizmodo,2019-09-20 19:52:07,A memo to tech titans on the day of the ClimateStrike Its time to pick a side  
2015,gizmodo,2019-09-20 19:34:31,Amazons sweeping climate plan is full of gaping holes  
2016,gizmodo,2019-09-20 19:24:15,RT  you know on second thought ClimateStrike 
2017,gizmodo,2019-09-20 19:18:23,FBI served secret subpoenas to a video game developer antivirus maker and more  
2018,gizmodo,2019-09-20 19:07:29,Todays ClimateStrike was an absolute successall around the world  
2019,gizmodo,2019-09-20 18:57:07,The world is installing tons of renewables but coal could screw things up  
2020,gizmodo,2019-09-20 18:54:43,RT  sign roundup part 2 ClimateStrike 
2021,gizmodo,2019-09-20 18:54:39,RT  as expected the signs out here are a ClimateStrike ClimateAction 
2022,gizmodo,2019-09-20 18:47:06,The White House has released a new photo of the most powerful man in the world meeting with President Trump 
2023,gizmodo,2019-09-20 18:41:02,Try to hate the iPhone 11 Pro  
2024,gizmodo,2019-09-20 18:27:44,Naruto run Some guy whos probably going to get himself killed is the first Storm Area 51 meme 
2025,gizmodo,2019-09-20 18:22:07,RT  Climate change is a public health issuea mental health issue  med school students at  ClimateAction ht
2026,gizmodo,2019-09-20 18:17:04,The news app thats testing a promising way to build in privacy from the ground up 
2027,gizmodo,2019-09-20 18:06:31,This nightmare game was designed by a dentist in MS Paint 
2028,gizmodo,2019-09-20 17:55:47,Spooky black hole on Jupiter is just a big shadow  
2029,gizmodo,2019-09-20 17:54:37,RT  Not even a fraction of the crowd gathered ClimateStrike 
2030,gizmodo,2019-09-20 17:54:37,RT  WE ARE UNSTOPPABLE A BETTER WORLD IS POSSIBLE ClimateStrike 
2031,gizmodo,2019-09-20 17:27:42,Heres our iPhone 11 review Its legitimately great  
2032,gizmodo,2019-09-20 17:14:23,Were at the New York Climate Strike  
2033,gizmodo,2019-09-20 17:00:05,The next Surface Laptop might have a powerful surprise  
2034,gizmodo,2019-09-20 16:53:30,A memo to tech titans on the day of the ClimateStrike Its time to pick a side  
2035,gizmodo,2019-09-20 16:36:14,Cooking the new Impossible burger makes me hungry for beef  
2036,gizmodo,2019-09-20 16:20:54,Google gives Chrome better tab management and deeper customization 
2037,gizmodo,2019-09-20 15:50:30,Tinders horny streaming series for Gen Z exposes your terrible soul  
2038,gizmodo,2019-09-20 15:42:34,RT  Were in New York City for todays ClimateStrikeWere still a couple of blocks from Foley Square and still have 15 hours
