,User,Date,Tweets
557,gizmodo,2019-10-30 23:52:15,The experimental future of digging up the past video  
558,gizmodo,2019-10-30 23:19:19,ATampTs new unlimited plans have wildly different data caps 
559,gizmodo,2019-10-30 22:47:40,Jack Dorsey takes obvious opportunity to backstab Facebook with Twitter political ad ban  
560,gizmodo,2019-10-30 21:58:34,ATampTs new unlimited plans have wildly different data caps 
561,gizmodo,2019-10-30 21:25:43,A radio enthusiast was livestreaming sensitive medical patient information being sent to pagers 
562,gizmodo,2019-10-30 21:13:22,How a telescope tragedy led to this amazing new xray image  
563,gizmodo,2019-10-30 20:41:40,Deep learning is making video game characters move like real people  
564,gizmodo,2019-10-30 18:49:12,The CDC is still warning people to stop vaping completely over lung illness casesbut why  
565,gizmodo,2019-10-30 18:13:58,I miss the OLPC a little laptop that dreamed bigger than it could deliver  
566,gizmodo,2019-10-30 18:02:03,AI bot is the first to play StarCraft II at the grandmaster level  
567,gizmodo,2019-10-30 17:37:27,Deep learning is making video game characters move like real people  
568,gizmodo,2019-10-30 17:26:37,Microsoft made a smartphone app that can administer driving tests without an instructor  
569,gizmodo,2019-10-30 16:59:09,How a telescope tragedy led to this amazing new xray image  
570,gizmodo,2019-10-30 16:29:19,LGs G8X Dual Screen phone gives you the most screen for your money 
571,gizmodo,2019-10-30 16:10:29,A deep look into iPhones new Deep Fusion feature  
572,gizmodo,2019-10-30 15:59:31,The experimental future of digging up the past video  
573,gizmodo,2019-10-30 14:50:51,The CDC is still warning people to stop vaping completely over lung illness casesbut why  
574,gizmodo,2019-10-30 14:27:05,The latest iffy wellness trend is CBDinfused workout gear  
575,gizmodo,2019-10-30 14:14:51,RT  Dark mode supposedly has two big benefits It helps your battery life and reduces strain on the eyes But how true is that
576,gizmodo,2019-10-30 14:00:27,LGs G8X Dual Screen phone gives you the most screen for your money 
577,gizmodo,2019-10-30 13:51:28,Microsoft made a smartphone app that can administer driving tests without an instructor  
578,gizmodo,2019-10-30 13:36:16,DJI released its latest folding drone the Mavic Mini Its so small and light that you can start flying without ha 
579,gizmodo,2019-10-30 13:00:06,DJIs Mavic Mini wants to be the drone for everyone  
580,gizmodo,2019-10-30 12:05:50,Nobody likes Motos as much as Felipe Berhau does Nobody 
581,gizmodo,2019-10-30 09:37:38,HBO Max is bringing DCs Green Lantern to life with a new show  
582,gizmodo,2019-10-30 01:35:39,How this decade of archaeology changed what we know about human origins  
583,gizmodo,2019-10-30 01:04:14,The perfect Halloween costume is a projector mask that can turn you into anyone  
584,gizmodo,2019-10-30 00:32:21,Facebook sues shadowy Israeli cyberweapons firm NSO Group over WhatsApp malware  
585,gizmodo,2019-10-30 00:01:22,Juul gradually weening itself off employees  
586,gizmodo,2019-10-29 23:46:28,HBO Max is bringing DCs Green Lantern to life with a new show  
587,gizmodo,2019-10-29 23:34:16,Samsungs second foldable is a flip phone with a nextgen design 
588,gizmodo,2019-10-29 23:21:33,Satellites track the worlds longest lightning bolt  
589,gizmodo,2019-10-29 22:51:19,Samsung brings big bright QLED displays to laptops for the first time 
590,gizmodo,2019-10-29 22:35:53,Terrorists win  
591,gizmodo,2019-10-29 22:23:27,Transitioning to renewables would be a major boost to public health  
592,gizmodo,2019-10-29 21:56:13,Samsungs second foldable is a flip phone with a nextgen design 
593,gizmodo,2019-10-29 21:49:31,Juul gradually weening itself off employees  
594,gizmodo,2019-10-29 21:36:36,The perfect Halloween costume is a projector mask that can turn you into anyone  
595,gizmodo,2019-10-29 21:20:23,Untitled Goose Game vulnerability allows hackers to sow chaos only a goose could love 
596,gizmodo,2019-10-29 21:02:04,Samsung brings big bright QLED displays to laptops for the first time 
597,gizmodo,2019-10-29 20:47:59,Nintendos Ring Fit Adventure tricked me into liking squats but the calorieburn was lacking 
598,gizmodo,2019-10-29 20:16:55,Heres the internets birth certificate from 50 years ago today  
599,gizmodo,2019-10-29 19:57:08,How to make a black hole in a science lab  
600,gizmodo,2019-10-29 19:26:47,Nintendos Ring Fit Adventure tricked me into liking squats but the calorieburn was lacking 
601,gizmodo,2019-10-29 18:55:03,Here they are the dumbest smart glasses  
602,gizmodo,2019-10-29 17:40:39,Even your parents could master Photoshops new AIpowered automatic selection tools  
603,gizmodo,2019-10-29 17:28:29,Apple pulls iOS 132 after users complain update bricks HomePods 
604,gizmodo,2019-10-29 17:16:48,Satellites track the worlds longest lightning bolt  
605,gizmodo,2019-10-29 17:04:56,Switching to renewables may spur trillions of dollars worth of benefits in the US  
606,gizmodo,2019-10-29 16:50:18,Untitled Goose Game vulnerability allows hackers to sow chaos only a goose could love 
607,gizmodo,2019-10-29 16:16:38,The new Pixel 4 realtime transcription app is amazingwhat to use if you cant get it  
608,gizmodo,2019-10-29 16:00:08,How to make a black hole in a science lab  
609,gizmodo,2019-10-29 15:41:07,Here they are the dumbest smart glasses  
610,gizmodo,2019-10-29 15:36:17,Apple pulls iOS 132 after users complain update bricks HomePods 
611,gizmodo,2019-10-29 15:26:53,Heres the internets birth certificate from 50 years ago today  
612,gizmodo,2019-10-29 13:53:54,Even your parents could master Photoshops new AIpowered automatic selection tools  
613,gizmodo,2019-10-29 13:34:03,How this decade of archaeology changed what we know about human origins  
614,gizmodo,2019-10-29 12:01:04,The Game of Thrones guys are no longer making their Star Wars movies  
615,gizmodo,2019-10-29 04:14:25,The Game of Thrones guys are no longer making their Star Wars movies  
616,gizmodo,2019-10-29 03:07:29,Hubble spots a ghoulish face in the depths of space  
617,gizmodo,2019-10-29 02:34:38,FCC proposes banning US firms from using federal subsidies to purchase Huawei ZTE equipment 
618,gizmodo,2019-10-29 02:01:58,Who is Dani the woman Terminators are after in Dark Fate We talked to actress Natalia Reyes about taking over the 
619,gizmodo,2019-10-29 01:31:26,Mysterious asteroid may actually be the smallest dwarf planet in the solar system  
620,gizmodo,2019-10-29 01:01:12,Could another Day Zero be coming for South Africa  
621,gizmodo,2019-10-29 00:33:53,Instagram removes fictional depictions of selfharm and suicide  
622,gizmodo,2019-10-28 23:46:30,A painting hanging outside a French womans kitchen for decades just sold at auction for 268 million 
623,gizmodo,2019-10-28 23:17:26,Microsoft has a plan to get you locked into the nextgen Xbox now 
624,gizmodo,2019-10-28 22:45:11,Facebook employees to Zuckerberg political speech policy is a threat  
625,gizmodo,2019-10-28 22:13:39,Maybe this is how well finally get a Pixel Watch 
626,gizmodo,2019-10-28 21:55:58,Thats one ginormous cyclone  
627,gizmodo,2019-10-28 21:43:03,The GoPro Max makes shooting 360degree video dead simple  
628,gizmodo,2019-10-28 21:28:07,Who is Dani the woman Terminators are after in Dark Fate We talked to actress Natalia Reyes about taking over the 
629,gizmodo,2019-10-28 21:17:12,MIT researchers taught autonomous cars to see around corners  
630,gizmodo,2019-10-28 21:13:30,Microsoft has a plan to get you locked into the nextgen Xbox now 
631,gizmodo,2019-10-28 20:52:44,Why do placebos work  
632,gizmodo,2019-10-28 20:40:07,Hubble spots a ghoulish face in the depths of space  
633,gizmodo,2019-10-28 20:35:36,A painting hanging outside a French womans kitchen for decades just sold at auction for 268 million 
634,gizmodo,2019-10-28 20:24:04,Samsungs space selfie satellite plummets from sky onto Michigan horse farm 
635,gizmodo,2019-10-28 20:11:01,California wildfire season is in full swing  
636,gizmodo,2019-10-28 19:52:49,South Africa rations water as it tries to avoid Day Zero again  
637,gizmodo,2019-10-28 19:29:05,A note to our readers  
638,gizmodo,2019-10-28 19:23:13,Maybe this is how we finally get a Pixel Watch 
639,gizmodo,2019-10-28 19:09:51,Apple announces AirPods Pro with noisecancellation coming on October 30th 
640,gizmodo,2019-10-28 18:38:05,Even Facebook employees think the companys political speech policy is awful  
641,gizmodo,2019-10-28 18:25:19,The GoPro Max is GoPros second take on a 360degree action camera and man is it a big stepup from their first at 
642,gizmodo,2019-10-28 18:01:32,The underpaid women of Instacart are fed up  
643,gizmodo,2019-10-28 17:30:04,The GoPro Max makes shooting 360degree video dead simple  
644,gizmodo,2019-10-28 17:17:57,Apple announces AirPods Pro with noisecancellation coming on October 30th 
645,gizmodo,2019-10-28 17:09:56,Nvidias new AI lets you know if your pet would look cuter as a different animal  
646,gizmodo,2019-10-28 16:39:45,Nvidias newest TV settop box does a damn good job using AI to turn content 4K  
647,gizmodo,2019-10-28 16:08:32,Mysterious asteroid may actually be the smallest dwarf planet in the solar system  
648,gizmodo,2019-10-28 15:37:06,Samsungs space selfie satellite plummets from sky onto Michigan horse farm 
649,gizmodo,2019-10-28 15:17:18,Top secret Air Force spaceplane lands in Florida after spending over 2 years in orbit  
650,gizmodo,2019-10-28 15:04:14,Sheertex maker of unbreakable pantyhose now makes shoes because why not 
651,gizmodo,2019-10-28 14:32:56,Hundreds of thousands have fled their homes as wildfires explode across California  
652,gizmodo,2019-10-28 14:12:40,The underpaid women of Instacart are fed up  
653,gizmodo,2019-10-28 13:57:16,Nvidias new AI lets you know if your pet would look cuter as a different animal  
654,gizmodo,2019-10-28 13:35:04,Adobe gets permission from US government to continue offering services in Venezuela  
655,gizmodo,2019-10-28 13:24:32,Sheertex maker of unbreakable pantyhose now makes shoes because why not  
656,gizmodo,2019-10-28 13:13:03,Why do placebos work  
657,gizmodo,2019-10-28 12:43:48,Facebook finally abides by its own ad policies  
658,gizmodo,2019-10-28 12:00:05,Nvidias newest TV settop box does a damn good job using AI to turn content 4K  
659,gizmodo,2019-10-28 11:13:03,Top secret spaceplane lands in Florida after spending over 2 years in orbit  
660,gizmodo,2019-10-28 11:02:10,Sennheisers Momentum Wireless headphones are still the king of their categorybut that doesnt mean we dont have 
661,gizmodo,2019-10-28 09:33:46,Adobe gets permission from US to continue offering services in Venezuela  
662,gizmodo,2019-10-28 00:17:05,A PSA from the hacker who easily cracked the hotel bedside robots  
663,gizmodo,2019-10-27 23:47:24,The best alternatives to the subscription services taking over your digital life  
664,gizmodo,2019-10-27 23:17:04,First look at Sycamore Googles quantum computer  
665,gizmodo,2019-10-27 23:14:03,You lost how much on scooters  
666,gizmodo,2019-10-27 21:16:06,Microsoft and AMDs Surface Laptop 3 is something special  
667,gizmodo,2019-10-27 20:16:03,Googles Pixebook Go is really weird but holy crap that battery life  
668,gizmodo,2019-10-27 19:47:22,The best alternatives to the subscription services taking over your digital life  
669,gizmodo,2019-10-27 19:16:02,The Hero8 Black is the GoPro Ive been waiting to see for years without realizing it 
670,gizmodo,2019-10-27 18:16:05,Beats turned a corner with its new noisecanceling headphones  
671,gizmodo,2019-10-27 17:16:03,Filtered cigarettes are just another scam by the tobacco industry and its time we ban them experts argue 
672,gizmodo,2019-10-27 16:16:07,The most bullshit health and wellness fads of the decade  
673,gizmodo,2019-10-27 15:15:02,Why your web browser is running slowly and how to fix it  
674,gizmodo,2019-10-27 14:46:44,Check out the worlds largest collection of scale model airplanes 
675,gizmodo,2019-10-27 14:15:04,A free year of Disney is coming to Verizon customers  
676,gizmodo,2019-10-27 03:15:05,Your vape litter is becoming an environmental disaster  
677,gizmodo,2019-10-27 02:45:05,How posting memes could soon cost you 30000  
678,gizmodo,2019-10-27 02:15:04,The 25 Apple Arcade games that make it worth the money  
679,gizmodo,2019-10-27 01:28:11,Employees continued to get screwed by MyPayrollHR fiasco  
680,gizmodo,2019-10-27 01:15:01,Its agoodbye Mario  
681,gizmodo,2019-10-27 00:29:53,New details on Microsofts dualscreen Windows OS leak  
682,gizmodo,2019-10-27 00:15:05,Dont feel guilty for upgrading to the iPhone 11 
683,gizmodo,2019-10-26 22:14:06,These rateating monkeys are a surprisingly effective form of pest control  
684,gizmodo,2019-10-26 21:50:55,One month with the improved Galaxy Fold and I actually still like it  
685,gizmodo,2019-10-26 21:26:31,Employees continued to get screwed by MyPayrollHR fiasco  
686,gizmodo,2019-10-26 21:14:37,iPhone users are accidentally deleting their emails thanks to Apples boneheaded UI update  
687,gizmodo,2019-10-26 18:03:01,One month with the Samsung Galaxy Fold Folding is believing
688,gizmodo,2019-10-26 16:40:58,One month with the improved Galaxy Fold and I actually still like it  
689,gizmodo,2019-10-26 15:31:03,Facebooks pretty sure that this will finally be the time it doesnt fuck up news  
690,gizmodo,2019-10-26 15:20:21,New evidence suggests Neanderthals were capable of starting fires  
691,gizmodo,2019-10-26 15:01:07,A month with the improved Samsung Galaxy Fold and I actually still like it 
692,gizmodo,2019-10-26 13:32:29,We asked all 41 Republican members of the House who signed up to demand open government while crashing the SCIF t 
693,gizmodo,2019-10-26 13:00:32,Adobe confirms 75 million accounts exposed in security blunder  
694,gizmodo,2019-10-26 12:02:11,Wow Apple I could have told you this UI update wasnt a good idea  
695,gizmodo,2019-10-26 11:51:35,The president is not happy that Apple ditched the iPhones home button As in that thing it did two years ago 
696,gizmodo,2019-10-26 11:41:06,Here are five reasons why you shouldnt feel guilty for upgrading to the iPhone 11 
697,gizmodo,2019-10-26 05:56:22,Microsoft beats out Amazon for Pentagons 10 billion cloud computing contract  
698,gizmodo,2019-10-26 03:26:22,Twitter is full of weird ads now and I love it  
699,gizmodo,2019-10-26 02:54:18,Major milestone reached as NASAs Mars 2020 rover stands on all six wheels  
700,gizmodo,2019-10-26 02:21:58,Okay but can we teach the rats to race  
701,gizmodo,2019-10-26 01:50:24,Trump subtweets Apple about ditching the home button years after the fact  
702,gizmodo,2019-10-26 01:28:53,A neutral AI used by hospitals everywhere ended up hurting black patients  
703,gizmodo,2019-10-26 00:57:42,iPhone users are accidentally deleting their emails thanks to Apples boneheaded UI update  
704,gizmodo,2019-10-26 00:42:46,Theres one tiny splice which you know folks might guess it is but it makes the entire ad a blatant lie 
705,gizmodo,2019-10-26 00:11:14,Its agoodbye Mario  
706,gizmodo,2019-10-25 23:39:27,BAN CARS  
707,gizmodo,2019-10-25 23:23:53,New evidence suggests Neanderthals were capable of starting fires  
708,gizmodo,2019-10-25 23:08:03,Former Apple lawyer tasked with blocking insider trading indicted on charges of insider trading 
709,gizmodo,2019-10-25 22:36:09,Facebooks pretty sure it wont fuck up the news this time  
710,gizmodo,2019-10-25 22:20:24,This video game gives you a taste of the climate apocalypse to come if we dont get our shit together 
711,gizmodo,2019-10-25 22:00:39,Oops Trumps Commerce secretary did the Hillary email thing  
712,gizmodo,2019-10-25 21:46:07,Republican SCIFstormers who demanded open government wont say if they support secret FISA courts 
713,gizmodo,2019-10-25 21:43:07,Okay but can we teach the rats to race  
714,gizmodo,2019-10-25 21:41:07,How a neutral health algorithm ended up hurting black patients  
715,gizmodo,2019-10-25 21:29:03,This fake Green New Deal ad perfectly illustrates Facebooks bullshit political ad policy  
716,gizmodo,2019-10-25 21:16:33,75 million Adobe accounts exposed by security blunder Report  
717,gizmodo,2019-10-25 21:00:07,75 million Adobe accounts exposed by security blunder report  
718,gizmodo,2019-10-25 20:50:25,Its agoodbye Mario  
719,gizmodo,2019-10-25 20:47:05,Why your web browser is running slowly and how to fix it  
720,gizmodo,2019-10-25 20:16:32,The Nest Mini is an excellent if unnecessary upgrade  
721,gizmodo,2019-10-25 19:31:49,Former Apple lawyer tasked with blocking insider trading indicted on charges of insider trading 
722,gizmodo,2019-10-25 18:56:09,Google tweaks search to better understand your gibberish queries 
723,gizmodo,2019-10-25 18:24:32,We have to figure out how to live with water This art installation is trying to help get us there its also tripp 
724,gizmodo,2019-10-25 18:10:36,Red founder kills the companys holographic phone project announces retirement 
725,gizmodo,2019-10-25 17:59:35,Chuck Schumer proposes electriconly cars by 2040 but that wont solve climate change  
726,gizmodo,2019-10-25 17:46:45,Why your web browser is running slowly and how to fix it  
727,gizmodo,2019-10-25 17:38:13,Sonys AIBO robodog could be trained to operate Hitachis smart appliances for you  
728,gizmodo,2019-10-25 17:14:27,The Nest Mini is an excellent if unnecessary upgrade  
729,gizmodo,2019-10-25 17:04:11,The Trump administration issues its most laughable defense of the border wall yet  
730,gizmodo,2019-10-25 16:53:50,A new video game tests whether you can survive the climate apocalypse  
731,gizmodo,2019-10-25 16:38:13,Google tweaks search to better understand your gibberish queries 
732,gizmodo,2019-10-25 16:22:25,Disney will let you keep downloaded content even after it leaves the platform  
733,gizmodo,2019-10-25 15:50:39,Major milestone reached as NASAs Mars 2020 rover stands on all six wheels  
734,gizmodo,2019-10-25 15:23:40,RIP to the Red Hydrogen One 
735,gizmodo,2019-10-25 14:42:20,Netflix and Spotify could soon be required to issue emergency alerts from the US government just like TV and radi 
736,gizmodo,2019-10-25 14:31:57,Sonys AIBO robodog could be trained to operate Hitachis smart appliances for you  
737,gizmodo,2019-10-25 13:44:12,Waterlicht a psychedelic art installation is trying to get people to talk about climate solutions 
738,gizmodo,2019-10-25 12:46:27,RT  Its Thursday The earth is dying Ease your mind with this twominute video of Mark Zuckerberg getting his shit handed to him
739,gizmodo,2019-10-25 11:40:28,Here are five key upgrades you only get on the iPhone 11 Pro 
740,gizmodo,2019-10-25 10:32:27,Netflix and Spotify might be required to issue emergency alerts from the government just like TV and radio 
741,gizmodo,2019-10-25 09:32:33,Googles Pixebook Go is really weird but holy crap that battery life  
742,gizmodo,2019-10-25 01:00:48,Senators warn that TikTok may pose national security threat  
743,gizmodo,2019-10-25 00:11:20,Incredible new fossils show how quickly mammals took over after dinosaur extinction  
744,gizmodo,2019-10-24 23:29:44,Disney will let you keep downloaded content even after it leaves the platform  
745,gizmodo,2019-10-24 22:12:16,Microsoft snipes another streamer from Twitch as Shroud moves to Mixer 
746,gizmodo,2019-10-24 21:39:10,Filtered cigarettes are just another scam by the tobacco industry and its time we ban them experts argue 
747,gizmodo,2019-10-24 21:27:04,The most futuristic developments we can expect in the next 10 years  
748,gizmodo,2019-10-24 20:58:56,Apple patent hints at AR glasses with transitionlike lenses 
749,gizmodo,2019-10-24 20:37:27,As if you needed another reason to quit vaping  
750,gizmodo,2019-10-24 20:19:36,Microsoft snipes another streamer from Twitch as Shroud moves to Mixer 
751,gizmodo,2019-10-24 20:03:35,The Kincade Fire spurs evacuations in Wine Country  
752,gizmodo,2019-10-24 19:30:14,A PSA from the hacker who easily cracked the hotel bedside robots  
753,gizmodo,2019-10-24 19:09:23,Apple patent hints at AR glasses with transitionlike lenses 
754,gizmodo,2019-10-24 18:18:56,Incredible new fossils show how quickly mammals took over after dinosaur extinction  
755,gizmodo,2019-10-24 18:08:10,Lazy artists will love this plastic bead printer that automates your arts and crafts  
756,gizmodo,2019-10-24 17:48:15,Filtered cigarettes are one of the worst types of pollution and we should ban them experts argue 
757,gizmodo,2019-10-24 17:36:00,Disney will let you keep downloaded content even after it leaves the platform  
758,gizmodo,2019-10-24 17:13:28,Your vape litter is becoming an environmental disaster  
759,gizmodo,2019-10-24 16:13:51,At least we can all agree that people who torture animals should be in prison 
760,gizmodo,2019-10-24 15:43:05,At least we can all agree that people who torture animals should be in prison 
761,gizmodo,2019-10-24 15:37:35,The most futuristic developments we can expect in the next 10 years  
762,gizmodo,2019-10-24 15:26:14,Joe Biden announced a new voter outreach program yesterday but forgot to buy the domain name You can probably gue 
763,gizmodo,2019-10-24 15:10:17,The Kincade Fire explodes in Wine Country where a blackout was scheduled  
764,gizmodo,2019-10-24 14:58:55,Lets see how the Pixel 4s radarpowered gestures hold up against the last great gesture phone 
765,gizmodo,2019-10-24 14:40:15,A PSA from the hacker who easily cracked the hotel bedside robots  
766,gizmodo,2019-10-24 14:22:58,Lazy artists will love this plastic bead printer that automates your arts and crafts  
767,gizmodo,2019-10-24 14:03:48,Beats turned a corner with its new noisecanceling headphones  
768,gizmodo,2019-10-24 13:42:33,RT  The Camp Fire destroyed large portions of the town of Paradise California and its surrounding communities in November 2018 N
769,gizmodo,2019-10-24 11:01:59,Biden forgot to buy the web address for his Latinx outreach campaign and now Trump owns it  
770,gizmodo,2019-10-24 03:44:24,Fresh look at New Horizons data shows Plutos far side in unprecedented detail  
771,gizmodo,2019-10-24 02:40:08,The NASCAR crash compilation of Mark Zuckerbergs sixhour congressional testimony  
772,gizmodo,2019-10-24 02:08:10,Report Google staff suspect new internal software is designed to suppress employee dissent  
773,gizmodo,2019-10-24 01:01:11,The link between civil rights climate change and the oil industrys role in this crisis  
774,gizmodo,2019-10-24 00:29:59,Internal cybersecurity memo White House is bound to get hacked 
775,gizmodo,2019-10-24 00:03:08,This uninhabited island is covered in rubber bands because birds think theyre worms  
776,gizmodo,2019-10-23 23:32:27,FTC finally decides stalking apps may not be all that great  
777,gizmodo,2019-10-23 23:22:17,First look at Sycamore Googles quantum computer  
778,gizmodo,2019-10-23 23:04:35,Scientists say theyve ferreted out an experimental drug that might be a super flu killer  
779,gizmodo,2019-10-23 22:38:37,The NASCAR crash compilation of Mark Zuckerbergs sixhour congressional testimony  
780,gizmodo,2019-10-23 22:25:05,How posting memes could soon cost you 30000  
781,gizmodo,2019-10-23 21:59:05,Fresh look at New Horizons data shows Plutos far side in unprecedented detail  
782,gizmodo,2019-10-23 21:54:42,Republicans wielding phones compromised classified room used for impeachment hearing  
783,gizmodo,2019-10-23 21:23:05,Internal cybersecurity memo White House is bound to get hacked 
784,gizmodo,2019-10-23 21:01:14,Whats a fair price for a Shrek baby  
785,gizmodo,2019-10-23 20:28:04,Congress explores why the oil industrys climate denial is a civil rights issue  
786,gizmodo,2019-10-23 20:24:35,Republicans wielding phones compromised classified room used for impeachment hearing  
787,gizmodo,2019-10-23 20:08:43,Blackouts may soon be hitting Californiaagain  
788,gizmodo,2019-10-23 19:47:03,FTC finally decides stalking apps may not be all that great  
789,gizmodo,2019-10-23 19:34:28,Axon brings license plate recognition to cops dash cams 
790,gizmodo,2019-10-23 19:15:10,The Trump administration continues its twin often intertwined wars against California and climate action 
791,gizmodo,2019-10-23 18:43:56,Scientists say their experimental drug knocks out the flu in animal tests at least  
792,gizmodo,2019-10-23 18:33:01,The Fujifilm XPro3 is a love letter to street photography 
793,gizmodo,2019-10-23 18:01:17,Google releases five digital wellbeing experiments to curb your smartphone addiction  
794,gizmodo,2019-10-23 17:31:05,Axon brings license plate recognition to cops dash cams 
795,gizmodo,2019-10-23 17:17:23,This uninhabited island is covered in rubber bands because birds think theyre worms  
796,gizmodo,2019-10-23 16:12:23,Google releases five digital wellbeing experiments to curb your smartphone addiction  
797,gizmodo,2019-10-23 16:00:43,The Fujifilm XPro3 is a love letter to street photography 
798,gizmodo,2019-10-23 15:44:29,We made some burgers and tacos to see how Impossible 20 compares to real beef 
799,gizmodo,2019-10-23 15:17:44,Whats a fair price for a Shrek baby  
800,gizmodo,2019-10-23 15:06:35,Trump administration sues California for daring to address climate change  
801,gizmodo,2019-10-23 14:55:19,PGampE could turn power off again as California faces wildfire weather  
802,gizmodo,2019-10-23 14:40:55,This Garmin smartwatch is a beast that doesnt have a real reason to exist 
803,gizmodo,2019-10-23 14:10:46,Raytheon delivers first antidrone laser weapon to US Air Force  
804,gizmodo,2019-10-23 13:34:49,This Garmin smartwatch is a beast that doesnt have a real reason to exist 
805,gizmodo,2019-10-23 13:20:46,Heres what it means for a quantum computer to outperform a regular one 
806,gizmodo,2019-10-23 13:12:53,So what the hell is a quantum computer anyway and how excited should you be  
