,User,Date,Tweets
1489,SamsungMobile,2016-08-31 16:13:11, Just in time
1490,SamsungMobile,2016-08-31 16:12:42, The GearS3 is even more impressive
1491,SamsungMobile,2016-08-31 16:12:31,Founder of  and tonights host Ariel Adams takes the stage GearS3 
1492,SamsungMobile,2016-08-31 16:11:20,The GearS3 is high tech with an analog feel Its rotating bezel provides a natural and authentic user experience
1493,SamsungMobile,2016-08-31 16:11:00,From a distance you would never know that the GearS3 is a smartwatch Its just a smartlooking watch  YH Lee
1494,SamsungMobile,2016-08-31 16:10:01,The GearS3 Classic has arrived  
1495,SamsungMobile,2016-08-31 16:06:48,The GearS3 Frontier is here  
1496,SamsungMobile,2016-08-31 16:04:28,Introducing the Samsung GearS3  
1497,SamsungMobile,2016-08-31 15:55:38,Its almost time 
1498,SamsungMobile,2016-08-29 18:00:02,Volume up Sweat on The new Samsung LevelActive Bluetooth Sports Earbuds  
1499,SamsungMobile,2016-08-27 12:00:00,Watch the sun rise and set on the dynamic cities of South Korea captured on the Gear360 
1500,SamsungMobile,2016-08-23 16:00:02,The LevelActive High quality sportstype bluetooth earbuds for your high intensity life  
1501,SamsungMobile,2016-08-22 16:40:57,RT  Im proud to stand with  and everyone who believes in DoWhatYouCant collab 
1502,SamsungMobile,2016-08-22 01:34:24,Heres to all the athletes who proved that with tenacity we can defy any barrier ClosingCeremony DoWhatYouCant 
1503,SamsungMobile,2016-08-22 00:05:31,Congrats to the countries who defied their pasts to win their first gold medals DoWhatYouCant Rio2016 
1504,SamsungMobile,2016-08-21 21:34:30,Rising to the challenge means always giving it your best shot Basketball DoWhatYouCant 
1505,SamsungMobile,2016-08-21 19:54:52,DEN just proved that the unstoppable can be stopped Handball DoWhatYouCant 
1506,SamsungMobile,2016-08-21 18:06:37,Today proved that barriers can be broken gracefully RhythmicGymnastics DoWhatYouCant 
1507,SamsungMobile,2016-08-21 17:00:01,TsepoMathibelle and TsegaiTewelde may have been outrun but theyre not outdone Marathon DoWhatYouCant 
1508,SamsungMobile,2016-08-21 16:11:35,In 2008 Lost Boy of Sudan  went from refugee to USA hero DoWhatYouCant 
1509,SamsungMobile,2016-08-21 15:28:18,RT  These DoWhatYouCant stories are so inspirational Thanks to everyone who shared  partner
1510,SamsungMobile,2016-08-21 01:45:25,RT  All of your DoWhatYouCant stories are incredible Thank you for sharing with me and  partner
1511,SamsungMobile,2016-08-20 23:40:21,BRA just proved that defeat can be defeated Football DoWhatYouCant 
1512,SamsungMobile,2016-08-20 19:49:18,BRA and GER face off in a highpressure rematch to claim victory and gold Football DoWhatYouCant 
1513,SamsungMobile,2016-08-20 18:08:14,No matter the outcome we know  will keep going Diving DoWhatYouCant 
1514,SamsungMobile,2016-08-20 18:00:01,No matter how TsepoMathibelle runs tomorrow hes overcome selfdoubt to be his personal best DoWhatYouCant 
1515,SamsungMobile,2016-08-20 16:00:01,TsegaiTewelde has truly gone the distance to make it to Rio2016 This is his moment DoWhatYouCant 
1516,SamsungMobile,2016-08-20 14:00:01,Wishing success to all the Olympians who never flee the mat in the face of adversity Wrestling DoWhatYouCant 
1517,SamsungMobile,2016-08-20 01:47:37,Races are won by persevering past whats been done Athletics DoWhatYouCant 
1518,SamsungMobile,2016-08-20 00:46:27,RT  Thanks everyone for sharing your DoWhatYouCant stories Check out some of my favs   partner  
1519,SamsungMobile,2016-08-19 23:56:52,RT  Obstacles should push you to be a better version of yourself Share how you DoWhatYouCant partner  
1520,SamsungMobile,2016-08-19 22:00:13,USA runner  knows that hardships inspire the biggest wins DoWhatYouCant
1521,SamsungMobile,2016-08-19 19:51:39, is diving the 10m platform Will he twist past yet another barrier DoWhatYouCant 
1522,SamsungMobile,2016-08-19 19:37:28,Plenty of barriers have been defied on the way to the gold medal Only one remains Badminton MAS DoWhatYouCant 
1523,SamsungMobile,2016-08-19 18:37:11,Congrats to the two and fourlegged competitors who inspire us to leap beyond Equestrian DoWhatYouCant 
1524,SamsungMobile,2016-08-19 15:44:54,RT  Despite my injury in Rioproud to uphold Olympic spirit of giving it your all no matter what DoWhatYouCant collab htt
1525,SamsungMobile,2016-08-19 01:45:06,Races are won by persevering beyond what you think you can do Athletics DoWhatYouCant 
1526,SamsungMobile,2016-08-19 01:00:13,In 1968 Aussie sprinter PeterNorman put rivalry aside to support his fellow athletes DoWhatYouCant 
1527,SamsungMobile,2016-08-19 00:34:29,Races are won by seeing obstacles as invitations to go further Athletics DoWhatYouCant 
1528,SamsungMobile,2016-08-18 23:24:52,RT  From humble beginnings to the Olympics  with dedication and hope any barrier can be broken DoWhatYouCant collab 
1529,SamsungMobile,2016-08-18 20:25:12,That time when  and  showed us that bravery can break barriers DoWhatYouCant TBT 
1530,SamsungMobile,2016-08-18 19:30:19,IND defied the rankings to clinch a historymaking finals debut Badminton DoWhatYouCant 
1531,SamsungMobile,2016-08-18 18:30:10,SRB just beat the odds to secure its first time in the Volleyball finals DoWhatYouCant 
1532,SamsungMobile,2016-08-18 02:35:53,RT  Joining  to tell TsepoMathibelle amp my barrierbreaking stories Share how you DoWhatYouCant partner 
1533,SamsungMobile,2016-08-18 00:19:01,Nothing will stop  from getting back up DoWhatYouCant
1534,SamsungMobile,2016-08-17 23:14:54,Congrats to the five Olympians who defied barriers today with their unexpected wins Taekwondo DoWhatYouCant 
1535,SamsungMobile,2016-08-17 21:39:54,2time gold medalist  inspired fans to break their own barriers at the Samsung Studio DoWhatYouCant 
1536,SamsungMobile,2016-08-17 15:06:02,RT  We all have challenges to face Join  conversation and share how you DoWhatYouCant partner
1537,SamsungMobile,2016-08-17 04:05:03,Proving that what you rank doesnt limit what you can do BRA BeachVolleyball DoWhatYouCant 
1538,SamsungMobile,2016-08-17 02:29:27,RT  When they said Id never walk again I said never say never DoWhatYouCant collab 
1539,SamsungMobile,2016-08-16 23:56:01, just proved that believing in your dreams can defy any barrier Boxing DoWhatYouCant 
1540,SamsungMobile,2016-08-16 21:10:36,RT  Partnering with  to share barrierbreaking stories Now tell me amp  how you DoWhatYouCant 
1541,SamsungMobile,2016-08-16 17:40:01,BRAs  went from humble beginnings into No 1 ranked in the world Boxing DoWhatYouCant 
1542,SamsungMobile,2016-08-16 15:00:02,TsegaiTewelde defied barriers and ran from oppression to freedom to the Olympic Games DoWhatYouCant 
1543,SamsungMobile,2016-08-16 14:04:41,In 2008  proved competition is conquered by dedication after cancer MarathonSwimming DoWhatYouCant 
1544,SamsungMobile,2016-08-16 00:26:56,Irish gymnast  proves that when strength meets drive any barrier can be broken DoWhatYouCant
1545,SamsungMobile,2016-08-15 23:00:01,Stay tuned for a timely innovation August 31 Berlin 
1546,SamsungMobile,2016-08-15 19:33:59,BRA just proved that small size doesnt have to be a big barrier Gymnastics DoWhatYouCant 
1547,SamsungMobile,2016-08-15 18:23:44,His time in London didnt deter TsepoMathibelle  it invigorated him to push past new barriers DoWhatYouCant 
1548,SamsungMobile,2016-08-15 17:39:03, knows the drill SPF On Responsibilities Off GearS2 
1549,SamsungMobile,2016-08-15 03:13:45,The glory is in the attempt Congrats to  for an inspiring Olympics run DoWhatYouCant 
1550,SamsungMobile,2016-08-15 00:58:46,In 1992 Derek Redmonds raceending injury reminded us that together we win DoWhatYouCant Athletics 
1551,SamsungMobile,2016-08-15 00:41:53,Heres to all the Rio2016 Olympians who didnt count a losing set as a set back Tennis DoWhatYouCant 
1552,SamsungMobile,2016-08-14 23:00:19,Good luck to  as she looks to prove that strength is found in struggle TeamUSA Running DoWhatYouCant 
1553,SamsungMobile,2016-08-14 21:28:06,India proved that pride makes anything possible ArtisticGymnastics DoWhatYouCant 
1554,SamsungMobile,2016-08-14 19:30:24,After 112 years of not being recognized as an Olympic sport Golf just made a historic return DoWhatYouCant 
1555,SamsungMobile,2016-08-14 01:50:32,For some falling is the fuel to go faster Athletics DoWhatYouCant 
1556,SamsungMobile,2016-08-13 22:53:02,History was made in a match point PUR has just won its first gold medal EquipoPUR Tennis DoWhatYouCant 
1557,SamsungMobile,2016-08-13 21:21:41,Finally beating the unbeatable Singapore has won its first gold medal in history Swimming DoWhatYouCant Rio2016 
1558,SamsungMobile,2016-08-13 21:21:17,RT  Joseph Schooling was 13 when he met Michael PhelpsThe boy who grew up to beat his idol  
1559,SamsungMobile,2016-08-13 19:25:39,Losing a shoe midrace didnt stop ETH from crossing the finish line Athletics DoWhatYouCant 
1560,SamsungMobile,2016-08-13 18:29:28,RT  Stoked to partner with  to create conversation about overcoming amp blowing minds DoWhatYouCant 
1561,SamsungMobile,2016-08-13 12:00:03,Its coffee oclock Sip your coffee while enjoying this piping hot  watch face on your GearS2 
1562,SamsungMobile,2016-08-13 01:25:12, didnt let a misstep stop her during trials amp now she continues her journey in Rio2016 DoWhatYouCant 
1563,SamsungMobile,2016-08-12 22:04:31,Well done  for defying barriers and overcoming injuries We know youll be back DoWhatYouCant 
1564,SamsungMobile,2016-08-12 21:44:18,The winning penalty was just one of many barriers defied DoWhatYouCant Football SWE 
1565,SamsungMobile,2016-08-12 20:43:02,Set your own expectations Dont let them be set for you DoWhatYouCant Judo 
1566,SamsungMobile,2016-08-12 18:34:01,From personal struggles to an Olympic trial trip  has always persevered DoWhatYouCant Athletics 
1567,SamsungMobile,2016-08-12 10:05:15,The LINEFriends watch face for the GearS2 is here BetterAtEveryTurn
1568,SamsungMobile,2016-08-11 23:12:47,Fiji tackles the odds with its 1st gold medal in history DoWhatYouCant Rugby7s FIJ 
1569,SamsungMobile,2016-08-11 22:37:53,Twice the records broken twice the barriers defied TeamGB CyclingTrack DoWhatYouCant 
1570,SamsungMobile,2016-08-11 21:44:25,Samsung salutes the Olympic gymnasts today that set the bar higher than ever DoWhatYouCant ArtisticGymnastics 
1571,SamsungMobile,2016-08-11 15:00:00,Go for a paramotor ride and soar over the beaches and mountains of Rio de Janeiro Gear360 
1572,SamsungMobile,2016-08-11 00:49:38,Continue defying barriers until the very end Cycling DoWhatYouCant 
1573,SamsungMobile,2016-08-10 23:05:10,TeamGB didnt let adversity get in the way of their first diving gold GBR DoWhatYouCant 
1574,SamsungMobile,2016-08-10 16:00:35, has turned a careerending injury into a careerbending success DoWhatYouCant OneTeam 
1575,SamsungMobile,2016-08-09 21:00:02,You can miss the movie previews but you cant miss this  watch face for the GearS2 
1576,SamsungMobile,2016-08-09 19:23:43,What boxing hopeful do you think will go the distance and take home the gold DoWhatYouCant 
1577,SamsungMobile,2016-08-09 14:00:01,What athletes and countries are you rooting for at Rio2016 DoWhatYouCant 
1578,SamsungMobile,2016-08-09 01:22:56,What personal hardships have you turned into lifechanging successes DoWhatYouCant Judo 
1579,SamsungMobile,2016-08-08 21:09:02,Congrats to  for his barrierdefying performance in the synchronized 10m DoWhatYouCant diving 
1580,SamsungMobile,2016-08-08 16:07:27, is preparing for a great performance in the synchronized 10m DoWhatYouCant Rio2016 
1581,SamsungMobile,2016-08-08 02:09:00,The most difficult barrier to break is the one you set for yourself DoWhatYouCant Rio2016 
1582,SamsungMobile,2016-08-08 02:07:02,Off the block and into the trophy case DoWhatYouCant Rio2016 
1583,SamsungMobile,2016-08-07 22:15:32,Even when hope was lost  pushed through his injuries for an inspiring performance DoWhatYouCant 
1584,SamsungMobile,2016-08-07 17:27:50,To the athletes out there who show us how to stay on our feet when the going gets tough DoWhatYouCant 
1585,SamsungMobile,2016-08-07 00:39:24,A triumph 64 years in the making Vietnam has won the first gold medal in its history DoWhatYouCant Rio2016 VIE 
1586,SamsungMobile,2016-08-06 21:42:30,Behind  stands his team coaches and anyone else who defies barriers to overcome fear DoWhatYouCant 
1587,SamsungMobile,2016-08-05 15:00:01,Congrats to Rio for demonstrating the vision that led to hosting its first Olympic Games DoWhatYouCant 
1588,SamsungMobile,2016-08-04 12:00:00,Make the jump with a skydiving team toward the beautiful city of Rio de Janeiro Gear360 
1589,SamsungMobile,2016-08-02 16:29:26, Immersive gaming meet submersion gaming GalaxyNote7
1590,SamsungMobile,2016-08-02 16:27:18, Not too shabby right GalaxyNote7
1591,SamsungMobile,2016-08-02 15:50:32,Smart and fit Sign us up The GearFit2 is intelligently designed to recognize any workout you throw at it
1592,SamsungMobile,2016-08-02 15:49:47,  The implications for banking security are the most exciting part GalaxyNote7
1593,SamsungMobile,2016-08-02 15:49:15, Nothing wrong with that  GalaxyNote7
1594,SamsungMobile,2016-08-02 15:48:53, We cant wait to see how game developers take advantage of the new hardware  GalaxyNote7
1595,SamsungMobile,2016-08-02 15:44:31,The GalaxyNote7 arrives on August 19th Preorders are available in most countries in a few days Let the countdown begin
1596,SamsungMobile,2016-08-02 15:43:13,With Samsung Pass plus Iris Scanner you wont need usernames or passwords  just you GalaxyNote7
1597,SamsungMobile,2016-08-02 15:41:40, We live in a world without limits So why should we limit our phones storage GalaxyNote7
1598,SamsungMobile,2016-08-02 15:40:55, Its the GIF that keeps on giving GalaxyNote7
1599,SamsungMobile,2016-08-02 15:39:23,Change can be scary Thats why we created Smart Switch to make the data transfer process effortless GalaxyNote7
1600,SamsungMobile,2016-08-02 15:36:45,The GalaxyNote7 has 2X the internal storage Thats 64GBs of music movies and podcasts to keep you entertained
1601,SamsungMobile,2016-08-02 15:29:58,Como se dice Awesome Translate text on the spot with the all new S Pen GalaxyNote7
1602,SamsungMobile,2016-08-02 15:29:44,From grocery lists to bucket lists Samsung Notes keeps all your thoughts big or small in one place GalaxyNote7
1603,SamsungMobile,2016-08-02 15:29:04,Oil Brush allows you to mix colors just like a real paintbrush Your GalaxyNote7 is now your own personal canvas
1604,SamsungMobile,2016-08-02 15:27:34,We made the GalaxyNote7s 57 inch screen nearly bezelless Its a feast for the eyes that fits in your hand
1605,SamsungMobile,2016-08-02 15:26:20,It was designed for pioneerspeople who need a canvas for their boldest ideas and a pen that can bring them to life  Justin Denison
1606,SamsungMobile,2016-08-02 15:24:34,  Celebrate thinking big with us  GalaxyNote7
1607,SamsungMobile,2016-08-02 15:09:20,It has been an honor to be the Worldwide Olympic Partner in the Wireless Communications Equipment category for nearly 20 years  DJ Koh
1608,SamsungMobile,2016-08-02 15:08:20, Hello London  GalaxyNote7 TheNextGalaxy
1609,SamsungMobile,2016-08-02 15:07:37,  Who kicks a VR Honestly  GalaxyNote7 TheNextGalaxy
1610,SamsungMobile,2016-08-02 15:06:00, Hold on to your VR headset  GalaxyNote7 TheNextGalaxy
1611,SamsungMobile,2016-08-02 15:01:16,  Bright lights for brighter ideas GalaxyNote7 TheNextGalaxy
1612,SamsungMobile,2016-08-02 14:55:27, Best seat in the house GalaxyNote7 TheNextGalaxy
1613,SamsungMobile,2016-08-02 14:53:49,   Set GO GalaxyNote7 TheNextGalaxy
1614,SamsungMobile,2016-08-02 14:52:32, Next year GalaxyNote7 TheNextGalaxy
1615,SamsungMobile,2016-08-02 14:51:54, 10 minutes GalaxyNote7 TheNextGalaxy
1616,SamsungMobile,2016-08-02 14:51:08, Pretty soon youll be passing NOTES again too GalaxyNote7 TheNextGalaxy
1617,SamsungMobile,2016-08-02 14:47:42, BIG is an understatement GalaxyNote7 TheNextGalaxy
1618,SamsungMobile,2016-08-02 14:46:57, Let the countdown begin GalaxyNote7 TheNextGalaxy
1619,SamsungMobile,2016-08-02 14:41:20, Just wait until you hear the specifics GalaxyNote7 TheNextGalaxy
1620,SamsungMobile,2016-08-02 14:34:00, 360 degrees of new device hype GalaxyNote7 TheNextGalaxy
1621,SamsungMobile,2016-08-02 14:33:12, You never know with Zuck GalaxyNote7 TheNextGalaxy
1622,SamsungMobile,2016-08-02 14:32:36,  Make yourself comfortable 30 minutes until the real show begins GalaxyNote7 TheNextGalaxy
1623,SamsungMobile,2016-08-02 14:30:49,Unpacked begins in 30 minutes TheNextGalaxy GalaxyNote7 
1624,SamsungMobile,2016-08-02 14:28:42, Someone should drop a lure GalaxyNote7 TheNextGalaxy
1625,SamsungMobile,2016-08-02 14:24:22, After Unpacked that good chance will be a great chance GalaxyNote7 TheNextGalaxy
1626,SamsungMobile,2016-08-02 14:22:52, In less than an hour all will be revealed TheNextGalaxy GalaxyNote7
1627,SamsungMobile,2016-08-02 14:09:20, Thanks Stephen Weve got a feeling youll love TheNextGalaxy
1628,SamsungMobile,2016-08-02 14:08:37, Big ideas start with a morning coffee TheNextGalaxy
1629,SamsungMobile,2016-07-29 12:08:34,Progress is accepting fear so you can face it  DoWhatYouCant 
1630,SamsungMobile,2016-07-28 12:00:02,Level up your listening with the new Samsung LevelUProANC ActiveNoiseCancellation  
1631,SamsungMobile,2016-07-27 12:00:12,Progress is not letting your age define your ability  DoWhatYouCant 
1632,SamsungMobile,2016-07-26 12:00:29,Progress is turning a disability into a superpower  DoWhatYouCant 
1633,SamsungMobile,2016-07-25 15:16:06,Progress is conquering a sport youve never tried  DoWhatYouCant 
1634,SamsungMobile,2016-07-25 12:00:08,Check the time go back in time Customize your GearS2 with MyPhotos  
1635,SamsungMobile,2016-07-24 12:00:01,Introducing the LevelUProANC the next evolution in wireless earbuds  
1636,SamsungMobile,2016-07-23 12:00:05,Progress is proving the strength of motherhood  DoWhatYouCant 
1637,SamsungMobile,2016-07-21 14:00:35,The Anthem Proud sponsor of a world without barriers DoWhatYouCant Rio2016  
1638,SamsungMobile,2016-07-20 18:00:02,On MoonDay capture photos that are out of this world GalaxyS7 
1639,SamsungMobile,2016-07-18 00:01:18,A phone made for barrier breakers Discover the GalaxyS7edge Olympic Games Limited Edition Rio2016 DoWhatYouCant
1640,SamsungMobile,2016-07-17 22:21:06,Samsung and WSL Proud sponsor of those who defy barriers DoWhatYouCant 
1641,SamsungMobile,2016-07-17 13:05:06,Untangle yourself from awkward moments with the wireless GearIconX
1642,SamsungMobile,2016-07-17 00:00:49,Up to 1000 of your favorite songs are just a tap away with the Gear IconX Now thats zen
1643,SamsungMobile,2016-07-16 12:00:02,The cordfree GearIconX frees you from tangles so that when youre in the zone you stay there
1644,SamsungMobile,2016-07-16 00:00:33,Avoid the dreaded drop with the wireless fitnesstracker and music player the GearIconX
1645,SamsungMobile,2016-07-15 12:00:03,The GearIconX is a cordfree music player and fitness tracker so you can go the distance without the distractions
1646,SamsungMobile,2016-07-12 21:00:19,Your next big idea is right around the corner Tune in to Unpacked live on August 2 
1647,SamsungMobile,2016-07-08 12:00:06,Progress is becoming the ultimate Olympic comeback story TsepoMathibelle DoWhatYouCant
1648,SamsungMobile,2016-07-07 14:00:19,Introducing the official smartphone of the Rio 2016 Olympic Games Rio2016 DoWhatYouCant 
1649,SamsungMobile,2016-07-06 12:00:15,Progress is proving yourself in a maledominated sport YenebierGuillen DoWhatYouCant
1650,SamsungMobile,2016-07-05 18:01:14,Progress is not letting traditional gender roles define your dreams  DoWhatYouCant
1651,SamsungMobile,2016-07-05 12:00:07,Learn how to get started with the GearIconX No cords no hassles 
1652,SamsungMobile,2016-07-02 12:00:11,Progress is witnessing your countrys first Olympics MargretHassan DoWhatYouCant
1653,SamsungMobile,2016-06-29 12:00:02,Wideeyed and wideangled with the Gear360 at Lisbons Rossio Square Hyperlapse 
1654,SamsungMobile,2016-06-26 12:00:01,By being placed in a completely different environment VR can help you meditate It can help you reset  
1655,SamsungMobile,2016-06-25 20:49:29,YH Lee EVP of Global Marketing Samsung Mobile accepts the 2016 Creative Marketer of the Year award CannesLions 
1656,SamsungMobile,2016-06-25 16:00:01,The power of going beyond the frame is addictive and magical Eddy Moretti CCO of  
1657,SamsungMobile,2016-06-25 11:59:21,Stop it youre making us blush CannesLions 
1658,SamsungMobile,2016-06-24 23:00:12,After a year of breaking new ground were excited to see what unfolds on the final day of CannesLions 
1659,SamsungMobile,2016-06-24 20:00:04,With VR sports fans will be teleported to the physical games when they arent able to attend  
1660,SamsungMobile,2016-06-24 11:06:20,The Samsung Studio at CannesLions for the crme de la crme of tech 
1661,SamsungMobile,2016-06-23 19:28:53,In VR you can experiment with being a different kind of person Chris Brewin 
1662,SamsungMobile,2016-06-23 07:30:42,VR allows the viewer to make a more profound connection than with traditional media   
1663,SamsungMobile,2016-06-22 16:58:49,Today at CannesLions we discussed the possibilites of VR with    and Chris Brewin 
1664,SamsungMobile,2016-06-22 12:00:01,VR amp 360 are the perfect medium to bring people inside a news story to see the scale of world issues  
1665,SamsungMobile,2016-06-21 10:01:55,Workation at CannesLions to celebrate a years worth of creativity GalaxyS7edge 
1666,SamsungMobile,2016-06-20 20:02:56,Automatically track your fitness without lifting a finger Welcome to alwayson SmartHealth with the GearFit2
1667,SamsungMobile,2016-06-20 14:00:04,The Chant DoWhatYouCant Rio2016 
1668,SamsungMobile,2016-06-19 12:00:04,Keep up the pace and the beat with music onthego GearFit2 Workout Playlist
1669,SamsungMobile,2016-06-18 19:51:32,Escape from your couch and explore new worlds with the GearVR E32016 
1670,SamsungMobile,2016-06-18 05:26:25,Game Launcher lets you lock keys So a missclick wont turn into a game over E32016 
1671,SamsungMobile,2016-06-17 18:00:48,Own every step of your run with GPS tracking A better workout starts with better feedback GearFit2
1672,SamsungMobile,2016-06-17 12:00:01,Show off your true colors The GalaxyS7 and GalaxyS7edge are now available in Pink Gold 
1673,SamsungMobile,2016-06-16 23:30:28,Fight largescale space battles from the comfort of your couch with the GearVR E32016 
1674,SamsungMobile,2016-06-16 04:40:51,We dropped in on a new reality at E32016 thanks to the GearVR  
1675,SamsungMobile,2016-06-16 01:50:18,Save power Save the day Tweak your GalaxyS7 battery settings with Game Launcher E32016 
1676,SamsungMobile,2016-06-15 18:48:09,Yesterday we had a first look at the newest games on the GalaxyS7 with Vulkan API  E32016 
1677,SamsungMobile,2016-06-15 06:56:37, We would love to use your tweet in our next ad If you are happy for us to quote you please reply with Yes
1678,SamsungMobile,2016-06-15 06:55:51, We would love to use your tweet in our next ad If you are happy for us to quote you please reply with Yes
1679,SamsungMobile,2016-06-15 06:55:07, We would love to use your tweet in our next ad If you are happy for us to quote you please reply with Yes
1680,SamsungMobile,2016-06-15 03:19:15, We would love to use your tweet in our next ad If you are happy for us to quote you please reply with Yes
1681,SamsungMobile,2016-06-15 03:18:51, We would love to use your tweet in our next ad If you are happy for us to quote you please reply with Yes
1682,SamsungMobile,2016-06-15 03:18:28, We would love to use your tweet in our next ad If you are happy for us to quote you please reply with Yes
1683,SamsungMobile,2016-06-15 03:17:59, We would love to use your tweet in our next ad If you are happy for us to quote you please reply with Yes
1684,SamsungMobile,2016-06-15 03:17:26, We would love to use your tweet in our next ad If you are happy for us to quote you please reply with Yes
1685,SamsungMobile,2016-06-15 03:15:49, We would love to use your tweet in our next ad If you are happy for us to quote you please reply with Yes
1686,SamsungMobile,2016-06-14 23:59:01,Dont put your gaming on hold Game Launchers Alert Settings  no interruptions E32016 
1687,SamsungMobile,2016-06-14 23:07:08,RT  SAMSUNG PARTNERSHIP amp INVITATIONAL TOURNAMENT ANNOUNCEDView Read  
1688,SamsungMobile,2016-06-14 19:06:25,Were on the ground and in the front row for the future of mobile gaming E32016  
1689,SamsungMobile,2016-06-11 12:00:01,Everyone wants to see results The GearFit2 and S Health app sync up to help you visualize your progress 
1690,SamsungMobile,2016-06-10 16:00:02,The GearFit2s ergonomic design lets you stay comfortable even when youre outside your comfort zone 
1691,SamsungMobile,2016-06-10 12:49:31,Track your fitness activities effortlessly with the GearFit2 GPS Health 
1692,SamsungMobile,2016-06-09 12:00:01,Sync your GearIconX with S Health to get caught up in the details  instead of your headphone wires 
1693,SamsungMobile,2016-06-08 12:00:01,The new GearFit2 is GPSenabled so you can retrace your steps while you chase down your goals 
1694,SamsungMobile,2016-06-07 12:00:01,You can store up to 1000 tracks on the GearIconX Now thats one serious workout playlist 
1695,SamsungMobile,2016-06-03 00:03:14,Say Hello to the GearIconX and cut the cords to stay in the zone with cordfree fitness earbuds
1696,SamsungMobile,2016-06-03 00:00:13,Meet the GearFit2 The allday GPS and healthtracking sports band made for all the ways you move
1697,SamsungMobile,2016-06-02 21:02:01,Introducing the GearIconX Cordfree fitness earbuds so your workout can have the freedom it deserves 
1698,SamsungMobile,2016-06-02 21:00:01,Introducing the new GearFit2 the lightweight alwayson GPS sports band All of the features none of the bulk 
1699,SamsungMobile,2016-06-01 16:41:31,RT  Want to know how the Gear 360 can be a perfect 360 companion for your life Watch this video 
