,User,Date,Tweets
0,SamsungMobile,2019-11-09 13:00:08,Read more about how we teamed up with  to celebrate three  students who embody the 
1,SamsungMobile,2019-11-09 12:00:00,Let your newest discovery  be our newest wallpapers Sciencethemed work by   
2,SamsungMobile,2019-11-06 12:02:23,RT  Setting up your smart home with SmartThings and enjoying all the conveniences Samsung and partner devices have to offer is as
3,SamsungMobile,2019-11-06 00:00:31,RT  See how Samsung is leading a new era of connectivity and collaboration for businesses with extensive suite of mobile devices a
4,SamsungMobile,2019-11-05 12:00:11,RT  Winners of Samsung Mobile Design Competition for mobile accessory and wallpaper designs were announced at SDC19 Take a close
5,SamsungMobile,2019-11-05 09:57:16,     Find other brilliant wallpapers here 
6,SamsungMobile,2019-11-05 02:26:45, 
7,SamsungMobile,2019-11-05 00:00:32,RT  This years Samsung Developer Conference showcases technologies that will enable Samsung device users to unlock the full power
8,SamsungMobile,2019-11-04 12:00:03,RT  Samsung unveiled One UI 2 as part of its ongoing commitment to ensuring that its technologies are accessible to all users SDC
9,SamsungMobile,2019-11-04 05:46:40, Totally feeling it  
10,SamsungMobile,2019-11-04 00:00:09,RT  Samsung announced the Best of Galaxy Store Awards 2019 selections Check out some of the winners from the Best of Galaxy Store
11,SamsungMobile,2019-11-03 06:50:03, Innovation never stops 
12,SamsungMobile,2019-11-02 12:00:00,Art to honor the dearly departed  Celebrate this Day of the Dead with wallpapers by  
13,SamsungMobile,2019-11-01 23:59:59,RT  Check out the product specifications of GalaxyBookFlex and GalaxyBookIon worlds first laptops with QLED displays SDC19
14,SamsungMobile,2019-11-01 12:04:27,RT  Samsung showcases new ways for developers to scale their services across billions of devices through its extensive secure and
15,SamsungMobile,2019-10-31 21:41:09, You know you want to
16,SamsungMobile,2019-10-31 21:36:48, and beyond 
17,SamsungMobile,2019-10-31 20:20:37, We are fully appreciative  
18,SamsungMobile,2019-10-31 12:01:10,RT  From cryptocurrency wallets to DApps Samsung has been steadily building a variety of blockchainpowered services See how the
19,SamsungMobile,2019-10-31 05:03:57, Nice  
20,SamsungMobile,2019-10-31 02:16:51, Feelin the love 
21,SamsungMobile,2019-10-31 01:05:32, Were inclined to agree 
22,SamsungMobile,2019-10-30 21:53:28,  
23,SamsungMobile,2019-10-30 19:03:24, 
24,SamsungMobile,2019-10-30 18:54:38, Thats absolutely what were here for Much  back to you
25,SamsungMobile,2019-10-30 18:17:30,   
26,SamsungMobile,2019-10-30 18:09:26, Innovation never stops 
27,SamsungMobile,2019-10-30 12:00:00,Lets make social media a happier place SpreadTheLove with  Learn more  
28,SamsungMobile,2019-10-30 08:16:10, 
29,SamsungMobile,2019-10-30 07:01:28, Absolutely spot on 
30,SamsungMobile,2019-10-30 04:40:11, And its looking pretty bright to us 
31,SamsungMobile,2019-10-30 04:19:38,  This tweet we like  
32,SamsungMobile,2019-10-30 04:02:09, Cant stop wont stop 
33,SamsungMobile,2019-10-30 03:52:53,  
34,SamsungMobile,2019-10-30 03:32:01, Its the little things 
35,SamsungMobile,2019-10-30 03:18:28, 
36,SamsungMobile,2019-10-30 03:03:36,  
37,SamsungMobile,2019-10-30 02:49:21,  
38,SamsungMobile,2019-10-30 02:39:23, We love that you love it 
39,SamsungMobile,2019-10-30 02:36:44, Right  
40,SamsungMobile,2019-10-30 01:01:10, We completely agree   
41,SamsungMobile,2019-10-30 00:43:29,  
42,SamsungMobile,2019-10-30 00:15:26, Cant stop wont stop 
43,SamsungMobile,2019-10-29 23:54:23, Oh yeah  
44,SamsungMobile,2019-10-29 23:40:47,    
45,SamsungMobile,2019-10-29 23:26:14,Transforming the mobile computing experience with  and  Together were realizing that vision 
46,SamsungMobile,2019-10-29 22:44:58, bows
47,SamsungMobile,2019-10-29 22:02:41, Aw youre making us blush 
48,SamsungMobile,2019-10-29 21:38:35,  
49,SamsungMobile,2019-10-29 20:55:53, We love that you love it 
50,SamsungMobile,2019-10-29 20:23:11,   
51,SamsungMobile,2019-10-29 20:14:09,  It only gets better 
52,SamsungMobile,2019-10-29 19:25:54, And thats whats up 
53,SamsungMobile,2019-10-29 19:02:52, Thats what were here for 
54,SamsungMobile,2019-10-29 18:46:30,A new era of mobile computing To drive innovation even further SDCD19 SamsungEvent Learn more 
55,SamsungMobile,2019-10-29 18:44:58, Sit tight  theres more youll love thats still to come 
56,SamsungMobile,2019-10-29 18:38:36, Totally feel you 
57,SamsungMobile,2019-10-29 18:36:55,Connecting multiple devices to a single Bluetooth speaker just got simpler All you need is a friends existing con 
58,SamsungMobile,2019-10-29 18:36:05,An enhanced keyboard that lets you undo or redo text changes with simple swipes SDC19 SamsungEvent Learn more 
59,SamsungMobile,2019-10-29 18:35:43,Enriched with Bitmoji and more for when the right words arent words at all SDC19 SamsungEvent Learn more 
60,SamsungMobile,2019-10-29 18:32:11,Pioneering foldable technology to open up innovative user experiences  SDC19 SamsungEvent Learn more 
61,SamsungMobile,2019-10-29 18:30:37, 
62,SamsungMobile,2019-10-29 18:29:01,Customized in more ways than ever for a continuously refreshing experience SDC19 SamsungEvent Learn more 
63,SamsungMobile,2019-10-29 18:28:25,Designed to be more comfortable and intuitive for your eyes as well as your hands SDC19 SamsungEvent Learn more 
64,SamsungMobile,2019-10-29 18:27:42,Simple interactions that make sense for quicker more intuitive access SDC19 SamsungEvent Learn more 
65,SamsungMobile,2019-10-29 18:26:25,Notifications designed to occupy less space so you can focus even more SDC19 SamsungEvent Learn more 
66,SamsungMobile,2019-10-29 18:17:10,WATCH LIVE Catch whats happening now at SDC19 SamsungEvent Discover more   
67,SamsungMobile,2019-10-29 18:00:23,Protect what matters most Security its in our DNA SDC19 SamsungEvent Learn more  
68,SamsungMobile,2019-10-29 17:56:11,  Still to come some of the coolest innovations
69,SamsungMobile,2019-10-29 17:08:15,WATCH LIVE Catch whats happening now at SDC19 SamsungEvent Discover more   
70,SamsungMobile,2019-10-29 07:29:38, Stay tuned More to love will be unveiled soon 
71,SamsungMobile,2019-10-29 07:26:19, See you there 
72,SamsungMobile,2019-10-29 01:56:36, We got you Stay uptodate on SDC19 live at your own comfort here  
73,SamsungMobile,2019-10-29 01:42:21, Not long now before SDC19
74,SamsungMobile,2019-10-29 01:34:53, 
75,SamsungMobile,2019-10-29 01:15:58, 
76,SamsungMobile,2019-10-29 00:42:39,  Hear more about whats coming on our SDC19 livestream 
77,SamsungMobile,2019-10-29 00:04:59, Glad you think so Watch the SDC19 livestream for more about our latest innovations 
78,SamsungMobile,2019-10-28 17:12:56, Love the energy Dont forget to catch our SDC19 livestream for more updates on One UI 2 and our lates 
79,SamsungMobile,2019-10-28 01:16:53,Partnerships that continuously push boundaries See whats next with  at SDC19 SamsungEvent Learn more 
80,SamsungMobile,2019-10-26 00:00:03,RT  Samsung unveiled the worlds first selfie sent to space as part of SpaceSelfie a mission to give everyone the chance to get
81,SamsungMobile,2019-10-25 17:00:01,A muchloved interface is getting even more lovable See whats next at SDC19 SamsungEvent Learn more 
82,SamsungMobile,2019-10-25 17:00:01,A new Galaxy Experience powered by trusted security See what comes next at SDC19 SamsungEvent Learn more 
83,SamsungMobile,2019-10-25 12:00:00,Put some scream  in your screen Halloween wallpapers by  TRNZ  and more are prowli 
84,SamsungMobile,2019-10-25 11:33:09,    Agree Hard to find any eyesaurs here 
85,SamsungMobile,2019-10-25 11:32:09,     Best part is they will always be with you forever 
86,SamsungMobile,2019-10-24 17:00:00,Time is running out Dont miss the chance to explore the latest tech at SDC19 and connect with the amazing devs d 
87,SamsungMobile,2019-10-23 00:00:07,RT  This years Samsung Developer Conference will offer creators and developers an opportunity to get to know Samsungs AI and I
88,SamsungMobile,2019-10-22 02:27:22,We are so ready for this TheRiseOfSkywalker 
89,SamsungMobile,2019-10-21 12:00:01,Love  Youll dig these new GalaxyNote10 and GalaxyS10 wallpapers by    an 
90,SamsungMobile,2019-10-18 16:00:07,RT  Explore the latest sessions on Tizen SPen Air Actions 5G and more at Samsung Developer Conference Plus dont miss b
91,SamsungMobile,2019-10-17 23:59:59,RT  The GalaxyFolds practical multitasking capabilities can streamline daily life bringing you almost PClike multitasking effi
92,SamsungMobile,2019-10-17 12:00:35,RT  Great article from  Head of Global B2B SJ Hahn on how 5G is defining how business is done in the new mobile econ
93,SamsungMobile,2019-10-15 12:00:03,RT  Samsung will deploy NFCenabled contactless payment acceptance on mobile devices in partnership with Mobeewave a pioneer in c
94,SamsungMobile,2019-10-14 12:00:33,RT  Join the Beta Program and enjoy the new One UI with Android10 features before its official release GalaxyS10
95,SamsungMobile,2019-10-11 12:00:00,Track your running cadence in realtime with Galaxy Watch Active2 Under Armour EditionDiscover more 
96,SamsungMobile,2019-10-11 06:42:59,    Weve got more to love coming your way soon 
97,SamsungMobile,2019-10-11 06:42:17,    Knew youd love it  Theres more to explore in the Gal 
98,SamsungMobile,2019-10-09 00:00:00,RT  Did you know that the Korean alphabet Hangeul is widely considered the most scientific alphabet existing today You can easil
99,SamsungMobile,2019-10-08 12:00:00,New wallpapers have landed  Blast off into World Space Week with rockets spacemen and more by  
100,SamsungMobile,2019-10-07 12:01:04,RT  The GalaxyA90 5G combines nextlevel connectivity with powerful features that let you capture stream and share the way you
101,SamsungMobile,2019-10-03 12:00:05,RT  Samsung GalaxyS10 is the first smartphone to receive the Best WiFi Innovation Award IntelligentWiFi WiFi6
102,SamsungMobile,2019-10-02 16:05:00,A Galactic alliance has begun Visit  to find out how to enter for a chance to win tickets t 
103,SamsungMobile,2019-10-01 12:45:00,The GalaxyNote10 and GalaxyNote10 Plus Power now comes in two sizes Learn more  
104,SamsungMobile,2019-10-01 12:30:00,Switch to the GalaxyNote10 with fast download speed For work stuff and not work stuff Learn more 
105,SamsungMobile,2019-10-01 12:15:00,Switch to the GalaxyNote10 Plus 5G for hyperfast download speed When you really really need them Learn more 
106,SamsungMobile,2019-10-01 12:00:01,Cant access the cloud from the clouds Switch to the GalaxyNote10 Plus with up to 15TB of storage Learn more 
107,SamsungMobile,2019-09-30 13:05:29,RT  New exclusive Fortnite Glow skin is now available on SamsungGalaxy devices  
108,SamsungMobile,2019-09-30 12:00:00,Wallpapers to fall for Spruce up your GalaxyNote10 and GalaxyS10 with new  art by  
109,SamsungMobile,2019-09-27 12:30:00,Galaxy Folds immersive display and optimized software allows you for the first time on mobile to operate 3 apps at 
110,SamsungMobile,2019-09-27 12:15:00,Galaxy Folds outer display is the first to enable truly onehanded onthego responsesWhen unfolded the immers 
111,SamsungMobile,2019-09-27 12:00:00,Make every angle epic with Galaxy Folds prograde 6 camera system GalaxyFoldLearn more  
112,SamsungMobile,2019-09-26 12:00:07,RT  With the GalaxyFold you can get things done onehanded while on the go and enjoy the immersive experience and productivity w
113,SamsungMobile,2019-09-24 12:00:05,RT  The GalaxyS10 software update will allow users to unleash their creativity and be more productive with new features including
114,SamsungMobile,2019-09-23 12:00:18,RT  Packed with innovations and optimized for users everyday lives Samsungs new GalaxyA20s lets you play and share instantaneo
115,SamsungMobile,2019-09-18 12:00:01,Where some see a  you see a passport to a different  Celebrate your greatest escapes with wallpapers by 
116,SamsungMobile,2019-09-18 00:00:45,RT  Samsung is proud to be announced as one of the first companies to hold the WiFi CERTIFIED 6 accreditation GalaxyNote10 h
117,SamsungMobile,2019-09-17 12:00:53,RT  Upgrade alert New features in Samsung Weather on the GalaxyNote10 now includes weather alerts videos and radar maps powered
118,SamsungMobile,2019-09-17 00:00:16,RT  The GalaxyTabS6 delivers a mobile device thats perfectly in sync with the needs and demands of todays artistic trailblazers
119,SamsungMobile,2019-09-16 12:00:01,The power is already here GalaxyS10 Plus and GalaxyNote10 Plus Learn more  
120,SamsungMobile,2019-09-12 12:00:01,The instinct to protect others is in all of us Its part of Samsungs DNA too Thats why weve spent years perfe 
121,SamsungMobile,2019-09-11 23:59:58,RT  Samsung Mobile Division RampD executives discuss how the categorydefining GalaxyFold establishes an allnew userexperience pl
122,SamsungMobile,2019-09-11 12:00:00,Track your running cadence in realtime with Galaxy Watch Active2 Under Armour EditionGalaxy Watch Active2 Under 
123,SamsungMobile,2019-09-11 09:40:20,    We completely agree Check out even more in the Galax 
124,SamsungMobile,2019-09-11 09:39:30,    Theres beauty in greenery  Which is your favorite wallpaper
125,SamsungMobile,2019-09-11 00:00:00,RT  Hundreds of applications and services for the GalaxyFold are now available in the Android ecosystem in the Google Play Store
126,SamsungMobile,2019-09-10 12:30:00,Store all of your final presentations on the GalaxyNote10 Plus Now with up to 15TB of storageLearn more 
127,SamsungMobile,2019-09-10 12:20:00,End your relationship with Low Power Mode Switch to the new GalaxyNote10 with 24hour batteryLearn more 
128,SamsungMobile,2019-09-10 12:10:00,Outlast every meeting with 24hour battery life on the GalaxyNote10Learn more  
129,SamsungMobile,2019-09-10 12:00:00,Get realtime coaching on every runGalaxy Watch Active2 with smart adviceDiscover more  
130,SamsungMobile,2019-09-10 00:00:51,RT  The wider application of 5G will usher us into the next major era of InventionAge
131,SamsungMobile,2019-09-09 12:00:16,RT  Samsung is paving the way for businesses to stay connected securely and safely through extensive global partnership network a
132,SamsungMobile,2019-09-09 12:00:00,Refined and now with more sizes and materials to choose fromGalaxy Watch Active2 with smart adviceDiscover more 
133,SamsungMobile,2019-09-09 00:00:13,RT  Enabling Samsung mobile devices to be used for contactless payments transactions with no additional equipment SoftPOS IFA201
134,SamsungMobile,2019-09-07 00:00:07,RT  Samsungs categorydefining GalaxyFold offers a brand new user experience Get a handson look at its innovative form factor
135,SamsungMobile,2019-09-06 12:15:00,Better care less worries Switch to the GalaxyNote10 with Samsung CareLearn more  
136,SamsungMobile,2019-09-06 12:00:00,More security less shock Switch to the GalaxyNote10 with Knox securityLearn more  
137,SamsungMobile,2019-09-06 00:00:07,RT  New GalaxyFold is a categorydefining foldable device designed to inspire firstofitskind user experience
138,SamsungMobile,2019-09-05 12:00:00,Forests are friends Celebrate  and everything green with fresh wallpapers from   
139,SamsungMobile,2019-09-05 06:58:32, Glad youre feeling it too  
140,SamsungMobile,2019-09-05 06:52:31, Feeling the love   
141,SamsungMobile,2019-09-05 02:20:00,We didnt just change the shape of the phone We changed the shape of tomorrow Introducing the Samsung Galaxy F 
142,SamsungMobile,2019-09-04 12:01:39,RT  New mobile processor the Exynos980 combines the bestinclass connectivity with an integrated 5G modem and intelligent pro
143,SamsungMobile,2019-09-04 11:30:00,Ultra Wide Lens captures more More portraits more landscapes more inspirations GalaxyTabS6 Learn more 
144,SamsungMobile,2019-09-04 11:20:00,Put more power in your hands with gesture control of the upgraded S Pen GalaxyTabS6 Learn more 
145,SamsungMobile,2019-09-04 11:10:00,A battery that lasts and lasts and lasts But please dont work that long GalaxyTabS6 Learn more 
146,SamsungMobile,2019-09-04 11:00:00,Take all your work togo The GalaxyTabS6 with detachable keyboard Learn more  
147,SamsungMobile,2019-09-04 00:00:08,RT  Introducing the latest addition to the GalaxyA family with 5G connectivity GalaxyA90
148,SamsungMobile,2019-09-03 12:00:14,RT  Take a look at this roundup of hidden tips and tricks to help you make the most out of your GalaxyNote10 or Note10 
149,SamsungMobile,2019-09-03 07:58:29, Thats what we were going for
150,SamsungMobile,2019-09-03 07:57:07, Nods 
151,SamsungMobile,2019-09-03 05:39:35, Welcome to the fam  
152,SamsungMobile,2019-09-03 05:37:35, You sure said it  
153,SamsungMobile,2019-09-02 11:52:38, We totally agree 
154,SamsungMobile,2019-09-02 11:48:52, 
155,SamsungMobile,2019-09-02 11:48:07, The heart wants what it wants  
156,SamsungMobile,2019-09-02 11:44:03, Go for it GalaxyNote10 
157,SamsungMobile,2019-09-02 11:38:38, Same  same 
158,SamsungMobile,2019-09-02 11:37:10, Thats what we like to hear 
159,SamsungMobile,2019-09-02 11:35:07, Welcome to the fam  
160,SamsungMobile,2019-09-02 11:33:26, Go for it GalaxyNote10
161,SamsungMobile,2019-09-02 11:29:34, Yasss  
162,SamsungMobile,2019-09-02 09:55:00, Thrilled that youre thrilled
163,SamsungMobile,2019-09-02 09:52:07, Feeling the love   
164,SamsungMobile,2019-09-02 09:48:36, Gotta make way for better things GalaxyNote10 
165,SamsungMobile,2019-09-02 09:37:07, Aw youre sweet 
166,SamsungMobile,2019-08-30 06:13:58, Nods 
167,SamsungMobile,2019-08-30 03:11:39, And thats just how it looks wait til you start using it 
168,SamsungMobile,2019-08-30 02:22:21,    Glad you think so Which is your fave
169,SamsungMobile,2019-08-30 02:21:31,    What can we say Choosing a wallpaper is the toughest part 
170,SamsungMobile,2019-08-30 00:00:06,RT  Bringing a homebased cardiac rehabilitation solution that is demonstrating promising results for better patient outcomes  wi
171,SamsungMobile,2019-08-29 12:00:29,RT  Here are the 10 functions and settings you should consider when setting up your new GalaxyNote10
172,SamsungMobile,2019-08-29 11:49:06, Time to take the GalaxyNote10 out for a spin  
173,SamsungMobile,2019-08-29 06:51:14, Aint that the truth Glad you like it 
174,SamsungMobile,2019-08-29 06:48:51, Yasss  
175,SamsungMobile,2019-08-29 06:47:30, We totally agree 
176,SamsungMobile,2019-08-29 06:45:31, We see you fam 
177,SamsungMobile,2019-08-29 06:41:24, Thats what we like to hear
178,SamsungMobile,2019-08-28 12:00:01,Celebrating the worlds largest  fight    and more get messy with  wallp 
179,SamsungMobile,2019-08-28 08:39:37, Glad youre feeling it too  
180,SamsungMobile,2019-08-28 07:50:04, Thats what we like to hear 
181,SamsungMobile,2019-08-28 07:13:06, We totally agree 
182,SamsungMobile,2019-08-28 07:02:00, Yasss 
183,SamsungMobile,2019-08-28 06:56:26, Aint that the truth Glad you like it
184,SamsungMobile,2019-08-28 06:52:58, Glad youre feeling it too  
185,SamsungMobile,2019-08-28 06:49:34, Thats what we like to hear 
186,SamsungMobile,2019-08-28 06:46:36,  
187,SamsungMobile,2019-08-27 12:00:49,RT  Samsung is expanding the commitment with the UNDP to support the Sustainable Development Goals Read on for details SamsungGa
188,SamsungMobile,2019-08-27 08:33:38, Yasss 
189,SamsungMobile,2019-08-26 12:00:25,RT  Helping keep away the postvacation blues with a suite of meditation and mindfulness features SamsungHealth CalmApp h
190,SamsungMobile,2019-08-26 08:15:26, We approve of this message 
191,SamsungMobile,2019-08-26 08:11:38, We totally agree 
192,SamsungMobile,2019-08-26 08:06:32, Thats what we like to hear 
193,SamsungMobile,2019-08-26 00:00:00,RT  The new GalaxyA50s and GalaxyA30s are made even more powerful with a versatile camera an uninterrupted infinity display and
194,SamsungMobile,2019-08-23 12:00:26,RT  The GalaxyNote10 and Galaxy Note10 will be available in stores and online beginning August 23
195,SamsungMobile,2019-08-23 10:02:57, We approve of this message  
196,SamsungMobile,2019-08-23 09:59:35, Aw youre sweet 
197,SamsungMobile,2019-08-23 09:58:03, Welcome to the fam 
198,SamsungMobile,2019-08-23 08:57:33, Yasss  
199,SamsungMobile,2019-08-23 08:10:00,Propel yourself into action GalaxyTabS6Learn more  
200,SamsungMobile,2019-08-23 08:05:00,S Pen gives you more freedom so your ideas can take flight GalaxyTabS6Learn more  
201,SamsungMobile,2019-08-23 08:00:00,Samsung DeX brings a full PClike experience at the push of a button GalaxyTabS6Learn more 
202,SamsungMobile,2019-08-22 09:30:40, We see you fam  
203,SamsungMobile,2019-08-22 09:25:46, Great minds think alike 
204,SamsungMobile,2019-08-22 09:24:06, WE  CANT  WAIT  EITHER 
205,SamsungMobile,2019-08-21 12:00:00,New phone new artists new wallpapers  Unpack your GalaxyNote10 and pack it up with fresh work from 
206,SamsungMobile,2019-08-20 12:00:02,RT  The GalaxyNote10 s Cinematic Infinity Display delivers rich vivid colors for unmatched video quality offering users a trul
207,SamsungMobile,2019-08-20 09:58:23,     There can only be one proper way
208,SamsungMobile,2019-08-20 09:39:43, If you know you know  
209,SamsungMobile,2019-08-20 09:38:06, Thrilled that youre thrilled 
210,SamsungMobile,2019-08-19 12:01:37,RT  DisplayMate recently described the Galaxy Note10s screen as an excellent toptier worldclass smartphone display See d
211,SamsungMobile,2019-08-19 11:39:21,     Wish granted  Stay tuned for more wallpapers
212,SamsungMobile,2019-08-19 08:28:52, Thats what we like to hear 
213,SamsungMobile,2019-08-19 08:27:31, Thrilled that youre thrilled 
214,SamsungMobile,2019-08-19 00:00:06,RT  Exclusive GalaxyWatchActive2 Under Armour Edition is designed to deliver unique experiences that help runners achieve their f
215,SamsungMobile,2019-08-16 12:00:00,For those about to rock Crank up the volume with new GalaxyS10 wallpapers by   
216,SamsungMobile,2019-08-16 10:27:42, Wow thank you Cant wait for you to try it 
217,SamsungMobile,2019-08-16 04:50:01, Yasss  
218,SamsungMobile,2019-08-16 04:48:07, Great minds think alike 
219,SamsungMobile,2019-08-16 04:46:39, Go wherever your heart desires  
220,SamsungMobile,2019-08-16 04:37:03, Aint that the truth Glad you like it 
221,SamsungMobile,2019-08-16 04:31:51, Same  same
222,SamsungMobile,2019-08-16 00:00:01,RT  New GalaxyBookS is built to remove barriers and friction from your day with alwayson LTE connectivity an ultraslim design
223,SamsungMobile,2019-08-15 12:00:02,RT  What are some of the most exciting new features of GalaxyNote10
224,SamsungMobile,2019-08-15 09:15:57, Thrilled that youre thrilled 
225,SamsungMobile,2019-08-15 09:00:36, If you know you know  
226,SamsungMobile,2019-08-15 08:44:07, Gotta make way for better things GalaxyNote10 
227,SamsungMobile,2019-08-15 08:21:07, Aint that the truth Glad you like it 
228,SamsungMobile,2019-08-15 08:11:51, Cant wait til you get to try it 
229,SamsungMobile,2019-08-15 07:40:09, We see you fam  
230,SamsungMobile,2019-08-15 07:36:01, 
231,SamsungMobile,2019-08-15 07:33:29, Aw youre sweet
232,SamsungMobile,2019-08-15 07:13:47, What can we say Were pretty hyped too 
233,SamsungMobile,2019-08-15 07:10:42, Cant wait til you get to try it 
234,SamsungMobile,2019-08-15 00:00:14,RT  New GalaxyNote10 line empowers users to take the bestofthebest technologies to the next level Learn more here
235,SamsungMobile,2019-08-14 12:00:02,RT  The S Pen now features S Pen Air actions letting users take pictures zoom in and out and switch camera perspective with a sim
236,SamsungMobile,2019-08-14 05:44:31, Aw youre sweet 
237,SamsungMobile,2019-08-14 05:41:27, Same  same
238,SamsungMobile,2019-08-14 05:37:08, Thrilled that youre thrilled 
239,SamsungMobile,2019-08-14 05:31:06, Nods 
240,SamsungMobile,2019-08-14 05:27:39, We approve of this message  
241,SamsungMobile,2019-08-14 05:23:57, Thats what we like to hear 
242,SamsungMobile,2019-08-13 12:00:11,RT  In celebration of International Cat Day here are some tips for creating a purrfect clip of your feline friend  GalaxyNote10
243,SamsungMobile,2019-08-13 10:03:34, Yasss 
244,SamsungMobile,2019-08-10 04:15:34, We approve of this message 
245,SamsungMobile,2019-08-10 03:04:33, Love this 
246,SamsungMobile,2019-08-10 02:22:06, 
247,SamsungMobile,2019-08-09 14:00:17,Today were taking Note further Say hi to Galaxy Note10 and 10 Learn more  
248,SamsungMobile,2019-08-09 09:26:40, What can we say Were pretty hyped too 
249,SamsungMobile,2019-08-09 02:16:01, We have the best fans in the world  
250,SamsungMobile,2019-08-09 02:13:33, Totally feel ya  
251,SamsungMobile,2019-08-09 02:08:07, Guilty as charged  
252,SamsungMobile,2019-08-09 00:07:00, Looks even better IRL  For a few more sweet shots check out 
253,SamsungMobile,2019-08-09 00:02:06, Aw yeah  
254,SamsungMobile,2019-08-09 00:00:07, Cant wait for you to take it for a spin  
255,SamsungMobile,2019-08-08 23:57:00, Doing every bit we can  
256,SamsungMobile,2019-08-08 23:54:34, Right back atcha  
257,SamsungMobile,2019-08-08 23:48:09, We feelin it from here  
258,SamsungMobile,2019-08-08 22:53:31, We do it all for you  
259,SamsungMobile,2019-08-08 22:48:06, Personally were all about the upgrade  
260,SamsungMobile,2019-08-08 22:43:00, Appreciate it  
261,SamsungMobile,2019-08-08 22:41:08, Thats how we do  
262,SamsungMobile,2019-08-08 22:38:33,  
263,SamsungMobile,2019-08-08 22:33:29,  
264,SamsungMobile,2019-08-08 22:25:07,  
265,SamsungMobile,2019-08-08 22:14:29, Get ready for the glowup 
266,SamsungMobile,2019-08-08 22:06:30,    
267,SamsungMobile,2019-08-08 21:03:32, Were pretty proud of it Check out more of its good looks at 
268,SamsungMobile,2019-08-08 19:45:11,  
269,SamsungMobile,2019-08-08 10:35:35, Youve been missed 
270,SamsungMobile,2019-08-08 10:23:40,  
271,SamsungMobile,2019-08-08 09:45:34, The kind of wizardry that gets everyone excited 
272,SamsungMobile,2019-08-08 09:13:45, Thats what we like to hear GalaxyNote10 
