,User,Date,Tweets
0,verge,2019-11-15 02:14:34,Taylor Swift provoked fans to go after Scooter Braun and now hes being doxxed  
1,verge,2019-11-15 02:07:01,AirFly wireless headphone dongle updated with aux input support 
2,verge,2019-11-15 02:01:01,The nine best beard trimmers via the    
3,verge,2019-11-15 01:54:01,Venices historic flooding blamed on human failure and climate change  
4,verge,2019-11-15 01:32:01,Why thousands of Amazon packages converge on a tiny Montana town  
5,verge,2019-11-15 01:00:04,The world is waiting for Google Stadia to flop  
6,verge,2019-11-15 00:29:01,Apple could bundle news TV and music into one subscription as soon as 2020  
7,verge,2019-11-15 00:16:16,Boosted rolls out squishier wheels for smoother faster rides  
8,verge,2019-11-15 00:06:01,Nike ends direct sale of clothes and shoes on Amazon  
9,verge,2019-11-15 00:00:09,The Motorola Razr avoids Samsungs worst folding phone mistakes  
10,verge,2019-11-14 23:08:36,Basecamp now has a totally free version to help you manage personal projects  
11,verge,2019-11-14 22:27:17,RT  Walmart has discounted the 2017 iPad Pro with 512GB of storage to 599 which is the best price weve seen anywhere Its n
12,verge,2019-11-14 22:16:24,Amazon will fight Pentagon contract loss after public criticism from Trump  
13,verge,2019-11-14 22:03:54,RT  If youre searching for an affordable capable gaming laptop Walmart has a great deal on Lenovos 156inch Legion It has
14,verge,2019-11-14 21:47:01,States to expand Google antitrust probe into search and Android businesses  
15,verge,2019-11-14 21:38:00,Google Pixel 4 and 4 XL review the best Android experience 
16,verge,2019-11-14 21:34:36,Xbox chief says Project Scarlett will not be out of position on power or price  
17,verge,2019-11-14 21:12:17,The Final Fantasy series is coming to Xbox Game Pass  
18,verge,2019-11-14 21:02:19,The NSA has stopped collecting location data from US cellphones without a warrant  
19,verge,2019-11-14 21:00:58,RT  Microsoft is cutting prices on Xbox One consoles controllers and firstparty games for Black Friday 
20,verge,2019-11-14 21:00:35,PayPal abruptly cuts off Pornhubs payroll leaving performers with few payment options  
21,verge,2019-11-14 20:52:30,Halo Reach is coming to PC on December 3rd  
22,verge,2019-11-14 20:39:37,Microsoft to launch xCloud in 2020 with PS4 controllers and PC streaming on the way  
23,verge,2019-11-14 20:38:36,Microsofts xCloud preview now has 50 new games more than Stadias launch list  
24,verge,2019-11-14 20:37:57,Life is Strange developer unveils new mystery game Tell Me Why  
25,verge,2019-11-14 20:22:24,Rare unveils Everwild a new exclusive game for Xbox and Windows 10  
26,verge,2019-11-14 20:16:06,Obsidians Grounded is a survival game crossed with Honey I Shrunk the Kids  
27,verge,2019-11-14 20:07:14,Impeachment podcasts are about more than Trump 
28,verge,2019-11-14 19:44:29,The Motorola Razr flip phone is back but now its an Android smartphone with a foldable display 
29,verge,2019-11-14 19:35:35,How to enable RCS chat in the Google Messages app on Android 
30,verge,2019-11-14 18:30:04,Facebook will let nonprofits include a donate button on their Instagram profiles  
31,verge,2019-11-14 18:18:09,RT  Andrew Yang wants to regulate loot boxesAnd a lot of other things This tech policy proposal is a lot but I went thr
32,verge,2019-11-14 17:47:40,BampH dodged millions in taxes New York attorney general alleges  
33,verge,2019-11-14 17:41:57,Andrew Yang wants to tax digital ads and launch a new algorithm regulator  
34,verge,2019-11-14 17:25:49,Instagrams test to hide like counts expands to the US and across the globe  
35,verge,2019-11-14 17:09:15,Greta Thunberg is sailing to Madrid with a family of YouTubers  
36,verge,2019-11-14 17:00:07,Googles rollout of RCS chat for all Android users in the US begins today  
37,verge,2019-11-14 17:00:05,Google search will now give you feedback on your pronunciation  
38,verge,2019-11-14 16:52:33,Today is WorldDiabetesDay but almost a century after the discovery of insulin half of the world still doesnt ha 
39,verge,2019-11-14 16:41:53,Security robots are mobile surveillance devices not human replacements  
40,verge,2019-11-14 15:42:33,RT  I went to Roundup Montana a small town thats become an unexpected hub for Amazon prep centers businesses that special
41,verge,2019-11-14 15:40:35,How to get the Disney bundle with adfree Hulu and ESPN  
42,verge,2019-11-14 15:32:29,Faze Ewok is the latest streamer to jump ship from Twitch  
43,verge,2019-11-14 15:30:05,As Facebook sponsors Kavanaugh event a new campaign is telling employees to fight back    
44,verge,2019-11-14 15:19:01,RT  I have a new illustration up on the  about a small town being transformed by the Amazon prepping business Thanks
45,verge,2019-11-14 15:15:59,Fords allelectric SUV gets an official name Mustang MachE  
46,verge,2019-11-14 15:11:05,How Respawn created its own world within Star Wars for Jedi Fallen Order  
47,verge,2019-11-14 15:10:19,RT  Holiday season is upon us and sometimes picking out the right gift can be hard You want to make sure you give your loved o
48,verge,2019-11-14 15:04:57,Walmarts Black Friday ad has been unveiled  here are the deals you need to know about 
49,verge,2019-11-14 14:07:42,AirFly wireless headphone dongle updated with aux input support 
50,verge,2019-11-14 14:00:08,The nine best beard trimmers via the    
51,verge,2019-11-14 13:54:28,Venices historic flooding blamed on human failure and climate change  
52,verge,2019-11-14 13:16:52,RT  These are the best phone deals that Black Friday will have to offer  
53,verge,2019-11-14 13:03:12,Why thousands of Amazon packages converge on a tiny Montana town  
54,verge,2019-11-14 13:00:03,The world is waiting for Google Stadia to flop  
55,verge,2019-11-14 12:29:46,Apple could bundle news TV and music into one subscription as soon as 2020  
56,verge,2019-11-14 12:04:24,Nike ends direct sale of clothes and shoes on Amazon  
57,verge,2019-11-14 12:00:04,The Motorola Razr avoids Samsungs worst folding phone mistakes  
58,verge,2019-11-14 11:00:05,Why tech companies owe us more than a quarterly transparency report  
59,verge,2019-11-14 08:35:01,Win a mystery bag from The Verge to celebrate Black Friday deals 
60,verge,2019-11-14 08:14:01,Apple Music Replay lets you see and share your listening habits  
61,verge,2019-11-14 08:07:01,YouTubes new kids content system has creators scrambling  
62,verge,2019-11-14 08:00:04,Microsoft releases ARM beta version of Edge Chromium for Surface Pro X  
63,verge,2019-11-14 07:54:01,Facebook includes Instagram in its transparency report for the first time  
64,verge,2019-11-14 07:36:01,Fortnites Android installer is now a launcher for Epic mobile games  
65,verge,2019-11-14 07:16:01,Disney warns viewers about past racism but not as well as Warner Bros  
66,verge,2019-11-14 06:42:01,The USPTO wants to know if artificial intelligence can own the content it creates  
67,verge,2019-11-14 06:22:01,The best smartwatch to buy if you have an Android phone 
68,verge,2019-11-14 06:14:01,Rockstar apologizes for buggy Red Dead Redemption 2 launch on PC  
69,verge,2019-11-14 06:05:01,Modes of transportation in The Wizard of Oz ranked  
70,verge,2019-11-14 05:54:01,Apples Phil Schiller says kids with Chromebooks in classroom are not going to succeed  
71,verge,2019-11-14 05:32:01,Lightroom on iOS will soon allow direct photo import from external storage  
72,verge,2019-11-14 04:39:43,RT  Want to see the new foldable Razr in action Check out the  hands on for all the details 
73,verge,2019-11-14 04:26:30,Motorola made the foldable Razr weve wanted 
74,verge,2019-11-14 04:15:36,Motorola resurrects the Razr as a foldable Android smartphone  
75,verge,2019-11-14 04:15:05,Party like its 2004 with the new Motorola Razrs secret Retro Razr mode  
76,verge,2019-11-14 04:01:01,Google Maps will speak the names of foreign places so you can ask for directions without shame 
77,verge,2019-11-14 03:23:01,Brave 10 launches bringing the privacyfirst browser out of beta  
78,verge,2019-11-14 02:58:01,How Teslas first Gigafactory is changing Reno Nevada  
79,verge,2019-11-14 02:35:01,The best games of 2019 
80,verge,2019-11-14 02:17:01,Google plans to offer checking accounts next year  
81,verge,2019-11-14 02:11:01,TMobile has made big promises about its merger  but talk is cheap  
82,verge,2019-11-14 02:06:01,Spotifys Magic Leap app will change playlists as you change rooms  
83,verge,2019-11-14 02:00:03,Pokmon Sword and Shield are the best Pokmon games in years  
84,verge,2019-11-14 01:50:01,The org that doles out org websites just sold itself to a forprofit company  
85,verge,2019-11-14 01:50:01,Apples new Mac Pro is shipping next month  
86,verge,2019-11-14 01:49:01,Apples 15inch MacBook Pro is no more  
87,verge,2019-11-14 01:43:01,A fully loaded 16inch MacBook Pro costs 6099  
88,verge,2019-11-14 01:39:01,The 16inch MacBook Pro is now available to order  
89,verge,2019-11-14 01:30:01,Apples 16inch MacBook Pro is here and it has a good keyboard  
90,verge,2019-11-14 00:01:38,John Carmack stepping down as CTO of Oculus to work on AI  
91,verge,2019-11-14 00:00:05,Han Shot First but leave Lucas edits in Star Wars forever  
92,verge,2019-11-13 23:38:01,Adidas to end robotic shoe production in Germany and the US  
93,verge,2019-11-13 23:23:16,SpaceXs Crew Dragon spacecraft just fired up its emergency escape engines  
94,verge,2019-11-13 23:09:59,SpongeBob Squarepants spinoff may head to Netflix in new massive deal with Nickelodeon  
95,verge,2019-11-13 23:05:24,Facebook updates iOS app to fix issues that let the camera open in the background  
96,verge,2019-11-13 23:01:01,Snap CEO Evan Spiegel on why Spectacles are a new kind of camera  
97,verge,2019-11-13 22:25:47,WordPress introduces a new way for bloggers to get paid  
98,verge,2019-11-13 22:09:00,DJI wants to let anyone with a smartphone monitor nearby drones  
99,verge,2019-11-13 22:06:00,How to find the microplastics in your seafood Presented by  
100,verge,2019-11-13 22:01:33,These are the best phone deals that Black Friday will have to offer  
101,verge,2019-11-13 21:09:17,No ebikes arent cheating  
102,verge,2019-11-13 20:35:47,Win a mystery bag from The Verge to celebrate Black Friday deals 
103,verge,2019-11-13 20:32:13,RT  Apples 16inch MacBook Pro was just announced and its already on sale  
104,verge,2019-11-13 20:31:48,RT  By now weve all seen Disneys disclaimer for outdated read racist and prejudiced content on movies from decades ag
105,verge,2019-11-13 20:14:24,Apple Music Replay lets you see and share your listening habits  
106,verge,2019-11-13 20:06:41,YouTubes new kids content system has creators scrambling  
107,verge,2019-11-13 19:51:06,Microsoft releases ARM beta version of Edge Chromium for Surface Pro X  
108,verge,2019-11-13 19:36:32,Facebook includes Instagram in its transparency report for the first time  
109,verge,2019-11-13 19:36:08,Fortnites Android installer is now a launcher for Epic mobile games  
110,verge,2019-11-13 19:15:32,Disney warns viewers about past racism but not as well as Warner Bros  
111,verge,2019-11-13 18:49:03,RT  reader I published it 
112,verge,2019-11-13 18:45:51,The USPTO wants to know if artificial intelligence can own the content it creates  
113,verge,2019-11-13 18:21:16,The best smartwatch to buy if you have an Android phone 
114,verge,2019-11-13 18:20:49,RT  Asus 173inch Strix SCAR II gaming laptop is a spec powerhouse and is only 1399 right now It comes loaded with an 8th
115,verge,2019-11-13 18:17:29,RT  The streaming wars are here  Which new service is right for you Listen to  to understand your options 
116,verge,2019-11-13 18:14:34,Rockstar apologizes for buggy Red Dead Redemption 2 launch on PC  
117,verge,2019-11-13 18:06:14,Modes of transportation in The Wizard of Oz ranked  
118,verge,2019-11-13 17:55:24,Apples Phil Schiller says kids with Chromebooks in classroom are not going to succeed  
119,verge,2019-11-13 17:51:25,Why is American internet access so much more expensive than the rest of the world  
120,verge,2019-11-13 17:51:03,MacBook Pro 16inch handson with the new keyboard 
121,verge,2019-11-13 17:32:36,Lightroom on iOS will soon allow direct photo import from external storage  
122,verge,2019-11-13 17:12:37,Breaking Disney surpasses 10 million subscribers on first day  
123,verge,2019-11-13 16:13:24,Motorolas folding Razr leaks again just hours before official launch event  
124,verge,2019-11-13 16:00:12,Brave 10 launches bringing the privacyfirst browser out of beta  
125,verge,2019-11-13 16:00:08,Google Maps will speak the names of foreign places so you can ask for directions without shame 
126,verge,2019-11-13 15:21:19,The best smartwatch to buy for your iPhone 
127,verge,2019-11-13 15:13:09,How to stream Disney 
128,verge,2019-11-13 14:58:15,How Teslas first Gigafactory is changing Reno Nevada  
129,verge,2019-11-13 14:18:04,The best games of 2019 
130,verge,2019-11-13 14:17:19,Google plans to offer checking accounts next year  
131,verge,2019-11-13 14:11:19,TMobile has made big promises about its merger  but talk is cheap  
132,verge,2019-11-13 14:07:11,RT  My first Mac was a 15inch Powerbook G4Pour one out for the classic screen size 
133,verge,2019-11-13 14:00:07,Spotifys Magic Leap app will change playlists as you change rooms  
134,verge,2019-11-13 14:00:06,Pokmon Sword and Shield are the best Pokmon games in years  
135,verge,2019-11-13 13:49:03,Apples 15inch MacBook Pro is no more  
136,verge,2019-11-13 13:43:46,A fully loaded 16inch MacBook Pro costs 6099  
137,verge,2019-11-13 13:42:04,The 16inch MacBook Pro is now available to order  
138,verge,2019-11-13 13:30:03,Apples 16inch MacBook Pro is here and it has a good keyboard  
139,verge,2019-11-13 13:30:03,Apples new Mac Pro is shipping next month  
140,verge,2019-11-13 12:00:08,Han Shot First but leave Lucas edits in Star Wars forever  
141,verge,2019-11-13 11:38:19,Adidas to end robotic shoe production in Germany and the US  
142,verge,2019-11-13 11:00:12,Snap CEO Evan Spiegel on why Spectacles are a new kind of camera  
143,verge,2019-11-13 10:32:47,Intel is still struggling with the truth about its processor security flaws  
144,verge,2019-11-13 10:06:49,Trump deal to share 3Dprinted gun blueprints online ruled unlawful  
145,verge,2019-11-13 09:48:01,Fukushima reinvents itself with a 27 billion bet on renewables  
146,verge,2019-11-13 09:24:36,Ikeas first decorative smart bulb is just 999  Hues costs 2499  
147,verge,2019-11-13 09:14:01,Veterans Affairs faces complaint after blocking Navy veteran on Twitter  
148,verge,2019-11-13 08:35:01,Teslas fourth Gigafactory will be in Berlin Elon Musk says  
149,verge,2019-11-13 08:25:02,Border officials cant have boundless access to search devices court rules  
150,verge,2019-11-13 07:52:01,Minecraft Earth is now available in early access in the US  
151,verge,2019-11-13 07:08:01,Walmarts early Black Friday deals have begun  here are the ones you need to know about  
152,verge,2019-11-13 06:52:01,Twitch Studio the companys streaming software for new users is now in open beta  
153,verge,2019-11-13 06:29:01,Toyota Uruguay wants humming electric cars to help pedestrians  and plants  
154,verge,2019-11-13 06:07:01,The Simpsons aspect ratio is messed up on Disney  
155,verge,2019-11-13 06:01:01,Windows 10 November 2019 Update is now available as more of a service pack  
156,verge,2019-11-13 05:51:01,Ebikes are coming back to San Francisco after Lyft resolves issues with battery fires  
157,verge,2019-11-13 05:47:01,Rad Power Bikes lineup of ebikes is discounted ahead of Black Friday  
158,verge,2019-11-13 05:33:01,Facebook Pay is a new payment system for WhatsApp Instagram and Facebook  
159,verge,2019-11-13 05:24:01,The problem with Googles health care ambitions is that no one knows where they end  
160,verge,2019-11-13 05:18:01,The best smartwatch to buy if you have an Android phone  
161,verge,2019-11-13 05:10:01,The best smartwatch to buy for your iPhone  
162,verge,2019-11-13 05:06:01,Chuck Schumer wants the US Army to think twice before using TikTok  
163,verge,2019-11-13 05:05:01,Podcasts are now available on Pandoras website and desktop app  
164,verge,2019-11-13 05:04:01,Herman Miller is getting into gaming  
165,verge,2019-11-13 04:03:01,George Lucas changed Han Solos scene with Greedo in Star Wars A New Hope Disney confirmed 
166,verge,2019-11-13 04:03:01,Disney will tolerate password sharing on Disney  for now  
167,verge,2019-11-13 03:33:01,How to get a year of free Disney from Verizon  
168,verge,2019-11-13 03:26:01,Disney doesnt have to sell anyone on streaming  the companys big advantage is having already sold subscribers o 
169,verge,2019-11-13 03:05:01,The Mandalorians first episode shows that Star Wars can work on the small screen  
170,verge,2019-11-13 03:00:03,Dell pledges to make greener computers over the next decade    
171,verge,2019-11-13 02:35:01,Impeachment podcasts are about more than Trump  
172,verge,2019-11-13 02:12:01,The Outer Worlds is a cruel twist on roleplaying games lone hero stories  
173,verge,2019-11-13 02:00:05,Spotifys free music service now works on Sonos speakers  
174,verge,2019-11-13 01:03:03,Verizons new settop box is possibly the worst option out there for streaming  
175,verge,2019-11-13 01:01:01,Master amp Dynamics MH40 Wireless look and feel like 300 but dont sound like it  
176,verge,2019-11-12 23:01:17,Apple will reportedly introduce 16inch MacBook Pro as soon as tomorrow  
177,verge,2019-11-12 22:59:01,Tim Cook to host Donald Trump at Texas Apple factory per report  
178,verge,2019-11-12 22:56:04,Google reportedly fires staffer in media leak crackdown  
179,verge,2019-11-12 22:33:30,Snowmanshaped target of NASAs New Horizons mission gets a brandnew name  
180,verge,2019-11-12 22:03:09,Apple in final talks with former HBO visionary who championed Game of Thrones  
181,verge,2019-11-12 22:01:02,Snap Spectacles 3 review Life In Depth   
182,verge,2019-11-12 21:45:11,Fukushima reinvents itself with a 27 billion bet on renewables  
183,verge,2019-11-12 21:15:37,Veterans Affairs faces complaint after blocking Navy veteran on Twitter  
184,verge,2019-11-12 20:32:33,Teslas fourth Gigafactory will be in Berlin Elon Musk says  
185,verge,2019-11-12 20:24:36,Border officials cant have boundless access to search devices court rules  
186,verge,2019-11-12 19:52:55,Minecraft Earth is now available in early access in the US  
187,verge,2019-11-12 19:10:35,Walmarts early Black Friday deals have begun  here are the ones you need to know about  
188,verge,2019-11-12 18:52:40,Twitch Studio the companys streaming software for new users is now in open beta  
189,verge,2019-11-12 18:27:06,Facebooks iOS app might be opening the camera in the background without your knowledge  
190,verge,2019-11-12 18:13:22,RT  New Disney confirmed to The Verge just now this change made by George Lucas made prior to the Disney acquisition ht
191,verge,2019-11-12 18:03:08,Toyota Uruguay wants humming electric cars to help pedestrians  and plants  
192,verge,2019-11-12 18:03:01,The Simpsons aspect ratio is messed up on Disney  
193,verge,2019-11-12 18:01:47,Windows 10 November 2019 Update is now available as more of a service pack  
194,verge,2019-11-12 17:55:14,Why is SMS texting a mess Fixing it is harder than you think  via  
195,verge,2019-11-12 17:54:29,Chuck Schumer wants the US Army to think twice before using TikTok  
196,verge,2019-11-12 17:51:17,Ebikes are coming back to San Francisco after Lyft resolves issues with battery fires  
197,verge,2019-11-12 17:47:11,Rad Power Bikes lineup of ebikes is discounted ahead of Black Friday  
198,verge,2019-11-12 17:33:04,Facebook Pay is a new payment system for WhatsApp Instagram and Facebook  
199,verge,2019-11-12 17:09:00,The problem with Googles health care ambitions is that no one knows where they end  
200,verge,2019-11-12 17:00:22,The best smartwatch to buy if you have an Android phone  
201,verge,2019-11-12 17:00:15,The best smartwatch to buy for your iPhone  
202,verge,2019-11-12 17:00:12,Podcasts are now available on Pandoras website and desktop app  
203,verge,2019-11-12 17:00:06,Herman Miller is getting into gaming  
204,verge,2019-11-12 16:24:03,You can save 250 right now on the 2019 MacBook Pro with upgraded storage at Costco  
205,verge,2019-11-12 16:13:16,Han Solos scene with Greedo in Star Wars A New Hope may be edited differently on Disney  
206,verge,2019-11-12 16:00:19,Disney will tolerate password sharing on Disney  for now  
207,verge,2019-11-12 15:33:00,How to get a year of free Disney from Verizon  
208,verge,2019-11-12 15:26:13,Disney doesnt have to sell anyone on streaming  the companys big advantage is having already sold subscribers o 
209,verge,2019-11-12 15:03:52,The Mandalorians first episode shows that Star Wars can work on the small screen  
210,verge,2019-11-12 15:00:22,Dell pledges to make greener computers over the next decade    
211,verge,2019-11-12 14:36:33,Impeachment podcasts are about more than Trump  
212,verge,2019-11-12 14:12:28,The Outer Worlds is a cruel twist on roleplaying games lone hero stories  
213,verge,2019-11-12 14:00:05,Spotifys free music service now works on Sonos speakers  
214,verge,2019-11-12 13:00:03,Master amp Dynamics MH40 Wireless look and feel like 300 but dont sound like it  
215,verge,2019-11-12 12:25:10,Instagram is testing a new video editing tool called Reels that copies TikToks best features 
216,verge,2019-11-12 12:18:56,Disney experiencing unable to connect errors on launch day  
217,verge,2019-11-12 12:00:08,How to stream Disney  
218,verge,2019-11-12 12:00:04,Apple owns every mistake Goldman Sachs makes with its card  
219,verge,2019-11-12 12:00:03,Heres what time every episode of The Mandalorian and other Disney shows go live  
220,verge,2019-11-12 11:19:59,Sonic the Hedgehog returns with bigger eyes and fewer teeth in new trailer  
221,verge,2019-11-12 11:00:07,Filter Bubble author Eli Pariser on why we need publicly owned social networks  
222,verge,2019-11-12 10:00:06,Snap Spectacles 3 review Life In Depth   
223,verge,2019-11-12 09:54:05,Instagram is testing a new video editing tool that sounds a lot like TikTok  
224,verge,2019-11-12 09:12:29,Star Wars episodes IVII are available in 4K HDR on Disney  
225,verge,2019-11-12 08:10:01,Apple pulls app that let you stalk people you follow on Instagram  
226,verge,2019-11-12 08:03:01,Google plans to give slow websites a new badge of shame in Chrome  
227,verge,2019-11-12 08:01:04,Were not embarrassed by the fact that we have big blockbusters Disney exec says addressing Martin Scorseses c 
228,verge,2019-11-12 08:01:03,Disney doesnt have plans to bring liveaction SpiderMan movies to Disney  
229,verge,2019-11-12 08:01:02,How important will Marvels Disney shows be in understanding the Cinematic Universe  
230,verge,2019-11-12 08:01:02,Disney wont share ratings for original Disney titles despite industry push to do so  
231,verge,2019-11-12 07:36:01,Queer Eyes Bobby Berk on designing for Japanese homes TikTok and the new iPhones  
232,verge,2019-11-12 07:30:02,Google may be secretly gathering millions of personal health records with alleged Project Nightingale 
233,verge,2019-11-12 06:04:01,WeWork reportedly wants to hire TMobiles brash CEO John Legere as its new boss  
234,verge,2019-11-12 05:54:01,Here are the holiday shipping and return policies for Apple Google Microsoft and others  
235,verge,2019-11-12 05:51:01,Designing League of Legends stunning holographic Worlds opening ceremony  
236,verge,2019-11-12 05:34:02,Amazon is opening its own grocery store in 2020  
237,verge,2019-11-12 05:05:01,Amazon Fire HD 10 2019 review you get what you pay for  
238,verge,2019-11-12 05:00:02,Dell XPS 13 2in1 review the XPS 13 to get  
239,verge,2019-11-12 03:53:01,Twitter proposes draft deepfake policies  
240,verge,2019-11-12 02:53:01,YouTube says it has no obligation to host anyones video  
241,verge,2019-11-12 02:49:54,Heres why Netflix is ditching old Roku devices DRM  
242,verge,2019-11-12 00:46:21,Disney launch lineup Every movie and TV show available to stream in the US on day one  
243,verge,2019-11-12 00:13:32,This new HyperJuice 100W GaN charger could be the charger of your dreams  
244,verge,2019-11-11 23:42:34,Apple TV Plus exec leaves two weeks after streaming service debuts to mediocre reviews  
245,verge,2019-11-11 22:15:34,Facebook will now let you turn off notification dots in its mobile app  
246,verge,2019-11-11 22:06:37,This wild NES mouse will haunt your dreams  
247,verge,2019-11-11 21:59:05,Microsoft vows to honor Californias sweeping privacy law across entire US  
248,verge,2019-11-11 21:52:40,Techs transportation companies keep bending the knee to Saudi Arabia  
249,verge,2019-11-11 20:35:10,Disney gets lastminute update will have most Marvel movies at launch  
250,verge,2019-11-11 20:09:58,Apple pulls app that let you stalk people you follow on Instagram  
251,verge,2019-11-11 20:03:28,Google plans to give slow websites a new badge of shame in Chrome  
252,verge,2019-11-11 19:36:30,Queer Eyes Bobby Berk on designing for Japanese homes TikTok and the new iPhones  
253,verge,2019-11-11 19:30:13,Google may be secretly gathering millions of personal health records with alleged Project Nightingale 
254,verge,2019-11-11 18:04:39,WeWork reportedly wants to hire TMobiles brash CEO John Legere as its new boss  
255,verge,2019-11-11 17:54:44,Here are the holiday shipping and return policies for Apple Google Microsoft and others  
256,verge,2019-11-11 17:46:01,Designing League of Legends stunning holographic Worlds opening ceremony  
257,verge,2019-11-11 17:34:51,Amazon is opening its own grocery store in 2020  
258,verge,2019-11-11 17:01:54,Amazon Fire HD 10 2019 review you get what you pay for  
259,verge,2019-11-11 17:00:10,Dell XPS 13 2in1 review the XPS 13 to get  
