,User,Date,Tweets
2288,verge,2019-10-04 22:19:33,Apple now has a free repair program if your iPhone 6S wont turn on  
2289,verge,2019-10-04 21:28:35,RT  NEW EPISODE   got leaked audio of Mark Zuckerberg in a closeddoor allstaff staff meeting at F
2290,verge,2019-10-04 21:17:18,Bose discontinues Sleepbuds due to faulty battery will offer full refund to all customers  
2291,verge,2019-10-04 20:51:24,Google finally gives Reader the respect it deserves with an actual gravestone  
2292,verge,2019-10-04 20:43:07,Apple CEO Tim Cook slams Facebooks Libra cryptocurrency as a power grab  
2293,verge,2019-10-04 20:30:07,Square Enixs Avengers game looks like Destiny with superheroes  
2294,verge,2019-10-04 20:03:34,Breaking PayPal withdraws support for Facebooks Libra cryptocurrency  
2295,verge,2019-10-04 19:53:12,Ninja left Twitch because his brand was too big for gaming  
2296,verge,2019-10-04 19:30:29,RT  Update after the Sacramento workers submitted their petition the worker was rehired with back pay However Amazon has yet
2297,verge,2019-10-04 19:02:00,RT  Amazon Prime Video strangely went missing from Apples App Store on iOS and Apple TV todayBut its just a technical issu
2298,verge,2019-10-04 18:29:01,The four big US carriers want to help you get rid of passwords but youll have to wait  
2299,verge,2019-10-04 18:11:33,Tesla is being investigated for a software update meant to limit fire risk  
2300,verge,2019-10-04 17:37:08,Watch Andurils Anvil take down an offtheshelf drone in midflight  
2301,verge,2019-10-04 17:30:21,In season 3 Netflixs Big Mouth keeps improving and maturing and immaturing  
2302,verge,2019-10-04 17:26:55,Cars with hightech safety systems are still really bad at not running people over  
2303,verge,2019-10-04 16:51:58,What the heck is Windows 10X  
2304,verge,2019-10-04 16:46:29,Microsoft says Iranian hacking group targeted a 2020 US presidential candidate  
2305,verge,2019-10-04 16:46:00,The court allowed the FCC to kill net neutrality because washing machines cant make phone calls 
2306,verge,2019-10-04 16:40:52,Behind the scenes of the viral social media campaign for Fat Bear Week  
2307,verge,2019-10-04 16:11:11,Monster Hunter World is getting a truly bizarre Resident Evil crossover  
2308,verge,2019-10-04 15:33:05,Disney is reportedly banning Netflix ads across its TV networks  
2309,verge,2019-10-04 15:13:56,Reminder to the Trump administration do not talk about your plans to do crime over text messages 
2310,verge,2019-10-04 15:09:31,M Night Shyamalans secretive Apple TV Plus show is a horror story about a fake baby  
2311,verge,2019-10-04 15:00:06,ElonMusks future Starship updates could use more details on human health and survival  
2312,verge,2019-10-04 14:56:38,Red Dead Redemption 2 is coming to PC in November  
2313,verge,2019-10-04 14:45:52,Heres the best Jokercentric episode of Batman The Animated series to stream on Jokers release weekend 
2314,verge,2019-10-04 14:45:00,LAX bans Uber and Lyft from picking up passengers at the terminal  
2315,verge,2019-10-04 14:44:04,Everything from Microsofts new foldable devices to Facebooks leaked audio  
2316,verge,2019-10-04 14:01:06,Apple iPad 2019 review no competition  
2317,verge,2019-10-04 14:00:08,How an iOS developer built an alternative App Store for the iPhone  
2318,verge,2019-10-04 13:58:54,The Star Wars x Le Creuset collection features Darth Vader Dutch ovens and Porg pie birds  
2319,verge,2019-10-04 13:17:21,The Galaxy Fold fell short of Samsungs claims in folding torture test  
2320,verge,2019-10-04 12:42:25,Google finds Android zero day that can take control of Pixel and Galaxy devices  
2321,verge,2019-10-04 12:24:42,Inside CoStar the app thats feeding millennials astrological fascinations with mystical algorithms and an olds 
2322,verge,2019-10-04 12:01:04,Rising Signs  
2323,verge,2019-10-04 12:00:08,Asus ROG Phone II is powerful ambitious and ridiculous  
2324,verge,2019-10-04 11:00:04,Microsofts dualscreen phone will live or die by the apps  
2325,verge,2019-10-04 10:00:11,Mark Zuckerberg promises Facebook wont be biased against Elizabeth Warren  
2326,verge,2019-10-04 09:27:04,Is this halfprice Surface Studio clone too good to be true  
2327,verge,2019-10-04 08:56:24,Samsungs Galaxy Home Bixby speaker quietly missed another launch date  
2328,verge,2019-10-04 08:00:03,Nokia 2720 Flip review proof you cant opt out of the smartphone generation  
2329,verge,2019-10-04 07:19:01,JBL Link Bar review three devices rolled into one average soundbar  
2330,verge,2019-10-04 07:03:01,Kitty Hawk says its third electric aircraft has a 100mile range  
2331,verge,2019-10-04 06:05:01,Bird raises new funding at a 25 billion valuation thanks to longerlasting scooters  
2332,verge,2019-10-04 05:46:01,In Noah Hawleys astronaut drama Lucy in the Sky the aspect ratio is the real star and Natalie Portman and Jon Ha 
2333,verge,2019-10-04 05:20:01,HBO Max locks down exclusive access to new Sesame Street episodes  
2334,verge,2019-10-04 05:18:01,This fall anime season brings 44 new shows full of superheroes fantasy and furries  here are our picks for the e 
2335,verge,2019-10-04 05:07:00,Panos Panay stops by The Vergecast to show off the Surface Duo  
2336,verge,2019-10-04 05:00:02,The Surface Pro X and Surface Laptop 3 are upgradable but only a little  
2337,verge,2019-10-04 04:48:01,Fire TV might not get Disney as Amazon and Disney clash over ads  
2338,verge,2019-10-04 04:33:01,Microsoft doesnt think Windows is important anymore  
2339,verge,2019-10-04 04:15:01,Palmer Luckey is making attack drones now  
2340,verge,2019-10-04 03:39:01,Foxconn releases and cancels plans for a giant dome in Wisconsin  
2341,verge,2019-10-04 03:04:01,The next iPhone SE will reportedly look like an iPhone 8 but itll be as fast as the iPhone 11 
2342,verge,2019-10-04 02:50:01,Facebook can be forced to remove content internationally top EU court rules  
2343,verge,2019-10-04 02:00:05,Sony announces new ultrafast A9 II camera for 4500  
2344,verge,2019-10-04 00:39:43,Zuckerberg broadcast the event publicly for the first time following the leak of a previous QampA session Read our e 
2345,verge,2019-10-04 00:35:01,Blizzard has wanted to port Overwatch since literally the day the Switch came out  
2346,verge,2019-10-04 00:33:22,Watch Mark Zuckerbergs surprise public QampA with employees  
2347,verge,2019-10-04 00:20:14,TMobile will stop selling the OnePlus 7 Pro  
2348,verge,2019-10-03 23:31:42,We now know even more about the Pixel 4 the mostleaked phone ever  
2349,verge,2019-10-03 21:53:32,Vaping lung injury toll tops 1000 as CDC investigation continues  
2350,verge,2019-10-03 21:27:14,Rudy Giuliani was briefly kicked off Twitter for tweeting a Ukrainian officials phone number 
2351,verge,2019-10-03 21:20:03,Google Shopping gets a new design with price tracking and a personalized homepage  
2352,verge,2019-10-03 20:55:56,The Voids new Avengers VR experience lets people control new Iron Man suits  
2353,verge,2019-10-03 20:52:44,How this weeks net neutrality ruling can move the fight for an open internet forward  
2354,verge,2019-10-03 20:38:33,You can now buy a 13inch laptop with a sixcore processor  
2355,verge,2019-10-03 20:32:48,Hulu is making its menus much easier to read  
2356,verge,2019-10-03 20:30:00,iPhone 11 review the phone most people should buyCheck out the full review here  
2357,verge,2019-10-03 20:23:31,ExTinder CEO files lawsuit saying sexual assault allegations against him are defamation  
2358,verge,2019-10-03 20:10:20,Senator accuses Amazon of evading questions over labor practices  
2359,verge,2019-10-03 20:00:42,My Little Pony invades the world of Magic The Gathering  
2360,verge,2019-10-03 19:47:40,Ubers helicopter trips to JFK International Airport are now open to all customers  
2361,verge,2019-10-03 19:42:39,RT  In the second protest by parttime Amazon workers this week 60 workers in Minnesota walked off the job last night Partti
2362,verge,2019-10-03 19:12:37,RT  Ikea smart blinds review worth the wait 
2363,verge,2019-10-03 19:05:32,JBL Link Bar review three devices rolled into one average soundbar  
2364,verge,2019-10-03 19:03:11,Kitty Hawk says its third electric aircraft has a 100mile range  
2365,verge,2019-10-03 18:05:05,Bird raises new funding at a 25 billion valuation thanks to longerlasting scooters  
2366,verge,2019-10-03 17:46:09,In Noah Hawleys astronaut drama Lucy in the Sky the aspect ratio is the real star and Natalie Portman and Jon Ha 
2367,verge,2019-10-03 17:44:12,Amazon workers in Minnesota walk out in protest over parttime work  
2368,verge,2019-10-03 17:20:43,HBO Max locks down exclusive access to new Sesame Street episodes  
2369,verge,2019-10-03 17:18:26,This fall anime season brings 44 new shows full of superheroes fantasy and furries  here are our picks for the e 
2370,verge,2019-10-03 17:07:46,Panos Panay stops by The Vergecast to show off the Surface Duo  
2371,verge,2019-10-03 17:00:04,The Surface Pro X and Surface Laptop 3 are upgradable but only a little  
2372,verge,2019-10-03 16:48:54,Fire TV might not get Disney as Amazon and Disney clash over ads  
2373,verge,2019-10-03 16:33:24,Microsoft doesnt think Windows is important anymore  
2374,verge,2019-10-03 16:15:33,Palmer Luckey is making attack drones now  
2375,verge,2019-10-03 16:00:20,Instagram introduces Threads a new messaging app for your close friends  
2376,verge,2019-10-03 15:39:02,Foxconn releases and cancels plans for a giant dome in Wisconsin  
2377,verge,2019-10-03 15:04:09,The next iPhone SE will reportedly look like an iPhone 8 but itll be as fast as the iPhone 11 
2378,verge,2019-10-03 14:50:12,Facebook can be forced to remove content internationally top EU court rules  
2379,verge,2019-10-03 14:31:01,Black Microsoft Surface Headphones appear in leaked promotional video  
2380,verge,2019-10-03 14:00:06,Sony announces new ultrafast A9 II camera for 4500  
2381,verge,2019-10-03 13:59:16,RT  Heres my first look at Microsofts Surface Duo Its a foldable Android Surface phone and I got a closer look at how it wo
2382,verge,2019-10-03 12:35:56,Blizzard has wanted to port Overwatch since literally the day the Switch came out  
2383,verge,2019-10-03 12:04:56,Nickelback brings a swift end to Trump Photograph tweet  
2384,verge,2019-10-03 12:01:05,A first look at Surface Duo Microsofts foldable Android phone  
2385,verge,2019-10-03 11:05:18,Ikea smart blinds review worth the wait 
2386,verge,2019-10-03 10:00:06,Why you cant say men are trash on Facebook  
2387,verge,2019-10-03 09:35:06,Marshalls latest Major headphones add Google Assistant and a 60hour battery  
2388,verge,2019-10-03 08:13:22,LGs wireless earbuds include a UV light to keep them squeaky clean  
2389,verge,2019-10-03 07:38:01,The Surface Pro X is Microsofts answer to the iPad Pro  
2390,verge,2019-10-03 07:07:01,Laurene Powell Jobs latest charity going to dinner with Ben Affleck 
2391,verge,2019-10-03 07:06:01,Batman casts a heavy shadow over The CWs new Batwoman series  
2392,verge,2019-10-03 07:03:01,Apples noisecanceling AirPods spotted in latest iOS 13 beta  
2393,verge,2019-10-03 07:00:23,This iPad mini keyboard makes for a surprisingly great tiny laptop  
2394,verge,2019-10-03 06:44:01,Microsofts future is built on Googles code  
2395,verge,2019-10-03 06:28:01,How to preorder Microsofts new Surface hardware  
2396,verge,2019-10-03 06:18:01,Instagrams Restrict feature now lets you shadow ban your bullies  
2397,verge,2019-10-03 05:40:01,A disgraced Tor developer has resurfaced to testify against one of his accusers  
2398,verge,2019-10-03 05:26:01,Aquatic hitchhikers might have taken a ride on Hurricane Dorians floodwaters  
2399,verge,2019-10-03 05:16:01,Samsung phones now work with wireless Android Auto  
2400,verge,2019-10-03 05:11:01,Melinda Gates pledges 1 billion to promote gender equality  
2401,verge,2019-10-03 04:59:00,Microsoft Surface Earbuds first listen live transcribe your life  
2402,verge,2019-10-03 04:58:01,Ikea delays its US smart blinds again  
2403,verge,2019-10-03 04:34:01,Florida man arrested for cutting the brakes on over 100 electric scooters  
2404,verge,2019-10-03 04:00:01,Androids new Action Blocks make Google Assistant more accessible  
2405,verge,2019-10-03 03:52:02,Inside Microsofts new custom Surface processors with AMD and Qualcomm  
2406,verge,2019-10-03 03:43:01,Microsofts Surface Laptop 3 comes in two sizes and with two different processors  
2407,verge,2019-10-03 03:38:01,Microsoft Surface Neo first look the future of Windows 10X is dualscreen  
2408,verge,2019-10-03 03:34:01,Microsoft Surface Pro X and Surface Pro 7 handson Qualcomm takes on Intel  
2409,verge,2019-10-03 03:30:01,Microsoft surprised everyone with new foldable Surface Duo phone running Android 
2410,verge,2019-10-03 03:24:01,Why Justin Timberlake didnt star in The Death of Dick Long  
2411,verge,2019-10-03 03:16:01,Windows 10X has a new Start Menu and no more Live Tiles  
2412,verge,2019-10-03 03:06:01,Adobe is bringing Creative Cloud to the ARMpowered Surface Pro X starting with Fresco  
2413,verge,2019-10-03 02:04:01,Microsofts new Surface Slim Pen now has a rechargeable battery  
2414,verge,2019-10-03 02:00:03,The Italian Air Force plans to fly researchers on one of Virgin Galactics flights to space  
2415,verge,2019-10-03 01:25:01,The biggest announcements from Microsofts Surface event  
2416,verge,2019-10-03 00:55:01,Siri will soon default to the messaging apps you prefer not just iMessage  
2417,verge,2019-10-03 00:47:25,Google contractors reportedly targeted homeless people for Pixel 4 facial recognition  
2418,verge,2019-10-03 00:34:01,The Gnarbox 2 is a simple expensive way to back up SD cards  
2419,verge,2019-10-03 00:20:32,The Trump administration wants to start DNA testing immigrants  
2420,verge,2019-10-02 23:37:18,Google will teach you how to use the Pixel 4s Motion Sense gesture controls with Pokemon  
2421,verge,2019-10-02 23:02:08,How to choose between the Surface Pro X and Surface Pro 7  
2422,verge,2019-10-02 21:47:12,iPhone 11s Deep Fusion camera is available now in iOS 13 public beta  
2423,verge,2019-10-02 21:29:24,Leaked Pixel 4 marketing videos show new Assistant and Motion Sense features  
2424,verge,2019-10-02 21:08:31,Tesla sets another new delivery record thanks to the Model 3  
2425,verge,2019-10-02 20:23:03,How to autodelete your YouTube history  
2426,verge,2019-10-02 19:38:15,The Surface Pro X is Microsofts answer to the iPad Pro  
2427,verge,2019-10-02 19:27:18,Laurene Powell Jobs latest charity going to dinner with Ben Affleck 
2428,verge,2019-10-02 19:16:00,Apple Watch Series 5 review the best smartwatch 
2429,verge,2019-10-02 19:06:44,RT  Microsofts browser is based on Google tech Now Microsofts mobile OS is Googles Android with Googles services It is a w
2430,verge,2019-10-02 19:06:22,Batman casts a heavy shadow over The CWs new Batwoman series  
2431,verge,2019-10-02 19:03:03,Apples noisecanceling AirPods spotted in latest iOS 13 beta  
2432,verge,2019-10-02 18:52:36,RT  Microsoft daySurface Neo Surface Pro X amp 7 Surface Laptop 3 
2433,verge,2019-10-02 18:44:28,Microsofts future is built on Googles code  
2434,verge,2019-10-02 18:31:34,RT  Theres a good way and a bad way to design true wireless earbuds and Microsoft chose to do them the bad way 
2435,verge,2019-10-02 18:28:37,How to preorder Microsofts new Surface hardware  
2436,verge,2019-10-02 18:18:37,Instagrams Restrict feature now lets you shadow ban your bullies  
2437,verge,2019-10-02 18:05:03,RT  Pokmon Lets Go Eevee for the Nintendo Switch is currently 2999 at Amazon The game usually costs closer to 5999 so
2438,verge,2019-10-02 17:40:38,A disgraced Tor developer has resurfaced to testify against one of his accusers  
2439,verge,2019-10-02 17:21:21,Aquatic hitchhikers might have taken a ride on Hurricane Dorians floodwaters  
2440,verge,2019-10-02 17:16:18,Samsung phones now work with wireless Android Auto  
2441,verge,2019-10-02 17:11:04,Melinda Gates pledges 1 billion to promote gender equality  
2442,verge,2019-10-02 16:59:53,Microsoft Surface Earbuds first listen live transcribe your life  
2443,verge,2019-10-02 16:58:14,Ikea delays its US smart blinds again  
2444,verge,2019-10-02 16:37:54,Florida man arrested for cutting the brakes on over 100 electric scooters  
2445,verge,2019-10-02 16:01:06,Androids new Action Blocks make Google Assistant more accessible  
2446,verge,2019-10-02 15:30:25,Surface Neo first look Microsofts dualscreen prototype 
2447,verge,2019-10-02 15:30:05,Inside Microsofts new custom Surface processors with AMD and Qualcomm  
2448,verge,2019-10-02 15:30:05,Microsoft Surface Neo first look the future of Windows 10X is dualscreen  
2449,verge,2019-10-02 15:30:05,Microsofts Surface Laptop 3 comes in two sizes and with two different processors  
2450,verge,2019-10-02 15:30:03,Microsoft Surface Pro X and Surface Pro 7 handson Qualcomm takes on Intel  
2451,verge,2019-10-02 15:28:13,Microsoft surprises with new Surface Duo phone  
2452,verge,2019-10-02 15:23:15,Why Justin Timberlake didnt star in The Death of Dick Long  
2453,verge,2019-10-02 15:16:33,Windows 10X has a new Start Menu and no more Live Tiles  
2454,verge,2019-10-02 15:07:56,Microsoft announces dualscreen Surface Neo coming next holiday  
2455,verge,2019-10-02 15:06:14,Adobe is bringing Creative Cloud to the ARMpowered Surface Pro X starting with Fresco  
2456,verge,2019-10-02 15:05:23,RT  Well you cant say the Surface Earbuds look anything like AirPods This design is going to be divisive But Microsoft
2457,verge,2019-10-02 15:00:03,Lyft introduces a rewards program for drivers  
2458,verge,2019-10-02 14:52:04,Microsofts new Surface Slim Pen now has a rechargeable battery  
2459,verge,2019-10-02 14:44:01,Microsoft announces ARMpowered Surface Pro X  
2460,verge,2019-10-02 14:36:03,The new Surface Earbuds are Microsofts first truly wireless earbuds  
2461,verge,2019-10-02 14:27:21,Microsoft announces Surface Pro 7 with longawaited USBC port  
2462,verge,2019-10-02 14:15:26,The biggest announcements live from Microsofts Surface event  
2463,verge,2019-10-02 14:14:04,Microsoft announces Surface Laptop 3 with a new 15inch model and USBC  
2464,verge,2019-10-02 14:00:27,Microsofts Surface event is starting now Follow along with us live to hear all the latest Surface and Windows new 
2465,verge,2019-10-02 14:00:03,The Italian Air Force plans to fly researchers on one of Virgin Galactics flights to space  
2466,verge,2019-10-02 13:31:13,RT  Update Twitter says it will respond to Kamala Harriss request to suspend Trumps account 
2467,verge,2019-10-02 13:23:52, Microsoft Surface Event 2019
2468,verge,2019-10-02 13:22:30,Live from Microsofts Surface hardware event  
2469,verge,2019-10-02 13:16:06,RT  For a limited time new subscribers to Xbox Game Pass Ultimate can get six months of Spotify Premium for free Youll need
2470,verge,2019-10-02 13:13:28,Kamala Harris asks Twitter to suspend Donald Trump for civil war and whistleblower tweets  
2471,verge,2019-10-02 13:06:20,RT  Microsofts big Surface event starts at 10AM ET  7AM PT  3PM UK today Well be live blogging the whole thing and heres h
2472,verge,2019-10-02 12:55:12,Siri will soon default to the messaging apps you prefer not just iMessage  
2473,verge,2019-10-02 12:34:47,The Gnarbox 2 is a simple expensive way to back up SD cards  
2474,verge,2019-10-02 11:45:44,How to watch Microsofts 2019 Surface event 
2475,verge,2019-10-02 11:30:04,Amazon is flooding the hardware gaps between Apple Microsoft and Google  
2476,verge,2019-10-02 11:00:04,Get ready for foldable and dualscreen Windows devices  
2477,verge,2019-10-02 10:41:33,Twitter and TweetDeck are both a little broken right now  
2478,verge,2019-10-02 10:00:06,Google announces three new ways to hide your personal activity from Google  
2479,verge,2019-10-02 10:00:06,Google is making it easier to check if your passwords have been compromised in a data breach  
2480,verge,2019-10-02 06:16:01,Apple Arcade is a home for premium games that lost their place on mobile  
2481,verge,2019-10-02 05:59:01,Why the Marvel Cinematic Universe doesnt care about secret identities  
2482,verge,2019-10-02 05:25:01,Twitter now lets anyone on iOS search DMs for long lost message threads  
2483,verge,2019-10-02 05:02:01,The iPhone 11s Deep Fusion camera tech is now in the iOS 13 developer betas  heres how it works 
2484,verge,2019-10-02 05:00:02,Skydio 2 the selfflying future of drones starts at 999 
2485,verge,2019-10-02 04:58:01,Transparents musical finale lays out the series intent and its legacy as a daring series that explores gender and 
2486,verge,2019-10-02 04:32:01,Former Yahoo engineer pleads guilty to searching 6000 user accounts for nudes  
2487,verge,2019-10-02 04:26:01,Harley Quinn enjoys a Jokerfree life in the first trailer for Birds of Prey a standalone DC Comics film that brin 
2488,verge,2019-10-02 04:20:01,The FCC can repeal net neutrality but it cant  block state laws says court  
2489,verge,2019-10-02 04:15:01,tvOS 13s small improvements make for a much better Apple TV experience  
2490,verge,2019-10-02 04:09:01,Pandora overhauls mobile app to focus on hyperpersonalization  
2491,verge,2019-10-02 04:01:01,Navigating Bill Gates brain with Netflix filmmaker Davis Guggenheim  
2492,verge,2019-10-02 03:42:01,TiVos Edge DVR arrives with support for Dolby Vision and Atmos  
2493,verge,2019-10-02 02:20:07,Elizabeth Warren says Facebook has repeatedly fumbled its responsibility to democracy  
2494,verge,2019-10-02 02:11:01,Xbox Game Pass Ultimate now comes with six months of Spotify Premium  
2495,verge,2019-10-02 02:01:01,Startup that aims to 3Dprint rockets says its fully funded for its first commercial missions 
2496,verge,2019-10-02 01:25:01,GoPros Hero 8 Black has new Mod accessories made for vloggers  
2497,verge,2019-10-02 01:20:01,Sony cuts PlayStation Now price to 999 a month adds GTA V and God of War  
2498,verge,2019-10-02 01:15:04,The GoPro Max is a reboot of the companys attempts at a spherical camera  
2499,verge,2019-10-02 01:13:02,Its about to get a lot easier to repair old appliances in the EU  
2500,verge,2019-10-02 01:10:01,GoPros new Hero 8 Black does more of the work for you  
2501,verge,2019-10-02 01:05:01,Adobes Character Animator is getting keyframes to give artists more control  
2502,verge,2019-10-02 01:00:05,GoPro Hero 8 Black review smooth operator  
2503,verge,2019-10-02 00:01:01,In leaked audio Mark Zuckerberg rallies Facebook against critics competitors and Elizabeth Warren 
2504,verge,2019-10-01 23:30:17,How to pair a PS4 or Xbox controller with your iPhone iPad Apple TV or Android device  
2505,verge,2019-10-01 23:18:36,The latest Pixel 4 leak is an app that automatically transcribes your voice memos  
2506,verge,2019-10-01 23:03:02,WhatsApp tests selfdestructing messages  
2507,verge,2019-10-01 23:00:09,Why Microsoft has to bet big on an ARMbased Surface  
2508,verge,2019-10-01 22:48:21,Kanye Wests Yandhi ringtones appear to be a scam and theyre now gone  
2509,verge,2019-10-01 22:18:01,Ikeas inexpensive Sonos remote control is worth every penny  
2510,verge,2019-10-01 22:00:07,How the spread of child abuse imagery online is changing the debate over encryption  
2511,verge,2019-10-01 21:10:02,Do 64megapixel phone cameras really make a difference  
2512,verge,2019-10-01 20:38:11,Logitechs new mechanical keyboard lets you swap its switches as easily as keycaps  
2513,verge,2019-10-01 20:33:54,RT  UPS won FAA approval to make a delivery drone network Pretty cool  but right now its only limited to hospital campuses
2514,verge,2019-10-01 20:01:44,Pokmons saddest creature Mimikyu finally gets its due  
2515,verge,2019-10-01 19:45:12,To learn more about the leaked Facebook audio and to keep up with all of the updates surrounding it subscribe to 
2516,verge,2019-10-01 19:27:08,UPS just won FAA approval to fly as many delivery drones as it wants  
2517,verge,2019-10-01 19:19:04,RT  You should readlisten to  exclusive on Zuckerberg But also you should check out how awesome  made i
2518,verge,2019-10-01 19:05:32,TwitchCon was a reminder that streamers are big business  
2519,verge,2019-10-01 18:16:41,Apple Arcade is a home for premium games that lost their place on mobile  
2520,verge,2019-10-01 17:59:13,Why the Marvel Cinematic Universe doesnt care about secret identities  
2521,verge,2019-10-01 17:25:56,Twitter now lets anyone on iOS search DMs for long lost message threads  
2522,verge,2019-10-01 17:16:06,RT  This is a terrific piece  looks back on the history and impact of Amazon Studios TRANSPARENT how it evolved fr
2523,verge,2019-10-01 17:02:20,The iPhone 11s Deep Fusion camera tech is now in the iOS 13 developer betas  heres how it works by  
2524,verge,2019-10-01 17:00:11,Skydio 2 the selfflying future of drones starts at 999 
2525,verge,2019-10-01 16:58:25,Transparents musical finale lays out the series intent and its legacy as a daring series that explores gender and 
2526,verge,2019-10-01 16:32:33,Former Yahoo engineer pleads guilty to searching 6000 user accounts for nudes  
2527,verge,2019-10-01 16:25:29,Harley Quinn enjoys a Jokerfree life in the first trailer for Birds of Prey a standalone DC Comics film that brin 
2528,verge,2019-10-01 16:20:44,The FCC can repeal net neutrality but it cant  block state laws says court  
2529,verge,2019-10-01 16:15:05,tvOS 13s small improvements make for a much better Apple TV experience  
2530,verge,2019-10-01 16:09:36,Pandora overhauls mobile app to focus on hyperpersonalization  
2531,verge,2019-10-01 16:01:07,Navigating Bill Gates brain with Netflix filmmaker Davis Guggenheim  
2532,verge,2019-10-01 15:47:17,TiVos Edge DVR arrives with support for Dolby Vision and Atmos  
2533,verge,2019-10-01 15:35:21,RT  San Francisco if you enjoyed  big Facebook scoop today come see him LIVE in conversation with  o
2534,verge,2019-10-01 15:16:00,Zuckerberg on refusing to testify before other governments 
