,User,Date,Tweets
774,verge,2019-11-01 19:51:22,Apple TV Plus launched today with original series including The Morning Show See and Dickinson Wondering which o 
775,verge,2019-11-01 19:50:32,Hearthstone is the latest game to add an auto chess mode  
776,verge,2019-11-01 19:49:26,Satellites track realtime damage of ocean blob menacing Hawaii  
777,verge,2019-11-01 19:17:35,Blizzard announces Overwatch 2  
778,verge,2019-11-01 18:52:12,A critical analysis of scroll bars throughout history  
779,verge,2019-11-01 18:31:32,Ubers lawsuit challenging NYCs cap on new vehicles is dismissed  
780,verge,2019-11-01 18:15:15,Diablo IV announced at Blizzcon 2019  
781,verge,2019-11-01 18:14:58,NBCUniversal reportedly considering making its Peacock streaming service totally free  
782,verge,2019-11-01 18:12:12,Blizzard says we failed in our purpose after Hearthstone Hong Kong controversy  
783,verge,2019-11-01 18:02:26,WeWork could be forming a gaming division  
784,verge,2019-11-01 17:57:56,  and  met with Instagrams  and Google Pixels Isaac Reynolds to discuss 
785,verge,2019-11-01 17:31:36,Amazon and Nintendo may have struck a deal to kick off retro game sellers  
786,verge,2019-11-01 17:25:57,Facebook reportedly was in talks to buy Fitbit before Google was  
787,verge,2019-11-01 16:49:15,Google says it talked to wedding photographers to figure out how to build its face retouching feature 
788,verge,2019-11-01 16:28:18,Savings app Digit can now help you pay off your student loans  
789,verge,2019-11-01 16:14:15,US launches national security review of TikTok Reuters reports  
790,verge,2019-11-01 15:47:01,iPhones are getting thousands of new fonts from Adobe  
791,verge,2019-11-01 15:42:14,For better and worse Terminator Dark Fate is a throwback for the franchise  
792,verge,2019-11-01 15:29:36,Autonomous flying taxi startup Ehang files 100 million initial public offering  
793,verge,2019-11-01 15:18:19,Dont cancel your Apple TV Plus trial until its almost over  
794,verge,2019-11-01 15:06:40,iRobots highend Roomba i7 and i7 vacuums are up to 200 off for Verge readers  
795,verge,2019-11-01 15:01:08,Apple TV Plus is basically free because Apples end game is replicating Amazon Prime  
796,verge,2019-11-01 14:59:59,You can get a new Apple TV 4K for 90 right now  
797,verge,2019-11-01 14:52:05,Googles autotranscribing Recorder app will come to older Pixel devices  
798,verge,2019-11-01 14:04:14,A classic Mary Tyler Moore Show episode available on Hulu mirrors Apple TV Plus Morning Show series with a simi 
799,verge,2019-11-01 14:01:12,How I made the yawning face and waffle emoji  
800,verge,2019-11-01 13:45:38,How to watch Apple TV Plus  
801,verge,2019-11-01 13:12:32,AirPods Pro review the perfect earbuds for the iPhone 
802,verge,2019-11-01 13:02:46,Breaking Google buys Fitbit for 21 billion  
803,verge,2019-11-01 13:01:09,Apple AirPods Pro review perfect fit  
804,verge,2019-11-01 13:01:07,How Google and Instagram think about the future of photos  
805,verge,2019-11-01 13:01:04,YouTubers are clashing over eye shadow and millions of dollars are at stake  
806,verge,2019-11-01 12:00:26,See is a funny TV show but not on purpose  
807,verge,2019-11-01 12:00:16,The Morning Show explores abuses of power but not really  
808,verge,2019-11-01 12:00:07,Dickinson is the wildest weirdest and most earnest show on Apple TV Plus  
809,verge,2019-11-01 10:01:07,Why a top content moderation company quit the business instead of fixing its problems  
810,verge,2019-11-01 09:24:35,GSync support is coming to LGs 2019 OLED TVs starting this week  
811,verge,2019-11-01 07:02:08,Death Stranding is a long bizarre journey thats both breathtaking and boring  
812,verge,2019-11-01 06:39:01,Luigis Mansion 3 is perfectly silly slapstick comedy  
813,verge,2019-11-01 05:30:01,Facebooks political ad ban created a disaster in Washington state  
814,verge,2019-11-01 05:17:01,Heres when Black Friday deals start at Amazon Best Buy Walmart and more  
815,verge,2019-11-01 05:08:01,iOS 13 is killing background apps more frequently iPhone owners report  
816,verge,2019-11-01 04:52:00,The Loupedeck Creative Tool is a physical control deck for creative apps  
817,verge,2019-11-01 04:26:01,Disaster capitalism piles on top of California blazes and power outages  
818,verge,2019-11-01 04:16:01,New trailer for Netflixs Witcher confirms December 20th release date  
819,verge,2019-11-01 03:57:01,Cortana gets a male voice and Outlook for iOS integration in leaked video  
820,verge,2019-11-01 03:27:01,WhatsApps fingerprint unlock feature is now on Android  
821,verge,2019-11-01 03:21:23,Were live on stage talking photos with Instagrams  and Google Pixels Isaac Reynolds Subscribe to The Ve 
822,verge,2019-11-01 02:55:01,YouTubers raise 10 million for tree charity  and bring in tens of millions of views  
823,verge,2019-11-01 02:46:01,Do Apple TV Plus shows have to be good to succeed  
824,verge,2019-11-01 02:38:01,The Moon Channel a short horror game about smart home gadgets  
825,verge,2019-11-01 02:31:01,The best anime of 2019 an ongoing list 
826,verge,2019-11-01 02:00:03,Xbox Elite 2 controller review Microsofts best Xbox controller just got better  
827,verge,2019-11-01 01:30:02,How LoveSync went from sex tech to viral joke  
828,verge,2019-11-01 01:13:01,Walmart is reportedly looking to sell its Vudu streaming service  
829,verge,2019-11-01 00:10:42,Netflix plans to release its first scripted podcast  
830,verge,2019-11-01 00:00:08,Inside Hot Ones the wildly popular and violently spicy YouTube show  
831,verge,2019-10-31 23:49:23,Trump abandons plan to freeze fuel efficiency standards of cars  
832,verge,2019-10-31 23:21:01,Use this script if youre tired of taking Medium posts too seriously  
833,verge,2019-10-31 22:47:26,Huaweis next tablet might look like an iPad Pro  
834,verge,2019-10-31 22:23:44,Update There are now ten 10 leaked images of Motorolas foldingscreen RAZR 
835,verge,2019-10-31 21:28:43,Twitters political ad ban raises one big issue what exactly is an issue  
836,verge,2019-10-31 21:12:07,Xiaomi mimics the Apple Watch with its first smartwatch  
837,verge,2019-10-31 20:58:17,Do yourself a favor and listen to RL Grimes annual Halloween mix  
838,verge,2019-10-31 20:40:16,RT  If youre having a tough time finding AirPods Pro in stock or dont have an Apple Store in your neighborhood Best Buy has
839,verge,2019-10-31 20:35:49, The Phoenix and Tampa sites will both close after March 1st Facebook told us in a statement Cogniza 
840,verge,2019-10-31 20:31:49,How to enable RCS chat in the Google Messages app on Android  
841,verge,2019-10-31 20:31:27, A followup report in June focused on a site in Tampa FL where moderators described a pattern of mis 
842,verge,2019-10-31 20:30:00,iPhone 11 Pro and 11 Pro Max review the BEST camera on a phone 
843,verge,2019-10-31 20:26:55, In February we reported the working conditions at the companys site in Phoenix Moderators at the si 
844,verge,2019-10-31 20:22:38,The professional services firm Cognizant will exit the content moderation business after two Verge investigations b 
845,verge,2019-10-31 19:39:53,RT  Twitter wants to ban all political advertising Well Facebook did that in Washington state and it was a complete disast
846,verge,2019-10-31 18:33:40,RT  Heres when Black Friday deals start at Amazon Best Buy Walmart and more  
847,verge,2019-10-31 18:22:29,RT  I made a short Halloween text game about running a smart home surveillance operation in an apartment complex built by a
848,verge,2019-10-31 18:09:58,Luigis Mansion 3 is perfectly silly slapstick comedy  
849,verge,2019-10-31 17:30:36,Facebooks political ad ban created a disaster in Washington state  
850,verge,2019-10-31 17:17:21,Heres when Black Friday deals start at Amazon Best Buy Walmart and more  
851,verge,2019-10-31 17:08:26,iOS 13 is killing background apps more frequently iPhone owners report  
852,verge,2019-10-31 16:52:08,The Loupedeck Creative Tool is a physical control deck for creative apps  
853,verge,2019-10-31 16:26:37,Disaster capitalism piles on top of California blazes and power outages  
854,verge,2019-10-31 16:11:58,New trailer for Netflixs Witcher confirms December 20th release date  
855,verge,2019-10-31 15:57:53,Cortana gets a male voice and Outlook for iOS integration in leaked video  
856,verge,2019-10-31 15:27:53,WhatsApps fingerprint unlock feature is now on Android  
857,verge,2019-10-31 15:06:01,Here are the best deals from Sams Clubs upcoming oneday sale  
858,verge,2019-10-31 14:55:30,YouTubers raise 10 million for tree charity  and bring in tens of millions of views  
859,verge,2019-10-31 14:38:40,The Moon Channel a short horror game about smart home gadgets  
860,verge,2019-10-31 14:35:06,Do Apple TV Plus shows have to be good to succeed  
861,verge,2019-10-31 14:31:36,The best anime of 2019 an ongoing list 
862,verge,2019-10-31 14:27:27,Motorolas foldable RAZR phone appears in leaked image  
863,verge,2019-10-31 14:13:13,RT  i talked to  about hot ones the show is very good and it just might be the future of late night tv 
864,verge,2019-10-31 14:00:25,Xbox Elite 2 controller review Microsofts best Xbox controller just got better  
865,verge,2019-10-31 13:45:17,Grubhubs new strategy is to be an even worse partner to restaurants via  
866,verge,2019-10-31 13:30:04,How LoveSync went from sex tech to viral joke  
867,verge,2019-10-31 13:25:30,RT  I get that everyone wants the AirPods to be as sleek and slim as possible but its still a shame to see Apple selling such e
868,verge,2019-10-31 13:13:08,Walmart is reportedly looking to sell its Vudu streaming service  
869,verge,2019-10-31 12:00:05,Inside Hot Ones the wildly popular and violently spicy YouTube show  
870,verge,2019-10-31 11:28:55,Use this script if youre tired of taking Medium posts too seriously  
871,verge,2019-10-31 10:00:14,Its harder to ban political ads on Twitter than it sounds  
872,verge,2019-10-31 10:00:05,The Verge Guide to the Apple Watch  
873,verge,2019-10-31 09:48:28,AirPods Pro teardown confirms that theyre just as disposable as ever  
874,verge,2019-10-31 07:38:01,Founder of SoftBankbacked car leasing startup resigns after layoffs  
875,verge,2019-10-31 07:20:02,Nintendos Switch Lite helps boost hardware sales by more than 50 percent  
876,verge,2019-10-31 07:15:01,Hackers hijacked the capitals surveillance cameras days before Trumps inauguration and said it was easy 
877,verge,2019-10-31 07:01:01,Apples Mac Pro clears FCC hinting at imminent launch  
878,verge,2019-10-31 06:38:01,ATampT updates its unlimited plans again now with more data and less free TV  
879,verge,2019-10-31 06:29:01,A former SVP at Juul is suing the company for shipping 1 million contaminated pods  
880,verge,2019-10-31 06:29:01,Apex Legends is launching a duos game mode for the first time  
881,verge,2019-10-31 06:00:02,DeepMinds StarCraft 2 AI is now better than 998 percent of all human players  
882,verge,2019-10-31 05:57:01,Update your iPhone 5 before November 3rd to keep email web and GPS working  
883,verge,2019-10-31 05:12:01,Samsungs newest rugged tablet is available now in the US starting at 59999  
884,verge,2019-10-31 04:46:01,SiriusXM is coming to Google Assistant smart speakers and displays  
885,verge,2019-10-31 04:24:01,Heres whos eligible for free HBO Max  
886,verge,2019-10-31 04:11:01,What DC Comics needs to learn from Jokers success  and how the film echoes back to DCs glory days as the company 
887,verge,2019-10-31 03:54:01,Apple TV Plus is now bundled with Apple Music student plans  
888,verge,2019-10-31 02:56:01,Sonos launches tradeup program for its oldest products  
889,verge,2019-10-31 02:48:01,Xbox Game Streaming handson turn your Xbox into a game streaming server  
890,verge,2019-10-31 02:26:02,Daylight saving time is hot garbage 
891,verge,2019-10-31 02:21:36,Strong Galaxy Note 10 sales help stem falling Samsung profits  
892,verge,2019-10-31 02:00:06,LG G8X Dual Screen review better than you might ThinQ  
893,verge,2019-10-31 01:30:02,Samsung Galaxy Fold rereview here we go again  
894,verge,2019-10-31 01:16:01,Faraday Futures still haunted by the past of its billionaire founder  
895,verge,2019-10-31 01:16:01,Linksys announces WiFi 6 Velop mesh router starting at 399  
896,verge,2019-10-31 01:00:03,The Mavic Mini is DJIs first drone that doesnt need FAA registration  
897,verge,2019-10-30 23:55:20,US Interior Department is grounding its drone fleet due to risks of Chinese spying  
898,verge,2019-10-30 23:45:01,Apples 5G iPhones will reportedly be powered by its first 5nanometer chips  
899,verge,2019-10-30 23:38:33,A Facebook content moderation vendor is quitting the business after two Verge investigations  
900,verge,2019-10-30 23:06:01,Spotify launches a dedicated Kids app with curated playlists and playful art  
901,verge,2019-10-30 23:00:11,How to find your Apple Watch  
902,verge,2019-10-30 22:55:11,It might be safe to update your Apple HomePod now  
903,verge,2019-10-30 22:30:06,Steams redesigned library is out now for everyone  
904,verge,2019-10-30 22:23:48,Trump campaign says Twitter ad block will silence conservatives  
905,verge,2019-10-30 22:00:08,Hate speech is spreading on Facebook in India again  
906,verge,2019-10-30 21:59:00,Apple will soon let you tack an iPhone onto your monthly Apple Card bill  
907,verge,2019-10-30 21:47:17,Biden campaign applauds Twitters political ad ban  
908,verge,2019-10-30 21:35:54,Text editor releases Free Uyghur edition gets swamped with Chinese spam  
909,verge,2019-10-30 20:56:53,Slow iPhone sales didnt stop Apple from its best Q4 revenue ever  
910,verge,2019-10-30 20:54:48,Lyft is still losing a ton of money but it claims profit is within reach  
911,verge,2019-10-30 20:43:14,Facebook keeps getting bigger as it fights off checks on its power  
912,verge,2019-10-30 20:42:36,Mixer lowers its subscription price to better compete with Twitch  
913,verge,2019-10-30 20:20:37,RT  Samsungs 65inch Q60 QLED 4K TV is 997 at Amazon which is the lowest price that weve seen so far If youre looking for
914,verge,2019-10-30 20:06:11,Breaking Twitter will ban all political advertising starting in November  
915,verge,2019-10-30 19:32:00,Founder of SoftBankbacked car leasing startup resigns after layoffs  
916,verge,2019-10-30 19:14:29,Hackers hijacked the capitals surveillance cameras days before Trumps inauguration and said it was easy 
917,verge,2019-10-30 18:57:31,Apples Mac Pro clears FCC hinting at imminent launch  
918,verge,2019-10-30 18:37:45,ATampT updates its unlimited plans again now with more data and less free TV  
919,verge,2019-10-30 18:32:40,A former SVP at Juul is suing the company for shipping 1 million contaminated pods  
920,verge,2019-10-30 18:29:13,Apex Legends is launching a duos game mode for the first time  
921,verge,2019-10-30 18:00:06,DeepMinds StarCraft 2 AI is now better than 998 percent of all human players  
922,verge,2019-10-30 17:29:35,Update your iPhone 5 before November 3rd to keep email web and GPS working  
923,verge,2019-10-30 17:16:20,Outlook for iOS is getting iPad Split View Do Not Disturb and smart folders  
924,verge,2019-10-30 17:00:04,Samsungs newest rugged tablet is available now in the US starting at 59999  
925,verge,2019-10-30 16:51:29,SiriusXM is coming to Google Assistant smart speakers and displays  
926,verge,2019-10-30 16:24:40,What DC Comics needs to learn from Jokers success  and how the film echoes back to DCs glory days as the company 
927,verge,2019-10-30 16:19:01,Heres whos eligible for free HBO Max  
928,verge,2019-10-30 16:13:17,Faraday Future has a new CEO Carsten Breitfeld who hopes to put Faraday Future back on track But if he cant con 
929,verge,2019-10-30 16:09:04,One way of turning the company around might be bankruptcy But that may change Jias immigration status who came t 
930,verge,2019-10-30 15:54:16,Apple TV Plus is now bundled with Apple Music student plans  
931,verge,2019-10-30 15:50:46,A savior investor wanted Jia gone in exchange for new funds in 2018 but Jia stayed causing Faraday Future to lose 
932,verge,2019-10-30 15:46:03,Faraday Futures founder Jia Yueting burned through 900 million of his own money until the company was just mont 
933,verge,2019-10-30 15:40:04,In 2017 Faraday Future made a big splash at CES with its luxury SUV But the car still hasnt gone into production 
934,verge,2019-10-30 15:34:07,Faraday Future the hyped EV startup raised eyebrows in 2014 by stealing talent from Silicon Valley and Detroit 
935,verge,2019-10-30 14:56:38,Sonos launches tradeup program for its oldest products  
936,verge,2019-10-30 14:50:14,RT  i reviewed the LG G8X it is absolutely not the best phone in the world but it absolutely is the best phone for watchin
937,verge,2019-10-30 14:48:26,Xbox Game Streaming handson turn your Xbox into a game streaming server  
938,verge,2019-10-30 14:00:14,LG G8X Dual Screen review better than you might ThinQ  
939,verge,2019-10-30 13:53:00,Daylight saving time is hot garbage 
940,verge,2019-10-30 13:30:04,Samsung Galaxy Fold rereview here we go again  
941,verge,2019-10-30 13:21:52,Linksys announces WiFi 6 Velop mesh router starting at 399  
942,verge,2019-10-30 13:00:46,Faraday Futures still haunted by the past of its billionaire founder  
943,verge,2019-10-30 13:00:29,The Mavic Mini is DJIs first drone that doesnt need FAA registration  
944,verge,2019-10-30 11:06:41,Apples 5G iPhones will reportedly be powered by its first 5nanometer chips  
945,verge,2019-10-30 11:00:06,Spotify launches a dedicated Kids app with curated playlists and playful art  
946,verge,2019-10-30 11:00:05,How to find your Apple Watch  
947,verge,2019-10-30 10:00:04,Hate speech is spreading on Facebook in India again  
948,verge,2019-10-30 09:04:55,Snapchat now lets you 3D Paint faces and pretty much anything else  
949,verge,2019-10-30 07:47:01,WhatsApp is suing an infamous spyware vendor for allegedly hacking its users  
950,verge,2019-10-30 07:29:01,HBO cancels its first planned Game of Thrones spinoff  
951,verge,2019-10-30 07:22:00,Xbox One testers can now stream any game to an Android phone  
952,verge,2019-10-30 06:55:48,The PS4 has outsold the original PlayStation and the Wii  
953,verge,2019-10-30 06:39:01,Amazon adds new wakeup lighting and sleep timer features for Alexapowered smart lights  
954,verge,2019-10-30 06:21:01,Uber Lyft and DoorDash kick off 90 million fight against Californias gig worker law  
955,verge,2019-10-30 06:16:01,Sony is shutting down its live TV service PlayStation Vue in January 2020  
956,verge,2019-10-30 06:09:01,Call of Dutys citybased league kicks off in January  
957,verge,2019-10-30 06:01:01,Samsungs new Galaxy Book Flex and Ion laptops bring better designs to the lineup  
958,verge,2019-10-30 05:51:01,watchOS 61 now available with Series 1 Series 2 and AirPods Pro support  
959,verge,2019-10-30 05:50:01,Porsche trials online sales that still require a trip to the dealer  
960,verge,2019-10-30 05:46:01,Afterparty is a hilarious exploration of the afterlife and binge drinking  
961,verge,2019-10-30 05:39:00,Heres how Apples new AirPods Pro stack up with other truly wireless earbuds  
962,verge,2019-10-30 04:58:01,YouTube Music gets Siri and desktop web app support  
963,verge,2019-10-30 04:52:01,Razers Junglecat brings Nintendo Switchlike snapon controllers to Android  
964,verge,2019-10-30 04:42:01,Uber sues Los Angeles as the fight over scooter data escalates  
965,verge,2019-10-30 04:32:01,The California fires show how unprepared we are for climate change  
966,verge,2019-10-30 04:13:01,Amber Baldet on what blockchain technology can do for us beyond cryptocurrency  
967,verge,2019-10-30 03:37:01,LGs G8X ThinQ is coming to ATampT on November 1st  
968,verge,2019-10-30 03:00:02,Razers first truly wireless earbuds aim to fix gaming audio lag on Android  
969,verge,2019-10-30 02:59:01,How to enable LTE cellular service on your Apple Watch  
970,verge,2019-10-30 02:54:01,In season 6 BoJack Horseman is still its own harshest most relentlessly selfexamining critic 
971,verge,2019-10-30 02:46:01,EA games are returning to Steam along with the EA Access subscription service  
972,verge,2019-10-30 02:32:01,Netflix wants to let people watch things at twice the speed but Hollywood is pushing back  
973,verge,2019-10-30 02:16:01,Hellvetica is a horrific take on the famous typeface  
974,verge,2019-10-30 02:02:01,Googles new shortcuts are coming to other websites and youll be able to register your own 
975,verge,2019-10-30 01:49:01,Lyft simplifies its subscription service with the 20amonth Lyft Pink  
976,verge,2019-10-30 01:33:01,Amazon Echo 2019 review middle child syndrome  
977,verge,2019-10-30 01:16:01,Amazon Echo Buds review great sound at the right price  
978,verge,2019-10-30 01:02:01,Logitechs MX Master 3 scroll wheel is focused hardware at its best  
979,verge,2019-10-30 01:01:48,Update Elon Musk appears to have donated the 1 million according to the TeamTrees leaderboard 
980,verge,2019-10-30 00:52:01,Nvidia unveils new Super variants for GTX 1660 and GTX 1650 graphics cards  
981,verge,2019-10-30 00:42:49,Blizzard lost a big sponsor after the Hong Kong outcry Mitsubishi  
982,verge,2019-10-30 00:36:51,Heres what HBO Max looks like  
983,verge,2019-10-30 00:36:01,The worlds first poop database needs your help  
984,verge,2019-10-30 00:16:01,Hellblade studio launches a new venture to explore mental health through games  
985,verge,2019-10-30 00:05:06,HBO announces new Game of Thrones spinoff House of the Dragon  
986,verge,2019-10-30 00:01:01,Toothbrush startup Quip is launching a 20 floss dispenser  
987,verge,2019-10-29 23:53:38,HBO Max launches in May 2020 for 1499 a month  
988,verge,2019-10-29 23:16:39,HBO Max event Rick and Morty Green Lantern and all the TV announcements  
989,verge,2019-10-29 22:44:49,Elon Musk says he will donate 1 million to plant trees after testifying that hes cashpoor  
990,verge,2019-10-29 22:03:06,In the escalating fight between Twitch and Mixer YouTube is the real winner  
991,verge,2019-10-29 20:49:37,Black Friday is still weeks away but Walmart has already started lowering prices Weve gathered the best deals so 
992,verge,2019-10-29 20:33:01,A summit in Egypt will decide the future of 5G and weather forecasts  
993,verge,2019-10-29 20:28:51,Apple AirPods Pro handson the noise cancellation really works  
994,verge,2019-10-29 20:28:09,How to share your audio in iOS 13  
995,verge,2019-10-29 20:23:29,Walmarts early Black Friday deals have begun  here are the ones you need to know about  
996,verge,2019-10-29 19:47:46,WhatsApp is suing an infamous spyware vendor for allegedly hacking its users  
997,verge,2019-10-29 19:44:42,HBO cancels its first planned Game of Thrones spinoff  
998,verge,2019-10-29 19:43:54,Xbox One testers can now stream any game to an Android phone  
999,verge,2019-10-29 19:20:05,RT  LGs G8X ThinQ is coming to ATampT on November 1st  
1000,verge,2019-10-29 18:54:39,Samsung unveils new foldable compact phone concept 
1001,verge,2019-10-29 18:39:45,Amazon adds new wakeup lighting and sleep timer features for Alexapowered smart lights  
1002,verge,2019-10-29 18:24:29,Uber Lyft and DoorDash kick off 90 million fight against Californias gig worker law  
1003,verge,2019-10-29 18:10:33,Call of Dutys citybased league kicks off in January  
1004,verge,2019-10-29 18:07:06,Samsungs new Galaxy Books double as a wireless charger 
1005,verge,2019-10-29 18:02:22,Sony is shutting down its live TV service PlayStation Vue in January 2020  
1006,verge,2019-10-29 18:01:13,Samsungs new Galaxy Book Flex and Ion laptops bring better designs to the lineup  
1007,verge,2019-10-29 17:51:16,watchOS 61 now available with Series 1 Series 2 and AirPods Pro support  
1008,verge,2019-10-29 17:50:55,Porsche trials online sales that still require a trip to the dealer  
1009,verge,2019-10-29 17:47:47,Afterparty is a hilarious exploration of the afterlife and binge drinking  
1010,verge,2019-10-29 17:36:15,Heres how Apples new AirPods Pro stack up with other truly wireless earbuds  
1011,verge,2019-10-29 17:00:13,League of Legends new hiphop group has outfits designed by Louis Vuitton  
1012,verge,2019-10-29 16:58:10,YouTube Music gets Siri and desktop web app support  
1013,verge,2019-10-29 16:53:02,Razers Junglecat brings Nintendo Switchlike snapon controllers to Android  
1014,verge,2019-10-29 16:49:11,Uber sues Los Angeles as the fight over scooter data escalates  
1015,verge,2019-10-29 16:32:40,The California fires show how unprepared we are for climate change  
1016,verge,2019-10-29 16:13:28,Amber Baldet on what blockchain technology can do for us beyond cryptocurrency  
1017,verge,2019-10-29 15:36:10,LGs G8X ThinQ is coming to ATampT on November 1st  
1018,verge,2019-10-29 15:00:20,Razers first truly wireless earbuds aim to fix gaming audio lag on Android  
1019,verge,2019-10-29 14:59:59,How to enable LTE cellular service on your Apple Watch  
1020,verge,2019-10-29 14:54:19,In season 6 BoJack Horseman is still its own harshest most relentlessly selfexamining critic 
1021,verge,2019-10-29 14:21:35,Fortnites new island has already changed just in time for Halloween  
1022,verge,2019-10-29 14:05:59,RT   also if any teens are still wondering why bernie joined twitch i have the answer 
1023,verge,2019-10-29 14:00:07,EA games are returning to Steam along with the EA Access subscription service  
1024,verge,2019-10-29 13:58:19,Netflix wants to let people watch things at twice the speed but Hollywood is pushing back  
1025,verge,2019-10-29 13:25:09,Hellvetica is a horrific take on the famous typeface  
1026,verge,2019-10-29 13:18:32,Ikeas smart button leaks with a tease of scenes to come  
1027,verge,2019-10-29 13:01:22,Googles new shortcuts are coming to other websites and youll be able to register your own 
1028,verge,2019-10-29 13:00:22,Lyft simplifies its subscription service with the 20amonth Lyft Pink  
