,User,Date,Tweets
1532,verge,2019-10-19 17:29:01,Disney launch lineup Every movie and TV show available to stream in the US on day one  
1533,verge,2019-10-19 16:28:01,Volvo unveiled its first fully electric car  and a bold pledge to go carbonneutral  
1534,verge,2019-10-19 16:05:00,iPhone 11 Pro and 11 Pro Max review the BEST camera on a phone 
1535,verge,2019-10-19 15:28:01,Analogue Pocket is a gorgeous modern handheld for playing your old Game Boy games  
1536,verge,2019-10-19 14:00:17,How Pebble smartwatches are getting a second life  
1537,verge,2019-10-19 14:00:16,11 new trailers you should watch this week  
1538,verge,2019-10-19 12:28:00,Pixelbook Go handson Googles cheapest Chromebook yet 
1539,verge,2019-10-19 12:26:00,OpenAIs AIpowered robot learned how to solve a Rubiks cube onehanded  
1540,verge,2019-10-19 11:26:01,Google Pixel 4 and 4 XL handson this time its not about the camera  
1541,verge,2019-10-19 07:37:01,Wings delivery drones take flight for the first time in Virginia  
1542,verge,2019-10-19 07:23:01,Theres a new Banana Phone and it can play Bananaphone  
1543,verge,2019-10-19 07:10:01,Google cant even get full RCS support for the Pixel 4  
1544,verge,2019-10-19 07:06:01,Netflixs Paul Rudd comedy series Living With Yourself fuses goofy sitcom humor with hightech anxiety 
1545,verge,2019-10-19 06:49:01,Disneys threehour Disney trailer proves that all those movies it tweeted are real  
1546,verge,2019-10-19 06:06:01,HarleyDavidson resumes production of first electric motorcycle after charging issue  
1547,verge,2019-10-19 05:48:01,Trump got factchecked from space again  
1548,verge,2019-10-19 05:30:01,Boeing reportedly misled FAA about safety of its grounded 737 Max jets  
1549,verge,2019-10-19 05:07:01,Imgur wont support Reddits NSFW communities anymore because they put its business at risk 
1550,verge,2019-10-19 05:01:01,It was a learning curve for everyone Robert Eggers on the centuryold lenses custombuilt buildings and 1920s 
1551,verge,2019-10-19 04:30:01,Latest macOS Catalina beta hints at new 16inch MacBook Pro  
1552,verge,2019-10-19 04:06:01,Heres how Google Pixel Buds 2 and its wireless earbud competition actually look in your ear  
1553,verge,2019-10-19 03:06:01,Before HBOs Watchmen stream V for Vendetta the best Alan Moore adaptation  
1554,verge,2019-10-19 02:17:01,Vergecast Pixel 4 handson and Mark Zuckerbergs speech on free speech  
1555,verge,2019-10-19 01:46:01,Ikeas Fyrtur smart blinds start to arrive in the US but only in retail stores  
1556,verge,2019-10-19 01:33:01,The Hydrogen One is now only 645 which is 645 more than you should spend on it  
1557,verge,2019-10-19 01:00:04,Nintendos Ring Fit Adventure has the perfect party games for when youre slightly drunk  
1558,verge,2019-10-19 00:15:27,Salesforce CEO hates Section 230 but his lawyers sure dont  
1559,verge,2019-10-18 22:58:01,Luna Display turns your Mac into a secondary display for your other Mac  
1560,verge,2019-10-18 22:45:01,Samsung says fingerprint security fix is coming as early as next week  
1561,verge,2019-10-18 22:00:08,What Mark Zuckerbergs big talk about free speech left out  
1562,verge,2019-10-18 21:40:24,Motorola may add flashy Moto E6 Play to its budget lineup according to leaked renders  
1563,verge,2019-10-18 21:20:17,Kik Messenger will live on after Kik sells it to focus on cryptocurrency  
1564,verge,2019-10-18 20:57:05,You can now subscribe to Twitch streamers on iOS if you pay the Apple tax  
1565,verge,2019-10-18 20:25:21,Blizzard is banning people in its Hearthstone Twitch chat for proHong Kong statements  
1566,verge,2019-10-18 20:21:07,RT  Vizios 75inch PSeries Quantum 4K TV is 1599 at Amazon Its Quantum Dot tech brings the picture quality much closer to
1567,verge,2019-10-18 20:09:28,RT  A new Banana Phone showed up in FCC filings today I spoke with the president of Banana Phone today to learn more about the
1568,verge,2019-10-18 19:45:23,AOC and Ted Cruz call out Apple for dropping Hong Kong app in joint letter  
1569,verge,2019-10-18 19:37:00,Wings delivery drones take flight for the first time in Virginia  
1570,verge,2019-10-18 19:23:07,Theres a new Banana Phone and it can play Bananaphone  
1571,verge,2019-10-18 19:10:32,Google cant even get full RCS support for the Pixel 4  
1572,verge,2019-10-18 19:06:47,Netflixs Paul Rudd comedy series Living With Yourself fuses goofy sitcom humor with hightech anxiety 
1573,verge,2019-10-18 18:49:29,Disneys threehour Disney trailer proves that all those movies it tweeted are real  
1574,verge,2019-10-18 18:06:24,HarleyDavidson resumes production of first electric motorcycle after charging issue  
1575,verge,2019-10-18 17:43:39,Trump just got factchecked from space again  
1576,verge,2019-10-18 17:30:12,Boeing reportedly misled FAA about safety of its grounded 737 Max jets  
1577,verge,2019-10-18 17:06:20,Imgur wont support Reddits NSFW communities anymore because they put its business at risk 
1578,verge,2019-10-18 17:01:17,It was a learning curve for everyone Robert Eggers on the centuryold lenses custombuilt buildings and 1920s 
1579,verge,2019-10-18 16:31:45,Latest macOS Catalina beta hints at new 16inch MacBook Pro  
1580,verge,2019-10-18 16:08:11,Heres how Google Pixel Buds 2 and its wireless earbud competition actually look in your ear  
1581,verge,2019-10-18 15:58:17,RT  Coming 10 years after ZOMBIELAND ZOMBIELAND DOUBLE TAP had the chance to be a radically rethought reunion that conside
1582,verge,2019-10-18 15:19:21,Before HBOs Watchmen stream V for Vendetta the best Alan Moore adaptation  
1583,verge,2019-10-18 14:24:16,RT  Hooray the day is finally here Two NASA astronauts  Christina Koch and Jessica Meir  will make history when they suit up
1584,verge,2019-10-18 14:17:50,Vergecast Pixel 4 handson and Mark Zuckerbergs speech on free speech  
1585,verge,2019-10-18 13:40:30,Ikeas Fyrtur smart blinds start to arrive in the US but only in retail stores  
1586,verge,2019-10-18 13:40:20,The Hydrogen One is now only 645 which is 645 more than you should spend on it  
1587,verge,2019-10-18 13:00:07,Nintendos Ring Fit Adventure has the perfect party games for when youre slightly drunk  
1588,verge,2019-10-18 11:00:07,Watch two NASA astronauts conduct the first allfemale spacewalk in history  
1589,verge,2019-10-18 10:58:46,Luna Display turns your Mac into a secondary display for your other Mac  
1590,verge,2019-10-18 10:45:47,Samsung says fingerprint security fix is coming as early as next week  
1591,verge,2019-10-18 10:00:10,What Mark Zuckerbergs big talk about free speech left out  
1592,verge,2019-10-18 09:57:01,Apple rumored to launch new AirPods Pro headphones at end of October  
1593,verge,2019-10-18 08:49:22,OnePlus 8 Pro will swap the popup camera for a holepunch leak claims  
1594,verge,2019-10-18 08:19:01,HBO Max secures streaming rights to Studio Ghibli films the first time the Japanese animators have allowed digital 
1595,verge,2019-10-18 07:27:01,Redditborn engineering group buys leftovers of failed hyperloop startup Arrivo  
1596,verge,2019-10-18 07:04:01,Mark Zuckerberg on lies in political ads I dont think its right for a private company to censor politicians 
1597,verge,2019-10-18 07:00:04,OnePlus 7T Pro review small updates make a great phone slightly better  
1598,verge,2019-10-18 06:44:00,Razers Blade 15 Studio Edition is now available with a whopping 16GB of graphics memory  
1599,verge,2019-10-18 06:25:01,Googles Pixel 4 face unlock has one major privacy weakness  
1600,verge,2019-10-18 06:03:01,Googles Rick Osterloh shows off new Pixel and Nest hardware on The Vergecast  
1601,verge,2019-10-18 05:41:01,Juul suspends sale of fruity flavor pods  
1602,verge,2019-10-18 05:29:01,Meetup apologizes for confusion but will continue testing paid RSVPs  
1603,verge,2019-10-18 05:17:01,GM still plans to sell Lordstown plant to EV startup after UAW strike  
1604,verge,2019-10-18 04:49:01,Zombieland Double Tap is a shambling halfrevived mess of a sequel  
1605,verge,2019-10-18 04:35:01,Swagtron introduces three new vintagestyle electric cruisers  
1606,verge,2019-10-18 03:43:01,Intel pledges to release data on race and gender pay gap  
1607,verge,2019-10-18 03:01:01,A closer look at the XC40 Recharge Volvos first electric car  
1608,verge,2019-10-18 02:43:01,Maleficent Mistress of Evil is boldly bonkers  
1609,verge,2019-10-18 01:04:19,RT  Mark Zuckerberg spoke earlier today at Georgetown University about free speech on Facebook 
1610,verge,2019-10-18 01:03:01,Pokmon Sword and Shields opening is a mix of nostalgia and innovation  
1611,verge,2019-10-18 00:53:23,Does praying burn calories Heres the popes 110 erosary  
1612,verge,2019-10-18 00:30:02,Arlos Video Doorbell shoots high enough for faces low enough for packages  
1613,verge,2019-10-18 00:00:05,Ring Fit Adventure review two weeks with Nintendos charming exercise RPG  
1614,verge,2019-10-17 22:25:41,Motorola teases its foldable RAZR phone reveal for November 13th  
1615,verge,2019-10-17 22:06:33,Some of the UKs phone number infrastructure relies on Yahoo Groups which is shutting down  
1616,verge,2019-10-17 22:03:38,Google Maps on iOS will soon let you report speed traps and traffic slowdowns  
1617,verge,2019-10-17 21:16:39,Californias earthquake warning app how it works and what comes next  
1618,verge,2019-10-17 20:53:07,The Switch turns Overwatch into a great secondscreen game  
1619,verge,2019-10-17 20:29:46,Yahoo will give you an extra week to post on Yahoo Groups says it will listen to feedback  
1620,verge,2019-10-17 20:14:42,Call of Duty Modern Warfare ditches loot boxes for a battle pass  
1621,verge,2019-10-17 19:26:08,Newegg leaks Nvidias brandnew Shield TV streaming tube  
1622,verge,2019-10-17 19:06:47,Redditborn engineering group buys leftovers of failed hyperloop startup Arrivo  
1623,verge,2019-10-17 18:45:27,Mark Zuckerberg took on China in a speech defending free expression  
1624,verge,2019-10-17 18:39:27,Mark Zuckerberg on lies in political ads I dont think its right for a private company to censor politicians 
1625,verge,2019-10-17 18:35:29,Razers Blade 15 Studio Edition is now available with a whopping 16GB of graphics memory  
1626,verge,2019-10-17 18:29:00,Googles Rick Osterloh shows off new Pixel and Nest hardware on The Vergecast  
1627,verge,2019-10-17 18:25:15,Googles Pixel 4 face unlock has one major privacy weakness  
1628,verge,2019-10-17 17:41:25,Juul suspends sale of fruity flavor pods  
1629,verge,2019-10-17 17:34:40,PSA Todays the day to cancel Apple Arcade without getting charged  
1630,verge,2019-10-17 17:29:20,Meetup apologizes for confusion but will continue testing paid RSVPs  
1631,verge,2019-10-17 17:19:18,HBO Max secures streaming rights to Studio Ghibli films the first time the Japanese animators have allowed digital 
1632,verge,2019-10-17 17:18:30,GM still plans to sell Lordstown plant to EV startup after UAW strike  
1633,verge,2019-10-17 17:09:17,Save 24 on the new Nintendo Switch with improved battery life  
1634,verge,2019-10-17 16:49:46,Zombieland Double Tap is a shambling halfrevived mess of a sequel  
1635,verge,2019-10-17 16:35:29,Swagtron introduces three new vintagestyle electric cruisers  
1636,verge,2019-10-17 16:33:59,Nvidia Shield TV Pro leaked on Amazon with Dolby Vision and even faster performance  
1637,verge,2019-10-17 15:43:08,Intel pledges to release data on race and gender pay gap  
1638,verge,2019-10-17 15:28:42,Save on fastcharging USBC wall adapters Google Pixel 4 preorders and more  
1639,verge,2019-10-17 15:14:45,A closer look at the XC40 Recharge Volvos first electric car  
1640,verge,2019-10-17 14:49:06,Samsung to patch the Galaxy S10s fingerprint sensor over screen protector concerns  
1641,verge,2019-10-17 14:43:27,Maleficent Mistress of Evil is boldly bonkers  
1642,verge,2019-10-17 13:00:20,Pokmon Sword and Shields opening is a mix of nostalgia and innovation  
1643,verge,2019-10-17 12:46:23,RT  Sen Ron Wyden is out with his new Mind Your Own Business data privacy bill today and theres a lot in itMark Zuc
1644,verge,2019-10-17 12:00:09,Arlos Video Doorbell shoots high enough for faces low enough for packages  
1645,verge,2019-10-17 12:00:03,Ring Fit Adventure review two weeks with Nintendos charming exercise RPG  
1646,verge,2019-10-17 11:30:03,Google keeps adding Pixel features it claimed it didnt need  
1647,verge,2019-10-17 11:00:04,Ron Wyden wants Facebook to mind your own business with new privacy bill  
1648,verge,2019-10-17 10:00:12,Congresss focus on content moderation has distracted it from the larger problem  
1649,verge,2019-10-17 07:45:01,How to check which version of Chrome OS youre running  
1650,verge,2019-10-17 07:16:01,The creators of Billions are making a TV show about Uber  
1651,verge,2019-10-17 07:01:01,Gemini Man is a cinematic throwback but it may be the future of blockbusters too  
1652,verge,2019-10-17 06:32:01,Skydio has a motorized charging box to make its selfflying drone truly autonomous  
1653,verge,2019-10-17 06:10:01,Primavera Sound festival switches to mobileonly tickets to combat bots and scalping  
1654,verge,2019-10-17 05:56:01,Blizzard bans three college Hearthstone players for Hong Kong protest sign  
1655,verge,2019-10-17 05:54:01,Ever buy an AMD FX eightcore CPU in California You may be owed up to 300  
1656,verge,2019-10-17 05:39:01,Volvo unveils its first fully electric car  and a bold pledge to go carbonneutral  
1657,verge,2019-10-17 04:56:01,Google Clips is dead  
1658,verge,2019-10-17 04:43:01,Feds arrest hundreds in takedown of massive child porn operation  
1659,verge,2019-10-17 04:21:01,Libra keyboard design will be changed to avoid Brydge patent creator says  
1660,verge,2019-10-17 04:00:06,Master amp Dynamics new MW07 Plus earbuds boast improved battery life and active noise cancellation 
1661,verge,2019-10-17 04:00:03,Hulu is giving customers much more control over its recommendations  
1662,verge,2019-10-17 03:42:01,How Apple Arcade mystery Tangle Tower was translated into more than a dozen languages  
1663,verge,2019-10-17 03:31:01,Twitch CEO Emmett Shear on how moderation creates communities  
1664,verge,2019-10-17 03:21:01,Phonebased VR is officially over  
1665,verge,2019-10-17 03:17:01,How to trade in your old Pixel phone  
1666,verge,2019-10-17 03:13:01,How the Pixelbook Go compares to other Chromebooks  
1667,verge,2019-10-17 03:00:02,Analogue Pocket is a gorgeous modern handheld for playing your old Game Boy games  
1668,verge,2019-10-17 02:24:01,How much will it take for these new giant pokmon to crush me  
1669,verge,2019-10-17 02:20:01,Virgin Galactic shows off the suits its customers will wear during joyrides to space  
1670,verge,2019-10-17 02:00:02,Come see The Interface live in San Francisco  
1671,verge,2019-10-17 01:46:01,Giphy Arcade lets you play create and share minigames on the web as if they were GIFs  
1672,verge,2019-10-17 01:16:01,Fortnite is exciting again  
1673,verge,2019-10-17 01:00:25,Apples iOS 13 is running on 50 percent of all iPhones after three weeks  
1674,verge,2019-10-17 00:53:01,Bose is now visiting customers at home to figure out QC35II noise cancellation problems  
1675,verge,2019-10-17 00:37:28,Googles Stadia wireless controller wont be very wireless at launch  
1676,verge,2019-10-17 00:32:01,Youll need to eat Taco Bell to get Microsofts Xbox Elite 2 controller early  
1677,verge,2019-10-17 00:00:06,Can the Pixel 4 win back Googles camera crown  
1678,verge,2019-10-16 22:53:06,Netflix says Stranger Things third season is recordbreaking but what does that mean  
1679,verge,2019-10-16 21:50:16,The UK porn block is finally dead  
1680,verge,2019-10-16 21:48:33,Hey  let me  explain Ninja to you  
1681,verge,2019-10-16 21:46:28,This live stream of a whale skeleton getting eaten is metal as hell  
1682,verge,2019-10-16 21:16:42,Yahoo will delete all Yahoo Groups content on December 14th  
1683,verge,2019-10-16 20:41:45,Lawmaker who helps fund NASA questions the agencys need to get to the Moon by 2024  
1684,verge,2019-10-16 20:32:19,Netflix wont shy away from taking bold swings as competition heats up  
1685,verge,2019-10-16 19:49:10,How to check which version of Chrome OS youre running  
1686,verge,2019-10-16 19:15:11,The creators of Billions are making a TV show about Uber  
1687,verge,2019-10-16 19:14:00,Apple Watch Series 5 review the best smartwatch 
1688,verge,2019-10-16 19:03:16,Mark Zuckerberg is delivering a free speech manifesto tomorrow  
1689,verge,2019-10-16 19:01:58,Gemini Man is a cinematic throwback but it may be the future of blockbusters too  
1690,verge,2019-10-16 18:50:31,RT  Googles Pixel 4 and Pixel 4 XL phones are now available for preorder and will ship on October 24th Weve collected all of
1691,verge,2019-10-16 18:48:19,Google reportedly wont sell Pixel 4 in India due to Motion Sense radar spectrum issues  
1692,verge,2019-10-16 18:30:19,Skydio has a motorized charging box to make its selfflying drone truly autonomous  
1693,verge,2019-10-16 18:08:48,Primavera Sound festival switches to mobileonly tickets to combat bots and scalping  
1694,verge,2019-10-16 17:56:32,Blizzard bans three college Hearthstone players for Hong Kong protest sign  
1695,verge,2019-10-16 17:54:43,Ever buy an AMD FX eightcore CPU in California You may be owed up to 300  
1696,verge,2019-10-16 17:39:42,Volvo unveils its first fully electric car  and a bold pledge to go carbonneutral  
1697,verge,2019-10-16 17:37:58,Breaking the FCC has voted to approve the TMobileSprint merger  
1698,verge,2019-10-16 16:56:48,Google Clips is dead  
1699,verge,2019-10-16 16:43:10,Feds arrest hundreds in takedown of massive child porn operation  
1700,verge,2019-10-16 16:21:07,Libra keyboard design will be changed to avoid Brydge patent creator says  
1701,verge,2019-10-16 16:00:02,Hulu is giving customers much more control over its recommendations  
1702,verge,2019-10-16 15:38:40,How Apple Arcade mystery Tangle Tower was translated into more than a dozen languages  
1703,verge,2019-10-16 15:32:32,Twitch CEO Emmett Shear on how moderation creates communities  
1704,verge,2019-10-16 15:21:26,Phonebased VR is officially over  
1705,verge,2019-10-16 15:09:38,How to trade in your old Pixel phone  
1706,verge,2019-10-16 15:00:11,How the Pixelbook Go compares to other Chromebooks  
1707,verge,2019-10-16 15:00:07,Analogue Pocket is a gorgeous modern handheld for playing your old Game Boy games  
1708,verge,2019-10-16 14:30:19,Motorolas Moto G8 Plus leaks with triple rear cameras and a 4000mAh battery  
1709,verge,2019-10-16 14:22:59,How much will it take for these new giant pokmon to crush me  
1710,verge,2019-10-16 14:16:51,Virgin Galactic shows off the suits its customers will wear during joyrides to space  
1711,verge,2019-10-16 14:00:07,Giphy Arcade lets you play create and share minigames on the web as if they were GIFs  
1712,verge,2019-10-16 14:00:07,Come see The Interface live in San Francisco  
1713,verge,2019-10-16 13:42:06,Nest is getting ready for the smart homes Cambridge Analytica moment  
1714,verge,2019-10-16 13:33:26,Fortnite is exciting again  
1715,verge,2019-10-16 12:53:48,Bose is now visiting customers at home to figure out QC35II noise cancellation problems  
1716,verge,2019-10-16 12:49:22,RT  Microsoft has created a new Xbox One X Eclipse Limited Edition console It includes the new Xbox Elite 2 controller and it
1717,verge,2019-10-16 12:00:10,Youll need to eat Taco Bell to get Microsofts Xbox Elite 2 controller early  
1718,verge,2019-10-16 12:00:05,Can the Pixel 4 win back Googles camera crown  
1719,verge,2019-10-16 10:00:12,Why social networks keep tripping over their own content moderation policies  
1720,verge,2019-10-16 09:00:09,Uber is adding electric mopeds to its app in Paris  
1721,verge,2019-10-16 08:35:01,Sony is launching its 360degree audio format this fall  
1722,verge,2019-10-16 07:35:01,Chromebook 101 How to change your Chrome OS channels and get unreleased features  
1723,verge,2019-10-16 06:59:01,Google to revamp Nest Aware with simpler pricing and new features  
1724,verge,2019-10-16 06:40:01,Harry Potter fans can spend 75 a year on a new subscription service  
1725,verge,2019-10-16 05:57:01,Pixel 4 vs iPhone 11 Pro a first look at camera photo samples  
1726,verge,2019-10-16 05:42:01,Google is discontinuing the Daydream View VR headset and the Pixel 4 wont support Daydream  
1727,verge,2019-10-16 05:34:01,The Pixel 4 doesnt include any headphones or even a 35mm adapter in the box  
1728,verge,2019-10-16 05:17:01,How to buy the Google Pixel 4 and the 4 XL  
1729,verge,2019-10-16 05:03:01,YouTube gets alleged copyright troll to agree to stop trolling YouTubers  
1730,verge,2019-10-16 04:33:01,OpenAIs AIpowered robot learned how to solve a Rubiks cube onehanded  
1731,verge,2019-10-16 04:11:01,Pixel Buds 2 handson Google takes on the AirPods  
1732,verge,2019-10-16 04:02:01,Google Pixel 4 buyers wont get unlimited photo uploads at original quality  
1733,verge,2019-10-16 03:57:01,Googles Project Soli the tech behind Pixel 4s Motion Sense radar  
1734,verge,2019-10-16 03:41:01,How Googles Pixel 4 compares to other popular flagship phones  
1735,verge,2019-10-16 03:16:01,Pixelbook Go Google finally made a reasonably priced Chromebook 
1736,verge,2019-10-16 03:10:01,Google Pixel 4 and 4 XL handson this time its not about the camera  
1737,verge,2019-10-16 03:07:01,Pixel 4 Recorder app can transcribe speech in real time without an internet connection  
1738,verge,2019-10-16 03:00:03,Nest Wifi first look Google finally combined a smart speaker and a router  
1739,verge,2019-10-16 02:53:14,Most Democrats refuse to back Elizabeth Warrens big tech break up plan on the debate stage  
1740,verge,2019-10-16 02:46:01,Googles new Nest Mini has better controls similar sound and the same price  
1741,verge,2019-10-16 02:30:01,The biggest announcements from Googles 2019 Pixel event  
1742,verge,2019-10-16 02:09:01,Googles Stadia cloud gaming service will launch on November 19th  
1743,verge,2019-10-16 02:00:05,Why it took a decade for Riot to follow League of Legends with a new game  
1744,verge,2019-10-16 02:00:04,League of Legends expands with animated series fighting game and more  
1745,verge,2019-10-16 02:00:02,Beats announces Solo Pro onear headphones with noise cancellation  
1746,verge,2019-10-16 01:42:01,Twitter is thinking about how tweets can become more ephemeral  
1747,verge,2019-10-16 01:37:55,Riot teases Project A a characterbased tactical shooter  
1748,verge,2019-10-16 01:20:46,League of Legends is coming to mobile and console  
1749,verge,2019-10-16 01:11:52,Democrats just had a real debate about automation on stage  
1750,verge,2019-10-16 01:09:01,Googles new Pixel Buds are coming spring 2020 for 179  
1751,verge,2019-10-16 00:38:01,Walmart begins directtofridge delivery service for 1 million US customers 
1752,verge,2019-10-16 00:17:01,Good Samaritan notifies owner of lost wallet via message hidden in bank deposits  
1753,verge,2019-10-16 00:00:05,Facebooks new Portal has a refined design but familiar limitations  
1754,verge,2019-10-15 23:14:19,You cant use the Pixelbook Pen with the Pixelbook Go  
1755,verge,2019-10-15 22:43:41,Uber Spin and Lime scooters are now legal in San Francisco but Skip is out  
1756,verge,2019-10-15 22:34:43,NASA unveils future Moon spacesuits that should be ready by 2024  
1757,verge,2019-10-15 22:31:16,Google Pixel 4 Pixel 3 or Pixel 3A Should you upgrade  
1758,verge,2019-10-15 22:29:45,Meetup wants to charge users 2 just to RSVP for events  and some are furious  
1759,verge,2019-10-15 21:57:56,Politicians arent entirely above the rules Twitter says  
1760,verge,2019-10-15 21:50:27,Instagrams latest security feature lets you better manage thirdparty app permissions  
1761,verge,2019-10-15 21:12:46,New computer model predicts where Ebola might strike next  
1762,verge,2019-10-15 19:40:04,Sony is launching its 360degree audio format this fall  
1763,verge,2019-10-15 19:02:12,Chromebook 101 How to change your Chrome OS channels and get unreleased features  
1764,verge,2019-10-15 18:59:46,Google to revamp Nest Aware with simpler pricing and new features  
1765,verge,2019-10-15 18:51:11,RT  How to buy the Google Pixel 4 and the 4 XL 
1766,verge,2019-10-15 18:39:29,Harry Potter fans can spend 75 a year on a new subscription service  
1767,verge,2019-10-15 17:58:56,Pixel 4 vs iPhone 11 Pro a first look at camera photo samples  
1768,verge,2019-10-15 17:44:03,Google is discontinuing the Daydream View VR headset and the Pixel 4 wont support Daydream  
1769,verge,2019-10-15 17:34:23,The Pixel 4 doesnt include any headphones or even a 35mm adapter in the box  
1770,verge,2019-10-15 17:33:41,How to buy the Google Pixel 4 and the 4 XL  
1771,verge,2019-10-15 17:30:15,RT  Got to do a really fun interview with my friend  and Twitters  check it out 
1772,verge,2019-10-15 17:29:45,YouTube gets alleged copyright troll to agree to stop trolling YouTubers  
1773,verge,2019-10-15 17:29:28,Google takes on the AirPods with the new Pixel Buds 2 
1774,verge,2019-10-15 16:20:27,Pixelbook Go handson Googles cheapest Chromebook yet 
1775,verge,2019-10-15 16:07:16,OpenAIs AIpowered robot learned how to solve a Rubiks cube onehanded  
1776,verge,2019-10-15 15:59:16,Elizabeth Warren swears off major donations from Facebook Google executives  
1777,verge,2019-10-15 15:55:31,Pixel Buds 2 handson Google takes on the AirPods  
1778,verge,2019-10-15 15:46:24,RT  Pixel Buds 
1779,verge,2019-10-15 15:44:33,RT  I got a chance to spend an hour talking about Project Soli aka Motion Sense and what Googles reasoning was for including it
1780,verge,2019-10-15 15:41:07,Google Pixel 4 buyers wont get unlimited photo uploads at original quality  
1781,verge,2019-10-15 15:30:07,Googles Project Soli the tech behind Pixel 4s Motion Sense radar  
1782,verge,2019-10-15 15:17:45,Pixel 4 and 4 XL handson what the leaks didnt tell you 
