,User,Date,Tweets
2397,BBCTech,2018-05-17 23:29:28,Expensive remittances 
2398,BBCTech,2018-05-17 23:06:24,Broadband speeds far slower than in ads 
2399,BBCTech,2018-05-17 12:21:42,YouTube unveils new music streaming service 
2400,BBCTech,2018-05-17 11:32:25,Ocado shares rocket on Kroger tech deal 
2401,BBCTech,2018-05-17 10:43:36,China car app Didi updates safety measures after murder 
2402,BBCTech,2018-05-17 09:59:12,UK leading world in compassionate technology 
2403,BBCTech,2018-05-17 08:08:42,Xbox Adaptive Controller a first for disabled gamers 
2404,BBCTech,2018-05-16 17:35:11,Pope warns nuns to use sobriety on social media 
2405,BBCTech,2018-05-16 17:02:13,Facebook privacy MEPs to press Zuckerberg 
2406,BBCTech,2018-05-16 13:54:59,Vault 7 inquiry CIA data leak suspect named by media 
2407,BBCTech,2018-05-16 13:18:18,Laurel or Yanny People cant decide 
2408,BBCTech,2018-05-16 13:13:12,NHS cyberhero discussed bank hack role 
2409,BBCTech,2018-05-16 12:10:56,Watch ban imposed at GCSE and Alevel exams 
2410,BBCTech,2018-05-16 12:01:28,Robert Downey Jr plans YouTube series on AI 
2411,BBCTech,2018-05-16 07:58:14,Smart SoPhy socks send data to your physiotherapist 
2412,BBCTech,2018-05-16 07:23:45,Synth suspense 
2413,BBCTech,2018-05-15 17:12:34,Kaspersky moves operations after spy claims 
2414,BBCTech,2018-05-15 16:13:05,Twitter trolls tweets to tumble down timeline 
2415,BBCTech,2018-05-15 15:48:52,Leftwing internet phrases gammon melts and slugs 
2416,BBCTech,2018-05-15 15:17:13,Keyless cars causing dozens of deaths 
2417,BBCTech,2018-05-15 12:52:44,Sharing of school pupils data put on hold 
2418,BBCTech,2018-05-15 12:50:15,Amazon and Starbucks blast Seattle tax to fight homelessness 
2419,BBCTech,2018-05-15 12:03:30,IS propaganda hidden on Internet Archive 
2420,BBCTech,2018-05-15 10:26:12,RT  Forget driverless carstaxis could dockless bikes be the future of urban transport Greener cleaner and better for our
2421,BBCTech,2018-05-15 10:02:06,Is this a pigeon A 2011 meme reincarnated in 2018 
2422,BBCTech,2018-05-15 09:41:33,O2 apologises for racist hate mail sent with Sim cards 
2423,BBCTech,2018-05-15 07:56:03,Pakistans army tried to hack my Facebook 
2424,BBCTech,2018-05-14 23:19:55,Wheelie good 
2425,BBCTech,2018-05-14 23:12:58,Can AI pick the perfect fantasy football team 
2426,BBCTech,2018-05-14 23:12:58,Face recognition police tools staggeringly inaccurate 
2427,BBCTech,2018-05-14 18:39:19,Why your social media is covered in gammon 
2428,BBCTech,2018-05-14 14:41:52,AppleSamsung patent battle revived in California court 
2429,BBCTech,2018-05-14 11:22:28,John Lewis apologises after wedding gift list site disappears 
2430,BBCTech,2018-05-14 11:03:40,PGP Serious flaw found in secure email tech 
2431,BBCTech,2018-05-14 07:26:05,Revealed Advice to Tory MPs on how to be real on Instagram 
2432,BBCTech,2018-05-14 07:26:05,SpaceX flies lessons learned rocket 
2433,BBCTech,2018-05-14 07:23:54,Twitter fails to take down Xanax adverts 
2434,BBCTech,2018-05-14 07:23:52,Xerox aborts 61bn sale to Japans Fujifilm 
2435,BBCTech,2018-05-14 07:21:43,Record 120m fine for nuisance robocalls 
2436,BBCTech,2018-05-14 07:21:41,Google to warn when humans chat with convincing bots 
2437,BBCTech,2018-05-14 07:21:41,Trump seeks to save Chinese jobs at ZTE ahead of trade talks 
2438,BBCTech,2018-05-13 20:03:38,RT  Volunteer speed detectors are striking back Full film  mojo London cars WorldHacks 
2439,BBCTech,2018-05-12 13:31:44,RT  If the digital ad industry doesnt get its act together we could all end up paying for internet content Would you care
2440,BBCTech,2018-05-11 02:37:49,Bad ads 
2441,BBCTech,2018-05-11 02:37:49,Selfdriving pods 
2442,BBCTech,2018-05-10 16:11:23,MPs summon exCambridge Analytica boss Alexander Nix 
2443,BBCTech,2018-05-10 15:35:24,UK access to Galileo satnav system after Brexit 
2444,BBCTech,2018-05-10 15:13:18,Workers banned from using USB sticks at IBM 
2445,BBCTech,2018-05-10 14:26:23,Tidal accused of manipulating Beyonce and Kanye West data 
2446,BBCTech,2018-05-10 14:17:03,US tech giant Apple scraps plans for Galway data centre 
2447,BBCTech,2018-05-10 11:43:34,US commercial drones given green light 
2448,BBCTech,2018-05-10 10:03:36,Are intelligent robots better at our jobs 
2449,BBCTech,2018-05-10 07:26:57,BT cuts 13000 jobs to slash costs 
2450,BBCTech,2018-05-10 07:24:34,California becomes first US state to mandate solar on homes 
2451,BBCTech,2018-05-09 23:04:54,The autonomous car that can drive where others cannot 
2452,BBCTech,2018-05-09 16:26:43,Cocaine breathalyser one step closer 
2453,BBCTech,2018-05-09 15:50:07,Brexit to force Airbus satnav work on Galileo out of UK 
2454,BBCTech,2018-05-09 15:42:44,Durham Sixth Form Centre paid ransom after cyberattack 
2455,BBCTech,2018-05-09 15:09:57,UK broadband speeds leap ahead according to Ofcom study 
2456,BBCTech,2018-05-09 12:50:17,Google bans abortion poll ads in Ireland 
2457,BBCTech,2018-05-09 11:50:48,BMW advert promoted dangerous driving 
2458,BBCTech,2018-05-09 07:18:51,Met Police gangs matrix not fit for purpose 
2459,BBCTech,2018-05-09 07:18:51,Vodafone to buy Liberty Global European assets for 184bn 
2460,BBCTech,2018-05-09 05:05:19,Tinder owner says its not afraid of Facebook dating app 
2461,BBCTech,2018-05-09 04:36:16,Google assistant calls to make appointment 
2462,BBCTech,2018-05-08 23:10:11,The Ocado robot swarms that pack your shopping 
2463,BBCTech,2018-05-08 18:13:12,Google AI to make phone calls for users 
2464,BBCTech,2018-05-08 13:13:32,Ireland abortion poll Facebook bans foreign ads 
2465,BBCTech,2018-05-08 12:53:56,Paedophiliadefending YouTuber has channel removed 
2466,BBCTech,2018-05-08 12:40:39,RT  DONT MISS Are Initial Coin Offerings the future of finance or just an investment craze  explores in Magical
2467,BBCTech,2018-05-08 11:52:01,AI creates new levels for Doom and Super Mario games 
2468,BBCTech,2018-05-08 10:57:31,Melania Trump faces new plagiarism row over cyber safety booklet 
2469,BBCTech,2018-05-08 10:45:04,World of Warcraft attacker jailed in US 
2470,BBCTech,2018-05-08 09:32:13,RT  The biggest seafaring vessel ever built is about to do battle in the race for natural gas off Western Australia But in
2471,BBCTech,2018-05-08 07:22:24,World Hacks Volunteers with speed guns strike back 
2472,BBCTech,2018-05-07 23:29:36,Sea giants do battle 
2473,BBCTech,2018-05-07 14:14:39,Fictional futures 
2474,BBCTech,2018-05-07 14:09:47,Google changes rules for buying election adverts 
2475,BBCTech,2018-05-07 13:27:15,Land locked 
2476,BBCTech,2018-05-07 11:19:22,Information watchdog seeks Cambridge Analytica data 
2477,BBCTech,2018-05-07 06:19:42,Could Trumps Space Force become a reality 
2478,BBCTech,2018-05-06 18:23:54,Facebook privacy Survey suggests continuing US loyalty 
2479,BBCTech,2018-05-05 18:54:46,YouTube stars fury as videos promoting cheating removed 
2480,BBCTech,2018-05-05 12:13:04,Nasas InSight rocket takes off for Mars 
2481,BBCTech,2018-05-04 20:39:06,Apple shares hit alltime high after Buffett raises stake 
2482,BBCTech,2018-05-04 17:47:47,Drones used to disrupt FBI hostage situation 
2483,BBCTech,2018-05-04 12:39:44,RT  The way our personal data can be used changes on 25 May GDPR  
2484,BBCTech,2018-05-04 12:31:00,Warnings over fresh processor security flaws 
2485,BBCTech,2018-05-04 12:04:50,What is GDPR Technology explained 
2486,BBCTech,2018-05-04 08:20:38,RT  Even Lionel Messi is digging deeper into blockchain and decentralised systems Is football about to get into cryptoh
2487,BBCTech,2018-05-03 23:27:13,New kids on the block 
2488,BBCTech,2018-05-03 20:22:29,Twitter tells 330 million users to change their passwords 
2489,BBCTech,2018-05-03 17:55:42,Vinyl collectors spent millions on Discogs last year 
2490,BBCTech,2018-05-03 17:02:14,Forty years of spam email 
2491,BBCTech,2018-05-03 16:22:14,Cambridge Analytica Will data scandal firm return from dead 
2492,BBCTech,2018-05-03 16:06:58,Elon Musk No bonehead analyst questions please 
2493,BBCTech,2018-05-03 14:43:56,NSPCC warning over Fortnite chat systems 
2494,BBCTech,2018-05-03 12:14:24,Exeter University Why I revealed my friends racist WhatsApp messages 
2495,BBCTech,2018-05-03 11:49:08,Facebook engineer fired over stalking claims 
2496,BBCTech,2018-05-03 08:26:38,Australias Commonwealth Bank lost data of 20m accounts 
2497,BBCTech,2018-05-03 08:26:38,Millennium Falcons walkin cape wardrobe 
2498,BBCTech,2018-05-03 08:26:38,Spotify earnings debut misses a beat 
2499,BBCTech,2018-05-03 03:08:03,Xiaomi launches 10bn Hong Kong stock market listing 
2500,BBCTech,2018-05-03 01:36:08,Cambridge Analytica Closure will not stop investigation 
2501,BBCTech,2018-05-03 00:50:10,TalkTalk broadband worst for customer service says Ofcom 
2502,BBCTech,2018-05-02 23:34:32,Gamers mine cryptocurrency for charity 
2503,BBCTech,2018-05-02 21:45:44,Tesla optimistic despite record loss 
2504,BBCTech,2018-05-02 18:35:40,Cambridge Analytica shutting down 
2505,BBCTech,2018-05-02 18:03:35,Chinas bungled drone display breaks world record 
2506,BBCTech,2018-05-02 17:00:46,TSB boss Paul Pester to give up 2m bonus amid IT mess 
2507,BBCTech,2018-05-02 15:07:58,LGs G7 phone shuns separate speakers 
2508,BBCTech,2018-05-02 14:56:10,BBC podcasts will run adverts outside UK to boost income 
2509,BBCTech,2018-05-02 14:04:41,LG G7 smartphone shines bright and plays deep bass 
2510,BBCTech,2018-05-02 11:35:42,Breast screening error affects 450000 women 
2511,BBCTech,2018-05-02 11:03:12,Ford car window helps blind passengers feel the view 
2512,BBCTech,2018-05-02 10:52:28,Biohacker Aaron Traywick found dead in a spa 
2513,BBCTech,2018-05-02 08:23:55,Tesla trouble 
2514,BBCTech,2018-05-02 07:56:56,The US town banning new Bitcoin mines 
2515,BBCTech,2018-05-02 07:39:11,City worker jailed for fake porn posts of colleague 
2516,BBCTech,2018-05-02 04:41:49,Snapchat redesign User growth sinks hitting Snap shares 
2517,BBCTech,2018-05-02 00:40:11,Braille saviour 
2518,BBCTech,2018-05-01 23:34:50,Apple faces battery pledge complaints 
2519,BBCTech,2018-05-01 23:17:49,The new nomads 
2520,BBCTech,2018-05-01 22:21:49,How Facebook plans to disrupt internet dating 
2521,BBCTech,2018-05-01 21:25:56,Solid iPhone sales boost Apple revenues 
2522,BBCTech,2018-05-01 19:55:54,Facial recognition to be used at Singapore airport 
2523,BBCTech,2018-05-01 19:07:46,Facebook Hate speech button causes confusion 
2524,BBCTech,2018-05-01 17:14:13,Facebook F8 This has been an intense year 
2525,BBCTech,2018-05-01 16:42:36,The YouTube stars being paid to sell cheating 
2526,BBCTech,2018-05-01 13:52:21,New problems with TSB standing orders 
2527,BBCTech,2018-05-01 13:52:21,Adverts for broadband speeds to face new rules 
2528,BBCTech,2018-05-01 13:35:37,RT  Think drones are just about taking pretty pictures and inspecting power lines Think again They are providing instant m
2529,BBCTech,2018-05-01 13:11:07,Iran bans Telegram as sanctions deadline looms 
2530,BBCTech,2018-05-01 12:58:14,Peppa Pig blocked from Chinas Douyin video platform 
2531,BBCTech,2018-05-01 11:32:39,Panasonic hit with 280m corruption fine 
2532,BBCTech,2018-05-01 11:32:39,Autonomy exexecutive guilty of fraud 
2533,BBCTech,2018-05-01 10:34:44,Drones deliver blood and medical supplies in Rwanda 
2534,BBCTech,2018-05-01 08:17:27,Russia internet freedom Mass rally in Moscow against Telegram ban 
2535,BBCTech,2018-05-01 08:08:53,Robot company Starship Technologies plans 1000 delivery bots 
2536,BBCTech,2018-05-01 05:58:44,Cancer researchers need phones to process data 
2537,BBCTech,2018-05-01 00:32:32,Emergency drones 
2538,BBCTech,2018-04-30 22:45:43,WhatsApp boss and cofounder Jan Koum to quit 
2539,BBCTech,2018-04-30 13:31:50,Logan Paul ends daily YouTube vlog series 
2540,BBCTech,2018-04-30 13:20:49,China shuts down Player Unknown cheat code gang 
2541,BBCTech,2018-04-30 12:30:21,Facebook downvote button in new test 
2542,BBCTech,2018-04-30 11:38:08,Legal row over who owns  domain 
2543,BBCTech,2018-04-30 07:37:43,Tesla driver banned for M1 autopilot seatswitch 
2544,BBCTech,2018-04-30 07:37:43,Regain control 
2545,BBCTech,2018-04-30 07:31:59,Body cameras deter attacks and abuse at Welsh hospitals 
2546,BBCTech,2018-04-30 07:31:57,Porn block 
2547,BBCTech,2018-04-30 07:29:29,Sentinel tracks ships dirty emissions from orbit 
2548,BBCTech,2018-04-30 07:29:29,TMobile agrees 26bn megamerger with Sprint 
2549,BBCTech,2018-04-30 07:23:54,Hackers paradise 
2550,BBCTech,2018-04-30 07:23:54,God of War Games no longer where actors careers go to die 
2551,BBCTech,2018-04-29 14:04:05,Games no longer where careers go to die 
2552,BBCTech,2018-04-29 12:32:21,Fortnite 13yearold is games youngest professional player 
2553,BBCTech,2018-04-29 10:26:16,Professional Fortnite gamer at 13 a dream for all kids 
2554,BBCTech,2018-04-28 23:24:46,Fake fivestar reviews being bought and sold online 
2555,BBCTech,2018-04-28 11:51:32,Play as a refugee in Syrian war video game 
2556,BBCTech,2018-04-27 16:20:11,Deadline to amend UK surveillance laws 
2557,BBCTech,2018-04-27 16:15:26,Tech Tent the technology of pleasure 
2558,BBCTech,2018-04-27 14:33:10,RT  Lowercost genetic testing heralds an era of precision medicine 
2559,BBCTech,2018-04-27 13:38:45,GDPR Your data protection questions answered 
2560,BBCTech,2018-04-27 11:15:19,AI could raise nuclear war risk 
2561,BBCTech,2018-04-27 10:11:59,How to handle the flood of GDPR privacy updates 
2562,BBCTech,2018-04-27 09:46:35,IS web media targeted in EUled attack 
2563,BBCTech,2018-04-27 09:12:41,Wildlife photo competition disqualifies stuffed anteater image 
2564,BBCTech,2018-04-27 08:57:39,RT  How lowcost genomics is creating the internet of living things and transforming healthcare
2565,BBCTech,2018-04-27 08:50:56,Golden State Killer suspect traced using genealogy websites 
2566,BBCTech,2018-04-27 07:09:08,Reallife Transformer The Japanese robot that becomes a car 
2567,BBCTech,2018-04-26 23:14:10,Cutprice genes 
2568,BBCTech,2018-04-26 19:56:21,Nintendo Switch fuels strong rise in profits 
2569,BBCTech,2018-04-26 18:26:48,Canada data firm AIQ may face legal action in UK 
2570,BBCTech,2018-04-26 16:25:32,Revenge porn hub taken down by Dutch police raid 
2571,BBCTech,2018-04-26 15:35:06,Sinclair Spectrum designer Rick Dickinson dies in US 
2572,BBCTech,2018-04-26 13:53:44,Snapchat releases new Spectacles 20 
2573,BBCTech,2018-04-26 13:25:01,Video game loot boxes declared illegal under Belgium gambling laws 
2574,BBCTech,2018-04-26 12:14:26,Snapchat releases new Spectacles 20 
2575,BBCTech,2018-04-26 11:34:00,Facebook accused of bullying by MPs 
2576,BBCTech,2018-04-26 11:03:10,Iran blocks video and images on Telegram messaging app 
2577,BBCTech,2018-04-26 07:23:15,Trump thanks Kanye West for Twitter compliments 
2578,BBCTech,2018-04-26 04:59:28,Facebook threw us under bus says data firm Cubeyou 
2579,BBCTech,2018-04-25 23:30:32,Meet people who review Facebooks reported content 
2580,BBCTech,2018-04-25 23:09:43,The robot helping to deliver water in rural India 
2581,BBCTech,2018-04-25 21:19:17,Really worthless 
2582,BBCTech,2018-04-25 20:56:36,Facebook sales soar despite challenges 
2583,BBCTech,2018-04-25 19:06:31,YouTube Kids to give parents more control over output 
2584,BBCTech,2018-04-25 17:00:37,BuzzFeed partners with Netflix for documentary series 
2585,BBCTech,2018-04-25 16:28:58,Amazon Alexa to reward kids who say Please 
2586,BBCTech,2018-04-25 13:33:55,Galileo UK plan to launch rival to EU satnav system 
2587,BBCTech,2018-04-25 13:09:32,Hotel door locks worldwide were vulnerable to hack 
2588,BBCTech,2018-04-25 12:52:28,Data watch 
2589,BBCTech,2018-04-25 12:18:13,Googles Gmail gets selfdestruct option ahead of GDPR 
2590,BBCTech,2018-04-25 11:43:49,Google gun emoji becomes water pistol 
2591,BBCTech,2018-04-25 07:33:56,TSB mobile and online up and running 
2592,BBCTech,2018-04-24 23:57:19,WhatsApp to raise minimum age limit to 16 in EU 
2593,BBCTech,2018-04-24 23:40:12,Sharkspotting drones help keep swimmers safe 
2594,BBCTech,2018-04-24 17:52:53,Canada developing quantum radar to detect stealth aircraft 
2595,BBCTech,2018-04-24 14:10:11,Facebook in PR crisis mode says academic at heart of row 
2596,BBCTech,2018-04-24 12:08:08,TSB boss says sorry for banking chaos 
2597,BBCTech,2018-04-24 12:08:08,BBC iPlayer streams sport in 4K HDR for first time 
2598,BBCTech,2018-04-24 11:31:36,Ransomware infects Ukraine energy ministry website 
2599,BBCTech,2018-04-24 10:55:26,The senior citizens taking on coding 
2600,BBCTech,2018-04-24 10:47:01,Vodafone rated worst mobile provider by Which survey 
2601,BBCTech,2018-04-24 08:11:16,China sexist adverts Tech firms apologise after damning report 
2602,BBCTech,2018-04-23 23:33:51,YouTube publishes deleted videos report 
2603,BBCTech,2018-04-23 23:21:53,Labgrown meat 
2604,BBCTech,2018-04-23 19:33:46,Robot helps Jack McLinden 14 to be Everton mascot 
2605,BBCTech,2018-04-23 18:42:36,Spotify tests filter to block swearing in songs 
2606,BBCTech,2018-04-23 17:04:45,Russia Telegram ban hits Google and Amazon services 
2607,BBCTech,2018-04-23 17:04:45,Police visit funeral home to unlock dead mans phone 
2608,BBCTech,2018-04-23 16:47:13,Apples Shazam deal faces European probe 
2609,BBCTech,2018-04-23 15:35:23,Amazon Echo trial to help elderly and disabled people 
2610,BBCTech,2018-04-23 13:26:14,Nazi pug videomaker has no regrets 
2611,BBCTech,2018-04-23 13:08:41,Irans banks banned from dealing in cryptocurrencies 
2612,BBCTech,2018-04-23 09:45:51,Man fined for hate crime after filming pugs Nazi salutes 
2613,BBCTech,2018-04-23 07:35:31,South Korea turns off loudspeaker broadcasts into North 
2614,BBCTech,2018-04-23 07:35:31,TSB customers report online problems 
2615,BBCTech,2018-04-22 06:58:50,Jeremy Hunt threatens social media with new childprotection laws 
2616,BBCTech,2018-04-21 00:04:16,HQ Trivia The free app giving away thousands of pounds 
2617,BBCTech,2018-04-20 19:37:48,Russias Telegram ban failing 
2618,BBCTech,2018-04-20 16:59:45,GDPR Are you ready for EUs huge data privacy shakeup 
2619,BBCTech,2018-04-20 14:16:12,Ofcom seeks to scrap local TV rollout 
2620,BBCTech,2018-04-20 12:25:44,German supreme court rejects adblock challenge 
2621,BBCTech,2018-04-20 11:17:28,Facebook removes gay sex for rent posts 
2622,BBCTech,2018-04-20 11:00:19,Googles SMS replacement ready to launch 
2623,BBCTech,2018-04-20 10:15:21,Robot visits a pub for Westworld promotion and other news 
2624,BBCTech,2018-04-20 09:52:31,Minister ridiculed for saying ancient India invented internet 
2625,BBCTech,2018-04-20 09:47:25,Meet the robots that can pick and plant better than we can 
2626,BBCTech,2018-04-20 07:43:15,God of War Giving gaming new emotions 
2627,BBCTech,2018-04-19 23:13:46,Robo farmers 
2628,BBCTech,2018-04-19 12:12:54,Facebook to exclude billions from European privacy laws 
2629,BBCTech,2018-04-19 09:53:38,Ikeas TaskRabbit app back online after data breach 
2630,BBCTech,2018-04-19 09:53:38,TalkTalk and Vodafone top complaints chart again 
2631,BBCTech,2018-04-19 09:25:13,The helmet which gives firefighters Xray vision 
2632,BBCTech,2018-04-19 08:51:15,Nasas Tess Planethunting satellite lifts off 
2633,BBCTech,2018-04-18 23:49:28,Why Indias Paytm isnt afraid of WhatsApp 
2634,BBCTech,2018-04-18 16:43:12,NHS website defaced by hackers 
2635,BBCTech,2018-04-18 13:09:38,Will AI authors take over storytelling 
2636,BBCTech,2018-04-18 10:45:58,NHS ransomware attack response criticised 
2637,BBCTech,2018-04-18 10:18:11,Icelands Bitcoin heist suspect flees on PMs plane 
2638,BBCTech,2018-04-18 10:14:30,RT  This game lets you ride the cryptocurrency wave bitcoin  
2639,BBCTech,2018-04-18 09:40:47,Bitcoin peaks and falls become race tracks 
2640,BBCTech,2018-04-18 08:23:18,School warns over Roblox and Fortnite online games 
2641,BBCTech,2018-04-18 04:59:37,Facebook seeks facial recognition consent in EU and Canada 
2642,BBCTech,2018-04-17 23:06:42,Penis advert appeared in video game apps 
2643,BBCTech,2018-04-17 23:06:42,Googles 3D scans aim to preserve historical sites 
2644,BBCTech,2018-04-17 23:06:42,Steep rise in child abuse images online charity reports 
2645,BBCTech,2018-04-17 14:00:46,RT  Synthetics in medicine could help us tackle antimicrobial resistance kill cancer tumours and speed up drug discovery
2646,BBCTech,2018-04-17 13:59:01,Russias Telegram block hits web users 
2647,BBCTech,2018-04-17 13:43:47,Life of a meme 
2648,BBCTech,2018-04-17 13:04:27,Brexit  figure praised clever Nazi tactics 
2649,BBCTech,2018-04-17 11:43:01,TMobile fined over false ringtones 
2650,BBCTech,2018-04-17 10:35:50,Lazy hackers turn to automated attack tools 
2651,BBCTech,2018-04-17 10:33:03,Ikea app TaskRabbit reveals security breach 
2652,BBCTech,2018-04-17 10:12:49,Will technology destroy our democracy 
2653,BBCTech,2018-04-17 08:10:33,Netflix overseas sales set to overtake US 
2654,BBCTech,2018-04-17 07:41:57,Singapore uncovers hightech exam cheating plot 
2655,BBCTech,2018-04-17 03:38:13,Facebook facial recognition faces classaction suit 
2656,BBCTech,2018-04-16 23:56:40,Ninjas and nanobots 
2657,BBCTech,2018-04-16 16:42:07,Russia accused of global net hack attacks 
2658,BBCTech,2018-04-16 15:10:27,Chinas ZTE poses risk to UK security 
2659,BBCTech,2018-04-16 12:57:32,Facebook expels altright figurehead 
2660,BBCTech,2018-04-16 10:18:31,Chinas Sina Weibo backtracks from gay content ban after outrage 
2661,BBCTech,2018-04-16 08:33:21,WhatsApp photo drug dealer caught by groundbreaking work 
2662,BBCTech,2018-04-16 08:09:57,Lockhart in Foster Twitter photo bullying complaint 
2663,BBCTech,2018-04-16 08:06:57,Wetherspoon pub chain shuts its social media accounts 
2664,BBCTech,2018-04-16 07:41:03,First timer 
2665,BBCTech,2018-04-16 07:29:52,Artificial intelligence must be for common good 
2666,BBCTech,2018-04-16 07:18:57,Why I like my jobshare with robots 
2667,BBCTech,2018-04-14 02:08:12,TED 2018 The smart home that spied on its owner 
2668,BBCTech,2018-04-13 23:48:09,Girl gamers told to get back in the kitchen 
2669,BBCTech,2018-04-13 23:48:07,The design tricks that get you hooked on your phone 
2670,BBCTech,2018-04-13 21:39:29,TED 2018 Alphabet firms tools to combat extremism 
2671,BBCTech,2018-04-13 20:55:50,Coffee trends 
2672,BBCTech,2018-04-13 15:14:58,Donkey Kong champion loses title for using emulator 
2673,BBCTech,2018-04-13 13:40:45,Google loses right to be forgotten case 
2674,BBCTech,2018-04-13 13:04:32,Facebook too slow to deal with hack says singer 
2675,BBCTech,2018-04-13 11:31:12,Tesla removed from fatal car crash probe 
2676,BBCTech,2018-04-13 10:40:58,China man caught by facial recognition at pop concert 
2677,BBCTech,2018-04-13 09:05:12,Telegram chat app blocked in Russia 
2678,BBCTech,2018-04-13 08:55:44,Robotic surgeon at Broomfield Hospital Chelmsford 
2679,BBCTech,2018-04-13 07:33:31,RT  Hackers are bad guys right Wrong Its now a respected  and lucrative  profession Lets meet some of them
2680,BBCTech,2018-04-13 01:51:01,Hellblade Senuas Sacrifice wins five Bafta Games Awards 
2681,BBCTech,2018-04-12 23:14:01,The neverending VR escalator journey and other news 
2682,BBCTech,2018-04-12 23:14:00,How Chinas ridehailing giant plans to conquer the world 
2683,BBCTech,2018-04-12 23:14:00,TED 2018 Fake Obama video creator defends invention 
2684,BBCTech,2018-04-12 23:05:00,Bug hunters 
2685,BBCTech,2018-04-12 22:04:24,Hellblade Our big risk paid off with five Bafta wins 
2686,BBCTech,2018-04-12 22:01:11,What Remains of Edith Finch team speechless at Bafta win 
2687,BBCTech,2018-04-12 20:44:22,Nintendo celebrates Bafta hat trick 
2688,BBCTech,2018-04-12 19:03:00,RT   have just won the  award for Game Beyond Entertainment for its take on mental health and psychos
2689,BBCTech,2018-04-12 18:07:56,Bafta Games awards Hellblade leads the pack 
2690,BBCTech,2018-04-12 17:26:14,Fortnite video game faces server outage 
2691,BBCTech,2018-04-12 14:52:04,RT  The  Awards are tonight The most nominated game is all about psychosis Its creator says Hellblade is part
2692,BBCTech,2018-04-12 11:00:36,Racism allowed on Reddit says chief 
2693,BBCTech,2018-04-12 10:45:37,TED 2018 Technology reveals fear and other emotions 
2694,BBCTech,2018-04-12 10:39:15,Childrens Commissioner criticises Amazon over Child Sex Dolls 
2695,BBCTech,2018-04-12 10:30:06,Tim Schafer My games suffered bit rot 
2696,BBCTech,2018-04-12 09:18:34,UK carries out cyberattack on Islamic State 
2697,BBCTech,2018-04-12 08:03:28,RollsRoyce and Boeing invest in UK space engine 
2698,BBCTech,2018-04-12 04:32:17,Bafta Games Awards 2018 What you need to know 
2699,BBCTech,2018-04-11 23:05:46,5G What the superfast connection will mean for you 
2700,BBCTech,2018-04-11 18:59:57,RT  Was Facebooks Mark Zuckerberg completely honest during his second day at a US Congress hearing Technology reporter 
2701,BBCTech,2018-04-11 18:16:40,YouTube star prompts conversation about social anxiety 
2702,BBCTech,2018-04-11 15:31:36,Amazon patents voicesniffing algorithms 
2703,BBCTech,2018-04-11 14:24:17,Facebooks Zuckerberg faces second day of questions 
2704,BBCTech,2018-04-11 13:35:41,Great Western Railway accounts breached 
2705,BBCTech,2018-04-11 11:47:51,Warranty void stickers not valid in US says FTC 
2706,BBCTech,2018-04-11 11:41:57,TED 2018 Tech pioneer wants end to free net services 
2707,BBCTech,2018-04-11 10:53:56,Russian trolls posted fake Clinton porn 
2708,BBCTech,2018-04-11 09:54:11,Could a robot pip people picking peppers 
2709,BBCTech,2018-04-11 08:09:42,TED 2018 Ukrainian journalist fights fake news 
2710,BBCTech,2018-04-11 07:56:46,Facebook Mark Zuckerberg and US senators inspire endless memes 
2711,BBCTech,2018-04-11 07:19:20,Lady Leshurr YouTubes queen bee 
2712,BBCTech,2018-04-11 07:19:18,Map records UKs small ups and downs 
2713,BBCTech,2018-04-11 07:19:18,Amber Rudd earmarks 9m to fight dark web criminals 
2714,BBCTech,2018-04-11 00:54:49,Key moments from Zuckerberg hearing 
