,User,Date,Tweets
71,BBCTech,2019-10-30 18:02:41,DeepMind AI achieves Grandmaster status at Starcraft 2 
72,BBCTech,2019-10-30 14:10:17,Microsofts GitHub blocks Catalan protest app 
73,BBCTech,2019-10-30 12:17:00,Amazons push for Prime signup misleading says ASA 
74,BBCTech,2019-10-30 10:05:38,Facebook agrees to pay Cambridge Analytica fine to UK 
75,BBCTech,2019-10-29 19:21:01,Currys PC World customers scammed via eBay 
76,BBCTech,2019-10-29 16:09:12,RT  LISTEN How dangerous are deepfakes In an extended radio report I look at how malicious videos could become a threat a
77,BBCTech,2019-10-29 13:39:07,Call of Duty faces Russian backlash over Highway of Death 
78,BBCTech,2019-10-28 18:29:08,Make or break moment for 5G 
79,BBCTech,2019-10-28 17:27:56,Georgia hit by massive cyberattack 
80,BBCTech,2019-10-28 16:16:27,Fitbit shares halted on Google takeover report 
81,BBCTech,2019-10-28 14:43:17,Cara Delevingne space selfie not meant for space 
82,BBCTech,2019-10-28 12:28:25,iPhone 5 users risk losing internet access 
83,BBCTech,2019-10-28 08:47:13,RT  Is this game over for catfish Gay dating app Hornet is going to verify members using algorithms My exclusive for BBC Ne
84,BBCTech,2019-10-28 06:11:58,Molly Russell Instagram extends selfharm ban to drawings 
85,BBCTech,2019-10-28 00:08:40,Why do gay apps struggle to stop catfish 
86,BBCTech,2019-10-26 03:13:53,Microsoft beats Amazon to Pentagons 10bn Jedi contract 
87,BBCTech,2019-10-25 23:51:43,How a social network could save democracy from deadlock 
88,BBCTech,2019-10-25 16:21:02,Gamer buys Fallout 76 addon domain to criticise Bethesda 
89,BBCTech,2019-10-25 15:44:49,Tech Tent Shutting down the software scammers 
90,BBCTech,2019-10-24 23:25:20,Why Terminator Dark Fate is sending a shudder through AI labs 
91,BBCTech,2019-10-24 23:22:52,Transgender people treated inhumanely online 
92,BBCTech,2019-10-24 23:20:24,Call of Duty Modern Warfare arrives amid China controversy 
93,BBCTech,2019-10-24 12:44:24,RBS pulls Samsung Galaxy S10 app over security flaw 
94,BBCTech,2019-10-23 17:28:04,Facebooks Zuckerberg grilled over Libra currency plan 
95,BBCTech,2019-10-23 16:15:40,RT  BBC News is now available via Tor in a bid to thwart censorship attempts   
96,BBCTech,2019-10-23 16:08:25,BBC News launches dark web Tor mirror 
97,BBCTech,2019-10-23 15:54:31,WWE 2K20 Fans slam game over glitches and bugs 
98,BBCTech,2019-10-23 11:24:50,RT  Alexa  give me the  headlinesToday the BBC is launching the UKs first interactive voice news service to help
99,BBCTech,2019-10-23 10:45:38,Instagram bans cosmetic surgery filters 
100,BBCTech,2019-10-23 06:08:14,Facebooks partners yet to commit money to Libra 
101,BBCTech,2019-10-22 23:19:07,Katie Price Lauren Goodger and Georgia Harrison Instagram posts banned 
102,BBCTech,2019-10-22 14:53:15,Sensitive US Army data exposed by online leak 
103,BBCTech,2019-10-22 14:25:44,Cloudflare embroiled in child abuse row 
104,BBCTech,2019-10-22 11:46:32,TikTok used by Islamic State to spread propaganda videos 
105,BBCTech,2019-10-21 21:04:57,Facebook reveals preparations for UK election 
106,BBCTech,2019-10-21 15:58:57,Amazon Echo and Google Home owners spied on by apps 
107,BBCTech,2019-10-21 13:37:26,Phone case created out of artificial skin 
108,BBCTech,2019-10-21 13:16:11,League of Legends admits censoring error 
109,BBCTech,2019-10-21 04:03:07,Russian hackers cloak attacks using Iranian group 
110,BBCTech,2019-10-18 16:29:40,Tech Tent Do we need gadget etiquette lessons 
111,BBCTech,2019-10-17 23:10:26,Banning outofhours email could harm employee wellbeing 
112,BBCTech,2019-10-17 18:01:18,Facebook chief rules out banning political adverts 
113,BBCTech,2019-10-17 15:37:16,Google Pixel 4 Face Unlock works if eyes are shut 
114,BBCTech,2019-10-17 13:38:56,Google and BBC scrap VR projects 
115,BBCTech,2019-10-17 08:55:51,Any fingerprint unlocks Galaxy S10 Samsung warns 
116,BBCTech,2019-10-17 08:09:30,Three investigating loss of phone services 
117,BBCTech,2019-10-17 00:52:24,O2 launches 5G network in five UK cities and Slough 
118,BBCTech,2019-10-16 23:03:46,Netflix feels the pressure as competitors circle 
119,BBCTech,2019-10-16 14:35:59,Government drops controversial porn blocker plan 
120,BBCTech,2019-10-16 14:19:21,Sextortion botnet spreads 30000 emails an hour 
121,BBCTech,2019-10-16 13:00:57,Twitter tweaks rules after calls to ban Trump 
122,BBCTech,2019-10-16 11:00:32,Unmanned ship to go on 400yearold journey across the Atlantic 
123,BBCTech,2019-10-16 09:46:50,Germany will not bar Huawei from its 5G networks 
124,BBCTech,2019-10-15 23:03:41,Send nudes Boohoo ad banned after complaint 
125,BBCTech,2019-10-15 21:47:58,Robot hand solves Rubiks cube but not the grand challenge 
126,BBCTech,2019-10-15 15:11:00,Google chief Id warn house guests about my smart speakers 
127,BBCTech,2019-10-15 15:08:28,Pixel 4 seeks to reclaim lowlight photography crown for Google 
128,BBCTech,2019-10-15 13:33:12,Deletefacebook trends after Zuckerberg backlash 
129,BBCTech,2019-10-15 12:42:46,Microsoft to use AI to filter game chat 
130,BBCTech,2019-10-15 12:28:57,YouTube regrets Anecdotal claims of damaged users 
131,BBCTech,2019-10-15 09:28:39,HarleyDavidson puts the brakes on electric bike 
132,BBCTech,2019-10-14 22:02:33,Facebook puts on brave face with Libra 
133,BBCTech,2019-10-14 15:03:48,Government dodges full fibre for all by 2025 pledge 
134,BBCTech,2019-10-14 14:15:44,Food writer Jack Monroe loses 5000 in phonenumber hijack 
135,BBCTech,2019-10-14 12:53:22,Chinas Study the Great Nation app enables spying via back door 
136,BBCTech,2019-10-11 20:32:34,Mastercard eBay and Stripe pull out of Facebooks Libra 
137,BBCTech,2019-10-11 16:23:30,Tech Tent China and US spar over games apps and AI 
138,BBCTech,2019-10-11 11:20:06,Sex workers clients exposed by Dutch hack attack 
139,BBCTech,2019-10-11 02:08:38,Few convinced by Apples case for Hong Kong app removal 
140,BBCTech,2019-10-10 14:08:22,Blizzard gamers complain they cannot boycott firm over China 
141,BBCTech,2019-10-10 09:57:54,Germany shooting 2200 people watched on Twitch 
142,BBCTech,2019-10-09 23:51:52,Google offers tool for cities to measure emissions 
143,BBCTech,2019-10-09 23:07:35,Liverpool is home to the chattiest mobile phone users 
144,BBCTech,2019-10-09 18:59:15,Passport facial recognition checks fail to work with dark skin 
145,BBCTech,2019-10-09 18:20:11,Russian trolls chief target was black US voters in 2016 
146,BBCTech,2019-10-09 11:46:32,Cookie monster eats data from Sesame Street store 
147,BBCTech,2019-10-09 10:57:47,Call of Duty breaks records despite Hong Kong backlash 
148,BBCTech,2019-10-08 23:14:26,Nodeal Brexit data  should firms worry 
149,BBCTech,2019-10-08 22:55:13,Twitter inadvertently used email addresses for ads 
150,BBCTech,2019-10-08 12:37:49,Could blacklisting Chinas AI champions backfire 
151,BBCTech,2019-10-08 12:16:48,Fortnitemaker settles lawsuit against cheatseller 
152,BBCTech,2019-10-08 11:49:07,Hearthstone gamer banned for Hong Kong protest 
153,BBCTech,2019-10-08 11:18:19,Adobe shuts down Photoshop in Venezuela 
154,BBCTech,2019-10-07 23:25:36,Femtech Right time wrong term 
155,BBCTech,2019-10-07 13:49:27,Deepfake videos double in nine months 
156,BBCTech,2019-10-07 12:58:36,Apple approves Hong Kong protest location app 
157,BBCTech,2019-10-07 12:17:00,Copycat coders create vulnerable apps 
158,BBCTech,2019-10-05 23:17:53,Facebook encryption Should governments be given keys to access our messages 
159,BBCTech,2019-10-05 09:20:23,Libra PayPal first to drop out of Facebook cryptocurrency 
160,BBCTech,2019-10-05 00:43:37,Blocking research with China would hurt Microsoft boss says 
161,BBCTech,2019-10-04 23:27:21,China and Taiwan clash over Wikipedia edits 
162,BBCTech,2019-10-04 16:36:08,Tech Tent should TikTok scare Facebook 
163,BBCTech,2019-10-04 12:21:55,Touchscreen typing speeds close in on keyboard rates 
164,BBCTech,2019-10-04 10:48:04,Met police admits it did not log face matches at Kings Cross 
165,BBCTech,2019-10-04 10:45:54,Fifa 20 error exposes players details 
166,BBCTech,2019-10-04 09:05:33,RT  Says A search of MPS records CRIMINT has identified that 7 images were shared between Camden Borough Police and Kings Cro
167,BBCTech,2019-10-04 09:03:21,RT  SCOOP Londons Met police force has told the Mayor it does not have records of sharing images for facial recognition use wi
168,BBCTech,2019-10-03 23:34:13,Facebook encryption threatens public safety says minister 
169,BBCTech,2019-10-03 15:37:43,RT  One of the odder stories Ive coveredBut its a pertinent point that mixedup data could have unintended consequences in t
170,BBCTech,2019-10-03 14:39:12,Google faces wingedmonkey privacy protest 
171,BBCTech,2019-10-03 11:15:09,Facebook can be ordered to remove posts worldwide 
172,BBCTech,2019-10-03 11:05:16,Apple bans Hong Kong protest location app 
173,BBCTech,2019-10-02 15:30:16,Microsoft bets on foldable though not bendable devices 
174,BBCTech,2019-10-02 13:00:29,Google tracking iPhone users case goes ahead 
175,BBCTech,2019-10-02 10:33:35,RT  The goose sits outside of human morality They arent causing trouble because its the right thing to do theyre doing
176,BBCTech,2019-10-02 09:58:45,US hospitals turn away patients as ransomware strikes 
177,BBCTech,2019-10-01 23:09:14,Why are so few women inventors named on patents 
178,BBCTech,2019-10-01 16:30:57,Leaked Zuckerberg audio You go to the mat and you fight 
179,BBCTech,2019-10-01 13:49:52,Email signature ruling cost seller 25000 
180,BBCTech,2019-10-01 13:01:51,GoPro Hero Black 8 targets vloggers with addon modules 
181,BBCTech,2019-10-01 11:35:38,Tiny needles help monitor antibiotic reactions 
182,BBCTech,2019-10-01 11:27:57,ExYahoo engineer hacked accounts seeking pornography 
183,BBCTech,2019-09-30 15:07:55,UK internet use peaks at 2100 on Wednesdays ONS says 
184,BBCTech,2019-09-30 14:31:47,Fullfibre broadband What is it and how does it work 
185,BBCTech,2019-09-30 14:29:28,5bn for full fibre  do the numbers add up 
186,BBCTech,2019-09-30 12:04:16,Southampton internet broadband speeds to be boosted 
187,BBCTech,2019-09-28 19:20:50,RT  I met some Parisians trying a novel business model to tackle food waste with a little help from tech developed in Macc
188,BBCTech,2019-09-28 17:25:06,RT  Spoofing emails The trickery costing businesses billions With hundreds of arrests earlier this month and a seemingly unstopp
189,BBCTech,2019-09-28 17:22:45,RT  Ive been trying out some augmented reality swimming goggles that track your swim 
190,BBCTech,2019-09-27 23:55:08,Spoofing emails The trickery costing businesses billions 
191,BBCTech,2019-09-27 16:09:52,Tech Tent Facebook has designs on your brain 
192,BBCTech,2019-09-27 11:07:32,Facebook to create VR world called Horizon 
193,BBCTech,2019-09-27 10:55:03,RT  Im building my Silicon Stoke dream  full video here  tech BBCWeAreStokeOnTrent video bus
194,BBCTech,2019-09-27 10:23:35,US uses Google Translate to vet refugees 
195,BBCTech,2019-09-26 12:40:58,Google makes deepfakes to fight deepfakes 
196,BBCTech,2019-09-26 12:00:57, and US regulators clash over fake accounts 
197,BBCTech,2019-09-26 10:09:33,Pornography one click away from young children 
198,BBCTech,2019-09-26 09:46:02,Heads up  why tech is in a race for your face 
199,BBCTech,2019-09-25 23:04:59,The mystery of the disappearing Cryptoqueen 
200,BBCTech,2019-09-25 19:45:19,RT  Alexa in glasses Alexa in a ring Alexa in earbuds Alexa in a glowing orb Amazon is pushing its smart assistant into a
201,BBCTech,2019-09-25 19:02:12,RT  Amazon has just unveiled a deluge of new devices Its determined to get Alexa everywhere But makers of compatible thirdpa
202,BBCTech,2019-09-25 17:55:48,Amazon Alexa gets Samuel L Jackson and other celebrity voices 
203,BBCTech,2019-09-25 13:02:02,Facebook will not factcheck politicians 
204,BBCTech,2019-09-25 11:42:53,TikTok censors references to Tiananmen and Tibet 
205,BBCTech,2019-09-25 11:28:20,Boston Dynamics robot dog Spot goes on sale 
206,BBCTech,2019-09-24 16:50:38,Notorious GandCrab hacker group returns from retirement 
207,BBCTech,2019-09-24 15:57:22,Facebook buys mindreading wristband firm CTRLLabs 
208,BBCTech,2019-09-24 12:02:37,Microsoft issues emergency patch for Explorer browser 
209,BBCTech,2019-09-24 10:11:00,Kik Messenger app to shut down 
210,BBCTech,2019-09-24 09:36:58,RT  For those asking how the Google right to be forgotten ruling will affect a postBrexit UK  thanks to  for the
211,BBCTech,2019-09-24 08:32:24,RT  BREAKING Google wins landmark right to be forgotten case This means right to be forgotten will not apply to searches made outsid
212,BBCTech,2019-09-24 07:54:24,Google wins landmark right to be forgotten case 
213,BBCTech,2019-09-23 18:50:22,Google launches Play Pass apps subscription package 
214,BBCTech,2019-09-23 15:59:10,Danielle Cohn Are teen influencers being exploited 
215,BBCTech,2019-09-23 12:55:49,Google seeks permission for staff to listen to Assistant recordings 
216,BBCTech,2019-09-23 11:03:58,YouTube Uturn after protests over verified status 
217,BBCTech,2019-09-23 08:22:43,Will Facebooks reputation over data privacy put people off its new smart home gadgets Our  sits down w 
218,BBCTech,2019-09-21 23:11:51,On the Record Andrew Boz Bosworth Facebooks hardware boss 
219,BBCTech,2019-09-20 23:55:14,What3words Lifesaving app divides opinion 
220,BBCTech,2019-09-20 20:37:27,Facebook suspends tens of thousands of apps 
221,BBCTech,2019-09-20 16:35:09,Tech Tent Can AI revolutionise health 
222,BBCTech,2019-09-20 15:03:15,RT  The cheat hackers ruining gaming for others I speak to a 17 year old about his underground business thats making 1500 a w
223,BBCTech,2019-09-20 11:53:09,YouTube stars rattled by verification changes 
224,BBCTech,2019-09-20 11:20:55,Hackers get chance to target US satellite 
225,BBCTech,2019-09-19 23:16:40,Tech entrepreneurs call for more government regulation 
226,BBCTech,2019-09-19 16:18:00,Amazons Jeff Bezos promises climatechange action 
227,BBCTech,2019-09-19 14:06:01,Huaweis Mate 30 phones lack Google services 
228,BBCTech,2019-09-19 10:44:55,Huawei Microsoft president seeks resolution to tech ban 
229,BBCTech,2019-09-19 00:34:53, still duping customers says watchdog 
230,BBCTech,2019-09-18 22:36:18,Instagram clamps down on diet and cosmetic surgery posts 
231,BBCTech,2019-09-18 13:01:33,Google swallows DeepMind Health 
232,BBCTech,2019-09-18 10:01:31,New Twitter algorithms aim to stamp out trolling 
233,BBCTech,2019-09-18 04:52:04,Live facial recognition surveillance must stop 
234,BBCTech,2019-09-17 23:04:37,BBC launches digital wellbeing Own It app for children 
235,BBCTech,2019-09-17 20:02:17,Facebook unveils its supreme court plan 
236,BBCTech,2019-09-17 17:03:04,Facebook to use police video to recognise shooters 
237,BBCTech,2019-09-17 16:38:21,Racist AI art warns against bad training data 
238,BBCTech,2019-09-17 15:52:31,Gatwick Airport commits to facial recognition tech at boarding 
239,BBCTech,2019-09-17 15:24:52,Amazon Echo screen flicker angers owners 
240,BBCTech,2019-09-17 14:53:47,HTC bets on former Orange executive to boost sales 
241,BBCTech,2019-09-17 12:40:15,UKs fullfibre broadband coverage rises to 8 says Ofcom 
242,BBCTech,2019-09-17 11:11:27,Electric car owners to choose engine sounds 
243,BBCTech,2019-09-16 17:21:03,Police officers raise concerns about biased AI tools 
244,BBCTech,2019-09-16 13:11:07,Muslim website defends Home Office funding 
245,BBCTech,2019-09-16 11:17:52,Data on almost every Ecuadorean citizen leaked 
246,BBCTech,2019-09-16 08:25:31,RT  Now heres a neat idea  a virtual card that stops you being charged for a service at the end of the free trial period But how lo
247,BBCTech,2019-09-16 07:11:38,App that cancels subscriptions launches in UK 
248,BBCTech,2019-09-15 21:09:33,RT  How virtualreality is helping people with dementia ICYMI Full report  mojo VR tech dement
249,BBCTech,2019-09-14 23:17:44,On the Record TaskRabbits Stacy BrownPhilpot 
250,BBCTech,2019-09-13 23:47:14,The hobbyists competing to make AI human 
251,BBCTech,2019-09-13 14:24:46,Russian activist saves data from police with drone 
252,BBCTech,2019-09-13 11:28:25,Google to remind staff they can complain about work 
253,BBCTech,2019-09-13 10:34:37,Instagram apologises after censoring London fishmonger 
254,BBCTech,2019-09-13 09:40:09,RT  Bill relives his rocknroll years thanks to virtual reality One of the most moving moments Ive had the privilege to f
255,BBCTech,2019-09-12 17:29:10,Data watchdog questions collection of publics  data 
256,BBCTech,2019-09-12 13:39:49,Huawei chief offers to share 5G knowhow for a fee 
257,BBCTech,2019-09-12 12:45:07,Phone subscription firm Veoo fined 600000 
258,BBCTech,2019-09-12 12:36:45,Googles smartcity plans tech for techs sake 
259,BBCTech,2019-09-12 12:25:50,Arrests in 10 countries over moneytransfer scams 
260,BBCTech,2019-09-12 00:56:22,Uber says gig economy law will not hurt business 
261,BBCTech,2019-09-11 23:38:39,Ban children from gambling in games MPs say 
262,BBCTech,2019-09-11 15:58:50,McDonalds to transform its drivethroughs with AI 
263,BBCTech,2019-09-11 12:25:11,Sony shocks gamers with Playstation revelation 
264,BBCTech,2019-09-11 09:14:35,Apples iPhone 11 Pro triggering fear of holes 
265,BBCTech,2019-09-10 23:40:43,Deliveroo TV advert banned for being misleading 
266,BBCTech,2019-09-10 22:49:43,RT  My handson with the new iPhones including slofie mode sorry 
267,BBCTech,2019-09-10 18:18:19,RT  But heres the iPhone 11 Pro with those rumoured three cameras 
268,BBCTech,2019-09-10 17:58:33,Apple unveils iPhone 11 and alwayson Watch 
269,BBCTech,2019-09-10 17:36:31,RT  Apple Watch now Theyre launching a few new health studies  on hearing womens health and heart health
270,BBCTech,2019-09-10 16:55:19,RT  Our full coverage will be over at    and Mark Twitterless Ward doing the real work back in
271,BBCTech,2019-09-10 16:53:49,RT  In position for AppleEvent 2019 Theres not a huge level of expectation here but thats not to say Apple wont have some
272,BBCTech,2019-09-10 14:19:22,Sainsburys reinstalls tills in tillfree store 
273,BBCTech,2019-09-10 13:44:36,Musicians call for facial recognition ban at gigs 
274,BBCTech,2019-09-10 11:44:58,Sex lives of app users shared with Facebook 
275,BBCTech,2019-09-10 04:51:55,Trumps tariffs puts Apples golden goose at risk 
276,BBCTech,2019-09-09 23:11:17,Brain hack devices must be scrutinised say top scientists 
277,BBCTech,2019-09-09 12:42:30,Apple responds to iPhone factory criticism 
278,BBCTech,2019-09-09 11:58:52,eBay investigates toplesswoman icon swap error 
279,BBCTech,2019-09-09 11:40:25,Russia complains about Facebook and Google election ads 
280,BBCTech,2019-09-09 08:43:56,Almost onefifth of Britons do not use internet 
281,BBCTech,2019-09-07 00:00:23,Fake news BBC and tech firms join forces to fight disinformation 
282,BBCTech,2019-09-06 22:38:00,Apple angry at Google hits back at hack claims 
283,BBCTech,2019-09-06 18:02:00,RT  Software that can detect and delete unsolicited penis pictures sent in Twitter DMs is being developed by researchers 
284,BBCTech,2019-09-06 17:37:13,Unsolicited nudes detected and deleted by AI 
285,BBCTech,2019-09-06 17:31:39,RT  Apple defends itself on the iOS hack publicised by Google last week Says it was narrow and only lasted two months It was
286,BBCTech,2019-09-06 15:25:21,RT  The total number is closer to 2000 people Two separate emails were sent with about 900 people CCed in on each one the c
287,BBCTech,2019-09-06 14:50:42,RT  A London gender identity clinic has mistakenly exposed details of more than 900 people on one of its mailing lists 
288,BBCTech,2019-09-06 14:43:06,Gender identity clinic leaks patient list 
289,BBCTech,2019-09-06 13:28:19,Facebook to face fresh antitrust investigation 
290,BBCTech,2019-09-06 10:57:45,Facebook puts 10m into effort to spot deep fake videos 
291,BBCTech,2019-09-06 10:49:43,RT  This article has been updated to include the fact the British Transport Police now acknowledges it provided images of convi
292,BBCTech,2019-09-05 23:50:22,Pornhub owners profit from revenge porn 
293,BBCTech,2019-09-05 17:38:36,Googles secret web tracking pages explained 
294,BBCTech,2019-09-05 13:03:46,Samsung Galaxy Fold UK launch date revealed 
295,BBCTech,2019-09-05 12:38:07,Facebook confirms millions of phone numbers exposed 
296,BBCTech,2019-09-05 12:30:56,Yahoo email fault hits BT Sky and TalkTalk customers 
297,BBCTech,2019-09-05 12:10:07,Tesla Autopilot design led to crash 
298,BBCTech,2019-09-05 11:30:32,Trolls cause shutdown of official Jeremy Renner app 
299,BBCTech,2019-09-05 00:32:51,Why phones that secretly listen to us are a myth 
300,BBCTech,2019-09-04 18:43:02,Met Police gave images for Kings Cross facial recognition test 
301,BBCTech,2019-09-04 16:38:06,Amazon TVs to be sold by Currys PC World in UK 
302,BBCTech,2019-09-04 15:00:17,Mentalhealth information sold to advertisers 
303,BBCTech,2019-09-04 13:34:48,YouTube fined 170m in US over childrens privacy breaches 
304,BBCTech,2019-09-04 11:12:40,Brexit Slouching Jacob ReesMogg lampooned in memes 
305,BBCTech,2019-09-04 11:08:14,Deepfake app causes fraud and privacy fears in China 
306,BBCTech,2019-09-03 16:41:50,Teletext Holidays exposed customer calls 
307,BBCTech,2019-09-03 13:09:19,Facebook hints at hiding likes 
308,BBCTech,2019-09-03 11:56:24,Kings Cross facialrecognition plans revealed by letter 
309,BBCTech,2019-09-03 11:42:29,Hong Kong protesters using Bluetooth Bridgefy app 
310,BBCTech,2019-09-02 18:23:20,RT  The Kings Cross developers say the facial recognition was  used to help the Metropolitan and British Transport Police Spokesme
311,BBCTech,2019-09-02 17:51:17,Kings Cross Facial recognition last used in 2018 
312,BBCTech,2019-09-02 13:34:36,Ku Klux Klan donation account suspended by PayPal 
313,BBCTech,2019-09-02 12:23:53,Minecraft players to be helped by AI assistant 
314,BBCTech,2019-08-30 20:16:01,Twitters Jack Dorsey has own account hacked 
315,BBCTech,2019-08-30 11:33:04,YouTube restores farright channels after appeal 
316,BBCTech,2019-08-30 11:07:53,Eight men facing charges over illegal streaming sites 
317,BBCTech,2019-08-30 03:07:31,Google finds indiscriminate iPhone attack lasting years 
318,BBCTech,2019-08-29 23:07:42,Half of parents want mobile phones banned in schools 
319,BBCTech,2019-08-29 13:38:55,Antigroping stamp lets victims mark assailants 
320,BBCTech,2019-08-29 11:12:43,Elon Musk and Jack Ma disagree about AIs threat 
321,BBCTech,2019-08-29 07:52:53,Huaweis next phone wont have Google apps 
322,BBCTech,2019-08-28 17:28:21,Facebook tightens rules amid 2020 US election fears 
323,BBCTech,2019-08-28 16:08:16,US still to grant any Huawei trade licences 
324,BBCTech,2019-08-28 15:56:57,Apple sorry that workers listened to Siri voice recordings 
325,BBCTech,2019-08-28 15:50:19,Gaming faces its MeToo moment 
326,BBCTech,2019-08-28 15:10:41,RT  Ive been to check out the Selfie Factory  
327,BBCTech,2019-08-28 11:05:24,Android CamScanner PDF app sent malware to phones 
328,BBCTech,2019-08-28 05:05:49,Want full fibre Head to the Hebrides 
329,BBCTech,2019-08-27 17:35:02,Google faces EU investigation over jobsearch tool 
330,BBCTech,2019-08-27 17:14:34,Facial recognition School ID checks lead to GDPR fine 
331,BBCTech,2019-08-27 16:28:56,Nato Cyberattack on one nation is attack on all 
332,BBCTech,2019-08-27 14:11:05,iPhone could face sales ban in patent battle 
333,BBCTech,2019-08-27 12:43:19,RT  Scalextric for grownups How driverless racing cars are helping to make autonomous vehicles safer for us all
334,BBCTech,2019-08-27 11:37:50,RT   The new Technology of Business editor will be   the section is in safe hands 
335,BBCTech,2019-08-27 11:02:41,RT  Dear Twitterati its my last week at the BBC after seven years in online news more than four as Technology of Business
336,BBCTech,2019-08-27 08:35:40,BBC to launch digital voice assistant next year 
337,BBCTech,2019-08-27 07:54:55,Huawei UK to make 5G decision by the autumn 
338,BBCTech,2019-08-27 00:06:28,Dangerous AI offers to write fake news 
339,BBCTech,2019-08-26 16:37:23,Facial recognition specialist Megvii plans share sale 
340,BBCTech,2019-08-26 12:11:24,Dota 2 win makes N0tail the topawarded esports star 
341,BBCTech,2019-08-26 05:46:29,World of Warcraft Classic Hit game goes back to basics 
342,BBCTech,2019-08-24 23:18:12,Instagram influencers Have we stopped believing 
343,BBCTech,2019-08-23 23:29:37,Big Tech must give up its awkward secret humans 
344,BBCTech,2019-08-23 09:48:52,Tesla and Walmart address solar panel fire issues 
345,BBCTech,2019-08-22 22:45:43,YouTube shuts accounts linked to Hong Kong disinformation 
346,BBCTech,2019-08-22 14:40:55,Why are pupils switching off from computing GCSE 
347,BBCTech,2019-08-22 13:59:08,Android ditches desserts as Q becomes 10 
348,BBCTech,2019-08-22 13:58:59,RT  The new version of Android will be called Android 10 as Google ditches its desserts  
349,BBCTech,2019-08-22 13:24:38,Spotify sued over billions of Eminem streams 
350,BBCTech,2019-08-22 13:20:04,Microsoft halts listening in to Xbox gamers 
351,BBCTech,2019-08-22 13:08:37,Fake news reinforced by false memories 
352,BBCTech,2019-08-22 11:37:17,Apple Card can be damaged by wallets and jeans 
353,BBCTech,2019-08-21 21:56:04,Google Deepminds cofounder goes on leave 
354,BBCTech,2019-08-21 18:52:26,Robot battles wrongly banned for animal cruelty 
355,BBCTech,2019-08-21 13:11:19,Google and Mozilla move to stop Kazakhstan snooping 
356,BBCTech,2019-08-21 13:04:28,Australia using drones to spot crocodiles near swimmers 
357,BBCTech,2019-08-21 12:27:32,Biostar 2 Suprema plays down fingerprint leak reports 
358,BBCTech,2019-08-21 11:19:15,Tesla sued by Walmart over solar panel fires 
359,BBCTech,2019-08-20 23:50:27,Baffled student tells Twitter Im not a Chinese agent 
360,BBCTech,2019-08-20 17:39:03,Google sign language AI turns hand gestures into speech 
