,User,Date,Tweets
643,BBCTech,2019-06-09 21:04:09,RT  Keanu Reeves gets the biggest cheer of e3 so far Here to announce the release date of Cyberpunk 2077 as  April 16th 2020 A
644,BBCTech,2019-06-09 19:41:58,RT  How time flies were in place for Microsofts e3 press event rumours we may hear about their next console 
645,BBCTech,2019-06-07 16:02:34,Tech Tent Apple takes a stand on design 
646,BBCTech,2019-06-07 14:06:29,Cyberthieves turn to invisible net to set up attacks 
647,BBCTech,2019-06-07 11:43:06,Facebook stops apps being preinstalled on Huawei phones 
648,BBCTech,2019-06-07 10:45:27,Microsoft deletes massive face recognition database 
649,BBCTech,2019-06-07 08:52:11,RT  Sea creatures as warning systems  Fascinating investigation by  for BBC Technology of Business
650,BBCTech,2019-06-06 21:27:06,Protester confronts Jeff Bezos on stage 
651,BBCTech,2019-06-06 16:21:59,RT  Google has announced its launch date and games for Stadia Stadia  
652,BBCTech,2019-06-06 16:20:47,Google Stadia launch date and games revealed 
653,BBCTech,2019-06-06 11:28:18,Model aircraft pilots angry over drone laws 
654,BBCTech,2019-06-06 00:20:58,Heathrow scanners mean liquids can stay in bags 
655,BBCTech,2019-06-05 22:00:10,RT  Looking forward to speak at  which is about to start in Galway Ireland Ill be talking about how smartph
656,BBCTech,2019-06-05 18:44:47,Amazon to deliver by drone with months 
657,BBCTech,2019-06-05 16:57:21,Zuckerberg classmate launches attack in front of MPs 
658,BBCTech,2019-06-05 11:28:30,YouTube Antigay slurs dont break rules 
659,BBCTech,2019-06-04 16:22:53,RT  A little trip down memory lane how is it 20 years since the launch of Napster
660,BBCTech,2019-06-04 14:40:56,Apples services disrupted for some 
661,BBCTech,2019-06-04 14:24:46,A brief history of Apples iTunes 
662,BBCTech,2019-06-04 11:32:54,Google Facebook Apple Amazon face US antitrust probe 
663,BBCTech,2019-06-04 09:07:41,RT  Given all the technology we have at our disposal today Im still at a loss as to how this happens so often to be honest
664,BBCTech,2019-06-03 19:09:23,Apple dissolves iTunes into new apps 
665,BBCTech,2019-06-03 10:31:15,YouTuber faces jail for prank on homeless man 
666,BBCTech,2019-06-03 08:05:04,Dark net drug sales on the rise in England 
667,BBCTech,2019-06-03 07:54:15,RT  More chunky fines could be coming Big Techs way as data regulators limber up  
668,BBCTech,2019-06-02 13:30:18,RT  Seacooled air conditioning rats poisoned by drones mosquito sterilisation programs and 3D predictive modelsjust so
669,BBCTech,2019-05-31 16:28:30,Tech Tent Why is 5G data capped 
670,BBCTech,2019-05-31 11:31:09,Dating app scammers spotted by AI 
671,BBCTech,2019-05-31 10:00:50,North Face apologises over Wikipedia hack 
672,BBCTech,2019-05-31 09:48:49,RT  Youve heard  on the show today hes in the big seat presenting the programme for the first time Hell be joi
673,BBCTech,2019-05-31 09:00:06,Facebooks Mark Zuckerberg survives leadership vote 
674,BBCTech,2019-05-30 15:47:36,Some personal news here from our Rory  
675,BBCTech,2019-05-30 15:11:08,Google and Apple criticise GCHQ eavesdropping idea 
676,BBCTech,2019-05-30 14:08:46,RT  Broadcasting from Covent Garden over 5G 
677,BBCTech,2019-05-30 13:07:39,RT  Been broadcasting live on the  channel today via superfast 5G mobile internet 5G 
678,BBCTech,2019-05-30 13:06:17,RT  Do you have any questions on what the new 5G network could mean for you Well be answering a selection on the BBC
679,BBCTech,2019-05-30 13:06:14,RT  Please send me your questions on the new 5G network for our technology corr  Chris Fox 
680,BBCTech,2019-05-30 09:51:50,RT  EE launched its 5G mobile network last night by sending Stormzy down the Thames on a boat  
681,BBCTech,2019-05-30 09:17:13,5G EE launches UKs nextgeneration mobile network 
682,BBCTech,2019-05-30 07:02:12,RT  Preparing for the first live TV broadcast over a 5G network 
683,BBCTech,2019-05-29 23:24:41,Roblox I thought he was playing an innocent game 
684,BBCTech,2019-05-29 23:22:23,UK parking space data offered up to app developers 
685,BBCTech,2019-05-29 14:27:51,Demo found written on South Sudan in Google Maps 
686,BBCTech,2019-05-29 08:59:28,Malwareridden laptop artwork sold for 13m 
687,BBCTech,2019-05-29 07:08:05,Would you recognise yourself from your data 
688,BBCTech,2019-05-28 12:34:20,US Navy wants 350 billion social media posts 
689,BBCTech,2019-05-28 12:20:18,RT  What was all the fuss about GDPR some might wonder But data protection authorities across Europe are only just getting
690,BBCTech,2019-05-27 23:16:08,The tablet computer pulled by donkey 
691,BBCTech,2019-05-27 14:39:28,Baltimore ransomware attack NSA faces questions 
692,BBCTech,2019-05-27 11:47:57,Amazon defeated Rekognition revolt by a large margin 
693,BBCTech,2019-05-27 07:20:55,The ethical hackers taking the bugs to the bank 
694,BBCTech,2019-05-25 02:36:47,Four times more data breaches logged in UK 
695,BBCTech,2019-05-24 23:09:11,Doctored Pelosi clips show misinformation still has a home on Facebook 
696,BBCTech,2019-05-24 16:18:05,Is Huawei in retreat 
697,BBCTech,2019-05-24 11:27:19,Mona Lisa brought to life with deepfake AI 
698,BBCTech,2019-05-24 10:21:32,Google thwarts Baltimore ransomware fightback 
699,BBCTech,2019-05-24 07:39:44,RT  The beauty industry is spending billions developing new technologies from UV light detectors to personalised makeup pla
700,BBCTech,2019-05-23 16:16:24,Facebook Another three billion fake profiles culled 
701,BBCTech,2019-05-23 11:16:06,DJI drones to come with plane detection 
702,BBCTech,2019-05-23 10:46:02,Nintendo removes mobile games in Belgium 
703,BBCTech,2019-05-22 17:04:32,Google ad platform to face regulator scrutiny 
704,BBCTech,2019-05-22 13:46:04,Apple to warn iPhone users about update impact 
705,BBCTech,2019-05-22 13:09:32,Would you pay 1m for a laptop full of malware 
706,BBCTech,2019-05-22 12:53:24,EA shows off its nextgeneration hair 
707,BBCTech,2019-05-22 09:36:09,RT  An exclusive from   UK chip designer ARM has sent a memo to its staff telling them to suspend business with Huaw
708,BBCTech,2019-05-22 09:25:10,Huawei ARM memo tells staff to stop working with Chinas tech giant 
709,BBCTech,2019-05-22 09:02:06,EE to launch UKs first 5G service in May 
710,BBCTech,2019-05-22 08:37:47,RT  EE offering 5G to preorder from today  in 6 cities 16 by end of year 
711,BBCTech,2019-05-22 08:37:30,RT  Big news   to launch 5G May 30th scooping Vodafone which launches early July And will also be using Huawei equipment
712,BBCTech,2019-05-21 23:15:31,Amazon set for facial recognition revolt 
713,BBCTech,2019-05-21 17:17:59,Bleach peddled as miracle autism cure on YouTube 
714,BBCTech,2019-05-21 15:10:11,Femalevoice AI reinforces bias says UN report 
715,BBCTech,2019-05-21 14:30:33,Google changes policy on abortion advertising 
716,BBCTech,2019-05-21 12:49:20,US warns of threat from Chinese drone companies 
717,BBCTech,2019-05-21 08:53:30,RT  Got to work on an egg  famous UK ad campaign from the 1950s and 60s Could a computer algorithm have come up with that
718,BBCTech,2019-05-21 06:02:44,European elections 2019 Facebook and Twitter under the spotlight 
719,BBCTech,2019-05-21 00:07:04,Microchips massive blow Huaweis vulnerability explained 
720,BBCTech,2019-05-20 12:20:58,Huaweis Android loss How it affects you 
721,BBCTech,2019-05-20 12:05:09,Warning over using augmented reality in precision tasks 
722,BBCTech,2019-05-20 11:26:15,Robots on the road  how close is our driverless future 
723,BBCTech,2019-05-17 23:32:55,The Google city that has angered Toronto 
724,BBCTech,2019-05-17 16:26:12,Tech Tent  whos spying on you 
725,BBCTech,2019-05-17 15:22:28,RT  A growing band of professionals is coming up with innovative ways to solve problems they come across at work 
726,BBCTech,2019-05-17 12:46:14,American man accused in 9m net address theft 
727,BBCTech,2019-05-17 10:37:20,Tesla Model 3 Autopilot engaged during fatal crash 
728,BBCTech,2019-05-16 19:58:31,Microsoft and Sony strike streaming games deal 
729,BBCTech,2019-05-16 15:18:39,Global education XPrize awards 10m 
730,BBCTech,2019-05-16 13:39:02,Driverless lorry allowed on public Swedish roads 
731,BBCTech,2019-05-16 12:02:22,GozNym cybercrime gang which stole millions busted 
732,BBCTech,2019-05-16 10:33:52,Global virus fear prompts update for old Windows 
733,BBCTech,2019-05-16 10:08:19,RT  OnThisDay 1996 Rory CellanJones was busy distracting the developers of a new game called Grand Theft Auto GTA didnt sh
734,BBCTech,2019-05-15 17:30:16,MPs ask Instagram chiefs about suicide poll 
735,BBCTech,2019-05-15 17:12:10,Tech giants pledge to limit online terror content 
736,BBCTech,2019-05-15 13:57:53,Eurovision stream interrupted by Tel Aviv bomb animation 
737,BBCTech,2019-05-15 13:33:03,WhatsApp hack Is any app or computer truly secure 
738,BBCTech,2019-05-15 13:01:17,DJI Osmo Action camera poses threat to GoPro 
739,BBCTech,2019-05-15 09:12:35,RT  Fascinating look at the role of robots in design and construction by my colleague Ben King Well be able to build things
740,BBCTech,2019-05-15 08:47:11,Intel Zombieload bug to slow data centre computers 
741,BBCTech,2019-05-15 06:12:44,Phone and internet users to get endofcontract alerts 
742,BBCTech,2019-05-15 02:58:10,Christchurch attacks May to call for curbs on internet terror 
743,BBCTech,2019-05-14 22:42:22,San Francisco is first US city to ban facial recognition 
744,BBCTech,2019-05-14 17:30:46,Wikipedia blocked in China in all languages 
745,BBCTech,2019-05-14 16:17:54,Security researchers find Cisco hardware vulnerabilities 
746,BBCTech,2019-05-14 09:54:59,Vodafone to launch 5G UK service in July 
747,BBCTech,2019-05-14 09:24:27,RT  One day you wont be able to differentiate between the real and the virtual How virtual and mixed reality is coming of
748,BBCTech,2019-05-13 23:52:02,WhatsApp discovers surveillance attack 
749,BBCTech,2019-05-13 20:48:38,ExGoogle boss defends multiple controversies 
750,BBCTech,2019-05-13 16:42:57,Apple faces customer lawsuit over app store 
751,BBCTech,2019-05-13 15:09:11,Android pioneer HTC stages retreat from China 
752,BBCTech,2019-05-13 13:38:45,Tech giants failing to protect children 
753,BBCTech,2019-05-13 10:51:37,Facial recognition tech should be dropped over race issues 
754,BBCTech,2019-05-11 03:08:23,Facebook sues analytics firm Rankwave over alleged data misuse 
755,BBCTech,2019-05-10 16:37:14,Tech Tent What is Ubers route to profit 
756,BBCTech,2019-05-10 15:36:11,Amazon stops selling toxic goods for children in US 
757,BBCTech,2019-05-10 10:58:18,Instagram blocks vaccine hoax hashtags 
758,BBCTech,2019-05-10 08:29:21,RT  The aviation industry must cut carbon emissions but air travel continues to rise in popularity around the world Can tec
759,BBCTech,2019-05-09 16:17:11,Facebook autogenerated extremist video 
760,BBCTech,2019-05-09 15:11:17,Data breaches a time bomb warns security report 
761,BBCTech,2019-05-09 11:27:54,Amazon sellers hit by extensive fraud campaign 
762,BBCTech,2019-05-09 11:19:07,Yolo Viral Snapchat app raises abuse concerns 
763,BBCTech,2019-05-09 11:16:48,Loot boxes should be banned says US senator 
764,BBCTech,2019-05-09 03:38:50,Silicon Valley nonsense Will Uber drivers be heard 
765,BBCTech,2019-05-08 17:13:07,CES 2019 Sex toy reawarded robotics prize 
766,BBCTech,2019-05-08 11:59:44,Amazon accused of failing pregnant workers 
767,BBCTech,2019-05-08 10:04:00,China replaces PUBG with patriotic game 
768,BBCTech,2019-05-08 09:08:46,Binance exchange hackers steal bitcoins worth 41m 
769,BBCTech,2019-05-08 06:54:45,RT  Google has announced the Pixel 3a and 3a XL phones which will launch with augmented reality Google Maps 
770,BBCTech,2019-05-07 23:15:38,Computing in schools in steep decline 
771,BBCTech,2019-05-07 18:11:04,Google reveals upgrades to search tool at IO conference 
772,BBCTech,2019-05-07 17:56:10,RT  Very impressive voice demo  Google is terrific at continuous conversations Show me my photos from Yellowstone follow
773,BBCTech,2019-05-07 11:29:56,Microsoft Word AI to improve writing 
774,BBCTech,2019-05-07 11:21:01,RT  Winter is coming  how tech startups are feeling the chill wind of trade wars and slowing economic growth
775,BBCTech,2019-05-06 13:02:28,Google ads promote firms charging extra for services 
776,BBCTech,2019-05-06 10:35:59,YouTuber Austin Jones gets 10 year prison sentence 
777,BBCTech,2019-05-04 02:29:11,Connecting my bird box camera to the web 
778,BBCTech,2019-05-03 15:53:51,Tech Tent Can YouTube fix its algorithms 
779,BBCTech,2019-05-03 10:00:10,Russia tightens grip on its national net 
780,BBCTech,2019-05-03 08:16:50,RT  Theres enough wind to meet all the worlds energy needs some studies suggest but its often too high for us to get at
781,BBCTech,2019-05-02 20:09:04,Facebook bans dangerous individuals 
782,BBCTech,2019-05-02 16:21:46,RT  Did you know the first Moon landing almost didnt happenHear from the people who prevented Apollo 11 from going bad
783,BBCTech,2019-05-02 15:08:08,Lifesaving kidney delivered by drone 
784,BBCTech,2019-05-02 12:03:35,Evoting by touchscreen trialled in local elections 
785,BBCTech,2019-05-02 09:11:50,Google to autodelete web tracking history 
786,BBCTech,2019-05-02 06:45:32,The growing threat to Mark Zuckerbergs power 
787,BBCTech,2019-05-01 17:05:29,Facebook and Twitter grilled over abuse faced by MPs 
788,BBCTech,2019-05-01 09:54:17,Phone and laptop searches at US border quadruple 
789,BBCTech,2019-04-30 23:10:11,Plan to secure internet of things with new law 
790,BBCTech,2019-04-30 18:56:32,RT  Familyfriendly robot company Anki set to close With thoughts from me on how consumer robots are struggling to win a place
791,BBCTech,2019-04-30 18:56:21,RT  Murmurs of disbelief as Facebook talks about its dating platform I dont think Ive ever heard a couple thousand people go
792,BBCTech,2019-04-30 18:19:13,Facebook boss reveals changes in response to criticism 
793,BBCTech,2019-04-30 15:21:47,Familyfriendly robot company Anki set to close 
794,BBCTech,2019-04-30 12:08:48,Samsung unveils TV that can switch to vertical mode 
795,BBCTech,2019-04-30 10:35:31,When will you next buy a mobile phone 
796,BBCTech,2019-04-30 09:16:00,TalkTalk service at bottom of Ofcom poll for third year running 
797,BBCTech,2019-04-30 08:51:17,RT  These are the topics ahead of Facebooks developer conference which starts Tuesday Anything missing 
798,BBCTech,2019-04-30 08:50:00,RT  For most Palestinians its the first time theyve encountered an Israeli other than at a checkpoint
799,BBCTech,2019-04-29 18:09:09,Minecraft player loses fiveyearlong game 
800,BBCTech,2019-04-29 11:01:57,Apple defends removing parental control apps 
801,BBCTech,2019-04-29 00:16:04,An algorithm wipes clean the criminal pasts of thousands 
802,BBCTech,2019-04-27 23:49:09,Jane Manchun Wong The woman scooping Silicon Valley 
803,BBCTech,2019-04-26 23:54:27,Fitness trackers add miles to your marathon 
804,BBCTech,2019-04-26 22:50:03,Elon Musk reaches deal over tweets 
805,BBCTech,2019-04-26 18:04:53,Extremist Google algorithms concern expolice chief 
806,BBCTech,2019-04-26 16:29:48,Tech Tent  Sri Lankas social media ban 
807,BBCTech,2019-04-26 14:07:43,Protests over plan to change domain pricing 
808,BBCTech,2019-04-26 11:21:11,Scooters hacked to play rude messages to riders 
809,BBCTech,2019-04-26 09:48:08,Apple recalls plugs in UK Hong Kong and Singapore 
810,BBCTech,2019-04-26 08:52:18,RT  How identifying air pollution hotspots could potentially save lives and help authorities pinpoint the worst perpetrators
811,BBCTech,2019-04-25 12:51:21,US Uber drivers plan 12hour shutdown over pay and conditions 
812,BBCTech,2019-04-25 11:11:04,RT  Zozo is closing down its US and European operations Sadly  and I could never get the Zozosuit to work 
813,BBCTech,2019-04-25 10:48:11,Failed Zozosuit hits company profits 
814,BBCTech,2019-04-24 19:35:44,NeoNazis Facebook account left active 
815,BBCTech,2019-04-24 16:35:58,Dick Barnes pioneer behind oldest working computer dies 
816,BBCTech,2019-04-24 13:19:37,Hate speech Facebook Twitter and YouTube told off by MPs 
817,BBCTech,2019-04-24 11:50:54,Huawei Why UK is at odds with its cyberallies 
818,BBCTech,2019-04-24 09:52:33,Microsoft Paint Fans rejoice as art app saved for now 
819,BBCTech,2019-04-24 00:00:40,Netherlands hosts most child sex abuse images 
820,BBCTech,2019-04-23 17:18:24,Google Wing drones approved for US home deliveries 
821,BBCTech,2019-04-23 17:02:33,Google retaliating against harassment protest organisers 
822,BBCTech,2019-04-23 17:00:17,Election interference is online harm MPs hear 
823,BBCTech,2019-04-23 12:38:22,Apple AI accused of leading to mans wrongful arrest 
824,BBCTech,2019-04-23 11:41:49,Sri Lanka attacks The ban on social media 
825,BBCTech,2019-04-23 10:02:28,RT  Would you pay big bucks for a work of art produced by an algorithm 
826,BBCTech,2019-04-22 17:59:25,RT  An alternative way to capture the way children grow up using your phone which Ive used for almost a decade 
827,BBCTech,2019-04-22 11:09:03,Samsung Galaxy Fold launch events delayed in China 
828,BBCTech,2019-04-22 10:15:15,TED 2019 How to kill a zombie rumour and fix Facebook 
829,BBCTech,2019-04-21 23:48:52,An alternative way to capture childhood on your phone 
830,BBCTech,2019-04-20 23:46:57,Millions using 123456 as password security study finds 
831,BBCTech,2019-04-20 00:20:21,TED 2019 The startups launching in space 
832,BBCTech,2019-04-19 21:46:57,Hacking hero Marcus Hutchins pleads guilty to US malware charges 
833,BBCTech,2019-04-19 16:43:34,RT  OnThisDay 1987 The process is very simple Sue Robbie demonstrated home video editing 80s style 
834,BBCTech,2019-04-19 14:22:28,Tech Tent Do we want our cities to be smart 
835,BBCTech,2019-04-18 16:34:47,Robot news presenter causes a stir on Russian TV 
836,BBCTech,2019-04-18 11:02:09,Facebook bans UK far right groups and leaders 
837,BBCTech,2019-04-18 08:13:19,Facebook scrapedemail contacts of 15 million users 
838,BBCTech,2019-04-17 22:59:17,TED 2019 The online campaign that ended a beard ban 
839,BBCTech,2019-04-17 21:14:53,Samsungs folding phone breaks for reviewers 
840,BBCTech,2019-04-17 15:04:41,TED 2019 Prize to online classes project causes controversy 
841,BBCTech,2019-04-17 14:32:28,Could Assassins Creed help rebuild NotreDame 
842,BBCTech,2019-04-17 13:33:59,Netflix to trial showing top 10 lists to UK users 
843,BBCTech,2019-04-17 11:35:01,UK to introduce porn agechecks in July 
844,BBCTech,2019-04-16 23:09:18,TED 2019 The 50 lab burger transforming food 
845,BBCTech,2019-04-16 23:06:55,Vodafone gigafast ad banned after Virgin Media complaint 
846,BBCTech,2019-04-16 18:00:25,TED 2019 Twitter boss offers to demote likes and follows 
847,BBCTech,2019-04-16 13:08:57,RT  Could tethered drones like this have helped French firefighters tackle the NotreDameCathedralFire 
848,BBCTech,2019-04-16 12:20:48,Game of Thrones Now TV glitch hits Apple TV owners 
849,BBCTech,2019-04-16 10:57:13,RT  Is education and negotiation more important than filtering technology when it comes to protecting our kids online
850,BBCTech,2019-04-16 08:42:55,Facebook challenged to give TED talk on political ads 
851,BBCTech,2019-04-16 06:56:03,RT  Heres my first handson with the Samsung Galaxy Fold GalaxyFold 
852,BBCTech,2019-04-15 13:25:38,Lyft removes faulty bikes from three US cities 
853,BBCTech,2019-04-15 13:23:21,Article 13 UK helps push through new EU copyright rules 
854,BBCTech,2019-04-15 11:26:58,Apple and Qualcomm square off in US court 
855,BBCTech,2019-04-15 09:38:14,Under18s face like and streaks bans on social media 
856,BBCTech,2019-04-15 08:27:47,TED 2019 10 years of ideas worth spreading 
857,BBCTech,2019-04-14 13:32:13,Facebook Instagram and WhatsApp suffer outages 
858,BBCTech,2019-04-12 19:24:28,RT  The city trying to save the planet with seven bags    See my full video for  here 
859,BBCTech,2019-04-12 15:56:34,Tech Tent Should we relax about screen time 
860,BBCTech,2019-04-12 15:40:13,You cheated not only the game but you became a meme 
861,BBCTech,2019-04-12 13:07:13,Internet Archive denies hosting terrorist content 
862,BBCTech,2019-04-12 11:45:18,Bounty pregnancy club fined 400000 over data handling 
863,BBCTech,2019-04-12 11:40:39,Wikileaks Document dumps that shook the world 
864,BBCTech,2019-04-12 07:34:10,RT  How much workplace surveillance is too much
865,BBCTech,2019-04-12 01:25:47,Its Disneys turn to launch a streaming service 
866,BBCTech,2019-04-11 22:09:06,RT  Disney will be global Hulu might be going global too  actively exploring
867,BBCTech,2019-04-11 22:09:02,RT  So  Disney will now offer three distinct services Disney family friendly ESPN sports Hulu staying just as it is
868,BBCTech,2019-04-11 13:28:21,Logan Paul unwise to do Alex Jones YouTube interview 
869,BBCTech,2019-04-11 11:43:00,RT  Amazon Apple and Google all employ staff who listen to customer voice recordings from their smart speakers and voice assis
870,BBCTech,2019-04-11 10:53:55,US lawmakers to probe algorithm bias 
871,BBCTech,2019-04-11 10:51:46,Smart speaker recordings reviewed by humans 
872,BBCTech,2019-04-10 11:18:19,Xiaomis founder Lei Jun receives 735m bonus 
873,BBCTech,2019-04-10 10:16:55,Google Wing launches first commercial drone delivery service 
874,BBCTech,2019-04-10 09:03:05,UK train passengers offered smart tickets 
875,BBCTech,2019-04-09 22:07:44,Facebook plans AI tool to respect the dead 
876,BBCTech,2019-04-09 18:09:39,Flickr adds photo theft detection tools 
877,BBCTech,2019-04-09 16:01:44,Lush steps away from social media in UK 
878,BBCTech,2019-04-09 14:26:25,Sony creates colossal 16K screen in Japan 
879,BBCTech,2019-04-09 11:32:40,Bitcoin mining ban considered by Chinas economic planner 
880,BBCTech,2019-04-08 20:17:07,Huawei wifi modules were pulled from Pakistan CCTV system 
881,BBCTech,2019-04-08 18:53:09,Panorama Can We Trust HuaweiOn  at 830pm tonight 
882,BBCTech,2019-04-08 14:24:04,RT  This just makes me think our 2019 predictions are all the more prescientand worrying 
883,BBCTech,2019-04-08 07:25:23,RT  The UK government has revealed its plans to tackle online harms including the spread of terrorist content cyberbulling
884,BBCTech,2019-04-07 23:09:08,Websites to be fined over online harms under new proposals 
885,BBCTech,2019-04-07 23:02:27,Huaweis shoddy work prompts talk of a Westminster ban 
886,BBCTech,2019-04-07 15:36:46,RT  Will  and Amazonian nations reach agreement about the use of the name or will ICANN have to reso
887,BBCTech,2019-04-05 16:11:19,Facebook hosts cybercrime marketplaces 
888,BBCTech,2019-04-05 15:39:44,Tech Tent Let the 5G battle commence 
889,BBCTech,2019-04-05 13:58:11,RT  Do website domain names have cultural significance Are they a matter of sovereignty Or should commercial interests hold
890,BBCTech,2019-04-05 13:00:28,Microsoft responds to female harassment claims 
891,BBCTech,2019-04-05 12:51:38,Teens not damaged by screen time study finds 
892,BBCTech,2019-04-05 11:40:31,Microsoft Sony and Nintendo quizzed over subscriptions 
893,BBCTech,2019-04-05 08:12:20,RT  How south American nations and a tech giant are doing battle over a name 
894,BBCTech,2019-04-04 23:04:16,Cyberattacks damage national infrastructure 
895,BBCTech,2019-04-04 18:14:12,Bafta Games awards God of War leads the pack 
896,BBCTech,2019-04-04 12:50:56,Computer virus alters cancer scan images 
897,BBCTech,2019-04-04 12:35:11,Fortnite Is Prince Harry right to want game banned 
898,BBCTech,2019-04-04 11:42:25,Facebook nodeal Brexit ads from same source 
899,BBCTech,2019-04-04 09:12:36,Data on 540 million Facebook users exposed 
900,BBCTech,2019-04-04 02:19:05,When this eBook store closes your books disappear too 
901,BBCTech,2019-04-03 13:37:44,Huawei laptop backdoor flaw raises concerns 
902,BBCTech,2019-04-03 10:48:27,Toyota to share hybrid vehicle secrets for free 
903,BBCTech,2019-04-03 10:46:02,Guardian to flag old news on social media 
904,BBCTech,2019-04-03 00:15:30,Crypto for care homes  really 
905,BBCTech,2019-04-02 12:35:40,Matter of factcheckers Is Facebook winning the fake news war 
906,BBCTech,2019-04-02 12:31:04,YouTube restricts Tommy Robinson channel 
907,BBCTech,2019-04-02 12:01:03,Study maps extensive Russian GPS spoofing 
908,BBCTech,2019-04-02 11:28:33,RT  Games industry in the UK keeps growing  now worth over 5 billion 
909,BBCTech,2019-04-02 11:28:18,RT  A top review of apps that can help with anxiety tested by autistic people Its AutismAwarenessDay Anxiety affects many o
910,BBCTech,2019-04-02 08:03:58,Sound now equal inside Royal Albert Hall 
911,BBCTech,2019-04-02 07:40:58,RT  Money laundering accounts for about 2tn  or 5 of global GDP  each year and only 1 of this is ever confiscated by th
912,BBCTech,2019-04-01 23:08:42,Google shuts failed social network Google 
913,BBCTech,2019-04-01 23:01:45,Revolut whistleblower had concerns over CEO conduct and compliance 
914,BBCTech,2019-04-01 14:56:39,UK to Zuckerberg show us youre sincere about regulation 
915,BBCTech,2019-04-01 11:58:44,Call Of Duty hoax caller Tyler Barriss jailed 
916,BBCTech,2019-04-01 10:55:44,PewDiePie loses YouTube crown to TSeries 
917,BBCTech,2019-04-01 09:00:41,Facebook to reveal News Feed algorithm secrets 
918,BBCTech,2019-03-30 10:20:44,Facebook to consider live video restrictions after NZ attacks 
919,BBCTech,2019-03-29 20:16:16,Apple abandons wireless charging product 
920,BBCTech,2019-03-29 17:58:21,Tech Tent Apple Lyft and feelgood tech 
921,BBCTech,2019-03-29 17:01:52,Russia police probe dark net murder case 
922,BBCTech,2019-03-29 14:09:57,RT  US senator Elizabeth Warren is talking tough about the tech giants but how easy would breaking them up really be And wh
923,BBCTech,2019-03-29 12:43:03,Facebook begins new EU political ads rules 
924,BBCTech,2019-03-29 12:20:32,NSA contractor pleads guilty to data theft 
925,BBCTech,2019-03-29 10:22:31,RT  Will mobile barber shops be a thing My latest feature for  london business More 
