,User,Date,Tweets
1495,BBCTech,2018-11-18 14:32:41,RT  Can startups do for nuclear fusion what SpaceX has done for rockets
1496,BBCTech,2018-11-16 17:20:49,Tech Tent Has Facebook reached peak crisis 
1497,BBCTech,2018-11-16 11:02:51,Award for wartime flight trainer returned to service 
1498,BBCTech,2018-11-16 00:38:31,Mark Zuckerberg missing in inaction 
1499,BBCTech,2018-11-16 00:07:01,How Amazon helped me transition to a woman 
1500,BBCTech,2018-11-15 18:14:09,Prince William criticises social media firms 
1501,BBCTech,2018-11-15 17:40:32,Googles Alphabet gives up on rescue robots 
1502,BBCTech,2018-11-15 14:26:34,Facebook leaks take their toll 
1503,BBCTech,2018-11-15 13:48:49,Facebook accused of dark PR tactics 
1504,BBCTech,2018-11-15 12:11:56,Japans cybersecurity minister has never used a computer 
1505,BBCTech,2018-11-15 00:10:59,MiSafes childtracking smartwatches are easy to hack 
1506,BBCTech,2018-11-14 19:14:39,Apple Stores to employ human trafficking victims 
1507,BBCTech,2018-11-14 13:04:31,Call of Duty swatting death prankster pleads guilty 
1508,BBCTech,2018-11-14 12:06:32,Google accused of trust demolition over health app 
1509,BBCTech,2018-11-14 11:05:25,Fake news Can teenagers spot it 
1510,BBCTech,2018-11-14 11:02:49,US asks London court to hand over two alleged hackers 
1511,BBCTech,2018-11-13 17:11:22,First 5G cities in UK named by EE 
1512,BBCTech,2018-11-13 12:34:22,Ugly mistake sends Google data to China 
1513,BBCTech,2018-11-13 11:28:20,Gross furry Pikachu divides Pokemon fans 
1514,BBCTech,2018-11-13 09:23:31,RT  No bees  no pollination  food shortages  starvation We REALLY need to find out exactly why their numbers are dwindlin
1515,BBCTech,2018-11-12 18:49:58,Car crash data thief unlucky to be jailed 
1516,BBCTech,2018-11-12 17:43:08,US overtakes China in top supercomputer list 
1517,BBCTech,2018-11-12 17:21:34,RT  Xiaomis 1 phone stunt has got it a lot of publicity but not all of its the desirable kind 
1518,BBCTech,2018-11-12 16:54:49,Xiaomi criticised for UK smartphone 1 flash sale 
1519,BBCTech,2018-11-12 13:49:22,Amazon asked to share Echo data in US murder case 
1520,BBCTech,2018-11-12 13:37:17,Steam bug allowed unlimited free downloads 
1521,BBCTech,2018-11-12 08:53:44,RT  Special thanks to  and  for speaking to us for this piece That said the real hero is Joni at BBC Washin
1522,BBCTech,2018-11-10 01:39:20,Meeting Kosovos clickbait merchants 
1523,BBCTech,2018-11-09 17:22:22,Tech Tent The taxi wars 
1524,BBCTech,2018-11-09 14:49:10,Man sent letter bomb to Bitcoin firm over password reset 
1525,BBCTech,2018-11-09 12:06:33,US man pleads guilty to game hacking charges 
1526,BBCTech,2018-11-09 10:06:57,Chinese headmaster fired over secret coin mining at school 
1527,BBCTech,2018-11-08 18:47:33,Harassment victims at Google gain more power 
1528,BBCTech,2018-11-08 18:23:25,Paypal stops handling payments for Tommy Robinson 
1529,BBCTech,2018-11-08 17:46:37,YouTube to label government and publicfunded clips 
1530,BBCTech,2018-11-08 16:03:13,Chinas Xiaomi enters UK with phones wristband and scooter 
1531,BBCTech,2018-11-08 12:34:00,Facebook delays mandatory political ad ID checks 
1532,BBCTech,2018-11-08 11:32:14,Chinas Xinhua agency unveils AI news presenter 
1533,BBCTech,2018-11-08 11:12:57,YouTube Uturn over Red Dead Redemption 2 suffragette clips 
1534,BBCTech,2018-11-08 08:57:25,RT  Thermal imaging drones can find people lost in the forest And 5G mobile will enable them to stream live video and acces
1535,BBCTech,2018-11-07 21:55:17,RT  After 5 years of talking about folding devices Samsung unveiled theirs at SDC18 
1536,BBCTech,2018-11-07 19:38:51,Red Dead 2 suffragette clips deleted by YouTube 
1537,BBCTech,2018-11-07 15:51:31,5G will let users ditch fixedline home broadband says Three 
1538,BBCTech,2018-11-07 13:43:49,League of Legends firm sued over workers sexism claims 
1539,BBCTech,2018-11-07 00:04:48,Relief at social networks as defences hold  for now 
1540,BBCTech,2018-11-06 18:15:46,HSBC bank confirms US data breach 
1541,BBCTech,2018-11-06 14:14:40,RT  Energysmart cities could feature special concrete that can store energy vertical turbines powered by passing traffic an
1542,BBCTech,2018-11-06 14:14:06,How can we stop being cyber idiots 
1543,BBCTech,2018-11-06 14:02:51,Facebook treated voters with disrespect over data collection 
1544,BBCTech,2018-11-06 13:00:53,ChristmasintheBahamas job ad overwhelms app 
1545,BBCTech,2018-11-06 12:14:39,Childrens screen time has little effect on sleep says study 
1546,BBCTech,2018-11-06 09:58:58,Bill Gates brandishes poo to showcase reinvented toilet tech 
1547,BBCTech,2018-11-06 00:06:16,Scooter firm pushing for law change 
1548,BBCTech,2018-11-05 19:12:16,Twitter Fake Elon Musk scam spreads after accounts hacked 
1549,BBCTech,2018-11-05 13:46:12,Social network Gab back online after shooting 
1550,BBCTech,2018-11-05 12:55:56,Player anger over Rainbow Six Siege changes 
1551,BBCTech,2018-11-04 14:39:37,RT  Should we be introducing biometrics in the office to counter our inability to remember complex passwords
1552,BBCTech,2018-11-03 11:53:52,Facebook sorry for white supremacist ad 
1553,BBCTech,2018-11-03 01:31:10,Why Big Tech pays poor Kenyans to programme selfdriving cars 
1554,BBCTech,2018-11-02 22:19:30,US midterms Twitter deletes antivoting bots 
1555,BBCTech,2018-11-02 17:34:31,Tech Tent Is Twitter besieged by bots 
1556,BBCTech,2018-11-02 12:10:11,Web needs more love says its creator 
1557,BBCTech,2018-11-02 11:14:57,The real Super Mario dies aged 84 
1558,BBCTech,2018-11-02 10:13:50,RT  Are you a PEBKAC Why humans are still the weakest link when it comes to cybersecurity 
1559,BBCTech,2018-11-02 00:03:55,Private messages from 81000 hacked Facebook accounts for sale 
1560,BBCTech,2018-11-01 17:38:09,Hologram lecturers to teach students at Imperial College London 
1561,BBCTech,2018-11-01 13:52:00,Samsung agrees to payouts after worker deaths 
1562,BBCTech,2018-11-01 11:19:29,Google staff are staging a series of walkouts in protest at the companys treatment of women  
1563,BBCTech,2018-11-01 05:13:45,Google staff to walk out over treatment of women 
1564,BBCTech,2018-10-31 18:51:26,Royoles bendyscreen FlexPai phone unveiled in China 
1565,BBCTech,2018-10-31 17:13:52,Eurostar resets customer passwords after hack attack 
1566,BBCTech,2018-10-31 16:24:55,Google executive leaves after sexual harassment claim 
1567,BBCTech,2018-10-31 14:39:24,Is Facebooks News Feed fading 
1568,BBCTech,2018-10-31 12:53:44,Apple Watches owners asked to return devices for repair after update glitch 
1569,BBCTech,2018-10-31 12:22:36,Fake Cambridge Analytica ad hits Facebook 
1570,BBCTech,2018-10-31 00:27:04,Can artificial intelligence help stop religious violence 
1571,BBCTech,2018-10-30 15:23:44,Android kids apps have unfair and deceptive ads 
1572,BBCTech,2018-10-30 14:52:45,RT  Whats the crimefighting weapon of choice for a growing number of police forces around the world
1573,BBCTech,2018-10-30 14:39:21,Budget 2018 Who will pay the Digital Services Tax 
1574,BBCTech,2018-10-30 12:13:55,Warning over DJI drones falling out of the sky 
1575,BBCTech,2018-10-30 11:02:23,Pornloving US official spreads malware to government network 
1576,BBCTech,2018-10-29 18:32:41,Red Hydrogen One The internet reacts to the 3Denabled phone 
1577,BBCTech,2018-10-29 14:46:28,MIT invites you to control a human on Halloween 
1578,BBCTech,2018-10-29 13:14:46,Pittsburgh shooting Gab drops offline after attack 
1579,BBCTech,2018-10-26 16:55:43,Facebook uncovers Iranianlinked accounts 
1580,BBCTech,2018-10-26 16:54:47,RT  Facebook has removed more fake accounts from Iran posing as UK and US citizens sharing memes about Theresa May Donald Tr
1581,BBCTech,2018-10-26 16:31:33,Tech Tent Tim Cooks privacy crusade 
1582,BBCTech,2018-10-26 12:39:30,Driverless cars Who should die in a crash 
1583,BBCTech,2018-10-26 10:53:22,Fatal swatting hoaxer faces more charges 
1584,BBCTech,2018-10-26 08:41:47,RT  How VR and empathetic robots are making vaccinations and cancer treatments less scary for kids
1585,BBCTech,2018-10-25 17:04:16,Portrait by AI program sells for 432000 
1586,BBCTech,2018-10-25 16:14:27,Second hack attack on BA website uncovered 
1587,BBCTech,2018-10-25 08:03:13,Facebook fined 500000 for Cambridge Analytica scandal 
1588,BBCTech,2018-10-25 08:03:11,RT  Facebook has been fined 500000 in the UK over the Cambridge Analytica data scandal  
1589,BBCTech,2018-10-25 07:41:20,RT  5G superfast mobile could power the internet of things but at what risk to our security
1590,BBCTech,2018-10-24 17:07:05,RT  Photographer  made a camera lens out of ice   
1591,BBCTech,2018-10-24 14:23:02,Facebook removes 87m child nudity images in three months 
1592,BBCTech,2018-10-24 12:01:43,Apple and Samsung fined by Italian authorities over slow phones 
1593,BBCTech,2018-10-24 11:39:58,How WhatsApp is being abused in Brazils elections 
1594,BBCTech,2018-10-24 09:31:26,Apple boss Tim Cook praises GDPR and wants tough US privacy law 
1595,BBCTech,2018-10-23 16:02:32,RT  Innovation must not come at the risk of public safety  more evidence that the rush to launch driverless vehicles could
1596,BBCTech,2018-10-23 13:59:10,Elon Musk says Twitter blocked him after Bitcoin tweet 
1597,BBCTech,2018-10-23 13:29:09,Uber bosss electric challenge 
1598,BBCTech,2018-10-23 13:06:06,Mobile app data sharing out of control 
1599,BBCTech,2018-10-23 12:19:26,Linus Torvalds returns to head Linux coding community 
1600,BBCTech,2018-10-23 12:01:16,Instagram used more than Snapchat by US teens 
1601,BBCTech,2018-10-23 11:01:56,London Uber drivers to charge electric car fee 
1602,BBCTech,2018-10-23 10:02:38,Selfdriving school bus test halted in US 
1603,BBCTech,2018-10-23 08:20:00,RT  Is blockchain just magic beans or a technology that could transform business
1604,BBCTech,2018-10-22 18:01:57,US teen is new Tetris world champion 
1605,BBCTech,2018-10-22 16:52:17,YouTube pours money into howto videos 
1606,BBCTech,2018-10-22 13:34:33,Five things to know about Red Dead Redemption 2 
1607,BBCTech,2018-10-22 10:37:34,New York police bodywarn cameras recalled after explosion 
1608,BBCTech,2018-10-22 09:20:06,RT  Sorry but its going to take much longer than that The sensors arent reliable or effective enough yet and the big elep
1609,BBCTech,2018-10-22 08:33:45,RT  Addison Lee plans selfdriving taxis by 2021 Teamed up with autonomous firm Oxbotica for the ambitious goal A good deal for
1610,BBCTech,2018-10-19 19:36:09,Apples Tim Cook calls for Chinese chip story retraction 
1611,BBCTech,2018-10-19 17:13:49,Tech Tent What was in Twitters troll data dump 
1612,BBCTech,2018-10-19 14:53:10,RT  3 Then Clegg  his wife dined w ZuckSandberg at Zucks house Clegg starts in London in a couple of weeks family will mov
1613,BBCTech,2018-10-19 14:53:06,RT  2 Elliot Schrage first mooted the job this summer Clegg rejected Then Sheryl Sandberg called him when he was walking in t
1614,BBCTech,2018-10-19 14:52:11,RT  1 Bit more detail on  move to  My  blog up shortly Before that heres a digest based on a
1615,BBCTech,2018-10-19 12:24:16,Facebook hires former deputy PM Sir Nick Clegg 
1616,BBCTech,2018-10-19 11:51:55,Google takes down Esta service ads  but many remain 
1617,BBCTech,2018-10-18 14:38:51,Facebook in fresh video metrics row 
1618,BBCTech,2018-10-18 13:02:49,British tech giant in Khashoggi dilemma 
1619,BBCTech,2018-10-18 11:17:36,Tiny companion phone released in Japan 
1620,BBCTech,2018-10-18 09:22:23,RT  Will 5G be worth forking out on a new phone that may not even work in different countries
1621,BBCTech,2018-10-17 17:50:48,Twitters RussiaIran troll tweet trove made public 
1622,BBCTech,2018-10-17 13:28:08,Grand Theft Auto cheats homes raided 
1623,BBCTech,2018-10-17 12:27:45,Google unshackles Androiddevicemakers 
1624,BBCTech,2018-10-17 07:46:33,YouTube back online after outage 
1625,BBCTech,2018-10-16 23:05:18,Spotify ad banned for causing distress to children 
1626,BBCTech,2018-10-16 14:53:32,Robot talks to MPs about future of AI in the classroom 
1627,BBCTech,2018-10-16 13:33:22,Huaweis Watch GT has no time for Androids Wear OS 
1628,BBCTech,2018-10-16 12:32:45,Fortnite cheat YouTuber sued by Epic Games 
1629,BBCTech,2018-10-16 11:42:14,RT  Biofuels are less polluting but are they cheap and plentiful enough to persuade cargo companies to switch
1630,BBCTech,2018-10-16 11:31:35,Tiny Palm smartphone baffles gadget fans 
1631,BBCTech,2018-10-16 09:20:06,RT  Just a reminder that Universal Credit got off to a bad start with an IT fiasco not sure DWP has ever written off the cost o
1632,BBCTech,2018-10-16 05:30:24,Sundar Pichai Google exploring censored China search app 
1633,BBCTech,2018-10-15 23:08:02,UK cybercentre thwarts hostile hackers 
1634,BBCTech,2018-10-15 23:04:19,Facebook tool makes UK political ads transparent 
1635,BBCTech,2018-10-15 20:20:32,Amazons Bezos US needs to be defended 
1636,BBCTech,2018-10-15 17:26:52,Virgin Media disrupted in London 
1637,BBCTech,2018-10-15 11:48:20,UK seeks to secure smart home gadgets 
1638,BBCTech,2018-10-15 11:40:27,Snapchat adds selfie filters for cats 
1639,BBCTech,2018-10-14 15:37:49,Did Apple Watch record Khashoggi killing 
1640,BBCTech,2018-10-14 01:30:21,An online decency moderators advice Blur your eyes 
1641,BBCTech,2018-10-12 21:55:53,RT  Facebook has told the BBC it will not offer any identity theft protection for the victims of its latest data breach At lea
1642,BBCTech,2018-10-12 19:03:13,Facebook shares more details on huge hack 
1643,BBCTech,2018-10-12 16:05:28,Tech Tent  Facebook and Googles hardware challenge 
1644,BBCTech,2018-10-12 13:34:30,RT  I dont want to be in a plane when a drone gets sucked into the engine How can we keep air passengers safe 
1645,BBCTech,2018-10-12 11:56:45,Facebook shuts down spammy politics pages 
1646,BBCTech,2018-10-12 00:16:18,Climate change Is streaming a threat to the environment 
1647,BBCTech,2018-10-11 14:16:41,Microsoft tackles horrifying Bing search results 
1648,BBCTech,2018-10-11 11:43:46,WhatsApp fixes big deal video crash bug 
1649,BBCTech,2018-10-11 11:28:28,US weapons systems can be easily hacked 
1650,BBCTech,2018-10-11 08:38:15,Apple hires engineers from UK company Dialog 
1651,BBCTech,2018-10-10 15:59:35,BBC News disrupted by software glitch 
1652,BBCTech,2018-10-10 11:56:32,Fibre island How Jersey went ultrafast 
1653,BBCTech,2018-10-10 11:00:13,Walmart planning netconnected trolley 
1654,BBCTech,2018-10-10 09:57:45,Amazon scrapped sexist AI tool 
1655,BBCTech,2018-10-10 09:22:18,Google appeals against 43bn Android fine 
1656,BBCTech,2018-10-10 03:15:27,Leak chips away at Googles secrecy on China 
1657,BBCTech,2018-10-09 18:40:26,RT  Quiet and pollutionfree  a cruise on the Prinses Irene 
1658,BBCTech,2018-10-09 16:06:26,Google Pixel 3 phones launch during privacy storm 
1659,BBCTech,2018-10-09 14:52:36,Sony PlayStation 4 console set for next generation 
1660,BBCTech,2018-10-09 13:06:03,Google drops 10bn battle for Pentagon data contract 
1661,BBCTech,2018-10-09 11:30:37,Microsofts Minecraft ends support on Apple TV 
1662,BBCTech,2018-10-08 17:59:18,Google shutting down after users data is exposed 
1663,BBCTech,2018-10-08 15:57:34,Boz Defending Facebooks Portal gadget 
1664,BBCTech,2018-10-08 13:07:01,Facebook says Portal will put privacy first  read our full story here 
1665,BBCTech,2018-10-08 13:02:59,Facebook Portal video chat screens raise privacy concerns 
1666,BBCTech,2018-10-08 13:01:23,Facebook has revealed its Portal videocalling home speaker  our reporter  tried it out 
1667,BBCTech,2018-10-08 11:24:25,Microsoft pauses Windows 10 update after files disappear 
1668,BBCTech,2018-10-08 10:28:17,Google iPhone data privacy case blocked by High Court 
1669,BBCTech,2018-10-08 06:02:28,Parkinsons diagnosis set to be sped up by Tencents AI 
1670,BBCTech,2018-10-05 15:47:58,Tech Tent  time for VR to face reality 
1671,BBCTech,2018-10-05 13:14:05,Apple and Amazon hit back over China soy chip report 
1672,BBCTech,2018-10-05 10:29:57,Weak passwords banned in California from 2020 
1673,BBCTech,2018-10-05 10:25:17,RT  ever wanted your phone to crawl across the desk  
1674,BBCTech,2018-10-05 08:13:16,RT  Polymer balls and drywash spray  how we can use less water doing our laundry 
1675,BBCTech,2018-10-04 16:59:48,Call problems hit O2 mobile network 
1676,BBCTech,2018-10-04 14:59:42,Fitbit data used to charge US man with murder 
1677,BBCTech,2018-10-04 12:59:09,China hack attack hits Apple and Amazon 
1678,BBCTech,2018-10-04 11:40:33,Netflix viewing eats up worlds data 
1679,BBCTech,2018-10-04 11:24:40,EBay accuses Amazon in merchant poaching row 
1680,BBCTech,2018-10-03 23:10:42,Preschoolers are watching more online video says study 
1681,BBCTech,2018-10-03 16:14:36,Trump alert US mobile phone owners braced for test 
1682,BBCTech,2018-10-03 12:17:53,Wikipedias broken links fixed by the Internet Archive 
1683,BBCTech,2018-10-03 11:55:31,Disney graffiti drone tags walls 
1684,BBCTech,2018-10-03 11:40:46,Facebook says other apps not caught in hack 
1685,BBCTech,2018-10-03 08:08:17,Panic over  it seems  is back online after reports it was not working 
1686,BBCTech,2018-10-03 08:06:48,RT  Reports that  is down  how is it for you
1687,BBCTech,2018-10-02 23:05:36,GP at Hands smartphone doctor ads ruled misleading 
1688,BBCTech,2018-10-02 16:55:24,Could Blockchain solve Irish border issue 
1689,BBCTech,2018-10-02 14:22:54,California bans secret election bots 
1690,BBCTech,2018-10-02 12:06:55,InfoWars Alex Jones sues PayPal 
1691,BBCTech,2018-10-02 10:51:07,Google to stream Assassins Creed for free in test 
1692,BBCTech,2018-10-02 10:03:04,RT  To show lovemaking in a theatre I will have to go through 10000 censor rules How digital platforms are giving directo
1693,BBCTech,2018-10-01 16:34:11,Web creator works to liberate personal data 
1694,BBCTech,2018-10-01 14:55:58,Will Facebook be fined after hack attack 
1695,BBCTech,2018-10-01 12:48:50,Apple silent amid iPhone chargegate complaints 
1696,BBCTech,2018-10-01 12:15:06,Honour of Kings uses facial recognition to check ages 
1697,BBCTech,2018-09-28 17:09:31,Up to 50m Facebook accounts attacked 
1698,BBCTech,2018-09-28 16:17:06,Tech Tent Facebooks family feud 
1699,BBCTech,2018-09-28 15:16:40,Facebook slated over phone ad push 
1700,BBCTech,2018-09-28 14:18:27,Google to be sued by Belgium for not blurring military sites 
1701,BBCTech,2018-09-28 11:41:11,US midterms Hackers expose staggering voter machine flaws 
1702,BBCTech,2018-09-28 10:24:28,San Diego port hit by ransomware attack 
1703,BBCTech,2018-09-28 01:13:19,Will Elon Musk be forced to leave Tesla 
1704,BBCTech,2018-09-27 17:34:45,Fortnite pets not moneymaking exercise expert believes 
1705,BBCTech,2018-09-27 12:23:59,Linus Torvalds Ill never be cuddly but I can be more polite 
1706,BBCTech,2018-09-27 11:44:27,Amazon to open fourstar store in New York 
1707,BBCTech,2018-09-27 10:28:07,Uber pays 148m over data breach coverup 
1708,BBCTech,2018-09-26 19:05:58,Facebooks Oculus Quest is latest attempt to make VR popular 
1709,BBCTech,2018-09-26 17:16:03,RT  And heres Zuck opening with the challenges VR faces to get to 1bn users amp be profitable OC5 
1710,BBCTech,2018-09-26 17:13:15,RT  Ah  with Oculus Quest 399 Wireless hand controllers Rift quality experiences Out in the Spring 
1711,BBCTech,2018-09-26 17:13:13,RT  He says 10m users is the sweet spot for making it worth it for developers Has said there wont be a new Rift announced tod
1712,BBCTech,2018-09-26 17:13:01,RT  Mark Zuckerberg is here Joking about how theyve not yet achieved even 1 of his billion people in VR target that he set
1713,BBCTech,2018-09-26 17:12:56,RT  In San Jose for Oculus Connect Facebooks VR devleoper conference Last two years have seen Zuckerberg address this event
1714,BBCTech,2018-09-26 14:35:19,RT  PlayStation has backed down in the Fortnite and crossplay row  
1715,BBCTech,2018-09-26 14:10:13,PlayStation backs down in Fortnite crossplay row 
1716,BBCTech,2018-09-26 14:01:28,ExGoogle employee warns of disturbing China plans 
1717,BBCTech,2018-09-26 11:52:58,Tablet computer kills child in car crash in Spain 
1718,BBCTech,2018-09-26 11:41:14,Distracted boyfriend advert ruled sexist 
1719,BBCTech,2018-09-26 01:08:52,Facebook investigating glitch in moderation system 
1720,BBCTech,2018-09-25 23:39:51,Mirrorless cameras Photographys new decisive moment 
1721,BBCTech,2018-09-25 22:14:34,Original working AppleI computer fetches 375000 at auction 
1722,BBCTech,2018-09-25 15:54:10,Instagram How it became a social media giant 
1723,BBCTech,2018-09-25 13:29:31,Facebook moderator sues over beheading stress 
1724,BBCTech,2018-09-25 13:21:33,Should gammon slur be banned on Twitter 
1725,BBCTech,2018-09-25 12:44:49,YouTube channel owner arrested over child sex abuse 
1726,BBCTech,2018-09-25 03:55:51,Instagram cofounders Systrom and Krieger leaving firm 
1727,BBCTech,2018-09-24 13:54:18,China shuts down 4000 websites in purge on improper values 
1728,BBCTech,2018-09-24 09:13:27,3Dprinted gun pioneer in jail on sex assault charge 
1729,BBCTech,2018-09-23 15:11:46,RT  Whats the funniestmost embarrassing gaffe youve made when relying on a translation app abroad For a  feature
1730,BBCTech,2018-09-21 23:27:35,Codecracking Bombe operation recreated at Bletchley 
1731,BBCTech,2018-09-21 22:07:47,Twitter warns direct messages were exposed 
1732,BBCTech,2018-09-21 16:09:27,Tech Tent Do the police have your biometric digits 
1733,BBCTech,2018-09-21 13:01:25,RT  Satellite wars Chinas push for global domination Excellent piece by 
1734,BBCTech,2018-09-21 12:28:36,Instagrams IGTV recommended abusive videos 
1735,BBCTech,2018-09-21 11:19:31,Facebook stops sending staff to help political campaigns 
1736,BBCTech,2018-09-21 09:48:15,China blocks Twitch gamestreaming service 
1737,BBCTech,2018-09-20 21:59:36,How Chinas GPS rival Beidou is plotting to go global 
1738,BBCTech,2018-09-20 18:30:23,RT  Amazon making a lot of cheap essentials  microwave clock  Alexa enabled Very smart way to get into peoples homes The
1739,BBCTech,2018-09-20 18:29:49,RT  Trying out the new  Hero 7 and its Hypersmooth stabilisation GoProHero7  
1740,BBCTech,2018-09-20 17:29:25,Internet regulator considered for UK 
1741,BBCTech,2018-09-20 15:47:50,Vote Leave data firm hit with first ever GDPR notice 
1742,BBCTech,2018-09-20 13:33:03,John Hancock makes fitness tracking mandatory for insurance 
1743,BBCTech,2018-09-20 13:04:30,GoPro Hero 7 camera films smooth videos without gimbal 
1744,BBCTech,2018-09-20 11:33:13,Facebook told to speed up changes or face sanctions 
1745,BBCTech,2018-09-20 02:11:35,Equifax fined by ICO over data breach that hit Britons 
1746,BBCTech,2018-09-19 16:21:34,Jellyfish robots to watch over endangered coral reefs 
1747,BBCTech,2018-09-19 10:30:21,Sony unveils mini PlayStation Classic console 
1748,BBCTech,2018-09-19 10:13:35,US judge allows evoting despite hack fears 
1749,BBCTech,2018-09-19 06:01:36,IBM launches tool aimed at detecting AI bias 
1750,BBCTech,2018-09-18 22:57:00,Facebook job ads discriminated by gender 
1751,BBCTech,2018-09-18 15:44:31,Can a new Kangaroo transform British TV 
1752,BBCTech,2018-09-18 12:09:59,Almost half of UK internet users harmed online 
1753,BBCTech,2018-09-18 11:50:25,Lyndsey Scott says models can also be coders 
1754,BBCTech,2018-09-18 11:27:49,RT  Are you broadcasting your spending habits to the world The pros and cons of persontoperson payment apps FinTech P2P
1755,BBCTech,2018-09-17 23:14:53,Soylent meal replacement gets UK launch 
1756,BBCTech,2018-09-17 12:53:41,Google admits changing phone settings remotely 
1757,BBCTech,2018-09-17 11:48:34,Google seeks birds to help with image recognition 
1758,BBCTech,2018-09-14 16:28:02,Tech Tent Has cryptocurrency peaked 
1759,BBCTech,2018-09-14 14:15:28,YouTube nurseryrhyme channel with billions of views sold 
1760,BBCTech,2018-09-14 13:19:34,RT  Why are Apple and Cisco investing in Naples Could this be the catalyst for a tech startup bonanza 
1761,BBCTech,2018-09-14 10:30:15,Nintendo announces raft of new games for Switch console 
1762,BBCTech,2018-09-14 04:31:15,Can health services handle the Apple Watch 
1763,BBCTech,2018-09-13 20:29:32,RT  Two years on from his mojo mobile journalism diet  has gone one step further amp made his kit even leaner
1764,BBCTech,2018-09-13 15:44:08,Google defends Trump election reaction 
1765,BBCTech,2018-09-13 12:55:37,EU network charges could revive roaming fees 
1766,BBCTech,2018-09-13 11:25:31,Microsoft tests rival browser warnings 
1767,BBCTech,2018-09-13 10:35:52,Fear Amazon glitch mixes in L Ron Hubbard book reviews 
1768,BBCTech,2018-09-13 09:50:23,Huawei promises foldable phone within a year 
1769,BBCTech,2018-09-12 23:16:13,BBC solves World Cup streaming delay 
1770,BBCTech,2018-09-12 19:28:04, Papped 
1771,BBCTech,2018-09-12 19:27:34,All you need to know from the AppleEvent in 90 seconds 
1772,BBCTech,2018-09-12 17:19:26,Apple unveils nextgeneration Watch 
1773,BBCTech,2018-09-12 16:53:35,MEPs vote to ban killer robots on battlefield 
1774,BBCTech,2018-09-12 11:15:49,European parliament backs copyright changes 
1775,BBCTech,2018-09-12 08:44:36,RT  How the US is lagging well behind China in the 5G investment stakes
1776,BBCTech,2018-09-12 08:24:10,Google Facebook Twitter face EU fines over extremist posts 
1777,BBCTech,2018-09-12 03:25:58,Apple launch Bigger Faster Pricier Innovative 
1778,BBCTech,2018-09-11 16:17:29,Marshall Islands warned against adopting digital currency 
1779,BBCTech,2018-09-11 13:31:46,Google fights plan to extend right to be forgotten 
1780,BBCTech,2018-09-11 12:12:46,RT  One day we may be able to bioprint hearts livers kidneys and other vital organs from pluripotent stem cells
1781,BBCTech,2018-09-11 10:13:45,Apple removes antimalware apps for harvesting browser data 
1782,BBCTech,2018-09-11 09:24:47,RT  The amazing story of Luke Massella  one of only 10 people in the world whose replacement bladder was grown from his own
