,User,Date,Tweets
,,,
0.0,thenextweb,2019-11-02 23:59:04,Samsung teases another folding phone but this ones a clamshell 
5.0,thenextweb,2019-10-29 11:33:54,CHEAP Fear me neighbors  theres 100 off this Samsung Harman Kardon soundbar and subwoofer 
6.0,thenextweb,2019-10-19 02:41:45,Samsung security flaw allows your fingerprint to unlock any Galaxy S10 
11.0,thenextweb,2019-10-13 12:02:07,CHEAP Yes please I will take 200 off the 512GB Samsung Galaxy S10 
12.0,thenextweb,2019-10-06 12:02:06,CHEAP Friend  you deserve 300 off the 1TB Samsung Galaxy S10 
20.0,thenextweb,2019-10-05 02:14:09,Galaxy Fold survives 60 percent of claimed folds in stress test but thats okay 
