Date,Tweets
24/10/2019,RBS pulls Samsung Galaxy S10 app over security flaw 
17/10/2019,Any fingerprint unlocks Galaxy S10 Samsung warns 
9/5/2019,Samsung Galaxy Fold UK launch date revealed 
8/7/2019,Galaxy Note 10 Samsung hopes to strike the right Note 
25/7/2019,RT  Samsung says the Galaxy Fold will go on sale in September after faulty screens delayed the launch 
7/4/2019,Samsung sued over waterresistant phone claims 
17/6/2019,Samsung TVs should be regularly viruschecked the company says 
30/4/2019,Samsung unveils TV that can switch to vertical mode 
22/4/2019,Samsung Galaxy Fold launch events delayed in China 
17/4/2019,Samsungs folding phone breaks for reviewers 
16/4/2019,RT  Heres my first handson with the Samsung Galaxy Fold GalaxyFold 
24/2/2019,RT  Our folding phone is bigger and better than Samsungs says Huawei 
21/2/2019,Samsung on whether you can end calls on the GalaxyFold by snapping it shut like the old flip phones 
21/2/2019,RT  Important can I answer calls with the phone unfolded and then hang up by snapping it shut   Samsung
20/2/2019,Samsung Galaxy Fold The internet reacts 
20/2/2019,Samsung reveals Galaxy Fold and S10 5G 
1/8/2019,CES 2019 Samsung adds rival Apples iTunes to smart TVs 
1/7/2019,RT  Samsung has revealed a 75in 190cm television made of modular panels you can rearrange  CES2019 
12/10/2018,Huawei Honor View20 and Samsung A8s have holepunch cameras 
12/3/2018,Samsung Nigeria tweets update using Apple iPhone 
23/11/2018,Samsung apologises to sick factory workers 
11/7/2018,RT  After 5 years of talking about folding devices Samsung unveiled theirs at SDC18 
11/1/2018,Samsung agrees to payouts after worker deaths 
24/10/2018,Apple and Samsung fined by Italian authorities over slow phones 
9/5/2018,Samsung Time for folding smartphones 
8/9/2018,Samsung Galaxy Note 9 warns of wonky photos 
31/7/2018,Why is Samsungs Galaxy S9 flagship struggling 
31/5/2018,Samsung wont be forced to update old phones 
25/5/2018,Apple awarded 539m in US patent case against Samsung 
14/5/2018,AppleSamsung patent battle revived in California court 
25/2/2018,Samsung Galaxy S9 gets super slowmo and AR emojis 
25/2/2018,Samsung Galaxy S9 focuses on the camera 
21/2/2018,Samsung Galaxy S9 smartphone images leaked by MWC app 
21/2/2018,Guardians of the Galaxy Vol 2 Visual effects revealed 
30/10/2019,Samsung One UI 2 Gets an Official Reveal With Smarter Dark Mode More
29/10/2019,Samsung Unveils Another Smart Speaker That May Never Launch
29/10/2019,Samsung Showcases Foldable Phone Concept With Clamshell Design
24/10/2019,Pixel 4 XL Teardown Reveals Samsung Display Almost Decent Repairability Score
18/10/2019,Samsung Issues Statement on Fingerprint Vulnerability Software Update is Coming
14/10/2019,Samsung Galaxy S10 owners any luck enrolling in the Android 10One UI 20 beta yet The Samsung Members app appears to be having issues
14/10/2019,Samsung One UI Beta for Android 10 Arrives Today in US on Galaxy S10 Line
10/11/2019,DEAL Samsung Offers 500 Off Galaxy Note 10 With Select TradeIn Throwing in Free 200 Credit or Wearable Bundle 
10/9/2019,Samsung confirms Unlocked ATampT and TMobile Galaxy S10 S10 and S10e models will have first dibs at the Android 
10/8/2019,Samsung Confirms One UI 20 Coming Soon to Galaxy S10 Lineup
10/3/2019,Samsung Pay Gets International Money Transfers
27/9/2019,Lets unbox Samsungs 1980 Galaxy Fold galaxyfold 
17/9/2019,Report Samsung Launching Android 10 Beta Next Month
9/9/2019,Samsung Says Hundreds of Apps Now Optimized for Galaxy Fold galaxyfold 
9/6/2019,  what are the samsung issues as for iphone vs p4 we wont have any good idea until next m 
9/5/2019,Samsung Finally Cancels Original Galaxy Fold PreOrders Offers 250 Credit galaxyfold 
9/5/2019,Samsungs Galaxy Fold is Back Available for Purchase This Month galaxyfold 
9/4/2019,Discord Integration Arrives for Samsungs Game Launcher App
28/8/2019,Samsung Galaxy Note 10 Review It Doesnt Get Much Better Than This
28/8/2019,Samsung still offering 600 off Galaxy Note 10 purchases with eligible tradeins 
27/8/2019,Samsung Keeps Note 10s 600Off Trade Deal Alive Adds 4 Months Free YouTube Premium GalaxyNote10 
24/8/2019,Windows and Mac apps for Samsungs DeX arrive 
24/8/2019,If you own a Samsung Galaxy phone on Verizon youre likely getting the August patch right now
23/8/2019,Windows and Mac Apps for Samsungs DeX are Live 
23/8/2019,Video Appears to Show Off Samsungs One UI 20 Running Atop Android 10
22/8/2019,Samsung is so weird sometimes
21/8/2019,Samsung Wins Today With Their Green Bubble GIFs
13/8/2019,Samsung Said to be Readying Graphene Batteries Capable of Insanely Fast Charge Times
8/12/2019,Samsung Still Cutting 600 Off Note 10 With Select TradeIns Ups Galaxy S9 Value to 350 galaxynote10 
8/9/2019,Samsungs Galaxy Home smart speaker is still in development a year after being announced 
8/8/2019,Samsung Still Working to Refine and Enhance BixbyPowered Galaxy Home Speaker
8/7/2019,Samsung Galaxy Note 10 and Note 10 Official PreOrders Start Tomorrow for 949
8/7/2019,Samsung Galaxy Note 10 Galaxy Note 10 Specs Official galaxynote10 
8/6/2019,Samsungs Galaxy Watch Active 2 is now official launches next month 
8/5/2019,Samsung Galaxy Watch Active 2 Official Priced Starting at 279 With PreOrders in September
8/3/2019,Samsung is watering down the Note line with the Galaxy Note 10
8/2/2019,Samsung is Watering Down the Note Line for No Good Reason
8/1/2019,Samsung has a new 650 tablet for those interested in Android tablets
31/7/2019,Samsungs Galaxy Tab S6 is a 649 Tablet in a World Without Many Android Tablets
30/7/2019,Samsung to Announce Galaxy Tab S6 Watch Active 2 Prior to Note 10 Event
26/7/2019,Samsung offers upto 600 off Note 10 with specific trades 
25/7/2019,Official Samsungs Galaxy Fold is ReLaunching in September galaxyfold 
23/7/2019,Samsungs Galaxy Watch Active Gets a Big Ol Update
23/7/2019, nothing is confirmed samsung hasnt yet announced if the phone will indeed feature a battery 
18/7/2019, the 12GB packages combining eight of the 12Gb chips arent yet in mass production Samsung says later t 
18/7/2019,Samsung Readying 12Gb LPDDR5 Mobile DRAM for Galaxy Note 10
7/10/2019,Pujie Black Available for Samsung Galaxy Wearables
7/2/2019,Samsungs Galaxy Fold was pushed out too early guys galaxyfold 
7/1/2019,Samsung is offering really solid tradein values for older phones like 350 for the Galaxy S8
7/1/2019,This Might Shock You but the Samsung Galaxy Fold was Rushed galaxyfold 
7/1/2019,DEAL Samsung Goes Wild With Trades Toward Galaxy S10 350Off for a Galaxy S8 galaxys10 
24/6/2019,Verizon TMobile Samsung and LG Devices Getting Security Patches
19/6/2019,Samsung irons out most Galaxy Fold issues is ready to release it to market 
19/6/2019,Samsung Most Galaxy Fold Display Issues Ironed Out Ready for Launch
15/6/2019,DEAL Samsung Galaxy Buds are 9999 at Verizon 30 Off
14/6/2019,Samsung Galaxy Fit Activity Tracker Now Available for 99
6/5/2019,Samsung celebrates 10th anniversary of Galaxy with deals and promos 
6/4/2019,Samsung Galaxy Home Launch Still Happening Scheduled for Q3
6/4/2019,Today is Galaxy Day MonthLong Celebration With Deals and Promos From Samsung
29/5/2019,Samsung has plans for 100W USBC chargers 
28/5/2019,Samsung has Plans for 100W USBC Chargers
27/5/2019,Samsung Loves Its Hole Punches Shares Free DisneyPixar Wallpapers for Galaxy S10 galaxys10 
24/5/2019,DEAL Samsungs Fast Wireless Charger is 50 Off Down to 1499
24/5/2019,With Still No Word From Samsung Best Buy Cancels All Galaxy Fold PreOrders
21/5/2019,We Hope Samsungs New 5x Optical Zoom Lens Ships With the Galaxy Note 10
20/5/2019,One UI update rolling out to Samsungs wearable lineup starting this week 
20/5/2019,Samsung Announces One UI for Wearable Lineup Highlights Better Battery and Cleaner UI
13/5/2019,Upcoming Phone Designs From OPPO Samsung and Huawei Might Get Weird
5/10/2019,Samsung ups its tradein offer to 400 off a Galaxy S10 
5/9/2019,Samsung Galaxy Fold supposedly ready to make a comeback 
5/9/2019,DEAL Samsung Ups Tradein Offer to 400 Off Galaxy S10 galaxys10 
5/9/2019,Samsungs Galaxy Fold is Ready to Return galaxyfold 
5/7/2019,Samsung is Still Trying to Fix the Galaxy Fold Asks if People Want to Keep PreOrders galaxyfold 
5/6/2019,DEAL Samsung Gear S3 Frontier Drops to 109 With 90 Discount
5/3/2019,Samsung Pay support comes to Simple Bank 
5/2/2019,Simple Bank Finally Finally Adds Support for Samsung Pay
30/4/2019,DEAL Samsung Will Still Give You 200 Off the Galaxy S10 for Trading in Any Smartphone galaxys10 
23/4/2019,Samsungs Galaxy View 2 looks pretty good when compared to the original 
23/4/2019,Samsung officially delays launch of the Galaxy Fold 
22/4/2019,Samsung Galaxy View 2 Looks Way Better Than the Original
22/4/2019,Samsung confirms Galaxy Fold delay as it investigates and runs internal tests 
22/4/2019,Samsung Might Have Delayed the Galaxy Fold galaxyfold 
19/4/2019,DEAL Samsung Offering Instant 300 Off Galaxy S10 With Trade galaxys10 
18/4/2019,Samsung Spins Bright Night Camera Feature Into Standalone Mode
16/4/2019,Samsung Quickly Sold Out of the 2000 Galaxy Fold galaxyfold 
16/4/2019,Samsungs Galaxy Fold has support for all major US carrier bands 
15/4/2019,Samsungs Galaxy Fold has Support for All Major US Carriers Bands galaxyfold 
13/4/2019,How has your experience been with Samsungs tradein program 
4/12/2019,Hows Your Experience Been With Samsungs TradeIn Program galaxys10 
4/11/2019,Invitations to purchase Samsungs 1980 Galaxy Fold apparently roll out tomorrow 
4/11/2019,Samsung Says You Should SignUp Today to be First in Line to Purchase Galaxy Fold galaxyfold 
4/10/2019,Samsung Galaxy A80 Trades Notches and Cutouts for PopUp Flippy Camera
4/9/2019,DEAL Need More Storage Get a Samsung 128GB MicroSD for 20
4/2/2019,DEAL Samsung Will Give You 200 TradeIn Value Towards Galaxy S10 for Any Android Device Even If Its Cracked
28/3/2019,Samsung shows the Galaxy Fold can fold a lot of times 
22/3/2019,Samsungs 550 Off TradeIn Galaxy S10 Deal is Still Live Plus BOGO ATampT and Verizon galaxys10 
22/3/2019,DEAL Samsung Wireless Charging Pad is 15 10000mAh Fast Battery Pack is 16 galaxys10 
20/3/2019,Poll Do Your Own a Google Samsung or OnePlus Phone
19/3/2019,Heres the 2000 ATampT Samsung Galaxy Fold Being Fondled galaxyfold 
16/3/2019,Samsung still offering up to 550 in tradein credit towards the purchase of a Galaxy S10 
15/3/2019,You Still Have Time to Take Advantage of Samsungs 550 Tradein Offer for the Galaxy S10
15/3/2019,Samsung Galaxy S10e Review Yo This is the Phone galaxys10e 
14/3/2019,Samsung Galaxy S10 Review Mostly Excellence Slight Disappointment
3/8/2019,DEAL Samsungs Excellent Galaxy Buds 25 Off at ATampT
3/8/2019,Time probably running out to take advantage of Samsungs really good tradein offer 
3/8/2019,Samsungs Good Lock app gets updated to work with Android Pie 
3/7/2019,Samsungs Good Lock App Updated to Work With Android Pie
3/6/2019,Report Your Samsung Galaxy Depreciates at Alarming Rate 42 in Month One
3/6/2019,Samsung is Folding Sht in All the Directions
3/5/2019, samsung tho lol
28/2/2019,Samsung Now Lets You Remap Bixby Button Just Not to Google Assistant
27/2/2019,Buying the Galaxy Fold will be unlike most Samsung products 
25/2/2019,Everyone see Samsungs new Galaxy Fold video It shows a lot of the device in action
25/2/2019,Samsung Releases the Galaxy Fold HandsOn Video You Wanted galaxyfold 
20/2/2019,Samsung Announces Galaxy S10 Family Starting at 900 galaxys10 
20/2/2019,Samsung Announces New Galaxy Watch Active Galaxy Fit and Galaxy Buds
20/2/2019,Official Specs Samsung Galaxy S10 S10 S10 5G and S10e galaxys10 
20/2/2019,Here is the Samsung Galaxy Fold galaxyfold 
20/2/2019,Watch Samsungs Galaxy S10 Galaxy Fold Event Live at 11AM Pacific
19/2/2019,Samsung Galaxy Fold Samsung Galaxy Fold
19/2/2019,And Heres a Samsung Galaxy S10 Promo Video Leak 
19/2/2019,Samsungs Internet browser gets a big One UI update
18/2/2019,Samsung Internet Gets One UI Makeover Complete With Dark Mode Support
16/2/2019,DEAL 300 Off Unlocked Samsung Galaxy Note 9 Today With Code galaxynote9 
15/2/2019,Samsung Outs Its Entire New Galaxy Wearable Line Early
13/2/2019,You can already reserve your Galaxy S10 from Samsung 
2/12/2019,Samsungs Galaxy S10 Arrives March 8 Get Up to 550 Off With Trade if You Reserve Now
2/12/2019,Samsung keeps teasing the fold 
2/11/2019,What Exactly is Samsung Trying to Tease Here
2/9/2019,A Fresh Clean HighRes Look at Samsungs Galaxy S10 and Galaxy S10e
2/7/2019,Verizon Valentines Deals Arent Awful 300 Off Pixel 3 BOGO Samsung deals 
2/4/2019,Samsung and fake Supreme are no longer working together
2/2/2019,Samsung Galaxy S10 Galaxy S10 Stop by the FCC galaxys10 
2/1/2019,DEAL Samsung Galaxy Note 9 S9 and S9 are 150 Off deals 
2/1/2019,Samsung brings out the cool concepts shows off foldable phone too
2/1/2019,Samsung pulled that concept video but we grabbed some extra screenshots from it
31/1/2019,Samsung Teases Foldable Phone in Futuristic Concept Video
31/1/2019,Samsung Galaxy Buds reported to launch with the Galaxy S10 
30/1/2019,Samsung Just Made a 1TB UFS 21 Chip for Smartphones Probably the Galaxy S10 galaxys10  
30/1/2019,Samsungs doing a bit better of a job at updating 
29/1/2019,Hey Samsung Better Job With Pie Updates so Far
29/1/2019,Samsung Galaxy S9 Gets Android Pie One UI Update on First US Carrier galaxys9 
25/1/2019,No bueno Samsung
24/1/2019,This is Bad Samsung
22/1/2019,Jesus Finally Target Will Soon Accept Google Pay Samsung Pay
14/1/2019,Heres Everything We Know About Samsungs GalaxyS10 so Far
14/1/2019,Samsungs 5G Galaxy S10 Might Add an X to Its Name Go Nuts With Specs galaxys10 
1/11/2019,DEAL Samsung Galaxy Note 9 S9 S9 All 200 Off With Up to 300 Off in Trades deals 
1/11/2019,There has been a ton of different Galaxy phones from Samsung over the years Which one stands out the most to you
1/11/2019,Well also see a fully functional foldable from Samsung on February 20 
1/10/2019,10 Years of Samsung Galaxy S Phones Which Stands Out the Most galaxys10 
1/10/2019,Fully Functional Foldable From Samsung Coming on February 20 Too
1/10/2019,Samsung is Announcing the Galaxy S10 on February 20 galaxys10 
1/7/2019,Sprints Samsung 5G Phone is Coming This Summer sprint ces2019 
1/4/2019,Samsung its time to move on from the curved display
1/3/2019,I Just Need Samsung to Ditch the Curved Display Now galaxys10 
1/3/2019,Samsung has another Pie roadmap with Galaxy Note 9 and Note 8 bumped up a month 
1/2/2019,Samsung Provides Different Pie Update Roadmap Galaxy Note 9 and Note 8 Bumped Up a Month
26/12/2018,Samsungs Pie Update Roadmap Wont Make You Envious of Galaxy Owners
21/12/2018,Samsung is Coming for Googles Night Sight Camera Magic
21/12/2018,Report Google Assistant Launching on 2019 Samsung Smart TV Lineup
19/12/2018,DEAL Samsung 10000mAh Fast Charge Battery Pack is 1599 19 Off deals 
19/12/2018,Verizon Updates Samsung Galaxy S7 S7 Edge LG V30
12/12/2018,Samsung is now reevaluating its partnership with fake Supreme
12/12/2018,DEAL Samsung Drops 300 Off Carrier Galaxy Note 9 250 Off Galaxy S9 galaxynote9 
12/11/2018,Did Samsung just partner with a knockoff Supreme label to sell stuff in China Yes 
12/10/2018,Samsung Embarrassingly Partners With Fake Supreme 
12/10/2018,Samsung Galaxy A8s With Infinity O Display Official for China
12/5/2018,ATampT Announces Another Samsung 5G Device With Better Connectivity 5g 
12/5/2018,ATampT says it will carry Samsungs 5G smartphone in early 2019 
12/4/2018,ATampT Will Also Carry Samsungs 5G Phone Next Year
12/4/2018,Verizon and Samsung launching 5G phone in first half of 2019 
12/3/2018,DEAL Samsung Wireless Charger Duo for Just 50 on Amazon 70 Off
12/3/2018,Verizon and Samsung Launching 5G Phone in First Half of 2019 Proof of Concept Coming This Week
30/11/2018,DEAL Verizon Galaxy Note 9 300 Off Today Only From Samsung GalaxyNote9 
29/11/2018,Samsungs 12 Days of Deals is Here Save on TVs Phones and Get Free Stuff 
29/11/2018,TMobile is giving away Samsung 50 4K TVs in new deal
29/11/2018,Samsung One UI Gets Updated Loads of Bug Fixes Inside
28/11/2018,Buy a Samsung Galaxy on TMobile Get Free 50 4K Smart TV
28/11/2018,Huawei Beats Samsung to Full Display With Camera Cutout Hole 
28/11/2018,Looks like Project Fi will soon support Samsung OnePlus and iPhone devices 
26/11/2018,Verizon Samsung Galaxy Devices LG V40 ThinQ Receive Security Patch Updates
25/11/2018,Samsung Cyber Monday Deals are Live CyberMondayDeals 
23/11/2018,Black Friday 2018 Best Google and Samsung Phone Deals BlackFriday2018 
22/11/2018,Dont sleep on Samsungs BlackFridayDeals
20/11/2018,Samsung microSD cards are so cheap right now
20/11/2018,Amazon matches Samsungs big BlackFridayWeek 200 off sale on Note 9 S9 and S9
19/11/2018,Samsung EVO Select MicroSD Cards are Stupid Cheap Right Now 128GB for 1999 BlackFridayWeek 
19/11/2018,DEAL Amazon Matches Samsungs 200 Off Galaxy S9 S9 and Note 9 Deal BlackFriday2018 
18/11/2018,Samsungs BlackFriday2018 deals are here with up to 300 off Note 9 S9
18/11/2018,Samsung Black Friday Deals Now Live Up to 300 Off Galaxy Note 9 S9 and S9 BlackFriday2018 
16/11/2018,Video Tour of Samsungs new One UI on a Galaxy S9 galaxys9 
16/11/2018,Samsungs One UI Beta with Android Pie goes live for Galaxy S9 S9
16/11/2018,Samsung is going to annoy you over use of free themes
15/11/2018,Video First Look at Samsung One UI Beta on Galaxy S9 galaxys9 
15/11/2018,Samsung One UI and Pie Beta Program Now Live in the US for S9 galaxys9 
15/11/2018,Samsung Doesnt Want You Using Free Themes Anymore
14/11/2018,Samsung might skip the notch on Galaxy S10 and go with InfinityO
11/9/2018,DEAL Verizon Galaxy S9 Note 9 are 100 Off From Samsung With 300 Bonus Bundle galaxynote9 
11/8/2018,Here are some display specs for Samsungs foldable Infinity Flex display
11/8/2018,Heres a pretty Samsung One UI wallpaper for you
11/8/2018,A photo tour of Samsungs new One UI
11/8/2018,Samsung has notched displays in the works You OK Samsung fans
11/8/2018,Samsungs new One UI looks pretty is ready for Galaxy S9 and Note 9 beta testers
11/8/2018,And here is Samsungs first foldable display phone
11/7/2018,Samsung Revealed Infinity Flex Display Specs for Its Foldable Phone
11/7/2018,You Know You Want That Wallpaper From Samsungs One UI
11/7/2018,Heres a Photo Tour of Samsungs One UI
11/7/2018,Samsung Who Laughed at Googles Notch is Ready to Introduce Notches Maybe
11/7/2018,Samsung One UI is the Software UX Refresh Weve Been Waiting For
11/7/2018,Here is Samsungs Foldable Display Device
11/7/2018,Samsung Experience aka TouchWiz refresh Yes please 
11/7/2018,Samsungs Galaxy Home Bixby Speaker Arrives at FCC in Time for Launch Details
11/7/2018,Watch Samsungs Developer Conference Where We May See a Foldable Phone
11/6/2018,Were learning more about Samsungs foldable ahead of a potential unveiling this week at SDC 
11/5/2018,Samsung May Launch Android Pie Beta Program During SDC This Week
11/5/2018,Latest Samsung Foldable Device Report Aligns With Concept Image From 2017
26/10/2018,Samsung still seems confused on what foldable device will be 
26/10/2018,Samsung Still Seems Confused on Its Foldable Phone But Itll Run Special Android galaxys10 
28/10/2019,US Galaxy S10 Lineup Getting Note 10s Live Focus Video AR Doodle in New Update
25/10/2019,One UI 20 Beta Opened to Galaxy Note 10 Lineup
10/7/2019,Theres Something Off About These Galaxy Fold Reviews on Best Buy
10/4/2019,Our thoughts after a week with the Galaxy Fold 
10/4/2019,Galaxy Fold Thoughts After a Week of Folding My Phone
10/3/2019,VIDEO Our Favorite Galaxy Fold Features galaxyfold 
10/1/2019,Drop Test Confirms Dont Drop the Galaxy Fold
30/9/2019,Verizon Galaxy S9 S9 Getting September Security Patch
30/9/2019,My Galaxy Fold Display is Not Damaged After a Day galaxyfold 
27/9/2019,Verizon Galaxy S8 S8 Note 8 and S10 5G Receive September Security Patch
27/9/2019,Podcast We Have the Galaxy Fold Show kicks off at 1230PM Pacific
27/9/2019,RT  2 Galaxy Folds gt 4 iPhone 11 Pros lol 
24/9/2019,Galaxy S10 Family Picking Up Suite of Note 10 Features in New Update
23/9/2019,Galaxy Fold Arrives This Week in the US galaxyfold 
20/9/2019,We Crushed 8GB Data on Verizon 5G in 1 Minute With a Galaxy Note 10 5G 5G 
20/9/2019,Verizon Galaxy S10 Note 10 Lineups Updated With September Security Patch
18/9/2019,Android 10 beta for Galaxy S10 Galaxy Note 10 reported to launch next month 
13/9/2019,Pixel 4 XL Gets a Galaxy Note 10 Comparison Already pixel4
9/11/2019,5 Reasons the Galaxy Note 10 is Worth Buying
9/11/2019,Second Galaxy arrives for Android 
9/10/2019,Second Galaxy Available for Android Reminds Me a Lot of EVE Online
9/5/2019,Android 10 Update for TMobile Galaxy Note 10 Galaxy S10 Already in Testing
30/8/2019,RT  PSA Public Software Announcement  GalaxyS10 devices getting SW update including bug fixes security updates amp Nigh
29/8/2019,Verizon Galaxy S10 Family Grabs a Fresh Update
29/8/2019,Hole punch wallpapers for your Note 10 are here galaxynote10 
29/8/2019,Our Galaxy Note 10 review galaxynote10 
28/8/2019,Cool Wallpapers to Go With Your GalaxyNote10 Camera Cutout
26/8/2019,PSA Your GalaxyNote10 Doesnt Have a Dead Pixel Thats the Proximity Sensor
23/8/2019,We got a couple Galaxy Note 10 phones We did a podcast about it 
23/8/2019,A Lot of Galaxy Phones on Verizon are Getting Updated With August Security Patch
23/8/2019,VIDEO First 10 things to do with the Galaxy Note 10
22/8/2019,Galaxy Note 10 First 10 Things to Dogalaxynote10
22/8/2019,Last Chance to Get the Galaxy Note 10 150 PreOrder Credit galaxynote10 
21/8/2019,VIDEO Galaxy Note 10 Unboxing
21/8/2019,Verizon Galaxy Note 10 lineup getting updated 
20/8/2019,Verizon Galaxy Note 10 Lineup Already Getting First Update
19/8/2019,Galaxy Note 10 Orders Now Shipping With Wednesday Arrival galaxynote10 
14/8/2019, Galaxy Fold running KitKat Very nice P
8/12/2019,Both DxOMark and DisplayMate are loving the Galaxy Note 10 
8/12/2019,Both DxOMark and DisplayMate Love the Galaxy Note 10
8/8/2019,Handson with the Galaxy Note 10 and Note 10 
8/8/2019,Video Galaxy Note 10 Note 10 First Look
8/8/2019,These are the best deals for the Galaxy Note 10 so far 
8/8/2019,600 off a Galaxy Note 10 aint bad at all 
8/8/2019,All your Galaxy Note 10 specs are right here 
8/8/2019,Galaxy Note 10 is all official now Preorders start at midnight tonight priced starting at 949 
8/8/2019,Poll Buying a Galaxy Note 10 galaxynote10 
8/7/2019,Best Galaxy Note 10 Note 10 and Note 10 5G PreOrder Deals galaxynote10 
8/7/2019,Reserve Your Galaxy Note 10 Now and Save Up to 600 With Eligible TradeIn
8/7/2019,You can watch the Note 10 event right here if you want GalaxyUnpacked 
8/6/2019,Heres a Galaxy Note 10 Note 10 Official Feature Leak galaxynote10 
8/5/2019,Verizon Galaxy S9 S9 and Note 9 Getting Dark Mode Camera Update
8/2/2019,Galaxy Note 10 in some pretty colors 
8/1/2019,This is probably the biggest Galaxy Note 10 leak of all 
8/1/2019,Heres the Galaxy Note 10 in Most of Its Pretty Colors
8/1/2019,Verizons Galaxy S10 Family Grabs Pair of Updates
8/1/2019,The Big Galaxy Note 10 Leak is Here
29/7/2019,Verizons Galaxy Note 10 5G has been tested 
29/7/2019,Verizons Galaxy Note 10 5G has Been Tested GalaxyNote10 
27/7/2019,Hi Galaxy Watch Active 2 
27/7/2019,Dont miss this weeks show We covered the TMoSprint merger Galaxy Note 10 and Pixel 4 
26/7/2019,Heres the Galaxy Watch Active 2 Thanks to the FCC galaxywatchactive2 
26/7/2019,DEAL All Unlocked Galaxy S10 Phones are 400500 Off at Best Buy Today galaxys10 
26/7/2019,Galaxy Note 10 Launch Day is August 23 Reservations Now Open With 600 Off for TradeIns galaxynote10 
26/7/2019,TMobile is done with the Galaxy Fold
25/7/2019,Galaxy Fold is almost ready for its comeback in September
25/7/2019,TMobile Wont Sell the Galaxy Fold
25/7/2019,Galaxy Note 10 5G for Verizon Disclosed Appears to be Limited Time Exclusive
24/7/2019,Verizon Galaxy S7 S7 Edge S8 S8 and Note 8 Get Updated Security Patches
23/7/2019,Galaxy Note 10 Note 10 Specs Reported to Include a Processor Display and Possibly Internal Storage
22/7/2019,Visible Adds WiFi Calling Capability for Galaxy S9 S9
22/7/2019,Here are the US Galaxy Note 10 Network Bands galaxynote10 
20/7/2019,Galaxy Fold aced its latest tests and is ready for launch according to report 
19/7/2019,Report Galaxy Fold Ready for Launch Following Latest Durability Tests
16/7/2019,Expect One UI 20 With Android Q Version 21 With Galaxy S11
15/7/2019,Galaxy S10 S10 now start at 300 off for Prime Day
14/7/2019,DEAL Unlocked Galaxy S10 Line is 200500 Off Right Now galaxys10 
7/11/2019,Galaxy Note 10 Stops at the FCC Dancing the No Headphone Jack Dance galaxynote10 
7/11/2019,Heres the Galaxy Note 10 
7/10/2019,This is the Galaxy Note 10
7/2/2019,Verizon Galaxy S10 S10 and S10e Grab New Updates With Performance Improvements galaxys10 
7/2/2019,We know when the Galaxy Note 10 will be announced
7/2/2019,Invites Rolling Out Galaxy Note 10 Arrives August 7
28/6/2019,Friday Phone Deals Pixel 2 XL for 10mo BOGO Galaxy S10
28/6/2019,Shaky Camera Returns Heres the Galaxy Note 10
27/6/2019,Giveaway Win 1 of 5 mophie Juice Pack Cases for Your Galaxy S10
27/6/2019,mophies 99 Juice Packs are a go for the Galaxy S10 lineup 
26/6/2019,DEAL Get MNML Cases for Pixel 3 Galaxy S10 for 1499 With Code 12 Off
26/6/2019,mophies 99 Juice Packs for Galaxy S10 Lineup Offer Up to 2500mAh in Extra Battery Life
25/6/2019,TMobile to Sell the Galaxy S10 5G in Select Cities on June 28
21/6/2019,Friday Phone Deals Galaxy S10 at 300 Off Pixel 3 XL Up to 220 Off galaxys10 
21/6/2019,Galaxy S7 and Galaxy S7 Edge Drop From Quarterly to Regular Security Updates
21/6/2019,Galaxy Note 10 rumored to feature camera with threestage variable aperture 
20/6/2019,Galaxy Note 10 Could Feature ThreeStage Variable Aperture Camera
17/6/2019,Verizon Galaxy S9 S9 Updated to June Security Patch
14/6/2019,DEAL All Unlocked Galaxy S10 Models are 300 Off at Best Buy galaxys10 
