timestamp,body,neg,neu,pos,compound
2019-10-01,"[""I'm currently saving up money for a new flagship phone and I'll be looking into spring 2020 to get one. I really like the size,headphone jack, and side finger print reader of the s10e. My question is how long can I expect the S10e to last me? I'm hoping it last at least 2-3 more years. How has the s10e been to current owners?""]",0.0,0.887,0.113,0.7471
2019-10-01,"[""I have a Samsung s8. I have two nano sim cards (came in cards and pop out). I can fit either card in the primary slot of the SIM tray (the one that would be lower when holding the phone topside up), but I can't fit either SIM card into the second tray. Afraid of breaking the tray -- is there some technique I'm not understanding?""]",0.024,0.899,0.076,0.5267
2019-10-01,"['I\'m a MacBook owner who recently bought a Samsung series 7 TV. It comes with a new features called Remote Access, however, all ""tutorials"" I\'ve seen mention PC and so does the user interface in the TV. Does it work with macOS?']",0.0,1.0,0.0,0.0
2019-10-01,"[""I just ordered a new A20 since my old one is having major issues. It can't detect my SIM card (checked that the SIM is working on a different phone), it can't connect to WiFi, and it can't connect bluetooth either. It also can't accept a tethered mobile hotspot as well as it can't connect to my PC via Kies 3 to update or reset. Since I can't connect to the internet, I can't do a factory reset from the settings either. So here's the predicament as above is just stating what I've tried and what isn't working. I'm trying to hard reset by holding down the volume up button and the power button. Literally nothing happens when I hold down those buttons. Before asking, I have also reset/power down and let it rest many many times. Is there any final solution to hard reset/factory reset my phone before I send it back?""]",0.034,0.9359999999999999,0.03,0.1068
2019-10-01,"['I sent in my galaxy buds for RMA, they have received it over a month ago(August 26th). I got the tracking number for replacement a week after. Seems like it\'s going fine, a week passes and there has been no movement. The person who initated the RMA(from the samsung community forums) emails September 17th me stating: ""Good evening, I just wanted to check in with you. I\'ve noticed that there has been no movement on the tracking number for your replacement ear buds. I currently have this escalated and am awaiting a response. I will follow up with you as soon as I hear back."" Went to the community forums to look at how other peoples RMA\'s were going, well I go to login and it returns with a 403 stating: Problem accessing /us/api/consumer/gnb/social. Reason: Forbidden Isn\'t this a forum ban? I can\'t login via google account, facebook, or even make a new account. It always results in that error. There has still been zero movement on the replacement.']",0.095,0.836,0.07,-0.743
2019-10-01,"['Welcome to the Daily Tech Support Thread for r/Samsung. Have a question you need answered or looking for advice about which Device you should purchase? Ask! Please remember to adhere to our rules which can be found in the sidebar(s) here, and find some new ones! **Note:** Comments are sorted by new for your convenience. If you do not get a response, try asking in the tech support or the purchase advice section of the r/Samsung Discord.']",0.0,0.897,0.10300000000000001,0.8065
2019-10-01,"[""###Welcome to Wallpaper Tuesday, r/Samsung! Wallpaper Tuesday is a day where users can share their favorite wallpaper's and/or find new ones themselves! Please remember to respect the rules below, and to upload the highest quality version of a wallpaper you can find. ----- **Rules** 1. Please use a reputable image host like [imgur.com]( 2. No NSFW posts. 3. Directly linked images only (albums are acceptable). ----- This thread will remain stickied for 24 hours. At that time, the thread will remain active, and an archives link will be posted in the sidebar for easy access. You may also find [archives here](""]",0.02,0.789,0.191,0.9544
2019-10-01,"[""All the apps on there are generally available on the Play Store and most of the Samsung apps are garbage and have bad reviews. I just don't understand why they have their own store. I have a Note 10 and a Galaxy Watch and rarely venture into that store""]",0.07200000000000001,0.879,0.049,-0.2732
2019-10-01,"[""Hey all, I'm a long time apple user and I just made the switch to a Galaxy note 10+ and I'm loving it so far! My question is, how many of you guys case or skin your phones? I have an otterbox and a protection plan, but I really love the aura glow, so I'm debating just leaving my phone caseless. What do you guys do? Also, any tips for a new samsung user? Thanks!""]",0.0,0.871,0.129,0.8959999999999999
2019-10-01,"[""The touch screen on my S7 Edge I just die. I'm talking about the touch features, which apparently is part of the display, so replacing it cost as much as selling the (working) phone itself, where I live. I approximate it has been in use for 2.5yrs, never been dropped, go swimming with, not even a scratch. So is this the life expectancy of newer samsung phone? I like samsung phone, but not sure if I should continue to buy them, as I need my phone to last at least 4 years to justify the cost. What the longest has you been using your phone?""]",0.052000000000000005,0.9309999999999999,0.017,-0.5428
2019-10-02,"[""In particular, does anyone happen to have combination firmware or eng boot file (they could link me) for the Samsung J72018 Verizon, binary 3 version? Thanks. google Search provided nothing but scammy lookin' pay sites.""]",0.045,0.9,0.055,0.09
2019-10-02,"['Hi guy, I use my Samsung a50 currently, when I done setup Bixby voice wake up so I say ""hi Bixby"" and it doesn\'t wake up, I did repeat many times it still didn\'t wake up at all. What is that issue? Tbh I like the old Bixby than this new.']",0.0,0.9470000000000001,0.053,0.3612
2019-10-02,"[""I have a fossil Gen 4 venture hr. I have had to replace it 4 times in less than a year. I'm thinking about getting the Samsung active gear 2. Any thoughts? Suggestions? Any advice is greatly appreciated!""]",0.0,0.905,0.095,0.5191
2019-10-02,['hey everyone i am interested in which of these 2 chargers would keep my s10 and gear s3 cooler in temp. i read that heat ruins battery life. i don’t mind a longer charge if it will stay cooler. i am just not very knowledgeable with wireless chargers. so does a faster charger mean more heat? or does a longer charger mean more heat? thank you!'],0.045,0.8590000000000001,0.096,0.499
2019-10-02,['So it looks like Samsung has now been added to the list of compatible devices for AA with wifi! (if you have a compatible head unit) I want to look into my 2017 Chevy Cruze and see if it is a possibility with my Galaxy Note 10+ now.. ['],0.0,0.915,0.085,0.4753
2019-10-02,"['Welcome to the Daily Tech Support Thread for r/Samsung. Have a question you need answered or looking for advice about which Device you should purchase? Ask! Please remember to adhere to our rules which can be found in the sidebar(s) here, and find some new ones! **Note:** Comments are sorted by new for your convenience. If you do not get a response, try asking in the tech support or the purchase advice section of the r/Samsung Discord.']",0.0,0.897,0.10300000000000001,0.8065
2019-10-02,"['Hi all, I have a question about uploading photos on facebook. When I click on facebook upload pictures, the pictures are not in chronological order. I want the upload to be the same order as when I click on my gallery icon on my note10 plus. Is there a setting i can change? Or is this an facebook problem?']",0.0,0.968,0.032,0.168
2019-10-02,"['I purchased the Note 10+ unlocked version from Samsung. I was very disappointing when it came in and Facebook was installed and I can only ""Disable it"" Does anyone know how to completely remove it?']",0.098,0.902,0.0,-0.5413
2019-10-02,"[""Hey guys, I'm fairly new to Samsung, I've been on apple for ages. I wanted to know what apps most Samsung users run. Samsung or Google? I've used a few Google apps over my time but I wasnt sure if they were the best for photos, connectivity etc. Advice is welcomed! If you have any recommendations for apps too that would be great.""]",0.036000000000000004,0.83,0.134,0.8294
2019-10-02,['I used to be using the S10+ before changing up to the note 10+. I backed up my s10+ twice just in case and there was no failure or anything. However when I backup from the samsung cloud my gallery was empty. Nothing was found in the gallery. I was sure to set the backup gallery active for backup with the actual syncing and all but turn out now I have lost quite a number of my photos. This is my'],0.098,0.8240000000000001,0.078,-0.39399999999999996
2019-10-02,"['Hey all, I have an older Samsung smart tv and am looking for an app that would let me show a photo on the TV. I’ve went to the App Store on the tv, but my searches aren’t bringing anything up. I was wondering if anyone had any ideas?']",0.0,0.961,0.039,0.2144
2019-10-02,"[""I Preordered the note 10+ 5g thru Verizon and was told that I was getting the Samsung $250 pre order bonus. I called samsung a week into having the phone and the rep seemed super confused and said I'll probably get an email in 6 weeks after registering phone (I did already) May not be 6 weeks yet, but still just feel like something isn't right. Anyone have better insight into the pre order bonus than the confused rep on the phone??""]",0.05,0.765,0.185,0.9233
2019-10-02,"[""10+ Years Apple user (the whole ecosystem) which I decided to break when the S10+ came out. Love it so much that I bought the watch (GW46) and the Galaxy buds, also replaced my LG TV with a Samsung smart TV. Very easy to pair my Galazy buds with the Samsung TV via bluetooth, but then there is no way to increase/decrease the volume. It just sits there at the same volume all the time. I paired my Apple Airpods and they work flawlessly, so do my sennheizer, i'm able to increase/decrease the volume (as one would expect). I just don't understand why 2 Samsung devices can't work well with each other but 3rd party brands do. Shouldn't it be the other way around?""]",0.039,0.865,0.096,0.7411
2019-10-03,"[""I recently joined the samsung family with the new tab s6. However I have a problem with trying to use my ps4 controller on my tablet. It says it is connected and the flashing light stops on my controller too but nothing happens. None of the buttons do anything when I click on them. Even when I boot up a game like GTA SA, nothing. I connect that same controller to my android phone (non-samsung) and it's perfectly fine. I can control the home screen and play games. Can someone help with this? There must be some setting I'm missing but cannot find anything online.""]",0.052000000000000005,0.7909999999999999,0.157,0.9319
2019-10-03,"[""I'm not sure if this is the correct place to post this so I apologize in advance if it is. If there is a better sub please let me know. I have a Samsung refrigerator model #RF263TEAEWW. I've had it for a while and it's definitely out of warranty. The last few months I have woken up to find puddles forming around the front bottom left corner on the floor. Sometimes it's small, sometimes it's a lot of water. I thought it may be from a full ice tray and cubes falling behind and melting. After monitoring that and making sure it doesn't get overly full, I'm sure that's not the issue. If anyone has a fix or can guide me in the right direction it would be greatly appreciated.""]",0.057999999999999996,0.867,0.076,0.5074
2019-10-03,"[""[ [ Anyone else hyped about this? I recently across mention of this ultra portable upcoming laptop and I think it could potentially be game changing, at least for me. I never really thought about it much but, by far the two biggest bottlenecks in my laptop usage are having to lug around my battery charger and making sure I'm some place with wi-fi. I don't think it can be overestimated how much more user-friendly not having to worry about either of these things will make using a laptop for the basic user. The new Snapdragon 8cx is supposedly going to go a long way to solving previous windows on ARM issues. And since I don't game on my laptop and just use it for school/work/programming I feel like this will be the definition of a perfect fit for me, and probably a lot of the mainstream public that doesn't have a heavy processing power requirement for their laptop use case. Either way, I'm pretty hyped to see this come out and even just about the trend it represents for where laptops are headed in the future.""]",0.0,0.87,0.13,0.9776
2019-10-03,"[""Hey all, Just got a Tab S6 and plan to use it for YouTube, Twitch, Netflix and university to take notes and keep track of what happened in my lectures. I'm wanting to switch from paper notes to fully digital notes which are backed up online either on OneDrive or Google Drive. I'm just wondering if anyone can share what apps they use and the routines they take to back up their notes. I've been using Samsung Notes but I prefer the 'Notebook' model that other apps have as it allows each module I'm taking to be split up. I also love how I can have several sections and pages in OneNote but I've heard the software for Tabs and androids for that matter isn't up to par? Is that still the case? I was using it but didn't really know what I was missing out on.""]",0.019,0.914,0.067,0.7319
2019-10-03,"[""Should I do it? I've always heard good things about Samsung hardware and software and how it's superior to Apple IOS phones.""]",0.0,0.748,0.252,0.7506
2019-10-03,"['Hi all, I’m sure you get this a lot, but I need some help. I have had an IPhone for about 9 years. Currently at the end of my 2 years with the IPhoneX....I am thinking about making the switch to Samsung but I’ve never had one before or know anyone who does to spec one out. I have some questions... 1.what Samsung should I get? I’m pretty confident on the S10+ but I’m also looking at the note. 2. Is it an easy transition? 3. Talk me into switching to Samsung. I know y’all love that.']",0.0,0.777,0.223,0.9772
2019-10-03,"[""I've been pretty excited about the Galaxy Active 2 but I can't decide if the LTE is worth the price increase. I'm a chemist and would mostly use the LTE when I work in the lab and don't want to bring my phone in there. I'm not sure if it's really worth it but I don't want to get the Bluetooth version and regret it. Any thoughts?""]",0.11900000000000001,0.7020000000000001,0.179,0.5409
2019-10-04,"[""Lots of potential, that's wat I see in Samsung Dex. But to be honest, right now I have no reason for using it. That's why I am looking for practical user cases. So guys, when and for what are you using Samsung Dex?""]",0.062,0.84,0.098,0.3919
2019-10-04,"[""I've recently bought this but I'm being bothered by the fact that it doesn't have a tilt mechanism. So to counter that I have to lower my chair to the lowest point, which is annoying. So, I can't find a vesa mount. Can anyone confirm that it's not mountable? And if not, can you recommend a non-vesa mount that doesn't look monstrous? Thanks.""]",0.22899999999999998,0.7709999999999999,0.0,-0.9406
2019-10-04,"[""For reasons that would be a waste of time to describe, I want to use an integrated screen cover with no fingerprint film on a new Note 10+ (haven't bought yet). I want to use Samsung Pay, and I don't mind using face recognition and/or a pin to do it, but I think on my S9+ I have to use my fingerprint (which is fine, since it's placed a lot smarter on the S9). &amp;#x200B; Anyway, possible?""]",0.063,0.8220000000000001,0.115,0.5859
2019-10-04,"['[TV Plus]( automatically got added to my Samsung TV and I can\'t seem to remove it. I don\'t care if it\'s just an icon that\'s there but it keeps defaulting to that app. I turn off my playstation and it goes there. I\'ve had my TV off and came back to it being on. I\'ve had it switch to it while in another app. I had Google\'d this and can\'t find anything helpful. Threads have told me to ""delete channels"" but when I\'m in the TV Plus I can\'t do anything, except exit the app. It is getting to the point where I\'m just considering selling this TV and getting a new one.']",0.0,0.948,0.052000000000000005,0.7003
2019-10-04,['hi i habe samsung s7edge but its cracked (second time after i fixed it and my battery is dying easily) its been 3 yrs i want to buy a new phone but not too expensive which is better A40 or A50? thnks'],0.0,0.868,0.132,0.6486
2019-10-04,"['My tv, before it used to power on right away when I press the power button. Now I have to press it twice for it to power on, anyone know why this is happening? TV Model: UN65NU6900']",0.0,1.0,0.0,0.0
2019-10-04,"[""I think its really really low for the future flagships. -Jerryrigeverything said there was space in the note 10 teardown. -Samsung even refused to put one in the tab s6 and s5e despite being 10 inch tablets. The s4 last year had it of course. I think Samsung is making a point that they are done with the Jack. - which is cool to me as i never use it on my n9 and s4. All i ask for is some honesty. Just come out and say it instead of using the ' can't fit it argument ' This is the kind of bullshit tactic i expect from apple.""]",0.098,0.8340000000000001,0.068,-0.5368
2019-10-04,"['Welcome to the Daily Tech Support Thread for r/Samsung. Have a question you need answered or looking for advice about which Device you should purchase? Ask! Please remember to adhere to our rules which can be found in the sidebar(s) here, and find some new ones! **Note:** Comments are sorted by new for your convenience. If you do not get a response, try asking in the tech support or the purchase advice section of the r/Samsung Discord.']",0.0,0.897,0.10300000000000001,0.8065
2019-10-04,"[""I was using the super slow Mo mode in the stock camera, while the video was processing the phone froze and shut down, the phone doesn't respond anymore, tried all the button combinations, the phone is stone cold and so is the charger. Going to leave it on charge overnight, if it still doesn't respond I'm probably going to get it replaced, nice job Samsung :/""]",0.017,0.889,0.094,0.7579
2019-10-04,"['I’ve been having this issue for 2-3 weeks now. I have a Samsung galaxy tab s and every time I turn it of after using it I won’t be able to turn it back on for at least an hour. The screen is responsive and the back and recents key both light up when I press the power button it also vibrates when I login using my finger print. Each time I powered it off after use the time for the screen to come back on increased. I powered it off last night and it is yet to come back on 24 hours later. Any help would be much appreciated, thanks']",0.0,0.902,0.098,0.8625
2019-10-04,"['As title says. I can no longer access telegram stickers, browsing to the stickers menu only gives me the samsung sticker set. Can I fix this?']",0.087,0.9129999999999999,0.0,-0.29600000000000004
2019-10-04,['Can you buy it somewhere else and still redeem it ?'],0.0,1.0,0.0,0.0
2019-10-05,['I wanted to ask if its true that samsung unlike apple doesnt need to show how much battery capacity is left after months/years because they have a mechanism which doesnt allow the phone to fully charge or fully discharge? I heard that helps them to maintain still much battery (95%) After a year or two like they advertised.'],0.027999999999999997,0.8420000000000001,0.13,0.7379
2019-10-05,"['So my family owns a samsung smart tv, and we recently got a sound bar that uses a digital audio cable, and no matter where i look or search online i cant find the edition of my samsung tv to find the digital audio cable (for context, my tv is mounted on a wall and can not move at all, and is too heavy to be easily picked up from its mount) so please if someone can find me a link to the tv or something or just give me where it is id greatly appreciate it, the model number for it is UN75JU7100PD, thanks to anyone willing to help']",0.019,0.836,0.14400000000000002,0.9039
2019-10-05,"['The likes of the Google Pixel 3a, Motorola Moto One Zoom and Moto G7 Plus have optical stabilization, even not being flagships.']",0.0,0.882,0.11800000000000001,0.4215
2019-10-05,"['Welcome to the Daily Tech Support Thread for r/Samsung. Have a question you need answered or looking for advice about which Device you should purchase? Ask! Please remember to adhere to our rules which can be found in the sidebar(s) here, and find some new ones! **Note:** Comments are sorted by new for your convenience. If you do not get a response, try asking in the tech support or the purchase advice section of the r/Samsung Discord.']",0.0,0.897,0.10300000000000001,0.8065
2019-10-05,"[""I own a Samsung Galaxy A30. I heard that GCam is the best camera out there, as the default camera app is very disappointing. So I had downloaded a GCam mod APK (130 Mb). The problem is, some of the modes (Night mode, portrait mode) doesn't work, and other modes like photo booth makes the app crash. Is there any solution to this? Any help would be useful. Thanks!""]",0.11,0.706,0.184,0.7183
2019-10-05,"['I have recently gotten into the Samsung Ecosystem, and im in the market for a tablet. The last tablet i had w as s the iPad 2, and Im looking for something new, is the S6 worth the money?']",0.0,0.9470000000000001,0.053,0.2263
2019-10-06,"[""Honestly it's by far the worst experience you could have in a software . Full of microstutterd , everyone you search for an app it's gets stuck and doest respond straight away. The keyboard gets stuck and doesn't withdraw when it's supposed to. It's very very very unsmooth. Like it's in constant beta mode. Samsung hardware is amazing but Samsung SOFTWARE is pure garbage !!""]",0.08199999999999999,0.823,0.095,0.2275
2019-10-06,"[""Thinking about getting a Galaxy Tab A 2019. Currently in school rn and don't want to pay extra for wifi. I would prefer to browse media and play games on a larger screen. How reliable would it be to use Samsung Flow to mirror my phone to the Tab A to play games, browse social media, YouTube, watch movies, etc. TIA. ✌🏽""]",0.019,0.821,0.16,0.8363
2019-10-06,"[""Hey guys! I was wondering if anyone knew where to get a screen protector similar to the one that came on the phone out of the box. I've left my one on as I really like the notch for the camera. Alot of the other screen protectors cut around the camera instead of going around the camera. Thanks!""]",0.036000000000000004,0.9059999999999999,0.057999999999999996,0.3131
2019-10-06,"['Welcome to the Daily Tech Support Thread for r/Samsung. Have a question you need answered or looking for advice about which Device you should purchase? Ask! Please remember to adhere to our rules which can be found in the sidebar(s) here, and find some new ones! **Note:** Comments are sorted by new for your convenience. If you do not get a response, try asking in the tech support or the purchase advice section of the r/Samsung Discord.']",0.0,0.897,0.10300000000000001,0.8065
2019-10-06,"['I switched over from apple to samsung and it\'s been one of my best choices in a while, the only ""problem"" I have if you can even call it that is that the ""chin"" stands out a little bit. Are there any cases that can cover the chin or make it about the same size as the bezzels?']",0.0,0.9279999999999999,0.07200000000000001,0.6369
2019-10-06,"[""I have a problem with how samsung decides to color text/touch icons. If I use a light green background, it makes my status white when I want it black. If i have a somewhat darker purple, it makes my touch icons black when I want them white. As far as the lock screen goes. If my status bar area is green, but my BG is purple, the phone will make my date/time text black with a green gradient on it. I actually don't want the gradient effect at all because its awkward for angle viewing and looks bad. My only workaround for this is to bait the UI into changing the text. I put some white in my mostly green status bar area for my wallpaper, then it changed the text to black.""]",0.066,0.905,0.028999999999999998,-0.775
2019-10-06,['And yes i have a j320f.']-------------,0.0,0.526,0.474,0.4019
2019-10-06,"['I gon Samsung Galaxy A20. It works great, but what I do mind is display. Shoul I change it for A30 or not? I watched some youtube videos and it appears that A20 is little bit faster in loading time.']",0.0,0.934,0.066,0.3716
2019-10-06,"[""Not sure if this is only for the Note 10, but it's that time of year for me where I get to upgrade my device (currently using Pixel XL3) and one of the big selling points of the Note 10 to me at least was Samsung Dex in windows. I use a PC a lot, but I hate having to look at my phone for notifications. Dex seems like a great way to manage them. But in all my researching, no one has ever talked about these questions below: &amp;#x200B; * Do notifications sync across to the desktop and can you interact with them? * If I open chrome will it reopen all the tabs I have on my phone? (what about samsung browser) * Any feedback on social applications like, discord, messenger and twitter? &amp;#x200B; Lastly, and unrelated, do samsung photos do that same motion capture that apple and google does? eg, you take a photo and you can see a few seconds before and after? &amp;#x200B; Thanks for any help.""]",0.063,0.8340000000000001,0.10300000000000001,0.8025
