timestamp,body,neg,neu,pos,compound
2019-10-07,"[""On occasion, my Q6 just loses connection to the internet. I go to open an app and either it just doesn't load or if it does load nothing inside it works. Other times it just straight up gives me a connection error info box offering me to troubleshoot. When going to the network status page it says that the connection is fine but it still doesn't work. So in order to fix this I have to disconnect and reconnect to my WiFi network. The funny thing is that I've had a similar issue in the past with my older Smart TV on a different WiFi network where I would lose connection to the internet and have to keep spamming the retry button to reconnect (or enter the WiFi password again). Any fixes? Entering the WiFi password each time is a bit of a hassle.""]",0.075,0.848,0.078,-0.1406
2019-10-07,"['Power of Sharing - ..aside from the obvious, i.e. post-processing and camera crews, of course. The default camera/video app is rubbish, unless there\'s something I\'m missing with it. For example, there\'s not even an option to shoot in 24 FPS to even achieve that ""cinematic"" look and feel. From what I saw with the behind the scenes of the short film\'s production there weren\'t any lenses attached to the phone for the purpose of demonstrating the power of the phone itself. I\'m even betting on there being very minimum post-processing for that reason alone. That being said there had to be an advanced (and I\'m sure not-free) camera/video app Samsung was using to achieve this. I\'m looking to make a short (and inexpensive) film using the phone as a proof-of-concept for a bigger project I\'m pitching to a professional. The look I\'m trying to achieve is that of what I saw in The Power of Sharing. Any advice, information on what app(s) to use, etc. would be really appreciated.']",0.038,0.904,0.057999999999999996,0.5106
2019-10-07,"[""Good phone all around but when I woke up this morning the phone won't connect to data at all. Wi-Fi is fine, I can call and text, but the data refuses to connect to a service. Any ideas what's going on here? Anyone with the A50 having similar issues?""]",0.0,0.946,0.054000000000000006,0.3736
2019-10-07,"[""Please help, fellow Redditors! I'm squeezing as much life as I can outta this Galaxy S7, with its cracked screen and frequent inability to display anything, hoping that the A90 will grace our shores before my S7 gives up the ghost. What's anyone's best guess as to when/if they'll sell the A90 here in the good ol' US of A? Can't afford a Note or any kind of 10, won't go to the dark side (Apple), would love to stay with Samsung, help!""]",0.051,0.7440000000000001,0.20600000000000002,0.9449
2019-10-07,['Any idea how can i turn off annoying global dimming of the screen during dark scenes?'],0.162,0.838,0.0,-0.4019
2019-10-07,"[""When do you anticipate the galaxy s10+ to go down in price? I'm kicking myself because I saw it for $400 off on bestbuy a few weeks ago and it's only been $150 off since.""]",0.0,1.0,0.0,0.0
2019-10-07,['Is there any way I can view blocked messages on my Samsung s10+. Coming from the Huawei mate 20 pro it was very easy to manage block/unwanted/calls not in contact calls etc. Any one if the s10 has similar features?'],0.05,0.875,0.075,0.2716
2019-10-07,"[""So I have a Galaxy s9 and I broke my camera a while back. I had it fixed and it worked for a little while after that but then it lost focus. Its like it was stuck in near focus, no matter what settings I change in the camera app. I've taken it to a fixit place, talked to Samsung support, even done a factory reset and it still won't work. Any help?""]",0.135,0.759,0.106,-0.29600000000000004
2019-10-07,['I come from a iphone xs. It has broken and I am thinking to switch from apple to samsung (again). Which phone should I get a S10 plus or a note 10 plus? Not sure if I would use the pen on the note.. I had the note 10 in my hands in a store and its INSANE.. such a beautiful phone.. Is there much difference between the s10 plus and the note 10 plus? &amp;#x200B; thanks :)'],0.066,0.8420000000000001,0.09300000000000001,0.4763
2019-10-08,['I put a complaint in with the better business bureau. A few days later I was contacted via samsung corporate and giving a new code. I used the code on the steel active2. After student discount and code total with tax was $221. This works in the US.'],0.046,0.8420000000000001,0.11199999999999999,0.4767
2019-10-08,"['Come on Samsung, the device would be perfect with these features.']",0.0,0.73,0.27,0.5719
2019-10-08,['Seller by the name of mo-gascan has a lot of Note 10 pluses for $600 new and seemingly legit feedback. What do you think? There must be a catch. First of all they want you to email them to verify your zip code can be shipped to. Is this a scam and why? [eBay]('],0.086,0.89,0.024,-0.6635
2019-10-08,"[""###Welcome to Wallpaper Tuesday, r/Samsung! Wallpaper Tuesday is a day where users can share their favorite wallpaper's and/or find new ones themselves! Please remember to respect the rules below, and to upload the highest quality version of a wallpaper you can find. ----- **Rules** 1. Please use a reputable image host like [imgur.com]( 2. No NSFW posts. 3. Directly linked images only (albums are acceptable). ----- This thread will remain stickied for 24 hours. At that time, the thread will remain active, and an archives link will be posted in the sidebar for easy access. You may also find [archives here](""]",0.02,0.789,0.191,0.9544
2019-10-08,"['Welcome to the Daily Tech Support Thread for r/Samsung. Have a question you need answered or looking for advice about which Device you should purchase? Ask! Please remember to adhere to our rules which can be found in the sidebar(s) here, and find some new ones! **Note:** Comments are sorted by new for your convenience. If you do not get a response, try asking in the tech support or the purchase advice section of the r/Samsung Discord.']",0.0,0.897,0.10300000000000001,0.8065
2019-10-08,"['I got a new A70 today. I was wondering if there is a way to make the Spotify widget on the lock screen larger, or for to be in the middle of the screen. Also is there a way to make Spotify show album art on the lock screen like it did with my old Motorola. Thanks :)']",0.0,0.9059999999999999,0.094,0.6597
2019-10-08,"[""Why Samsung isnt updating the s8 ( and s8+) to Android 10 ? It IS hardware capable, I've seen older and less powerful phones planned for the update soon ! If the plan is to make me buy their new phone well jokes on them i am buying a new phone but it wont be a Samsung anymore. Anyone has more details about this?""]",0.0,0.882,0.11800000000000001,0.6434
2019-10-08,"[""So my T-Mobile Note 8 worked perfectly in Hungary/Europe in general when visiting using the Vodafone network (Got a temporary 30 day unlock from T-Mobile when visiting) I had 4G LTE full bars across the whole region. Awesome right?! Now, I'm considering a Note 9 upgrade, but T-Mobile doesn't really sell their version anymore, but I also wanted to skip the whole unlocking procedure with them and just get the phone outright unlocked from Samsung store or a local brick &amp; mortar store or something... My main question is: Will the UNLOCKED U.S. version of Note 9 work the same as my T-Mobile version of my Note 8 in regards to using it outside of the U.S.? Will it be region-locked (I'm not too familiar with that term but I've seen it be an issue with a lot of people, that they have to make a 5 minute call to their country of origin to unlock the region they are currently in i.e, Europe etc.)??? Does the unlocked U.S. version of the Note 9 have the same CDMA/GSM band frequencies as the T-Mobile carrier Note 8 version, Essentially working the same way overseas and at home? I'm just wondering if all the frequency bands available on my Note 8 are also in the Note 9 and none were removed or changed. I don't remember what band it was that I was on in Europe on Vodafone. I tried researching it but couldn't find anything conclusive for the exact models of the phones. Hoping someone can clear it up here, Thanks.""]",0.0,0.9520000000000001,0.048,0.8979
2019-10-08,"['So after spending all that money on a watch and a phone, I have to go out and buy the means to charge the latest watch because Samsung are stupid?']",0.0,1.0,0.0,0.0
2019-10-08,"['From my understanding you need a cable to do this, right? Any word if this will become a wireless feature?']",0.0,1.0,0.0,0.0
2019-10-08,"[""Hello Everyone, I recently saw that my 2016 UN65KS8000 Samsung TV has a single vertical line on the top third of the screen. I've changed inputs and it appears the vertical line is still there despite what device / app I am using. Is this an indicator that the actual LCD has an issue? I didn't purchase any additional warranty, and if I recall, the 'standard' Samsung warranty for electronics is 1 year (is that right?) Either way, I just wanted to ask what I should do at this point to fix the issue and have a fully working TV again? Thanks to everyone in advance for your time and help, it is super appreciated!""]",0.0,0.893,0.107,0.9028
2019-10-09,"[""I need a good 4g watch to use while running so i can Bluetooth to my headphones and run without a phone and listen to music, and receive messages and/or calls. I have a samsung phone. I really like the look of the apple watches and I think the samsung watches look really crappy. If you've got a good suggestion please let me know. Thanks :)""]",0.055999999999999994,0.746,0.198,0.836
2019-10-09,"['Welcome to the Daily Tech Support Thread for r/Samsung. Have a question you need answered or looking for advice about which Device you should purchase? Ask! Please remember to adhere to our rules which can be found in the sidebar(s) here, and find some new ones! **Note:** Comments are sorted by new for your convenience. If you do not get a response, try asking in the tech support or the purchase advice section of the r/Samsung Discord.']",0.0,0.897,0.10300000000000001,0.8065
2019-10-09,"[""I'm looking for a good nice looking low profile pair of wireless earbuds. I see Samsung has the Gear Icon X and the Galaxy Buds. Which is better? Which is smaller?""]",0.06,0.685,0.256,0.782
2019-10-09,"[""So my phone has had this problem the first time when it got to 60% it switched off and lost all battery. The second time it was at 20 and now at 30. As well as it going down rather than up when I put it in charge. I've taken it to samsung in romford twice now, they've replaced the battery and motherboard but 3rd time in a year its happened again. I'm still in warranty. It's getting a bit ridiculous, what can I do? Can I demand the phone to be replaced? Thanks.""]",0.096,0.888,0.016,-0.7595
2019-10-09,"[""So I got my new phone but I haven't received my new SIM yet and instead want to use my old one until the new one arrives. Will it lock my phone to that specific network (I'm switching providers) or can I just put in my old SIM card without worrying? (I live in Germany, if that makes any difference **and** the phone is bought from the Samsung Website (unlocked?))""]",0.0,0.937,0.063,0.521
2019-10-09,"['This is kinda a crazy story, so I thought I\'d go ahead and share. You\'d thing Samsung would not send the incorrect item three times, right? At least they could lie to me and tell me the color I want is out of stock, but no... Towards the beginning of August 2019, my right Galaxy Bud broke under warranty. This pair was one I purchased from an online retailer and I was able to exchange it to Samsung for free, under warranty for free. Keep in mind this pair was white. Unfortunately, when the new pair arrived two weeks later, it was in the Yellow color. This matters to me as I\'d expect the same product to be returned. I was never made aware of why this color change occurred and the Galaxy Buds were still in stock in white online. This didn\'t make sense to me, so I called customer service back about this. They said it was simply a mistake, so I sent back the yellow pair for a white pair. Unfortunately, two weeks later, I recieved yet another yellow pair. This absolutely made no sense. I called back again the day those arrived and told Customer Service the issue. They said they would escalate this situation. A few days later, I was called by someone higher up in the customer service department who apologized profusely about this and agreed to send me a white pair. They said it would definitely be white this time and said it would arrive in a few business days. This brings us to today, nearly THREE WEEKS later (so much for their ""fastest shipping""), where the earbuds arrive again. Yellow. A third time. After the customer service lady said for the third time they would be WHITE. This all seems kinda crazy to me, so if anyone here has insight into what to do, let me know! I\'m done trying to contact the customer service and promotion lines as they are obviously hot garbage with this issue. I sent this information to the office of the CEO today, so fingers crossed they can help.']",0.055999999999999994,0.882,0.062,0.2139
2019-10-10,"['So, my girlfriends all time nostalgia game is Saints Row the third. She has a Samsung Notebook 9 Pro 256GB and I\'ve managed to get the game fully installed but as soon as the game goes to launch regardless of DirectX version used it gives me error **""The application was unable to start correctly (0xc000007b).""** I\'ve tried updating all drivers, bios, running with compatibility settings, updating windows install to latest updates, re-installing the game (three times.. just to be sure., ya know.?) but I\'ve finally hit my end of my personal troubleshooting tips. To my understanding the game should still launch if not minimum recommended specs and I\'m actually typing this on a much older PC setup with an AMD Athlon processor and it still manages to play the game at Ultra 60FPS so I\'m at a loss. Please help!']",0.062,0.883,0.055,-0.2443
2019-10-10,"['I have Samsung Galaxy J7 6 and today I saw an amazing feature on my friends Y2 which have MIUI, I want to know is there a way that I can use the second space on my Samsung device?']",0.0,0.7909999999999999,0.209,0.802
2019-10-10,"['Welcome to the Daily Tech Support Thread for r/Samsung. Have a question you need answered or looking for advice about which Device you should purchase? Ask! Please remember to adhere to our rules which can be found in the sidebar(s) here, and find some new ones! **Note:** Comments are sorted by new for your convenience. If you do not get a response, try asking in the tech support or the purchase advice section of the r/Samsung Discord.']",0.0,0.897,0.10300000000000001,0.8065
2019-10-11,"['Welcome to the Daily Tech Support Thread for r/Samsung. Have a question you need answered or looking for advice about which Device you should purchase? Ask! Please remember to adhere to our rules which can be found in the sidebar(s) here, and find some new ones! **Note:** Comments are sorted by new for your convenience. If you do not get a response, try asking in the tech support or the purchase advice section of the r/Samsung Discord.']",0.0,0.897,0.10300000000000001,0.8065
2019-10-11,"['Sincerely, a life long Apple user turned Android. ❤️ Really though, your apps are limited, and bixby is so slow and horrible. The active 2 watch alone makes me want to switch back to my Apple watch']",0.18,0.727,0.094,-0.5667
2019-10-11,['By on display I mean are people able to like use it/fold it/hold it like all the other phones.'],0.0,0.762,0.23800000000000002,0.6124
2019-10-11,['I’m blind and thinking of buying a samsung tv with voice control for the lack of buttons. The control is the one with the circle for arrows and the centre is the ok button. There’s two rocker switches for volume and channels if that helps you know what tv I’m talking about.'],0.08800000000000001,0.8270000000000001,0.085,-0.0516
2019-10-11,"['Whenever a program is being broadcast in 4K HDR, the Picture Profile icon in the menu shows ""HDR"". If I turn on HDR in the profile settings the picture looks like crap. When I first got the tv you had to turn on HDR. Before the firmware updates there wouldn\'t be an HDR logo. Now there is when the broadcast is in HDR. So I\'m wondering if it\'s now automatic that the TV switches to HDR and no longer necessary to check the HDR+ setting to on in the menu? Like I said, when I do this, the picture quality looks like shit, brownish and washed out. Thanks in advance.']",0.07200000000000001,0.8390000000000001,0.08900000000000001,0.25
2019-10-11,['Thank you for the answers.']----------,0.0,1.0,0.0,0.0
2019-10-11,['## Samsung Galaxy S11 avrà una nuova fotocamera con zoom ottico 5X in grado di scatatre foto bellissime e nitide come una vera reflex Negli ultimi giorni Samsung ha rilasciato un video che mostra le nuove frontiere della tecnologia fotografica che troveranno spazio sul nuovo smartphone Android [Galaxy S11 di Samsung]('],0.0,0.953,0.047,0.34
2019-10-11,"['Exclusive: One UI 2.0 features will include Emoji suggestions ￼ Samsung will make major software-related announcements at its developers’ conference next month. That’s when we’ll get a good look at One UI 2.0, the next major iteration of its custom skin. The company will likely also detail its plans for Android 10 at the event. As you can probably expect, there will be quite a few new features included in One UI 2.0. We hear that one of those features will be Emoji suggestions and predictions. It will be a fun little addition to the Samsung Keyboard. It will surface these suggestions as you’re typing along. Emoji suggestions will be part of One UI 2.0 This won’t really be a groundbreaking feature. There are countless messaging apps that will show Emoji suggestions and predictions as you type. KakoTalk, a Korean messaging app that’s quite popular across Asia, is one such example. Line is another. Similar functionality has long been offered by third-party keyboards as well. Offering this feature with the native keyboard will ensure that users have fewer reasons to switch away from Samsung Keyboard. We recently got our first look at Android 10 and One UI 2.0 on a Galaxy S10. The video showed a glimpse of the new gesture system that Android 10 brings to the table. Google has made it mandatory for OEMs to bring these stock navigation gestures to their devices. The One UI design itself doesn’t appear to have changed much but since this was likely a very early development build, chances are that things may have changed along the way.']",0.0,0.9540000000000001,0.046,0.7933
2019-10-12,"['Looking to buy the galaxy buds, was wondering if I could charge them on the convertible wireless charger that I already own and use with my S10e.']",0.0,1.0,0.0,0.0
2019-10-12,"['I\'ve had a Galaxy S8 for a few years and really liked it. This weekend however I\'ve been trying to develop an Android app using the heart rate sensor and realizing that Samsung makes it **absurdly** hard to access any ""health data"" such as heart rate. Writing the code for normal android devices took me about an hour and it\'s my first time ever accessing a hardware sensor. Trying to write the code for Samsung phones has taken me hours already and I may just give up. Trying to set up a connection to Samsung Health and read it that way is simply hard, and that\'s really frustrating given the fact that it\'s completely unnecessary. I\'m just making this post to vent and see if anyone else has had a similar experience?']",0.046,0.9309999999999999,0.024,-0.2263
2019-10-12,"[""I have been using Samsung phones since I switched back when the iPhone 6S was announced and I was angry at the incremental upgrade. since then I have purchased 8 Samsung phones. I have been an advocate and even told people how much better they are than iPhone. Last year I convinced my wife (a long time iPhone user) to try the new Galaxy Note 9 and she had fallen in love with this phone...until. 6 months in the phone had started to have charging issues. we tried flashing it, factory resetting it, cleaning the charge port, switching chargers, buying original Samsung adapters and so on. the phone will only slow charge on anything except a PureGear charger. to top things off her S Pen cracked (which is apparently an issue). We finally just sent the phone in to be looked at and they called and said that the device was not under warranty because it's water damaged...the phone is water resistant!? she hasn't taken it into water, she does wipe her phone down a lot because she has OCD but that is ridiculous to think that cleaning it has caused enough water damage to prevent fast charge from working. So when it came back I took things into my own hands. I have replaced the battery with a high quality Ampsentrix battery, replaced the charge port with an oem charge port and flashed the phone again with a unbranded firmware hoping it was carrier specific and it STILL won't fast charge. today she called because we finally got our receipt for the phone and it was out of warranty so now she can't even get her pen replaced. So last year I bought a phone for $1100 that took water damage from being wiped down, voided warranty on a water damaged phone, got told repair would be $400 and S pen replacement was another $32 so if I want to continue using the phone I'll need to put another $432 into the phone... I can get an iPhone 11 Pro max with a 2 year apple extended warranty that will replace the whole phone for an extra $100 so the phone and warranty would be $1300 and replacement under the warranty would be $100 so $1400 and the phone would be functioning... might be time to switch back to iPhone...""]",0.051,0.9079999999999999,0.040999999999999995,-0.8282
2019-10-12,['I recently bought a Samsung Q70r smart tv and I was flashed by the low latency times. But my tv is lagging and the latency feels sooooooo high. I can literally press 5 times on the remote control and after 5 sec or so the task will get fullfilled. Can someone help me with my problem?'],0.07400000000000001,0.83,0.095,0.29600000000000004
2019-10-12,"[""My Gear S3 Frontier has been tracking sleep data wrongly a lot lately, recording sleep times even when I am at my desk typing. Sometimes when I put it on the charger, it also records that as sleep (you'd think the fact that its sensors do not detect skin or heartbeat as it draws power would make this obvious). Since sleep tracking is helpful for my personal health records, I usually have to go to the Samsung Health app on my phone and delete this erroneous data. Which begs the question: why doesn't the watch reflect this correction since both devices sync up any time I open Samsung Health (and I assume it gets uploaded to my Samsung Account)..?""]",0.027999999999999997,0.948,0.024,-0.1154
2019-10-12,"['So a few years back when the exploding Note 7 incident occurred, I returned my Note 7 expecting a refund. But Samsung claimed that I never returned the 2nd unit they sent out and refused to give me a refund no matter how hard I tried. Fast forward to August of 2019, I received a lost parcel with the 2nd Note 7 unit that they sent out and claimed I had. I called up Samsung\'s support line that referred me to enrsupport@samsung.com and after a lot of back and fourth they agreed to refund me once I returned the 2nd unit. So they sent me a return label package and I returned the unit in the middle of August. Now it\'s been over 2 months where Samsung claims they\'re going to be refunding me repeatedly, but all they end up doing is giving me the run around and constantly ignoring status update requests. They\'ve been giving me excuses such as their account department is on vacation, ""the VP at Tech Data is involved now and you should be seeing a refund on your card soon"", ""I\'ll contact them again for an update"", ""I just spoke on the phone with them earlier today and you\'ll be getting your refund"". I even tried calling Tech Data directly and got some low level support agents that said they would follow up with me weeks ago and never did. TLDR - Samsung Canada refuses to refund my exploding Note 7 purchase and keeps giving me lies and excuses and I would really appreciate some help. Thanks in advance to /r/Samsung to anyone that could provide some help on this matter.']",0.069,0.8079999999999999,0.12300000000000001,0.9508
2019-10-12,"[""Hi guys! I'm thinking of buying my first ever smartwatch, the Active 2, but I'm trying to decide whether for the aluminum or stainless steel. I'd go for the 44mm and use it both for fitness tracking and every day use. Any recommendations on why I'd pick one above the other? My idea is for it to last a few years and I'm not thinking of using the LTE, but I like the difference in hardware. Your guidance will be highly appreciated 😁""]",0.0,0.856,0.14400000000000002,0.9175
2019-10-12,"['I recently learned that verizon blocks ""findmysamsung"". My mom is going through hell and back trying to find hers because she either lost it, or has had some recent company that might have pawned it. I was wondering if it is possible to unlock my own watch so I can avoid this fiasco if I should ever lose my own watch. I have recently gotten into the world of unlocked devices and I\'ll never go back, but obviously I didn\'t know about this beforehand.']",0.14,0.86,0.0,-0.8371
2019-10-12,['my 55 inch qled samsung tv keeps shutting of and coming back on randomly. anyone else have this problem?'],0.0,1.0,0.0,0.0
