,body,timestamp
0,"You lose credibility with these statements. There are more than a few posts on this and other Samsung product subreddits about poor support. They don't always stand behind their product and there is plenty of room for improvement with their product support.

Also what other brands are you speaking of? Why not post some authoritative links?",2019-07-31 08:49:45
1,"Yes. The writing functionality is based on (I believe) the magnetic sensor within the S-Pen. Bluetooth functionality was introduced with the Note 9, but the Note 8 pen which doesn't contain a battery still works with any Samsung device that has S-Pen capabilities.",2019-07-31 09:25:30
2,"People that work at Samsung/Apple have the phones early. You can check the Youtube video of a girl that his father worked at Apple and she basically leaked the iPhone X and his father got firer. Also as far as I know in Korea and US, Samsung gives phones to people to test them as their daily phone. You can check the S10. People have been spotted with them months before them being released.",2019-07-31 09:31:25
3,"The top title bar reads ""Submit an Issue / (Buttons) Attach / Upload"" plus he's submitting an issue with the Samsung Pass app",2019-07-31 09:36:10
4,Well the folds display is messed up with the screen saver so why would Samsung let workers use it and have the chance to spoiled the phone out in public,2019-07-31 09:46:06
5,"The Samsung A20 should boost sales a bit.

It is a gift to value buyers.

I was able to play video for 4 hours (Youtube, Wifi, Airplane mode, lowest brightness) and my A20's battery went from 100% down to only 80%.",2019-07-31 09:47:27
6,"Reps carry them but can only show them behind closed doors to Samsung colleagues.

Source: I work at Samsung.",2019-07-31 09:55:52
7,"I will be messaging you on [**2019-08-07 17:39:04 UTC**](http://www.wolframalpha.com/input/?i=2019-08-07%2017:39:04%20UTC%20To%20Local%20Time) to remind you of [**this link**](https://np.reddit.com/r/samsung/comments/ck9jxn/galaxy_note_10/evlhfhj/)

[**CLICK THIS LINK**](https://np.reddit.com/message/compose/?to=RemindMeBot&amp;subject=Reminder&amp;message=%5Bhttps%3A%2F%2Fwww.reddit.com%2Fr%2Fsamsung%2Fcomments%2Fck9jxn%2Fgalaxy_note_10%2Fevlhfhj%2F%5D%0A%0ARemindMe%21%202019-08-07%2017%3A39%3A04) to send a PM to also be reminded and to reduce spam.

^(Parent commenter can ) [^(delete this message to hide from others.)](https://np.reddit.com/message/compose/?to=RemindMeBot&amp;subject=Delete%20Comment&amp;message=Delete%21%20ck9jxn)

*****

|[^(Info)](https://np.reddit.com/r/RemindMeBot/comments/c5l9ie/remindmebot_info_v20/)|[^(Custom)](https://np.reddit.com/message/compose/?to=RemindMeBot&amp;subject=Reminder&amp;message=%5BLink%20or%20message%20inside%20square%20brackets%5D%0A%0ARemindMe%21%20Time%20period%20here)|[^(Your Reminders)](https://np.reddit.com/message/compose/?to=RemindMeBot&amp;subject=List%20Of%20Reminders&amp;message=MyReminders%21)|[^(Feedback)](https://np.reddit.com/message/compose/?to=Watchful1&amp;subject=Feedback)|
|-|-|-|-|",2019-07-31 09:59:55
8,"This is an android tablet, Surface Pro is a full Windows 10 machine. If you need to run full offline programs and not just apps, get the surface.

If you primarily do everything on the internet and you already have other Samsung products get the Tab S6.",2019-07-31 10:08:43
9,Yeah. I remember when I toured a major phone carrier facility. It was a very in depth tour and they said they really really wish they could show us a testing room where they had where they get to test prototype devices that are 5 years out. But they were not allowed to. Just makes me wonder what Samsung and other companies have planned,2019-07-31 10:27:58
10,"Looking into this as well, seems the galaxy s series, 8 and up, and tab 4 only.

https://www.samsung.com/global/galaxy/apps/samsung-dex/",2019-07-31 10:45:43
11,"It looks like Exynos 9610. Not sure how they managed it in the US. I do have another low end Samsung phone that only has Exynos. It's a US carrier phone, too. So I know it's possible.",2019-07-31 10:48:16
12,"On a severe budget, why even consider samsung?

Poco F1, Pixel 2 or 3a, Xiaomi......
Second hand of above...... Etc etc",2019-07-31 10:48:32
13,"Yup, I need a tablet to edit photos with. Also it's light, loud, comes with a pen and works with my Samsung ecosystem of products.",2019-07-31 11:06:31
14,It's looks exactly like 8x digital zoom on a Samsung.,2019-07-31 11:30:50
15,Yep definitely. That makes sense though seeing that Samsung usually has bad placement of the power buttons. Like on the s10 series it's too high.,2019-07-31 11:30:52
16,Yeah it definitely looks like Samsung style photo processing.,2019-07-31 11:32:01
17,Samsung Galaxy Core ?,2019-07-31 11:56:48
18,Samsung duh. Can't your read?,2019-07-31 12:04:07
19,"#### Hi there Mpikoz!

Regrettably your submission has been removed as it did not fall in line with /r/Samsung's rules:


&amp;nbsp;


&gt; **Rule 1:**
&gt; 
&gt; Posts must foster reasonable discussion. This includes rants and low-effort posts, both positive and negative in nature.
&gt; 
&gt; Threads need to consist of paragraphed discussion which benefits the community and have a purpose. Threads that are also littered with explicit language, or consist of a few sentences with explicit language will be removed until you edit your post to be constructive.


&amp;nbsp;


Thank you for understanding! We welcome you to edit your post to fall in line with Rule 1. Thank you for your submission!

-----

*I am a bot, and this action was performed automatically. Please [contact the moderators of this subreddit](/message/compose/?to=/r/samsung) if you have any questions or concerns.*",2019-07-31 12:47:55
20,"My samsung galaxy buds are connected to my computer but not working for audio. They work fine with my motorola android phone, ipad, and linux computer but poorly with my windows 10 computer. The first time I connected my galaxy buds to my windows computer they worked with audio but all afternoon I have tried and failed to do the same thing again.",2019-07-31 12:51:04
21,"Yeah man and so well wait.. then why is it called 4k? Also, so is UHD higher then QHD? But yeah man they kind of downgraded display to apples type man.. Samsung would make more if they upgraded the pixels or kept them the same.. but no they're going to downgrade to 1080p and the iPhone xr isn't even full 1080p which is terrible and its 2019.. why Samsung.. if S11 or note 11 doesn't have it, that will suck a ton for us Samsung users in my opinon.. removed headphone Jack ( if it happens) and no 4k.. nooo",2019-07-31 12:59:26
22,iPads have generally always been the best tablets. They are the main reason why Samsung is one of the few companies left that still make android tablets.,2019-07-31 13:11:01
23,"sorry about the long response delay, but this hasn't worked either. I'm thinking I'm going to have to seek a warranty repair option. is there any option I can take outside of sending the buds to Samsung and waiting for multiple days/weeks?",2019-07-31 13:15:20
24,"HA! Okay... Sure... Whatever. TVs, Watches, 8 Phones going back to the original S Galaxy... So, if the fact I've always gotten good support from them makes me lose credibility. Whatever. Go live in your own little world where everyone has bad service with Samsung.",2019-07-31 13:15:49
25,"According to Samsung, you have to be in the plan for exactly 12 months and no sooner, then you trade in your device and you get whatever left you owe and then you can apply it towards a new payment plan.",2019-07-31 13:19:08
26,"There are compromises. I use a pouch to carry my Note 8 around but actually use it as Samsung intended. So far, my drops have been in the pouch (the most common drops are taking it in and out of your pocket) and the pouch saved it.",2019-07-31 13:31:15
27,"Get package disabler, not through the app store but from their website. This isn't like root so you won't trip Knox but just be careful to not disable anything important.
I've found that disabling the face id features significantly slow down Samsung pay",2019-07-31 13:42:14
28,"Imagine if that's the big sell of the Note 10. Samsung disappoints with the lack of a headphone jack, but in exchange brings a holeless display",2019-07-31 13:42:42
29,cool. I also work in samsung. what dep are you in?,2019-07-31 13:53:49
30,"The camera hole is what sells its credibility though...

Matches exactly what what we saw with the S10, even on [test models](https://imgur.com/a/6Jtr36q/) spotted in the wild.

The camera is shallow and of course would appear like that. There’s also other angles of the device [As seen here...](https://i.imgur.com/2Nfahp7.jpg)

The same person was also wearing a [Galaxy Watch Active 2](https://i.imgur.com/fFf2Fb4.jpg)... lotta credibility and pretty big chance this was just a Samsung employee testing the device.",2019-07-31 14:13:39
31,"Not even close.  I wish Samsung would compete with iPad, but sadly they won't put the hardware inside to really compete.  Although the screen is really pretty.",2019-07-31 14:38:30
32,"
Your submission was automatically removed because your post had no body, and it's considered low-effort. 

Please submit a new post with both a title and a body.

*I am a bot, and this action was performed automatically. Please [contact the moderators of this subreddit](/message/compose/?to=/r/samsung) if you have any questions or concerns.*",2019-07-31 14:48:04
33,"I wonder what case they are using, if it's official from Samsung. It looks like either an S-View or LED Wallet? If it's the latter, I hope the interior isn't made of the old stuff before the S10's case. That stuff gets so gross overtime for those who don't know.",2019-07-31 15:29:30
34,Yeah I checked but the US wifi version does not include that option unlike the Samsung 5se and now the tab s6,2019-07-31 15:37:29
35,"When you are eligible to upgrade, you send in your phone and they will pay off the remainder of what you owe on your phone and then you enter a new 12 month agreement with Samsung.",2019-07-31 16:15:11
36,"how about ""Power off phone &gt; BIXBY + VOLUME UP + POWER &gt; let go of POWER after Samsung logo &gt; From recovery select ""reboot to bootloader""?",2019-07-31 16:30:29
37,I chatted with a Samsung rep today and they told me no. You'll have to pay off the whole phone and trade it in. According to them you have to keep the phone 12 months to the day regardless of payments or you're not eligible for upgrade.,2019-07-31 17:03:00
38,"IMO the outcry wasn't really as big with the IR blaster. Plus Samsung had an ulterior motive with that because they're pushing Smart Things, one remote to control everything and it won't rely on IR.
Same as with removable battery. Instead of manufacturers trying to attract Samsung customers with removable batteries, the majority of them went with Samsung in sealed units.
In the case of microSD, many manufacturers kept it and the memory of the S6 and Note 5 simply weren't enough for it to go just yet.
The return of the headphone jack now rests on 2 things. 1 is the Pixel. The Pixel 3a brought back the jack in their lineup. If the P4 gets it, then we have a viable competitor to Samsung that has it. 2 is the sales of the Note 10. If it's low and the major reason is the jack.
So Samsung does have a history to backtrack, but only when certain conditions arise. If the loss of the jack does not affect sales, they might not.",2019-07-31 17:11:20
39,He/She is typing: Samsung Pass update ....,2019-07-31 17:54:25
40,"Hello. I own the Samsung Galaxy S10+ with the Sprint network. I pay for phone insurance which is operated by Asurion. Recently, I scratched my phone screen. But I call the Sprint authorize company store and they're telling me, ""No, we cannot repair or change your screen because of a scratch."" I called Asurion, they're telling me, ""You filed your claim and now we want you to take your device to a Sprint store for a tech to look at your device.""

This is really annoying. My phone is scratched. I pay for insurance. But I'm getting sent all over the place? 

I'm now left to contact Samsung. It's a deep scratch on the lower portion of my phone screen. The screen still works! But the scratch is annoying me. 

Last Friday, my nephew was watching a show on my phone and he was trying to avoid being stung by a bee and mistakenly scratched my device screen on the steps. Lucky, he didn't destroy the phone! Boy, I was lucky!

Can someone help me? Asurion and Sprint are confusing me!",2019-07-31 18:20:59
41,You have to subtract the temperature from 100 for Samsung SSD drives.,2019-07-31 19:04:24
42,"Hello, I have a Samsung Galaxy S8 Edge with Verizon.  For a few months now whenever I get a text message a blue box pops up with a microphone- the blue box is not from my messaging app (textra) which already sends me a pop up box- so I get two pop up boxes per text.  I thought it was from Bixby so I tried deactivating Bixby as much as possible. I also contacted Samsung tech support who told me to pick ""cards"" under Bixby settings and turn it off- unfortunately ""Cards"" is not an option under my Bixby settings. They also suggested the pop up box is from Google, because the microphone looks like the google microphone.  I have a screenshot, but I don't know how to upload a photo in a reddit comment box.  Does anyone know which app the pop up box is from?",2019-07-31 20:02:01
43,"And? It's not like it's available for anything non Apple, so why take it against Samsung. It's not like they're hiding something more powerful back from you. It's not like iOS is taking full advantage of it either. Would I like Android running on something that fast? Yes. Would it be a reason for me to consider an iPad over an Android tablet. No.",2019-07-31 20:25:49
44,"Wow, you're taking it a little personal. No tablet running a mobile operating system takes full advantage of its hardware because they aren't meant to be laptops. Android on a tablet has always been a mess and lacked optimization. The iPad Pro’s are functional but don't justify their price tag.  Google even announced they aren't making tablets anymore. Samsung makes excellent hardware but like I said Android in tablet form isn't great. Now the Samsung Windows tablets are nice and they can justify their price because of Windows and the ability to run full desktop applications.",2019-07-31 20:54:22
45,"Those are unreliable and probably easier to break

I would rather have a phone with a hole in the screen and no moving parts, than an uninterrupted screen and the possibility that the front camera could literally stop working, also it's probably harder to make it water resistant

And besides, Samsung are meant to be working on under screen cameras anyway",2019-07-31 20:55:36
46,I just realized you weren't the guy I originally replied to who said Samsung isn't bringing in the hardware.,2019-07-31 21:18:04
47,"No worries. Samsung has the hardware it's Android that needs optimizations in the tablet market. That's why the iPad is so popular, I know a lot of people that use Windows PC’s, have Android phones and use an iPad. I just hate how Apple makes decisions for their customers and doesn't give them an option to change it like with two-step authentication on icloud.",2019-07-31 21:24:31
48,"https://www.techwalls.com/samsung-galaxy-s10e-model-number-sm-g970-differences/

Looks like we get Snapdragon here, my phone is the first version listed under Bell mobility because I'm with Virgin Mobile.",2019-07-31 21:59:31
49,"So, I have a Samsung Galaxy S8 Active Gold version and I want to upgrade my phone from Oreo to Pie but I don't have any SIM card to update from so I'm stuck. I bought my phone from the internet so I don't know who I bought it from. I am going to be switching to t-mobile soon so I want to unlock my phone but again I bought it online so what do I do to update my phone then unlock?",2019-07-31 22:33:47
50,Why with Google developing ChromeOS shouldn't Samsung develop a tablet that uses Android?,2019-07-31 23:32:02
51,"I miss it too. Was searching for it a long time. I can't stand gestures the way Samsung implemented them. I also don't like the little bars on the bottom of the screen displaying where you have to start your gestures from. 
Technically the little dot to tap twice shouldn't be a problem at all.",2019-07-31 23:49:28
52,"Hi there richardsonj36!

Regrettably your submission was automatically removed as it was flagged as not falling in line with one of r/Samsung's rules:

&gt; **Rule 6** No posts relating to buying, selling, trading, giveaways or asking for advice about any of those topics.

Please post your issue/concern in the [Daily Tech Support](https://www.reddit.com/r/samsung) instead. Even though it as a ""Tech Support"" thread, you can ask anything related to advice on buying/selling/trading Samsung products.

*I am a bot, and this action was performed automatically. Please [contact the moderators of this subreddit](/message/compose/?to=/r/samsung) if you have any questions or concerns.*",2019-08-01 00:05:43
53,"It should be yes, did you buy it directly from Samsung?",2019-08-01 00:09:35
54,Samsung allows you to register several fingerprints. Do this with only one of your fingers you are going to use the most. This way the fingerprint sensor will be more likely to function faster and to register it even if you didn't place your finger like when you registered it back then.,2019-08-01 00:16:32
55,"S6 w/ 128GB: $650
Ipad pro w/ 64GB: $825

&gt;  And a bunch of other stuff,

Like DeX, kde connect or an actual pencil: https://www.samsung.com/us/mobile/mobile-accessories/tablets/staedtler--noris--digital-samsung-pencil-gp-u999eripaab/

Ipads are nice, but it is good to have alternatives.",2019-08-01 00:25:22
56,"Hi i did same. You may of bought it from hong like me thru an australian website , but when the box arrives it says Samsung Malaysia. I googled samsung malaysia and chat with their sales consultant who confirmed all A50s and A70s from samsung malaysia do not have built in NFC hardware. They also said there maybe other differences like different apps emojis etc. Infact mine came with earphones where one earphone is 2foot longer than other apparently so you can stick it in your mates ear as well",2019-08-01 01:11:27
57,"The phone is pretty decent. I am not gonna lie.  I was concerned about UI/UX because the last time I used a Samsung it was on TouchWiz and I hated it passionately. OneUI, on the other hand, is pretty decent. My only gripe right now is the lack of updates or rather an inconsistent release of updates. Some countries are already on July security patch, some are on June security patch which improves the camera, and I am stuck on May security patch.",2019-08-01 02:18:56
58,"Could be real. Trying real hard to read the korean but the picture is not of the highest quality so I could only get some of the words.

&amp;#x200B;

I'll write down the korean characters so you can compare yourself and the **english translation down below**. stuff too unclear to be read will be represented with an asterisk.

&amp;#x200B;

\--------------------------------------------

Korean transcription

\--------------------------------------------

&lt; \*\* 전송                            첨부   \*\*\*

&amp;#x200B;

\*\*

Once

&amp;#x200B;

\*\*\*\*\*

Other samsung app

\*\* \*\*

\*\*패스 업데이트 ㅅ|

&amp;#x200B;

\--------------------------------------------

English translation:

\--------------------------------------------

I straight up reckon this guy is a tester of some sort and is reporting a bug to samsung

&amp;#x200B;

&amp;#x200B;

&lt; \*\* send                            attach   \*\*\*

&amp;#x200B;

\*\* *(guessing this would say something like frequency of bug)*

Once

&amp;#x200B;

\*\*\*\*\* *(where bug occurred)*

Other samsung app

&amp;#x200B;

\*\* \*\* *(details of bug/error)*

\*\*Pass Update s| (\[whilst?\] updating samsung pass)",2019-08-01 02:41:11
59,Anyone @ Samsung can get pre-production demo units you just need to sign up for the program.,2019-08-01 02:44:07
60,"I just take a power bank with me everywhere, now that I've gotten used to it I couldn't live without it. Also the Samsung adapters are very small I sometimes carry that if I know I will be around sockets.

Batteries are made to be used, so use your phone as you enjoy it and forget about the battery.",2019-08-01 03:27:32
61,"Recently I bought Samsung A20 and a SD card. But, I can't move my game data to SD card.

Game like AOV, Epic Seven and Browndust have setting manage storage (move to sd card), after I click it nothing happens. The game data still in internal memory

Is there any other method?",2019-08-01 05:04:11
62,Got someone better to ask an irrelevant question about Samsung to?,2019-08-01 05:57:29
63,I used the jack to plug my phone in to my car stereo! Now i'll have to use a dongle or buy a new car stereo with USB... Cheers Samsung!,2019-08-01 06:15:34
64,"Well Google's own tablet program under Chrome OS is on life support. To be honest, I believe that Samsung just want to make a tablet that can at least rival that of Apple's as far as hardware is concerned. But until Google comes up with a better OS that is tablet compatible then it will be hard for it to rival Apple's OS",2019-08-01 06:25:41
65,samsung has entered the dongle group chat*,2019-08-01 06:26:11
66,"There is a reason tho. They really want the Note 10 to become mainstream which is why they also made a smaller version this time. The smaller version obviously has a smaller battery as well and they removed the headphone jack and the ad card slot in the smaller version for a larger battery. And obviously people would buy their Galaxy Buds as well. Everyone knew that Samsung would remove it some day, why is everyone so surprised now. Wireless is the future.",2019-08-01 06:49:30
67,"Add for the heating im gonna guess it's due to the age of the device, my s7 also got a littloo e hot near the end of its life.

For the placement you might just need better pads. Some of the older Samsung ones aren't the best for it,  mainly the first gen fast charging pads. Rectangular pads are fantastic, even if it wasn't the same shape as your phone, most of them have full coverage.",2019-08-01 07:15:28
68,Dude it’s not like any future Samsung flagship will have a headphone jack anyway...,2019-08-01 07:33:15
69,"Seen this exact image on AliExpress, Although I am dissapointed if Samsung were to join in",2019-08-01 07:36:19
70,"Samsung is joining. It’s basically official and confirmed. 

The [FCC released photos](https://i.imgur.com/ByOkfKk.jpg) of the Note 10 and there’s  no headphone jack.",2019-08-01 07:38:28
71,"
Your submission was automatically removed because your post had no body, and it's considered low-effort. 

Please submit a new post with both a title and a body.

*I am a bot, and this action was performed automatically. Please [contact the moderators of this subreddit](/message/compose/?to=/r/samsung) if you have any questions or concerns.*",2019-08-01 07:40:41
72,Note9 most probably will be my last Samsung phone. First they made fun of everyone and now they joined them.,2019-08-01 07:46:47
73,"When the iPhone 7 was released with no headphone jack the market was not ready but I think that now is the right time to ditch the headphone jack, for 2 reasons:

1.Most people use the car aux as a reason why they need it but most, if not all, cars released in the past 2-3 years have Bluetooth and if your car doesn’t, there is a cheap device the plugs into the cars aux and you can connect using Bluetooth

2.There is a 90% chance that Samsung will offer free galaxy buds and a dongle with the note 10, so you won’t have the excuse of saying I don’t have Bluetooth headphones.",2019-08-01 08:05:12
74,"I'm glad my S10 has a jack, I'm hopping they keep it. Pleased Samsung I'm begging you",2019-08-01 08:21:30
75,"I just don't understand, why remove the headphone jack? is it too expensive to put in the phone when not enough people are using it? Are they just trying to push wireless headphones? I use wireless so this doesn't effect me, I'm just disappointed in Samsung for lowering themselves to Apple's cheap parlor tricks",2019-08-01 08:22:33
76,"Agreed, headphone jack is good to have but not a must. However one of the main reasons I switched from iPhone 7 plus to Note9 is the headphone jack. Since Samsung is taking it always I might just go with a Pixel or go back to iPhones when I am done with my Note. There is no reason really to choose Samsung again. They are extremely slow on OS Updates, the camera video recording has time limits, the front camera is not good compared to iPhones or Pixels, their pricing is always increasing with no legit reason.  Don't get me wrong I like my Note9 and I will keep at least for another year or more.",2019-08-01 08:28:34
77,Exynos can be custom firmwared in the future when Samsung stops supporting it.,2019-08-01 08:46:20
78,"This was very helpful, thank you. Do you have any idea how release dates work for these kinds of things? Can you buy it online on release date, or do you have to go to a Samsung store?",2019-08-01 08:48:02
79,"
Your submission was automatically removed because your post had no body, and it's considered low-effort. 

Please submit a new post with both a title and a body.

*I am a bot, and this action was performed automatically. Please [contact the moderators of this subreddit](/message/compose/?to=/r/samsung) if you have any questions or concerns.*",2019-08-01 08:53:11
