,body,timestamp
151,"
Your submission was automatically removed because your post had no body, and it's considered low-effort. 

Please submit a new post with both a title and a body.

*I am a bot, and this action was performed automatically. Please [contact the moderators of this subreddit](/message/compose/?to=/r/samsung) if you have any questions or concerns.*",2019-08-02 08:54:01
152,One of the main reasons I like Samsung is because they still had the headphone jack. My first Samsung was the S6 and now I have the S9,2019-08-02 08:59:49
153,The name of the processor Samsung phones in the USA and China get. Meanwhile exynos is what the rest of the world gets,2019-08-02 09:29:12
154,"Please someone help because I'm panicking. I got my Samsung Galaxy s9 at Christmas time and all of a sudden it stopped charging. I've tried different chargers and they're not working. I was at the gym and a message appeared on my phone saying something like ""what should this device do while charging"" even though my phone wasn't connected to anything",2019-08-02 09:37:04
155,This is the Samsung s10e by the way!,2019-08-02 09:46:12
156,"I really wish they would revive their old logo, this is much more symbollic and aesthetic than current logo which just screams SAMSUNG.",2019-08-02 11:01:38
157,"
Your submission was automatically removed because your post had no body, and it's considered low-effort. 

Please submit a new post with both a title and a body.

*I am a bot, and this action was performed automatically. Please [contact the moderators of this subreddit](/message/compose/?to=/r/samsung) if you have any questions or concerns.*",2019-08-02 11:11:46
158,"I honestly have no idea. I've been here 15+ years and that thing has been here WAY longer than I have. In fact, our newer microwave (that's much smaller) sits on top of the old Samsung.",2019-08-02 11:16:32
159,"Hi there cool4902!

Regrettably your submission was automatically removed as it was flagged as not falling in line with one of r/Samsung's rules:

&gt; **Rule 6** No posts relating to buying, selling, trading, giveaways or asking for advice about any of those topics.

Please post your issue/concern in the [Daily Tech Support](https://www.reddit.com/r/samsung) instead. Even though it as a ""Tech Support"" thread, you can ask anything related to advice on buying/selling/trading Samsung products.

*I am a bot, and this action was performed automatically. Please [contact the moderators of this subreddit](/message/compose/?to=/r/samsung) if you have any questions or concerns.*",2019-08-02 11:32:35
160,Fun fact: Samsung originally started off selling sugar.,2019-08-02 12:00:03
161,I'm sure Samsung will grieve over you........smh,2019-08-02 12:47:49
162,"Hi there VeryThiccSchnitzel!

Regrettably your submission was automatically removed as it was flagged as not falling in line with one of r/Samsung's rules:

&gt; **Rule 4** No tech-support questions outside of the Daily Tech Support sticky.

Please post your issue/concern in the [Daily Tech Support Thread](https://www.reddit.com/r/samsung) instead.

We **may** approve your post if it is a high-level issue that can't be found through searches. Please [Modmail us](https://www.reddit.com/message/compose?to=/r/samsung) if you think this is the case.

*I am a bot, and this action was performed automatically. Please [contact the moderators of this subreddit](/message/compose/?to=/r/samsung) if you have any questions or concerns.*",2019-08-02 13:20:14
163,"Just realize that Samsung wants to sell tons of Note 10+ instead of Note 10. Therefore, we call that ""Strategy"" folks.

I cant imagine anyone who pays 1000 euro for fake flagship device that is named as ""Note 10"".
HD+ screen, No 3.5mm, No SD Card, 3500 mah for a note series device.

Note 10+ ? Almost 1200 Euro. Think thrice, not twice. You will still get a device that has lack of features.",2019-08-02 14:02:44
164,"Actually they were a trading company before getting into sugar.

https://en.m.wikipedia.org/wiki/Samsung",2019-08-02 14:39:39
165,Because as good as the processor Ipad is its limited by it's software. Samsung's Dex makes it better to do those activities. The rendering time differences is a few seconds. Games and movie also look much better on the superior Samsung display.,2019-08-02 14:48:29
166,"1) you're inputting it wrong.
2) the systems are down/producing an error
3) your phone is a fraudulent copy of a Samsung product.",2019-08-02 15:11:38
167,We should simply stop supporting samsung... and switch to other android phones...,2019-08-02 15:36:18
168,"Android tables are closer to desktops. Especially Samsung with dex mode. And with USB C you can attach displays, mice Keyboards, usb's and even things like Infared cameras. You can use the tablet like a mini computer.",2019-08-02 16:12:22
169,The A50 on Amazon isnt the Verizon compatible one. They have Verizon and Sprint compatible on the Samsung website. I got the A50 just a few days ago and it is absolutely amazing so definitely look to get it. It doesn't disappoint.,2019-08-02 17:03:58
170,No problem! I also seemed interested in the routines but since it asked for so many permissions I decided that just doing everything myself was better than giving a lot of unnecessary perms to Samsung and Google.,2019-08-02 17:47:40
171,"Yeah I'm with you on that. I turned off all the syncing and adjusted every security and privacy setting I could find. And the email addy I'm using is just an alias I only use for them. 

That said, its still bugging me, and just the overall feeling of them wanting you to have a samsung account for every damn feature. That's why I said I'm not even sure I'll keep using the routines even tho they work. 

Btw not sure why someone DVd your first post but I did get you for taking the time to answer.",2019-08-02 17:52:02
172,"So after I bought my galaxy buds it seemed to work fine and everything charged to green smoothly, but then I noticed one morning that my galaxy bud case remained red even though I left it charging on my samsung duo wireless charger overnight. Over the course of several days and nights I found the same issue and the buds just didnt seem to charge wirelessly though they charged using the wire. At one point the led lights both inside and outside the case just stopped working. I took them to the service centre at least 4 times and everytime they told me they found no issue with it. At one point I managed to make the case yellow but when I placed it back on the charger and checked on it again after awhile it was red again. Am I doing something wrong, or is there a reason why the techs say it works fine but I cant get it to work. They told me not to charge it overnight in case overcharging is the issue, but even then I couldnt get it to charge. Any help would be appreciated. Thanks",2019-08-02 18:00:56
173,I was born 24 years after 1980 too. Nearly all people around my age(in america) seems to use apple. People underestimate samsung..,2019-08-02 18:27:37
174,Please post Photography on our Shot on Samsung Sunday thread,2019-08-02 20:07:45
175,"Hi there TJColeson!

Regrettably your submission was automatically removed as it was flagged as not falling in line with one of r/Samsung's rules:

&gt; **Rule 6** No posts relating to buying, selling, trading, giveaways or asking for advice about any of those topics.

Please post your issue/concern in the [Daily Tech Support](https://www.reddit.com/r/samsung) instead. Even though it as a ""Tech Support"" thread, you can ask anything related to advice on buying/selling/trading Samsung products.

*I am a bot, and this action was performed automatically. Please [contact the moderators of this subreddit](/message/compose/?to=/r/samsung) if you have any questions or concerns.*",2019-08-02 20:38:11
176,That's great pal. Those are the only possible reasons. Call Samsung if you care that much.,2019-08-02 21:47:08
177,That's great pal. Those are the only possible reasons. Call Samsung if you care that much,2019-08-02 21:47:37
178,https://www.dropbox.com/s/66bxj3fz0ltqgqk/Samsung%20LockStar.jpg?dl=0,2019-08-02 22:16:36
179,"Thank you for participating in r/samsung. Unfortunately, your submission was removed for breaking the following rule(s):

________________________________________________________________________________________________________________
&gt; **Rule 7** No photography type posts. Please share your awesome photos in the ""Shot on Samsung Sunday"" thread.

Reposting posts removed by a moderator without express permission is not allowed. Not here, and not on most of reddit. Please read reddiquette (linked below).
________________________________________________________________________________________________________________
For questions, comments and concerns, [message the moderators.](https://www.reddit.com/message/compose?to=/r/samsung)

[Reddiquette](https://www.reddit.com/wiki/reddiquette) | [New to Reddit?](https://www.reddit.com/wiki/reddit101) | [Reddit's Content Policy](https://www.reddit.com/help/contentpolicy/)",2019-08-02 23:01:51
180,"I'm an iPad Pro user, although I'm a fan of Samsung (own several of the Samsung's appliances ecosystem and past flagships) I never really looked into their tablet devices as they just didn't cut it for me (through reviews and handheld experiences) they just weren't up there, but man seeing this screenshot pop up in my feed gave me a little hope, that looks clean. I look forward to the time where they start giving Apple some competition and tablets reach their full potential; iPadOS just set the bar extremely up, hope Samsung decides to take it as a challenge.",2019-08-03 01:35:14
181,"
Your submission was automatically removed because your post had no body, and it's considered low-effort. 

Please submit a new post with both a title and a body.

*I am a bot, and this action was performed automatically. Please [contact the moderators of this subreddit](/message/compose/?to=/r/samsung) if you have any questions or concerns.*",2019-08-03 04:35:33
182,check Samsung Cloud &amp; Google Photos,2019-08-03 04:45:09
183,"Hi there TheItalianDude96!

Regrettably your submission was automatically removed as it was flagged as not falling in line with one of r/Samsung's rules:

&gt; **Rule 6** No posts relating to buying, selling, trading, giveaways or asking for advice about any of those topics.

Please post your issue/concern in the [Daily Tech Support](https://www.reddit.com/r/samsung) instead. Even though it as a ""Tech Support"" thread, you can ask anything related to advice on buying/selling/trading Samsung products.

*I am a bot, and this action was performed automatically. Please [contact the moderators of this subreddit](/message/compose/?to=/r/samsung) if you have any questions or concerns.*",2019-08-03 04:45:51
184,"Hi there vlad_gutenco!

Regrettably your submission was automatically removed as it was flagged as not falling in line with one of r/Samsung's rules:

&gt; **Rule 6** No posts relating to buying, selling, trading, giveaways or asking for advice about any of those topics.

Please post your issue/concern in the [Daily Tech Support](https://www.reddit.com/r/samsung) instead. Even though it as a ""Tech Support"" thread, you can ask anything related to advice on buying/selling/trading Samsung products.

*I am a bot, and this action was performed automatically. Please [contact the moderators of this subreddit](/message/compose/?to=/r/samsung) if you have any questions or concerns.*",2019-08-03 04:50:25
185,Cant you just use the original samsung charger then?,2019-08-03 04:52:59
186,"Hi there piemeril!

Regrettably your submission was automatically removed as it was flagged as not falling in line with one of r/Samsung's rules:

&gt; **Rule 6** No posts relating to buying, selling, trading, giveaways or asking for advice about any of those topics.

Please post your issue/concern in the [Daily Tech Support](https://www.reddit.com/r/samsung) instead. Even though it as a ""Tech Support"" thread, you can ask anything related to advice on buying/selling/trading Samsung products.

*I am a bot, and this action was performed automatically. Please [contact the moderators of this subreddit](/message/compose/?to=/r/samsung) if you have any questions or concerns.*",2019-08-03 05:03:26
187,Use the Samsung SoundAssistant App and adust the Change Step Volume interval. Unfortunately it effects the media volume.,2019-08-03 09:12:20
188,"
Your submission was automatically removed because your post had no body, and it's considered low-effort. 

Please submit a new post with both a title and a body.

*I am a bot, and this action was performed automatically. Please [contact the moderators of this subreddit](/message/compose/?to=/r/samsung) if you have any questions or concerns.*",2019-08-03 09:28:54
189,"Samsung phone you only get 2 years of updates.  
Oneplus maybe 3 years
Google pixel 3 years
iPhone about 5 to 6 years
Phones are so powerful and good, excellent camera you don't need to update should last 4 years easily.",2019-08-03 10:33:23
190,"
Your submission was automatically removed because your post had no body, and it's considered low-effort. 

Please submit a new post with both a title and a body.

*I am a bot, and this action was performed automatically. Please [contact the moderators of this subreddit](/message/compose/?to=/r/samsung) if you have any questions or concerns.*",2019-08-03 10:34:56
191,"Hi there ching_d0v!

Regrettably your submission was automatically removed as it was flagged as not falling in line with one of r/Samsung's rules:

&gt; **Rule 4** No tech-support questions outside of the Daily Tech Support sticky.

Please post your issue/concern in the [Daily Tech Support Thread](https://www.reddit.com/r/samsung) instead.

We **may** approve your post if it is a high-level issue that can't be found through searches. Please [Modmail us](https://www.reddit.com/message/compose?to=/r/samsung) if you think this is the case.

*I am a bot, and this action was performed automatically. Please [contact the moderators of this subreddit](/message/compose/?to=/r/samsung) if you have any questions or concerns.*",2019-08-03 10:43:40
192,1600* CAD on the Samsung website but Canadian carriers always overprice it from their site so it's for sure gonna be at least $1800+ if you buy it from bell or telus kinda thing,2019-08-03 11:44:37
193,Has Samsung gotten better about rolling out Android software updates? Or is this still a frustration for folks?,2019-08-03 12:08:50
194,"Usually what others have said. But if you bought it from an authorized retailer as you said, sometimes the Point of Sale system will not record the IMEI until a few days later or will sometimes just fill in incorrect numbers and send it to the Samsung reporting system (whatever internal database they use to record sale of devices). 


I`d call up BB and see whats up, Samsung after confirmation from BB with paperwork. However best bet is call up BB and see verify the device as well as the recorded imei on the bill of sale their POS unit registered. Then with that information call up Samsung to rectify the situation if it still happens.",2019-08-03 12:11:35
195,"Yes, but I'd likely purchase direct from Samsung because I want Dual SIM capability. T-Mobile likely won't offer that? Or can I flash the T-Mobile version to international and buy a dual SIM tray?",2019-08-03 12:13:03
196,You can sync your contacts to either your Samsung or Google account so they are always there when you change phones or do a reset.,2019-08-03 12:20:17
197,"You should just be able to put the simcard into a new phone with no issues

I got my boyfriend to switch from the iPhone 7 (couldn't get a signal due to apples manufacturing, every iPhone 7 had an antenna problem and horrid battery life) to the 3a and he was thankful I got him to switch. The 3a has an astounding camera, way better than apples offerings but not offering multiple lenses. The battery life on it is amazing, it still fits good in one hand, and proformance is more than enough for day to day usage even though it has a low/medium end processor. And it has a headphone jack, which the iPhone didn't have. 

It's definitely the best phone you can get for under $600 brand new, it's only been out for 3 months. Plus, it deals with the one issue Samsung has: software updates.",2019-08-03 12:26:41
198,"Some other neat things to mention are call screening. Where I live, we get telemarketers a lot, ever since I got this phone and used Google call screening that screens any number I don't recognize, They've since stopped calling me as often.

Also for a $400-479 phone, the AMOLED display panel from Samsung is really really close to the ones on a Samsung flagship.
It lacks HDR10 and high level of brightness, but it's very close in display quality.
The haptic feedback on this is really top caliber.

I also feel safer with a plastic back phone over a glass one.
The glossy plastic on edges still keep a premium look.",2019-08-03 12:43:42
199,If they're in the Samsung ecosystem... bad idea.,2019-08-03 12:54:53
200,Pixel is a nice device. Samsung is like swiss knife whereas the pixel is more skin to the iPhone in simplicity and updates,2019-08-03 13:01:27
201,"Backup your data

And then reset your phone



Restore your data



Done





Samsung isn't igoing to spend their time to screw with you, my brother and his wife run a Samsung S4.

 And if there were the case they would have been screwed.





I'm betting you have something running that is incompatible with os system",2019-08-03 13:10:02
202,"I would recommend another Samsung, pixel phones for the price is not worth it compared to a Samsung model at the same price.

Magna swipe and NFC 

Wireless charge

Better battery 

Better screen

 Better support, my cousin has a pixel  and something went wrong and it took him 2 and a 1/2 months to get the issue resolved.",2019-08-03 13:14:24
203,Everyone keeps saying Samsung has continues updates....idk,2019-08-03 13:24:54
204,"By all means vote with your wallet but if you really think Samsung hasn't accounted for people not buying due to absent headphone jack you're mistaken.

You seem to think that anyone who doesn't care about the headphone jack is a casual n00b or a moron, have you considered that the fact that it matters so much to you makes you an edge case? The dongle/USB-C headphones are adequate for most people and wireless headphones for most of the rest; only a very small amount of people can't make either option work for them.",2019-08-03 13:31:37
205,"
Your submission was automatically removed because your post had no body, and it's considered low-effort. 

Please submit a new post with both a title and a body.

*I am a bot, and this action was performed automatically. Please [contact the moderators of this subreddit](/message/compose/?to=/r/samsung) if you have any questions or concerns.*",2019-08-03 13:48:46
206,"That's not even remotely true.  Google sends updates to not just themselves but to other manufacturers.

So Google might be getting update faster because they are direct source but Samsung quickly will add those into the operating system",2019-08-03 13:49:09
207,"https://www.google.com/search?q=Google+pixel+3+vs+Samsung+S9&amp;client=ms-android-tmus-us-revc&amp;sourceid=chrome-mobile&amp;ie=UTF-8&amp;inm=vs#fpstate=spci&amp;tts=0

You'll see that the s9 is cheaper and more for your money",2019-08-03 13:51:50
208,"
Your submission was automatically removed because your post had no body, and it's considered low-effort. 

Please submit a new post with both a title and a body.

*I am a bot, and this action was performed automatically. Please [contact the moderators of this subreddit](/message/compose/?to=/r/samsung) if you have any questions or concerns.*",2019-08-03 14:26:17
209,"I don't see an option to update. When I click ""about phone"" ""software information "" it says ANDROID VERSION 8.0.0 (SAMSUNG EXPERIENCE) 9.0",2019-08-03 14:28:01
210,You should be fine. Samsung knew this might happen so the speaker is countersink at an angle so you can't poke it.,2019-08-03 14:57:27
211,"I got my Samsung A70 screen replaced and now when I look at it, it seems to be elevated. Like I can take it off with my finger nail.( it wasn't sent to Samsung be cause I broke the screen, six days after I got the phone)",2019-08-03 15:46:40
212,"Different strokes for different folks. I don't recall using a phone's heart rate sensor other than to test if it worked. Use my watch's HR sensor instead. And don't keep track of that either. 

I haven't had the need for an SD card. Phone memory is more than enough. Most of my files are on the cloud (OneDrive) or backed up on an external drive.

And I haven't used wired headphones in years, have always used bluetooth, and now, galaxy buds. It's not perfect, but good enough and I'll sacrifice the tiny latency on some apps over having to mess with wires. 

I know just because I don't use a lot of the things above means neither does everyone, but I can see why with alternatives, Samsung can feel confident in removing them.",2019-08-03 15:48:12
213,"Even so, keeping the features do that both sides of the fanbase are satisfied is what Samsung has been liked for. And now, by taking it away, it feels like they've lost their edge over others",2019-08-03 15:58:39
214,"True, true. I see what you're saying. Maybe it had to be removed to thin the phone. There might be space but with everything so compacted, it could increase heat, who knows. Could just be saving production costs and increasing sale of their other services (watches, buds, Samsung cloud). If only companies were more transparent.",2019-08-03 16:20:37
215,Turn on dark mode in the settings and after Samsung music will turn black too,2019-08-03 17:03:37
216,"Yeah they are. Idk why people are spreading these false accusations around. I literally got a 2018 12.9"" iPad Pro just to see if the apps are any better. They're not, and even the apps that aren't optimized either are so much worse on the iPad. Those apps are the literal definition of blown up phone apps.

&amp;#x200B;

But apps are the last thing you need to worry about in an Android tablet. Software's good too on One UI and Samsung Experience. And even Google's apps are pretty good and all exactly the same as the iPad versions. Gmail, YouTube, Chrome, Docs, the others...",2019-08-03 17:27:25
217,"The microphone is offset to the side, and for that reason the tool will not harm it. Samsung designed it that way.",2019-08-03 17:40:01
218,"I jThis is a wide spread problem. If you got yours from Samsung, talk to customer support and get a replacement. 

I heard of one method which involved leaving them out of the case until they die and that should fix the problem. Not sure if this works as I haven’t tried it yet tho.",2019-08-03 17:44:53
219,"Hi there MastaGAtomic!

Regrettably your submission was automatically removed as it was flagged as not falling in line with one of r/Samsung's rules:

&gt; **Rule 4** No tech-support questions outside of the Daily Tech Support sticky.

Please post your issue/concern in the [Daily Tech Support Thread](https://www.reddit.com/r/samsung) instead.

We **may** approve your post if it is a high-level issue that can't be found through searches. Please [Modmail us](https://www.reddit.com/message/compose?to=/r/samsung) if you think this is the case.

*I am a bot, and this action was performed automatically. Please [contact the moderators of this subreddit](/message/compose/?to=/r/samsung) if you have any questions or concerns.*",2019-08-03 18:10:22
220,"Thank you for participating in r/samsung. Unfortunately, your submission was removed for breaking the following rule(s):

________________________________________________________________________________________________________________
&gt; **Rule 4** No tech support / What should I buy questions. Please ask your question in the tech support / WSIB thread which is stickied. 

Reposting posts removed by a moderator without express permission is not allowed. Not here, and not on most of reddit. Please read reddiquette (linked below).
________________________________________________________________________________________________________________
For questions, comments and concerns, [message the moderators.](https://www.reddit.com/message/compose?to=/r/samsung)

[Reddiquette](https://www.reddit.com/wiki/reddiquette) | [New to Reddit?](https://www.reddit.com/wiki/reddit101) | [Reddit's Content Policy](https://www.reddit.com/help/contentpolicy/)",2019-08-03 18:25:52
221,"Thank you for participating in r/samsung. Unfortunately, your submission was removed for breaking the following rule(s):

________________________________________________________________________________________________________________
&gt; **Rule 4** No tech support / What should I buy questions. Please ask your question in the tech support / WSIB thread which is stickied. 

Reposting posts removed by a moderator without express permission is not allowed. Not here, and not on most of reddit. Please read reddiquette (linked below).
________________________________________________________________________________________________________________
For questions, comments and concerns, [message the moderators.](https://www.reddit.com/message/compose?to=/r/samsung)

[Reddiquette](https://www.reddit.com/wiki/reddiquette) | [New to Reddit?](https://www.reddit.com/wiki/reddit101) | [Reddit's Content Policy](https://www.reddit.com/help/contentpolicy/)",2019-08-03 18:26:05
