,body,timestamp
343,"Hi there granndolynn!

Regrettably your submission was automatically removed as it was flagged as not falling in line with one of r/Samsung's rules:

&gt; **Rule 4** No tech-support questions outside of the Daily Tech Support sticky.

Please post your issue/concern in the [Daily Tech Support Thread](https://www.reddit.com/r/samsung) instead.

We **may** approve your post if it is a high-level issue that can't be found through searches. Please [Modmail us](https://www.reddit.com/message/compose?to=/r/samsung) if you think this is the case.

*I am a bot, and this action was performed automatically. Please [contact the moderators of this subreddit](/message/compose/?to=/r/samsung) if you have any questions or concerns.*",2019-08-05 04:56:04
344,"If I buy a Samsung device, I want bells and whistles. If I want high speed low drag performance, I'd get a oneplus.",2019-08-05 04:59:40
345,"https://twitter.com/UniverseIce/status/1157979279096893440?s=19

Check this. On Samsung there isn't any stable mod of Gcam at all. For other devices good, but why you should depend on GCam mods after paying that much.
I understand your point but not only software improvement, they need to upgrade hardware as well.",2019-08-05 05:09:10
346,"
Your submission was automatically removed because your post had no body, and it's considered low-effort. 

Please submit a new post with both a title and a body.

*I am a bot, and this action was performed automatically. Please [contact the moderators of this subreddit](/message/compose/?to=/r/samsung) if you have any questions or concerns.*",2019-08-05 05:40:20
347,"
Your submission was automatically removed because your post had no body, and it's considered low-effort. 

Please submit a new post with both a title and a body.

*I am a bot, and this action was performed automatically. Please [contact the moderators of this subreddit](/message/compose/?to=/r/samsung) if you have any questions or concerns.*",2019-08-05 05:57:59
348,"Ive read something about the lcd being worse...
The aux thing makes me furious tbh,it doesn't cost much and doesn't take much space,i dont care about waves,Samsung was the one making waves!",2019-08-05 06:25:57
349,"True,and it looks better without the hole in the screen...does the fact that Samsung slowly makes us apple users make u mad?lol",2019-08-05 06:31:39
350,"Hey guys, I've had every S phone since the s6, and I've loved them and I love my S10+, but I noticed that a lot of my outdoor photos have a glare from the cutout. This one isn't as obvious as others. In some photos you can see an entire circle around the image. 

I've contacted Samsung and they said they'd replace the lens, but I'm not sure if that'd fix this issue. I just checked my brothers and his does the same, too.",2019-08-05 08:42:57
351,"
Your submission was automatically removed because your post had no body, and it's considered low-effort. 

Please submit a new post with both a title and a body.

*I am a bot, and this action was performed automatically. Please [contact the moderators of this subreddit](/message/compose/?to=/r/samsung) if you have any questions or concerns.*",2019-08-05 09:02:36
352,"I think part of the grievance with Apple is they did it far earlier than the market was ready for, and they did it from every one of their devices. Unlike Apple, you can get a lot more phones from Samsung in every price range and most of them have headphone jacks.",2019-08-05 09:07:35
353,"I rlly feel like this is Samsung's direct answer to the Apple Watch series 4. idk if that's a good thing bc tbh I prefer the design of the regular galaxy watch but with the two sizes, LTE, ecg n upgraded fitness stuff, it is quite literally the Samsung Apple Watch and idk how to feel about that.",2019-08-05 09:24:24
354,"
Your submission was automatically removed because your post had no body, and it's considered low-effort. 

Please submit a new post with both a title and a body.

*I am a bot, and this action was performed automatically. Please [contact the moderators of this subreddit](/message/compose/?to=/r/samsung) if you have any questions or concerns.*",2019-08-05 09:59:09
355,"I use to have black dot on photos. When i asked samsung, they tell me theres a chance dust or any particles get into the camera lense, either is it the front camera or that rear camera. Just to make it clear that what samsung said about replacing your camera is totally make sense and might fix the problem permanently.",2019-08-05 10:02:04
356,"Really? Why? The only reason I'd ever go for a iPhone as a second phone is for gaming :/ at least give Huawei a shot, although I prefer Samsung one UI software",2019-08-05 10:42:05
357,"I don't own a Samsung smartphone, is it still a good idea to go for a Galaxy watch instead of a WearOS one?",2019-08-05 11:20:58
358,"So first of all, i won't boycot samsung for getting rid of the jack. Yes it sucks, but god knows it's happening whether you like it or not. Second, the sd slot isn't dead. It's on the note 10+, which is the phone you should be getting anyway as a ""Power"" user which is who the note series are for. And tbh, if the starting space is 256GB, most people won't need an SD card seeing as 90% of the things can be streamed online. We are not living in the day and age of 16GB phones anymore, so stop acting like it's a required thing in a phone when you stream your music through spotify or w/e app you use, you watch youtube, you stream netflix, etc etc. Most people just don't need an SD card.

&amp;#x200B;

So instead of making these BS posts, go put your money where your mouth is and just buy an s10+ and gtfo while i and many others will enjoy the note. And if you ""Might as well buy an iphone"" please do! you'd just be spending the 1000 bucks on another company that never had an SD slot and removed the jack years ago, which nobody cares about nowadays anyway.",2019-08-05 11:33:34
359,"Haloing is typically an hdr artifact. Not much you can do about it, it's just the algorithm Samsung uses for stitching the images together",2019-08-05 11:42:17
360,"Hey guys, 

So a Samsung rep told me to take the phone in to UbreakIfix. I took it there and the UBIF rep told me that it's a design flaw of the phone and replacing the camera wouldn't help. 

He basically told me that I'd have to hold my phone a certain way to get rid of the glare. 

Sucks though because to confirm this he made me take off the screen protector.",2019-08-05 11:46:48
361,"Cant Samsung actually remove all accounts associated with you, and let you restart them?",2019-08-05 11:53:49
362,"You would think so, right?  Shouldn't it be that simple?  Unfortunately every time we call they just escalate us to the next tier of tech support who are supposed to contact us.   They never do, which means we call back the next week and repeat the process.  Samsung customer service has been a horrible experience so far.",2019-08-05 12:01:11
363,I think we can agree all j series samsung phones are awful,2019-08-05 12:18:11
364,I wish Samsung wouldn't do this nonsense,2019-08-05 13:55:13
365,"Hello!

I have a Samsung S10 Plus on Verizon. I upgraded from the Google Pixel earlier this year, and after doing an exhausting amount of research I decided to give Samsung a shot. 

I will admit I wasn't really a fan of Samsung devices, I used to work for AT&amp;T and while I was there we had a few issuees with some of the deivces we were carrying at that time. But, the S10 got great reviews, I had some tech savvy friends who all suggested I give it a whirl, so I bit the bullet.

So I have some issues, I dont know if its me, or if Im just being picky cuz I wasnt totally sold on it. (by the end of this you will also learn, I was COMPLETELY sold on my pixel, didnt go to the 3 cuz it was getting panned by all my go to tech sites...)

Issues:

MY SWYPE SUCKS!!!  Even the most basic words come out like total garbage, and on occasion my predictive text will ""predict"" that i have had a stroke, and words like ""predict"" will come out damn near different each time. I just swyped the word predict and I got precidentt, precent, percocet and president. I'll also add that the swype on my older tablet works fine. 

my voice chat  also sucks most of the time and puts out sentences that make absolutely no sense and sound NOTHING like what was said. I have no heavy or thick accent, slight new yorker, so its not like im confusing the system.

Forget about OK Google. I have to literally YELL at my phone for that to work, meanwhile my tablet, which is a 3 year old black friday deal model, picks up when i say OK Google from across the room. 

Has anyone else come across any of these Samsung Galaxy S10 Plus tech woes,  or is skynet simply out to get me?",2019-08-05 14:21:32
366,"Hi. I'm a new owner of the Samsung J3. It's a decent phone and I don't need a phone to do much, so it's fine for me. Well, it was.

After my phone updated to Android Pie my app notifications are either inconsistent or nonexistent. Before Pie, everything was cool. Now if I get a message thru Kik, I don't get a notification. I have to actually start the app and then magically the notification pops up. This also happens with other apps such as a game that came pre-installed. I have to open the app for most notifications to come through. And yet oddly ,some do. Some of the game notifications work, some don't. 

And yet Gmail and most of my text messages send notifications immediately. I have tried EVERYTHING. I've fiddled with phone notification settings, I've looked into the apps' own settings. I've even disabled Do Not Disturb. Nothing I have changed has made one iota of difference.

Had anyone else seen this with Android Pie? I've seen ppl complaining on a few other sites but I've yet to see anything that makes a difference.",2019-08-05 14:35:16
367,About time proof that samsung matches or exceeds gcam. Good for you.,2019-08-05 16:12:55
368,what kind of Samsung is that?  I thought they all had one,2019-08-05 16:25:25
369,My 4K Samsung tv got airplay integration and an Apple TV app and it’s easier to use the iPhone now than the S10.,2019-08-05 16:29:00
370,"Go to language and input settings under general management, and when you go to on-screen keyboard, tap samsung keyboard and you can change the keyboard layout. It won't be completely on the bottom, but you can pull it down as much as it lets you.",2019-08-05 16:36:28
371,"Idk, but it comes with stuff even the Latest haven't anymore. 4 Temp sensors on inside parts,  Barometer, Light sensor, Earth Magnetic field sensor, etc and got features like IR LED (i can literally control every non-Smart TV from Samsung in Universe without any Code or Connecting. The Android 6.0.1 is Sick AF ... never would use something different. I 100% use that phone i use every ability that thing provides. Never Apple. The most ppl just want to Talk, and SMS or Internet, but thats not even close to that Multitool from Phone i expecting a Smartphone to be. But the S6 is in my opinion the Best... ok, its maybe weak with its Octacore CPU compared to latest devices, but its still enough when you controll the system (no Root)",2019-08-05 16:39:06
372,"Rumor is that the cheaper model of the Note 10 is going to not have the SD card slot either. I don't know what Samsung is thinking with that. (probably trying to encourage people to spring for the Note 10+, I guess)",2019-08-05 16:40:01
373,"I will only switch from my Motorola Razr if Samsung comes out with a phone with a headphone jack a micro SD slot, 8 USB c slots.  I also NEED IT to have a 1080 ti running Inside so I can run my angry birds at 8k resolution 140 fps.  Until then screw samsung ! They ain't getting my money !!!!! 

(How these folks sound in these threads)",2019-08-05 16:42:09
374,"Sorry, I forgot which sub I was in. Just plugged it into my Tab S4 and into my TV. It went straight to DeX mode without needed additional power (something my Note 9 needs). The sound carries through the HDMI to the TV, or you can change the output in the settings. You can also exit DeX mode and just mirror the screen. A warning popped up that suggested I use original Samsung accessories, but it did not give me any trouble.",2019-08-05 16:45:07
375,"Hi there SokkasInstincts_!

Regrettably your submission was automatically removed as it was flagged as not falling in line with one of r/Samsung's rules:

&gt; **Rule 4** No tech-support questions outside of the Daily Tech Support sticky.

Please post your issue/concern in the [Daily Tech Support Thread](https://www.reddit.com/r/samsung) instead.

We **may** approve your post if it is a high-level issue that can't be found through searches. Please [Modmail us](https://www.reddit.com/message/compose?to=/r/samsung) if you think this is the case.

*I am a bot, and this action was performed automatically. Please [contact the moderators of this subreddit](/message/compose/?to=/r/samsung) if you have any questions or concerns.*",2019-08-05 16:58:33
376,I have a Galaxy gear s3. When it stopped working I hunted down another s3. Wont upgrade till Samsung brings back MST in the watches,2019-08-05 17:00:53
377,A very good reason to stop buying Samsung.,2019-08-05 17:17:20
378,Yeah I will be on my 3rd device this year lol. Only worrisome thing is I heard the tablets and phones don’t sync as well when it comes to messages. Not sure if it’s true . I only use Samsung messages also so i wouldn’t imagine it a problem,2019-08-05 17:28:52
379,"Hi there DSN_ACT!

Regrettably your submission was automatically removed as it was flagged as not falling in line with one of r/Samsung's rules:

&gt; **Rule 4** No tech-support questions outside of the Daily Tech Support sticky.

Please post your issue/concern in the [Daily Tech Support Thread](https://www.reddit.com/r/samsung) instead.

We **may** approve your post if it is a high-level issue that can't be found through searches. Please [Modmail us](https://www.reddit.com/message/compose?to=/r/samsung) if you think this is the case.

*I am a bot, and this action was performed automatically. Please [contact the moderators of this subreddit](/message/compose/?to=/r/samsung) if you have any questions or concerns.*",2019-08-05 17:31:51
380,"Hi there blackalbum!

Regrettably your submission was automatically removed as it was flagged as not falling in line with one of r/Samsung's rules:

&gt; **Rule 4** No tech-support questions outside of the Daily Tech Support sticky.

Please post your issue/concern in the [Daily Tech Support Thread](https://www.reddit.com/r/samsung) instead.

We **may** approve your post if it is a high-level issue that can't be found through searches. Please [Modmail us](https://www.reddit.com/message/compose?to=/r/samsung) if you think this is the case.

*I am a bot, and this action was performed automatically. Please [contact the moderators of this subreddit](/message/compose/?to=/r/samsung) if you have any questions or concerns.*",2019-08-05 19:28:42
381,"So, I got the New 7 Series 4k From Samsung. Airplay is recognizing my Tv through Quicktime, but once I hit play the screen on the TV is just stuck with the Airplay screen. Anyone else have this issue? I have tried converting the video format too, still ain't working. Although, I can play videos from my Iphone.

Or Does Airplay on stream from Apple TV Which I don't have a subscription for.",2019-08-05 19:30:32
382,"I was literally in your boat about a month and a half ago. I actually came from a phone that was the size of the s10+ and almost bit the bullet but went with the s10e instead. It's just easier to hold, which is great for me because I'm clumsy and can accidentally drop my phone from time to time if it's too big. It's finger scanner is lightning fast and you'll know where it is every time, which helps with Samsung pass/pay. The 256GB actually has 8GB ram so it keeps up with the s10 and s10+. I personally haven't had the battery die on me yet and I play Pokemon Go and Wizards United daily, major battery drainers. The camera is all I need it to be and more. The screen is beautiful and I couldn't notice a difference between the 3 side by side in best buy. 

It's checks all the boxes and the value is great. I have no regrets. 

I hope this helps your decision. Cheers!",2019-08-05 20:23:20
383,"It's not all screen though. It has a whole punch.

My OnePlue 7 Pro is all screen, and it doesn't have Samsung's awful bloatware

Not to mention US model Samsung phones can't be rooted nor loaded with a custom ROM",2019-08-05 20:52:02
384,"s10e has wireless charging, an IP68 water resistance with no on screen fingerprint sensor (which can be a plus or minus). It also runs the latest snapdragon and has the same cameras as the s10, minus the telephoto lens. The s10e is also smaller and better for one-handed use.

A70 doesn't have wireless charging or an IP rating, but has a bigger battery and an on-screen fingerprint sensor. It has a mid-tier processor and has 3 cameras, not sure about their exact quality. the A70 is larger than the s10. 

I got my s10e the month of launch and I don't regret it. The size difference isnt that big compared to my s8 and the jump to the s10 wasn't worth it imo. I personally like feeling boujee so I like having flagship phones especially because I want it running well 2 yrs from now when I upgrade again, but the A70 is still a good phone. I also got my phone on a contract (80/month 10gb data) and Samsung had a trade in promotion so I ended up paying 300 CAD for my s10e. The s10 would have been 700 D:",2019-08-05 20:58:01
385,"Theres one thing samsung did right that my Nexus 6 did not.  


Using the volume buttom controlled media and not vibrate to ringer level.  


Volume buttoms should always control media. I don;t want to have to press the button, open the volume slider, then slide the volume down if I have to quickly turn something down.",2019-08-05 20:58:46
386,Before they removed prices on the samsung website only the note 9 was pulling 550.,2019-08-05 21:56:36
387,"As somebody who owns the 12.9"" iPad Pro, I can understand why you would want Samsung to make a similar device. They probably can, but its the software that holding them back. As far as I know, Adobe has no plan of releasing optimized android creative suite apps like it has with Photoshop on the iPad because google itself announced that androids focus will no longer be on tablets. 

&amp;#x200B;

Too bad, because from what I've seen, the Tab S6 seems like a pretty nice device",2019-08-05 23:02:47
388,"I did get it for fitness, although i am quite a lazy myself, but just wanted a a watch, and thought i have only had Samsung galaxy phones so may aswell get the watch too",2019-08-05 23:33:13
389,"So check notifications and fitness?

Thanks for the replies. Maybe when Samsung announce the Samsung Watch Inactive I'll reconsider.",2019-08-05 23:44:25
390,"looking at 200 to 250 for screen replacement. 

my 7000 series costed me that for a replacement.

option is get repaired by Samsung or opt for another TV at that price.",2019-08-05 23:53:12
391,What a poor attempt at reverse psychology. That person hoped for Samsung to fall for it and send them a free phone. Talk about being cheap. You don't even have to be rich to get a smartphone.,2019-08-06 00:32:44
392,"Hi there NvNaxos!

Regrettably your submission was automatically removed as it was flagged as not falling in line with one of r/Samsung's rules:

&gt; **Rule 4** No tech-support questions outside of the Daily Tech Support sticky.

Please post your issue/concern in the [Daily Tech Support Thread](https://www.reddit.com/r/samsung) instead.

We **may** approve your post if it is a high-level issue that can't be found through searches. Please [Modmail us](https://www.reddit.com/message/compose?to=/r/samsung) if you think this is the case.

*I am a bot, and this action was performed automatically. Please [contact the moderators of this subreddit](/message/compose/?to=/r/samsung) if you have any questions or concerns.*",2019-08-06 01:13:31
393,Is it worth getting this or any Galaxy wearable for that matter ? Ireland has yet to introduce samsung pay in anyway,2019-08-06 01:13:55
394,"You will lose some features (message app for example) but globally it's working fine.Also, no bixby and no native support for other Assistant.

I have a gear S3 with my Oneplus 7 pro and it's good. I am happy with this watch and will buy the active 2 next month. Wear OS is good but I need to have 2-3 days of battery life and except maybe Ticwatch pro , samsung is far better for this point.",2019-08-06 01:29:24
395,Android is shit on tablets and Samsung probably calculated that tablets won't be selling that well,2019-08-06 01:33:35
396,"I dont see why not, i mainly will be using it as a fitness tracker and, i have owned samsung phones so thought it made sense to get over a fitbit",2019-08-06 01:36:02
397,I have an S8+ still gets me through a full day. I plan on getting the s11. Hopefully samsung may announce some new markets for samsung pay. I also plan on joining a gym which would make more sense to get a galaxy watch :),2019-08-06 01:37:54
398,"
Your submission was automatically removed because your post had no body, and it's considered low-effort. 

Please submit a new post with both a title and a body.

*I am a bot, and this action was performed automatically. Please [contact the moderators of this subreddit](/message/compose/?to=/r/samsung) if you have any questions or concerns.*",2019-08-06 01:48:58
399,It's unclear if Samsung restricts it or if Google is uninterested but right now the only assistant is Bixby,2019-08-06 01:54:54
400,"Hi there BJG18!

Regrettably your submission was automatically removed as it was flagged as not falling in line with one of r/Samsung's rules:

&gt; **Rule 4** No tech-support questions outside of the Daily Tech Support sticky.

Please post your issue/concern in the [Daily Tech Support Thread](https://www.reddit.com/r/samsung) instead.

We **may** approve your post if it is a high-level issue that can't be found through searches. Please [Modmail us](https://www.reddit.com/message/compose?to=/r/samsung) if you think this is the case.

*I am a bot, and this action was performed automatically. Please [contact the moderators of this subreddit](/message/compose/?to=/r/samsung) if you have any questions or concerns.*",2019-08-06 02:03:20
401,"Enjoy your phone man. My Note 8 started giving me a lot of problems. The wifi was iffy, and the bluetooth would disconnect all of the time. I made the jump to the S10+ as well. I don't care for it too much. I've been trying to sell it locally, but no one is interested. I'll probably just hang onto it for now despite Samsung offering $600 for trade in towards the Note 10.",2019-08-06 02:23:39
402,"Thank you for participating in r/samsung. Unfortunately, your submission was removed for breaking the following rule(s):

________________________________________________________________________________________________________________
&gt; **Rule 4** No tech support / What should I buy questions. Please ask your question in the tech support / WSIB thread which is stickied. 

Reposting posts removed by a moderator without express permission is not allowed. Not here, and not on most of reddit. Please read reddiquette (linked below).
________________________________________________________________________________________________________________
For questions, comments and concerns, [message the moderators.](https://www.reddit.com/message/compose?to=/r/samsung)

[Reddiquette](https://www.reddit.com/wiki/reddiquette) | [New to Reddit?](https://www.reddit.com/wiki/reddit101) | [Reddit's Content Policy](https://www.reddit.com/help/contentpolicy/)",2019-08-06 02:39:11
403,"Thank you for participating in r/samsung. Unfortunately, your submission was removed for breaking the following rule(s):

________________________________________________________________________________________________________________
&gt; **Rule 4** No tech support / What should I buy questions. Please ask your question in the tech support / WSIB thread which is stickied. 

Reposting posts removed by a moderator without express permission is not allowed. Not here, and not on most of reddit. Please read reddiquette (linked below).
________________________________________________________________________________________________________________
For questions, comments and concerns, [message the moderators.](https://www.reddit.com/message/compose?to=/r/samsung)

[Reddiquette](https://www.reddit.com/wiki/reddiquette) | [New to Reddit?](https://www.reddit.com/wiki/reddit101) | [Reddit's Content Policy](https://www.reddit.com/help/contentpolicy/)",2019-08-06 02:39:17
404,"Thank you for participating in r/samsung. Unfortunately, your submission was removed for breaking the following rule(s):

________________________________________________________________________________________________________________
&gt; **Rule 4** No tech support / What should I buy questions. Please ask your question in the tech support / WSIB thread which is stickied. 

Reposting posts removed by a moderator without express permission is not allowed. Not here, and not on most of reddit. Please read reddiquette (linked below).
________________________________________________________________________________________________________________
For questions, comments and concerns, [message the moderators.](https://www.reddit.com/message/compose?to=/r/samsung)

[Reddiquette](https://www.reddit.com/wiki/reddiquette) | [New to Reddit?](https://www.reddit.com/wiki/reddit101) | [Reddit's Content Policy](https://www.reddit.com/help/contentpolicy/)",2019-08-06 02:39:29
