,body,timestamp
278,"Last Samsung phone I had was an original Galaxy s i-9003. I switched because of the constant lags and poor performance.
Never looked back from Ios.
The newer Samsung phones are very enticing and definitely give more value.
What is the experience like nowadays on flagships?
Do they start lagging after some time like before and make life difficult?
I am still on a 6s and it runs damn smooth. I want to buy the upcoming note 10 or s10plus 5g. Will it last a long time or start frustrating me after a year or so?
If anyone switched some time back. Pl feel free to share your experience.",2019-08-04 09:28:56
279,"Last Samsung phone I had was an original Galaxy s i-9003. I switched because of the constant lags and poor performance.
Never looked back from Ios.
The newer Samsung phones are very enticing and definitely give more value.
What is the experience like nowadays on flagships?
Do they start lagging after some time like before and make life difficult?
I am still on a 6s and it runs damn smooth. I want to buy the upcoming note 10 or s10plus 5g. Will it last a long time or start frustrating me after a year or so?
If anyone switched some time back. Pl feel free to share your experience.",2019-08-04 09:29:08
280,What the hell that's more phones than Samsung even sells here.,2019-08-04 09:33:34
281,"I switched from iPhone to Android (Pixel and Samsung) and that was my best choice. Nowadays, Android flagship is not going to be lagging like before because they have a very powerful CPU. In my opinion, I think Samsung flagship is worth your money

I got my brand new S10+ for 600$",2019-08-04 09:38:18
282,"1. Yes, the vibration is slightly more powerful than my Galaxy A8 and is enough to wake me up every day
2. The Galaxy Wearable app is only needed for settings so I don't use it often, I use the Samsung Health app most of the time so no it's not irritating for me
3. For me it's fairly simple to use, the UI is separated into different sections and it's not cluttered.",2019-08-04 09:39:21
283,"
Your submission was automatically removed because your post had no body, and it's considered low-effort. 

Please submit a new post with both a title and a body.

*I am a bot, and this action was performed automatically. Please [contact the moderators of this subreddit](/message/compose/?to=/r/samsung) if you have any questions or concerns.*",2019-08-04 10:06:35
284,"Dude, just the OS is 11gb. Add a couple of gb over the years in updates. Don't buy any Samsung phone with 32gigs in it. Not worth it.",2019-08-04 10:18:58
285,Pretty much. USB c is cross compatible with alot of devices as long as they follow the protocols. I would trust Nintendo if I really had to. Samsung just states that so they aren't liable for people who fry their phone with dollar store brands,2019-08-04 10:50:53
286,"Which part of the Samsung Experience do you think you're losing, specifically?",2019-08-04 11:12:52
287,"Apple isn't trash but I way prefer android and Samsung. If something goes wrong with a text or a phone call with an Android it's because ""it's an Android"" if something happens with an iPhone oh it must be the bad network.",2019-08-04 11:39:23
288,Now I have a Samsung Galaxy A50,2019-08-04 12:13:10
289,Samsung doesn't want your money to go elsewhere,2019-08-04 13:04:08
290,"The Samsung members app sometime post updates on when is the next software update is available, you cans find it in the galaxy store or its usually already pre installed on your phone",2019-08-04 13:31:34
291,"Has Samsung published official specs for the note 10 versions? All I've seen discussed by various websites is ""anticipated"" specs.",2019-08-04 13:46:33
292,"People will still buy it, making this the end of the headphone Jack. I wish the note 10 had the headphone Jack, hopefully Samsung actually planned these leaks and is revealing it to have a headphone Jack and sd card slot. One can dream",2019-08-04 15:02:18
293,Age has a factor too. The youth in Korea generally like the aesthetics of the iPhone while the older get a Samsung just cause the majority of folks have one.,2019-08-04 15:05:57
294,lol implying Samsung is the only company making android phones,2019-08-04 15:09:14
295,"Lol...I think people are realizing spending $1000 a year is a waste of money .

Apparently there have been issues with cheap Chinese phones not having qccess to certain American bands? 

I  do not understand the defeatism that seems to be default here...everyone says it is trash and makes fun of it for being a ripoff sales drop.

A midpriced phone that embraces easily installed open source mobile software that is updated comes along...fuck Samsung and Apple.",2019-08-04 15:12:56
296,"They can, that is why we need to encourage sales to drop, so they remember the lesson they were ince taught.

I can't be the only person who is waiting for the S11 to come out because that will mean q sale in the last useful Samsung phone (S10) and fuck it, if LG just let us install opensource trustworthy upgrades I would buy one of them.

I fucking hate Apple, but if I am overpaying for bullshit then I might as well hqve an iPhone.

There is this...bootlicking attitude here. ""DUR WHAT CAN WE DO?""

Skip every generation without the headphone jack and SD card slot, that is what we can do. They learn or become interchangeable with every other android phone. Kleenex style.",2019-08-04 15:19:51
297,"Check out oneplus and huawei, Samsung is good but not the only good brand",2019-08-04 15:35:49
298,"I've used the upgrade once so far. Samsung initially claimed the phone I sent them wasn't my s9. It took like a month for them to fix.

Other than that it was easy enough. If I hadn't had a whole month feeling uneasy about being stuck paying for two phones, my biggest complaint would've been the fact that I had to wait exactly a full year to order the S10...thus missing all the preorder promos. When I say exactly, I mean down to the hour. Samsung refused to move the upgrade date by 3 days 😥",2019-08-04 16:24:35
299,"My Samsung TV is stuck on 1 channel.   
  
Remotes doesnt work, but TV is recieving signal (led flashes)  
  
The touch buttons also dont do anything beside make the led flash.",2019-08-04 17:14:50
300,Samsung is releasing a Note 10 and a Note 10 plus in a few weeks. I work in mobility. The Samsung rep just came and told us about it.,2019-08-04 17:22:27
301,"Why the fuck would I want to buy an adapter after buying a $1,000 phone?

I plan on buying something else, or the S10+ instead of next years Samsung flagship.",2019-08-04 18:11:49
302,"No hate because I happen to like all phone brands and used to sell them... but I find the controversy with the Note 10 somewhat humorous. While I hope they don't get rid of the jack, the fact that people now seem to be okay with it is exactly what I would joke about with slightly extreme ""fanboy"" customers  years ago. No matter if you love Samsung or Apple, in the end they're both companies that want to make money and they'll both continue to do what they want. Samsung does a good job of listening to their customers compared to Apple..(apple just waits for Samsung to piss off their customers ie the note 7 and s6 controversy..forcing conversions by default) but ultimately, they'll do what they want and what makes them money. Cause brand loyalty equals stuff like this.",2019-08-04 18:30:05
303,"Still shit lol. 😆
Samsung really need to step up the camera game, fuckin using same sensor since ages.",2019-08-04 19:27:48
304,"First of all this meme isn't even related to Samsung (Rule 1). And it's kind of offensive (Rule 8), and low quality.

Let's keep all submissions on topic and civil. Memes aren't exempt from the rules.",2019-08-04 19:28:27
305,"First of all this meme isn't even related to Samsung (Rule 1). And it's kind of offensive (Rule 8), and low quality.

Let's keep all submissions on topic and civil. Memes aren't exempt from the rules.",2019-08-04 19:28:54
306,I’ve contacted Samsung through their chat and they sent me a pack of two screen protectors free of charge!,2019-08-04 20:13:00
307,"Why does it matter whether it's in the USA or not? Samsung is a Korean company, it's very likely that it's being tested in Korea (surprised Pikachu face) before it's released internationally. If you look closely, there's something written on the edge of the phone; I personally believe it's very likely to be a real Note 10+ or at least a tester.",2019-08-04 20:20:12
308,"Upvoting this because Huawei has better hardware in their phones, but Samsung and the Google Pixel do take better photos in day light.",2019-08-04 20:21:04
309,"I know it's Samsung reddit, but people need to understand the truth.",2019-08-04 20:26:39
310,"Nice, i'll try contacting samsung",2019-08-04 21:22:44
311,"Three are slow in many places though, even in London. You can usually get better deals with SIMO plans. I usually don't need unlimited data as I have fibre at home, so I get 20GB with EE for £11 with loyalty discounts etc. 

I pay £24/month for my S10+ through Samsung (traded-in my S8+), so in total I pay about £35/month for phone + sim.",2019-08-04 22:21:13
312,"Yeah, what the other guy said. You go into the samsung gear app, then go to touch settings(if i remember correctly), after which you click on a preference for the touch controls and you set them up for Volume up or down. After this your galaxy buds will have Volume down for the left and volume up for the right. Your voice assistant will be gone, though.",2019-08-04 22:50:40
313,"Yes, I know that miband 4 is way better, but I wanted Samsung product.",2019-08-04 22:52:49
314,"In my opinion Yes, because it's simple, stable and working very well with Samsung Health app.",2019-08-04 22:54:37
315,"Hi there Hanzojob!

Regrettably your submission was automatically removed as it was flagged as not falling in line with one of r/Samsung's rules:

&gt; **Rule 4** No tech-support questions outside of the Daily Tech Support sticky.

Please post your issue/concern in the [Daily Tech Support Thread](https://www.reddit.com/r/samsung) instead.

We **may** approve your post if it is a high-level issue that can't be found through searches. Please [Modmail us](https://www.reddit.com/message/compose?to=/r/samsung) if you think this is the case.

*I am a bot, and this action was performed automatically. Please [contact the moderators of this subreddit](/message/compose/?to=/r/samsung) if you have any questions or concerns.*",2019-08-04 23:17:16
316,"I am looking to buy a samsung qled tv, but I cannot decide between twi models, the 2018 75 q900 8k and the 75 q90r 4k. Pricewise they are identical and I cannot really find any good comparisons online. Any advice would be greatly appreciated, thanks!",2019-08-04 23:35:35
317,"I just talked with Samsung Support and according to the rep, the Canadian model has both NFC and MST. My bank is TD and on their website it says Samsung Pay fully supports their debit cards. Both NFC and MST works with all of their cards. I will just have to get the phone and see for myself I guess.",2019-08-05 00:21:39
318,Umm you're looking at the American TD bank. TD Canada does not support Google and Samsung pay since they have their own app here in Canada. Interec debits and the only supported debits in any other bank than td so mst wouldn't work,2019-08-05 00:23:58
319,Yep so TD Canada is really just stupid it doesn't wanna give support to Google or Samsung pay since they wanna keep their app running and yes the app uses NFC.  What I would recommend is getting a stack Mastercard (fee free) and since stack supports Samsung pay and MST you can always e transfer money into that account and use Samsung pay that way,2019-08-05 00:34:42
320,Ohhh ok. Will definitely look into that. That’s sounds like a really nice way to take advantage of Samsung pay. Thank you so much for your help. The Samsung rep just kept giving half answers to my questions but you really out done yourself over a trained Samsung employee lol. thanks again ;),2019-08-05 00:41:11
321,"[Specs and compatibility with US carriers](https://www.kimovil.com/en/frequency-checker/US/samsung-galaxy-s10-lite)

[All bands of the S10e in India](https://i.imgur.com/o148lf7.jpg)

Check what model number you have and then select the carrier that has the most coverage.",2019-08-05 00:57:27
322,"I read Pie is finally coming to the tab s3 in august but anyone know when?


The way samsung treats older flagships is despicable",2019-08-05 01:23:57
323,"I read Pie is finally coming to the tab s3 in august but anyone know when?


The way samsung treats older flagships is despicable",2019-08-05 01:24:10
324,"Lol you're asking the wrong people for that.  Ask Samsung but I'd be willing to bet no, just one trade in. I could be wrong though.",2019-08-05 01:33:45
325,Samsung has decided to remove the j line-up this year so you can only find a j smartphone from 2018.If  you want a 2019 smartphone you can get a A20e-A80 or  a M series,2019-08-05 02:17:25
326,I believe that from the A series only the A70 supports Samsung pay,2019-08-05 02:33:55
327,https://news.samsung.com/za/samsung-pay-now-available-on-galaxy-a70-and-a9,2019-08-05 02:35:00
328,"It seems like ting supports all versions. 

&amp;#x200B;

I will be getting the samsung GM G970U. That is the one being sold in India",2019-08-05 02:43:20
329,Samsung makes the best displays in the whole world. You’ll be able to tell it’s not 4K but it’s good. It works well there is an hdmi and dvi port in the back. The screen is bright and the curve gives you privacy at many angles. When it is dark there is a “night mode” And is a big bright screen at a nice price. I suggest it.,2019-08-05 03:23:13
330,Yeah because the telephoto only works for far subjects. I don't know why Samsung doesn't let us change the camera in Pro Mode.,2019-08-05 04:14:52
331,"Thank you for participating in r/samsung. Unfortunately, your submission was removed for breaking the following rule(s):

________________________________________________________________________________________________________________
&gt; **Rule 7** No photography type posts. Please share your awesome photos in the ""Shot on Samsung Sunday"" thread.

Reposting posts removed by a moderator without express permission is not allowed. Not here, and not on most of reddit. Please read reddiquette (linked below).
________________________________________________________________________________________________________________
For questions, comments and concerns, [message the moderators.](https://www.reddit.com/message/compose?to=/r/samsung)

[Reddiquette](https://www.reddit.com/wiki/reddiquette) | [New to Reddit?](https://www.reddit.com/wiki/reddit101) | [Reddit's Content Policy](https://www.reddit.com/help/contentpolicy/)",2019-08-05 04:22:17
332,"Thank you for participating in r/samsung. Unfortunately, your submission was removed for breaking the following rule(s):

________________________________________________________________________________________________________________
&gt; **Rule 4** No tech support / What should I buy questions. Please ask your question in the tech support / WSIB thread which is stickied. 

Reposting posts removed by a moderator without express permission is not allowed. Not here, and not on most of reddit. Please read reddiquette (linked below).
________________________________________________________________________________________________________________
For questions, comments and concerns, [message the moderators.](https://www.reddit.com/message/compose?to=/r/samsung)

[Reddiquette](https://www.reddit.com/wiki/reddiquette) | [New to Reddit?](https://www.reddit.com/wiki/reddit101) | [Reddit's Content Policy](https://www.reddit.com/help/contentpolicy/)",2019-08-05 04:23:16
333,"Thank you for participating in r/samsung. Unfortunately, your submission was removed for breaking the following rule(s):

________________________________________________________________________________________________________________
&gt; **Rule 4** No tech support / What should I buy questions. Please ask your question in the tech support / WSIB thread which is stickied. 

Reposting posts removed by a moderator without express permission is not allowed. Not here, and not on most of reddit. Please read reddiquette (linked below).
________________________________________________________________________________________________________________
For questions, comments and concerns, [message the moderators.](https://www.reddit.com/message/compose?to=/r/samsung)

[Reddiquette](https://www.reddit.com/wiki/reddiquette) | [New to Reddit?](https://www.reddit.com/wiki/reddit101) | [Reddit's Content Policy](https://www.reddit.com/help/contentpolicy/)",2019-08-05 04:23:45
334,"Thank you for participating in r/samsung. Unfortunately, your submission was removed for breaking the following rule(s):

________________________________________________________________________________________________________________
&gt; **Rule 4** No tech support / What should I buy questions. Please ask your question in the tech support / WSIB thread which is stickied. 

Reposting posts removed by a moderator without express permission is not allowed. Not here, and not on most of reddit. Please read reddiquette (linked below).
________________________________________________________________________________________________________________
For questions, comments and concerns, [message the moderators.](https://www.reddit.com/message/compose?to=/r/samsung)

[Reddiquette](https://www.reddit.com/wiki/reddiquette) | [New to Reddit?](https://www.reddit.com/wiki/reddit101) | [Reddit's Content Policy](https://www.reddit.com/help/contentpolicy/)",2019-08-05 04:23:58
335,"Thank you for participating in r/samsung. Unfortunately, your submission was removed for breaking the following rule(s):

________________________________________________________________________________________________________________
&gt; **Rule 4** No tech support / What should I buy questions. Please ask your question in the tech support / WSIB thread which is stickied. 

Reposting posts removed by a moderator without express permission is not allowed. Not here, and not on most of reddit. Please read reddiquette (linked below).
________________________________________________________________________________________________________________
For questions, comments and concerns, [message the moderators.](https://www.reddit.com/message/compose?to=/r/samsung)

[Reddiquette](https://www.reddit.com/wiki/reddiquette) | [New to Reddit?](https://www.reddit.com/wiki/reddit101) | [Reddit's Content Policy](https://www.reddit.com/help/contentpolicy/)",2019-08-05 04:24:04
336,"Thank you for participating in r/samsung. Unfortunately, your submission was removed for breaking the following rule(s):

________________________________________________________________________________________________________________
&gt; **Rule 4** No tech support / What should I buy questions. Please ask your question in the tech support / WSIB thread which is stickied. 

Reposting posts removed by a moderator without express permission is not allowed. Not here, and not on most of reddit. Please read reddiquette (linked below).
________________________________________________________________________________________________________________
For questions, comments and concerns, [message the moderators.](https://www.reddit.com/message/compose?to=/r/samsung)

[Reddiquette](https://www.reddit.com/wiki/reddiquette) | [New to Reddit?](https://www.reddit.com/wiki/reddit101) | [Reddit's Content Policy](https://www.reddit.com/help/contentpolicy/)",2019-08-05 04:24:22
337,"Thank you for participating in r/samsung. Unfortunately, your submission was removed for breaking the following rule(s):

________________________________________________________________________________________________________________
&gt; **Rule 4** No tech support / What should I buy questions. Please ask your question in the tech support / WSIB thread which is stickied. 

Reposting posts removed by a moderator without express permission is not allowed. Not here, and not on most of reddit. Please read reddiquette (linked below).
________________________________________________________________________________________________________________
For questions, comments and concerns, [message the moderators.](https://www.reddit.com/message/compose?to=/r/samsung)

[Reddiquette](https://www.reddit.com/wiki/reddiquette) | [New to Reddit?](https://www.reddit.com/wiki/reddit101) | [Reddit's Content Policy](https://www.reddit.com/help/contentpolicy/)",2019-08-05 04:24:27
338,"Thank you for participating in r/samsung. Unfortunately, your submission was removed for breaking the following rule(s):

________________________________________________________________________________________________________________
&gt; **Rule 4** No tech support / What should I buy questions. Please ask your question in the tech support / WSIB thread which is stickied. 

Reposting posts removed by a moderator without express permission is not allowed. Not here, and not on most of reddit. Please read reddiquette (linked below).
________________________________________________________________________________________________________________
For questions, comments and concerns, [message the moderators.](https://www.reddit.com/message/compose?to=/r/samsung)

[Reddiquette](https://www.reddit.com/wiki/reddiquette) | [New to Reddit?](https://www.reddit.com/wiki/reddit101) | [Reddit's Content Policy](https://www.reddit.com/help/contentpolicy/)",2019-08-05 04:25:01
339,"Thank you for participating in r/samsung. Unfortunately, your submission was removed for breaking the following rule(s):

________________________________________________________________________________________________________________
&gt; **Rule 4** No tech support / What should I buy questions. Please ask your question in the tech support / WSIB thread which is stickied. 

Reposting posts removed by a moderator without express permission is not allowed. Not here, and not on most of reddit. Please read reddiquette (linked below).
________________________________________________________________________________________________________________
For questions, comments and concerns, [message the moderators.](https://www.reddit.com/message/compose?to=/r/samsung)

[Reddiquette](https://www.reddit.com/wiki/reddiquette) | [New to Reddit?](https://www.reddit.com/wiki/reddit101) | [Reddit's Content Policy](https://www.reddit.com/help/contentpolicy/)",2019-08-05 04:25:15
340,"Thank you for participating in r/samsung. Unfortunately, your submission was removed for breaking the following rule(s):

________________________________________________________________________________________________________________
&gt; **Rule 4** No tech support / What should I buy questions. Please ask your question in the tech support / WSIB thread which is stickied. 

Reposting posts removed by a moderator without express permission is not allowed. Not here, and not on most of reddit. Please read reddiquette (linked below).
________________________________________________________________________________________________________________
For questions, comments and concerns, [message the moderators.](https://www.reddit.com/message/compose?to=/r/samsung)

[Reddiquette](https://www.reddit.com/wiki/reddiquette) | [New to Reddit?](https://www.reddit.com/wiki/reddit101) | [Reddit's Content Policy](https://www.reddit.com/help/contentpolicy/)",2019-08-05 04:25:25
341,"Thank you for participating in r/samsung. Unfortunately, your submission was removed for breaking the following rule(s):

________________________________________________________________________________________________________________
&gt; **Rule 7** No photography type posts. Please share your awesome photos in the ""Shot on Samsung Sunday"" thread.

Reposting posts removed by a moderator without express permission is not allowed. Not here, and not on most of reddit. Please read reddiquette (linked below).
________________________________________________________________________________________________________________
For questions, comments and concerns, [message the moderators.](https://www.reddit.com/message/compose?to=/r/samsung)

[Reddiquette](https://www.reddit.com/wiki/reddiquette) | [New to Reddit?](https://www.reddit.com/wiki/reddit101) | [Reddit's Content Policy](https://www.reddit.com/help/contentpolicy/)",2019-08-05 04:25:34
342,"Thank you for participating in r/samsung. Unfortunately, your submission was removed for breaking the following rule(s):

________________________________________________________________________________________________________________
&gt; **Rule 4** No tech support / What should I buy questions. Please ask your question in the tech support / WSIB thread which is stickied. 

Reposting posts removed by a moderator without express permission is not allowed. Not here, and not on most of reddit. Please read reddiquette (linked below).
________________________________________________________________________________________________________________
For questions, comments and concerns, [message the moderators.](https://www.reddit.com/message/compose?to=/r/samsung)

[Reddiquette](https://www.reddit.com/wiki/reddiquette) | [New to Reddit?](https://www.reddit.com/wiki/reddit101) | [Reddit's Content Policy](https://www.reddit.com/help/contentpolicy/)",2019-08-05 04:26:09
