,User,Date,Tweets
1207,Wired,2019-10-13 19:11:43,Dyson abandoned its plans to build an electric car the Elon Muskpedo guy story gets even weirder and the scien 
1208,Wired,2019-10-13 18:07:34,MacOS Catalina is now available for download and its packed with features focused on user security and privacy T 
1209,Wired,2019-10-13 17:04:52,How long have you gone without checking your phone this week Ten 15 maybe 20 minutes Webby founder and filmmake 
1210,Wired,2019-10-13 17:01:05,The internet is a dangerous place but were here to help This allencompassing guide has everything you need to k 
1211,Wired,2019-10-13 17:01:04,Smart Home SnoopingSmart devices are yet another set of gadgets for hackers to target To keep them out of your ho 
1212,Wired,2019-10-13 17:01:03,Leaky Photo UploadsWhile lots of apps Instagram and Facebook strip out the location data in photos some Google 
1213,Wired,2019-10-13 17:01:01,Rogue USB SticksThey may not look dangerous but these portable drives can carry major threats Dont connect a U 
1214,Wired,2019-10-13 17:01:00,Zombie Accounts Every social media account you abandon is another one that could be hacked Make sure you shut dow 
1215,Wired,2019-10-13 17:00:59,Bogus Online Quizzes Finding out which Hogwarts house youd get into seems like harmless fun but that quiz could 
1216,Wired,2019-10-13 17:00:57,Untrusted Browser ExtensionsPick the wrong extension and it could sell your browsing data or install software you 
1217,Wired,2019-10-13 17:00:56,Malicious Charging CablesBe careful buying nonstandard charging cables Fake Lightning cables that look just like 
1218,Wired,2019-10-13 17:00:54,Data breaches and hacks get all the headlines but there are plenty of lesserknown cyber dangers that can do serio 
1219,Wired,2019-10-13 16:02:25,Hiking Camping Leafpeeping Skiing Tis the season to embrace it all without melting in the process Good deal 
1220,Wired,2019-10-13 14:39:20,Ripper was a muchhyped videogame featuring Christopher Walken that interspersed scenes of fullmotion video with 
1221,Wired,2019-10-13 13:31:51,The heist should have been impossible to pull off 625000 in highly purified polysilicon over fiveplus years 
1222,Wired,2019-10-13 12:26:59,We must declare war on microfibers Our yoga pants socks waterwicking sweatshirts all are plasticinfused Once 
1223,Wired,2019-10-13 11:23:15,According to new court documents after Elon Musk called a cave expert who helped rescue the Thai youth soccer team 
1224,Wired,2019-10-13 10:16:59,Facebook and Silicon Valley more broadly sees the world as Donald Trump doesa ceaseless battle for dominance 
1225,Wired,2019-10-13 09:12:07,Protect yourself 
1226,Wired,2019-10-13 08:08:39,Remember that scene in Avengers Endgame where all the women of Marvel gathered on the battlefield to protect the I 
1227,Wired,2019-10-13 06:58:17,These rippling rocks and canyons arent from around here They lie deep within the Gale Crater on Mars and could s 
1228,Wired,2019-10-13 05:51:07,Apollo astronauts werent just heroesthey were fantastic photographers  
1229,Wired,2019-10-13 03:49:26,Fourteen individuals or entities have claimed the Bahia emerald is theirs Four lawsuits have been filed over the r 
1230,Wired,2019-10-13 02:39:54,A Google team has apparently demonstrated that its now possible to build a quantum machine thats large enough an 
1231,Wired,2019-10-13 01:35:29,These babies are made for danger 
1232,Wired,2019-10-13 00:10:22,Prototypes and demos of flying cars are common but footage of them actually flying is pretty rare This new video 
1233,Wired,2019-10-12 22:38:52,Got too many Lego pieces scattered throughout the house Now might be a good time to put them back in the box 
1234,Wired,2019-10-12 21:52:03,RT  War has always been entwined with photography but never quite like in Mosul This was the first smartphone war where ever
1235,Wired,2019-10-12 21:35:15,A decade ago South Korean photographer Seunggu Kim began noticing a new trend of luxury apartment complexes in Seo 
1236,Wired,2019-10-12 20:31:11,The Surface Pro 7 The Kindle Fire HD 10 The PlayStation 5 They all have one thing the iPhone does not USBC 
1237,Wired,2019-10-12 19:26:51,Its been busy in cybersecurityRussia is still spreading disinformation in the USiTunes could be use 
1238,Wired,2019-10-12 18:53:43,And regardless of what phone you have here are some tips to keep it running smoothly for as long as possible 7
1239,Wired,2019-10-12 18:53:42,Now that you have a phone you love these accessories will help you make the most of it 6
1240,Wired,2019-10-12 18:53:42,Still want great photos but dont need the extra oomph The Phone 11 is the one for you Read more here 5 
1241,Wired,2019-10-12 18:53:42,Youre ready for a new iPhone but which one Do you fancy yourself a photographer If so youll probably like t 
1242,Wired,2019-10-12 18:53:42,If youre team iPhone how important is it for you to have the latest modelIf youd rather save money click her 
1243,Wired,2019-10-12 18:53:42,First things first Android or iPhoneClick the link below for our favorite Android phones and keep scrolling fo 
1244,Wired,2019-10-12 18:53:41, So youre in the market for a new phone but youre not sure where to start Dont worry Weve got you covered  1
1245,Wired,2019-10-12 17:45:40,Next time you pick up a pizza from your favorite pizzeria and toss the box in your front seat think about why the 
1246,Wired,2019-10-12 16:41:33,Say hello to Microsofts new Surface Pro X a thinner sleekerlooking version of its Surface Pro tablet And it wi 
1247,Wired,2019-10-12 15:38:00,Next time you pick up a pizza from your favorite pizzeria and toss the box in your front seat think about why the 
1248,Wired,2019-10-12 14:33:58,David Marcus head of Facebooks Libra project said the departure of five more members including Visa Mastercard 
1249,Wired,2019-10-12 12:29:04,The PlayStation 5 is officially coming in 2020 Heres what you need to know 
1250,Wired,2019-10-12 11:16:03,The former ambassador to Russia Michael McFaul tweeted Please tell me this cant be true 
1251,Wired,2019-10-12 09:51:22,The is it blue and black or white and gold Dress from 2015 didnt just break the internet it broke color science 
1252,Wired,2019-10-12 08:47:30,The smart cameras at an apartment complex on Manhattans Lower East Side which uses facial recognition technology 
1253,Wired,2019-10-12 07:44:43,A gang of teen hackers snatched the keys to Microsofts videogame empire for what they thought was harmless fun Th 
1254,Wired,2019-10-12 06:42:40,From rogue USB sticks to Chrome extensions gone wild to bogus online quizzes heres a quick guide to some basic ri 
1255,Wired,2019-10-12 05:30:00,In a few hours Eliud Kipchoge the best marathoner on Earth will try to break the 2hour marathon To do so hel 
1256,Wired,2019-10-12 05:25:34,Got too many Lego pieces scattered throughout the house Now might be a good time to put them back in the box 
1257,Wired,2019-10-12 04:22:53,Forget the spendy phones and get a seriously great more affordable phone instead These are our favorites 
1258,Wired,2019-10-12 03:19:06,How long have you gone without checking your phone this week Ten 15 maybe 20 minutes Webby founder and filmmake 
1259,Wired,2019-10-12 03:05:14,500000 homes in 20 counties across northern and central California went without power after PGampE pulled the plug 
1260,Wired,2019-10-12 02:00:12,Introducing the GroombaA comic by Lars Kenseth with   
1261,Wired,2019-10-12 01:48:18,RT  Turkey is cutting off social media in the south of the countryfollowing the typical playbook when you dont want people to
1262,Wired,2019-10-12 00:21:49,Visa Mastercard Stripe eBay and Mercado Pago have all pulled out of Facebooks Libra Association Now Facebook 
1263,Wired,2019-10-11 22:40:13,As Turkey launched an attack on Kurdish forces in northern Syria this week the country also restricted access to s 
1264,Wired,2019-10-11 22:05:38,Want more science news Make sure you dont miss any of our stories Sign up for our daily newsletter 
1265,Wired,2019-10-11 22:05:37,Before the discovery the only planets we knew were the eight in our own solar system It was quite a feat of scien 
1266,Wired,2019-10-11 22:05:36,At 93 billion light years across our observable universe is full of possibility The Nobel Prize in physics this y 
1267,Wired,2019-10-11 22:05:35,The Nobel Prizes can sometimes dive into seemingly rarified corners of science but the 2019 Nobel Prize in Chemist 
1268,Wired,2019-10-11 22:05:34,Theres been a LOT of news this week including two big Nobel Prize awards The prizes celebrated scientists whose 
1269,Wired,2019-10-11 21:49:47,Some 96 of deepfakes circulating on the internet are pornographic 
1270,Wired,2019-10-11 19:51:18,Maybe she can answer some of those slacks though A comic by Lars Kenseth with  
1271,Wired,2019-10-11 19:47:32,RT  The best reason for Rudy Giuliani and his compatriots to have bought those oneway tickets to Vienna To watch Eliud Kipcho
1272,Wired,2019-10-11 17:49:14,The subtwohour marathon is the last great barrier in distance running Tomorrow Eliud Kipchoge the best maratho 
1273,Wired,2019-10-11 17:44:07,Facebook and Silicon Valley more broadly sees the world as Donald Trump doesa ceaseless battle for dominance 
1274,Wired,2019-10-11 17:43:05,Last chance Get 1 year of print and digital access for just 10 Plus youll receive a free WIRED gift 
1275,Wired,2019-10-11 17:03:12,RT  The acting director of the Bureau of Land Management is refusing to say whether climate change is real or a problem  at th
1276,Wired,2019-10-11 16:22:00,Next year Tern will release the HSD or Haul Stuff Daily bike The new ebike is comfortable compact and more 
1277,Wired,2019-10-11 15:59:19,RT  What will come next after journalism for me  
1278,Wired,2019-10-11 15:45:27,This guidance computer was supposed to help Apollo11 astronauts Neil Armstrong and Buzz Aldrin land on the moon I 
1279,Wired,2019-10-11 14:57:22,Facial recognition is largely unregulated in the US There are no federal rules governing its use That means the o 
1280,Wired,2019-10-11 13:50:38,Latency in gaming is that tricky delay between giving an input and seeing its result Now Google is promising neg 
1281,Wired,2019-10-11 13:44:13,Turns out its harder to make an electric car than a vacuum Two years after announcing it would invest 25 billio 
1282,Wired,2019-10-11 12:43:04,US tech companies rely on Chinas factories supply chain and its topclass research talent Those ties are incre 
1283,Wired,2019-10-11 11:40:36,What if your keyboard was the size of a kingsized candy bar With no number keys and the space bar is supertiny 
1284,Wired,2019-10-11 10:37:23,In an era of heightened scrutiny of the technology sector is possible to divorce new gadgets from the people who m 
1285,Wired,2019-10-11 09:23:52,Stretching another couple years out of your PS4 console Try some of these lovely extras 
1286,Wired,2019-10-11 08:21:46,The Surface Pro 7 The Kindle Fire HD 10 The PlayStation 5 All major gadgets announced or detailed this week and 
1287,Wired,2019-10-11 07:19:34,Opinion Rather than bucking the trend politicians and educators should help students avoid gaming addiction and b 
1288,Wired,2019-10-11 06:17:04,Next time you pick up a pizza from your favorite pizzeria and toss the box in your front seat think about why the 
1289,Wired,2019-10-11 05:14:34,Yes your beloved yoga pants shed as much as 100k synthetic fibers every single time you wash them They then end u 
1290,Wired,2019-10-11 04:11:11,Brie Larson says Marvels superheroines want an allfemale movie I will say that a lot of the female cast members 
1291,Wired,2019-10-11 03:07:51,Think youd spot this tiny chip in a piece of hardware Researchers have found that planting tiny spy chips in IT e 
1292,Wired,2019-10-11 02:00:22,Tinder meets Crispr By  with   
1293,Wired,2019-10-11 01:49:12,RT  Its total garbage that Twitter took the phone numbers we gave for 2FA and used them for ad targeting  is spot
1294,Wired,2019-10-11 01:28:28,This week PGampE a utility responsible for as many people as the entire population of Cambodia essentially said it 
1295,Wired,2019-10-11 00:15:00,RT  The port of the future has become the port of right nowwith one big exception 
1296,Wired,2019-10-11 00:01:07,Workplace discrimination is illegal under Title VII of the 1964 Civil Rights Act it forbids discrimination based o 
1297,Wired,2019-10-10 23:06:12,Chinas embrace of American products over the past decade has made tech companies rich Now amidst the prodemocra 
1298,Wired,2019-10-10 21:39:19,Chemicals in microwave popcorn are in your bloodstream researchers discovered a 200 way to spy on you and you ca 
1299,Wired,2019-10-10 21:32:32,Turns out its harder to make an electric car than a vacuum Two years after announcing it would invest 25 billio 
1300,Wired,2019-10-10 20:47:46,The USBC port has become the industry standard with one big exceptionthe iPhone 
1301,Wired,2019-10-10 20:23:27,RT  Andy Rubins new phone thing isnt just a new phone thing  
1302,Wired,2019-10-10 19:59:19,Andy Rubins Essential has made another phone a year after reports highlighted his alleged sexual misconduct and a 
1303,Wired,2019-10-10 19:52:24,Opinion Transgender employees live in fear even in the most progressive workplaces We need clearer and more dedic 
1304,Wired,2019-10-10 18:10:03,Remember that scene in Avengers Endgame where all the women of Marvel gathered on the battlefield to protect the I 
1305,Wired,2019-10-10 17:57:03,PFAS per and polyfluoroalkyl substances are the reason the oil doesnt ooze out of your popcorn bag while its bu 
1306,Wired,2019-10-10 17:43:03,Subscribe now Get 1 year of WIRED print and digital access for just 10 Plus youll receive a free WIRED gift 
1307,Wired,2019-10-10 17:16:41,RT  We still dont know the full story of SuperMicro and China But a researcher has just proven how to cheaply hack IT hardwar
1308,Wired,2019-10-10 16:54:01,Parrot is back with a new drone the Anafi FPV firstperson viewTired No collision avoidance features Camera 
1309,Wired,2019-10-10 16:33:07,The Phonocut is the first consumer device capable of making custom records immediately right there in your home a 
1310,Wired,2019-10-10 16:06:13,RT  A year after Bloombergs questionable spy chip story a researcher has shown how those hardware implants arent just possi
1311,Wired,2019-10-10 15:43:04,Opinion Esports is neither cureall nor curse for engaging students Like any activity the devil is in the execut 
1312,Wired,2019-10-10 15:18:55,What does it take to plant malicious spy chips into your IT equipment A motivated hacker and just 200 worth of eq 
1313,Wired,2019-10-10 14:54:04,A decade ago South Korean photographer Seunggu Kim began noticing a new trend of luxury apartment complexes in Seo 
1314,Wired,2019-10-10 14:07:24,Do you know of any tech products initiatives and policiesthat have demonstrated a commitment to tech and public 
1315,Wired,2019-10-10 13:05:29,Can Tesla owners use their cars batterieswhich hold enough juice to power a house for days and are now the object 
1316,Wired,2019-10-10 12:25:01,Ripper was a muchhyped videogame featuring Christopher Walken that interspersed scenes of fullmotion video with 
1317,Wired,2019-10-10 11:22:53,Hundreds of thousands of homes across California are without power But chunks of Bay Area remain conspicuously abs 
1318,Wired,2019-10-10 10:20:41,Bugs and mistakes happen but when it comes to misuse of information users provide for security services its obvi 
1319,Wired,2019-10-10 09:18:37,Do you own a Nintendo Switch You really should consider some of these accoutrements  
1320,Wired,2019-10-10 08:16:09,All is not well out west 
1321,Wired,2019-10-10 07:13:40,When the government offered to buy up houses in flood zones wealthier homeowners took advantage while poorer resid 
1322,Wired,2019-10-10 06:11:09,The lithiumion battery has become a staple in modern electronics Three scientists won the 2019 Nobel Prize in Che 
1323,Wired,2019-10-10 05:09:23,A new movement to encrypt a fundamental internet mechanism promoted by browser heavyweights like Google Chrome and 
1324,Wired,2019-10-10 04:07:02,A group of computer scientists affiliated with Facebook AI Research have created a machine learning system called F 
1325,Wired,2019-10-10 03:41:00,The current world record for solving a Rubiks cube is 347 seconds Could it be faster  
1326,Wired,2019-10-10 03:05:06,The 1996 gorefilled Ripper was a muchhyped videogame that interspersed scenes of fullmotion video with 3Dgraphi 
1327,Wired,2019-10-10 03:00:20,From Californias power outage to what Nintendo Switch accessories to buy heres the news to know today in two min 
1328,Wired,2019-10-10 02:32:01,Hate to break it to you but you cant use your Teslas battery to keep your house lights on if your power goes out 
1329,Wired,2019-10-10 02:01:07,Fight FOMO with FOMOBy  with  
1330,Wired,2019-10-10 01:05:07,500000 homes in 20 counties and counting across northern and central California are without power after PGampE pul 
1331,Wired,2019-10-10 00:29:25,RT  Behind the clickbait headlines about antibioticresistant cows theres the untold story of how cultural divides in scien
1332,Wired,2019-10-09 23:51:24,The 2019 Nobel Prize for Physics went to two scientists who were the first to detect a planet orbiting a faraway s 
1333,Wired,2019-10-09 22:52:36,Its hard keeping up with the news But what if you could get the most important stuff summarized in two minutes o 
1334,Wired,2019-10-09 22:41:21,Good news We found the best Nintendo Switch accessories you should buyBad news Hundreds of thousands of people 
1335,Wired,2019-10-09 22:13:07,A decade ago South Korean photographer Seunggu Kim began noticing a new trend of luxury apartment complexes in Seo 
1336,Wired,2019-10-09 21:31:01,As it turns out its mostly wealthier counties around the country taking advantage of the governments flood buyba 
1337,Wired,2019-10-09 20:39:06,Check out some of the best accessories available to get the most out of your Nintendo Switch  
1338,Wired,2019-10-09 20:03:20,WIRED and  have launched Tech Spotlight a way to recognize products initiatives policies that embra 
1339,Wired,2019-10-09 19:09:00,Opinion The military will eventually adapt to incorporating information technologies AI cyber warfare and more 
1340,Wired,2019-10-09 18:41:02,A friendly reminder that every time you give your data to a company no matter what they say its for it could alw 
1341,Wired,2019-10-09 18:26:47,A machine learning system called Fashion makes outfits more stylish with small changetucking in a shirt adding 
1342,Wired,2019-10-09 16:47:07,Humans thought their ships could burn filthy fuel without any judgement raining down They thought wrong 
1343,Wired,2019-10-09 16:32:52,RT  The world champs in Doha2019 were amazing Knox Robinson and I dug into the results and key questions namely A does a b
1344,Wired,2019-10-09 16:32:22,RT  Love this story from  on tiny keyboard enthusiasts who are trying to foster creativity through constraint a
1345,Wired,2019-10-09 15:44:05,The security community generally agrees on the importance of encrypting private data But a new movement to encrypt 
1346,Wired,2019-10-09 15:38:05,Exclusive offer for our Twitter followers Get 1 year of print and digital access for just 10 Plus youll receiv 
1347,Wired,2019-10-09 15:15:53,RT  A behind the scenes look at the production of Ripper the comically wooden and bizarre videogame from the 1990sstarring
1348,Wired,2019-10-09 15:04:04,A Senate intelligence report offers the most comprehensive look thus far at the efforts of the Russian propaganda f 
1349,Wired,2019-10-09 14:41:22,For their invention of the rechargeable lithiumion batterythe key to everything from mobile phones to electric ca 
1350,Wired,2019-10-09 14:39:55,The hard truth is that California is built to burn But PGampE bears outsized responsibility for this mess the west i 
1351,Wired,2019-10-09 14:26:50,RT  What I got from this is that the ubiquity of plastic waste IS a problem but there ARE solutions beyond just not wearing s
1352,Wired,2019-10-09 13:24:32,Bollingers electric pickup and SUVs will carry 120 kWh batteries bigger than any pack on the market today That w 
1353,Wired,2019-10-09 12:20:33,The Trump administration has banned six Chinese companies that work on artificial intelligence from doing business 
1354,Wired,2019-10-09 12:13:37,Christopher Walken and I were standing on a dark deserted street in Manhattans Meatpacking district at 4 in the 
1355,Wired,2019-10-09 11:11:56,According to court documents Elon Musk has regrets about his Twitter use Im a fucking idiot he wrote to a p 
1356,Wired,2019-10-09 10:09:31,Our oceans are in immediate serious trouble because of climate change The thing that needs to happen ASAP huma 
1357,Wired,2019-10-09 08:08:54,The former ambassador to Russia Michael McFaul tweeted Please tell me this cant be true 
1358,Wired,2019-10-09 07:07:10,What if your keyboard was the size of a kingsized candy bar With no number keys and the space bar is supertiny 
1359,Wired,2019-10-09 06:04:18,We must declare war on microfibers Our yoga pants socks waterwicking sweatshirts all are plasticinfused Once 
1360,Wired,2019-10-09 05:02:40,Deep learning is good at finding patterns in reams of data but cant explain how theyre connected Turing Award w 
1361,Wired,2019-10-09 04:00:23,Say hello to the PlayStation 5 officially 
1362,Wired,2019-10-09 02:38:05,Holiday parties are about to get a lot more awkwardBy  with  
1363,Wired,2019-10-09 01:57:06,At 93 billion light years across our observable universe is full of unfathomable possibility The Nobel Prize Comm 
1364,Wired,2019-10-09 00:31:00,In an attempt to limit potential windinduced wildfires PGampE is shutting off power to a staggering 800000 custome 
1365,Wired,2019-10-08 23:29:52,According to new court documents after Elon Musk called a cave expert who helped rescue the Thai youth soccer team 
1366,Wired,2019-10-08 23:23:08,An exclusive look at the new Playstation 5 Elon Musk has some Twitter regrets and a new electric truck is ready t 
1367,Wired,2019-10-08 22:16:26,Neon Genesis Evangelion takes as its premise an idea thats worryingly relevant to the psyche of 2019 It suggest 
1368,Wired,2019-10-08 22:03:03,RT  CDC says combined cases of syphilis gonorrhea and chlamydia reached a record high in 2018 To blame Public health de
1370,Wired,2019-10-08 21:40:25,RT  Holiday parties are about to get a lot more awkwardBy  with  
1371,Wired,2019-10-08 21:08:56,Check out Bollingers electric pickup and SUV They have massive offroad tires that offer 10 inches of wheel trave 
1372,Wired,2019-10-08 20:02:34,Were entering a new world of doghuman communication where technology is allowing dogs to speak in ways we can 
1373,Wired,2019-10-08 19:09:37,RT  Selfawareness from Elon Musk From the court docs today 
1374,Wired,2019-10-08 18:52:57,Dalilah Muhammad broke the world record in the 400 meter hurdles Salwa Eid Naser made a stunning win in the 400m 
1375,Wired,2019-10-08 18:49:42,RT  Now that the name is official weve got more details about Sonys nextgen consolefrom the hapticspacked controller to UI
1376,Wired,2019-10-08 18:41:26,Minimalists intent on freeing up desk space are shrinking their keyboards Welcome to the world of customdesigned 
1377,Wired,2019-10-08 18:10:56,RT  This story is so rich A biotech company was geneediting  dairy cows to make them hornless But a lab mistake triggered a
1378,Wired,2019-10-08 17:37:35,Without synthetic plasticky fabrics wed have no yoga pants no stretchy socks no waterwicking sweatshirts But 
1379,Wired,2019-10-08 16:31:50,If the Trump administration does pull out of the Open Skies agreement its collapse would be the latest in a series 
1380,Wired,2019-10-08 16:29:28,Got too many Lego pieces scattered throughout the house Now might be a good time to put them back in the box 
1381,Wired,2019-10-08 16:03:37,RT  Donald Trumps latest targetunwinding a bedrock principle of Cold War nuclear deterrence that allows for confidence build
1382,Wired,2019-10-08 15:27:35,Yoshua Bengio is a pioneer of deep learning the technique that triggered a renaissance in artificial intelligence 
1383,Wired,2019-10-08 14:27:04,On Monday the results of a years long study on geneedited DNA were published with open access Whether it will he 
1384,Wired,2019-10-08 14:07:23,RT  Six months ago we brought you the first solid news about Sonys nextgen console Felt like time for an update The PS5 wi
1385,Wired,2019-10-08 13:57:32,At 93 billion light years across our observable universe seems full of unfathomable possibility Today the Nobe 
1386,Wired,2019-10-08 13:10:51,Exclusive The PlayStation 5 is officially coming in 2020 Heres what you need to know 
1387,Wired,2019-10-08 12:38:35,If the early rise of Netflix helped define the tail end of the Prestige TV era with standouts like House of Cards a 
1388,Wired,2019-10-08 11:27:32,Hollywoods hottest new talent has superhuman strength doesnt take breaks or require hair and makeup services He 
1389,Wired,2019-10-08 10:24:49,Portable speakers come in all shapes and sizes from clipons to a massive boom box We did the hard work and found 
1390,Wired,2019-10-08 09:23:06,Some 96 of deepfakes circulating on the internet are pornographic 
1391,Wired,2019-10-08 08:20:48,Welcome to Airbnbs glitzy greenwashing PR stunt In December the vacation rental platform will send five lucky v 
1392,Wired,2019-10-08 07:18:19,In an onlymaybekinda surprising twist Warner Bros Joker nabbed a cool 96 million at the domestic box office 
1393,Wired,2019-10-08 06:16:07,Facebook said that its cryptocurrency Libra will be managed by an independent group But a WIRED analysis has found 
1394,Wired,2019-10-08 05:12:57,Stitch Fix is using something called eigenvector decomposition a concept from quantum mechanics to tease apart th 
1395,Wired,2019-10-08 04:10:09,The war against the Islamic State was the first smartphone war   
