,User,Date,Tweets
1786,Wired,2019-09-26 13:22:23,If a Ring camera does capture someone elses property or an innocent person walking by whose right is it to turn 
1787,Wired,2019-09-26 13:16:55,RT  Hello I read dozens of local news stories featuring footage from Ring cameras and wrote about what this passive form of vi
1788,Wired,2019-09-26 12:30:26,For seven years running 123456 and password have been the two most commonly used passwords on the web We can  
1789,Wired,2019-09-26 11:30:10,About 300 ebuses trundle along US roads operated by transit agencies in Los Angeles Philadelphia and elsewhere 
1790,Wired,2019-09-26 11:27:04,Amazon unleashed a flood of hardware over 90 minutes Wednesday including new Alexa devices new Echo speakers devi 
1791,Wired,2019-09-26 10:28:24,Thanks to images that onlookers filmed of the eerie approaching tsunami waves scientists are now able to create de 
1792,Wired,2019-09-26 09:26:05,Cheaper lighter and a whole lot cuter the 200 Nintendo Switch Lite is both a followup and a spinoff of Ninten 
1793,Wired,2019-09-26 09:01:02,You wont find more pure whimsy in a 2019 game via  
1794,Wired,2019-09-26 07:59:01,TikTok is used by a billion people across the worldits sheer volume makes it difficult to censor For Uyghurs in 
1795,Wired,2019-09-26 07:44:07,I would like you to find out what happened with this whole situation with Ukraine they say CrowdStrike  I gues 
1796,Wired,2019-09-26 06:42:19,In a hearing on ecigarettes not only did the acting FDA commissioner say theyre not safe he stated that all e 
1797,Wired,2019-09-26 05:40:15,The UNs Intergovernmental Panel on Climate Change has dropped a new report and it warns of an unfolding catastrop 
1798,Wired,2019-09-26 05:23:00,How did Avengers Endgame look so cool Jen Underdahl Visual Effects Producer for Marvel Entertainment gave us 
1799,Wired,2019-09-26 04:38:07,We took a Sonos speaker on its first trip outside the house and off of WiFi This is what happened 
1800,Wired,2019-09-26 04:21:00,Astronomer Jill Tarter has devoted most of her adult life to the search for extraterrestrial intelligence She answ 
1801,Wired,2019-09-26 03:36:10,Dont want to be tracked Bad news 2000 streaming apps are tracking information about your deviceseven when you 
1802,Wired,2019-09-26 02:37:18,RT  On the heels of a significant announcement about its environmental efforts last week Amazon said little if anything about
1803,Wired,2019-09-26 02:30:51,Step aside Polaroid 
1804,Wired,2019-09-26 01:26:18,Jeff Bezos says Amazon is evaluating manufacturing as part of climaterelated efforts and that its not looking j 
1805,Wired,2019-09-26 00:59:08,Bacteria harvested from pigs and chickens are developing resistance to numerous antibiotics at an alarming rate 
1806,Wired,2019-09-25 23:59:07,Digital Thin Mints are still better than real Trefoils By  with  
1807,Wired,2019-09-25 23:20:47,Ultimately the report shows climate change is ocean change If we dont fix it our forewarned catastrophe will un 
1808,Wired,2019-09-25 23:20:47,Permafrost too is a looming crisis Arctic and boreal permafrost hold almost twice the amount of carbon in the at 
1809,Wired,2019-09-25 23:20:45,Then theres snow Snow cover has declined in nearly all mountain regions Less snow melt threatens drinking water 
1810,Wired,2019-09-25 23:20:43,The ocean is also warming The number of marine heat waves has doubled over the last four decades driving ecologic 
1811,Wired,2019-09-25 23:20:41,In the next three decades many lowlying megacities and islands could start seeing what used to be onceinacentu 
1812,Wired,2019-09-25 23:20:39,Global sea level rise is accelerating Between 2006 and 2015 it rose about 36 millimeters a year more than doubl 
1813,Wired,2019-09-25 23:20:37,The latest report from the UNs Intergovernmental Panel on Climate Change has dropped and it paints a bleak pictur 
1814,Wired,2019-09-25 23:17:16,RT  Heres all Amazon announced today Basically you can now put Alexa on your ears eyes finger and electrical sockets htt
1815,Wired,2019-09-25 22:38:06,Thanks to images that onlookers filmed of the eerie approaching tsunami waves scientists are now able to create de 
1816,Wired,2019-09-25 22:35:40,Amazon announced a slew of new products President Trump drew cybersecurity firm CrowdStrike into his mess with Ukr 
1817,Wired,2019-09-25 22:21:42,Alexa earbuds Alexa glasses An Alexa ring Amazon made one thing very clear at its hardware event today It wants 
1818,Wired,2019-09-25 21:45:10,Exclusive offer for our Twitter followers Get 1 year of print and digital access for just 10 Plus youll receiv 
1819,Wired,2019-09-25 21:05:06,If youre into Echo weve got some good news for you 
1820,Wired,2019-09-25 20:09:01,RT  Lots and lots and lots of Amazon  via 
1821,Wired,2019-09-25 20:07:06,As smartphones with builtin cameras continue to grow in popularity millions of amateur videographers can record d 
1822,Wired,2019-09-25 19:45:04,Opinion Privacyminded designers need to get resourceful and be prolific Sometimes that means using socalled da 
1823,Wired,2019-09-25 19:41:57,Amazon just announced Echo Frames Alexaenabled smart glasses that have microphones but critically no camera Th 
1824,Wired,2019-09-25 19:29:04,At a US House Committee on Energy and Commerce hearing today on ecigarettes US representatives blasted FDA offici 
1825,Wired,2019-09-25 19:19:01,RT  We have some great plant content on  today First read  on the natureondemand market 
1826,Wired,2019-09-25 19:13:55,Amazon just unleashed a flood of hardware including new Echo speakers devices Echo Frames new Alexaenabled smar 
1827,Wired,2019-09-25 18:54:02,Cloudfares initial launch of its mobile VPN Warp didnt go as planned Now its trying again  
1828,Wired,2019-09-25 18:39:05,If your plants could make music what would it sound like PlantWave lets you find out 
1829,Wired,2019-09-25 18:34:02,Have questions about the Switch Lite Were answering them over on our Instagram stories 
1830,Wired,2019-09-25 18:33:06,The Switch Lite is the first step into a new era for Nintendo  There are no mobile versions of Switch games All S 
1831,Wired,2019-09-25 18:31:02,CrowdStrike a prominent cybersecurity company that most Americans have never heard of made an unexpected appearan 
1832,Wired,2019-09-25 18:24:28,RT  ALEXA SMART GLASSES Dave has been wearing them this whole time 
1834,Wired,2019-09-25 18:17:29,Our oceans are in immediate serious trouble because of climate change The thing that needs to happen ASAP huma 
1835,Wired,2019-09-25 18:17:05,RT  I broke down 21 levels of complexities in basic skate tricks with   aka watch on old dog tea
1836,Wired,2019-09-25 18:13:20,RT  This 4legged robot could be your next coworker Boston Dynamics will now allow Spot its famous robot to be leased Its
1837,Wired,2019-09-25 17:22:15,Today about 300 ebuses trundle along US roads in Los Angeles Philadelphia and elsewhere But an obscure provis 
1838,Wired,2019-09-25 16:47:22,RT  Why are the killifish of Newark so tough There are all kinds of amazing lessons about evolution from the creatures that th
1839,Wired,2019-09-25 16:20:55,150000 people woke up Monday morning to find that they didnt have a ride home But the UK has a plan and the pla 
1840,Wired,2019-09-25 15:20:43,Wearing Garmins Fenix 6S Pro is like borrowing a real outdoors persons brain  
1841,Wired,2019-09-25 15:18:19,RT  Today is Amazons big hardware event in Seattle Last year the company revealed a voicecontrolled microwave along with d
1842,Wired,2019-09-25 14:19:05,Xinjiang is in information lockdown Thanks to a defacto ban on contact with foreign numbers Uyghurs are afraid t 
1843,Wired,2019-09-25 13:18:30,The ocean has warmed unabated since 1970 In the next 30 years many lowlying megacities and islands could start s 
1844,Wired,2019-09-25 12:25:18,The drone was in the right place ready to do the right thingbut not quite at the right time  
1845,Wired,2019-09-25 11:22:38,A meteor is coming The world as we know it is ending And how you spend your last hours will determine who you can 
1846,Wired,2019-09-25 10:22:33,A few years ago Apple and Google starting assigning phones an ad ID for digital trackers Heres how to reset yo 
1847,Wired,2019-09-25 09:21:05,About 80 Google contractors in Pittsburgh voted to unionize with United Steelworkers on Tuesday one of the first g 
1848,Wired,2019-09-25 08:27:04,Opinion The Ukraine scandal as it unfurls brings together two central and ongoing problems of the Trump adminis 
1849,Wired,2019-09-25 08:07:42,Hollywoods hottest new talent has superhuman strength doesnt take breaks or require hair and makeup services He 
1850,Wired,2019-09-25 07:05:26,This is our clearest view yet of Apples AR ambitions 
1851,Wired,2019-09-25 05:00:53,The is it blue and black or white and gold Dress from 2015 didnt just break the internet it broke color science 
1852,Wired,2019-09-25 03:59:06,Add Hyundai to the list of car companies developing a robotaxi Its spending 2 billion and partnering with an in 
1853,Wired,2019-09-25 03:45:00,The world record for an NFL field goal is 64 yards Is a 90yard kick possible We took a look at the physics 
1854,Wired,2019-09-25 03:10:00,Our WIRED 25 summit is back Join us in San Francisco for four days of stage chats and workshops with luminaries an 
1855,Wired,2019-09-25 02:57:16,With the latest iOS 13 update you can share one audio stream between two pairs of headphones Thats right no mor 
1856,Wired,2019-09-25 01:52:17,Google made computer science history last week Its quantum computer performed a task in 200 seconds that would hav 
1857,Wired,2019-09-25 00:49:07,Star gazing gets darkBy  with   
1858,Wired,2019-09-25 00:40:00,Spot Boston Dynamics scarycute fourlegged robot will no longer be confined to testing grounds and viral YouTu 
1859,Wired,2019-09-25 00:19:07,RT   Way to go Googlers 
1860,Wired,2019-09-24 23:38:16,Karen is the internets stock female antagonist a righteously annoyed middleaged white woman who loves coupons 
1861,Wired,2019-09-24 23:04:18,Youre now able to buy an iPhone 11 But is it right for you This is our complete buying guide with our pick for t 
1862,Wired,2019-09-24 21:59:20,I dont want you to be hopeful I want you to panic I want you to feel the fear I feel every day And then I want 
1863,Wired,2019-09-24 21:01:37,LIVE House Speaker Nancy Pelosi is expected to announce the beginning of a formal impeachment inquiry on President 
1864,Wired,2019-09-24 20:52:02,You can now lease Boston Dynamics infamous robot dog Apple might be giving away its own AR secrets and weve got 
1865,Wired,2019-09-24 20:29:57,About 80 Google contractors in Pittsburgh voted to unionize today in a historic move as one of the first groups of 
1866,Wired,2019-09-24 20:02:33,If youre in the market for a Kindle now is a good time to buy 
1867,Wired,2019-09-24 19:56:23, Our October issue is out now A brutal murder with a wearable witness the next Hollywood star who lives in a h 
1868,Wired,2019-09-24 19:00:11,If youre a driver for hire stock these essentials to keep everyone in the car safe and happyincluding yourself  
1869,Wired,2019-09-24 18:16:04,Theres nothing like a bare minimum of knowledge to make a person ultimately incurious about the true state of thin 
1870,Wired,2019-09-24 18:15:09,A slew of features and language recently discovered inside iOS 13 and 131 appear to confirm the very thing Apple e 
1871,Wired,2019-09-24 17:27:30,The latest semiautonomous driving technology is making vehicles safer and comfier for the rest of us 
1872,Wired,2019-09-24 16:58:13,RT  Amazing First 1 happens then 2 
1873,Wired,2019-09-24 16:49:18,RT  Samsung handed out new Galaxy Fold units to writers amp editors yesterday myself included The new premiere unboxing exp
1874,Wired,2019-09-24 16:24:59,Over the last few years Russian hackers have meddled in elections blacked out power grids hacked the Olympics a 
1875,Wired,2019-09-24 15:57:28,Wise leaders always put the good of their own people and their own country first The future does not belong to gl 
1876,Wired,2019-09-24 15:22:59,Opinion Trump appears to prioritize his own political future over both the Wests traditional hopes for Ukraine t 
1877,Wired,2019-09-24 14:30:05,Its the end of the world as we know it so why not be on Tinder trying to find your match At least thats what th 
1878,Wired,2019-09-24 14:14:11,RT  Researchers at Check Point and Intezer made this pretty graph of all the code shared between Russian state hacker groups
1879,Wired,2019-09-24 14:02:12,First Atlas the robot backflipped Then it could do parkour Now this  machine can do a gymnastic 
1880,Wired,2019-09-24 14:01:09,For years Boston Dynamics has been posting videos teasing its scarycute robot Spot Now its unleashing Spot into 
1881,Wired,2019-09-24 12:58:49,Hollywoods hottest new talent doesnt take breaks He doesnt need a trailer Hes called Junior or sometimes t 
1882,Wired,2019-09-24 12:19:05,These appcontrolled headphones pipe a live feed of personalized concert audio directly from the stage into your ea 
1883,Wired,2019-09-24 11:30:05,Here come the anonymous rumormongers 
1884,Wired,2019-09-24 11:09:06,Whether youre backcountry skiing or counting your dance steps at a wedding we have an activity tracker for you H 
1885,Wired,2019-09-24 11:06:06,We rarely give thought to the creatures that skitter about our apartment blocks and strip malls But we should marv 
1886,Wired,2019-09-24 10:05:31,The launch of the iPhone 11 Pro and its siblings reaffirms that Apples real advantage over its competitors comes f 
1887,Wired,2019-09-24 09:02:49,Last April Elon Musk promised that Tesla would soon be able to power its electric cars for more than 1 million mil 
1888,Wired,2019-09-24 08:00:16,This global switch is unprecedented 
1889,Wired,2019-09-24 06:57:56,Elon Musk promised Tesla would soon have a millionmile battery more than double what drivers can expect today A 
1890,Wired,2019-09-24 05:56:12,After reports emerged in July that a contractor was leaking Google Assistant audio snippets Google announced today 
1891,Wired,2019-09-24 04:53:36,Upgrading to Apples new iOS13 Heres what you should know 
1892,Wired,2019-09-24 03:51:07,Its the first day of fall Embrace the season ditch those beach reads and get a bit more serious Here are the to 
1893,Wired,2019-09-24 03:30:00, took our WIRED Autocomplete Interview and answered the internets most searched questions about himself 
1894,Wired,2019-09-24 03:20:03,An excerpt from Edward Snowdens new book Democracy could never be imposed at the point of a gun but perhaps it 
1896,Wired,2019-09-24 02:23:04,With the final Star Wars movie just a few months away spoilers for The Rise of Skywalker are starting to get s 
1897,Wired,2019-09-24 01:17:21,Add WeWorks WiFi securityor lack thereofto its list of troubles  
1898,Wired,2019-09-24 00:31:50,RT  We rarely give thought to the creatures that skitter about our apartment blocks and strip malls But we should marvel at
1899,Wired,2019-09-24 00:14:02,Rufus begs to differBy  with    
1900,Wired,2019-09-23 23:50:46,Feel uneasy about allowing Facebook access to your contacts Buckle up it just bought a company that will literall 
1901,Wired,2019-09-23 23:42:59,RT  Facebook buys CTRLlabs to let you control devices with your brain Just sayin 
1902,Wired,2019-09-23 22:57:49,At the United Nations summit on Monday the UN Secretary General called for all countries to commit to carbon neutr 
1903,Wired,2019-09-23 22:45:54,Since 2016 global carbon emissions have continued to grow Last year the US which is the second largest contribu 
1904,Wired,2019-09-23 22:39:02,A lofty Elon Musk promise may soon be realized teen activist Greta Thunberg blistered members of the UN and scien 
1905,Wired,2019-09-23 22:18:04, Check out WIREDs Most Interesting Things in Tech on your Google Home or Alexa speaker Todays edition is presen 
1906,Wired,2019-09-23 21:56:05,RT  Space toilets are far smaller than the toilets on Earth so before they head to zero gravity astronauts had to practice g
1907,Wired,2019-09-23 20:30:31,Over the last 30 years global demand for food has grown By 2050 there will be 97 billion people If trends cont 
1908,Wired,2019-09-23 20:24:58,Climate change has thrown our planet into chaos As oceans and forests transform and ecosystems go into shock a mi 
1909,Wired,2019-09-23 20:22:18,We now use nearly threequarters of the worlds icefree surface and waste a quarter of the food we produce all wh 
1910,Wired,2019-09-23 20:21:02,After a former employee deleted open source projects in protest Seattle software company Chef now says it will not 
1911,Wired,2019-09-23 20:20:23,Additionally humans need to fundamentally transform our relationship with the land to stand any hope of fighting c 
1912,Wired,2019-09-23 20:18:04,Cutting emissions alone is not enough to stave off disasterwe as a species have to suck CO2 out of the atmosphere 
1913,Wired,2019-09-23 20:11:11,Our world is busted Absent any change in our behavior the average global temperature will rise as much as 4 degre 
1914,Wired,2019-09-23 19:21:41,Emmys winners Fleabag Phoebe WallerBridge Billy Porter Jodie Comer and for a final time Game of ThronesEm 
1915,Wired,2019-09-23 18:17:47,The longlost internet of the 90s Edward Snowden writes offered its inhabitants a reset button for your life t 
1916,Wired,2019-09-23 17:15:18,Shipping accounts for 4 percent of global oil demand most of it for a particularly dirty fuel New regulations are 
1917,Wired,2019-09-23 16:28:38,Heres some background on the science behind climate change UNGA 
1918,Wired,2019-09-23 16:10:34,Peex appcontrolled headphones are nothing short of a reinvention of the arena concert experience 
1919,Wired,2019-09-23 16:07:36,People are suffering people are dying entire ecosystems are collapsing We are in the beginning of a mass extinc 
1920,Wired,2019-09-23 15:11:33,RT  Happy Monday Todays  cartoon is by  with   
1921,Wired,2019-09-23 15:08:33,Quantum mechanics has inserted a tiny alien world into ours By doing these experiments physicists hope to find th 
1922,Wired,2019-09-23 14:55:08,How does the gooses body cope in altitudes of of 26000 feet Lets break it down  
1923,Wired,2019-09-23 13:56:14,RT  google is also very sorry about the whole turns out smart assistants get a boost from sketchy human contractors who might
1924,Wired,2019-09-23 13:53:33,Last April Elon Musk promised that Tesla would soon be able to power its electric cars for more than 1 million mil 
1925,Wired,2019-09-23 12:53:05,Urban evolution researchers are working to make the reality of a ravaged environment a little less grimstarting wi 
1926,Wired,2019-09-23 11:57:02,This guidance computer was supposed to help Apollo11 astronauts Neil Armstrong and Buzz Aldrin land on the moon I 
1927,Wired,2019-09-23 09:55:42,Microplastic is poisoning Californias Monterey Bay 
1928,Wired,2019-09-23 07:55:36,Work on reducing deaths in car crashes doesnt demand banning all cars requiring seat belts made a huge difference 
1929,Wired,2019-09-23 05:54:32,Introducing Cygnus OB2 an association of astral objects that contains stars much larger than our Sun In burning b 
1930,Wired,2019-09-23 04:30:00,How did Avengers Endgame look so cool Jen Underdahl Visual Effects Producer for Marvel Entertainment gave us 
1931,Wired,2019-09-23 03:53:53,Who had one of these In 1977 the first Atari Video Computer System sold for 200 In 1982 Atari relaunched the 
1932,Wired,2019-09-23 01:53:23,Thanks to new rules structural engineers architects and developers in the historic heart of London have to consi 
1933,Wired,2019-09-22 23:52:46,Freedom in this telling is about exclusion The freedom to drive others away And until recently freedom from 
1934,Wired,2019-09-22 22:49:22,Whew A lot happened in car news this week Strap in  
1935,Wired,2019-09-22 21:45:42,Researchers say they may have found an algorithm that can predict the start of a slow slip earthquake to within a 
1936,Wired,2019-09-22 20:43:11,Step aside Polaroid 
1937,Wired,2019-09-22 19:39:34,Get your droolworthy architecture fix with this photos series 
1938,Wired,2019-09-22 18:34:40,Have you ever heard the urban legend about the Inuit man who fashioned a knife out of his own frozen poop and vanis 
1939,Wired,2019-09-22 17:30:15,Want to become a better chef Kitchen tech probably isnt the answer As our writer says Despite the influx of te 
1940,Wired,2019-09-22 17:23:00,Tech talks thought leaders robots science screenings networking tastings a family day These are just SOME o 
1941,Wired,2019-09-22 16:26:43,Democracy could never be imposed at the point of a gun but perhaps it could be sown by the spread of silicon and 
1942,Wired,2019-09-22 16:09:32,Upgrading to Apples new iOS13 Heres what you should know 
1943,Wired,2019-09-22 15:37:37,RT  Connected cookbooks Alexaenabled microwaves None of this stuff will make you a better home cook 
1944,Wired,2019-09-22 15:00:01,Plastic is infiltrating every crevice of our planet Its in the ocean the mountains our beer and yes even our 
1945,Wired,2019-09-22 14:42:44,The electric car may be great for the planet and glorious for drivers but its no good for jobs 
1946,Wired,2019-09-22 13:11:31,As a fitness tracker its fantastic Just dont try to make it into a smart watch 
1947,Wired,2019-09-22 12:09:06,If youre at all concerned about the privacy of your data you dont want to leave the default settings in place on 
1948,Wired,2019-09-22 11:06:53,Harry Potterloving TVdebating fanficwriting enthusiasts have emerged from the underground to dominateand shap 
1949,Wired,2019-09-22 09:27:26,In Netflixs new threepart documentary Inside Bills Brain Bill Gates examines his own life with a candor that 
1950,Wired,2019-09-22 07:42:28,Could HBOs Watchmen be the superhero show we need right now This fall has some unique treats in television Here 
1951,Wired,2019-09-22 06:31:00,After six years in exile Edward Snowden has a new memoir In the book and in an interview with WIRED the worlds 
1952,Wired,2019-09-22 05:51:50,Dont want to be tracked Bad news 2000 streaming apps are tracking information about your deviceseven when you 
1953,Wired,2019-09-22 04:46:33,When the Air Force showed up at the Defcon hacker conference in Las Vegas last month it didnt come emptyhanded 
1954,Wired,2019-09-22 03:12:58,Time to shelve the beach reads and get a bit more serious Here are the tomes were most looking forward to reading 
1955,Wired,2019-09-22 02:10:15,Our most important data can easily be lost when you forget your phone on the train or have an unfortunate spat with 
1956,Wired,2019-09-22 01:07:04,On September 8 2018 Karen Navarras heart rate apparently spiked and then plummeted By 328 pm she wasnt regis 
1957,Wired,2019-09-22 00:10:00,Our WIRED 25 summit is back Join us in San Francisco for four days of stage chats and workshops with luminaries an 
1958,Wired,2019-09-22 00:06:03,Capitalism has steamrolled this planet and its organisms gouging out mountains overexploiting fish stocks and bu 
1959,Wired,2019-09-22 00:00:17,Check out these rings   
1960,Wired,2019-09-21 22:49:07,The Dark Crystal prequel is like Game of Thrones meets puppets We discuss the show its design and  how it f 
1961,Wired,2019-09-21 21:59:35,Wearing Garmins Fenix 6S Pro is like borrowing a real outdoors persons brain  
1962,Wired,2019-09-21 20:56:06,What is a videogame worth The introduction of walled ecosystems like Apple Arcade makes that calculus a lot harder 
1963,Wired,2019-09-21 20:22:01,A new startup called Nebula is using robust digital privacy protocolsencrypted email VPNs blockchain techto gua 
1964,Wired,2019-09-21 20:08:04,The legendary Viking warriors known as berserkers were renowned for their ferocity in battle purportedly fighting 
1965,Wired,2019-09-21 19:07:53,If youve made transactions to Click2Gov systems you should check your paymentcard statements  via  
1966,Wired,2019-09-21 18:29:38,RT  The cool  doc on  vindicated my theory that the Malcom  outlier theory is bullshit 
1967,Wired,2019-09-21 18:06:22,If youre in the market for a Kindle now is a good time to buy 
1968,Wired,2019-09-21 17:02:28,Opinion Extremerisk legislation alone will not end the countrys gun violence but research shows these laws not 
1969,Wired,2019-09-21 16:10:00,Researchers combed through everything from traffic patterns to utilities data to quantify the emissions from every 
1970,Wired,2019-09-21 15:59:48,Add WeWorks WiFi securityor lack thereofto its list of troubles  
1971,Wired,2019-09-21 14:58:59,A few years ago Apple and Google starting assigning phones an ad ID for digital trackers Heres how to reset yo 
1972,Wired,2019-09-21 14:36:04,RT  In Netflixs new threepart documentary Inside Bills Brain Bill Gates examines his own life with a candor that lets h
1973,Wired,2019-09-21 13:55:17,Amazons 100000 vehicle deal suggests that fleetsdelivery fleets truck fleets taxi fleets ridehail fleetsmay 
1974,Wired,2019-09-21 13:34:46,Come for the aliens Stay for the selfies 
1975,Wired,2019-09-21 13:00:01,Think you want to upgrade to Apples 699 iPhone 11 or the 999 iPhone 11 Pro  reviewed the new phones 
1976,Wired,2019-09-21 12:34:44,Do you have a favorite iPhone These are ours 
1977,Wired,2019-09-21 11:30:58,Buying an iPhone 11 11 Pro or 11 Pro Max Heres how to choose between themand find the best deal 
1978,Wired,2019-09-21 10:22:54,The average Utahan consumes a staggering 248 gallons of water a day nearly triple the American average People wa 
1979,Wired,2019-09-21 08:55:03,Ecigarettes are now associated with a national outbreak of mystery respiratory illnesses six deaths and a fraudu 
1980,Wired,2019-09-21 06:54:36,Richard Stallman leaving MIT is like the big dome on Massachusetts Avenue itself getting an eviction notice But 
1981,Wired,2019-09-21 06:00:00,You up You probably shouldnt beSleep unfortunately is not an optional lifestyle luxury Sleep is a nonnegot 
