,User,Date,Tweets
625,Wired,2019-10-30 23:53:33,This is NASAs Saturn V rocketbut with a small modification Instead of shooting out rocket propellant this one s 
626,Wired,2019-10-30 23:48:17,RT  Today Twitter announced a new policy to ban political advertisements on the platform Great Except its not quite so s
627,Wired,2019-10-30 23:25:27,If Facebook has made the issue of political ads seem unavoidably thorny Twitters decision to ban them all seems s 
628,Wired,2019-10-30 23:12:54,RT  Maybe youve seen that really cool animation of a Saturn V shooting elephants out of the engines   Would that actually work
629,Wired,2019-10-30 23:12:33,Drivers Get ready for Fords with huge screens and overair updatesHackers Prepare for a landmark lawsuit He 
630,Wired,2019-10-30 23:12:26,RT  An update to Mondays report Apple has confirmed that the new AirPods Pro are no more repairable than previous versions o
631,Wired,2019-10-30 22:30:11,Your Android or iPhone camera is already outstanding But if you want professionalgrade photo and video use these 
632,Wired,2019-10-30 21:25:52,Drug discovery gets delayed because information is locked up in unread literature New treatments dont get applied 
633,Wired,2019-10-30 20:22:48,Driving to the zoo looking for parking and smearing sunscreen on squirmy toddlers is tough enough without struggl 
635,Wired,2019-10-30 19:22:03,As Mark Zuckerberg testified about all things Facebook before the House last week over on the Senate side some law 
636,Wired,2019-10-30 19:20:05,Exclusive offer Plus youll get a free WIRED webcam cover  
637,Wired,2019-10-30 19:12:46,  Welcome to the team
638,Wired,2019-10-30 18:57:39,Witchcraft and witch hunts are all about power Right now lots of people feel like they dont have any 
639,Wired,2019-10-30 17:18:02,WhatsApp just took a hard new line against the malware industry 
640,Wired,2019-10-30 16:15:56,The Rise of Jordan Peterson thoughtfully explores the ways in which the professor and author has been both celebr 
641,Wired,2019-10-30 15:12:32,The automaker that put Sync onto 30 million cars in 10 years is introducing 12 and 15 inch screens to its latest 
642,Wired,2019-10-30 14:07:02,In order to investigate how a horse could suddenly crumble to the ground you need to understand the ground itself 
643,Wired,2019-10-30 13:18:55,This is the multitool of rain jackets 
644,Wired,2019-10-30 12:16:09,The iPhone remains one of the most secure consumer devices you can buy thanks in large part to the lockeddown eco 
645,Wired,2019-10-30 11:13:10,Climate change might actually make the Santa Ana winds later and milder in Southern California but the dry grass a 
646,Wired,2019-10-30 10:09:49,Long ago men in gray flannel suits all got on the same train at the same time carrying identical briefcases and u 
647,Wired,2019-10-30 09:07:59,If Teslas new Solar Glass Roof grows like kelp on steroids as Elon Musk says it will it could revive Teslas s 
648,Wired,2019-10-30 08:05:57,Lo That was the first message to cross the internet in 1969 sent from a router at UCLA to one at Menlo Park 
649,Wired,2019-10-30 07:04:18,Lets be honest this is better for everyone 
650,Wired,2019-10-30 06:01:52,A year ago Google introduced one of those timesaving tricks that makes the cold relentless march of time just a 
651,Wired,2019-10-30 04:59:03,If you had a daemon what would it be 
652,Wired,2019-10-30 04:06:36,Dont be basic Get your jackolantern straight with these Halloweenready tools and kits 
653,Wired,2019-10-30 03:04:05,Research has shown that exposure to wildfire smoke may alter the immune system for yearsand children are especiall 
654,Wired,2019-10-30 02:16:05,Humans take note Even in dense crowded conditions ant colonies still manage to maintain a smooth and efficient t 
655,Wired,2019-10-30 02:15:05,WhatsApp just took a hard new line against the malware industry suing notorious Israeli surveillance contractor NS 
656,Wired,2019-10-30 02:00:07,Surviving a house fire for the clout By Farley Katz with  
657,Wired,2019-10-30 01:58:10,RT  How can the tech industry fix the mess of the past few years For starters by having software engineers learn from the rel
658,Wired,2019-10-30 01:39:45,Huawei has repeatedly denied that it would help the Chinese government spy on its customers but the US government 
659,Wired,2019-10-30 00:44:03,Democracy is a kumbayahumming potluck where the whole class is invited Democratization meanwhile caters to inf 
660,Wired,2019-10-30 00:32:30,Imagine a Sunny Delight factory explosion in the gloomy realm of Mordor spilling streams of orange drink Thats 
661,Wired,2019-10-29 23:31:18,Russian hackers havent forgotten or forgiven Russias ban from the 2018 Olympics for doping Theyre going after a 
662,Wired,2019-10-29 22:30:07,Across the 11 songs and 27 minutes of Jesus is King Kanye West attempts to repurpose his lifes work into religi 
663,Wired,2019-10-29 22:00:10,Welcome to year 50 of the information age when nearly every human lives willingly or not in both a physical spac 
664,Wired,2019-10-29 22:00:10,New research says that climate change might actually reduce the frequency of southern Californias Santa Ana winds 
665,Wired,2019-10-29 21:10:54,How the hell is your cat supposed to know that youre yelling at him because you want him to stop scratching the c 
666,Wired,2019-10-29 20:30:10,RT  Like any good scary story Hellvetica takes something familiar and innocuous and turns it into something to fear New
667,Wired,2019-10-29 20:29:58,RT  Hat tip to  and  for nudging me to write a bit about the 25th anniversary of the time I wrote about the 2
668,Wired,2019-10-29 20:08:01,His Dark Materials promises not just the intellectual chewiness of Philip Pullmans books but also the character 
669,Wired,2019-10-29 19:46:41,Get ready to send all of your designs straight to Hades Hellvetica is the worlds most ubiquitous font turned evil 
670,Wired,2019-10-29 19:25:00,Scientists are raising bees for interplanetary life and there are new Google shortcuts you should learn Heres 
671,Wired,2019-10-29 18:38:05,Game of Thrones creators David Benioff and DB Weiss are no longer helming the next Star Wars trilogy It migh 
672,Wired,2019-10-29 18:30:08,These bees have their work cut out for them  
673,Wired,2019-10-29 18:12:06,Keep your conversations private Heres how to opt out of human transcription of your voice snippets on Siri Alexa 
674,Wired,2019-10-29 17:33:26,Googles latest Nest Mini comes with improved sound and onboard machine learning for 49 
675,Wired,2019-10-29 16:31:24,Opinion Had Facebook shut up in 2017 the overall story would have been one of modesty and competence Instead th 
676,Wired,2019-10-29 15:30:11,Dodgy energy deals loose regulation and dubious characterswith links to the Hillary Clinton email hackersare fu 
677,Wired,2019-10-29 14:40:31,Happy NationalCatDay Good news your cat probably does actually love you 
678,Wired,2019-10-29 14:32:00,Over a dozen fires are turning California into a surreal kind of underworld threatening hundreds of thousands of l 
679,Wired,2019-10-29 14:31:19,The Surveillance Detection Scout can track license plates and faces near your Teslawith all the privacy concerns t 
680,Wired,2019-10-29 13:58:25,RT  Elizabeth Warren wants to stop big corporations from hiring government officials for at least four years after they leave of
681,Wired,2019-10-29 13:58:01,RT    new Spotify playlist  new Open Table reservation
682,Wired,2019-10-29 13:29:01,As promised Google has started the process of opening up its newpowered shortcuts to the broader web  Want to s 
683,Wired,2019-10-29 13:08:26,Elizabeth Warren has already taken Facebook to task for being too big and for not fact checking political ads Now 
684,Wired,2019-10-29 13:00:24,If you live in an area with a lot of pollution or wildfires hi California an air purifier might be just what yo 
685,Wired,2019-10-29 12:00:17,Get your late night burrito delivered in style 
686,Wired,2019-10-29 10:04:56,The Air Forces secretive X37B space plane just autonomously returned from orbit after a recordbreaking mission 
687,Wired,2019-10-29 09:03:02,Russias statesponsored hackers have a few predictable fixations NATOcountry embassies Hillary Clinton Ukraine 
688,Wired,2019-10-29 08:01:08,While dog owners have scads of options for testing their pups DNA cat owners have largely been left out in the co 
689,Wired,2019-10-29 06:48:14,From rogue USB sticks to Chrome extensions gone wild to bogus online quizzes heres a quick guide to some basic ri 
690,Wired,2019-10-29 05:37:22,Apples AirPods Pro are here 
691,Wired,2019-10-29 04:35:48,Nix the 1000th viewing of John Carpenters Halloween Dim the lights and let these 12 foreign horror movies scar 
692,Wired,2019-10-29 03:32:43,Its the 1990s at least when it comes to the fact that fanny packs are back in fashion These are our favorites Y 
693,Wired,2019-10-29 03:14:00,This artist makes mirrors that mimic your movements and form 
694,Wired,2019-10-29 02:30:04,Catch up on todays news in two minutes or less 
695,Wired,2019-10-29 01:39:04,No one was harmed in the making of this podcast By  with   
696,Wired,2019-10-29 00:29:44,Come next summer your food could be delivered to you by this little guy a drone with an 18mile range than can ca 
697,Wired,2019-10-29 00:10:44,History will remember the burning of California as a generationdefining crisis nestled within the speciesdefinin 
698,Wired,2019-10-29 00:02:17,RT   is the Lorax he speaks for the treesHe speaks for the trees for the trees have no tonguesAnd hes telling yo
699,Wired,2019-10-28 23:53:29,In six words imagine a rosy future for facial recognition WIREDBackpage 
700,Wired,2019-10-28 23:40:45,There are a lot of good gaming headsets to choose from right now but these are the ones actually worth buying  
701,Wired,2019-10-28 22:39:27,Massive wildfires in Northern and Southern California are ravaging the state    again Welcome to the Pyrocenet 
702,Wired,2019-10-28 21:46:29,Mass is one of the most basic and important characteristics of fundamental particles The neutrino is the only know 
703,Wired,2019-10-28 20:41:06,The Pentagon may be fortified against foreign cyberintrusion but local school districts now face sophisticated att 
704,Wired,2019-10-28 20:35:29,Say hello to Apples new AirPods Pro Teslas new solar roof and a secret Air Force spacecraft Heres the news 
705,Wired,2019-10-28 20:29:58,Its not too late to take your jackolantern game to the next level  
706,Wired,2019-10-28 19:29:05,Mix things up this year and see what horror looks like around the world 
707,Wired,2019-10-28 18:56:03,Apples new AirPods Pro are here  and theyre 250 Want a pair  
708,Wired,2019-10-28 18:14:16,Oh hello new AirPods 
709,Wired,2019-10-28 17:21:17,If you find yourself stargazing next spring and cant shake the feeling that something is watching you it might no 
710,Wired,2019-10-28 17:14:46,Earth to Ned will feature a popcultureobsessed alien who interviews celebrity guests 
711,Wired,2019-10-28 16:14:29,Who doesnt love a good fanny pack 
712,Wired,2019-10-28 15:33:04,RT  I wrote about TikToks precarious position as the first foreign social media platform to gain a massive following in the US
713,Wired,2019-10-28 15:13:39,Video posted on social media show one Tesla that cant tell the difference between grass and asphalt another that 
714,Wired,2019-10-28 14:15:00,Tech talks thought leaders robots science experiments film screenings networking tastings These are just SOM 
715,Wired,2019-10-28 13:19:09,Blockchain fatigue is realwith regulatory and technical headaches startups that invested in the technology are t 
716,Wired,2019-10-28 11:29:30,Is your kid is too young for a smartphone but old enough that they can wander off on their own These gadgets might 
717,Wired,2019-10-28 09:28:26,Check out Bollingers electric pickup and SUV They have massive offroad tires that offer 10 inches of wheel trave 
718,Wired,2019-10-28 07:28:24,More mush less spamA cartoon by J C Duffy with   
719,Wired,2019-10-28 05:27:33,Opinion from Matt Stoller  On the verge of the 2020s were reverting to the 1920s The rule of 
720,Wired,2019-10-28 04:25:38,Your Bloomin Onion now comes with a side of Big Brother
721,Wired,2019-10-28 02:53:52,Be wary of trying to save a few bucks on a new iPhone case  we spent a month testing out 30 different cases These 
722,Wired,2019-10-28 02:09:00,This DIY implant lets you stream movies from inside your leg Learn more  
723,Wired,2019-10-28 00:52:11,Hate to break it to you but the multiplication method you learned in school isnt the best way to do it 
724,Wired,2019-10-27 23:16:12,The truth hurts 
725,Wired,2019-10-27 22:12:35,Opinion Knowing that tens of millions of examples of the most heartbreaking imagery pass through its services eve 
726,Wired,2019-10-27 20:50:11,It wasnt until her early forties that photographer Elinor Carucci started to look and feel different There were g 
727,Wired,2019-10-27 19:45:20,As we watch tsunamis of disinfo rage through social networks were now suspecting it wasnt so great for cocky yo 
728,Wired,2019-10-27 19:10:00,We combed the web for data about Daisy Ridley and presented all the information to her  
729,Wired,2019-10-27 18:42:09,Adding a new flag to the emoji keyboard now means getting tech companies supportand that could be an issue if Chi 
730,Wired,2019-10-27 17:37:46,If a Ring camera captures someone elses property or an innocent person walking by whose right is it to turn that 
731,Wired,2019-10-27 16:34:41,More than half a million Chinese kids take virtual English classes on VIPKid What can the platform do to keep them 
732,Wired,2019-10-27 15:30:50,In doubleblind lab tests two dogs were able to pick out the scent of children infected with malaria parasites wit 
733,Wired,2019-10-27 15:16:00,Cat loves us Right Right Those cute bundles of fluff may be generally considered to be less loyal and social th 
734,Wired,2019-10-27 14:27:17,Scientists are already studying how space conditions might affect babymakin 
735,Wired,2019-10-27 14:01:17,You dont have to be a genius to understand how dimensions work This physicist explains them at five levels of com 
736,Wired,2019-10-27 12:57:37,For more than 100 years medical researchers puzzled over why the immune system doesnt fight cancer the way it fig 
737,Wired,2019-10-27 11:54:19,New Zealands probably best known for its breathtaking verdant terrain But nothing on the ground surpasses whats 
738,Wired,2019-10-27 10:51:40,Make this the year you finally carve a pumpkin youre proud of These carving kits and tools will up the game of an 
739,Wired,2019-10-27 09:49:20,A new report is challenging the popular school of thought that YouTubes recommendation algorithm is the central fa 
740,Wired,2019-10-27 08:46:52,Your cat is not as indifferent about you as it may seem They want to bond and the best way to do so is with petti 
741,Wired,2019-10-27 07:44:58,In 1988 the Soviet Unions first space shuttle  the Buran  blasted off from presentday Kazakhstan It never wen 
742,Wired,2019-10-27 06:42:01,This is one of the more unique photos taken on the surface of the moon The crew of Apollo 15 spotted this relativ 
743,Wired,2019-10-27 05:39:47,Microsofts Surface Laptop 3 is wellmade but its almost as if Microsoft zapped its old 13inch Surface Laptop wi 
744,Wired,2019-10-27 04:38:02,In 2015 Patricia Marcoccia and Maziar Ghaderi started filming a documentary about a Canadian psychology professor 
745,Wired,2019-10-27 04:03:05,Leaves arent the only thing dropping as we get deeper into fall Prices on everything from warm pullovers to LED m 
746,Wired,2019-10-27 04:00:06,Finding a quality pair of headphones under 100 can be like looking for a needle in a haystack Lucky for you we s 
747,Wired,2019-10-27 03:59:07,You probably have a lot of questions about your cat While this athome DNA test cant answer all of them its the 
748,Wired,2019-10-27 03:59:05,Amazon is an ecommerce site a fashion designer advertising business cloud computing provider tv and movie produ 
749,Wired,2019-10-27 03:59:05,Rudy Giuliani may be as divisive a character as exists in American politics today but in the annals of buttdialin 
750,Wired,2019-10-27 03:56:01,From Silicon Valleys perspective Pete Buttigieg is the dream candidate a change agent who doesnt want to cha 
751,Wired,2019-10-27 03:37:04,If you watched carefully earlier this month you could almost see Mike Pompeos political life flash before his eye 
752,Wired,2019-10-27 03:06:48,Sure you see plenty of pics of the moon but how many do you see on it These images of its surface were taken 
753,Wired,2019-10-27 02:02:05,Maggie Guterl is the first woman to win the Bigs Backyard Ultra Theres no set distance or set total time just e 
754,Wired,2019-10-27 01:41:44,When it comes to human sexual anatomy theres a shocking amount people dont know 
755,Wired,2019-10-27 01:15:00,Tech talks thought leaders robots science experiments film screenings networking tastings These are just SOM 
756,Wired,2019-10-27 00:37:52,When Chris Coyne and Max Krohn who previously cofounded OKCupid launched their own digital identity and encrypted 
757,Wired,2019-10-26 23:34:38,The Masterbuilt Propane Smoker might just change the way you think about smoking  
758,Wired,2019-10-26 22:31:24,Dont trust the tech giants to safeguard all your information We dont blame you If you want to get scrappy with y 
759,Wired,2019-10-26 21:28:19,The Ocean Cleanup has unveiled its latest plasticcollecting machine Called The Interceptor its a solarpowered 
760,Wired,2019-10-26 20:44:54,If Teslas new Solar Glass Roof grows like kelp on steroids as Elon Musk says it will it could revive Teslas s 
761,Wired,2019-10-26 20:21:00,The ocean has warmed unabated since 1970 absorbing more than 90 percent of the excess heat in the climate system 
762,Wired,2019-10-26 19:40:01,Every frequent flier has a trick to outrace jet lag but this app might be the best of them all 
763,Wired,2019-10-26 18:36:49,Its nice to meet someone with the same interests A cartoon by Lars Kenseth with  ttpstriba 
764,Wired,2019-10-26 17:34:51,This should be a nobrainer Do NOT storm into SCIF Sensitive Compartmented Information Facility Especially wi 
765,Wired,2019-10-26 16:34:03,Whats your tipping habit Researchers found that Uber drivers were tipped in just 16 percent of rides and just 1 
766,Wired,2019-10-26 15:45:54,Like much of the internet online reviews are often fake And FTC commissioners themselves say this practice could 
767,Wired,2019-10-26 15:17:00,Meet The Blob With nearly 720 sexes this slime mold has the ability to heal itself in two minutes if cut in half 
768,Wired,2019-10-26 14:42:04,The new Star Wars The Rise of the Skywalker trailer is here and this thing looks incredible Will you go see th 
769,Wired,2019-10-26 13:51:00,Northern California has plunged back into wildfire hell This is a clip of the KincadeFire Sparked on Wednesday n 
770,Wired,2019-10-26 13:39:28,Seriously Just get a password manager 
771,Wired,2019-10-26 12:35:03,Climate change Flawed algorithms Deadly diseases Tech monopolies We face challenges that need to be tackled now 
772,Wired,2019-10-26 11:32:46,TikTok has been downloaded more than 110 million times in the United States since 2017 Now lawmakers are questioni 
773,Wired,2019-10-26 10:30:08,The new Pixel phones are among the best smartphones money can buy But theyre not number one Heres why 
774,Wired,2019-10-26 09:26:10,The iPhone remains one of the most secure consumer devices you can buy thanks in large part to the lockeddown eco 
775,Wired,2019-10-26 08:24:10,If everyone on earth planted a treeall 75 billion of ushow much carbon dioxide would it pull out of the air  
776,Wired,2019-10-26 07:21:12,The TeamTrees project aims to plant 20 million new trees by January 1 2020 Is this ambitious Yes Impossible N 
777,Wired,2019-10-26 06:18:37,Its time to dig out your old Game Boy cartridges from the attic Retro console maker Analogue is releasing a Game 
778,Wired,2019-10-26 05:15:36,Stan felt that the internet had not necessarily lived up to its promise author Kat Rosenfield said Instead of 
779,Wired,2019-10-26 04:30:00,Facebook CEO Mark Zuckerberg testified before Congress this week the companys cryptocurrency But in one exchange 
780,Wired,2019-10-26 04:13:02,After Senators Chuck Schumer and Tom Cotton asked US intelligence officials to investigate whether TikTok poses na 
781,Wired,2019-10-26 04:07:14,Forget everything you know about normal body temperature and fever starting with 986 Thats an antiquated number 
782,Wired,2019-10-26 03:42:00,Could you do this This is tricking The sports origins are in martial arts but it also incorporates elements of 
783,Wired,2019-10-26 03:04:10,The Air Force has finally stopped using 8Inch floppy disks for Missile Command 
784,Wired,2019-10-26 02:23:34,RT  Facebooks focus on encryption will make it harder to thwart child abusewrites a tech pioneer who built one of the key too
785,Wired,2019-10-26 02:00:16,Modernist mathematicsBy  with   
786,Wired,2019-10-26 01:18:48,RT  In a huge upset the Pentagon awarded the JEDI contract worth up to 10 bil to Microsoft Amazon had been considered the
787,Wired,2019-10-26 01:18:42,RT  Amazon statement Were surprised about this conclusion AWS is the clear leader in cloud computingWe remain deeply com
788,Wired,2019-10-26 00:47:46,The Department of Defense has awarded Microsoft the 10 billion Joint Enterprise Defense Infrastructure contract kn 
789,Wired,2019-10-26 00:29:56,Is Facebook a savior or killer of journalism Facebook is trying again with publishers by rolling out Facebook News 
790,Wired,2019-10-25 23:52:12,Make your family happy These multitalented routers ensure that your home WiFi isnt just stable and fast but also 
791,Wired,2019-10-25 22:49:02,Each month we publish a sixword storyand it could be written by you This months winner PHELPS CLONE SWEEPS ENT 
792,Wired,2019-10-25 22:29:40, Saturday
793,Wired,2019-10-25 22:04:03,Does an excessive or addictive relationship with gaming actually cause psychological problems or are people with e 
794,Wired,2019-10-25 21:34:01,Tricking incorporates elements of gymnastics breakdancing parkour and capoeira Its a sport where athletes move 
795,Wired,2019-10-25 21:28:45,A new study reveals your Uber tipping behavior and malware hits Apples App Store Heres the new to know today 
796,Wired,2019-10-25 21:15:00,Tech talks thought leaders robots science experiments film screenings networking tastings These are just SOM 
797,Wired,2019-10-25 20:49:02,Opinion We do not need to cripple our ability to remove some of the most harmful and heinous content in the name 
798,Wired,2019-10-25 20:40:06,Last week the internet got itself in a tizzy over a mysterious blob It has 720 sexes It has no brain but can 
799,Wired,2019-10-25 19:39:04,The Tibetan flag is a patchwork quilt of color and spirit For the Tibetan diaspora thousands of people flung arou 
800,Wired,2019-10-25 19:02:08,The best way to beat climate change in theory is simple Plant a trillion trees But in reality its not that si 
801,Wired,2019-10-25 18:23:54,RT  In the past 18 months AI researchers made a burst of progress on software named after Sesame Street characters that processe
802,Wired,2019-10-25 18:01:05,Twofactor authentication is a specific tool with a lot of important uses but its not a onesizefitsall solutio 
803,Wired,2019-10-25 17:57:03,Even Congress is unhappy with Blizzard after Blitzchungs punishment for supporting protestors in Hong Kong  
804,Wired,2019-10-25 17:25:10,A photographer takes a photo amidst a shower of embers as wind and flames rip through the area during the 
805,Wired,2019-10-25 17:19:08,The App Store is not perfect  
806,Wired,2019-10-25 16:51:27,On this weeks Gadget Lab podcast we discuss what YouTubers hope to get out of their unionization efforts and wha 
807,Wired,2019-10-25 15:48:17,Online fake reviews have reached epidemic proportions and these FTC commissioners know exactly who to blame their 
808,Wired,2019-10-25 14:47:07,Researchers found that Uber drivers were tipped in just 16 percent of rides and just 1 percent of riders tipped on 
809,Wired,2019-10-25 14:39:36,RT  YouTube creators are looking to collective action as part of an attempt to get YouTube to be more transparent about policy
810,Wired,2019-10-25 14:06:07,RT  online fake reviews have reached epidemic proportionsand its about to get even worse two FTC commissioners say and
811,Wired,2019-10-25 13:37:58,RT  twofactor auth is great and important but it doesnt always make sense to just slap it on 
812,Wired,2019-10-25 13:21:47,With Googles new software youre less likely to get frustrating responses to queries dependent on prepositions li 
813,Wired,2019-10-25 12:37:41,Tesla has constructed its Shanghai Gigafactorywhich it says will ultimately crank out 150000 cars a yearin 168 w 
814,Wired,2019-10-25 11:35:19,There arent many sports in which women can compete sidebyside with men and win podium spots But endurance event 
815,Wired,2019-10-25 10:32:30,A government report has found that vehiclerelated deaths fell 24 last year But pedestrian deaths are up 50 in 
816,Wired,2019-10-25 09:29:22,Turns out machines might not need noses to smell Researchers have trained a set of machinelearning algorithms to 
817,Wired,2019-10-25 08:27:06,Care for some of the sickest Americans is decided in part by algorithm New research shows that software guiding ca 
818,Wired,2019-10-25 07:25:08,The Jedi vs superhero clash for cash is officially on Who do you think wins Besides Disney 
819,Wired,2019-10-25 06:22:33,There are two ways to react to ones neighborhood becoming the backdrop of a meme capitalism or hollering get off 
820,Wired,2019-10-25 05:20:57,This folding phone costs 1980 Do you want one Our review of the Samsung Galaxy Fold  
821,Wired,2019-10-25 04:19:03,Eureka  A cartoon by Lars Kenseth with  
