,User,Date,Tweets
2555,Wired,2019-09-04 02:41:57,Ellen Pao writes Its so tempting to focus on forgiving the harasser accepting tepid excuses and apologies high 
2556,Wired,2019-09-04 01:42:27,RT  My dream for the next Dem debate  and  argue it out on whether we can have secure blockchainbased e
2557,Wired,2019-09-04 01:38:49,Super Pumped The Battle for Uber traces Travis Kalanicks trajectory from floundering startup founder to the env 
2558,Wired,2019-09-04 01:02:27,Meet the fastest production car ever This prototype of a special edition Bugatti Chiron just became the first prod 
2559,Wired,2019-09-03 23:12:37,Android 10 is out today hackers are using virtual USBs to get into company servers and we reviewed the 500 ble 
2560,Wired,2019-09-03 23:09:08,RT  Had so much fun answering some of your tennis questions with   Check out the video here  
2561,Wired,2019-09-03 22:36:28,Children bully them Philadelphians behead them In one incident office workers bullied an HR chatbot so terribly 
2562,Wired,2019-09-03 21:36:07,For years the iPhone was considered the most lockeddown mainstream computing device in the world But Googles An 
2563,Wired,2019-09-03 21:20:05,After President Trump tweeted a sensitive image of a charred launch pad in Iran amateur satellite trackers not onl 
2564,Wired,2019-09-03 21:19:38,RT  On Friday Trump tweeted out a highly sensitive spy photo of Iran Heres how Internet sleuths studied the shadows and figu
2565,Wired,2019-09-03 20:27:05,Uncertainty is usually seen as a problem but it can also be a solutionjust not always to the same problem 
2566,Wired,2019-09-03 20:24:12,Why are there so many lefties in tennis What do you look for in a coach Who is the toughest opponent youve ever 
2567,Wired,2019-09-03 20:11:15,The Yamaha Wabash is pretty heavy and the motor doesnt help you go very fast because laws But its hard not to 
2568,Wired,2019-09-03 19:08:03,Gravity is one of the most pervasive forces on earth Since we cant hide from it we might as well work with it 
2569,Wired,2019-09-03 18:34:02,NASA astronaut Christina Koch took this image of Hurricane Dorian from the International Space Station on Monday R 
2570,Wired,2019-09-03 18:31:09,Starting out in college Dorm living is a riot but the close quarters can be stifling Carve out some extra me sp 
2571,Wired,2019-09-03 18:28:58,Well its finally here Google has just released the final version of its new operating system for Android phones 
2572,Wired,2019-09-03 17:51:52,Sure mobile voting would be great but its plagued by security issues that blockchain cant solve 
2573,Wired,2019-09-03 16:49:04,Only when we invest in protections for everyone in our community can we bring problematic people back in because o 
2574,Wired,2019-09-03 16:29:51,You probably know better than to plug a strange USB stick into a network computer But there are flaws in certain d 
2575,Wired,2019-09-03 15:27:17,Megvii is one of four Chinese AI startups specializing in facial recognition valued at more than 1 billion Now t 
2576,Wired,2019-09-03 14:25:31,A petition with more than 40 signatories including 20 current Google employees says Schmidts appearance would be 
2577,Wired,2019-09-03 13:24:02,Ever wanted to mail a package from space Heres how you do it 
2578,Wired,2019-09-03 11:28:47,Amazon says its algorithms can now read fear on your face at a cost of 0001 per image 
2579,Wired,2019-09-03 10:26:52,The very specific migration of influencers onto Xrated social media sites is having a curious impact on digital al 
2580,Wired,2019-09-03 08:26:34,Automatic license plate reader cameras are controversial enough when law enforcement deploys them Now one hacker 
2581,Wired,2019-09-03 06:57:25,Welcome to the age of thigh speed internet 
2582,Wired,2019-09-03 05:38:47,This updated bedside climate control device still keeps you comfy under the sheets but with an improved design 
2583,Wired,2019-09-03 04:37:21,Did you know Neptune has rings Most large planets do Voyager 2 snapped this photo in 1989 during its flyby and t 
2584,Wired,2019-09-03 03:32:15,The new friends of the podA comic by Ivan Ehlers with  Make your day better and see more of ou 
2585,Wired,2019-09-03 02:28:26,Begin by acknowledging your password has a problem A cartoon by Amy Kurzweil with  
2586,Wired,2019-09-03 01:24:52,How vulnerable are landmark stone formations to tremors from earthquakes or human activities Researchers finally h 
2587,Wired,2019-09-03 00:48:00,Tech talks thought leaders robots science screenings networking tastings a family day These are just SOME o 
2588,Wired,2019-09-03 00:21:33,Want to make awesome espresso on the road or anywhere else We found several portable espresso makers that can tur 
2589,Wired,2019-09-02 23:18:26,Have 500 Want 1800 watts of liquefying power to make your smoothies Meet the Breville Super Q  Our review 
2590,Wired,2019-09-02 22:16:03,Your search is done These are the best gaming laptops weve tested 
2591,Wired,2019-09-02 21:13:02,Astronauts have accidentally dropped things while space walking all the time a pair of pliers a camera a tool ba 
2592,Wired,2019-09-02 21:00:02,Dont  miss  out  on  these  deals LaborDaySale 
2593,Wired,2019-09-02 20:09:52,We all get too many rings and blips and squawks on our smartphone Every ping your phone emits is another distracti 
2594,Wired,2019-09-02 19:22:29,RT  With 1800 watts of liquefying power the Breville Super Q is an excellent buyif youre a blender person 
2595,Wired,2019-09-02 19:07:12,Thanks to new rules structural engineers architects and developers in the historic heart of London have to consi 
2596,Wired,2019-09-02 18:37:16,From video games to new movies Keanu Reeves has been everywhere lately Offscreen hes building bikes with the he 
2597,Wired,2019-09-02 18:05:15,So much gear so little time Heres all the gadgets we loved last month  
2598,Wired,2019-09-02 17:05:00,RT  From 260 miles in altitude cameras outside the  captured views of HurricaneDorian at 1127am ET on Sept 2 as the
2599,Wired,2019-09-02 17:03:08,It costs an estimated 26 billion to get a new drug to market and pipelines are only getting slower and more expe 
2600,Wired,2019-09-02 15:59:36,Its celebrities on demand On the platform Cameo shoppers can buy personalized video messages from a marketplace 
2601,Wired,2019-09-02 14:46:16,Social media can be a lifeline during natural disasters It can also be full of misinformation Here are some thing 
2602,Wired,2019-09-02 14:09:00,Pianist and composer Nahre Sol attempts to play Happy Birthday in 16 levels of complexity She starts playing the 
2603,Wired,2019-09-02 13:34:18,Harry Potterloving TVdebating fanficwriting enthusiasts have emerged from the underground to dominateand shap 
2604,Wired,2019-09-02 11:33:20,Welcome to our robot coffee future 
2605,Wired,2019-09-02 10:27:26,Opinion While yearning for celebrity might seem smallsouled aspiring to fame was for centuries considered morall 
2606,Wired,2019-09-02 08:26:15,The new Bugatti Centodieci goes from 0 to 62 mph in 24 seconds and can reach 186 mph in 131 seconds Bugatti actu 
2607,Wired,2019-09-02 07:00:25,I Kill Giants A Monster Calls and Colossal each present an original ambitious thoughtful take on the idea 
2608,Wired,2019-09-02 04:59:21,We sauted boiled and burned our food to find the best portable propane gas stoves for your next outdoor adventur 
2609,Wired,2019-09-02 04:16:00,Mother Nature What would happen if we mixed a bear with a cat WIRED That seems like a lot Mother Nature Let 
2610,Wired,2019-09-02 03:51:05,This is Neptunes south pole just barely illuminated by the sun Voyager 2 took this photo from 560000 miles away 
2611,Wired,2019-09-02 02:46:21,Andrew Finch heard a noise outside his house He opened the front door A few seconds later he was shot dead by pol 
2612,Wired,2019-09-02 01:40:49,Love it or hate it the Netflix series The OA is one of the most unusual and daring TV shows in years Netflix re 
2613,Wired,2019-09-02 00:38:35,Nothing is perfect but a good waffle maker is damn close 
2614,Wired,2019-09-01 23:34:39,The images in this photo series are hallucinatory in their intensity evoking a fever dream or a psychedelic tripa 
2615,Wired,2019-09-01 22:31:14,A new paper looking at gender bias in awarding of research positions examined two situations when people on the aw 
2616,Wired,2019-09-01 21:27:31,Bells new autonomous cargo carrier is a fourmotor verticallift electric UAV and is one of the largest commerci 
2617,Wired,2019-09-01 20:23:30,Researchers found another bug in Teslas Model S key fobs that might have allowed hackers to break into cars The e 
2618,Wired,2019-09-01 19:20:55,Theres thinking outside the box and theres Hey lets nuke a hurricane Last week we found out which one accu 
2619,Wired,2019-09-01 18:18:46,We tested out 25 of the top memory foam and hybrid individually wrapped springs  foam mattresses you can order o 
2620,Wired,2019-09-01 17:16:28,As scientists peer further back in time and uncover evolutionary relationships in unprecedented detail their findi 
2621,Wired,2019-09-01 16:45:36,RT  Its a holiday that celebrates working but some of the best deals may help you sleep 
2622,Wired,2019-09-01 16:39:08,Want more WIRED Subscribe for just 5 and get full access to our website and get our magazine delivered right to y 
2623,Wired,2019-09-01 16:39:07,A comic by Drew Dernavich with  5  
2624,Wired,2019-09-01 16:39:05,A comic by Ellis Rosen with  4   
2625,Wired,2019-09-01 16:39:03,A comic by Lila Ash with  3   
2626,Wired,2019-09-01 16:39:01,A comic by Ivan Ehlers with  2   
2627,Wired,2019-09-01 16:39:00,Its Sunday That means its time for the comics Lighten up your feed with our favorites from this week 
2628,Wired,2019-09-01 15:37:22,Alibaba cofounder Jack Ma I dont think artificial intelligence is a threat Tesla CEO Elon Musk I dont kno 
2629,Wired,2019-09-01 14:21:03,Social media can be a lifeline during natural disasters It can also be full of misinformation Here are some thing 
2630,Wired,2019-09-01 12:59:01,Who created bitcoin 
2631,Wired,2019-09-01 11:56:46,Beware of Chinese spies offering laptops women or educational stipendsand especially watch out for odd LinkedIn 
2632,Wired,2019-09-01 10:54:39,This is the great mystery of human vision Vivid pictures of the world appear before our minds eye yet the brain 
2633,Wired,2019-09-01 09:27:58,Overkill has never been so beautiful Our review of the 1100 Samsung Galaxy Note10  
2634,Wired,2019-09-01 07:26:09,This swoopy green sand machine is meant to prove the flexibility of VWs modular electric car platform and that li 
2635,Wired,2019-09-01 06:06:31,Disney and Charter Communications are teaming up to fight account sharing in an attempt to prevent multiple people 
2636,Wired,2019-09-01 05:04:38,Expectations for Star Wars The Rise of Skywalker continues to build but theres a lot more going on in so many o 
2637,Wired,2019-09-01 04:10:00,How far can you push the human body Researchers studied athletes who ran six marathons a week over months and trac 
2638,Wired,2019-09-01 04:01:23,The Raspberry Pi is a computer the size of a credit card that is aimed at DIYers Its newest version has some feat 
2639,Wired,2019-09-01 02:57:40,The battery is the most important component in your smartphone Heres how to keep it healthy and happy 
2640,Wired,2019-09-01 01:53:18,Thousands of the toughest known animal in the universe are now on the moon 
2641,Wired,2019-09-01 00:50:24,Its been 30 years since we last glimpsed Neptune Its gaseous atmosphere slushy surface dramatic storms and icy 
2642,Wired,2019-08-31 23:47:12,Love it or hate it the Netflix series The OA was one of the most unusual and daring TV shows in years  
2643,Wired,2019-08-31 22:44:24,Just how secure is that 8000mile undersea internet cable And what happens when the US cyberattacks Iran 
2644,Wired,2019-08-31 21:39:19,Its time to upgrade from biscuits and beans LaborDayWeekend 
2645,Wired,2019-08-31 20:36:05,Netflix took over 100 acres of an old Kodak plant to make a wild obstacle course including a sixstory seesaw calle 
2646,Wired,2019-08-31 19:29:55,After three years of fighting shortterm rental regulations in cities across the US Airbnb is starting to change i 
2647,Wired,2019-08-31 18:25:40,Things we loved this monthCooking everything in a waffle makerTesting smart swim gogglesSnapping pics wit 
2648,Wired,2019-08-31 18:04:46,Google says it alerted Apple in February and that Apple released a patch days later The phonemaker declined to com 
2649,Wired,2019-08-31 18:04:45,So whos behind the hacks Its still unclear but both its sophistication and focus on espionage suggest statesp 
2650,Wired,2019-08-31 18:04:44,Before the discovery the cost of hacking an iPhone was reportedly as much as 2 million Those assumptions are now 
2651,Wired,2019-08-31 18:04:42,The attack is notable not just for its breadth but the depth of information it could glean from a victims iPhone 
2652,Wired,2019-08-31 18:04:40,Googles Project Zero security research team recently revealed a hacking campaign that used malicious websites to c 
2653,Wired,2019-08-31 18:04:39,iPhone hacks have long been considered an endeavor undertaken only by nationstates with highvalue targets But a 
2654,Wired,2019-08-31 17:24:05,LaborDayWeekend means Labor Day sales Check out our favorite dealsSales on MacBooks Dell XPS Surface Pros a 
2655,Wired,2019-08-31 16:27:30,Looking to unwind this long weekend Take a break after grilling and get lost in these streaming films and shows 
2656,Wired,2019-08-31 15:25:24,The US Navy is following the advice of TED talkers and technology Cassandras Its taking a step away from screens 
2657,Wired,2019-08-31 15:00:00,Tech talks thought leaders robots science screenings networking tastings a family day These are just SOME o 
2658,Wired,2019-08-31 14:23:13,Reducing methane is important to slowing global warming because methane is 80 times more potent than carbon dioxide 
2659,Wired,2019-08-31 13:20:12,REIs huge Labor Day sale is officially live Here are 26 great deals you should take advantage of right now 
2660,Wired,2019-08-31 12:16:38,I saw a wave of screens turning black Black black black Black black black black blackThis is the story of 
2661,Wired,2019-08-31 11:16:15,Ridehail companies desperate to stop a proposed California law that would force them to treat workers as employees 
2662,Wired,2019-08-31 10:15:58,The Childrens Online Privacy Protection Act was passed in 1998 the same year that Google was founded Since then 
2663,Wired,2019-08-31 09:12:38,A comic by Lars Kenseth with  Make your day better and see more of our cartoons here 
2664,Wired,2019-08-31 08:09:41,Music art dancing experimental livingBurning Man is a world of its own Photographer Philip Volkers spent a dec 
2665,Wired,2019-08-31 07:07:21,Twitter keeps acting like its the best damn party on the internet But if Twitter is a party its a party where t 
2666,Wired,2019-08-31 06:04:49,Dont blame drought for the fires in the Amazon Blame humans When we look from space we see that economic acti 
2667,Wired,2019-08-31 05:01:19,Despite multiple warnings illegal nonFCCcompliant cell phone signal boosters continue to be sold on Amazon H 
2668,Wired,2019-08-31 04:30:00,This DIY implant lets you stream movies from inside your leg Learn more  
2669,Wired,2019-08-31 03:59:04,EPA officials want to eliminate Obamaera rules on monitoring and limiting methane leaks But heres the thing A l 
2670,Wired,2019-08-31 03:12:51,Whoops 
2671,Wired,2019-08-31 02:10:28,While everyone else was yelling about chicken sandwiches Disney assembled its forces to fire the first shot in the 
2672,Wired,2019-08-31 01:07:39,Just months after the collapse of Telltale Games and the major toll that took on its now former employees Telltale 
2673,Wired,2019-08-31 00:55:40,Twitter confirms Jack Dorseys Twitter account was hacked by a SIM swap attack Heres how it could have happened 
2674,Wired,2019-08-31 00:49:39,RT  Updated our story on the  account hack to reflect that we called it 
2675,Wired,2019-08-31 00:03:43,Snap has a new pair of sunglasses Spectacles 3 They come with two HD cameras and cost 380 
2676,Wired,2019-08-31 00:00:00,What does Novak Djokovic eat for breakfast When did he start playing tennis  answers the internets mo 
2677,Wired,2019-08-30 23:01:37,My goal is simple to become as proficient at playing music as I can as quickly as I can without the help of a t 
2678,Wired,2019-08-30 22:20:09,RT  As  reports this is probably how  was hacked You can tweet via text message no password required The hack
2679,Wired,2019-08-30 22:00:15,Twitter CEO  ongoing mission to increase the civility of public discourse suffered a setback when an anonymo 
2680,Wired,2019-08-30 21:15:02, Check out WIREDs Most Interesting Things in Tech on your Google Home or Alexa speaker Todays edition is presen 
2681,Wired,2019-08-30 21:09:36,Google has reportedly agreed to pay as much as 200 million to settle with the FTC over claims that YouTube violate 
2682,Wired,2019-08-30 21:04:51,Thousands of iPhones have been hacked a man implanted a streaming device into his leg and Uber amp Lyft are spendin 
2683,Wired,2019-08-30 20:03:28,When Ryan Taft agreed to help a help the Damiani family he had never even seen an individual human genome At firs 
2684,Wired,2019-08-30 19:00:07,Biohackers are inserting a devicea hard drive plus routerinto their legs Welcome to the age of thigh speed inter 
2685,Wired,2019-08-30 18:42:41,Labor Day generally marks the end of summer which means its a great time to catch up on some binge watching Here 
2686,Wired,2019-08-30 17:42:03,Ridehail companies are so desperate to stop a proposed California law that would force them to treat workers as em 
2687,Wired,2019-08-30 17:30:11,Last chance sale offer Happy Labor Day Weekend Get 1 year of print and digital access for just 5 
2688,Wired,2019-08-30 17:28:43,RT  Well this was an absolutely nuts turn of events  If youre a security researcher pulling any of t
2689,Wired,2019-08-30 16:49:45,Why is it so hard to unlink yourself from Facebook  joins this weeks Gadget Lab podcast to explain 
2690,Wired,2019-08-30 16:11:00,RT  In case you missed it WIRED has original cartoons now just like the New Yorker which makes sense because there are a lo
2691,Wired,2019-08-30 15:43:49,Scheduling a running competition in a scorching hot desert may seem ridiculous and avoidable But as climate change 
2692,Wired,2019-08-30 14:40:04,Our latest guest is a friend of the pod By Ivan Ehlers with   
2693,Wired,2019-08-30 14:32:05,The Dark Crystal Age of Resistance will like its predecessor freak you and your kids right the hell out in all 
2694,Wired,2019-08-30 13:23:48,RT  not to be dramatic but this actually does change everything 
2695,Wired,2019-08-30 12:50:28,A newly revealed attack hit thousands of iPhones with sophisticated spyware upending longheld assumptions about t 
2696,Wired,2019-08-30 12:21:25,Videogames have always been weird But being surreal in a meaningful way in a way thats surprising that feels tr 
2697,Wired,2019-08-30 11:19:18,At the end of July Capital One disclosed it had suffered a massive data breach that exposed personal and financial 
2698,Wired,2019-08-30 10:17:01,Children bully them Philadelphians behead them In one incident office workers bullied an HR chatbot so terribly 
2699,Wired,2019-08-30 09:14:15,Former colleagues have described Anthony Levandowski as brilliant engaging motivating fastcharging inconsidera 
2700,Wired,2019-08-30 08:11:36,Want to make awesome espresso on the road or anywhere else We found several portable espresso makers that can tur 
2701,Wired,2019-08-30 07:09:05,What exactly constitutes a trade secret and how one might go about stealing one will be key to the governments c 
2702,Wired,2019-08-30 06:07:27,REIs huge Labor Day sale is still going These are the deals you should take advantage of while they last 
2703,Wired,2019-08-30 05:05:11,This one paradoxical photo captures the essence of unmet fried food desires 
2704,Wired,2019-08-30 04:11:00,These 4K maps and spinning globes of Jupiter are  but theres more going on here than just a beautiful video The 
2705,Wired,2019-08-30 04:02:49,Youre no longer limited to just the Genius Bar or Best Buy to get your iPhone fixed  
2706,Wired,2019-08-30 02:49:35,As a star like the Sun ages it loses the ability to convert hydrogen into helium This causes the star to become u 
2707,Wired,2019-08-30 00:48:07,We drank chilled beverage after chilled beverage we know we know hard work to bring you our favorite coolers fo 
2708,Wired,2019-08-29 22:47:03,Control is surreal in a meaningful surprising truly strange way Even the most mundane moments are suffused wit 
2709,Wired,2019-08-29 22:31:20,RT  I tried to make sense of WiFi 6 If you havent heard much about it yet well youre about to if you follow the tech ind
2710,Wired,2019-08-29 21:46:56,The intelligence community has plans for a telescope network that can see not just a blob in orbit but details such 
2711,Wired,2019-08-29 20:46:21,The next generation of WiFi is coming soon the government took down two illegal streaming juggernauts and the fl 
2712,Wired,2019-08-29 20:14:47,Its soon going to be much easier to get your iPhone fixedApple plans to give more indie stores the same tools a 
2713,Wired,2019-08-29 20:11:41,In 2016 Luxembourg announced an ambitious initiative to mine asteroids and other nearEarth objects NEOs for rar 
2714,Wired,2019-08-29 19:32:44,RT  A big step forward for iPhone repairs and the Right to Repair movement in general Apple will give indie repair shops the
2715,Wired,2019-08-29 19:25:00,What does Novak Djokovic eat for breakfast When did he start playing tennis  answers the internets mo 
2716,Wired,2019-08-29 19:11:04,At the end of July Capital One disclosed it had suffered a massive data breach that exposed personal and financial 
2717,Wired,2019-08-29 18:27:11,Its unclear what Levandowskis future will be so lets take a look back at where hes been   
2718,Wired,2019-08-29 17:25:45,K5 is not a friendly robot even if the cutesy blue lights are meant to telegraph that it is Its not there to c 
2719,Wired,2019-08-29 16:58:43,RT  Someone in Hayward pushed over a robot Obviously that means I took a plunge down the rabbit hole of surveillance et
2720,Wired,2019-08-29 16:38:39,Are you ready for a superdark Joker movie Welp youre getting one Joker which is about to hit the festival c 
2721,Wired,2019-08-29 16:23:38,Just got this in our inbox What do you think Apple will announce 
2722,Wired,2019-08-29 16:09:44,In six words predict a scandal at the 2040 Summer Olympics WIREDBackpage 
2723,Wired,2019-08-29 16:02:15,Jetflicks was like having Netflix Hulu Amazon Prime HBO and a basic cable subscription all for the price of a 
2724,Wired,2019-08-29 15:00:11,Lets not point fingers By  with   
2725,Wired,2019-08-29 14:31:04,What exactly constitutes a trade secret and how one might go about stealing one will be key to the governments c 
2726,Wired,2019-08-29 14:01:57,RT  The new standard promises to improve the speed and reliability of your home WiFi network And it arrives as soon as this fa
2727,Wired,2019-08-29 14:01:47,RT  Opinion If we are all going to be able to eat tomorrow we cannot let corporate interests continue to dictate our climat
2728,Wired,2019-08-29 13:08:41,WiFi 6 is WiFi for a world crowded with mobile gadgets IoT devices and connected equipment And its coming as 
2729,Wired,2019-08-29 12:16:40,Think dropping a nuclear bomb into the eye of a hurricane is a bad idea In the 1940s some scientists wanted to bo 
2730,Wired,2019-08-29 11:14:25,Dont get swept away by the hype Most times you hear the term artificial intelligence the specific technology at 
2731,Wired,2019-08-29 10:07:48,Strange times make for strange bedfellows So it is in 2019 when conservative nonprofit Prager University finds its 
2732,Wired,2019-08-29 09:05:49,Fire tornadoes can reach up to 140 miles per hour tear roofs off houses and can spread flames unpredictably Here 
2733,Wired,2019-08-29 08:03:03,Even if a user never explicitly linked their Facebook and Instagram profiles they are intrinsically connectedfins 
2734,Wired,2019-08-29 07:00:48,The crowding in the detention centers is selfevident and the physical and emotional conditions that migrants end 
2735,Wired,2019-08-29 05:57:11,Newark New Jersey has had warnings that its water is contaminated with lead since 2016the year Flints crisis ma 
2736,Wired,2019-08-29 04:55:28,Looking for a new laptop Microsofts laptoptablet hybrid Surface Pro 6 is as cheap as weve seen it Details 
2737,Wired,2019-08-29 03:53:17,Fitbit wants to be your onestop health care stop The companys new offerings include two fitnesstracking product 
2738,Wired,2019-08-29 02:47:10,With preinternet privacy youd never know Hollywood relationships were fake unless you lived inside a celebritys 
2739,Wired,2019-08-29 02:45:00,Try the turkey tetrazzini skip the ice cream and dont miss your chance to steal the commanders shrimp cocktail 
2740,Wired,2019-08-29 01:43:22,David Makes Man goes where few dramas have dared sojourn Into the minds of young black boys 
2741,Wired,2019-08-29 00:46:06,RT  Common sense suggests that if you unlink a Facebook account from your Instagram profile youve unlinked that Facebook
2742,Wired,2019-08-29 00:39:21,In June lightning struck down just 100 miles from the North Pole We dont know this because someone nearby saw it 
2743,Wired,2019-08-28 23:34:53,This is a supernova remnant of a star that died 8000 years ago and was more than 20 times the mass of our Sun Whe 
2744,Wired,2019-08-28 22:00:13,Exclusive access to our Labor Day Sale Get 1 year of print and digital access for just 5  
2745,Wired,2019-08-28 21:27:01,the most impactful results of SaveTheOA have manifested IRL somewhere far from the Netflix queues and web forums 
2746,Wired,2019-08-28 21:04:25,Brazilian government policies are fueling the Amazon fire YouTube is making everyone mad and experts say Newark 
